index,url,valid,domain,title,description,image,published,archive,content,quote,language,keyword
https://11freunde.de/artikel/sei-ein-mensch/10266357,https://11freunde.de/artikel/sei-ein-mensch/10266357,0,11freunde.de,„Sei ein Mensch“: Marcel Reif spricht im Bundestag über seinen Vater und den Holocaust,Über Jahrzehnte war Marcel Reif als Kommentator die Stimme des deutschen Fußballs. Nun sprach er im Deutschen Bundestag anlässlich des Jahrestages der Auschwitz-Befreiung. Über den Holocaust und über seinen Vater.,https://11freunde.de/assets/images/_1200x630_crop_center-center_82_none/Bildschirmfoto-2024-02-01-um-15.23.50.png?mtime=1706797646,2024-02-01T14:00:00Z,,"Marcel Reif spricht im Bun­destag über seinen Vater und den Holo­caust
Über Jahr­zehnte war Marcel Reif als Kom­men­tator die Stimme des deut­schen Fuß­balls. Nun sprach er im Deut­schen Bun­destag … [+97 chars]",,de,'Reif'
https://www.zeit.de/news/2024-02/02/nhl-profis-erstmals-seit-2014-wieder-bei-olympia,https://www.zeit.de/news/2024-02/02/nhl-profis-erstmals-seit-2014-wieder-bei-olympia,0,www.zeit.de,Eishockey: NHL-Profis erstmals seit 2014 wieder bei Olympia,Hier finden Sie Informationen zu dem Thema „Eishockey“. Lesen Sie jetzt „NHL-Profis erstmals seit 2014 wieder bei Olympia“.,https://img.zeit.de/news/2024-02/02/nhl-profis-erstmals-seit-2014-wieder-bei-olympia-image-group/wide__1300x731,2024-02-02T19:24:54Z,,"Nach zwölf Jahren Pause werden Eishockey-Spieler aus der nordamerikanischen Profiliga NHL wieder bei Olympischen Winterspielen auf dem Eis stehen.
Mehr Schlagzeilen
Wie die NHL im Rahmen des All-St… [+1826 chars]",,de,'Winter'
