index,url,valid,domain,title,description,image,published,archive,content,quote,language,keyword
https://www.faz.net/aktuell/wirtschaft/mehr-wirtschaft/heizen-mit-erdgas-gasnetzentgelte-steigen-110043481.html,https://www.faz.net/aktuell/wirtschaft/mehr-wirtschaft/heizen-mit-erdgas-gasnetzentgelte-steigen-110043481.html,0,www.faz.net,Heizen mit Erdgas: Kunden müssen wegen steigender Gasnetzentgelte mehr zahlen,Viele Versorger erhöhen ihre Netzentgelte für Erdgas. Das kann mehrere Hundert Euro pro Jahr ausmachen. Hintergrund ist auch der Umstieg vieler Kunden auf andere Energiequellen.,https://media1.faz.net/ppmedia/aktuell/wirtschaft/1533068029/1.10043525/facebook_teaser/eine-gasleitung-ist-auf-einer.jpg,2024-10-13T05:47:43Z,,Dem Bericht zufolge gibt es in Deutschland etwa 700 Gasnetzbetreiber. Die bislang von Verivox ausgewerteten Netzbetreiber decken dem Bericht zufolge bei Gas 43 Prozent aller Haushalte in Deutschland … [+2027 chars],,de,'Heizen'
https://www.zeit.de/wirtschaft/2024-10/verivox-gaspreise-erhoehung-netzentgelte,https://www.zeit.de/wirtschaft/2024-10/verivox-gaspreise-erhoehung-netzentgelte,0,www.zeit.de,Verivox-Analyse: Netzentgelte machen Gas vielerorts deutlich teurer,Einzelne Gasnetzbetreiber wollen die Durchleitung um fast 60 Prozent teurer machen. Das Heizen im Einfamilienhaus könnte pro Jahr hunderte Euro teurer werden.,https://img.zeit.de/wirtschaft/2024-10/heizen-gas-bild/wide__1300x731,2024-10-13T05:53:14Z,,"Gaskunden müssen im kommenden Jahr mit erheblichen Mehrkosten rechnen. Vor allem das Heizen mit Gas könnte pro Jahr einige Hundert Euro teurer werden, berichten die Zeitungen der Funke Mediengruppe u… [+3168 chars]",,de,'Gas'
https://www.n-tv.de/wirtschaft/Gaspreise-koennten-2025-deutlich-anziehen-article25287862.html,https://www.n-tv.de/wirtschaft/Gaspreise-koennten-2025-deutlich-anziehen-article25287862.html,0,www.n-tv.de,Netzgebühren steigen: Gaspreise könnten 2025 deutlich anziehen,"Die Gasnetzbetreiber wollen einem Medienbericht zufolge ihre Gebühren deutlich erhöhen - was sich auch beim Verbraucher niederschlagen dürfte. Demnach müssen dann Verbraucher, die mit Gas ein Einfamilienhaus heizen, mit Mehrkosten von bis zu 445 Euro rechnen.",https://bilder1.n-tv.de/img/Bilder_dpa_Import/crop25205748/6861323141-cImg_16_9-w1200/Mehrere-Stadtwerke-haben-bereits-die-Preise-fur-Gas-gesenkt.jpg,2024-10-13T06:15:06Z,http://archive.md/20241014080457/http://www.n-tv.de/wirtschaft/Gaspreise-koennten-2025-deutlich-anziehen-article25287862.html,"Die Gasnetzbetreiber wollen einem Medienbericht zufolge ihre Gebühren deutlich erhöhen - was sich auch beim Verbraucher niederschlagen dürfte. Demnach müssen dann Verbraucher, die mit Gas ein Einfami… [+2534 chars]",,de,'Gas'
https://www.stern.de/familie/den-garten-winterfest-machen--so-schuetzen-sie-pflanzen-und-moebel-9021214.html,https://www.stern.de/familie/den-garten-winterfest-machen--so-schuetzen-sie-pflanzen-und-moebel-9021214.html,0,www.stern.de,"Kalte Jahreszeit: Den Garten winterfest machen: So überdauern Ihre Pflanzen Frost, Eis und Schnee","Nicht nur Pflanzen, sondern auch Gartenmöbel leiden im Winter. Wenn Sie im Frühjahr keine bösen Überraschungen erleben wollen, sollten Sie Ihren Garten zeitnah winterfest machen.",https://image.stern.de/9021216/t/qY/v3/w1440/r1.7778/-/garten-winterfest-machen-neu.jpg,2024-10-13T06:46:00Z,,"Auch wenn der Winter seinen Höhepunkt erst im neuen Jahr erreicht, machen die sinkenden Temperaturen vielen Gartenbewohnern jetzt schon zu schaffen: Sensible Pflanzen wie Rosen und Kamelien, junge Bä… [+7284 chars]",,de,'Eis'
https://www.stern.de/gesellschaft/regional/berlin-brandenburg/einaescherungen--krematorien--7-5-millionen-kilowattstunden-energieverbrauch-35139198.html,https://www.stern.de/gesellschaft/regional/berlin-brandenburg/einaescherungen--krematorien--7-5-millionen-kilowattstunden-energieverbrauch-35139198.html,0,www.stern.de,"Einäscherungen: Krematorien: 7,5 Millionen Kilowattstunden Energieverbrauch","Urnenbestattungen sind inzwischen verbreiteter als klassische Beerdigungen. Zuvor muss aber noch die Leiche eingeäschert, also verbrannt werden. Das kostet viel Energie in Form von Gas oder Strom.",https://image.stern.de/35139200/t/Nu/v1/w1440/r1.7778/-/13--7zjihz47amv1axw800h600jpeg---1b219ab26fd9c032.jpg,2024-10-13T07:17:06Z,,"Urnenbestattungen sind inzwischen verbreiteter als klassische Beerdigungen. Zuvor muss aber noch die Leiche eingeäschert, also verbrannt werden. Das kostet viel Energie in Form von Gas oder Strom.
D… [+1733 chars]",,de,'Gas'
https://www.tagesspiegel.de/berlin/einascherungen-krematorien-75-millionen-kilowattstunden-energieverbrauch-12524471.html,https://www.tagesspiegel.de/berlin/einascherungen-krematorien-75-millionen-kilowattstunden-energieverbrauch-12524471.html,0,www.tagesspiegel.de,"Einäscherungen: Krematorien: 7,5 Millionen Kilowattstunden Energieverbrauch","Urnenbestattungen sind inzwischen verbreiteter als klassische Beerdigungen. Zuvor muss aber noch die Leiche eingeäschert, also verbrannt werden. Das kostet viel Energie in Form von Gas oder Strom.",https://www.tagesspiegel.de/images/12524468/alternates/BASE_16_9_W1400/1728803940000/krematorium-baumschulenweg.jpeg,2024-10-13T07:19:00Z,,Die Einäscherung einer Leiche in einem der beiden Berliner Krematorien verbraucht so viel Energie wie eine Waschmaschine im durchschnittlichen Verbrauch in zwei bis drei Jahren. 485 Kilowattstunden E… [+1618 chars],,de,'Gas'
https://www.faz.net/aktuell/sport/wintersport/nhl-leon-draisaitl-und-edmonton-oilers-verlieren-schon-wieder-110043574.html,https://www.faz.net/aktuell/sport/wintersport/nhl-leon-draisaitl-und-edmonton-oilers-verlieren-schon-wieder-110043574.html,0,www.faz.net,"Eishockeystar in Amerika: Draisaitl trifft, aber verliert schon wieder","Leon Draisaitl erzielt sein erstes Saisontor in der NHL, verliert aber auch das zweite Spiel mit den Edmonton Oilers. Tim Stützle ergeht es mit Ottawa ähnlich. Moritz Seider und Detroit hingegen siegen.",https://media1.faz.net/ppmedia/aktuell/sport/11935892/1.10043585/facebook_teaser/leon-draistil-links-im-bild.jpg,2024-10-13T07:38:44Z,,"Der 28 Jahre alte Angreifer, der in der kommenden Saison zum bestbezahlten Spieler der NHL aufsteigen wird, erzielte Mitte des Schlussabschnitts in einer Überzahlphase das 2:4. Aus dem Power Play Chi… [+1305 chars]",,de,'Eis'
https://www.sueddeutsche.de/bayern/reichling-landsberg-am-lech-ammersee-gas-foerderung-genexco-protest-pro-contra-lux.VYUBryYX6jF6nXidGnDzdj,https://www.sueddeutsche.de/bayern/reichling-landsberg-am-lech-ammersee-gas-foerderung-genexco-protest-pro-contra-lux.VYUBryYX6jF6nXidGnDzdj,0,www.sueddeutsche.de,Pro und Contra: Der Streit ums Erdgas aus Bayern,"Ein Unternehmen will im oberbayerischen Reichling nach Gas bohren – gegen großen Widerstand in der Region. Ist es noch sinnvoll, in Bayern fossile Energieträger zu fördern? Argumente dafür und dagegen.",https://www.sueddeutsche.de/2024/09/30/923d800c-9bf8-45c6-b3c8-d2a77ec1b608.jpeg?q=60&fm=webp&width=1200&rect=0%2C285%2C4000%2C2250,2024-10-13T09:25:45Z,,"Pro: Besser bayerisches Gas als importiertes
Ein Kommentar von Sebastian Beck
Das Dorf Reichling scheint sich gerade zum neuen Protestziel für Klima- und Umweltaktivisten zu entwickeln. Dabei wirkt… [+5448 chars]",,de,'Gas'
https://www.welt.de/kultur/literarischewelt/article253901086/Actionszenen-der-Weltliteratur-Als-Shelley-auf-einen-Daemon-schoss.html,https://www.welt.de/kultur/literarischewelt/article253901086/Actionszenen-der-Weltliteratur-Als-Shelley-auf-einen-Daemon-schoss.html,0,www.welt.de,Als Shelley auf einen Dämon schoss,"Es ist der 26. Februar 1813, über den Norden von Wales fegt ein Sturm. Der romantische Dichter Percy Bysshe Shelley ist mit zwei geladenen Pistolen ins Bett gegangen. Über den Winter hat er sich Feinde gemacht. Und die kommen in dieser Nacht gleich zweimal.",https://img.welt.de/img/kultur/literarischewelt/mobile253908736/2987932717-ci16x9-w1200/DWO-Teaser-shelley-daemon-aw.jpg,2024-10-13T10:16:24Z,,"Es ist der 26. Februar 1813, über den Norden von Wales fegt ein Sturm. Der romantische Dichter Percy Bysshe Shelley ist mit zwei geladenen Pistolen ins Bett gegangen. Über den Winter hat er sich Fein… [+3776 chars]",,de,'Winter'
https://www.tagesspiegel.de/wirtschaft/finanzen/wegen-steigender-netzentgelte-gaskunden-drohen-2025-offenbar-deutlich-steigende-preise-12525941.html,https://www.tagesspiegel.de/wirtschaft/finanzen/wegen-steigender-netzentgelte-gaskunden-drohen-2025-offenbar-deutlich-steigende-preise-12525941.html,0,www.tagesspiegel.de,Wegen steigender Netzentgelte: Gaskunden drohen 2025 offenbar deutlich steigende Preise,Auf viele Kunden von Erdgas könnten einem Medienbericht zufolge Mehrkosten von einigen hundert Euro zukommen. Die Bundesnetzagentur hat noch keinen abschließenden Überblick.,https://www.tagesspiegel.de/images/11549792/alternates/BASE_16_9_W1400/1728824212000/erdgasleitung-in-sachsen.jpeg,2024-10-13T13:20:43Z,http://archive.md/20241014075945/https://www.tagesspiegel.de/wirtschaft/finanzen/wegen-steigender-netzentgelte-gaskunden-drohen-2025-offenbar-deutlich-steigende-preise-12525941.html,Es wäre ein Preisschock für die Verbraucher: Gaskunden müssen nach Berechnungen des Vergleichsportals Verivox im kommenden Jahr mit Mehrkosten von mitunter einigen hundert Euro rechnen. Grund sind ei… [+3559 chars],,de,'Gas'
https://www.stern.de/gesellschaft/regional/baden-wuerttemberg/verfolgungsjagd--mann-verursacht-unfaelle-auf-flucht-mit-gestohlenem-auto-35139784.html,https://www.stern.de/gesellschaft/regional/baden-wuerttemberg/verfolgungsjagd--mann-verursacht-unfaelle-auf-flucht-mit-gestohlenem-auto-35139784.html,0,www.stern.de,Verfolgungsjagd: Mann verursacht Unfälle auf Flucht mit gestohlenem Auto,"Ein Auto wird gestohlen und eine Nacht später auf der Straße unterwegs gesehen. Doch ehe die Polizeistreife Signale zum Anhalten gibt, drückt der unbekannte Fahrer das Gas durch. Mit teuren Folgen.",https://image.stern.de/35139786/t/f4/v1/w1440/r1.7778/-/13--rzrkwgbsi4v9axw800h600jpeg---aac75f4fd9754117.jpg,2024-10-13T13:23:38Z,,"Ein Auto wird gestohlen und eine Nacht später auf der Straße unterwegs gesehen. Doch ehe die Polizeistreife Signale zum Anhalten gibt, drückt der unbekannte Fahrer das Gas durch. Mit teuren Folgen.
… [+1145 chars]",,de,'Gas'
https://www.bild.de/politik/inland/bild-exklusiv-gruene-stoppten-heimlich-waffen-hilfe-fuer-israel-670b96af2de6a20c12808c97,https://www.bild.de/politik/inland/bild-exklusiv-gruene-stoppten-heimlich-waffen-hilfe-fuer-israel-670b96af2de6a20c12808c97,0,www.bild.de,BILD exklusiv - Grüne stoppten heimlich Waffen-Hilfe für Israel,Im Sicherheitsrat ließ Habeck die Waffenlieferungen an Israel auf Eis legen.Foto: TOBIAS SCHWARZ/AFP,"https://images.bild.de/670b96af2de6a20c12808c97/86e063acec9bcb071db29234aebb5480,94e0b8bd?w=1280",2024-10-13T14:01:14Z,http://archive.md/20241013141613/https://www.bild.de/politik/inland/bild-exklusiv-gruene-stoppten-heimlich-waffen-hilfe-fuer-israel-670b96af2de6a20c12808c97,"BILD exklusiv Grüne stoppten heimlich Waffen-Hilfe für Israel
BILD exklusiv Grüne stoppten heimlich Waffen-Hilfe für Israel
BILD exklusiv Grüne stoppten heimlich Waffen-Hilfe für Israel
BILD exklu… [+428 chars]",,de,'Eis'
https://www.bild.de/sport/mehr-sport/ingolstadt-an-spitze-der-penny-del-8-sieg-in-serie-berlin-folgt-670c2aee2de6a20c128091b4,https://www.bild.de/sport/mehr-sport/ingolstadt-an-spitze-der-penny-del-8-sieg-in-serie-berlin-folgt-670c2aee2de6a20c128091b4,0,www.bild.de,Penny DEL - Ingolstadt verteidigt Spitze - Berlin mit 5. Sieg in Serie,"Ingolstadt führt die Penny DEL-Tabelle an, gefolgt von den Eisbären Berlin. Beide Teams feiern beeindruckende Siegesserien.","https://images.bild.de/670c2aee2de6a20c128091b4/ec6adddeecd05de40d55028c743b8f9b,720096cd?w=1280",2024-10-13T21:23:13Z,,"Ingolstadt grüßt mit zwei Punkten Vorsprung weiter von der Tabellenspitze in der Penny DEL.
 In Köln gewannen die Bayern mit 3:2 n.P. und fahren damit bereits den 8. Sieg in Serie ein. Vereinsrekord… [+2492 chars]",,de,'Eis'
https://kaernten.orf.at/stories/3277039/,https://kaernten.orf.at/stories/3277039/,0,kaernten.orf.at,Diskussion um Sicherheit in Eishallen,"Am Wochenende sind gleich zwei Frauen bei Eishockeyspielen in Kärnten von einem Puck am Kopf getroffen worden. Beide Male bei Spielen gegen die Pioneers Vorarlberg, einmal in der Stadthalle Villach, einmal in Klagenfurt. Das löste Diskussionen über die Sicher…",https://ibs.orf.at/ktn?image=https%3A%2F%2Foekastatic.orf.at%2Fmims%2F2022%2F15%2F67%2Fcrops%2Fw%3D1200%2Ch%3D627%2Cq%3D75%2F1300891_master_464767_20220404_neue_eishalle_klagenfurt_00_00_32_16.jpg%3Fs%3D5dec7dffe1850d1ab56c50bd15072473003be282,2024-10-14T04:56:31Z,,"Dass Eishockey nicht nur auf dem Eis ein gefährlicher Sport ist, ist vielen bekannt. Vorfälle, wo Zuschauer von einem Puck getroffen werden, gibt es allerdings sehr selten. Dennoch passierte es am ve… [+1218 chars]",,de,'Eis'
https://www.stern.de/panorama/wissen/suedpolarmeer-in-gefahr--antarktis-konferenz-ringt-um-ausweisung-neuer-schutzgebiete-35140582.html,https://www.stern.de/panorama/wissen/suedpolarmeer-in-gefahr--antarktis-konferenz-ringt-um-ausweisung-neuer-schutzgebiete-35140582.html,0,www.stern.de,Südpolarmeer in Gefahr: Antarktis-Konferenz ringt um Ausweisung neuer Schutzgebiete,"Das Eis im Südpolarmeer schmilzt - und das betrifft nicht nur Pinguine, sondern den ganzen Planeten. Ein Experten-Bericht zeigt das ganze Ausmaß. Reagiert die Antarktis-Kommission bei ihrer Tagung?",https://image.stern.de/35140584/t/Bb/v1/w1440/r1.7778/-/14--s2gpyigbidv5axw800h600jpeg---4e102047ffad31d9.jpg,2024-10-14T05:00:36Z,,"Das Eis im Südpolarmeer schmilzt - und das betrifft nicht nur Pinguine, sondern den ganzen Planeten. Ein Experten-Bericht zeigt das ganze Ausmaß. Reagiert die Antarktis-Kommission bei ihrer Tagung?
… [+3156 chars]",,de,'Eis'
https://www.tagesspiegel.de/wissen/sudpolarmeer-in-gefahr-antarktis-konferenz-ringt-um-ausweisung-neuer-schutzgebiete-12527705.html,https://www.tagesspiegel.de/wissen/sudpolarmeer-in-gefahr-antarktis-konferenz-ringt-um-ausweisung-neuer-schutzgebiete-12527705.html,0,www.tagesspiegel.de,Südpolarmeer in Gefahr: Antarktis-Konferenz ringt um Ausweisung neuer Schutzgebiete,"Das Eis im Südpolarmeer schmilzt - und das betrifft nicht nur Pinguine, sondern den ganzen Planeten. Ein Experten-Bericht zeigt das ganze Ausmaß. Reagiert die Antarktis-Kommission bei ihrer Tagung?",https://www.tagesspiegel.de/images/12527702/alternates/BASE_16_9_W1400/1728882128000/antarktis-konferenz-in-hobart-weddellmeer.jpeg,2024-10-14T05:02:08Z,,Die Antarktis und das sie umgebende Südpolarmeer sind in immer größerer Gefahr. Die Region erlebt einem neuen Bericht zufolge beispiellose Temperaturanomalien mit häufigeren marinen Hitzewellen und e… [+3707 chars],,de,'Eis'
https://www.golem.de/sonstiges/zustimmung/auswahl.html?from=https://www.golem.de/news/mehr-unfaelle-bei-senioren-verwechslung-von-gas-und-bremspedal-2410-189785.html&referer=https://t.co/80cf54eb73,https://www.golem.de/sonstiges/zustimmung/auswahl.html?from=https://www.golem.de/news/mehr-unfaelle-bei-senioren-verwechslung-von-gas-und-bremspedal-2410-189785.html&referer=https://t.co/80cf54eb73,0,www.golem.de,Mehr Unfälle bei Senioren: Verwechslung von Gas- und Bremspedal,"Autounfälle durch Pedalverwechslung nehmen nach Beobachtung von Experten zu, besonders bei älteren Fahrern. Nun gibt es technische Lösungen. (Auto, Mobilität)",,2024-10-14T05:22:01Z,,"Besuchen Sie Golem.de wie gewohnt mit Werbung und Tracking,
 indem Sie der Nutzung aller Cookies zustimmen.
 Details zum Tracking finden Sie im Privacy Center.
Skript wurde nicht geladen. Informat… [+607 chars]",,de,'Gas'
https://www.zeit.de/news/2024-10/14/enviam-will-strom-und-gaspreise-senken,https://www.zeit.de/news/2024-10/14/enviam-will-strom-und-gaspreise-senken,0,www.zeit.de,Energieversorger: EnviaM will Strom- und Gaspreise senken,Hier finden Sie Informationen zu dem Thema „Energieversorger“. Lesen Sie jetzt „EnviaM will Strom- und Gaspreise senken“.,https://img.zeit.de/news/2024-10/14/enviam-will-strom-und-gaspreise-senken-image-group/wide__1300x731,2024-10-14T06:37:48Z,,"Das ostdeutsche Energieunternehmen EnviaM will die Preise für Strom und Gas senken. «Unterm Strich werden die Preise für EnviaM-Kunden im kommenden Jahr spürbar sinken», sagte der Chef des größten os… [+2148 chars]",,de,'Gas'
https://www.transfermarkt.de/berichte-genoa-legt-balotelli-deal-vorerst-auf-eis-klubchefs-furchten-um-frieden-in-kabine/view/news/444965,https://www.transfermarkt.de/berichte-genoa-legt-balotelli-deal-vorerst-auf-eis-klubchefs-furchten-um-frieden-in-kabine/view/news/444965,0,www.transfermarkt.de,CFC Genua legt Balotelli-Deal vorerst auf Eis – Furcht um Kabinenfrieden,"Wo liegt die sportliche Zukunft von Mario Balotelli? Nachdem im September der spanische Drittligist CF Intercity mit ihm verhandelt hatte, galt zuletzt der Genua CFC als wahrscheinlichstes Ziel...",https://tmssl.akamaized.net/images/foto/big/mario-balotelli-monza-1613402816-56589.jpg?lm=1613402834,2024-10-14T07:07:04Z,,"Wo liegt die sportliche Zukunft von Mario Balotelli? Nachdem im September der spanische Drittligist CF Intercity mit ihm verhandelt hatte, galt zuletzt der Genua CFC als wahrscheinlichstes Ziel für d… [+2016 chars]",,de,'Eis'
https://www.bild.de/politik/ausland-und-internationales/staats-praesidentin-zurabishvili-georgien-hat-die-wahl-europa-oder-dunkelheit-66b8af61c10294619c9335a5,https://www.bild.de/politik/ausland-und-internationales/staats-praesidentin-zurabishvili-georgien-hat-die-wahl-europa-oder-dunkelheit-66b8af61c10294619c9335a5,0,www.bild.de,Staats-Präsidentin Zurabishvili - „Georgien hat die Wahl: Europa oder Dunkelheit“,Staats-Präsidentin Zurabishvili im BILD-Interview.,"https://images.bild.de/66b8af61c10294619c9335a5/002776b5e58d3d95997031824a386592,2a4d35d2?w=1280",2024-10-14T08:22:38Z,http://archive.md/20241015084924/https://www.bild.de/politik/ausland-und-internationales/staats-praesidentin-zurabishvili-georgien-hat-die-wahl-europa-oder-dunkelheit-66b8af61c10294619c9335a5,"Bei der EM begeisterte die Mannschaft Georgiens als Einheit. Doch das Land ist zerrissen wie nie.
Regierungschef Irakli Kobachidse (45) sucht die Nähe zu Kreml-Diktator Wladimir Putin (71). Unterstü… [+3423 chars]",,de,'Dunkelheit'
https://www.bild.de/news/ausland/griechenland-mafia-mord-um-immobilien-auf-urlaubsinsel-mykonos-670bbea7e949b91c106332dd,https://www.bild.de/news/ausland/griechenland-mafia-mord-um-immobilien-auf-urlaubsinsel-mykonos-670bbea7e949b91c106332dd,0,www.bild.de,Mafia tötet für Mykonos-Grundstück - Eiskalter Auftragsmord für ein Stück Paradies,Das Influencer- und Urlauberparadies Mykonos ist im Würgegriff der griechischen Mafia.,"https://images.bild.de/670bbea7e949b91c106332dd/0c779a2d983765d103d05cf5afe9dc3e,7d943484?w=1280",2024-10-14T09:16:07Z,http://archive.md/20241015131157/https://www.bild.de/news/ausland/griechenland-mafia-mord-um-immobilien-auf-urlaubsinsel-mykonos-670bbea7e949b91c106332dd,"Athen Angst geht auf der griechischen Insel Mykonos um. Angst vor der Mafia, die das Urlaubsparadies als Geldquelle entdeckt hat und nun brutal ausquetschen will. Und dabei vor Mord nicht zurückschre… [+3809 chars]",,de,'Gefrieren'
https://www.bild.de/sport/fussball/machen-sie-was-draus-reif-erfindet-neues-fussball-wort-670cd3cd1970835c9d86113a,https://www.bild.de/sport/fussball/machen-sie-was-draus-reif-erfindet-neues-fussball-wort-670cd3cd1970835c9d86113a,0,www.bild.de,„Machen Sie was draus“ - Reif erfindet LIVE im Studio neues Fußball-Wort,Fußball-Experte Marcel Reif analysiert Wirtz Traum-Tor-Vorlage – und erfindet dabei eine neue Taktik.,"https://images.bild.de/670cd3cd1970835c9d86113a/931b886677de0d2d419cf4f9ca1edc23,877c49d7?w=1280",2024-10-14T09:24:08Z,,"Mehr zum Video anzeigen 
Fußball-Experte Marcel Reif analysiert Wirtz Traum-Tor-Vorlage und erfindet dabei eine neue Taktik. 
Quelle: BILD14.10.2024 - 11:24 Uhr",,de,'Reif'
https://www.bild.de/sport/fussball/ist-ja-kein-geheimnis-voeller-bestaetigt-bayern-interesse-an-wirtz-670cd3f61970835c9d861146,https://www.bild.de/sport/fussball/ist-ja-kein-geheimnis-voeller-bestaetigt-bayern-interesse-an-wirtz-670cd3f61970835c9d861146,0,www.bild.de,„Ist ja kein Geheimnis“ - Ach ja? Völler bestätigt Bayern-Interesse an Wirtz,"Leverkusen, Bayern oder Madrid? Fußball-Experte Marcel Reif spekuliert, wo es Florian Wirtz zukünftig hin verschlagen könnte.","https://images.bild.de/670cd3f61970835c9d861146/5d83e1657eb1fbecc28647046904af3d,92e4da3a?w=1280",2024-10-14T09:34:37Z,,"Prozess in Berlin: Zehn Jahre Haft für Stasi-Mord von 1974
Prozess in Berlin: Zehn Jahre Haft für Stasi-Mord von 1974
Prozess in Berlin: Zehn Jahre Haft für Stasi-Mord von 1974
Prozess in Berlin: … [+398 chars]",,de,'Reif'
https://www.bild.de/sport/fussball/mehr-geld-fuer-stars-diesen-einfluss-koennte-klopp-auf-leipzig-nehmen-670cd43c1d5d3c53fecc3e1e,https://www.bild.de/sport/fussball/mehr-geld-fuer-stars-diesen-einfluss-koennte-klopp-auf-leipzig-nehmen-670cd43c1d5d3c53fecc3e1e,0,www.bild.de,Mehr Geld für neue Stars? - Diesen Einfluss könnte Klopp auf RB Leipzig nehmen,Was Jürgen Klopp in seiner neuen Rolle als Red-Bull-Funktionär für den deutschen Fußball bedeutet – das weiß Experte Marcel Reif.,"https://images.bild.de/670cd43c1d5d3c53fecc3e1e/048416ee2bc453d9bc5de84ec374263e,f12ad12e?w=1280",2024-10-14T10:06:01Z,,"Mehr zum Video anzeigen 
Was Jürgen Klopp in seiner neuen Rolle als Red-Bull-Funktionär für den deutschen Fußball bedeutet das vermuten Rudi Völler und Marcel Reif. 
Quelle: BILD14.10.2024 - 12:06 … [+2 chars]",,de,'Reif'
https://www.bild.de/sport/fussball/er-haette-gern-die-kutsche-das-steckt-hinter-tuchels-joblosigkeit-670cd4771d5d3c53fecc3e23,https://www.bild.de/sport/fussball/er-haette-gern-die-kutsche-das-steckt-hinter-tuchels-joblosigkeit-670cd4771d5d3c53fecc3e23,0,www.bild.de,„Er hätte gern die Kutsche“ - Das steckt hinter Tuchels Joblosigkeit,"„Er darf es sich leisten“: Fußball-Experte Marcel Reif weiß, warum Thomas Tuchel so anspruchsvoll ist.","https://images.bild.de/670cd4771d5d3c53fecc3e23/445bcb67b8fcb53919e12830d491e7fe,c82a768c?w=1280",2024-10-14T10:21:24Z,,"Mehr zum Video anzeigen 
Er darf es sich leisten: Fußball-Experte Marcel Reif weiß, warum Thomas Tuchel so anspruchsvoll ist.
Quelle: BILD14.10.2024 - 12:21 Uhr",,de,'Reif'
https://www.bild.de/sport/fussball/glauben-sie-an-diese-theorie-darum-wuerde-undav-ein-bayern-angebot-ablehnen-670cf2be7056bb502fd9ca35,https://www.bild.de/sport/fussball/glauben-sie-an-diese-theorie-darum-wuerde-undav-ein-bayern-angebot-ablehnen-670cf2be7056bb502fd9ca35,0,www.bild.de,Glauben Sie an diese Theorie? - Darum würde Undav ein Bayern-Angebot ablehnen,Reif Short - Undav würde Bayern ablehnen,"https://images.bild.de/670cf2be7056bb502fd9ca35/f3fdc20532746b8914889000ee2b993f-landscape,e3a9fa1c?w=1280",2024-10-14T11:01:08Z,,"Mehr zum Video anzeigen 
Reif Short - Undav würde Bayern ablehnen
Quelle: BILD14.10.2024 - 13:01 Uhr",,de,'Reif'
https://www.bild.de/sport/machen-sie-was-draus-reif-erfindet-live-im-studio-neues-fussball-wort-670ced003042982550c1a6d9,https://www.bild.de/sport/machen-sie-was-draus-reif-erfindet-live-im-studio-neues-fussball-wort-670ced003042982550c1a6d9,0,www.bild.de,„Machen Sie was draus“ - Reif erfindet LIVE im Studio neues Fußball-Wort,"Bei Wirtz kommt der Experte so ins Schwärmen, dass er neue Worte erfindet...","https://images.bild.de/670ced003042982550c1a6d9/f3fdc20532746b8914889000ee2b993f-landscape,e3a9fa1c?w=1280",2024-10-14T11:01:18Z,,"Mehr zum Video anzeigen 
Bei Wirtz kommt der Experte so ins Schwärmen, dass er neue Worte erfindet...
Quelle: BILD14.10.2024 - 13:01 Uhr",,de,'Reif'
https://www.faz.net/aktuell/finanzen/meine-finanzen/heizkosten-wer-die-heizung-noch-aus-laesst-kann-80-euro-sparen-110041379.html,https://www.faz.net/aktuell/finanzen/meine-finanzen/heizkosten-wer-die-heizung-noch-aus-laesst-kann-80-euro-sparen-110041379.html,0,www.faz.net,Das kostet uns dieser Winter,"Heizen kostet immer noch viel Geld. Wer die Heizung noch zwei Wochen aus lässt, kann 80 Euro sparen. Aber es gibt auch andere Wege.",https://media1.faz.net/ppmedia/aktuell/1971248111/1.10046133/facebook_teaser_fplus/verbraucher-sollten-vor.jpg,2024-10-14T13:49:12Z,http://archive.md/20241016143405/https://www.faz.net/aktuell/finanzen/meine-finanzen/heizkosten-wer-die-heizung-noch-aus-laesst-kann-80-euro-sparen-110041379.html,"Schwitzen Sie noch, oder frieren Sie schon? Die Temperaturen in Deutschland jedenfalls ließen zuletzt jegliche Outfitkombinationen aus T-Shirt, Lederjacke, Wollmütze und Dreiviertelhose zu, ohne dass… [+51 chars]",,de,'Heizung'
https://www.nzz.ch/zuerich/winterthur-hat-problem-mit-illegal-entsorgtem-abfall-ld.1852794,https://www.nzz.ch/zuerich/winterthur-hat-problem-mit-illegal-entsorgtem-abfall-ld.1852794,0,www.nzz.ch,"Windeln, Sexspielzeug, WC-Brillen: Immer mehr Leute entsorgen ihren Abfall an Bushaltestellen","In Winterthur durchwühlen Mitarbeitende des Tiefbauamts den Müll, um den Sündern auf die Spur zu kommen.","https://img.nzz.ch/2024/10/14/2b086811-b817-4818-abf0-e638362784ec.jpeg?width=1200&height=675&fit=bounds&quality=75&auto=webp&crop=4032,2268,x0,y515&wmark=nzz",2024-10-14T13:54:58Z,http://archive.md/20241014201450/https://www.nzz.ch/zuerich/winterthur-hat-problem-mit-illegal-entsorgtem-abfall-ld.1852794,"Abfallkübel an Bushaltestellen in der Stadt Winterthur werden regelmässig mit Hauskehricht vollgestopft.
Dominic Bösch muss Handschuhe anziehen, damit er seine Arbeit machen kann. Er öffnet den über… [+5150 chars]",,de,'Winter'
