index,url,valid,domain,title,description,image,published,archive,content,quote,language,keyword
https://www.tagesschau.de/wirtschaft/mehrwertsteuer-gas-102.html,https://www.tagesschau.de/wirtschaft/mehrwertsteuer-gas-102.html,0,www.tagesschau.de,Ab heute Mehrwertsteuer auf Gas wieder bei 19 Prozent,Ab heute wird wieder die volle Mehrwertsteuer von 19 Prozent auf Gas und Fernwärme fällig - die von der Bundesregierung im Zuge des Ukraine-Kriegs beschlossene Senkung auf 7 Prozent läuft aus. Experten rechnen mit höheren Kosten für Verbraucher.,https://images.tagesschau.de/image/5208ed99-5eb8-4caa-9d45-a58cd3ac2df9/AAABiJ8KRVE/AAABjcWen7M/16x9-1280/gasflamme-124.jpg,2024-04-01T02:42:00Z,,"Stand: 01.04.2024 04:42 Uhr
Ab heute wird wieder die volle Mehrwertsteuer von 19 Prozent auf Gas und Fernwärme fällig - die von der Bundesregierung im Zuge des Ukraine-Kriegs beschlossene Senkung au… [+1004 chars]",,de,'Gas'
https://www.tagesschau.de/wissen/klima/skifahren-deutschland-zukunft-100.html,https://www.tagesschau.de/wissen/klima/skifahren-deutschland-zukunft-100.html,0,www.tagesschau.de,War's das mit Skifahren in Deutschland?,"Der Winter war sehr warm, viele Skigebiete mussten den Betrieb früher als geplant einstellen. Hat Wintersport in Deutschland überhaupt noch eine Zukunft? Es kommt drauf an. Von Holger Schwesinger.",https://images.tagesschau.de/image/b413be8d-48b7-486c-92eb-f45316c7cdc8/AAABjpnArmg/AAABjcWen7M/16x9-1280/skifahren-114.jpg,2024-04-01T13:02:08Z,,"Stand: 01.04.2024 15:02 Uhr
Der Winter war sehr warm, viele Skigebiete mussten den Betrieb früher als geplant einstellen. Hat Wintersport in Deutschland überhaupt noch eine Zukunft? Es kommt drauf a… [+12618 chars]",,de,'Schnee'
https://orf.at/stories/3353240/,https://orf.at/stories/3353240/,0,orf.at,Hagel und Schnee in Norditalien,,https://orf.at/mojo/1_4_1/storyserver//news/common/images/og-fallback-news.png,2024-04-01T18:03:44Z,,Norditalien ist heute von schweren Unwettern heimgesucht worden. Besonders betroffen waren die Regionen Lombardei und Piemont. Wegen eines heftigen Hagelsturms kam es zu Verkehrsproblemen auf der Aut… [+997 chars],,de,'Schnee'
https://www.welt.de/vermischtes/article250829668/Schweiz-Drei-Menschen-sterben-bei-Lawinenunglueck-in-Zermatt.html,https://www.welt.de/vermischtes/article250829668/Schweiz-Drei-Menschen-sterben-bei-Lawinenunglueck-in-Zermatt.html,0,www.welt.de,Drei Menschen sterben bei Lawinenunglück in Zermatt,Wegen starker Schneefälle und orkanartiger Winde warnten die Behörden vor einer erhöhten Lawinengefahr in der Region: Nun wurden drei Personen tot nach einem Lawinenabgang aus den Schnemassen geborgen. Eine vierte Person überlebte.,https://img.welt.de/img/incoming/mobile250829670/5171359897-ci16x9-w1200/Lawine-reisst-bei-Zermatt-mehrere-Menschen-mit.jpg,2024-04-01T19:23:29Z,,"In einer riesigen Lawine sind bei Zermatt in der Schweiz am Ostermontag mindestens drei Menschen ums Leben gekommen. Eine vierte Person sei lebend gefunden worden, berichtete die Polizei im Kanton Wa… [+1632 chars]",,de,'Schnee'
https://www.nzz.ch/panorama/lawinenniedergang-bei-zermatt-polizei-meldet-drei-tote-und-einen-verletzten-suche-nach-moeglichen-weiteren-vermissten-wird-am-dienstag-fortgesetzt-ld.1824492,https://www.nzz.ch/panorama/lawinenniedergang-bei-zermatt-polizei-meldet-drei-tote-und-einen-verletzten-suche-nach-moeglichen-weiteren-vermissten-wird-am-dienstag-fortgesetzt-ld.1824492,0,www.nzz.ch,Lawinenniedergang bei Zermatt: Polizei meldet drei Tote und einen Verletzten. Suche nach möglichen weiteren Vermissten wird am Dienstag fortgesetzt,Das Institut für Schnee- und Lawinenforschung (SLF) in Davos hatte am Ostermontag vor «sehr grossen und vereinzelt extrem grossen spontanen Lawinen» gewarnt.,"https://img.nzz.ch/2024/04/01/e4620d6e-d501-499f-9915-d17158bbc633.jpeg?width=1200&height=675&fit=bound&quality=75&auto=webp&crop=3500,1969,x0,y300&wmark=nzz",2024-04-01T19:59:26Z,,"Skifahrer am Riffelberg bei Zermatt, wo am Montag eine grosse Lawine niederging. Aufnahme vom 16. Januar 2012.
Viel Neuschnee und orkanartige Winde haben in südlichen Alpenlagen in Österreich und de… [+5479 chars]",,de,'Schnee'
https://www.faz.net/aktuell/wirtschaft/auto-verkehr/reifenwechsel-auf-sommerreifen-was-autofahrer-nun-beachten-muessen-17953343.html,https://www.faz.net/aktuell/wirtschaft/auto-verkehr/reifenwechsel-auf-sommerreifen-was-autofahrer-nun-beachten-muessen-17953343.html,0,www.faz.net,Reifenwechsel: Sommerreifen erst bei Temperaturen ab sieben Grad aufziehen,"An Ostern ist es für die meisten Autofahrer wieder Zeit, von Winter- auf Sommerreifen zu wechseln – doch die Faustregel „von Oktober bis Ostern“ ist mit Vorsicht zu genießen. Das muss man beachten.",https://media1.faz.net/ppmedia/aktuell/wirtschaft/3389478309/1.9618191/facebook_teaser/die-faustregel-besagt-dass.jpg,2024-04-02T09:20:26Z,,"Wann genau sollten Sommerreifen aufgezogen werden?
Einen allgemein vorgeschriebenen Zeitpunkt für den Reifenwechsel gibt es in Deutschland nicht. Der Gesetzgeber schreibt lediglich vor, dass die Aus… [+2920 chars]",,de,'Schnee'
https://www.zeit.de/news/2024-04/02/ex-nationalstuermer-wolf-verabschiedet-sich-von-mannheim,https://www.zeit.de/news/2024-04/02/ex-nationalstuermer-wolf-verabschiedet-sich-von-mannheim,0,www.zeit.de,Eishockey: Ex-Nationalstürmer Wolf verabschiedet sich von Mannheim,Hier finden Sie Informationen zu dem Thema „Eishockey“. Lesen Sie jetzt „Ex-Nationalstürmer Wolf verabschiedet sich von Mannheim“.,https://img.zeit.de/news/2024-04/02/ex-nationalstuermer-wolf-verabschiedet-sich-von-mannheim-image-group/wide__1300x731,2024-04-02T14:55:15Z,,"Olympia-Silbermedaillengewinner David Wolf wird nach eigenen Worten nicht mehr für die Adler Mannheim spielen. «Ich bin traurig und es bricht mir das Herz kein Teil der Adler Mannheim mehr zu sein», … [+956 chars]",,de,'Eis'
https://www.faz.net/aktuell/gesellschaft/viel-schnee-in-norditalien-ungewoehnlich-gute-skisaison-endet-19624150.html,https://www.faz.net/aktuell/gesellschaft/viel-schnee-in-norditalien-ungewoehnlich-gute-skisaison-endet-19624150.html,0,www.faz.net,Viel Schnee in Norditalien: Ungewöhnlich gute Skisaison endet,In den norditalienischen Hochlagen hat es in diesem Winter so viel geschneit wie seit Jahren nicht. Die Skigebiete blicken allem Pessimismus zum Trotz auf eine erfolgreiche Saison zurück.,https://media1.faz.net/ppmedia/aktuell/3990816090/1.9624225/facebook_teaser/ein-skifahrer-steht-anfang.jpg,2024-04-02T15:25:53Z,,"Wer an der Talstation der Seilbahn zur Seiser Alm in Südtirol kostenlos parken will, muss früh aufstehen. Rasch ist der riesige Parkplatz gefüllt, im zweistöckigen Parkhaus sind dann Gebühren fällig.… [+3846 chars]",,de,'Schnee'
https://www.morgenpost.de/wirtschaft/article242014234/Heizung-Bund-bremst-bei-Foerderung-von-Energieberatung.html,https://www.morgenpost.de/wirtschaft/article242014234/Heizung-Bund-bremst-bei-Foerderung-von-Energieberatung.html,0,www.morgenpost.de,Heizung: Bund bremst bei Förderung von Energieberatung,"Wer eine Immobilie energetisch sanieren will, kann Geld vom Staat bekommen – zunächst für eine Energieberatung. Doch es hakt.",https://img.sparknews.funkemedien.de/241650136/241650136_1707734355_v16_9_1600.jpeg,2024-04-02T16:23:32Z,,"Berlin. Wer eine Immobilie energetisch sanieren will, kann Geld vom Staat bekommen zunächst für eine Energieberatung. Doch es hakt.
Wärmepumpe, Gasheizung oder Pelletheizung? Wer sein Haus energetis… [+4415 chars]",,de,'Heizung'
https://www.zeit.de/news/2024-04/02/bremse-und-gas-verwechselt-auto-geraet-auf-caf-terrasse,https://www.zeit.de/news/2024-04/02/bremse-und-gas-verwechselt-auto-geraet-auf-caf-terrasse,0,www.zeit.de,Magdeburg: Bremse und Gas verwechselt: Auto gerät auf Café-Terrasse,Hier finden Sie Informationen zu dem Thema „Magdeburg“. Lesen Sie jetzt „Bremse und Gas verwechselt: Auto gerät auf Café-Terrasse“.,https://img.zeit.de/news/2024-04/02/bremse-und-gas-verwechselt-auto-geraet-auf-caf-terrasse-image-group/wide__1300x731,2024-04-02T17:39:31Z,,"Das Auto eines Rentners ist am Dienstagnachmittag in der Magdeburger Innenstadt von der Straße abgekommen und auf die Terrasse eines Cafés geraten. Zwei Gäste, die an einem Tisch saßen, wurden verlet… [+1056 chars]",,de,'Gas'
https://www.pcgames.de/South-Park-Snow-Day-Spiel-74574/Tests/south-park-snow-day-thq-obsidian-review-test-multiplayer-koop-1444364/,https://www.pcgames.de/South-Park-Snow-Day-Spiel-74574/Tests/south-park-snow-day-thq-obsidian-review-test-multiplayer-koop-1444364/,0,www.pcgames.de,South Park: Snow Day! im Test - Jetzt schon Schnee von gestern,"Mit Snow Day! erschien ein neues South-Park-Spiel, das ALLES anders macht: 3D-Grafik, uninteressante Dialoge, schlechte Gags und eine Menge eintönige Kämpfe.",https://www.pcgames.de/screenshots/1280x1024/2024/04/SOUTH_PARK_SNOW_DAY_KEYART-pc-games.jpg,2024-04-03T09:00:00Z,,"Mit South Park: Der Stab der Wahrheit und South Park: Die Rektakuläre Zerreißprobe kamen Fans der abgedrehten Animationsserie voll auf ihre Kosten. Obsidian schuf zwei Rollenspiele, die South-Park-Ve… [+3835 chars]",,de,'Schnee'
https://www.zeit.de/news/2024-04/03/adler-mannheim-bestaetigen-abschied-von-wolf,https://www.zeit.de/news/2024-04/03/adler-mannheim-bestaetigen-abschied-von-wolf,0,www.zeit.de,Eishockey: Adler Mannheim bestätigen Abschied von Wolf,Hier finden Sie Informationen zu dem Thema „Eishockey“. Lesen Sie jetzt „Adler Mannheim bestätigen Abschied von Wolf“.,https://img.zeit.de/news/2024-04/03/adler-mannheim-bestaetigen-abschied-von-wolf-image-group/wide__1300x731,2024-04-03T13:58:14Z,,"Einen Tag nach David Wolfs persönlicher Abschiedserklärung haben die Adler Mannheim seinen Abgang bestätigt. Es ende «ein prägendes Kapitel der Clubgeschichte», teilte der Verein der Deutschen Eishoc… [+1626 chars]",,de,'Eis'
https://www.bild.de/news/ausland/news-ausland/drei-tote-in-zermatt-hier-verschlingt-die-lawine-ihre-opfer-87743146.bild.html,https://www.bild.de/news/ausland/news-ausland/drei-tote-in-zermatt-hier-verschlingt-die-lawine-ihre-opfer-87743146.bild.html,0,www.bild.de,Drei Tote in Zermatt - Hier verschlingt die Lawine ihre Opfer,"Ein Foto zeigt den Moment, in dem die Todes-Lawine von Zermatt abgeht – und die drei Menschen, die sich direkt unter den rollenden Schneemassen befinden.","https://images.bild.de/660d35bb3d30b9192564cd02/2ed6a76c08e0b4b7f92716af98a09c1c,d165c4d8?w=1280",2024-04-03T15:51:58Z,,"Es ist ein Augenblick zwischen Leben und Tod. Ein Foto zeigt den Moment, in dem die gewaltige Lawine von Zermatt abgeht und die drei Menschen, die sich direkt unter den rollenden Schneemassen befinde… [+2067 chars]",,de,'Schnee'
https://www.bild.de/geld/wirtschaft/wirtschaft/angestellte-rentner-pensionaere-wen-die-inflation-am-staerksten-trifft-87739852.bild.html,https://www.bild.de/geld/wirtschaft/wirtschaft/angestellte-rentner-pensionaere-wen-die-inflation-am-staerksten-trifft-87739852.bild.html,0,www.bild.de,Haushalte im Vergleich - Wen die Inflation am stärksten trifft,"Teuer-Schock bei Heizen, Lebensmitteln, Benzin! Das Institut der deutschen Wirtschaft hat ermittelt, wen es wie stark erwischt hat.","https://images.bild.de/660d1589d3df1c408f7f44bb/27e626ce843a30e2e2d7c690cef90669,af26207a?w=1280",2024-04-03T19:14:06Z,,"In den vergangen beiden Jahren kannten die Preise nur eine Richtung: nach oben. Teuer-Schock! Die allgemeine Inflation kletterte 2022 auf 6,9 Prozent. Rekord seit Wiedervereinigung! 2023 waren es 5,9… [+2515 chars]",,de,'Heizen'
https://www.nzz.ch/visuals/im-sueden-tuermt-sich-der-neuschnee-doch-an-vielen-messstationen-liegt-kaum-mehr-schnee-als-im-langjaehrigen-durchschnitt-ld.1824569,https://www.nzz.ch/visuals/im-sueden-tuermt-sich-der-neuschnee-doch-an-vielen-messstationen-liegt-kaum-mehr-schnee-als-im-langjaehrigen-durchschnitt-ld.1824569,0,www.nzz.ch,"DATENANALYSE - Im Süden türmt sich der Neuschnee, doch an vielen Messstationen liegt kaum mehr Schnee als im langjährigen Durchschnitt",In den Tessiner und den Walliser Bergen hat es in den letzten Wochen viel geschneit. Wie ungewöhnlich ist das?,"https://img.nzz.ch/2024/04/02/08272a59-a9d0-405b-926a-465776082e82.jpeg?width=1200&height=675&fit=bound&quality=75&auto=webp&crop=1770,996,x633,y69&wmark=nzz",2024-04-04T03:30:00Z,,Auf den wärmsten Februar seit Messbeginn folgte dieses Jahr ein stürmischer März. Dem Süden brachte der Monat viel Niederschlag und teilweise eine hohe Lawinengefahr. Das Institut für Schnee- und Law… [+3604 chars],,de,'Schnee'
https://praxistipps.chip.de/warum-eisbaeren-weiss-sind-einfach-erklaert_176983,https://praxistipps.chip.de/warum-eisbaeren-weiss-sind-einfach-erklaert_176983,0,praxistipps.chip.de,Warum Eisbären weiß sind: Einfach erklärt,"Warum Eisbären weiß sind, hat verschiedene nützliche Gründe. Die Bären, auch Ursus maritimus genannt, gelten vor allem in kalter Umgebung als besonders anpassungsfähig. … ... mehr",https://im.contentlounge.net/styles/manual_crop/s3/2024-04/65401303.jpg?im=AspectCrop%3D%281.91%2C1%29%2Cgravity%3DCenter%3BResize%3D%281200%2C630%29%2Caspect%3Dfit%3BBackgroundColor%2Ccolor%3Dffffff&hash=eb89dcddb58c45f52265d1007eec052fc583dab501e15c7e668f8db024cd8a38,2024-04-04T08:12:37Z,,"Warum Eisbären weiß sind, hat verschiedene nützliche Gründe. Die Bären, auch Ursus maritimus genannt, gelten vor allem in kalter Umgebung als besonders anpassungsfähig.
Die mit einem Symbol oder far… [+2747 chars]",,de,'Eis'
https://www.appgefahren.de/smarte-heizkoerper-thermostate-von-bosch-und-tado-stark-reduziert-355506.html,https://www.appgefahren.de/smarte-heizkoerper-thermostate-von-bosch-und-tado-stark-reduziert-355506.html,0,www.appgefahren.de,Smarte Heizkörper-Thermostate von Bosch und Tado stark reduziert,"Der Winter hat ein Ende gefunden, am Wochenende werden es zum Teil weit über 25 Grad. Da bleibt die Heizung definitiv aus. Das heißt aber auch: Die Hersteller und Händler wollen die Lagerbestände reduzieren. Falls ihr jetzt schon für den nächsten Winter vorso…",https://www.appgefahren.de/wp-content/uploads/2022/12/Tado-1.jpg,2024-04-04T09:36:24Z,,"Der Winter hat ein Ende gefunden, am Wochenende werden es zum Teil weit über 25 Grad. Da bleibt die Heizung definitiv aus. Das heißt aber auch: Die Hersteller und Händler wollen die Lagerbestände red… [+2432 chars]",,de,'Heizen'
https://taz.de/Die-Heizung-bleibt-aus/!5999989/,https://taz.de/Die-Heizung-bleibt-aus/!5999989/,0,taz.de,Die Heizung bleibt aus: Meine Winter im Skianzug,"Vor zwei Jahren, als durch Russlands Angriffskrieg eine Gasknappheit drohte, kaufte sich unsere Autorin einen Skianzug. Sie wollte gewappnet sein.",https://taz.de/picture/6905249/948/35022843-1.jpeg,2024-04-04T10:24:00Z,,"Vor zwei Jahren, als durch Russlands Angriffskrieg eine Gasknappheit drohte, kaufte sich unsere Autorin einen Skianzug. Sie wollte gewappnet sein.
Skianzüge sind nicht nur warm, sondern auch ganz sc… [+5552 chars]",,de,'Heizung'
https://www.sueddeutsche.de/bayern/wenzenbach-regensburg-fernwaerme-waermenetz-insolvenz-1.6519553,https://www.sueddeutsche.de/bayern/wenzenbach-regensburg-fernwaerme-waermenetz-insolvenz-1.6519553,0,www.sueddeutsche.de,"Ärger um Heizung: ""Die am wenigsten haben, zahlen den höchsten Preis""","Kein heißes Wasser, keine Heizung - in Wenzenbach bei Regensburg sitzen immer noch rund 35 Familien in der Kälte. Sie sind zwar an ein Fernwärmenetz angeschlossen, doch der Anbieter ging pleite. Nicht nur in Wenzenbach fragen sie sich: Wie hätte das verhinder…",https://www.sueddeutsche.de/image/sz.1.6519783/1200x675?v=1712240509,2024-04-04T14:21:52Z,http://archive.md/20240404183558/http://www.sueddeutsche.de/bayern/wenzenbach-regensburg-fernwaerme-waermenetz-insolvenz-1.6519553,"Das Heizungs-Drama in der Gemeinde Wenzenbach bei Regensburg geht in die nächste Runde. Seit mehr als einem Monat frieren sie im Ortsteil Roither Berg, weil ihr Fernwärme-Anbieter EVW Heizung und War… [+3589 chars]",,de,'Kälte'
https://fm4.orf.at/stories/3040281/,https://fm4.orf.at/stories/3040281/,0,fm4.orf.at,Die Sane! Gang zelebriert den Frühlingsbeginn im Schnee,Die Innsbrucker Snowboard Crew Sane! Gang erhält seit Jahren Snowboardkultur und -lifestyle und gibt der Szene mit Events wie dem Sane! Spring Break neue Impulse.,https://tubestatic.orf.at/static/images/site/tube/20240414/maxglatzl-quer-by-adrian-formella.6011069.jpg,2024-04-04T14:30:00Z,,"Die Innsbrucker Snowboard Crew Sane! Gang erhält seit Jahren Snowboardkultur und -lifestyle und gibt der Szene mit Events wie dem Sane! Spring Break neue Impulse.
Von Simon Welebil
Wer um diese Jah… [+4821 chars]",,de,'Schnee'
https://www.welt.de/sport/eishockey/article250877978/NHL-Rangers-gegen-Devils-Nach-zwei-Sekunden-pruegeln-sich-zehn-Spieler-auf-dem-Eis.html,https://www.welt.de/sport/eishockey/article250877978/NHL-Rangers-gegen-Devils-Nach-zwei-Sekunden-pruegeln-sich-zehn-Spieler-auf-dem-Eis.html,0,www.welt.de,Massenschlägerei – Nach zwei Sekunden prügeln sich zehn Spieler auf dem Eis,"Das Eishockey-Duell zwischen den New York Rangers und den New Jersey Devils verkommt zu einem Boxkampf, an dem gleich zehn Spieler beteiligt sind. Der Grund für die Massenschlägerei liegt Wochen zurück. Es gibt reichlich Strafen.",https://img.welt.de/img/sport/eishockey/mobile250878170/4371359127-ci16x9-w1200/New-Jersey-Devils-v-New-York-Rangers.jpg,2024-04-04T15:14:34Z,,Mit einer wilden Schlägerei direkt zu Beginn des Spiels in der National Hockey League (NHL) haben die Profis der New York Rangers und New Jersey Devils (4:3) für Aufsehen und zahlreiche Strafen gesor… [+1770 chars],,de,'Eis'
https://www.faz.net/podcasts/f-a-z-podcast-fruehdenker/nutzt-iran-den-al-quds-tag-fuer-vergeltungsmassnahmen-faz-fruehdenker-19632098.html,https://www.faz.net/podcasts/f-a-z-podcast-fruehdenker/nutzt-iran-den-al-quds-tag-fuer-vergeltungsmassnahmen-faz-fruehdenker-19632098.html,0,www.faz.net,F.A.Z. Frühdenker: Nutzt Iran den Al-Quds-Tag für Vergeltungsmaßnahmen?,"Am Al-Quds-Tag hetzt Iran gegen Israel, die Slowakei wählt einen neuen Staatspräsidenten, Gerhard Schröder hat Geburtstag und auf den Winter folgt der Aprilsommer. Der F.A.Z.-Newsletter.",https://media1.faz.net/ppmedia/aktuell/politik/245709587/1.9632115/facebook_teaser_fplus/ali-khamenei-oberster-fuehrer.jpg,2024-04-05T04:20:39Z,,"Ali Khamenei, Oberster Führer des Iran, ruft am Al-Quds-Tag die iranische Bevölkerung zur Hetze gegen Israel auf. Bild: dpa
Am Al-Quds-Tag hetzt Iran gegen Israel, die Slowakei wählt einen neuen Sta… [+1063 chars]",,de,'Winter'
https://www.tagesschau.de/wissen/klima/oesterreich-gletscher-schmelzen-100.html,https://www.tagesschau.de/wissen/klima/oesterreich-gletscher-schmelzen-100.html,0,www.tagesschau.de,Österreichs Gletscher könnten laut Alpenverein in 45 Jahren abgeschmolzen sein,"Bis auf einen haben zuletzt alle Gletscher in Österreich an Eis verloren. Bereits in wenigen Jahrzehnten könnten sie ganz verschwunden sein, hieß es bei der Vorstellung des Gletscherberichts des Österreichischen Alpenvereins.",https://images.tagesschau.de/image/df96c8b5-7ba7-47c2-8c0e-35a26c7876b8/AAABjq_UEnM/AAABjcWen7M/16x9-1280/gletscher-oesterreich-104.jpg,2024-04-05T19:51:25Z,,"Stand: 05.04.2024 21:51 Uhr
Bis auf einen haben zuletzt alle Gletscher in Österreich an Eis verloren. Bereits in wenigen Jahrzehnten könnten sie ganz verschwunden sein, hieß es bei der Vorstellung d… [+2398 chars]",,de,'Eis'
https://www.faz.net/aktuell/wissen/alpenvereins-oesterreich-in-45-jahren-weitgehend-eisfrei-19635036.html,https://www.faz.net/aktuell/wissen/alpenvereins-oesterreich-in-45-jahren-weitgehend-eisfrei-19635036.html,0,www.faz.net,Alpenverein: Österreich in 45 Jahren „weitgehend“ eisfrei,"Der Gletscherbericht des Österreichischen Alpenvereins zeigt auf, wie schnell das Eis in der Alpenrepublik schmilzt. Für eine Trendumkehr ist es laut den Experten bereits zu spät.",https://media0.faz.net/ppmedia/aktuell/gesellschaft/465210002/1.9635038/facebook_teaser/oesterreich-eine-gruppe-von.jpg,2024-04-05T21:36:57Z,,"Mit dem Ewigen Eis ist es in Österreich in absehbarer Zeit wohl vorbei: In 40 bis 45 Jahren werde die Alpenrepublik weitgehend eisfrei sein, sagte der Geograf Andreas Kellerer-Pirklbauer am Freitag a… [+1575 chars]",,de,'Eis'
https://www.tagesspiegel.de/wirtschaft/immobilien/mietminderung-bei-mangeln-was-tun-wenn-die-hausverwaltung-nicht-in-die-gange-kommt-11459381.html,https://www.tagesspiegel.de/wirtschaft/immobilien/mietminderung-bei-mangeln-was-tun-wenn-die-hausverwaltung-nicht-in-die-gange-kommt-11459381.html,0,www.tagesspiegel.de,"Mietminderung bei Mängeln: Was tun, wenn die Hausverwaltung nicht in die Gänge kommt?","Ist die Heizung defekt oder tropft es von der Decke, haben Mieter oft wochenlang Ärger. Manchmal verschleppen Vermieter oder Hausverwaltung das Problem. So schaffen Sie Abhilfe.",https://www.tagesspiegel.de/images/wasserschadenschirm/alternates/BASE_16_9_W1400/wasserschadenschirm.jpeg,2024-04-06T06:09:02Z,http://archive.md/20240406071415/http://www.tagesspiegel.de/wirtschaft/immobilien/mietminderung-bei-mangeln-was-tun-wenn-die-hausverwaltung-nicht-in-die-gange-kommt-11459381.html,"Ausgerechnet in der kalten Jahreszeit fällt die Heizung aus. Die Fenster sind undicht und lassen Lärm durch und manchmal auch Regenwasser. Oder es tropft plötzlich von der Decke, weil ein altes Wasse… [+1037 chars]",,de,'Heizung'
https://www.zeit.de/news/2024-04/06/eis-schlecken-in-zeiten-teuren-kakaos,https://www.zeit.de/news/2024-04/06/eis-schlecken-in-zeiten-teuren-kakaos,0,www.zeit.de,Gastgewerbe: Eis-Schlecken in Zeiten teuren Kakaos,Hier finden Sie Informationen zu dem Thema „Gastgewerbe“. Lesen Sie jetzt „Eis-Schlecken in Zeiten teuren Kakaos“.,https://img.zeit.de/news/2024-04/06/eis-schlecken-in-zeiten-teuren-kakaos-image-group/wide__1300x731,2024-04-06T06:35:21Z,,"Süß, kalt, teuer? Beim Speiseeis in Thüringens Cafés zeichnen sich in dieser Saison keine sinkenden Preise ab. «Dass es günstiger wird, das ist sehr unwahrscheinlich», sagte Thomas Junghans, Landesin… [+2442 chars]",,de,'Eis'
https://www.zeit.de/news/2024-04/06/eisbaeren-profi-noebels-erwartet-mammutaufgabe-in-straubing,https://www.zeit.de/news/2024-04/06/eisbaeren-profi-noebels-erwartet-mammutaufgabe-in-straubing,0,www.zeit.de,DEL: Eisbären-Profi Noebels erwartet «Mammutaufgabe» in Straubing,"Hier finden Sie Informationen zu dem Thema „DEL“. Lesen Sie jetzt „Eisbären-Profi Noebels erwartet ""Mammutaufgabe"" in Straubing“.",https://img.zeit.de/news/2024-04/06/eisbaeren-profi-noebels-erwartet-mammutaufgabe-in-straubing-image-group/wide__1300x731,2024-04-06T08:34:12Z,,"Drei Spiele - drei Siege: Trotz der bisher makellosen Serie im Halbfinale der Deutschen Eishockey Liga (DEL) träumt Nationalspieler Marcel Noebels noch nicht von einem Einzug ins Finale. «Ich glaube,… [+2346 chars]",,de,'Eis'
https://www.welt.de/finanzen/plus250813540/Immobilien-Erst-Heizung-Daemmung-oder-Dach-So-machen-Sie-den-perfekten-Sanierungs-Plan.html,https://www.welt.de/finanzen/plus250813540/Immobilien-Erst-Heizung-Daemmung-oder-Dach-So-machen-Sie-den-perfekten-Sanierungs-Plan.html,0,www.welt.de,"Erst Heizung, Dämmung oder Dach? So machen Sie den perfekten Sanierungs-Plan","Wer sein Haus sanieren möchte, kann sich oft nicht alles auf einmal leisten. Eine Sanierung kann mehr als 100.000 Euro kosten. WELT nennt die wichtigsten Fördermöglichkeiten. Experten räumen mit den größten Mythen auf und sagen, welche Maßnahmen unnötig oder …",https://img.welt.de/img/finanzen/mobile250853140/8451353607-ci16x9-w1200-fnov-fpotl-fpi157750653/GettyImages-1359726556.jpg,2024-04-06T10:25:24Z,http://archive.md/20240409120439/http://www.welt.de/finanzen/plus250813540/Immobilien-Erst-Heizung-Daemmung-oder-Dach-So-machen-Sie-den-perfekten-Sanierungs-Plan.html,"Die WELT als ePaper: Die vollständige Ausgabe steht Ihnen bereits am Vorabend zur Verfügung so sind Sie immer hochaktuell informiert. Weitere Informationen: http://epaper.welt.de 
 Der Kurz-Link die… [+49 chars]",,de,'Heizung'
https://www.morgenpost.de/bezirke/reinickendorf/article242039008/Wenn-man-sich-fuer-seine-Preise-schaemt-muss-man-aufhoeren.html,https://www.morgenpost.de/bezirke/reinickendorf/article242039008/Wenn-man-sich-fuer-seine-Preise-schaemt-muss-man-aufhoeren.html,0,www.morgenpost.de,"„Wenn man sich für seine Preise schämt, muss man aufhören“","Gleich vier Restaurants mussten kürzlich in Tegel schließen. Zwei Gastronomen erklären, warum sich die Lage so zugespitzt hat.",https://img.sparknews.funkemedien.de/242039006/242039006_1712403165_v16_9_1600.jpeg,2024-04-06T15:30:00Z,,"Berlin. Gleich vier Restaurants mussten kürzlich in Tegel schließen. Zwei Gastronomen erklären, warum sich die Lage so zugespitzt hat.
Sören Engelmann nimmt es sachlich. Der Kaufmann hat eine Kosten… [+5581 chars]",,de,'Gas'
https://vorarlberg.orf.at/stories/3252016/,https://vorarlberg.orf.at/stories/3252016/,0,vorarlberg.orf.at,Von Skigaudi bis Skifrust: Skisaison war durchwachsen,"In etlichen Skigebieten endet an diesem Wochenende die Skisaison. Einzelne Gebiete haben noch bis Mitte April offen. Aber nicht alle Skigebiete hatten heuer Glück, jene unter 1.500 Meter Seehöhe mussten schon vor längerer Zeit aufgrund des Schneemangels für h…",https://ibs.orf.at/vbg?image=https%3A%2F%2Foekastatic.orf.at%2Fmims%2F2021%2F03%2F11%2Fcrops%2Fw%3D1200%2Ch%3D627%2Cq%3D75%2F815298_master_284311_alberschwende_wintersport_24.jpg%3Fs%3D2ec5dd09a396ce32f3f3b89bbec67e513317b92f,2024-04-06T17:10:47Z,,"In Vorarlberg geht eine sehr durchwachsene Skisaison zu Ende. Während die höheren Skigebiete heuer überdurchschnittlich viel Schnee hatten, ist in vielen tieferen Tälern bereits seit Wochen kein Betr… [+1223 chars]",,de,'Winter'
