index,url,valid,domain,title,description,image,published,archive,content,quote,language,keyword
https://tirol.orf.at/stories/3303534/,https://tirol.orf.at/stories/3303534/,0,tirol.orf.at,Der April war sehr mild und trocken,Der April 2025 war in Tirol außergewöhnlich warm und in vielen Regionen deutlich zu trocken. Laut GeoSphere Austria gehört der Monat zu den wärmsten April-Monaten seit Beginn der Messungen. In den Bergen fiel außerdem weniger Schnee als im Durchschnitt.,https://ibs.orf.at/tir?image=https%3A%2F%2Foekastatic.orf.at%2Fmims%2F2025%2F09%2F65%2Fcrops%2Fw%3D1200%2Ch%3D627%2Cq%3D75%2F2534826_master_971465_t2.jpg%3Fs%3De0bde8160cfb0787f3e045754e106eac1522a06d,2025-05-01T03:56:52Z,https://web.archive.org/web/20250501064812/https://tirol.orf.at/stories/3303534/,"Der April 2025 war laut GeoSphere Austria in Tirol um 2,3 Grad wärmer als im langjährigen Mittel 1991 bis 2020. Der Monat liegt in den Gebirgsregionen Österreichs auf Platz acht der wärmsten April-Mo… [+2604 chars]",,de,'geringe Temperatur'
https://www.welt.de/geschichte/article255988390/Mumien-Forschung-DO-FRUEH-So-kamen-Oetzis-Vorfahren-nach-Europa.html,https://www.welt.de/geschichte/article255988390/Mumien-Forschung-DO-FRUEH-So-kamen-Oetzis-Vorfahren-nach-Europa.html,0,www.welt.de,Mit diesen Migranten kamen Ötzis Vorfahren nach Europa,"Der berühmte „Mann aus dem Eis“ gehörte offenbar zu einer weitgehend isoliert lebenden Gemeinschaft in den Alpen. Neue Studien zeigen auch, dass er mit den Pferdehirten aus der osteuropäischen Steppe nichts zu tun hatte.",https://img.welt.de/img/geschichte/mobile256040700/6847935177-ci16x9-w1200/A-replica-of-Iceman-Oetzi.jpg,2025-05-01T05:39:46Z,https://web.archive.org/web/20250501070426/https://www.welt.de/geschichte/article255988390/Mumien-Forschung-DO-FRUEH-So-kamen-Oetzis-Vorfahren-nach-Europa.html,"Der berühmte Mann aus dem Eis gehörte offenbar zu einer weitgehend isoliert lebenden Gemeinschaft in den Alpen. Neue Studien zeigen auch, dass er mit den Pferdehirten aus der osteuropäischen Steppe n… [+4166 chars]",,de,'Eis'
https://gentleman-blog.de/merinowolle-kleidung-fuer-sommer-und-winter/,https://gentleman-blog.de/merinowolle-kleidung-fuer-sommer-und-winter/,0,gentleman-blog.de,Merinowolle – die klügste Wahl für Sommer- und Winterbekleidung,"Wenn man an Wolle denkt, stellt man sich oft dicke Pullover, warme Decken und kalte Wintertage vor. Dieses Bild ist nachvollziehbar, trifft aber nicht immer zu. Es gibt nämlich eine Wollart, die sich nicht nur hervorragend für Winterkleidung eignet, sondern a…",https://gentleman-blog.de/wp-content/uploads/Sommer-Pullover-fuer-Herren-aus-Merinowolle.jpg,2025-05-01T07:46:45Z,,"Wenn man an Wolle denkt, stellt man sich oft dicke Pullover, warme Decken und kalte Wintertage vor. Dieses Bild ist nachvollziehbar, trifft aber nicht immer zu. Es gibt nämlich eine Wollart, die sich… [+6090 chars]",,de,'Winter'
https://www.welt.de/sport/basketball/video256045010/Video-Highlights-ALBA-BERLIN-SYNTAINICS-MBC-Basketball-Bundesliga.html,https://www.welt.de/sport/basketball/video256045010/Video-Highlights-ALBA-BERLIN-SYNTAINICS-MBC-Basketball-Bundesliga.html,0,www.welt.de,Souveräne Leistung – Alba Berlin lässt gegen Weißenfels nichts anbrennen,"Alba Berlin gibt auf der Zielgeraden der BBL-Saison nochmal richtig Gas. Das ist auch unbedingt nötig, wenn der Vizemeister die Playoffs erreichen will. Gegen den Syntainics MBC holt Alba einen überzeugenden Sieg. Die Highlights im Video.",https://img.welt.de/img/sport/basketball/mobile256045268/6077939717-ci16x9-w1200/DEU-DFL-2-FBL-Hertha-BSC-Training.jpg,2025-05-01T08:31:10Z,https://web.archive.org/web/20250502042820/https://www.welt.de/sport/basketball/video256045010/Video-Highlights-ALBA-BERLIN-SYNTAINICS-MBC-Basketball-Bundesliga.html,"Alba Berlin gibt auf der Zielgeraden der BBL-Saison nochmal richtig Gas. Das ist auch unbedingt nötig, wenn der Vizemeister die Playoffs erreichen will. Gegen den Syntainics MBC holt Alba einen überz… [+148 chars]",,de,'Gas'
https://www.zeit.de/zeit-magazin/leben/2025-04/heimwerken-do-it-yourself-haushalt-renovierung,https://www.zeit.de/zeit-magazin/leben/2025-04/heimwerken-do-it-yourself-haushalt-renovierung,0,www.zeit.de,"Heimwerken: Ich flexe, also bin ich","Während er Fliesen legt oder die Heizung repariert, hasst er es. Ist die Arbeit geschafft, blickt er stolz drauf. Die Psychologie erklärt, warum Selbermachen so guttut.",https://img.zeit.de/zeit-magazin/2025-04/heimwerken-do-it-yourself-haushalt-renovierung-bild/wide__1300x731,2025-05-01T11:52:53Z,http://archive.md/20250501120404/https://www.zeit.de/zeit-magazin/leben/2025-04/heimwerken-do-it-yourself-haushalt-renovierung,"Die Knie, die verdammten Knie! An den Knien tut Fliesenlegen noch viel mehr weh als im Rücken. Nach jeder Fliese, die ich in den Flexkleber drücke, hebe ich das linke Knie, ziehe die schon rote am dr… [+932 chars]",,de,'Heizung'
https://www.bild.de/unterhaltung/zwillinge-crashen-flughafen-sicherheit-680f5494a395cf64b5a98db3,https://www.bild.de/unterhaltung/zwillinge-crashen-flughafen-sicherheit-680f5494a395cf64b5a98db3,0,www.bild.de,Es geht um ihre Gesichter - Zwillinge crashen Flughafen-Sicherheit,"Ein Frost-Shooting endet in der Notaufnahme, Zwillinge crashen die Flughafen-Sicherheit und der emotionsloseste Heiratsantrag ever – in der BILDBoxx mit ...","https://images.bild.de/680f5494a395cf64b5a98db3/762697511d4b64ad1b3c8e3cccd3bc37,21e3463e?w=1280",2025-05-01T12:28:25Z,https://web.archive.org/web/20250501132735/https://www.bild.de/unterhaltung/zwillinge-crashen-flughafen-sicherheit-680f5494a395cf64b5a98db3,"Mehr zum Video anzeigen 
Ein Frost-Shooting endet in der Notaufnahme, Zwillinge crashen die Flughafen-Sicherheit und der emotionsloseste Heiratsantrag ever in der BILDBoxx mit Martin Gerstenberg.
Q… [+55 chars]",,de,'Frost'
https://orf.at/stories/3392115/,https://orf.at/stories/3392115/,0,orf.at,April machte Namen alle Ehre,"Von Neuschnee über Frost bis zu Sommertemperaturen und Unwettern ist alles dabei gewesen: Der launische April hat auch heuer gezeigt, was er kann. Dabei war er über weite Strecken sehr mild, er gehört zu den wärmsten fünf Prozent aller April-Monate seit Messb…",https://ibs.orf.at/news?image=https%3A%2F%2Fassets.orf.at%2Fmims%2F2025%2F18%2F30%2Fcrops%2Fw%3D1200%2Ch%3D630%2Cq%3D75%2F2608656_master_1001530_klima_wetter_april_bilanz_vik.jpg%3Fs%3Dbb402108c023a5d093a116d4e5c0dbfde4967912,2025-05-01T14:23:17Z,https://web.archive.org/web/20250501172544/https://orf.at/stories/3392115/,"Der Frühling hat sich im Zuge des Klimawandels in den letzten Jahrzehnten deutlich erwärmt, die ersten klimatologischen Sommertage mit Höchstwerten über 25 Grad werden immer früher erreicht, heuer sc… [+3740 chars]",,de,'Frost'
https://www.morgenpost.de/berlin/article408915102/waerme-adC3A9-berlin-erwarten-gewitter-sturmboeen-und-wieder-kaelte.html,https://www.morgenpost.de/berlin/article408915102/waerme-adC3A9-berlin-erwarten-gewitter-sturmboeen-und-wieder-kaelte.html,0,www.morgenpost.de,"Wärme adé: Berlin erwarten Gewitter, Sturmböen und wieder Kälte",Die T-Shirts können wieder in den Schrank gepackt werden. Am Abend soll es gewittern. Danach wird es in Berlin deutlich kälter.,https://img.sparknews.funkemedien.de/408913912/408913912_1746166140_v16_9_1600.jpeg,2025-05-02T06:08:53Z,http://archive.md/20250502122709/https://www.morgenpost.de/berlin/article408915102/waerme-adC3A9-berlin-erwarten-gewitter-sturmboeen-und-wieder-kaelte.html,"Berlin. Die T-Shirts können wieder in den Schrank gepackt werden. Am Abend soll es gewittern. Danach wird es in Berlin deutlich kälter.
En paar Tage konnten die Berlinerinnen und Berliner sonnige un… [+3252 chars]",,de,'Kälte'
https://www.bild.de/news/wetter/nach-prost-kommt-frost-temperaturen-in-deutschland-rauschen-runter-681344b0d9d64b6077035a05,https://www.bild.de/news/wetter/nach-prost-kommt-frost-temperaturen-in-deutschland-rauschen-runter-681344b0d9d64b6077035a05,0,www.bild.de,Temperaturen rauschen runter - Nach Prost kommt Frost!,Jetzt ändert sich das Wetter schnell: Eben noch 30 Grad und Sonnenschein. Dann rauschen die Temperaturen in den Bibber-Keller.,"https://images.bild.de/681344b0d9d64b6077035a05/963bbc642effa5383343837d82201d9c,1f4b133d?w=1280",2025-05-02T06:50:18Z,http://archive.md/20250502104231/https://www.bild.de/news/wetter/nach-prost-kommt-frost-temperaturen-in-deutschland-rauschen-runter-681344b0d9d64b6077035a05,"Jetzt gehts ganz schnell bergab! Am 1. Mai haben wir uns noch über sommerliche Temperaturen (bis zu 30 Grad) und Sonnenschein gefreut  Hoch Quendolin sei Dank! Doch schon ab heute, einen Tag später, … [+1891 chars]",,de,'Frost'
https://www.tagesschau.de/wirtschaft/verbraucher/gasspeicher-erdgas-energiebranche-100.html,https://www.tagesschau.de/wirtschaft/verbraucher/gasspeicher-erdgas-energiebranche-100.html,0,www.tagesschau.de,"Erdgas: Teures Gas, leere Speicher","Die Gasspeicher sind so leer wie selten. Staatliche Auflagen schreiben vor, dass die Speicher im Sommer wieder befüllt werden. Doch ausgerechnet dann ist Erdgas inzwischen besonders teuer. Von Ingo Nathusius.",https://images.tagesschau.de/image/02090288-7cb9-4290-a09a-9527fec758c6/AAABld-Y7YQ/AAABkZLhkrw/16x9-1280/gas-172.jpg,2025-05-02T07:13:45Z,http://archive.md/20250502122925/https://www.tagesschau.de/wirtschaft/verbraucher/gasspeicher-erdgas-energiebranche-100.html,"Stand: 02.05.2025 09:13 Uhr
Die Gasspeicher sind so leer wie selten. Staatliche Auflagen schreiben vor, dass die Speicher im Sommer wieder befüllt werden. Doch ausgerechnet dann ist Erdgas inzwische… [+5058 chars]",,de,'Gas'
https://www.sueddeutsche.de/bayern/bayern-wetter-kaelte-mai-eisheilige-wetterphaenomen-vorhersage-li.3245805,https://www.sueddeutsche.de/bayern/bayern-wetter-kaelte-mai-eisheilige-wetterphaenomen-vorhersage-li.3245805,0,www.sueddeutsche.de,Wetter im Mai: Warum sich die Eisheiligen nicht immer an ein genaues Datum halten,"Mitte Mai sind Landwirte und Hobbygärtner gleichermaßen in Sorge: In diesen Tagen treten häufig Nachtfröste auf, die Pflanzen zerstören können. Doch nicht immer sind sie pünktlich, zeigen Daten von Meteorologen.",https://www.sueddeutsche.de/2022/06/20/32744a67-f361-4d4c-931e-918d4bd1a853.jpeg?q=60&fm=webp&width=1200&rect=0%2C94%2C1266%2C712,2025-05-02T13:38:12Z,http://archive.md/20250504044835/https://www.sueddeutsche.de/bayern/bayern-wetter-kaelte-mai-eisheilige-wetterphaenomen-vorhersage-li.3245805,"Pankratius, Servatius, Bonifatius und die kalte Sophie: Sie sind ausgemachte Feinde jedes bayerischen Weinbauern, Landwirts, Obstzüchters und vieler Hobbygärtner. Auf den 11. bis 15. Mai fallen die N… [+3653 chars]",,de,'Frost'
https://www.zeit.de/news/2025-05/03/gastrobranche-sieht-trend-zum-essen-und-trinken-im-freien,https://www.zeit.de/news/2025-05/03/gastrobranche-sieht-trend-zum-essen-und-trinken-im-freien,0,www.zeit.de,Von Restaurant bis Kneipe: Gastrobranche sieht Trend zum Essen und Trinken im Freien,Hier finden Sie Informationen zu dem Thema „Von Restaurant bis Kneipe“. Lesen Sie jetzt „Gastrobranche sieht Trend zum Essen und Trinken im Freien“.,https://img.zeit.de/news/2025-05/03/gastrobranche-sieht-trend-zum-essen-und-trinken-im-freien-image-group/wide__1300x731,2025-05-03T02:00:48Z,,Die Gastronomiebranche in Rheinland-Pfalz sieht einen klaren Trend zum Essen und Trinken im Freien und formuliert zum Start in die Außensaison Wünsche an Kommunen. «Seit der Pandemie suchen die Leute… [+2338 chars],,de,'Gas'
https://www.stern.de/wirtschaft/missgeschick-verraet--das-verdienen-influencer-im-monat-wirklich--video--35690246.html,https://www.stern.de/wirtschaft/missgeschick-verraet--das-verdienen-influencer-im-monat-wirklich--video--35690246.html,0,www.stern.de,"Pamela Reif, iCrimax und Co.: Missgeschick zeigt Einnahmen – das verdienen Influencer im Monat","Ein US-Gamer macht aus Versehen öffentlich, was er monatlich verdient. Ein Blick auf Pamela Reif, iCrimax & Co zeigt, ob deutsche Influencer da mithalten können.",https://image.stern.de/35690288/t/yZ/v1/w1440/r1.7778/-/gamer.jpg,2025-05-03T09:22:00Z,,"Zugang zu stern+statt 11,96 
 nur 1",,de,'Reif'
https://www.telepolis.de/features/Klimawandel-laesst-Wasserspeicher-der-Alpen-verdunsten-10369827.html,https://www.telepolis.de/features/Klimawandel-laesst-Wasserspeicher-der-Alpen-verdunsten-10369827.html,0,www.telepolis.de,Klimawandel lässt Wasserspeicher der Alpen verdunsten,Die Alpen verlieren ihre Rolle als Europas Wasserspeicher. Immer weniger Schnee bleibt im Winter liegen. Wird das Alpenvorland zur Steppe?,https://heise.cloudimg.io/bound/1200x1200/q85.png-lossy-85.webp-lossy-85.foil1/_www-heise-de_/imgs/18/4/8/4/6/7/9/9/Scheefall-223b1dabd207bd6c.jpeg,2025-05-03T10:00:00Z,https://web.archive.org/web/20250503104934/https://www.telepolis.de/features/Klimawandel-laesst-Wasserspeicher-der-Alpen-verdunsten-10369827.html,"Die Alpen verlieren ihre Rolle als Europas Wasserspeicher. Immer weniger Schnee bleibt im Winter liegen. Wird das Alpenvorland zur Steppe?
Der Klimawandel sorgt für beachtliche Entwicklungen im mitt… [+5443 chars]",,de,'Winter'
https://www.zeit.de/news/2025-05/03/600-menschen-demonstrieren-gegen-gasbohrung-in-reichling,https://www.zeit.de/news/2025-05/03/600-menschen-demonstrieren-gegen-gasbohrung-in-reichling,0,www.zeit.de,Gasbohrungen: 600 Menschen demonstrieren gegen Gasbohrung in Reichling,Hier finden Sie Informationen zu dem Thema „Gasbohrungen“. Lesen Sie jetzt „600 Menschen demonstrieren gegen Gasbohrung in Reichling“.,https://img.zeit.de/news/2025-05/03/600-menschen-demonstrieren-gegen-gasbohrung-in-reichling-image-group/wide__1300x731,2025-05-03T13:43:30Z,https://web.archive.org/web/20250504025813/https://www.zeit.de/news/2025-05/03/600-menschen-demonstrieren-gegen-gasbohrung-in-reichling,Etwa 600 Menschen haben in Reichling im Landkreis Landsberg am Lech lautstark gegen den Start von Gasbohrungen in ihrer Ortschaft demonstriert. Die Kritiker halten Bohrungen nach fossilem Gas in Zeit… [+1500 chars],,de,'Gas'
https://www.sueddeutsche.de/bayern/bayern-wetter-wetterumschwung-gewitter-sturmboeen-starkregen-eisheilige-li.3246349,https://www.sueddeutsche.de/bayern/bayern-wetter-wetterumschwung-gewitter-sturmboeen-starkregen-eisheilige-li.3246349,0,www.sueddeutsche.de,Unwetterwarnung: Wetterumschwung mit starken Gewittern und Sturmböen,Besonders rund um Ingolstadt und Regensburg sollen es laut Deutschem Wetterdienst starke Gewitter mit heftigem Niederschlag und Hagel geben. In den Alpen wird vor Sturmböen gewarnt. Auch Frost ist wieder möglich.,https://www.sueddeutsche.de/2024/07/12/83891434-d8f0-4ae3-9243-918ba4493ee9.jpeg?q=60&fm=webp&width=1200&rect=0%2C156%2C3000%2C1687,2025-05-03T16:02:00Z,https://web.archive.org/web/20250503165115/https://www.sueddeutsche.de/bayern/bayern-wetter-wetterumschwung-gewitter-sturmboeen-starkregen-eisheilige-li.3246349,"Am Samstagnachmittag gab der DWD eine Unwetterwarnung der Stufe 2 heraus, das ist eine Warnung vor markantem Wetter. In den Landkreisen rund um Ingolstadt und Regensburg, von Donau-Ries bis Straubing… [+1056 chars]",,de,'Frost'
https://www.sueddeutsche.de/bayern/bayern-wetter-wetterumschwung-gewitter-sturmboeen-starkregen-eisheilige-unterfranken-li.3246349,https://www.sueddeutsche.de/bayern/bayern-wetter-wetterumschwung-gewitter-sturmboeen-starkregen-eisheilige-unterfranken-li.3246349,0,www.sueddeutsche.de,Unwetterwarnung: Wetterumschwung mit starken Gewittern und Sturmböen,Besonders in Unterfranken soll es laut Deutschem Wetterdienst starke Gewitter mit heftigem Starkregen und Hagel geben. In den Alpen wird vor Sturmböen gewarnt. Auch Frost ist wieder möglich.,https://www.sueddeutsche.de/2024/07/12/83891434-d8f0-4ae3-9243-918ba4493ee9.jpeg?q=60&fm=webp&width=1200&rect=0%2C162%2C3000%2C1687,2025-05-03T16:02:00Z,https://web.archive.org/web/20250503183424/https://www.sueddeutsche.de/bayern/bayern-wetter-wetterumschwung-gewitter-sturmboeen-starkregen-eisheilige-unterfranken-li.3246349,"Am Abend gab der DWD eine amtliche Unwetterwarnung für Teile Unterfrankens heraus. In manchen Landkreisen seien schwere Gewitter (Stufe 3 von 4) möglich, die eine Gefahr für Leib und Leben seien könn… [+1326 chars]",,de,'Frost'
https://www.welt.de/sport/fussball/article256061008/Bundesliga-live-Reif-fuer-die-Champions-League-BVB-ueberrennt-Wolfsburg.html,https://www.welt.de/sport/fussball/article256061008/Bundesliga-live-Reif-fuer-die-Champions-League-BVB-ueberrennt-Wolfsburg.html,0,www.welt.de,Reif für die Champions League – BVB überrennt Wolfsburg,Borussia Dortmund kann eine verkorkste Saison noch halbwegs retten. Nach guten Wochen ist für den BVB noch die Qualifikation für die Champions League drin. Dafür sollte ein Sieg gegen den VfL Wolfsburg her. Verfolgen Sie das Spiel hier im Liveticker.,https://img.welt.de/img/sport/fussball/mobile256061652/4757939347-ci16x9-w1200/Borussia-Dortmund-VfL-Wolfsburg.jpg,2025-05-03T18:30:00Z,,"Borussia Dortmund ist kurz davor, eine verkorkste Saison noch zu retten. Gegen den VfL Wolfsburg gelingt der nächste Sieg und der Sprung auf Platz vier der Tabelle. Das Team von Trainer Kovac gewinnt… [+2644 chars]",,de,'Reif'
https://tirol.orf.at/stories/3303461/,https://tirol.orf.at/stories/3303461/,0,tirol.orf.at,Zugriffsrekord beim Euregio-Lawinenreport,"Trotz des schneearmen Winters sind beim Euregio-Lawinenreport Zugriffsrekorde verzeichnet worden. In der abgelaufenen Wintersaison wurde er 5,7 Millionen-mal aufgerufen. Mit Ende April wurde der Report eingestellt.  Der Winter war von wenig Schnee und mildem …",https://ibs.orf.at/tir?image=https%3A%2F%2Foekastatic.orf.at%2Fmims%2F2025%2F18%2F11%2Fcrops%2Fw%3D1200%2Ch%3D627%2Cq%3D75%2F2608336_master_1001411_20250430_lawinenreport__1_.jpg%3Fs%3Dd020c0bb0bdb1172dd7a69d82e52171c25cd782c,2025-05-04T03:56:54Z,https://web.archive.org/web/20250504065532/https://tirol.orf.at/stories/3303461/,Seit 7. Dezember informierten insgesamt 144 Lawinenreporte über die aktuelle Lawinensituation in der Euregio Tirol-Südtirol-Trentino. Um zehn Prozent wurde www.lawinen.report häufiger aufgerufen als … [+1521 chars],,de,'Schnee'
https://www.googlewatchblog.de/2025/05/gemini-startschuss-fuer-android-auto-wearos-google-tv-smart-displays-und-smart-glasses-in-kuerze-u/,https://www.googlewatchblog.de/2025/05/gemini-startschuss-fuer-android-auto-wearos-google-tv-smart-displays-und-smart-glasses-in-kuerze-u/,0,www.googlewatchblog.de,"Gemini: Startschuss für Android Auto, WearOS, Google TV, Smart Displays und Smart Glasses kommt sehr bald","Google gibt rund um die KI-Plattform Gemini seit weit über einem Jahr richtig Gas und liefert Woche für Woche immer neue Funktionen, tiefere Integrationen und sonstige Verbesserungen. Vermutlich schon im nächsten Monat wird es den nächsten großen Schritt gebe…",https://www.googlewatchblog.de/wp-content/uploads/gemini-logo-1.jpg,2025-05-04T06:30:52Z,,"Google gibt rund um die KI-Plattform Gemini seit weit über einem Jahr richtig Gas und liefert Woche für Woche immer neue Funktionen, tiefere Integrationen und sonstige Verbesserungen. Vermutlich scho… [+4480 chars]",,de,'Gas'
https://www.n-tv.de/panorama/Die-Eisheiligen-sind-in-diesem-Jahr-frueh-dran-article25744284.html,https://www.n-tv.de/panorama/Die-Eisheiligen-sind-in-diesem-Jahr-frueh-dran-article25744284.html,0,www.n-tv.de,Die Wetterwoche im Schnellcheck: Die Eisheiligen sind in diesem Jahr früh dran,"Nach der Hitze kommt die typische Mai-Abkühlung: Auf die Eisheiligen ist auch in diesem Jahr Verlass, allerdings sind sie etwas früher dran als üblich. In einigen Teilen Deutschlands bedeutet das: Nachtfrost. Im Verlauf der Woche dürfte es aber vor allem im F…",https://www.n-tv.de/img/incoming/crop25744301/1561324746-cImg_16_9-w1200/bf4c6c32f1fbabceec91d018eee839f7.jpg,2025-05-04T11:41:10Z,https://web.archive.org/web/20250504142218/https://www.n-tv.de/panorama/Die-Eisheiligen-sind-in-diesem-Jahr-frueh-dran-article25744284.html,"Nach der Hitze kommt die typische Mai-Abkühlung: Auf die Eisheiligen ist auch in diesem Jahr Verlass, allerdings sind sie etwas früher dran als üblich. In einigen Teilen Deutschlands bedeutet das: Na… [+4546 chars]",,de,'Frost'
https://www.zeit.de/news/2025-05/04/eishockey-wm-generalprobe-geht-daneben-2-5-gegen-usa,https://www.zeit.de/news/2025-05/04/eishockey-wm-generalprobe-geht-daneben-2-5-gegen-usa,0,www.zeit.de,Eishockey: Eishockey-Team reist mit Niederlage im Gepäck zur WM,Hier finden Sie Informationen zu dem Thema „Eishockey“. Lesen Sie jetzt „Eishockey-Team reist mit Niederlage im Gepäck zur WM“.,https://img.zeit.de/news/2025-05/04/eishockey-wm-generalprobe-geht-daneben-2-5-gegen-usa-image-group/wide__1300x731,2025-05-04T17:23:50Z,https://web.archive.org/web/20250505032006/https://www.zeit.de/news/2025-05/04/eishockey-wm-generalprobe-geht-daneben-2-5-gegen-usa,Trotz des Personal-Updates aus der NHL und von Meister Eisbären Berlin sind Deutschlands Eishockey-Cracks noch nicht in WM-Form. Sechs Tage vor dem ersten WM-Spiel gegen Ungarn verlor die Auswahl des… [+3233 chars],,de,'Eis'
https://www.stern.de/gesellschaft/regional/hamburg-schleswig-holstein/wetter-im-norden--meist-trockener-wochenstart-erwartet---nachts-frost-moeglich-35693408.html,https://www.stern.de/gesellschaft/regional/hamburg-schleswig-holstein/wetter-im-norden--meist-trockener-wochenstart-erwartet---nachts-frost-moeglich-35693408.html,0,www.stern.de,Wetter im Norden: Meist trockener Wochenstart erwartet - nachts Frost möglich,"Den Norden erwartet kühles, aber trockenes Wetter in der neuen Woche. In Schleswig-Holstein können die Temperaturen in der Nacht zu Dienstag stellenweise unter den Gefrierpunkt sinken.",https://image.stern.de/35693410/t/T9/v1/w1440/r1.7778/-/05--gtlprrfuvfv5axs2048jpeg---5aff105dd9e18d0b.jpg,2025-05-05T04:55:08Z,https://web.archive.org/web/20250505232432/https://www.stern.de/gesellschaft/regional/hamburg-schleswig-holstein/wetter-im-norden--meist-trockener-wochenstart-erwartet---nachts-frost-moeglich-35693408.html,"Kopiere den aktuellen Link
Zur Merkliste hinzufügen
Den Norden erwartet kühles, aber trockenes Wetter in der neuen Woche. In Schleswig-Holstein können die Temperaturen in der Nacht zu Dienstag stel… [+723 chars]",,de,'Frost'
https://www.zeit.de/news/2025-05/05/meist-trockener-wochenstart-erwartet-nachts-frost-moeglich,https://www.zeit.de/news/2025-05/05/meist-trockener-wochenstart-erwartet-nachts-frost-moeglich,0,www.zeit.de,Wetter im Norden: Meist trockener Wochenstart erwartet - nachts Frost möglich,Hier finden Sie Informationen zu dem Thema „Wetter im Norden“. Lesen Sie jetzt „Meist trockener Wochenstart erwartet - nachts Frost möglich“.,https://img.zeit.de/news/2025-05/05/meist-trockener-wochenstart-erwartet-nachts-frost-moeglich-image-group/wide__1300x731,2025-05-05T04:55:08Z,https://web.archive.org/web/20250506030750/https://www.zeit.de/news/2025-05/05/meist-trockener-wochenstart-erwartet-nachts-frost-moeglich,"Im Norden startet die neue Woche mit trockenem und kühlem Wetter. Dabei gebe es am Montag Höchstwerte von 12 bis 15 Grad, meldet der Deutsche Wetterdienst (DWD). Im südlichen Schleswig-Holstein kann … [+523 chars]",,de,'Frost'
"https://www.gamestar.de/artikel/dreame-1a-pro-im-test,3432162.html","https://www.gamestar.de/artikel/dreame-1a-pro-im-test,3432162.html",0,www.gamestar.de,Test: Dreame A1 Pro - Mähroboter im Test: Lohnt sich das Upgrade mit Offroad-Reifen & Dual-Map wirklich?,"Bessere Reifen, Navigation und Kartenverwaltung: Ich habe den neuen Dreame A1 Pro-Mähroboter getestet: Lohnt sich das Upgrade gegenüber dem Vorgänger?",https://images.cgames.de/images/gamestar/293/dreame-a1-pro-mirco_6351220.jpg,2025-05-05T06:49:00Z,"https://web.archive.org/web/20250505154453/https://www.gamestar.de/artikel/dreame-1a-pro-im-test,3432162.html","Der Dreame A1 Pro im Test: Mähroboter mit sinnvollen Upgrades.
Dreame brachte letztes Jahr mit dem A1 seinen ersten Mähroboter an den Start, der uns dank der einfachen Einrichtung und des ausgezeich… [+7940 chars]",,de,'Reif'
https://www.stern.de/gesellschaft/regional/bayern/wetter--wolken--regen-und-schneefall-zu-wochenbeginn-in-bayern-35693556.html,https://www.stern.de/gesellschaft/regional/bayern/wetter--wolken--regen-und-schneefall-zu-wochenbeginn-in-bayern-35693556.html,0,www.stern.de,"Wetter: Wolken, Regen und Schneefall zu Wochenbeginn in Bayern","München (lby) - Die Menschen in Bayern sollten diese Woche wieder einen Regenschirm bereithalten. Vor allem der Süden sei von Niederschlägen betroffen,",https://image.stern.de/35693558/t/2A/v1/w1440/r1.7778/-/05--5pnora5w7tv9axs2048jpeg---aa151a3195ec283c.jpg,2025-05-05T06:58:50Z,,"Kopiere den aktuellen Link
Zur Merkliste hinzufügen
Bayern dürfte erneut eine Woche mit Wolken und Regen bevorstehen. Aber auch Lichtblicke soll es laut des Deutschen Wetterdienstes geben.
Die Men… [+1359 chars]",,de,'Frost'
https://www.zeit.de/news/2025-05/05/wolken-regen-und-schneefall-zu-wochenbeginn-in-bayern,https://www.zeit.de/news/2025-05/05/wolken-regen-und-schneefall-zu-wochenbeginn-in-bayern,0,www.zeit.de,"Wetter: Wolken, Regen und Schneefall zu Wochenbeginn in Bayern","Hier finden Sie Informationen zu dem Thema „Wetter“. Lesen Sie jetzt „Wolken, Regen und Schneefall zu Wochenbeginn in Bayern“.",https://img.zeit.de/news/2025-05/05/wolken-regen-und-schneefall-zu-wochenbeginn-in-bayern-image-group/wide__1300x731,2025-05-05T06:58:50Z,,"Die Menschen in Bayern sollten diese Woche wieder einen Regenschirm bereithalten. Vor allem der Süden sei von Niederschlägen betroffen, teilte der Deutsche Wetterdienst (DWD) mit.
Heute müsse in Süd… [+1207 chars]",,de,'Frost'
