index,url,valid,domain,title,description,image,published,archive,content,quote,language,keyword
https://www.zeit.de/news/2026-02/03/solange-der-vorrat-reicht-kostenloser-splitt-fuer-potsdamer,https://www.zeit.de/news/2026-02/03/solange-der-vorrat-reicht-kostenloser-splitt-fuer-potsdamer,0,www.zeit.de,Eisglatte Gehwege: Solange der Vorrat reicht: Kostenloser Splitt für Potsdamer,Hier finden Sie Informationen zu dem Thema „Eisglatte Gehwege“. Lesen Sie jetzt „Solange der Vorrat reicht: Kostenloser Splitt für Potsdamer“.,https://img.zeit.de/news/2026-02/03/solange-der-vorrat-reicht-kostenloser-splitt-fuer-potsdamer-image-group/wide__1300x731,2026-02-03T04:00:18Z,,Kostenloses Streugut gegen vereiste Gehwege: Ab heute können Privathaushalte in Potsdam bis zu 20 Liter Splitt bei Wertstoffhöfen abholen. Die Ausgabe ist täglich bis 20.00 Uhr möglich - solange der … [+461 chars],,de,'Frost'
https://www.zeit.de/news/2026-02/03/frost-und-neuschnee-in-berlin-und-brandenburg,https://www.zeit.de/news/2026-02/03/frost-und-neuschnee-in-berlin-und-brandenburg,0,www.zeit.de,Wetter: Frost und Neuschnee in Berlin und Brandenburg,Hier finden Sie Informationen zu dem Thema „Wetter“. Lesen Sie jetzt „Frost und Neuschnee in Berlin und Brandenburg“.,https://img.zeit.de/news/2026-02/03/frost-und-neuschnee-in-berlin-und-brandenburg-image-group/wide__1300x731,2026-02-03T05:35:13Z,,"Frost und Schnee: Das Wetter in Berlin und Brandenburg bleibt weiter eisig. Zum Mittwoch und Donnerstag klettern die Höchsttemperaturen jedoch wieder über null Grad, wie der Deutsche Wetterdienst (DW… [+868 chars]",,de,'Frost'
https://www.zeit.de/news/2026-02/03/glatte-strassen-moeglich-neuer-schnee-zieht-heran,https://www.zeit.de/news/2026-02/03/glatte-strassen-moeglich-neuer-schnee-zieht-heran,0,www.zeit.de,Wetter-Vorhersage: Glatte Straßen möglich - neuer Schnee zieht heran,Hier finden Sie Informationen zu dem Thema „Wetter-Vorhersage“. Lesen Sie jetzt „Glatte Straßen möglich - neuer Schnee zieht heran“.,https://img.zeit.de/news/2026-02/03/glatte-strassen-moeglich-neuer-schnee-zieht-heran-image-group/wide__1300x731,2026-02-03T06:04:54Z,,"Verkehrsteilnehmer müssen heute Morgen mit Glätte auf Straßen und Wegen rechnen. Dies trete örtlich durch überfrierende Nässe, vereinzelt auch durch Reif auf, teilt der Deutsche Wetterdienst (DWD) in… [+1147 chars]",,de,'Nässe'
https://www.zeit.de/news/2026-02/03/glaette-frost-und-schnee-in-nordrhein-westfalen-moeglich,https://www.zeit.de/news/2026-02/03/glaette-frost-und-schnee-in-nordrhein-westfalen-moeglich,0,www.zeit.de,"DWD-Vorhersage: Glätte, Frost und Schnee in Nordrhein-Westfalen möglich","Hier finden Sie Informationen zu dem Thema „DWD-Vorhersage“. Lesen Sie jetzt „Glätte, Frost und Schnee in Nordrhein-Westfalen möglich“.",https://img.zeit.de/news/2026-02/03/glaette-frost-und-schnee-in-nordrhein-westfalen-moeglich-image-group/wide__1300x731,2026-02-03T07:14:30Z,,"In Nordrhein-Westfalen sorgen niedrige Temperaturen und Niederschlag für glatte Straßen. Wie der Deutsche Wetterdienst (DWD) mitteilte, liegen die Temperaturen am Morgen bei null bis minus sieben Gra… [+577 chars]",,de,'Frost'
https://www.zeit.de/news/2026-02/03/naturschuetzer-streusalz-im-winter-schaedigt-baeume-im-sommer,https://www.zeit.de/news/2026-02/03/naturschuetzer-streusalz-im-winter-schaedigt-baeume-im-sommer,0,www.zeit.de,Naturschutz: Naturschützer: Streusalz im Winter schädigt Bäume im Sommer,Hier finden Sie Informationen zu dem Thema „Naturschutz“. Lesen Sie jetzt „Naturschützer: Streusalz im Winter schädigt Bäume im Sommer“.,https://img.zeit.de/news/2026-02/03/naturschuetzer-streusalz-im-winter-schaedigt-baeume-im-sommer-image-group/wide__1300x731,2026-02-03T10:30:19Z,,"Der hohe Einsatz von Streusalz hat nach Ansicht von Naturschützern fatale Folgen für Bäume, Böden und Gewässer in Sachsen. In Kombination mit Trockenstress schwächt Streusalz Stadtbäume dauerhaft und… [+747 chars]",,de,'Winter'
https://www.telepolis.de/article/Heizungsgesetz-Warum-die-Koalition-seit-Monaten-auf-der-Stelle-tritt-11163445.html,https://www.telepolis.de/article/Heizungsgesetz-Warum-die-Koalition-seit-Monaten-auf-der-Stelle-tritt-11163445.html,0,www.telepolis.de,Heizungsgesetz: Warum die Koalition seit Monaten auf der Stelle tritt,Die Koalition sollte bis Ende Januar Eckpunkte für ein neues Heizungsgesetz vorlegen. Doch eine Einigung ist nicht in Sicht. Die Gründe sind vielschichtig.,https://heise.cloudimg.io/bound/1200x1200/q85.png-lossy-85.webp-lossy-85.foil1/_www-heise-de_/imgs/18/5/0/2/1/1/2/4/shutterstock_2725083747-86f1013d7e91719d.jpg,2026-02-03T10:31:00Z,,"Eine Einigung beim Heizungsgesetz ist noch nicht in Sicht
(Bild: holgers.pictures/Shutterstock.com)
Die Koalition sollte bis Ende Januar Eckpunkte für ein neues Heizungsgesetz vorlegen. Doch eine E… [+8350 chars]",,de,'Heizung'
https://www.tagesspiegel.de/alles-lebensgefahrlich--ausser-autofahren-glatte-sturze-stillstand--und-der-arger-wachst-weiter-15209412.html,https://www.tagesspiegel.de/alles-lebensgefahrlich--ausser-autofahren-glatte-sturze-stillstand--und-der-arger-wachst-weiter-15209412.html,0,www.tagesspiegel.de,"„Alles lebensgefährlich – außer Autofahren“: Glätte, Stürze, Stillstand – und der Ärger wächst weiter","Die Geduld unserer Community ist erschöpft. Spiegelglatte Gehwege, Streit ums Streusalz, Frust über Behörden: Der Winter legt schonungslos die Schwächen der Berliner Verwaltung offen.",https://www.tagesspiegel.de/images/357550/alternates/BASE_16_9_W1400/1642004271000/86988715.jpeg,2026-02-03T11:36:28Z,,"Nutzer Freelancede ist sauer: Ich laufe seit Tagen nur noch auf der Straße Gehsteigbenutzung unmöglich. Was wie eine Übertreibung klingt, ist für viele Berlinerinnen und Berliner bittere Realität. Hi… [+7873 chars]",,de,'Schnee'
https://www.sueddeutsche.de/medien/bastian-pastewka-fabian-und-die-moerderische-hochzeit-interview-krimi-li.3355639,https://www.sueddeutsche.de/medien/bastian-pastewka-fabian-und-die-moerderische-hochzeit-interview-krimi-li.3355639,0,www.sueddeutsche.de,Streaming: „Der Krimi hat sich in die Unterhaltungs-DNA dieser Republik eingebacken“,"Im Film „Fabian und die mörderische Hochzeit“ schlüpft Bastian Pastewka in die Rolle eines Trickbetrügers, der sich als Ermittler tarnt. Ein Gespräch über Fischmehl als Schnee-Ersatz, Edgar-Wallace-Filme - und die Krimi-Nation Deutschland.",https://www.sueddeutsche.de/2026/02/02/69b33b7e-8100-4d3d-ab62-e3e60e7a0025.jpg?q=60&fm=webp&width=1200&rect=82%2C63%2C826%2C464,2026-02-03T12:22:54Z,,"Bastian Pastewka ist Profi. Als der Ton des Videotelefonats nicht funktioniert, lässt er sich die Nummer der SZ geben und greift zum Handy. Klar, das hier ist nicht sein erstes Interview, doch die Ru… [+573 chars]",,de,'Schnee'
https://www.stern.de/politik/ausland/ukraine-krieg--neue-russische-angriffe--frieren-in-der-ukraine-geht-weiter-37100174.html,https://www.stern.de/politik/ausland/ukraine-krieg--neue-russische-angriffe--frieren-in-der-ukraine-geht-weiter-37100174.html,0,www.stern.de,Ukraine-Krieg: Neue russische Angriffe: Frieren in der Ukraine geht weiter,Moskau bestätigte eine von US-Präsident Trump angestoßene begrenzte Waffenruhe – bis Sonntag. Das ist nun augenscheinlich vorbei. Hunderttausende Menschen kämpfen mit Strom- und Heizungsausfällen.,https://image.stern.de/37102304/t/2f/v1/w1440/r1.7778/-/03--6k7ry6cqvvv3axs2048jpeg---33802efea640d4ac.jpg,2026-02-03T12:53:54Z,,"Kopiere den aktuellen Link
Zur Merkliste hinzufügen
Moskau bestätigte eine von US-Präsident Trump angestoßene begrenzte Waffenruhe bis Sonntag. Das ist nun augenscheinlich vorbei. Hunderttausende M… [+5085 chars]",,de,'Heizung'
https://www.stern.de/gesellschaft/regional/hamburg-schleswig-holstein/wetterbedingte-absage--termin-gefunden--towers-gegen-trier-am-22--maerz-37102340.html,https://www.stern.de/gesellschaft/regional/hamburg-schleswig-holstein/wetterbedingte-absage--termin-gefunden--towers-gegen-trier-am-22--maerz-37102340.html,0,www.stern.de,Wetterbedingte Absage: Termin gefunden: Towers gegen Trier am 22. März,Schnee und Eis haben Anfang Januar den Norden Deutschlands beherrscht. Ein Spiel der Basketball-Bundesliga ist ausgefallen. Ende März wird es nachgeholt.,https://image.stern.de/37102342/t/3A/v1/w1440/r1.7778/-/03--lcngf32f7tv6axs2048jpeg---d33bab7b8ba574f7.jpg,2026-02-03T12:59:45Z,,"Kopiere den aktuellen Link
Zur Merkliste hinzufügen
Schnee und Eis haben Anfang Januar den Norden Deutschlands beherrscht. Ein Spiel der Basketball-Bundesliga ist ausgefallen. Ende März wird es nac… [+452 chars]",,de,'Schnee'
https://www.stern.de/gesellschaft/regional/berlin-brandenburg/hauptstadt--berlin-im-krisenmodus--erst-kein-strom-und-dann-noch-winter-37102380.html,https://www.stern.de/gesellschaft/regional/berlin-brandenburg/hauptstadt--berlin-im-krisenmodus--erst-kein-strom-und-dann-noch-winter-37102380.html,0,www.stern.de,Hauptstadt: Berlin im Krisenmodus: Erst kein Strom und dann noch Winter,"Berlin will Olympische Spiele ausrichten, scheitert aber schon an glatten Gehwegen. Womit die Hauptstadt zu kämpfen hat - und was leere Straßenbahnen damit zu tun haben.",https://image.stern.de/37102382/t/qn/v1/w1440/r1.7778/-/03--uylxtwuy6iv7axs2048jpeg---95c8de465c580db9.jpg,2026-02-03T13:12:49Z,,"Kopiere den aktuellen Link
Zur Merkliste hinzufügen
Berlin will Olympische Spiele ausrichten, scheitert aber schon an glatten Gehwegen. Womit die Hauptstadt zu kämpfen hat - und was leere Straßenba… [+5179 chars]",,de,'Winter'
https://www.zeit.de/news/2026-02/03/berlin-im-krisenmodus-erst-kein-strom-und-dann-noch-winter,https://www.zeit.de/news/2026-02/03/berlin-im-krisenmodus-erst-kein-strom-und-dann-noch-winter,0,www.zeit.de,Hauptstadt: Berlin im Krisenmodus: Erst kein Strom und dann noch Winter,Hier finden Sie Informationen zu dem Thema „Hauptstadt“. Lesen Sie jetzt „Berlin im Krisenmodus: Erst kein Strom und dann noch Winter“.,https://img.zeit.de/news/2026-02/03/berlin-im-krisenmodus-erst-kein-strom-und-dann-noch-winter-image-group/wide__1300x731,2026-02-03T13:12:49Z,,"Das neue Jahr hat den Menschen in Berlin schon viel abverlangt. Kaum war der alljährliche Böllerwahnsinn zu Silvester abgeklungen, fiel der Strom aus: Nach einem wohl von Linksextremisten begangenen … [+4992 chars]",,de,'Winter'
https://www.focus.de/panorama/wetter-in-deutschland-ueber-zehn-grad-am-rhein-eiseskaelte-im-nordosten-wo-jetzt-glatteis-droht_a264a293-d982-4ee2-af61-04f58e582bf0.html,https://www.focus.de/panorama/wetter-in-deutschland-ueber-zehn-grad-am-rhein-eiseskaelte-im-nordosten-wo-jetzt-glatteis-droht_a264a293-d982-4ee2-af61-04f58e582bf0.html,0,www.focus.de,Wetter in Deutschland: DWD warnt örtlich vor markanter Glätte – im Norden und Osten droht strenger Frost,"Im Nordosten herrscht Dauerfrost, im Südwesten bleibt es mild – das Wetter zeigt sich weiter gegensätzlich. In Hessen und Rheinland-Pfalz warnt der DWD vor starkem Schneefall. Alle Wetter-Infos im Ticker.",https://quadro.burda-forward.de/ctf/de67e552-99ee-46fd-9304-5d5ba2672c3b.0429c438-6c3e-48b0-bfd4-223d8388369b.jpeg?im=RegionOfInterestCrop%3D%281200%2C630%29%2CregionOfInterest%3D%28813%2C531%29&hash=6b54a284dc5fcd490feb52dc79ca543e8a386ffa501209242247d0001112f182,2026-02-03T13:16:00Z,,"Dieser Wochenstart hat alles zu bieten: Es wird über Deutschland verteilt frostig, stürmisch, bewölkt, stellenweise auch sonnig und mit teils zweistelligen Plusgraden vergleichsweise warm. 
Zur Hera… [+1963 chars]",,de,'Schnee'
https://www.welt.de/sport/olympia/article69812e59f0e62064809e2a58/olympia-2026-baustellen-in-cortina-die-gondel-zur-olympiapiste-ist-laengst-nicht-fertig.html,https://www.welt.de/sport/olympia/article69812e59f0e62064809e2a58/olympia-2026-baustellen-in-cortina-die-gondel-zur-olympiapiste-ist-laengst-nicht-fertig.html,0,www.welt.de,Wann die Gondel zur Olympiapiste fertig wird? Der Bauleiter reagiert gereizt,"Die Eröffnung der Winterspiele naht, doch in Cortina ist längst nicht alles fertig – im Gegenteil. Weil an der Gondelbahn noch gebaut wird, müssen Athleten und Zuschauer wohl anders auf den Berg gebracht werden. Schulen werden extra geschlossen, um den Nahver…",https://images.welt.de/69812e59f0e62064809e2a58/41db39985034dc1c99436620a0a0b143/ci16x9-w1200/seilbahn-2-jpeg,2026-02-03T13:27:24Z,,"Die Eröffnung der Winterspiele naht, doch in Cortina ist längst nicht alles fertig im Gegenteil. Weil an der Gondelbahn noch gebaut wird, müssen Athleten und Zuschauer wohl anders auf den Berg gebrac… [+6472 chars]",,de,'Winter'
https://www.welt.de/sport/olympia/article69812e59f0e62064809e2a58/olympia-2026-noch-ist-cortina-vielerorts-eine-baustelle-ein-report.html,https://www.welt.de/sport/olympia/article69812e59f0e62064809e2a58/olympia-2026-noch-ist-cortina-vielerorts-eine-baustelle-ein-report.html,0,www.welt.de,Im Olympia-Ort wird noch gebaut und gebaggert,"Die Eröffnung der Winterspiele naht, doch in Cortina ist längst nicht alles fertig. Weil an der Gondelbahn noch gebaut wird, müssen Athleten und Zuschauer wohl anders auf den Berg gebracht werden. Nicht die einzige Baustelle, auch wenn olympisches Flair berei…",https://images.welt.de/69812e59f0e62064809e2a58/41db39985034dc1c99436620a0a0b143/ci16x9-w1200/seilbahn-2-jpeg,2026-02-03T13:27:24Z,,"Die Eröffnung der Winterspiele naht, doch in Cortina ist längst nicht alles fertig. Weil an der Gondelbahn noch gebaut wird, müssen Athleten und Zuschauer wohl anders auf den Berg gebracht werden. Ni… [+6471 chars]",,de,'Schnee'
https://www.golem.de/sonstiges/zustimmung/auswahl.html?from=https://www.golem.de/news/anzeige-smarter-heizkoerperthermostat-mit-hub-jetzt-unter-32-euro-2602-204949.html&referer=https://t.co/059f40c674,https://www.golem.de/sonstiges/zustimmung/auswahl.html?from=https://www.golem.de/news/anzeige-smarter-heizkoerperthermostat-mit-hub-jetzt-unter-32-euro-2602-204949.html&referer=https://t.co/059f40c674,0,www.golem.de,Anzeige: Smartes Heizkörperthermostat mit Hub jetzt unter 32 Euro,"Bei Frost und hohen Heizkosten zählt jedes Grad. Dieses smarte Thermostat heizt nur dort, wo es wirklich nötig ist. (TP-Link, Technik/Hardware)",,2026-02-03T13:37:01Z,,"Besuchen Sie Golem.de wie gewohnt mit Werbung und Tracking,
 indem Sie der Nutzung aller Cookies zustimmen.
 Details zum Tracking finden Sie im Privacy Center.
Skript wurde nicht geladen. Informat… [+607 chars]",,de,'Frost'
https://www.tagesspiegel.de/berlin/berlin-im-krisenmodus-erst-kein-strom-und-dann-noch-winter-15212955.html,https://www.tagesspiegel.de/berlin/berlin-im-krisenmodus-erst-kein-strom-und-dann-noch-winter-15212955.html,0,www.tagesspiegel.de,Berlin im Krisenmodus: Erst kein Strom und dann noch Winter,"Berlin will Olympische Spiele ausrichten, scheitert aber schon an glatten Gehwegen. Womit die Hauptstadt zu kämpfen hat – und was leere Straßenbahnen damit zu tun haben.",https://www.tagesspiegel.de/images/15213085/alternates/BASE_16_9_W1400/1770126077000/winterwetter-in-berlin.jpeg,2026-02-03T13:41:23Z,,"Das neue Jahr hat den Menschen in Berlin schon viel abverlangt. Kaum war der alljährliche Böllerwahnsinn zu Silvester abgeklungen, fiel der Strom aus: Nach einem wohl von Linksextremisten begangenen … [+5565 chars]",,de,'Schnee'
https://www.stern.de/gesellschaft/regional/mecklenburg-vorpommern/winterwetter--wieder-schnee-in-mecklenburg-vorpommern-erwartet-37102626.html,https://www.stern.de/gesellschaft/regional/mecklenburg-vorpommern/winterwetter--wieder-schnee-in-mecklenburg-vorpommern-erwartet-37102626.html,0,www.stern.de,Winterwetter: Wieder Schnee in Mecklenburg-Vorpommern erwartet,Schwerin (mv) - Laut Deutschem Wetterdienst (DWD) steht Mecklenburg-Vorpommern in den kommenden Tagen wieder Schnee ins Haus. Den Meteorologen zufolge,https://image.stern.de/37102628/t/zJ/v1/w1440/r1.7778/-/03--zfrhdhctqpv3axs2048jpeg---eec4eb97f1919092.jpg,2026-02-03T13:59:12Z,,"Kopiere den aktuellen Link
Zur Merkliste hinzufügen
Nach klirrender Kälte steigen die Temperaturen, bleiben aber frostig in MV. Außerdem ist Niederschlag angesagt - als Schnee - aber nicht nur.
La… [+965 chars]",,de,'Winter'
https://www.stern.de/gesellschaft/regional/hessen/wetter--zu-viel-schnee--betrieb-am-frankfurter-flughafen-eingestellt-37102870.html,https://www.stern.de/gesellschaft/regional/hessen/wetter--zu-viel-schnee--betrieb-am-frankfurter-flughafen-eingestellt-37102870.html,0,www.stern.de,Wetter: Zu viel Schnee: Betrieb am Frankfurter Flughafen eingestellt,Starker Schneefall legt den Frankfurter Flughafen lahm: Seit dem Nachmittag sind keine Starts und Landungen möglich. Wann der Betrieb wieder anlaufen könnte.,https://image.stern.de/37102872/t/LS/v1/w1440/r1.7778/-/03--5l7iecjs2qv7axs2048jpeg---3089c3b5c1b83141.jpg,2026-02-03T14:44:10Z,,"Kopiere den aktuellen Link
Zur Merkliste hinzufügen
Starker Schneefall legt den Frankfurter Flughafen lahm: Seit dem Nachmittag sind keine Starts und Landungen möglich. Wann der Betrieb wieder anla… [+738 chars]",,de,'Schnee'
https://www.zeit.de/news/2026-02/03/schnee-am-frankfurter-airport-flieger-landen-in-stuttgart,https://www.zeit.de/news/2026-02/03/schnee-am-frankfurter-airport-flieger-landen-in-stuttgart,0,www.zeit.de,Winterwetter: Schnee am Frankfurter Airport - Flieger landen in Stuttgart,Hier finden Sie Informationen zu dem Thema „Winterwetter“. Lesen Sie jetzt „Schnee am Frankfurter Airport - Flieger landen in Stuttgart“.,https://img.zeit.de/news/2026-02/03/schnee-am-frankfurter-airport-flieger-landen-in-stuttgart-image-group/wide__1300x731,2026-02-03T14:54:21Z,,"Wegen Schneefalls am Frankfurter Flughafen sind mehrere Flugzeuge nach Stuttgart umgeleitet worden. Zehn Maschinen seien am Stuttgarter Airport gelandet, sagte eine Sprecherin. Ob und wie viele weite… [+921 chars]",,de,'Winter'
https://www.stern.de/gesellschaft/regional/niedersachsen-bremen/frostige-temperaturen--brrrr--warum-fuehlt-es-sich-noch-kaelter-an-als-es-ist--37102984.html,https://www.stern.de/gesellschaft/regional/niedersachsen-bremen/frostige-temperaturen--brrrr--warum-fuehlt-es-sich-noch-kaelter-an-als-es-ist--37102984.html,0,www.stern.de,Frostige Temperaturen: Brrrr! Warum fühlt es sich noch kälter an als es ist?,"Es fühlt sich bitterkalt an - doch das Thermometer zeigt ""nur"" einstellige Minusgrade. Warum wir draußen derzeit besonders frieren und warum ein Pinguin-Gang bei glatten Wegen helfen kann.",https://image.stern.de/37102986/t/T1/v1/w1440/r1.7778/-/03--zvrgfgdm5rv3axs2048jpeg---b90bcaf74802d450.jpg,2026-02-03T15:03:39Z,,"Kopiere den aktuellen Link
Zur Merkliste hinzufügen
Es fühlt sich bitterkalt an - doch das Thermometer zeigt ""nur"" einstellige Minusgrade. Warum wir draußen derzeit besonders frieren und warum ein … [+1431 chars]",,de,'Frieren'
https://www.zeit.de/news/2026-02/03/ruegen-eisschollen-tuermen-sich-zu-meterhohen-eisbergen-auf,https://www.zeit.de/news/2026-02/03/ruegen-eisschollen-tuermen-sich-zu-meterhohen-eisbergen-auf,0,www.zeit.de,Frost an der Küste: Rügen: Eisschollen türmen sich zu meterhohen Eisbergen auf,Hier finden Sie Informationen zu dem Thema „Frost an der Küste“. Lesen Sie jetzt „Rügen: Eisschollen türmen sich zu meterhohen Eisbergen auf“.,https://img.zeit.de/news/2026-02/03/ruegen-eisschollen-tuermen-sich-zu-meterhohen-eisbergen-auf-image-group/wide__1300x731,2026-02-03T16:11:25Z,,"Eisplatten, die sich teils meterhoch auftürmen, locken derzeit Schaulustige an Rügens Küste. Er sei schon in Grönland und Island gewesen, sagte etwa der Rüganer Gerald Schmidt in Palmer Ort am Greifs… [+1091 chars]",,de,'Frost'
https://www.zeit.de/news/2026-02/03/30-kilometer-stau-auf-a3-mit-schnee-rettungsdienste-bereit,https://www.zeit.de/news/2026-02/03/30-kilometer-stau-auf-a3-mit-schnee-rettungsdienste-bereit,0,www.zeit.de,Schnee und Glätte: 30 Kilometer Stau auf A3 mit Schnee: Rettungsdienste bereit,Hier finden Sie Informationen zu dem Thema „Schnee und Glätte“. Lesen Sie jetzt „30 Kilometer Stau auf A3 mit Schnee: Rettungsdienste bereit“.,https://img.zeit.de/news/2026-02/03/30-kilometer-stau-auf-a3-mit-schnee-rettungsdienste-bereit-image-group/wide__1300x731,2026-02-03T17:33:23Z,,"Nach heftigen Schneefällen staut es sich auf der A3 zwischen Raunheim und Idstein in Hessen auf knapp 30 Kilometern Länge. Derzeit hoffe die Polizei, dass der Stau in den nächsten Stunden zumindest e… [+944 chars]",,de,'Schnee'
https://www.faz.net/aktuell/wirtschaft/mehr-wirtschaft/sinkende-oeleinnahmen-russlands-haushaltsnoete-wachsen-110830710.html,https://www.faz.net/aktuell/wirtschaft/mehr-wirtschaft/sinkende-oeleinnahmen-russlands-haushaltsnoete-wachsen-110830710.html,0,www.faz.net,Sinkende Öleinnahmen: Russlands Haushaltsnöte wachsen,Der Kreml verdient immer weniger Geld mit dem Öl- und Gasverkauf. Nun droht mit Indien einer der wichtigsten verbliebenen Kunden wegzubrechen.,https://media0.faz.net/image/w1200h627/3fbbb9e26ff4/w3000h1567x0y159o/022025/1.10830707/eine-nicht-unkomplizierte.webp,2026-02-03T18:10:21Z,,Schon das vergangene Jahr war kein gutes für den russischen Haushalt. Um knapp 24 Prozent brachen die Öl- und Gaseinnahmen im Vergleich zu 2024 ein. Dieses Jahr könnte sich die Lage noch einmal versc… [+6683 chars],,de,'Gas'
https://www.zeit.de/news/2026-02/03/schneefall-und-glatteis-schulausfaelle-in-hessen-moeglich,https://www.zeit.de/news/2026-02/03/schneefall-und-glatteis-schulausfaelle-in-hessen-moeglich,0,www.zeit.de,Winterwetter: Schneefall und Glatteis – Schulausfälle in Hessen möglich,Hier finden Sie Informationen zu dem Thema „Winterwetter“. Lesen Sie jetzt „Schneefall und Glatteis – Schulausfälle in Hessen möglich“.,https://img.zeit.de/news/2026-02/03/schneefall-und-glatteis-schulausfaelle-in-hessen-moeglich-image-group/wide__1300x731,2026-02-03T18:52:42Z,,Wegen starken Schneefalls und Glatteiswarnungen für Teile Hessens müssen sich Schülerinnen und Schüler auf Unterrichtsausfälle an diesem Mittwoch einstellen. Hessenweit könne es zu einem witterungsbe… [+880 chars],,de,'Nässe'
https://www.zeit.de/news/2026-02/03/wetterdienst-warnt-vor-glaettegefahr-im-nordwesten,https://www.zeit.de/news/2026-02/03/wetterdienst-warnt-vor-glaettegefahr-im-nordwesten,0,www.zeit.de,Winterwetter: Wetterdienst warnt vor Glättegefahr im Nordwesten,Hier finden Sie Informationen zu dem Thema „Winterwetter“. Lesen Sie jetzt „Wetterdienst warnt vor Glättegefahr im Nordwesten“.,https://img.zeit.de/news/2026-02/03/wetterdienst-warnt-vor-glaettegefahr-im-nordwesten-image-group/wide__1300x731,2026-02-03T19:16:40Z,,"In großen Teilen Niedersachsens und Bremens warnt der Deutsche Wetterdienst (DWD) vor Glatteins. Das teilte der DWD am Abend mit. 
In der Nacht zum Mittwoch wird demnach verbreitet leichter bis mäßi… [+480 chars]",,de,'Frost'
https://www.zeit.de/news/2026-02/04/schnee-und-glatteis-in-teilen-deutschlands-angesagt,https://www.zeit.de/news/2026-02/04/schnee-und-glatteis-in-teilen-deutschlands-angesagt,0,www.zeit.de,Wetter: Schnee und Glatteis in Teilen Deutschlands angesagt,Hier finden Sie Informationen zu dem Thema „Wetter“. Lesen Sie jetzt „Schnee und Glatteis in Teilen Deutschlands angesagt“.,https://img.zeit.de/news/2026-02/04/schnee-und-glatteis-in-teilen-deutschlands-angesagt-image-group/wide__1300x731,2026-02-04T04:04:48Z,,Wegen des Winterwetters müssen sich die Menschen in Teilen Deutschlands am Morgen auf glatte Straßen einstellen. Der Deutsche Wetterdienst hatte für die Nacht stellenweise vor Glätte durch überfriere… [+2095 chars],,de,'Schnee'
https://www.faz.net/aktuell/gesellschaft/ungluecke/unfaelle-und-staus-schnee-und-glatteis-in-teilen-deutschlands-accg-200504458.html,https://www.faz.net/aktuell/gesellschaft/ungluecke/unfaelle-und-staus-schnee-und-glatteis-in-teilen-deutschlands-accg-200504458.html,0,www.faz.net,Winter-Wetter: Schnee und Glatteis in Teilen Deutschlands angesagt,Im Westen und Norden Deutschlands ist mit Glatteis und Schnee zu rechnen. Vor allem in Niedersachsen herrscht bereits Chaos auf den Straßen.,https://media0.faz.net/image/w1200h627/14aee72b71d7/w5031h2628x0y363o/202602/43601.0.1732366419/im-nordwesten-von.webp,2026-02-04T04:13:57Z,,Wegen des Winterwetters müssen sich die Menschen in Teilen Deutschlands am Morgen auf glatte Straßen einstellen. Der Deutsche Wetterdienst hatte für die Nacht stellenweise vor Glätte durch überfriere… [+2037 chars],,de,'Schnee'
https://www.zeit.de/news/2026-02/04/frost-ist-bisher-kein-problem-fuer-bestattungen,https://www.zeit.de/news/2026-02/04/frost-ist-bisher-kein-problem-fuer-bestattungen,0,www.zeit.de,Winter auf Friedhöfen: Frost ist bisher kein Problem für Bestattungen,Hier finden Sie Informationen zu dem Thema „Winter auf Friedhöfen“. Lesen Sie jetzt „Frost ist bisher kein Problem für Bestattungen“.,https://img.zeit.de/news/2026-02/04/frost-ist-bisher-kein-problem-fuer-bestattungen-image-group/wide__1300x731,2026-02-04T04:30:04Z,,"Trotz anhaltender Minusgrade, trotz des Eises und Schnees läuft der Betrieb auf den Hamburger Friedhöfen bisher ohne größere Probleme weiter. Die Erdarbeiten dauerten aber wegen Eiskrusten nach Angab… [+471 chars]",,de,'Winter'
