index,url,valid,domain,title,description,image,published,archive,content,quote,language,keyword
https://www.tagesspiegel.de/berlin/frost-und-eis-wildtiere-in-not-wie-jager-jetzt-eingreifen-15228424.html,https://www.tagesspiegel.de/berlin/frost-und-eis-wildtiere-in-not-wie-jager-jetzt-eingreifen-15228424.html,0,www.tagesspiegel.de,Frost und Eis: Wildtiere in Not - Wie Jäger jetzt eingreifen,"Frost, Eis und Futtermangel: In einigen Gebieten Brandenburgs gilt die Notzeit für Wildtiere. Wie Jäger jetzt Rehen und Hirschen helfen und was Spaziergänger beachten sollen.",https://www.tagesspiegel.de/images/15228423/alternates/BASE_16_9_W1400/1770447687000/winterwetter-in-brandenburg.jpeg,2026-02-07T07:01:27Z,,"Wegen hartnäckigem Frost und Eis ist in einigen Regionen Brandenburgs die Notzeit für Wildtiere ausgerufen. Jäger müssen Waldbewohner wie Rehe und Hirsche füttern, um sie vor dem Verhungern zu bewahr… [+2573 chars]",,de,'Eis'
https://www.macerkopf.de/2026/02/07/apple-tv-original-doku-the/,https://www.macerkopf.de/2026/02/07/apple-tv-original-doku-the/,0,www.macerkopf.de,Apple TV sichert sich die Original-Doku „The Last First: Winter K2“,"Apple TV zeigt nicht nur Original-Filme und -Serien, sondern auch Original-Dokus. Nun konnte sich der Streaming-Dienst einen weiteren Dokumentarfilm sichern. Konkret handelt es sich um „The Last First: Winter K2“. „The Last First: Winter K2“ kommt auf Apple T…",https://www.macerkopf.de/wp-content/uploads/2026/02/apple_tv_the_last_first_winter_k2_szene.jpeg,2026-02-07T07:04:06Z,,"Apple TV zeigt nicht nur Original-Filme und -Serien, sondern auch Original-Dokus. Nun konnte sich der Streaming-Dienst einen weiteren Dokumentarfilm sichern. Konkret handelt es sich um The Last First… [+1428 chars]",,de,'Winter'
https://www.urlaubspiraten.de/pauschalreisen/alicante-staedtetrip,https://www.urlaubspiraten.de/pauschalreisen/alicante-staedtetrip,0,www.urlaubspiraten.de,Winter satt? ✈️ Besuche eine der sonnigsten Städte Europas! ☀️,"Kein Witz, das spanische Alicante gehört zu den sonnigsten Städten Europas, durchschnittlich scheint die Sonne 349 Stunden pro Monat und ab März erwarten euch durchschnittlich um die 19 bis 21 °C Tagestemperatur. ☀️✈️ Bei diesem eisigen Winter hilft neben der…",https://image.urlaubspiraten.de/720/image/upload/v1770367888/Impressions%20and%20Other%20Assets/shutterstock_2057814977_aoimfl.jpg,2026-02-07T07:35:00Z,,"Wir nutzen Cookies, um deine Nutzererfahrung zu verbessern, dir persönlich auf dich zugeschnittene Inhalte liefern zu können und die Nutzung unserer App zu analysieren. Wenn du auf ""alle akzeptieren""… [+435 chars]",,de,'Winter'
https://www.diepresse.com/20550855/als-franz-reichelt-vom-eiffelturm-sprang,https://www.diepresse.com/20550855/als-franz-reichelt-vom-eiffelturm-sprang,0,www.diepresse.com,Als Franz Reichelt vom Eiffelturm sprang [premium],"Franz ­Reichelt, der aus Österreich-Ungarn nach Paris gezogen war, sprang am 4. Februar 1912 bei Minusgraden vom Eiffelturm. Er trug eine Mütze, Handschuhe, einen dicken, an Zorro erinnernden Stoffumhang und einen in den Anzug genähten Rucksack auf seinem Rüc…",https://img.diepresse.com/public/incoming/47khq1-gettyimages-545943123jpg/alternates/DPR_SOCIAL_MAGAZIN/GettyImages-545943123.jpg,2026-02-07T22:17:12Z,,"Ich frage mich, was ihm durch den Kopf ging, als er auf einem wackeligen Holzschemel stand und zum Himmel schaute, Sekunden, bevor er sich über das Geländer der ersten Etage des Pariser Eiffelturms a… [+11174 chars]",,de,'Handschuhe'
https://www.welt.de/politik/deutschland/article6988049800d739e7f40597e7/gasspeicher-ministerin-reiche-macht-ihren-job-nicht-jetzt-sorgen-sich-die-gruenen-um-lng-und-pipelines.html,https://www.welt.de/politik/deutschland/article6988049800d739e7f40597e7/gasspeicher-ministerin-reiche-macht-ihren-job-nicht-jetzt-sorgen-sich-die-gruenen-um-lng-und-pipelines.html,0,www.welt.de,„Ministerin Reiche macht ihren Job nicht“ – jetzt sorgen sich die Grünen um das Gas im Land,Die deutschen Gasspeicher sind aktuell nur noch zu weniger als 28 Prozent gefüllt. Die Bundesnetzagentur hält die Versorgung für stabil. Doch die Grünen zweifeln – und bestellen Wirtschaftsministerin Reiche in eine Sondersitzung.,https://images.welt.de/6988049800d739e7f40597e7/d83564ca8c78887060da09bb4a063b8a-master/ci16x9-w1200/dpa-com-20090101-260128-911-017730-jpg,2026-02-08T03:52:05Z,,Die deutschen Gasspeicher sind aktuell nur noch zu weniger als 28 Prozent gefüllt. Die Bundesnetzagentur hält die Versorgung für stabil. Doch die Grünen zweifeln  und bestellen Wirtschaftsministerin … [+2664 chars],,de,'Heizen'
https://www.n-tv.de/panorama/Die-Toten-in-unserer-Timeline-oder-Wie-soll-man-das-alles-aushalten-id30330540.html,https://www.n-tv.de/panorama/Die-Toten-in-unserer-Timeline-oder-Wie-soll-man-das-alles-aushalten-id30330540.html,0,www.n-tv.de,Eine für alle: Die Toten in unserer Timeline oder: Wie soll man das alles aushalten?,"Ich jammere auf hohem Niveau, ich weiß, denn ich habe Heizung, Strom, Essen, muss nicht vor Bomben in den Keller flüchten und nicht Angst haben, wenn es klopft. Trotzdem ist mir so schwer ums Herz, dass ich manchmal das Gefühl habe, da nicht rauszukommen.",https://www.n-tv.de/img/30332824/1770380450/Img_16_9/1200/People-in-Iran-Protesting-Against-Iran-s-Clerical-Establishment-Tehran-Nazanin-Asmi-Khani-17-years-old-she-was-shot-dead-by-the-brutal-Islamic-Republic-security-forces-during-the-January-8-protests-in-Qazvin-These-images-represent-Irans-stolen-generation-young-women-and-men-killed-by-the-Islamic-Republic-for-demanding-political-and-social-freedoms-Their-photographs-now-appear-in-cemeteries-and-homes-beside-graves-and-memorials-marking-lives-cut-short-Since-protests-erupted-on-28-December-2025-against-economic-hardship-and-state-repression-security-forces-have-responded-with-mass-arrests-and-deadly-crackdowns-including-one-of-the-deadliest-episodes-on-89-January-2026.jpg,2026-02-08T06:19:10Z,,"Der Iran hat Zehntausende seiner jungen Menschen verloren. Sie wurden abgeschlachtet, gefoltert, hingerichtet. Wie soll ein Land, wie soll ein Volk, das verkraften? (Foto: IMAGO/ABACAPRESS)
Ich jamm… [+5719 chars]",,de,'Heizung'
https://www.stern.de/panorama/obdachlosigkeit--wie-kann-man-wohnungslosen-helfen---37107426.html,https://www.stern.de/panorama/obdachlosigkeit--wie-kann-man-wohnungslosen-helfen---37107426.html,0,www.stern.de,"Hilfe in der Kälte: Wie kann ich erkennen, ob ein Obdachloser erfriert?",Obdachlosigkeit kann in diesen Tagen und Nächten lebensgefährlich sein: Wie hilft man wohnungslosen Menschen bei eisigen Temparaturen? Eine Hamburger Expertin weiß Rat.,https://image.stern.de/37107464/t/qw/v8/w1440/r1.7778/-/symbolfoto-obdachlosigkeit.jpg,2026-02-08T07:24:00Z,,"Kopiere den aktuellen Link
Zur Merkliste hinzufügen
Obdachlosigkeit kann in diesen Tagen und Nächten lebensgefährlich sein: Wie hilft man wohnungslosen Menschen bei eisigen Temparaturen? Eine Hambu… [+3449 chars]",,de,'Kälte'
https://www.faz.net/aktuell/wirtschaft/gasversorgung-wirtschaftsministerin-reiche-soll-in-ausschuss-kommen-accg-200517915.html,https://www.faz.net/aktuell/wirtschaft/gasversorgung-wirtschaftsministerin-reiche-soll-in-ausschuss-kommen-accg-200517915.html,0,www.faz.net,Fallende Gasspeicherstände: Wirtschaftsministerin Reiche soll in Ausschuss kommen,Die deutschen Gasspeicher sind derzeit zu weniger als 30 Prozent gefüllt. Die Grünen sehen Bundeswirtschaftsministerin Reiche in der Pflicht – und haben nun eine Sondersitzung des Bundestagsenergieausschusses beantragt.,https://media0.faz.net/image/w1200h627/1e448514f6f5/w4596h2401x0y256o/202601/43601.0.1712815964/zuletzt-noch-zu-knapp-einem.webp,2026-02-08T10:06:51Z,,Angesichts der niedrigen Füllstände in den deutschen Gasspeichern beantragen die Grünen eine Sondersitzung des Bundestagsausschusses für Wirtschaft und Energie unter Anwesenheit von Ministerin Kather… [+1855 chars],,de,'Heizen'
https://www.zeit.de/news/2026-02/08/eis-vor-ruegener-lng-terminal-gastanker-muss-weiter-warten,https://www.zeit.de/news/2026-02/08/eis-vor-ruegener-lng-terminal-gastanker-muss-weiter-warten,0,www.zeit.de,Eis auf der Ostsee: Eis vor Rügener LNG-Terminal - Gastanker muss weiter warten,Hier finden Sie Informationen zu dem Thema „Eis auf der Ostsee“. Lesen Sie jetzt „Eis vor Rügener LNG-Terminal - Gastanker muss weiter warten“.,https://img.zeit.de/news/2026-02/08/eis-vor-ruegener-lng-terminal-gastanker-muss-weiter-warten-image-group/wide__1300x731,2026-02-08T12:42:49Z,,"Der Betreiber des Rügener LNG-Terminals rechnet wegen der Eislage erst im Laufe der neuen Woche damit, dass ein schon länger wartender Gastanker das Terminal anlaufen kann. «Für die Ein- und Ausfahrt… [+1886 chars]",,de,'Gas'
https://www.welt.de/politik/deutschland/article69884bc3088305faf4ff681a/heizen-droht-gasmangel-im-frostwinter-so-reagiert-schwarz-rot-auf-die-attacke-der-gruenen.html,https://www.welt.de/politik/deutschland/article69884bc3088305faf4ff681a/heizen-droht-gasmangel-im-frostwinter-so-reagiert-schwarz-rot-auf-die-attacke-der-gruenen.html,0,www.welt.de,Droht Gasmangel im Frostwinter? So reagiert Schwarz-Rot auf die Attacke der Grünen,Die Grünen wollen Wirtschaftsministerin Reiche (CDU) wegen niedriger Gasspeicher-Füllstände in den Energie-Ausschuss zitieren. Union und SPD weisen die Kritik zurück – auch unter Bezug auf Reiches Vorgänger Habeck. Für die AfD macht sich mit der Ökopartei der…,https://images.welt.de/69884bc3088305faf4ff681a/334f76143cee0e1d0f48b38c1c592b08/ci16x9-w1200/573706325-jpg,2026-02-08T14:32:34Z,,Die Grünen wollen Wirtschaftsministerin Reiche (CDU) wegen niedriger Gasspeicher-Füllstände in den Energie-Ausschuss zitieren. Union und SPD weisen die Kritik zurück  auch unter Bezug auf Reiches Vor… [+6875 chars],,de,'Frost'
https://taz.de/Kriegswinter-in-der-Ukraine/!6148225/,https://taz.de/Kriegswinter-in-der-Ukraine/!6148225/,0,taz.de,"Kriegswinter in der Ukraine: Kälte, Hoffnung und Kultur","Es ist kalt, Russland verschärft seine Angriffe. Fünf Ukrai­ne­r*in­nen haben uns erzählt, wie sie mit kaputter Heizung und fehlendem Strom umgehen.",https://taz.de/picture/8235465/1200/Ukraibe-Russland-Kaelte.jpeg,2026-02-08T17:54:00Z,,"Es ist kalt, Russland verschärft seine Angriffe. Fünf Ukrai­ne­r*in­nen haben uns erzählt, wie sie mit kaputter Heizung und fehlendem Strom umgehen. mehr...",,de,'Kälte'
https://www.basicthinking.de/blog/2026/02/08/elektroautos-hoechstens-reichweite-winter/,https://www.basicthinking.de/blog/2026/02/08/elektroautos-hoechstens-reichweite-winter/,0,www.basicthinking.de,Elektroautos mit der höchsten Reichweite im Winter,"Der Beitrag Elektroautos mit der höchsten Reichweite im Winter erschien zuerst beim Online-Magazin BASIC thinking. Über unseren Newsletter UPDATE startest du jeden Morgen bestens informiert in den Tag.
Ein kalter Winter wie in diesem Jahr ist für Elektroautos…",https://www.basicthinking.de/blog/wp-content/uploads/2025/11/tesla-model-y.png,2026-02-08T19:53:14Z,,"Ein kalter Winter wie in diesem Jahr ist für Elektroautos die ultimative Belastungsprobe. Ein Test unter arktischen Bedingungen zeigt auf, welcher Akku wirklich frostfest ist und welche Modelle auf h… [+2129 chars]",,de,'Heizung'
https://www.morgenpost.de/wirtschaft/article411151936/heizoelpreise-aktuell-heute-9-februar-2026-heizoel-kaufen-heizung.html,https://www.morgenpost.de/wirtschaft/article411151936/heizoelpreise-aktuell-heute-9-februar-2026-heizoel-kaufen-heizung.html,0,www.morgenpost.de,"Heizölpreise heute (Montag, 9. Februar): Der aktuelle Preis pro Liter","Die Kältewelle treibt die Heizöl-Nachfrage nach oben. Wie reagieren die Preise, lohnt sich jetzt ein Kauf – oder zahlt sich Abwarten aus?",https://img.sparknews.funkemedien.de/406781589/406781589_1720770938_v16_9_1600.jpeg,2026-02-09T06:46:17Z,,"Hartnäckig halten sich die Temperaturen in vielen Teilen Deutschlands unter dem Gefrierpunkt, der ungewöhnlich kalte Winter dauert an. Viele Haushalte müssen jetzt neu kalkulieren: Sollte man den all… [+8447 chars]",,de,'Heizung'
https://www.zeit.de/news/2026-02/09/frost-glaette-und-wenig-sonne-wetter-bleibt-ungemuetlich,https://www.zeit.de/news/2026-02/09/frost-glaette-und-wenig-sonne-wetter-bleibt-ungemuetlich,0,www.zeit.de,"Wetter: Frost, Glätte und wenig Sonne – Wetter bleibt ungemütlich","Hier finden Sie Informationen zu dem Thema „Wetter“. Lesen Sie jetzt „Frost, Glätte und wenig Sonne – Wetter bleibt ungemütlich“.",https://img.zeit.de/news/2026-02/09/frost-glaette-und-wenig-sonne-wetter-bleibt-ungemuetlich-image-group/wide__1300x731,2026-02-09T07:41:26Z,,Frostige Temperaturen und örtliche Glätte prägen in den kommenden Tagen das Wettergeschehen in Hamburg und Schleswig-Holstein. Heute kommt es bis in den Vormittag stellenweise zu Glätte durch gefrier… [+1351 chars],,de,'Frost'
https://www.focus.de/finanzen/heizkoerper-tipp-so-sparen-sie-bares-geld-und-haben-bessere-luft_c4b08e21-f70b-4f12-aa38-675a239d5bb0.html,https://www.focus.de/finanzen/heizkoerper-tipp-so-sparen-sie-bares-geld-und-haben-bessere-luft_c4b08e21-f70b-4f12-aa38-675a239d5bb0.html,0,www.focus.de,Heizkörper-Tipp: So sparen Sie bares Geld und haben bessere Luft,Heizung reinigen lohnt sich. Wie oft Sie den Heizkörper putzen sollten und wie Sie damit sparen.,https://quadro.burda-forward.de/ctf/aa800bc2-d0a6-4767-ac74-9f2407f9b800.858c340e-7bb1-42b9-a54f-2ba937205117.jpeg?im=RegionOfInterestCrop%3D%281200%2C630%29%2CregionOfInterest%3D%28600%2C343%29&hash=1394356581c2513e71c846eee3eb0a6f9ac7f3e427d3ab48f471b6642f6f9ca9,2026-02-09T08:04:00Z,,"Heizkörper arbeiten nur dann effizient, wenn Luft und Wärme ungehindert zirkulieren können. Genau das verhindert feiner Staub, der sich vor allem zwischen den Lamellen festsetzt. Bereits geringe Abla… [+1762 chars]",,de,'Heizung'
https://hallespektrum.de/aktuelles/frostwarnung-und-tauwetter-durchwachsenes-winterwetter-in-halle-saale/475257/,https://hallespektrum.de/aktuelles/frostwarnung-und-tauwetter-durchwachsenes-winterwetter-in-halle-saale/475257/,0,hallespektrum.de,Frostwarnung und Tauwetter: Durchwachsenes Winterwetter in Halle,"Über Halle zieht in diesen Tagen ein Wechselspiel aus Nässe und Kälte hinweg, wie es der Februar seit jeher bereithält. Während der Himmel heute und am Mittwoch dicht verhangen bleibt, öffnet er am morgigen Dienstag für kurze Zeit sein Grau und lässt etwas So…",https://hallespektrum.de/wp-content/uploads/2025/12/WETTERSCHMUDDEL.png,2026-02-09T12:10:38Z,,"Über Halle zieht in diesen Tagen ein Wechselspiel aus Nässe und Kälte hinweg, wie es der Februar seit jeher bereithält. Während der Himmel heute und am Mittwoch dicht verhangen bleibt, öffnet er am m… [+672 chars]",,de,'Winter'
https://www.bild.de/leben-wissen/wohnen-living/notfallvorrat-anlegen-diese-fehler-sollten-sie-vermeiden-6989c4adf443a013f3fe2c7f,https://www.bild.de/leben-wissen/wohnen-living/notfallvorrat-anlegen-diese-fehler-sollten-sie-vermeiden-6989c4adf443a013f3fe2c7f,0,www.bild.de,Bereit für den Ernstfall - Notfallvorrat anlegen? Diese Fehler sollten Sie vermeiden,"Bei Schnee, Eis oder einem längeren Stromausfall kann sich ein Notfallvorrat lohnen. Welche Fehler beim Anlegen von Notfallvorräten passieren.","https://images.bild.de/6989c4adf443a013f3fe2c7f/c4c757bd77ca3a5b1726e93fc8c3550c,fc2074b8?w=1280",2026-02-09T12:56:04Z,,"TTS-Player überspringenArtikel weiterlesenBei Schnee, Eis oder einem längeren Stromausfall kann sich ein Notfallvorrat lohnen. Welche vier klassischen Fehler viele beim Anlegen von Notfallvorräten ma… [+2681 chars]",,de,'Schnee'
https://www.dw.com/de/hass-posts-von-trump-und-anderen-gegen-us-olympiastarter/a-75876575,https://www.dw.com/de/hass-posts-von-trump-und-anderen-gegen-us-olympiastarter/a-75876575,0,www.dw.com,Hassbotschaften von Trump und anderen gegen US-Olympioniken,Bei den Olympischen Winterspielen in Mailand und Cortina stehen US-Sportler im Mittelpunkt politischer Debatten. Ihr eigener Präsident und dessen Anhänger schießen per Social Media gegen sie. Die US-Olympiateilnehmer erhalten immer mehr Hass-Nachrichten. Erst…,https://static.dw.com/image/75877160_6.jpg,2026-02-09T14:19:00Z,,"Die US-Olympiateilnehmer erhalten immer mehr Hass-Nachrichten. Erster und prominentester Absender ist ihr eigener Präsident, Donald Trump. Der fast 80-Jährige nutzte am Wochenende nach dem Beginn der… [+5382 chars]",,de,'Schnee'
https://www.dw.com/de/trump-olympische-spiele-mailand-social-media-ski-freestyler-hunter-hess-shiffrin-ice-proteste/a-75876575,https://www.dw.com/de/trump-olympische-spiele-mailand-social-media-ski-freestyler-hunter-hess-shiffrin-ice-proteste/a-75876575,0,www.dw.com,"""Echter Loser"": Trump beschimpft US-Athleten bei Olympia",Bei den Olympischen Winterspielen in Mailand und Cortina stehen US-Sportler im Mittelpunkt politischer Debatten. Ihr eigener Präsident und dessen Anhänger schießen per Social Media gegen sie. Die US-Olympiateilnehmer erhalten immer mehr Hass-Nachrichten. Erst…,https://static.dw.com/image/75877160_6.jpg,2026-02-09T14:19:00Z,,"Die US-Olympiateilnehmer erhalten immer mehr Hass-Nachrichten. Erster und prominentester Absender ist ihr eigener Präsident, Donald Trump. Der fast 80-Jährige nutzte am Wochenende nach dem Beginn der… [+5451 chars]",,de,'Winter'
https://www.diepresse.com/20561981/die-waechter-des-eismeers-haben-in-groenland-viel-zu-tun,https://www.diepresse.com/20561981/die-waechter-des-eismeers-haben-in-groenland-viel-zu-tun,0,www.diepresse.com,Die Wächter des Eismeers haben in Grönland viel zu tun [premium],"Klimawandel und politische Begehrlichkeiten machen den Grönländern Sorgen. Wer auf die größte Insel der Erde reist, erlebt überwältigende Natur – und die Kultur der Inuit im Umbruch.",https://img.diepresse.com/public/incoming/uqcltx-1-eisberge-r%C3%B8depynt-kangertittivaq-win-schumacher-weltwegejpgjpg/alternates/DPR_SOCIAL_MAGAZIN/1%20Eisberge%20R%C3%B8depynt%20Kangertittivaq%20%C2%A9%20Win%20Schumacher%20WeltwegeJPG.JPG,2026-02-09T14:35:49Z,,"Am zweiten Tag, nachdem die Gletscher und Gipfel von Island am Horizont verschwunden sind, rücken die Eisberge vor dem Schiff immer dichter zusammen. Es scheint, als ob sich die schwimmenden Giganten… [+11340 chars]",,de,'Kälte'
https://www.stern.de/gesellschaft/regional/niedersachsen-bremen/2--fussball-bundesliga--ungewoehnliche-idee--braunschweiger-trainingslager-im-februar-37120832.html,https://www.stern.de/gesellschaft/regional/niedersachsen-bremen/2--fussball-bundesliga--ungewoehnliche-idee--braunschweiger-trainingslager-im-februar-37120832.html,0,www.stern.de,2. Fußball-Bundesliga: Ungewöhnliche Idee: Braunschweiger Trainingslager im Februar,"Eintracht Braunschweig steckt mitten im Abstiegskampf und hat in diesem Winter stark seinen Kader verändert. Um sich neu zu finden, setzt der Club auf eine ungewöhnliche Maßnahme.",https://image.stern.de/37120834/t/4G/v1/w1440/r1.7778/-/09--uxwc7r2swcv7axs2048jpeg---044d0d88fe7bb5c9.jpg,2026-02-09T14:37:34Z,,"Kopiere den aktuellen Link
Zur Merkliste hinzufügen
Eintracht Braunschweig steckt mitten im Abstiegskampf und hat in diesem Winter stark seinen Kader verändert. Um sich neu zu finden, setzt der Clu… [+1007 chars]",,de,'Schnee'
https://www.morgenpost.de/berlin/article411142641/motocross-spektakel-in-berlin-fliegende-motoren-gegen-den-kalten-winter.html,https://www.morgenpost.de/berlin/article411142641/motocross-spektakel-in-berlin-fliegende-motoren-gegen-den-kalten-winter.html,0,www.morgenpost.de,Motocross-Spektakel in Berlin: Fliegende Motoren gegen den kalten Winter,"Beim Freestyle-Motocross kann man den kalten Winter vergessen. Das geht mit Feuerwerk, Adrenalin und Motoren. Davon gab’s nicht zu wenig.",https://img.sparknews.funkemedien.de/411144811/411144811_1770648166_v16_9_1600.jpeg,2026-02-09T14:42:00Z,,"Mit dem Winter in Berlin ist es ja wirklich verflixt. Über Jahre wünscht man sich Schnee. Weiße Weihnachten, bitte. Doch wenn der Schnee dann da ist, ist es das reinste Chaos. Glatteis, Frost, ungest… [+4594 chars]",,de,'Winter'
https://www.tagesspiegel.de/sport/als-mutter-zum-ersten-olympia-gold-italien-feiert-francesca-lollobrigida-und-das-progetto-mamma-15233927.html,https://www.tagesspiegel.de/sport/als-mutter-zum-ersten-olympia-gold-italien-feiert-francesca-lollobrigida-und-das-progetto-mamma-15233927.html,0,www.tagesspiegel.de,Als Mutter zum ersten Olympia-Gold: Italien feiert Francesca Lollobrigida und das „Progetto Mamma“,Sie kann Kälte nicht leiden und ihre Großtante war eine Filmdiva. Eisschnellläuferin Lollobrigida ist Italiens Liebling bei diesen Winterspielen – und kämpft für Gleichberechtigung.,https://www.tagesspiegel.de/images/15233881/alternates/BASE_16_9_W1400/1770649323000/womena-s-speed-skating-3000m-milano-cortina-2026-olympic-games-07-02-2026.jpeg,2026-02-09T16:06:36Z,,"Der italienische Wintersport wird seit jeher vom Norden dominiert. Die überwältigende Mehrheit des Olympiateams stammt aus den Regionen in oder am Fuße der Alpen: aus Südtirol, dem Trentino, Venetien… [+6356 chars]",,de,'Kälte'
https://versicherungswirtschaft-heute.de/maerkte-und-vertrieb/2026-02-10/versicherer-muessen-durch-wintersturm-fern-kaum-zittern-die-kunden-schon/,https://versicherungswirtschaft-heute.de/maerkte-und-vertrieb/2026-02-10/versicherer-muessen-durch-wintersturm-fern-kaum-zittern-die-kunden-schon/,0,versicherungswirtschaft-heute.de,Versicherer müssen durch Wintersturm „Fern“ kaum zittern – die Kunden schon,"Der Wintersturm „Fern“, der weite Teile der USA lahmgelegt hatte, ist für die Schaden- und Unfallversicherer zwar kostspielig, aber nicht so schadenträchtig, dass auch die Rückversicherer einspringen müssen. Zu dieser Einschätzung kommt die Ratingagentur Fitc…",https://versicherungswirtschaft-heute.de/wp-60d20-content/uploads/2026/02/55062001666_aeab17494e_o-1200x800.jpg,2026-02-09T23:00:00Z,,"Mindestens 16 US-Bundesstaaten und die Hauptstadt Washington, D.C. riefen in Folge des Wintersturms Fern den Notstand aus. Millionen Menschen waren von massivem Schneefall, Eisregen und extremer Kält… [+674 chars]",,de,'Kälte'
https://www.spektrum.de/news/wetter-weltweit-fuenftwaermster-januar-der-geschichte/2309154,https://www.spektrum.de/news/wetter-weltweit-fuenftwaermster-januar-der-geschichte/2309154,0,www.spektrum.de,Wetter im Januar 2026: Weltweit fünftwärmster Januar der Geschichte,Teile Deutschlands hatten im Januar mit Schnee und Eis zu kämpfen. Doch weltweit war der erste Monat des Jahres der fünftwärmste seit Beginn der Messungen.,https://static.spektrum.de/fm/912/f1920x1080/GettyImages-942583684.jpg,2026-02-10T03:00:00Z,,"Dieser Inhalt wurde automatisch von der Deutschen Presse-Agentur (dpa) übernommen und von Spektrum.de nicht redaktionell bearbeitet.
Auch wenn weite Teile der Nordhalbkugel eine Kältewelle erlebten,… [+939 chars]",,de,'Kälte'
https://www.stern.de/panorama/wissen/kontrast-zwischen-nord-und-sued--weltweit-fuenftwaermster-januar-der-geschichte-37121734.html,https://www.stern.de/panorama/wissen/kontrast-zwischen-nord-und-sued--weltweit-fuenftwaermster-januar-der-geschichte-37121734.html,0,www.stern.de,Kontrast zwischen Nord und Süd: Weltweit fünftwärmster Januar der Geschichte,Teile Deutschlands hatten im Januar mit Schnee und Eis zu kämpfen. Doch weltweit war der erste Monat des Jahres der fünftwärmste seit Beginn der Messungen.,https://image.stern.de/37121736/t/t5/v1/w1440/r1.7778/-/10--awwkzyvjczv5axs2048jpeg---0e7b87b3eb2e1119.jpg,2026-02-10T03:00:06Z,,"Kopiere den aktuellen Link
Zur Merkliste hinzufügen
Teile Deutschlands hatten im Januar mit Schnee und Eis zu kämpfen. Doch weltweit war der erste Monat des Jahres der fünftwärmste seit Beginn der … [+2452 chars]",,de,'Kälte'
https://www.tagesspiegel.de/wissen/kontrast-zwischen-nord-und-sud-weltweit-funftwarmster-januar-der-geschichte-15234638.html,https://www.tagesspiegel.de/wissen/kontrast-zwischen-nord-und-sud-weltweit-funftwarmster-januar-der-geschichte-15234638.html,0,www.tagesspiegel.de,Kontrast zwischen Nord und Süd: Weltweit fünftwärmster Januar der Geschichte,Teile Deutschlands hatten im Januar mit Schnee und Eis zu kämpfen. Doch weltweit war der erste Monat des Jahres der fünftwärmste seit Beginn der Messungen.,https://www.tagesspiegel.de/images/15234637/alternates/BASE_16_9_W1400/1770692551000/weltweit-funftwarmster-januar-der-geschichte.jpeg,2026-02-10T03:02:31Z,,"Auch wenn weite Teile der Nordhalbkugel eine Kältewelle erlebten, so war der vergangene Monat weltweit der fünftwärmste bisher gemessene Januar. Die Durchschnittstemperatur lag bei 12,95 Grad Celsius… [+2335 chars]",,de,'Eis'
https://www.diepresse.com/20555561/weborn-wo-fitnessfreaks-und-karrierefrauen-entspannen,https://www.diepresse.com/20555561/weborn-wo-fitnessfreaks-und-karrierefrauen-entspannen,0,www.diepresse.com,Weborn: Wo Fitnessfreaks und Karrierefrauen entspannen [premium],"Im Sauna- und Eisbadeclub Weborn wird nicht nur geschwitzt, bei Partyaufgüssen soll auch die soziale Gesundheit auf ihre Kosten kommen. Das lockt Extremsportler wie Karrierefrauen an.",https://img.diepresse.com/public/incoming/vvdr82-jessica-halper-katharina-fojtl-weborn-studio/alternates/DPR_SOCIAL_MAGAZIN/Jessica%20Halper%20Katharina%20Fojtl%20Weborn%20Studio,2026-02-10T04:38:02Z,,"Sobald der erste Schöpfer Wasser auf die heißen Steine trifft, setzt die Musik ein. Rhythmische Klänge zu einer ruhigen Melodie, sanft genug, um Entspannung zuzulassen, aber dennoch energetisch. Schl… [+5495 chars]",,de,'Eis'
