index,url,valid,domain,title,description,image,published,archive,content,quote,language,keyword
https://www.freitag.de/autoren/der-freitag/krise-als-chance-wie-saehe-eine-oeko-soziale-waermewende-aus,https://www.freitag.de/autoren/der-freitag/krise-als-chance-wie-saehe-eine-oeko-soziale-waermewende-aus,0,www.freitag.de,Energie | Krise als Chance: Wie sähe eine öko-soziale Wärmewende aus?,"Wirklicher Wumms entstünde, wenn wir in der Krise nicht nur das Bestehende retten und bewahren wollten. Sondern die Transformation der Wärmeversorgung offensiv und gerecht angingen Die Sorgen und Nöte sind groß und berechtigt. Wie hoch kann ich die Heizung no…",https://www.freitag.de/autoren/der-freitag/krise-als-chance-wie-saehe-eine-oeko-soziale-waermewende-aus/@@images/social_image,2023-01-01T03:00:00Z,https://web.archive.org/web/20221221154604/https://www.freitag.de/autoren/der-freitag/krise-als-chance-wie-saehe-eine-oeko-soziale-waermewende-aus,Die Sorgen und Nöte sind groß und berechtigt. Wie hoch kann ich die Heizung noch drehen? Werde ich mich verschulden müssen oder vielleicht sogar frieren? Getrieben von explodierenden Energiekosten un… [+7438 chars],,de,'Heizung'
"https://www.computerwoche.de/a/so-unterschiedlich-fallen-im-winter-die-reichweitenverluste-aus,3613537?utm_source=Nach-Artikeltyp_1,30,119,124,125&utm_medium=RSS&utm_campaign=RSS-Feeds","https://www.computerwoche.de/a/so-unterschiedlich-fallen-im-winter-die-reichweitenverluste-aus,3613537?utm_source=Nach-Artikeltyp_1,30,119,124,125&utm_medium=RSS&utm_campaign=RSS-Feeds",0,www.computerwoche.de,E-Autos: So unterschiedlich fallen im Winter die Reichweitenverluste aus,Niedrige Außentemperaturen senken die Reichweite von E-Autos. Doch nicht bei allen Modellen gibt es gleich hohe Verluste.,https://images.computerwoche.de/bdb/3375820/640x360.jpg,2023-01-01T05:00:00Z,,"Foto: buffaloboy - shutterstock.com
Wer ein E-Autos besitzt, kennt das Problem: Niedrige Außentemperaturen senken die Reichweite. Der Grund dafür liegt in der Technik der Fahrzeuge begründet, so sor… [+1995 chars]",,de,'Heizung'
https://www.faz.net/aktuell/stil/mode-design/alpaka-wolle-waermt-im-winter-besonders-gut-18522306.html,https://www.faz.net/aktuell/stil/mode-design/alpaka-wolle-waermt-im-winter-besonders-gut-18522306.html,0,www.faz.net,Alpaka-Wolle wärmt im Winter besonders gut,Importiert aus Peru: Jannik Weich vertreibt Produkte aus Alpaka-Wolle in Europa. Bei extremer Kälte wärmt die Wolle und das Fell der Lasttiere besonders gut. Auch ökologisch punkten die Alpakas.,https://media1.faz.net/ppmedia/aktuell/gesellschaft/837713081/1.8522303/facebook_teaser/ideale-thermoeigenschaften-das.jpg,2023-01-01T13:15:57Z,https://web.archive.org/web/20230101142523/https://www.faz.net/aktuell/stil/mode-design/alpaka-wolle-waermt-im-winter-besonders-gut-18522306.html,"Viele verbinden Alpaka-Wolle mit den bunten Mützen, wie sie die Bauern in den peruanischen Anden tragen; die traten in Europa in den Siebzigerjahren ihren Siegeszug an, weil sie an den Ohren so schön… [+4327 chars]",,de,'Kälte'
https://www.freitag.de/autoren/nick-reimer/klimawandel-und-insekten-ohne-frost-gibts-hunger,https://www.freitag.de/autoren/nick-reimer/klimawandel-und-insekten-ohne-frost-gibts-hunger,0,www.freitag.de,Klimaerwärmung | Klimawandel und Insekten: Ohne Frost gibt's Hunger,"Insekten, denen es früher hierzulande zu kalt war, breiten sich jetzt auch durch die milden Winter aus. Manche Entwicklungen klingen skurril, andere sind lebensbedrohlich Neuerdings gibt es in Berlin-Schöneberg eine Population der Gottesanbeterin. Die Weibche…",https://www.freitag.de/autoren/nick-reimer/klimawandel-und-insekten-ohne-frost-gibts-hunger/@@images/social_image,2023-01-02T03:00:00Z,,"Neuerdings gibt es in Berlin-Schöneberg eine Population der Gottesanbeterin. Die Weibchen der Mantis religiosa, wie der wissenschaftliche Name der Fangschrecke lautet, werden bis zu acht Zentimeter g… [+1864 chars]",,de,'Winter'
https://orf.at/stories/3299874/,https://orf.at/stories/3299874/,0,orf.at,„Winterhitzewelle“ in Teilen Europas,"Der Jahreswechsel ist im Großteil Europas außergewöhnlich warm gewesen:  Europaweit verzeichneten Hunderte Wetterstationen Temperaturen, die es um diese Zeit noch nicht gegeben hat. Weil die Abweichungen von den typischen Temperaturen zu dieser Jahreszeit so …",https://ibs.orf.at/news?image=https%3A%2F%2Fassets.orf.at%2Fmims%2F2023%2F01%2F51%2Fcrops%2Fw%3D1200%2Ch%3D630%2Cq%3D75%2F1628243_master_597551_wetter_winter_waerme_1_a.jpg%3Fs%3D852e39dd6da716eb0ef7c23d2b84e043fcdb52ca,2023-01-02T20:07:38Z,,"Neue nationale Temperaturrekorde für den Monat Jänner gab es etwa in den Niederlanden, Dänemark, Tschechien, Lettland und Litauen. In Belarus wurden erstmals in einem Jänner 16,4 Grad gemessen, der b… [+2746 chars]",,de,'Temperatur unter Null'
