index,url,valid,domain,title,description,image,published,archive,content,quote,language,keyword
https://www.diepresse.com/20054009/austrians-im-us-sport-von-ball-legionaeren-puck-pionieren-bis-golf-solist-straka,https://www.diepresse.com/20054009/austrians-im-us-sport-von-ball-legionaeren-puck-pionieren-bis-golf-solist-straka,0,www.diepresse.com,"„Austrians“ im US-Sport: Von Ball-Legionären, Puck-Pionieren bis Golf-Solist Straka [premium]","Rot-weiß-rote Spurensuche jenseits des Atlantik: Welche heimischen Sportler zeigen in Basketball, Eishockey, Fußball oder Golf auf?",https://img.diepresse.com/public/incoming/mfd33a-BASKETBALL-NBA-TOR-BKN/alternates/DPR_SOCIAL_NACHRICHTEN/BASKETBALL-NBA-TOR-BKN,2025-09-07T07:00:55Z,,Footballer Bernhard Raimann zählt zu den bestbezahlten Profis in der hochkarätigen NFL. Auch in den anderen US-Sportligen sorgen Aktive aus Österreich für Schlagzeilen. Ein Überblick über Legionäre i… [+8417 chars],,de,'Eis'
https://www.kino.de/stars/eis-am-stiel-war-kult-so-sehen-zachi-benny-johnny-heute-aus--01K1GAQP52WK5N23F7GVHKZ7D1,https://www.kino.de/stars/eis-am-stiel-war-kult-so-sehen-zachi-benny-johnny-heute-aus--01K1GAQP52WK5N23F7GVHKZ7D1,0,www.kino.de,"""Eis am Stiel"" war Kult: So sehen Zachi, Benny & Johnny heute aus",Die Stars der Kult-Reihe haben sich mit der Zeit vor der Kamera rar gemacht.,https://www.kino.de//static.kino.de/5f/d3/3c/50f4452903d0e3fe9a0236d5e9_ZmMgODAwMDgwMDBmZmZmIDEyMDAgNjI3AzUzNTQyM2VlMDZl.jpeg,2025-09-07T07:06:00Z,,"1979 landete der israelische Regisseur Boaz Davidson mit dem ersten Eis am Stiel-Film einen Überraschungserfolg, der bis 1988 stolze sieben Fortsetzungen nach sich zog. Zwar wurden die Geschichten de… [+196 chars]",,de,'Eis'
https://www.n-tv.de/politik/Was-wird-eigentlich-aus-dem-Heizungsgesetz-article26016114.html,https://www.n-tv.de/politik/Was-wird-eigentlich-aus-dem-Heizungsgesetz-article26016114.html,0,www.n-tv.de,Warten auf schwarz-rote Reform: Was wird eigentlich aus dem Heizungsgesetz?,"Vor zwei Jahren beschließt die Ampel das sogenannte Heizungsgesetz. Doch die Regeln sind umstritten, im Wahlkampf wirbt die Union mit der Abschaffung und schreibt das auch in den schwarz-roten Koalitionsvertrag hinein. Und nun?",https://www.n-tv.de/img/incoming/crop26016217/3021324220-cImg_16_9-w1200/423583711.jpg,2025-09-07T11:21:53Z,,Das sogenannte Heizungsgesetz ist eines der heikelsten Vorhaben der schwarz-roten Koalition. Im Koalitionsvertrag kündigen Union und SPD die Abschaffung an. Inzwischen scheint klar: Es läuft eher auf… [+7655 chars],,de,'Heizung'
https://www.tagesschau.de/inland/innenpolitik/heizungsgesetz-zwei-jahre-koalition-100.html,https://www.tagesschau.de/inland/innenpolitik/heizungsgesetz-zwei-jahre-koalition-100.html,0,www.tagesschau.de,Was wird aus dem Heizungsgesetz?,Vor zwei Jahren wurde das Gebäudeenergiegesetz beschlossen - besser bekannt als Heizungsgesetz. Die Kritik daran riss nie ab. Schwarz-Rot will die Vorgaben ändern. Was bedeutet das für Eigentümer?,https://images.tagesschau.de/image/43eb11a0-0839-44cd-ac77-23b811d730b0/AAABldpMyu0/AAABmKJZ-0g/16x9-big/heizungstausch-102.jpg?width=1280,2025-09-07T13:59:50Z,,"Stand: 07.09.2025 15:59 Uhr
Vor zwei Jahren wurde das Gebäudeenergiegesetz beschlossen - besser bekannt als Heizungsgesetz. Die Kritik daran riss nie ab. Schwarz-Rot will die Vorgaben ändern. Was be… [+5691 chars]",,de,'Heizung'
https://www.sueddeutsche.de/sport/erc-ingolstadt-zug-lausanne-chl-li.3308959,https://www.sueddeutsche.de/sport/erc-ingolstadt-zug-lausanne-chl-li.3308959,0,www.sueddeutsche.de,Eishockey: Angenehme Reise durch die Schweiz,"Der ERC Ingolstadt gewinnt in der Champions Hockey League seine Partien in Zug und Lausanne. Mit insgesamt zehn Treffern schieben sie umgehend die Fragezeichen in Sachen Offensive beiseite, die nach den beiden Auftaktniederlagen aufkamen.",https://www.sueddeutsche.de/2025/09/07/71b4ee09-a416-46c3-af79-71a307477179.jpg?q=60&fm=webp&width=1200&rect=0%2C156%2C3000%2C1687,2025-09-07T15:04:00Z,,Der ERC Ingolstadt hat am vergangenen Wochenende auch die Annehmlichkeiten der überschaubaren eidgenössischen Reisestrecken kennengelernt. Am Freitagabend waren die Oberbayern beim EV Zug in der Zent… [+4079 chars],,de,'Eis'
https://www.zeit.de/news/2025-09/08/frost-trockenheit-hoehere-kosten-tannenbaeume-werden-teurer,https://www.zeit.de/news/2025-09/08/frost-trockenheit-hoehere-kosten-tannenbaeume-werden-teurer,0,www.zeit.de,"Weihnachtsbäume: Frost, Trockenheit, höhere Kosten: Tannenbäume werden teurer","Hier finden Sie Informationen zu dem Thema „Weihnachtsbäume“. Lesen Sie jetzt „Frost, Trockenheit, höhere Kosten: Tannenbäume werden teurer“.",https://img.zeit.de/news/2025-09/08/frost-trockenheit-hoehere-kosten-tannenbaeume-werden-teurer-image-group/wide__1300x731,2025-09-08T03:00:50Z,,"Frost und Trockenheit machen den angehenden Weihnachtsbäumen zu schaffen. Wenn Niederschlag fehle, litten vor allem junge Pflanzen, die noch kein ausgeprägtes Wurzelwerk hätten, sagte Lars Zimmermann… [+2932 chars]",,de,'Frost'
https://www.tagesspiegel.de/wirtschaft/weihnachtsbaume-frost-trockenheit-hohere-kosten-tannenbaume-werden-teurer-14291345.html,https://www.tagesspiegel.de/wirtschaft/weihnachtsbaume-frost-trockenheit-hohere-kosten-tannenbaume-werden-teurer-14291345.html,0,www.tagesspiegel.de,"Weihnachtsbäume: Frost, Trockenheit, höhere Kosten: Tannenbäume werden teurer",Ein Tannenbaum gehört für viele Menschen zu Weihnachten wie Geschenke und Festessen. Doch dieses Jahr dürften die Bäumchen vielerorts etwas teurer sein.,https://www.tagesspiegel.de/images/14291342/alternates/BASE_16_9_W1400/1757300541000/weihnachtsbaum-plantage.jpeg,2025-09-08T03:02:21Z,,"Frost und Trockenheit machen den angehenden Weihnachtsbäumen zu schaffen. Wenn Niederschlag fehle, litten vor allem junge Pflanzen, die noch kein ausgeprägtes Wurzelwerk hätten, sagte Lars Zimmermann… [+2989 chars]",,de,'Frost'
https://www.zeit.de/news/2025-09/08/gas-proteste-neubauer-sieht-hindernis-fuer-energiewende,https://www.zeit.de/news/2025-09/08/gas-proteste-neubauer-sieht-hindernis-fuer-energiewende,0,www.zeit.de,Klimacamp: Gas-Proteste - Neubauer sieht Hindernis für Energiewende,Hier finden Sie Informationen zu dem Thema „Klimacamp“. Lesen Sie jetzt „Gas-Proteste - Neubauer sieht Hindernis für Energiewende“.,https://img.zeit.de/news/2025-09/08/gas-proteste-neubauer-sieht-hindernis-fuer-energiewende-image-group/wide__1300x731,2025-09-08T05:54:24Z,,Die Klimaaktivistin Luisa Neubauer hat die Erdgasförderung in der Nordsee nahe der Insel Borkum als Hindernis für die Energiewende kritisiert. «Das Borkum-Gas macht kaum einen Unterschied für die Ver… [+2471 chars],,de,'Gas'
https://science.orf.at/stories/3231392/,https://science.orf.at/stories/3231392/,0,science.orf.at,Was Gletschereis über das Klima verrät,"Aus den Eismassen im Hochgebirge werden wichtige Daten für die Klimaforschung gewonnen – etwa über Entwicklung der schwindenden Gletscher in einem wärmer werdenden Klimasystem. Mit einer neuen Technik sollen diese Prognosen nun verbessert werden, wie Fachleut…",https://ibs.orf.at/science?image=https%3A%2F%2Ftubestatic.orf.at%2Fmims%2F2025%2F31%2F84%2Fcrops%2Fw%3D1200%2Ch%3D627%2Cq%3D75%2F2719014_master_1046984_warmer_sommer_setzte_oesterreichs_groesstem_gletscher_zu_.jpg%3Fs%3D557ca5e729d4903c40aa12b723b5996e6b406e0d,2025-09-08T06:03:40Z,,Gletscher sind empfindlich auf aktuelle Veränderungen im Klima daher ihr Ruf als Frühwarnsystem das Eis sagt aber auch viel über die Vergangenheit aus. Eisbohrkerne sind eine wichtige Datenquelle in … [+6684 chars],,de,'Eis'
https://taz.de/Tannenbaeume-werden-teurer/!6112297/,https://taz.de/Tannenbaeume-werden-teurer/!6112297/,0,taz.de,"Tannenbäume werden teurer: Frost, Trockenheit, höhere Kosten",Ein Tannenbaum gehört für viele Menschen zu Weihnachten wie Geschenke und Festessen. Doch dieses Jahr dürften die Bäumchen vielerorts teurer sein.,https://taz.de/picture/7916546/1200/39183292-1.jpeg,2025-09-08T06:34:00Z,,Ein Tannenbaum gehört für viele Menschen zu Weihnachten wie Geschenke und Festessen. Doch dieses Jahr dürften die Bäumchen vielerorts teurer sein. mehr...,,de,'Frost'
https://www.sueddeutsche.de/leben/kinder-zucker-suessigkeiten-li.3303184,https://www.sueddeutsche.de/leben/kinder-zucker-suessigkeiten-li.3303184,0,www.sueddeutsche.de,Familien-Newsletter: Der erste Zucker,"Als die Tochter unseres Autoren ihr erstes Eis isst, brechen alle Dämme. Über die ewige Frage, wie man es als Elternteil mit dem Zucker hält.",https://www.sueddeutsche.de/2022/06/22/06fa4506-c7b2-4312-9ede-a655c84e2e08.jpeg?q=60&fm=webp&width=1200&rect=0%2C0%2C1381%2C777,2025-09-08T06:37:09Z,,"Liebe Leserin, lieber Leser,
vor Kurzem ist meine Tochter zwei geworden. Naja, wenn es nach ihr ginge, eigentlich schon früher. Wochen vor ihrem Geburtstag war sie felsenfest davon überzeugt, dass s… [+2277 chars]",,de,'Eis'
https://taz.de/Proteste-gegen-Gasbohrung-in-der-Nordsee/!6112298/,https://taz.de/Proteste-gegen-Gasbohrung-in-der-Nordsee/!6112298/,0,taz.de,Proteste gegen Gasbohrung in der Nordsee: Neubauer sieht Hindernis für Energiewende,Klima-Aktivist*innen demonstrieren gegen die Erdgasförderung nahe Borkum. Für Luisa Neubauer ist klar: Das Gas hilft der Versorgungssicherheit nicht.,https://taz.de/picture/7916550/1200/39183859-1.jpeg,2025-09-08T06:48:00Z,,Klima-Aktivist*innen demonstrieren gegen die Erdgasförderung nahe Borkum. Für Luisa Neubauer ist klar: Das Gas hilft der Versorgungssicherheit nicht. mehr...,,de,'Gas'
https://www.stern.de/familie/igelhaus-fuer-herbst-und-winter--so-helfen-sie-schutzlosen-tieren-30833408.html,https://www.stern.de/familie/igelhaus-fuer-herbst-und-winter--so-helfen-sie-schutzlosen-tieren-30833408.html,0,www.stern.de,Sicherer Unterschlupf: Ein Igelhaus im Garten? So helfen Sie den Tieren durch den Winter,Im Herbst sieht man Igel auf der Suche nach einem Winterquartier. Durch fehlende Wald- und Wiesenflächen finden die Tiere kaum Rückzugsmöglichkeiten. Vielleicht möchten Sie helfen?,https://image.stern.de/30833412/t/_r/v6/w1440/r1.7778/-/igelhaus.jpg,2025-09-08T08:56:00Z,,"Kopiere den aktuellen Link
Zur Merkliste hinzufügen
Im Herbst sieht man Igel auf der Suche nach einem Winterquartier. Durch fehlende Wald- und Wiesenflächen finden die Tiere kaum Rückzugsmöglichkei… [+5257 chars]",,de,'Schnee'
https://www.bild.de/sport/fussball/uli-hoeness-rief-marcel-reif-zu-hause-an-68be99b64c3a8d706ef421f5,https://www.bild.de/sport/fussball/uli-hoeness-rief-marcel-reif-zu-hause-an-68be99b64c3a8d706ef421f5,0,www.bild.de,Bayern-Boss und TV-Ikone - Hoeneß rief Reif zu Hause an!,"Wenn Uli Hoeneß seinen FC Bayern München ungerecht behandelt sieht, glühen die Telefonleitungen! Das musste auch schon TV-Experte Marcel Reif erleben.","https://images.bild.de/68be99b64c3a8d706ef421f5/c319b8e088496dc21a1dc137e1ea135f-landscape,acabf86b?w=1280",2025-09-08T09:07:51Z,,"Mehr zum Video anzeigen 
Wenn Uli Hoeneß seinen FC Bayern München ungerecht behandelt sieht, glühen die Telefonleitungen! Das musste auch schon TV-Experte Marcel Reif erleben.
Quelle: BILD08.09.202… [+12 chars]",,de,'Reif'
https://www.bild.de/sport/fussball/jetzt-hier-reif-ist-live-gucken-dfb-team-zwischen-blamage-und-zittersieg-68be78620755415a0da97295,https://www.bild.de/sport/fussball/jetzt-hier-reif-ist-live-gucken-dfb-team-zwischen-blamage-und-zittersieg-68be78620755415a0da97295,0,www.bild.de,Jetzt HIER „Reif ist live“ gucken - DFB-Team zwischen Blamage und Zittersieg,"„Reif ist live“, der BILD-Talk mit Kommentatoren-Legende Marcel Reif.","https://images.bild.de/68be78620755415a0da97295/d8103da858c28225557d8465087984b9,a836af86?w=1280",2025-09-08T09:30:49Z,,"Mehr zum Video anzeigen 
Reif ist live, der BILD-Talk mit Kommentatoren-Legende Marcel Reif. 
Quelle: BILD08.09.2025 - 11:30 Uhr",,de,'Reif'
https://www.waz.de/ratgeber-wissen/energie/article405472831/heizung-austauschpflicht-verbot-alter.html,https://www.waz.de/ratgeber-wissen/energie/article405472831/heizung-austauschpflicht-verbot-alter.html,0,www.waz.de,Austauschpflicht nach 30 Jahren: Diese Heizungen betrifft es,Für eine Gas- oder Ölheizung kann nach 30 Jahren eine Austauschpflicht gelten. Jedes Jahr ist ein weiterer Jahrgang betroffen. es gibt aber Ausnahmen.,https://img.sparknews.funkemedien.de/404446238/404446238_1704877865_v16_9_1600.jpeg,2025-09-08T09:40:00Z,,<ul><li>Das Gebäudeenergiegesetz sieht nach 30 Jahren ein Betriebsverbot für bestimmte Heizungen vor.</li><li>Seit diesem Jahr gilt das Betriebsverbot für einen weiteren Jahrgang alter Gas- und Ölhei… [+5045 chars],,de,'Heizung'
https://www.bild.de/sport/fussball/100-von-100-neuer-leverkusen-trainer-im-tv-verraten-68bea72f0755415a0da976a7,https://www.bild.de/sport/fussball/100-von-100-neuer-leverkusen-trainer-im-tv-verraten-68bea72f0755415a0da976a7,0,www.bild.de,„100 von 100“ - Neuer Leverkusen-Trainer im TV verraten!,Wir ER neuer Leverkusen-Trainer? Marcel Reif ist sich sicher.,"https://images.bild.de/68bea72f0755415a0da976a7/d5be86fb0e7d6ca7b4b137200c6e3c97,b67e426c?w=1280",2025-09-08T09:59:37Z,,"Mehr zum Video anzeigen 
Wir ER neuer Leverkusen-Trainer? Marcel Reif ist sich sicher.
Quelle: BILD08.09.2025 - 11:59 Uhr",,de,'Reif'
https://www.sueddeutsche.de/politik/saudi-arabien-grossprojekte-skigebiet-verzoegerung-li.3307318,https://www.sueddeutsche.de/politik/saudi-arabien-grossprojekte-skigebiet-verzoegerung-li.3307318,0,www.sueddeutsche.de,Saudi-Arabien: Wo bleibt der Schnee?,Kronprinz Mohammed bin Salman will sein Land mit riesigen Projekten auf Zukunft trimmen. Zum Beispiel mit einem künstlichen XXL-Skigebiet. Doch nun holt die Realität seine Träume ein.,https://www.sueddeutsche.de/2025/09/08/e5d46c50-be20-414f-bc2c-1bb59e498df7.jpg?q=60&fm=webp&width=1200&rect=773%2C0%2C868%2C488,2025-09-08T10:17:36Z,,Kronprinz Mohammed bin Salman will sein Land mit riesigen Projekten auf Zukunft trimmen. Zum Beispiel mit einem künstlichen XXL-Skigebiet. Doch nun holt die Realität seine Träume ein.Morgens auf der … [+280 chars],,de,'Schnee'
https://www.tagesschau.de/wissen/klima/eisberg-schmilzt-100.html,https://www.tagesschau.de/wissen/klima/eisberg-schmilzt-100.html,0,www.tagesschau.de,Südatlantik: Früher größter Eisberg der Welt verschwindet langsam,Noch vor wenigen Monaten wog der Eisberg A23a fast eine Billion Tonnen und war in etwa so groß wie die Insel Mallorca. Nun fällt er in sich zusammen und könnte innerhalb von Wochen ganz verschwinden.,https://images.tagesschau.de/image/f812d93f-e58d-44c0-a00c-3dab260fcead/AAABmSlim84/AAABmKJZ-0g/16x9-big/antarktis-eisberg-102.jpg?width=1280,2025-09-08T13:48:57Z,,"Stand: 08.09.2025 15:48 Uhr
Noch vor wenigen Monaten wog der Eisberg A23a fast eine Billion Tonnen und war in etwa so groß wie die Insel Mallorca. Nun fällt er in sich zusammen und könnte innerhalb … [+4791 chars]",,de,'Eis'
https://www.stern.de/familie/tiere/vogelhaus-zum-aufhaengen--so-helfen-sie-wildvoegeln-bei-der-futtersuche-31632094.html,https://www.stern.de/familie/tiere/vogelhaus-zum-aufhaengen--so-helfen-sie-wildvoegeln-bei-der-futtersuche-31632094.html,0,www.stern.de,Futterstation: Sie wollen ein Vogelhaus aufhängen? Das sollten Sie im Vorfeld darüber wissen,"Meise, Spatz und Rotkehlchen werden es Ihnen danken, wenn Sie sie bei der Futtersuche im Winter mit einem Vogelhaus unterstützen. Was Sie dabei beachten müssen, verraten wir Ihnen.",https://image.stern.de/31632096/t/mw/v4/w1440/r1.7778/-/vogelhaus-zum-aufhaengen.jpg,2025-09-08T13:52:00Z,,"Kopiere den aktuellen Link
Zur Merkliste hinzufügen
Meise, Spatz und Rotkehlchen werden es Ihnen danken, wenn Sie sie bei der Futtersuche im Winter mit einem Vogelhaus unterstützen. Was Sie dabei b… [+5557 chars]",,de,'Nässe'
https://www.lawblog.de/archives/2025/09/08/richter-ordnet-durchsuchung-ohne-antrag-an/,https://www.lawblog.de/archives/2025/09/08/richter-ordnet-durchsuchung-ohne-antrag-an/,0,www.lawblog.de,Richter ordnet Durchsuchung ohne Antrag an,"Manchmal ist das Eis sehr dünn, auf dem die Gewaltenteilung in Deutschland (aka: Rechtsstaat) wandelt. Was als Routineermittlung wegen Graffitis begann, entwickelt sich zu einem Lehrstück über die Grenzen richterlicher Befugnisse – mit einem bemerkenswerten I…",https://www.lawblog.de/wp-content/themes/lawblog-neu/logo.png,2025-09-08T16:01:11Z,,"Manchmal ist das Eis sehr dünn, auf dem die Gewaltenteilung in Deutschland (aka: Rechtsstaat) wandelt. Was als Routineermittlung wegen Graffitis begann, entwickelt sich zu einem Lehrstück über die Gr… [+2511 chars]",,de,'Eis'
https://www.welt.de/sport/eishockey/article68b9c37ff1375c767b7fbe08/Eishockey-Das-Dresden-Maerchen.html,https://www.welt.de/sport/eishockey/article68b9c37ff1375c767b7fbe08/Eishockey-Das-Dresden-Maerchen.html,0,www.welt.de,Das Dresden-Märchen,Die Dresdner Eislöwen standen kurz vor der Insolvenz. Jetzt spielt der Verein erstmals in der Deutschen Eishockey Liga. Die Euphorie ist riesig – auch weil sich der Verein in der Stadt clever gegen eine scheinbar erdrückende Konkurrenz behauptet.,https://images.welt.de/68b9c37ff1375c767b7fbe08/c936de41f43ea3bb0836e2c8701f0f0a-master/ci16x9-w1200/ger-ravensburg-towerstars-vs-dresdner-eisloewen-eishockey-del2-spielzeit-2024-2025-playoff-finale-spiel-7-29-04-25,2025-09-09T06:38:50Z,,Die Dresdner Eislöwen standen kurz vor der Insolvenz. Jetzt spielt der Verein erstmals in der Deutschen Eishockey Liga. Die Euphorie ist riesig auch weil sich der Verein in der Stadt clever gegen ein… [+6204 chars],,de,'Eis'
https://www.zeit.de/news/2025-09/09/obstbauern-erwarten-nach-frostjahr-wieder-normale-apfelernte,https://www.zeit.de/news/2025-09/09/obstbauern-erwarten-nach-frostjahr-wieder-normale-apfelernte,0,www.zeit.de,Agrar: Obstbauern erwarten nach Frostjahr wieder normale Apfelernte,Hier finden Sie Informationen zu dem Thema „Agrar“. Lesen Sie jetzt „Obstbauern erwarten nach Frostjahr wieder normale Apfelernte“.,https://img.zeit.de/news/2025-09/09/obstbauern-erwarten-nach-frostjahr-wieder-normale-apfelernte-image-group/wide__1300x731,2025-09-09T11:20:53Z,,Nach verheerenden Ernteausfällen im vergangenen Jahr blicken die Thüringer Obstbauern optimistischer auf die aktuelle Apfelernte. «Es geht wieder bergauf. Ich würde es dieses Jahr als normale Ernte b… [+1847 chars],,de,'Frost'
"https://www.br.de/nachrichten/bayern/betretung-lebensgefaehrlich-eiskapelle-am-watzmann-eingestuerzt,UwJdAx3","https://www.br.de/nachrichten/bayern/betretung-lebensgefaehrlich-eiskapelle-am-watzmann-eingestuerzt,UwJdAx3",0,www.br.de,Folge des Klimawandels: Eiskapelle am Watzmann eingestürzt,"Ein Hohlraum umgeben von Eis: Das war die Eiskapelle an Watzmann in den Berchtesgadener Alpen. Jetzt ist die bekannte Naturattraktion zerstört – eine Folge des Klimawandels. Fachleute warnen nun davor, das Gebiet zu betreten, es gilt Lebensgefahr.",https://img.br.de/458228e8-0738-40a5-aadb-6c2f6180e2a4.jpeg?q=80&rect=0%2C344%2C2330%2C1310&w=1600&h=900,2025-09-09T18:00:34Z,,"Neubildung der Eishöhle ist möglich, aber nicht sicher
Nationalparkleiter Roland Baier spricht von einem ""schockierenden Verlust"" und einem ""sichtbaren Beleg für den Klimawandel"". Er warnt zugleich,… [+2045 chars]",,de,'Eis'
https://www.morgenpost.de/blogs-kolumnen/article409924406/indoor-radeln-ploetzlich-steht-das-fahrrad-im-wohnzimmer.html,https://www.morgenpost.de/blogs-kolumnen/article409924406/indoor-radeln-ploetzlich-steht-das-fahrrad-im-wohnzimmer.html,0,www.morgenpost.de,Indoor-Radeln: Plötzlich steht das Fahrrad im Wohnzimmer,"Unsere Autorin beobachtet, wie ihre Sportausrüstung weiterwächst – jetzt um einen Rollentrainer fürs Radfahren im Winter. Was er bringen soll und warum sich der Kauf im Sommer lohnt.",https://img.sparknews.funkemedien.de/409927925/409927925_1757238971_v16_9_1600.jpeg,2025-09-10T04:00:00Z,,"Wer sparen will, kauft am besten antizyklisch. Das gilt für Winterkleidung, Gartenmöbel oder auch: für Indoor Fahrrad-Trainer. In die Geräte werden Rennräder eingespannt, um das Radtraining auch bei … [+3667 chars]",,de,'Winter'
https://www.bild.de/sport/fussball/reif-wendet-sich-direkt-an-bayern-boss-nicht-boese-sein-aber-68c27f1bd265e67995afbcb7,https://www.bild.de/sport/fussball/reif-wendet-sich-direkt-an-bayern-boss-nicht-boese-sein-aber-68c27f1bd265e67995afbcb7,0,www.bild.de,"Reif wendet sich direkt an Bayern-Boss - „Nicht böse sein, aber ...“",Ist Ihnen das bei der Aussage vom Bayern-Boss auch aufgefallen?,"https://images.bild.de/68c27f1bd265e67995afbcb7/b8a734d6bd4015c64695164204d5ea65-landscape,e6321195?w=1280",2025-09-11T11:24:03Z,,"Mehr zum Video anzeigen 
Ist Ihnen das bei der Aussage vom Bayern-Boss auch aufgefallen?
Quelle: BILD11.09.2025 - 13:24 Uhr",,de,'Reif'
https://www.zeit.de/news/2025-09/12/radon-gemessen-raeume-von-schule-vorsorglich-geschlossen,https://www.zeit.de/news/2025-09/12/radon-gemessen-raeume-von-schule-vorsorglich-geschlossen,0,www.zeit.de,Radioaktives Gas: Radon gemessen - Räume von Schule vorsorglich geschlossen,Hier finden Sie Informationen zu dem Thema „Radioaktives Gas“. Lesen Sie jetzt „Radon gemessen - Räume von Schule vorsorglich geschlossen“.,https://img.zeit.de/news/2025-09/12/radon-gemessen-raeume-von-schule-vorsorglich-geschlossen-image-group/wide__1300x731,2025-09-12T06:58:08Z,,Kurz vor dem Schulstart: Wegen erhöhter Radon-Werte in einer Schule in Vaihingen/Enz (Kreis Ludwigsburg) sind Räume im Keller für den Schulbetrieb vorsorglich geschlossen worden. Das teilte die Stadt… [+638 chars],,de,'Gas'
https://www.diepresse.com/20091398/ein-garten-auf-der-fensterbank-wie-aromapflanzen-den-winter-in-der-wohnung-ueberdauern,https://www.diepresse.com/20091398/ein-garten-auf-der-fensterbank-wie-aromapflanzen-den-winter-in-der-wohnung-ueberdauern,0,www.diepresse.com,Ein Garten auf der Fensterbank: Wie Aromapflanzen den Winter in der Wohnung überdauern [premium],Die Online-Ausgabe der österreichischen Tageszeitung Die Presse.,https://img.diepresse.com/public/incoming/s0ow6p-Sauerklee/alternates/DPR_SOCIAL_NACHRICHTEN/Sauerklee,2025-09-13T14:15:55Z,,"Noch kann man draußen aus dem Vollen schöpfen und in aromatischem Allerlei schwel­gen. Die Petersilie bedankt sich für die kühleren Tage mit regem Wachstum, der Schnittlauch ist unverwüstlich, um Sal… [+3802 chars]",,de,'Frost'
https://www.zeit.de/news/2025-09/14/kleiner-hsv-mutmacher-nach-0-5-bis-zum-ende-gas-gegeben,https://www.zeit.de/news/2025-09/14/kleiner-hsv-mutmacher-nach-0-5-bis-zum-ende-gas-gegeben,0,www.zeit.de,"Heftige Abfuhr beim FC Bayern: Kleiner HSV-Mutmacher nach 0:5 - ""Bis zum Ende Gas gegeben""","Hier finden Sie Informationen zu dem Thema „Heftige Abfuhr beim FC Bayern“. Lesen Sie jetzt „Kleiner HSV-Mutmacher nach 0:5 - ""Bis zum Ende Gas gegeben""“.",https://img.zeit.de/news/2025-09/14/kleiner-hsv-mutmacher-nach-0-5-bis-zum-ende-gas-gegeben-image-group/wide__1300x731,2025-09-14T03:30:40Z,,Trotz der 0:5-Klatsche in München und dem Abrutschen auf den vorletzten Tabellenplatz bemüht sich der Hamburger SV um Optimismus. Trainer Merlin Polzin und seine Fußballer klammern sich an die zweite… [+2089 chars],,de,'Gas'
https://www.diepresse.com/20098770/alternative-heizung-solar-luftkollektoren-fuer-hallen-bueros-und-ferienhaeuser,https://www.diepresse.com/20098770/alternative-heizung-solar-luftkollektoren-fuer-hallen-bueros-und-ferienhaeuser,0,www.diepresse.com,"Alternative Heizung: Solar-Luftkollektoren für Hallen, Büros und Ferienhäuser [premium]","Noch sind Solar-Luftkollektoren eine Nische, doch für bestimmte Gebäude können sie Vorteile bringen. Wo sich die Technologie lohnt und wo nicht.",https://img.diepresse.com/public/incoming/ibnuam-GettyImages-165051020.jpg/alternates/DPR_SOCIAL_NACHRICHTEN/GettyImages-165051020.jpg,2025-09-15T08:46:26Z,,"Um aus Sonnenstrahlen Wärme zu gewinnen, sind grundsätzlich drei Dinge vonnöten: ein Solarspeicher, eine Steuerungseinheit und Solarkollektoren. Die Solarkollektoren dienen zur Umwandlung von Sonnens… [+5003 chars]",,de,'Heizung'
