index,url,valid,domain,title,description,image,published,archive,content,quote,language,keyword
https://www.zeit.de/news/2026-02/04/schnee-und-glaette-in-berlin-und-brandenburg-erwartet,https://www.zeit.de/news/2026-02/04/schnee-und-glaette-in-berlin-und-brandenburg-erwartet,0,www.zeit.de,Wetter: Schnee und Glätte in Berlin und Brandenburg erwartet,Hier finden Sie Informationen zu dem Thema „Wetter“. Lesen Sie jetzt „Schnee und Glätte in Berlin und Brandenburg erwartet“.,https://img.zeit.de/news/2026-02/04/schnee-und-glaette-in-berlin-und-brandenburg-erwartet-image-group/wide__1300x731,2026-02-04T04:56:16Z,,In Berlin und Brandenburg sind Schnee und Temperaturen über dem Gefrierpunkt in Sicht. Laut Deutschem Wetterdienst (DWD) ist es am Mittwoch stark bewölkt bei Höchsttemperaturen von -6 bis 1 Grad. In … [+578 chars],,de,'Schnee'
https://www.zeit.de/news/2026-02/04/winterwetter-bremst-nahverkehr-wo-pendler-geduld-brauchen,https://www.zeit.de/news/2026-02/04/winterwetter-bremst-nahverkehr-wo-pendler-geduld-brauchen,0,www.zeit.de,Glätte und Schnee: Winterwetter bremst Nahverkehr – Wo Pendler Geduld brauchen,Hier finden Sie Informationen zu dem Thema „Glätte und Schnee“. Lesen Sie jetzt „Winterwetter bremst Nahverkehr – Wo Pendler Geduld brauchen“.,https://img.zeit.de/news/2026-02/04/winterwetter-bremst-nahverkehr-wo-pendler-geduld-brauchen-image-group/wide__1300x731,2026-02-04T06:00:07Z,,"Wer mit Bus oder Regionalbahn in Niedersachsen unterwegs ist, braucht wegen des Winterwetters Geduld. Fahrgäste müssen mit Verzögerungen oder Ausfällen im Linienverkehr rechnen, wie mehrere Busuntern… [+979 chars]",,de,'Winter'
https://www.zeit.de/news/2026-02/04/winterwetter-legt-teile-des-bahn-fernverkehrs-lahm,https://www.zeit.de/news/2026-02/04/winterwetter-legt-teile-des-bahn-fernverkehrs-lahm,0,www.zeit.de,"Schnee, Eis, Kälte: Winterwetter legt Teile des Bahn-Fernverkehrs lahm","Hier finden Sie Informationen zu dem Thema „Schnee, Eis, Kälte“. Lesen Sie jetzt „Winterwetter legt Teile des Bahn-Fernverkehrs lahm“.",https://img.zeit.de/news/2026-02/04/winterwetter-legt-teile-des-bahn-fernverkehrs-lahm-image-group/wide__1300x731,2026-02-04T08:11:13Z,,"Das Winterwetter sorgt im Fernverkehr der Deutschen Bahn zwischen Berlin und Hannover am Morgen für zahlreiche Ausfälle. Wie die Bahn online mitteilte, fällt unter anderem der ICE-Sprinter zwischen B… [+338 chars]",,de,'Schnee'
https://www.zeit.de/news/2026-02/04/frost-sorgt-fuer-probleme-bei-akkuzuegen,https://www.zeit.de/news/2026-02/04/frost-sorgt-fuer-probleme-bei-akkuzuegen,0,www.zeit.de,Winterwetter im Norden: Frost sorgt für Probleme bei Akkuzügen,Hier finden Sie Informationen zu dem Thema „Winterwetter im Norden“. Lesen Sie jetzt „Frost sorgt für Probleme bei Akkuzügen“.,https://img.zeit.de/news/2026-02/04/frost-sorgt-fuer-probleme-bei-akkuzuegen-image-group/wide__1300x731,2026-02-04T08:25:10Z,,Der Dauerfrost im Norden sorgt aktuell für Einschränkungen bei den Akkuzügen der Nordbahn. Aufgrund witterungsbedingter Fahrzeugstörungen sei der Betrieb in den Akku-Netzen bis 11.00 Uhr eingeschränk… [+608 chars],,de,'Frost'
https://www.golem.de/sonstiges/zustimmung/auswahl.html?from=https://www.golem.de/news/unitree-g1-humanoider-roboter-stapft-kilometerweit-durch-schnee-2602-204976.html&referer=https://t.co/95c39e23ea,https://www.golem.de/sonstiges/zustimmung/auswahl.html?from=https://www.golem.de/news/unitree-g1-humanoider-roboter-stapft-kilometerweit-durch-schnee-2602-204976.html&referer=https://t.co/95c39e23ea,0,www.golem.de,Unitree G1: Humanoider Roboter stapft kilometerweit durch Schnee,"Über mehrere Stunden war der Roboter bei -50 °C unterwegs, um die Robustheit und Präzision zu demonstrieren - bei erleichterten Bedingungen. (Roboter, GPS)",,2026-02-04T08:44:02Z,,"Besuchen Sie Golem.de wie gewohnt mit Werbung und Tracking,
 indem Sie der Nutzung aller Cookies zustimmen.
 Details zum Tracking finden Sie im Privacy Center.
Skript wurde nicht geladen. Informat… [+607 chars]",,de,'Schnee'
https://www.zeit.de/news/2026-02/04/eis-auf-der-elbe-faehre-tanja-stellt-betrieb-ein,https://www.zeit.de/news/2026-02/04/eis-auf-der-elbe-faehre-tanja-stellt-betrieb-ein,0,www.zeit.de,"Folgen des Winterwetters: Eis auf der Elbe - Fähre ""Tanja"" stellt Betrieb ein","Hier finden Sie Informationen zu dem Thema „Folgen des Winterwetters“. Lesen Sie jetzt „Eis auf der Elbe - Fähre ""Tanja"" stellt Betrieb ein“.",https://img.zeit.de/news/2026-02/04/eis-auf-der-elbe-faehre-tanja-stellt-betrieb-ein-image-group/wide__1300x731,2026-02-04T10:37:42Z,,"Fähre «Tanja» stellt ihren Betrieb vorerst ein. Grund sei Eisgang auf der Elbe, teilte der Landkreis Lüneburg mit. Das Schiff verbindet die Ortschaft Darchau (Landkreis Lüneburg) mit der Ortschaft Ne… [+625 chars]",,de,'Winter'
https://www.zeit.de/news/2026-02/04/glaettegefahr-durch-regen-und-frost-zum-ende-der-woche,https://www.zeit.de/news/2026-02/04/glaettegefahr-durch-regen-und-frost-zum-ende-der-woche,0,www.zeit.de,Niederschlag erwartet: Glättegefahr durch Regen und Frost zum Ende der Woche,Hier finden Sie Informationen zu dem Thema „Niederschlag erwartet“. Lesen Sie jetzt „Glättegefahr durch Regen und Frost zum Ende der Woche“.,https://img.zeit.de/news/2026-02/04/glaettegefahr-durch-regen-und-frost-zum-ende-der-woche-image-group/wide__1300x731,2026-02-04T12:23:02Z,,In Mecklenburg-Vorpommern dürfte es zum Ende der Woche nochmals glatter werden. Am Donnerstag besteht nach Aussage des Wetter-Experten Stefan Kreibohm nicht nur Glättegefahr durch Neuschnee. «Das Pro… [+2328 chars],,de,'Frost'
https://www.nzz.ch/fotografie/diese-bilder-zeigen-die-spektakulaere-schoenheit-der-zugefrorenen-niagarafaelle-ld.1923420,https://www.nzz.ch/fotografie/diese-bilder-zeigen-die-spektakulaere-schoenheit-der-zugefrorenen-niagarafaelle-ld.1923420,0,www.nzz.ch,Diese Bilder zeigen die spektakuläre Schönheit der zugefrorenen Niagarafälle,"Ende Januar hat eine Kältewelle die Niagarafälle in eine scheinbar erstarrte Landschaft verwandelt: Sprühnebel und Oberflächenwasser gefrieren zu dicken Eispanzern, während darunter unaufhörlich weiter Wasser stürzt.","https://img.nzz.ch/2026/02/04/c2a66aa7-8c9b-46a9-a6f9-604a190524d7.jpg?width=1200&height=674&fit=bounds&quality=75&auto=webp&crop=5000,2812,x0,y523&wmark=nzz",2026-02-04T12:47:12Z,,"Touristen bestaunen Ende Januar in Ontario die teilweise gefrorenen Niagarafälle an der kanadisch-amerikanischen Grenze.
Seit Tagen herrschen in weiten Teilen der USA und Kanadas tiefe Temperaturen,… [+4110 chars]",,de,'Kälte'
https://www.zeit.de/news/2026-02/04/daumen-hoch-was-das-deutsche-olympia-team-erwartet,https://www.zeit.de/news/2026-02/04/daumen-hoch-was-das-deutsche-olympia-team-erwartet,0,www.zeit.de,Winterspiele in Italien: Daumen hoch: Was das deutsche Olympia-Team erwartet,Hier finden Sie Informationen zu dem Thema „Winterspiele in Italien“. Lesen Sie jetzt „Daumen hoch: Was das deutsche Olympia-Team erwartet“.,https://img.zeit.de/news/2026-02/04/daumen-hoch-was-das-deutsche-olympia-team-erwartet-image-group/wide__1300x731,2026-02-04T12:55:14Z,,Vom Dauerregen in Mailand ließ sich der deutsche Chef de Mission die Olympia-Vorfreude nicht verderben. Nach seinen langen Autofahrten durch die Schnee-Landschaften in den italienischen Alpen brachte… [+4342 chars],,de,'Winter'
https://www.stern.de/sport/winterspiele-in-italien--daumen-hoch--was-das-deutsche-olympia-team-erwartet-37105930.html,https://www.stern.de/sport/winterspiele-in-italien--daumen-hoch--was-das-deutsche-olympia-team-erwartet-37105930.html,0,www.stern.de,Winterspiele in Italien: Daumen hoch: Was das deutsche Olympia-Team erwartet,Das größte deutsche Olympia-Team der Winter-Geschichte will wieder unter die Top-Nationen. Der Chef der Auswahl kann die erste Medaille kaum erwarten.,https://image.stern.de/37105932/t/T-/v1/w1440/r1.7778/-/04--xwrr2sp47zv5axs2048jpeg---5b5d5f37784d3a12.jpg,2026-02-04T12:55:14Z,,"Kopiere den aktuellen Link
Zur Merkliste hinzufügen
Das größte deutsche Olympia-Team der Winter-Geschichte will wieder unter die Top-Nationen. Der Chef der Auswahl kann die erste Medaille kaum erwa… [+4508 chars]",,de,'Winter'
https://www.tagesspiegel.de/sport/olympia-und-paralympics-ioc-pruft-fruhere-winterspiele-wegen-klimawandels-15217749.html,https://www.tagesspiegel.de/sport/olympia-und-paralympics-ioc-pruft-fruhere-winterspiele-wegen-klimawandels-15217749.html,0,www.tagesspiegel.de,Olympia und Paralympics: IOC prüft frühere Winterspiele wegen Klimawandels,"Das IOC denkt darüber nach, Winterspiele künftig schon im Januar auszutragen. Das hätte auch Folgen auf den Termin der Paralympics. Grund ist der Klimawandel.",https://www.tagesspiegel.de/images/15217748/alternates/BASE_16_9_W1400/1770209903000/olympische-winterspiele-2026.jpeg,2026-02-04T12:58:24Z,,"Das Internationale Olympische Komitee prüft, ob künftige Winterspiele vor dem Hintergrund des Klimawandels bereits im Januar stattfinden könnten. Vielleicht diskutieren wir auch darüber, die Olympisc… [+1243 chars]",,de,'Schnee'
https://www.focus.de/panorama/welt/null-grad-und-frost-kuba-erlebt-historischen-temperatursturz_895ae745-d746-4220-8078-2a54fd5d1cbf.html,https://www.focus.de/panorama/welt/null-grad-und-frost-kuba-erlebt-historischen-temperatursturz_895ae745-d746-4220-8078-2a54fd5d1cbf.html,0,www.focus.de,Null Grad und Frost: Kuba erlebt historischen Temperatursturz,Eis in der Karibik: Kuba meldet erstmals Temperaturen um den Gefrierpunkt. Eine ungewöhnliche Kaltfront bringt Frost und sorgt bis in die USA für Chaos.,https://quadro.burda-forward.de/ctf/45b8b6ac-50ee-4e83-b1ef-ef9bed964309.31a0caf0-9080-47b0-a515-a74fed92e2e7.jpg?im=RegionOfInterestCrop%3D%281200%2C630%29%2CregionOfInterest%3D%28518%2C409%29&hash=ce949eafd9c1332ad9cd151435e4d170a6948818b5542ed8f24e959997004d80,2026-02-04T13:04:00Z,,Historischer Temperatursturz in der Karibik: In Kuba sind die Temperaturen erstmals in der Geschichte des Landes auf null Grad abgesackt. Eine Wetterstation in der Provinz Matanzas im Norden der trop… [+1156 chars],,de,'Eis'
https://www.stern.de/gesellschaft/regional/hamburg-schleswig-holstein/winterwetter-im-norden--15--grosseinsatz-der-saison-fuer-hamburger-winterdienst-37104326.html,https://www.stern.de/gesellschaft/regional/hamburg-schleswig-holstein/winterwetter-im-norden--15--grosseinsatz-der-saison-fuer-hamburger-winterdienst-37104326.html,0,www.stern.de,Winterwetter im Norden: 15. Großeinsatz der Saison für Hamburger Winterdienst,Erneut sind Hunderte Einsatzkräfte des Winterdienstes in Hamburg unterwegs. Der Winterdienst rückt in diesem Winter ungewöhnlich oft zum Volleinsatz aus.,https://image.stern.de/37106002/t/u8/v1/w1440/r1.7778/-/04--dbtpqgomqav1axs2048jpeg---cff9c042ba60f971.jpg,2026-02-04T13:17:36Z,,"Kopiere den aktuellen Link
Zur Merkliste hinzufügen
Erneut sind Hunderte Einsatzkräfte des Winterdienstes in Hamburg unterwegs. Der Winterdienst rückt in diesem Winter ungewöhnlich oft zum Volleins… [+1627 chars]",,de,'Winter'
https://www.zeit.de/news/2026-02/04/forstarbeit-bei-dauerfrost-da-wird-einem-warm,https://www.zeit.de/news/2026-02/04/forstarbeit-bei-dauerfrost-da-wird-einem-warm,0,www.zeit.de,"Winterwetter: Forstarbeit bei Dauerfrost: ""Da wird einem warm""","Hier finden Sie Informationen zu dem Thema „Winterwetter“. Lesen Sie jetzt „Forstarbeit bei Dauerfrost: ""Da wird einem warm""“.",https://img.zeit.de/news/2026-02/04/forstarbeit-bei-dauerfrost-da-wird-einem-warm-image-group/wide__1300x731,2026-02-04T13:48:13Z,,"Derzeit ist Hochsaison im Wald - auch strenger Frost kann Waldarbeitern und Forstleuten wenig anhaben. «Die Holzernte ist in vollem Gang», sagte der Geschäftsführer des Waldbesitzerverbandes Brandenb… [+1879 chars]",,de,'Winter'
https://www.tagesspiegel.de/berlin/winterwetter-forstarbeit-bei-dauerfrost-da-wird-einem-warm-15218459.html,https://www.tagesspiegel.de/berlin/winterwetter-forstarbeit-bei-dauerfrost-da-wird-einem-warm-15218459.html,0,www.tagesspiegel.de,Winterwetter: Forstarbeit bei Dauerfrost: „Da wird einem warm“,Bei Eiseskälte an die Motorsäge: Warum Brandenburgs Forstwirte den Winter lieben und das geschlagene Holz jetzt besonders wertvoll ist.,https://www.tagesspiegel.de/images/15218458/alternates/BASE_16_9_W1400/1770212957000/holzernte.jpeg,2026-02-04T13:49:18Z,,"Derzeit ist Hochsaison im Wald - auch strenger Frost kann Waldarbeitern und Forstleuten wenig anhaben. Die Holzernte ist in vollem Gang, sagte der Geschäftsführer des Waldbesitzerverbandes Brandenbur… [+1927 chars]",,de,'Winter'
https://www.faz.net/aktuell/sport/olympische-winterspiele/liveblog-olympia-2026-cyber-attacken-aus-russland-faz-200420161.html,https://www.faz.net/aktuell/sport/olympische-winterspiele/liveblog-olympia-2026-cyber-attacken-aus-russland-faz-200420161.html,0,www.faz.net,Liveblog Olympia 2026: Russische Cyberangriffe auf die Winterspiele in Italien,Helikopter-Einsatz nach schwerem Sturz im Training +++ Kein Medaillenziel für Deutsche +++ Italiens Skilegenden wohl letzte Fackelläufer bei Eröffnungsfeier +++ alle Olympia-2026-News im Liveblog.,https://media0.faz.net/image/w1200h627/872c7e9f60a0/w5155h2693x203y387o/202601/43601.0.1713664245/wir-haben-eine-reihe-von.webp,2026-02-04T14:03:52Z,,"Vor allem im Bob, Rodeln und Skeleton geht das deutsche Team aussichtsreich an den Start ein Duo kann sich dabei zu den erfolgreichsten Winter-Olympioniken aus Deutschland krönen. Dies sind die größt… [+2136 chars]",,de,'Winter'
https://www.tagesspiegel.de/berlin/der-winter-aus-sicht-eines-meteorologen-berlin-erlebt-kaltesten-januar-seit-16-jahren--und-es-gibt-wieder-eisregen-15218202.html,https://www.tagesspiegel.de/berlin/der-winter-aus-sicht-eines-meteorologen-berlin-erlebt-kaltesten-januar-seit-16-jahren--und-es-gibt-wieder-eisregen-15218202.html,0,www.tagesspiegel.de,Der Winter aus Sicht eines Meteorologen: Berlin erlebt kältesten Januar seit 16 Jahren – und es gibt wieder Eisregen,"Dauerfrost, Eisregen: Der Januar war außergewöhnlich kalt und trocken. Meteorologe Jörg Riemann erklärt, was das für die Umwelt bedeutet, was die nächsten Tage bringen und wann ein Umschwung zu erwarten ist.",https://www.tagesspiegel.de/images/15218137/alternates/BASE_16_9_W1400/1770211875000/eiszeit-in-berlin.jpeg,2026-02-04T14:16:48Z,,"Berlin hat im Januar einen Winter erlebt, wie ihn viele längst vergessen glaubten: dauerhaft frostig, ungewöhnlich trocken und zeitweise sehr glatt. Wir haben tatsächlich den kältesten Januar seit 16… [+3465 chars]",,de,'Winter'
https://www.dw.com/de/reichen-deutschlands-gasvorr%C3%A4te/a-75803518,https://www.dw.com/de/reichen-deutschlands-gasvorr%C3%A4te/a-75803518,0,www.dw.com,Reichen Deutschlands Gasvorräte?,"In Deutschland ist es kalt - schließlich ist Winter. Doch manche sind besorgt, ob die Heizungen vielleicht kalt bleiben, weil die Gasspeicher nur zu 30 Prozent gefüllt sind. Ist das eine berechtigte Sorge?",https://static.dw.com/image/63216300_6.jpg,2026-02-04T14:23:00Z,,"Das Nachrichtenmagazin Focus berichtete am 1. Februar: ""Kältewelle frisst unsere Gasreserven"". Der Sender ntv wurde schon zwei Tage vorher konkreter: ""Deutsche Gasvorräte reichen theoretisch noch für… [+5668 chars]",,de,'Gas'
https://www.bild.de/sport/fussball/1-fc-kaiserslautern-hengen-und-klos-das-grosse-transfer-zeugnis-6983466a2dfdd2aa24525609,https://www.bild.de/sport/fussball/1-fc-kaiserslautern-hengen-und-klos-das-grosse-transfer-zeugnis-6983466a2dfdd2aa24525609,0,www.bild.de,"Vier da, sechs weg - Darum gibt's für die FCK-Bosse die Transfer-Note 2",Was für ein Winter-Transferfenster beim FCK! Hinter Lautern-Boss Thomas Hengen (51) und Sportdirektor Marcel Klos (37) liegen intensive Wochen.,"https://images.bild.de/6983466a2dfdd2aa24525609/a38e17c075a4e8797fc26655bcfbce96,4cc6e587?w=1280",2026-02-04T14:24:28Z,,"+++Höcke (AfD) gescheitert Thüringen-Chef Voigt (CDU) übersteht Misstrauensvotum
+++Höcke (AfD) gescheitert Thüringen-Chef Voigt (CDU) übersteht Misstrauensvotum
+++Höcke (AfD) gescheitert Thüringe… [+618 chars]",,de,'Winter'
https://www.pcgames.de/Stronghold-Crusader-Definitive-Edition-Spiel-75299/News/Winter-Update-und-neuer-DLC-1495005/,https://www.pcgames.de/Stronghold-Crusader-Definitive-Edition-Spiel-75299/News/Winter-Update-und-neuer-DLC-1495005/,0,www.pcgames.de,"Stronghold Crusader: Winter-Update bringt Workshop, Editor und Koop","Die Neuauflage des Strategiespiel-Hits Stronghold Crusader wird größer als jemals zuvor. Die Fans dürften sich nicht nur über einen neuen DLC freuen, sondern bekommen zudem ein kostenloses Winter-Update serviert.",https://www.pcgames.de/screenshots/original/2026/02/Stronghold-Crusader-Definitive-Edition-pc-games_artwork1.jpg,2026-02-04T14:31:00Z,,"Kann die Neuauflage von Stronghold Crusader eigentlich noch besser werden? Im ersten Moment scheint das schwer vorstellbar, immerhin steht die Definitive Edition seit ihrem Release im vergangenen Som… [+2094 chars]",,de,'Winter'
https://www.tagesspiegel.de/sport/olympia-in-italien-winter-rekord-bei-wahl-des-fahnentrager-duos-15219443.html,https://www.tagesspiegel.de/sport/olympia-in-italien-winter-rekord-bei-wahl-des-fahnentrager-duos-15219443.html,0,www.tagesspiegel.de,Olympia in Italien: Winter-Rekord bei Wahl des Fahnenträger-Duos,Deutlich mehr Sportfans als noch vor den Peking-Spielen haben sich an der Wahl der deutschen Fahnenträger für die Olympia-Eröffnung beteiligt. Noch sind die Sieger geheim.,https://www.tagesspiegel.de/images/15219441/alternates/BASE_16_9_W1400/1770216618000/ramona-hofmeister.jpeg,2026-02-04T14:50:18Z,,Rund 135.000 Olympia-Fans haben bei der Online-Wahl des deutschen Fahnenträger-Duos für die Eröffnungsfeier der Winterspiele ihre Stimme abgegeben. Das sind deutlich mehr als vor Winter-Olympia in Pe… [+1370 chars],,de,'Winter'
https://www.bild.de/news/inland/wegen-dauer-frost-fische-ersticken-unter-dem-eis-69831c9e8e80b703b0c28dd2,https://www.bild.de/news/inland/wegen-dauer-frost-fische-ersticken-unter-dem-eis-69831c9e8e80b703b0c28dd2,0,www.bild.de,Anglerverband warnt vor Massensterben - Wegen Dauer-Frost! Fische ersticken unter dem Eis,"Der anhaltende Frost wird zur tödlichen Gefahr für die Fische in unseren Seen. Angler helfen, damit die Tiere nicht ersticken.","https://images.bild.de/69831c9e8e80b703b0c28dd2/e26d54075c498228cef1cb962cc02f2f,de3560f0?w=1280",2026-02-04T14:58:50Z,,TTS-Player überspringenArtikel weiterlesenHannover (Niedersachsen) Schon seit November 2025 zeigt uns der Winter seine kalte Seite. Und seit Wochen herrscht in vielen Bundesländern Dauer-Frost. Doch … [+2503 chars],,de,'Frost'
https://www.zeit.de/news/2026-02/04/eis-um-inselhafen-und-seebruecke-seenotretter-umgezogen,https://www.zeit.de/news/2026-02/04/eis-um-inselhafen-und-seebruecke-seenotretter-umgezogen,0,www.zeit.de,Eis auf der Ostsee: Eis um Inselhafen und Seebrücke - Seenotretter umgezogen,Hier finden Sie Informationen zu dem Thema „Eis auf der Ostsee“. Lesen Sie jetzt „Eis um Inselhafen und Seebrücke - Seenotretter umgezogen“.,https://img.zeit.de/news/2026-02/04/eis-um-inselhafen-und-seebruecke-seenotretter-umgezogen-image-group/wide__1300x731,2026-02-04T15:07:21Z,,Mit der Seebrücke Prerow ist nun auch die nach offiziellen Angaben längste Seebrücke im Ostseeraum komplett von Eis umschlossen. Erstmals seit seiner Inbetriebnahme sei auch der dortige Inselhafen we… [+1220 chars],,de,'Kälte'
https://www.bild.de/news/ausland/kaelte-rekord-erstmals-null-grad-auf-karibik-insel-69830c8d2dfdd2aa24524faf,https://www.bild.de/news/ausland/kaelte-rekord-erstmals-null-grad-auf-karibik-insel-69830c8d2dfdd2aa24524faf,0,www.bild.de,Eigentlich herrscht Urlaubs-Saison - Kälte-Rekord! Erstmals null Grad auf Karibik-Insel,Rekord-Kälte auf Kuba: Temperaturen auf Urlaubsinsel fallen auf null Grad. Historischer Frost trifft Matanzas im sonst warmen Karibikstaat zur Reisezeit.,"https://images.bild.de/69830c8d2dfdd2aa24524faf/ab97726635063a218ea9d66c79aa0fd3,cc567055?w=1280",2026-02-04T18:21:38Z,,"TTS-Player überspringenArtikel weiterlesenMatanzas (Kuba) Beim Stichwort Karibik haben wohl die meisten Menschen Bilder von Palmen, weißen Stränden und blauem Himmel im Kopf. Doch auf Kuba sind zum e… [+2245 chars]",,de,'Temperatur unter Null'
https://www.zeit.de/news/2026-02/04/unwetterwarnung-vor-glatteis,https://www.zeit.de/news/2026-02/04/unwetterwarnung-vor-glatteis,0,www.zeit.de,Winter: Unwetterwarnung vor Glatteis,Hier finden Sie Informationen zu dem Thema „Winter“. Lesen Sie jetzt „Unwetterwarnung vor Glatteis“.,https://img.zeit.de/news/2026-02/04/unwetterwarnung-vor-glatteis-image-group/wide__1300x731,2026-02-04T18:31:27Z,,"Für Teile Brandenburgs und Berlins hat der Deutsche Wetterdienst eine amtliche Unwetterwarnung vor Glatteis herausgegeben. Die Warnung, die auch über Warnapps wie Nina verbreitet wurde, gilt für Donn… [+469 chars]",,de,'Winter'
https://www.zeit.de/hamburg/2026-02/obdachlose-hamburg-tot-kaelte-winter,https://www.zeit.de/hamburg/2026-02/obdachlose-hamburg-tot-kaelte-winter,0,www.zeit.de,"Obdachlose in Hamburg: Nicht der Frost ist Schuld, sondern die Struktur","Seit Jahresbeginn sind in Hamburg 15 Obdachlose gestorben. Das macht deutlich, wo das Winternotprogramm an Grenzen stößt – und wie die Stadt strukturell versagt.",https://img.zeit.de/hamburg/2026-02/obdachlose-hamburg-tot-kaelte-winter-bild/wide__1300x731,2026-02-04T19:36:20Z,,"Schließen
Artikelzusammenfassung
15 Obdachlose sind in Hamburg gestorben, keiner obduziert, die genaue Todesursache unklar. Unter den Toten sind Deutsche, Osteuropäer und ein Syrer. Das Winternotpr… [+492 chars]",,de,'Winter'
https://www.zeit.de/news/2026-02/05/eisparty-unmoeglich-warum-friert-der-maschsee-nicht-zu,https://www.zeit.de/news/2026-02/05/eisparty-unmoeglich-warum-friert-der-maschsee-nicht-zu,0,www.zeit.de,Eis und Schnee: Eisparty unmöglich: Warum friert der Maschsee nicht zu?,Hier finden Sie Informationen zu dem Thema „Eis und Schnee“. Lesen Sie jetzt „Eisparty unmöglich: Warum friert der Maschsee nicht zu?“.,https://img.zeit.de/news/2026-02/05/eisparty-unmoeglich-warum-friert-der-maschsee-nicht-zu-image-group/wide__1300x731,2026-02-05T05:00:06Z,,Trotz anhaltender Frosttage friert der Maschsee in Hannover nicht ganz zu. An einen erneuten Schlittschuh-Spaß auf dem See wie zuletzt im Jahr 2012 mit rund 150.000 Besuchern ist daher derzeit nicht … [+2684 chars],,de,'Eis'
https://www.zeit.de/news/2026-02/05/weiter-winterwetter-im-nordosten-warnung-vor-glaette,https://www.zeit.de/news/2026-02/05/weiter-winterwetter-im-nordosten-warnung-vor-glaette,0,www.zeit.de,Winter in MV: Weiter Winterwetter im Nordosten - Warnung vor Glätte,Hier finden Sie Informationen zu dem Thema „Winter in MV“. Lesen Sie jetzt „Weiter Winterwetter im Nordosten - Warnung vor Glätte“.,https://img.zeit.de/news/2026-02/05/weiter-winterwetter-im-nordosten-warnung-vor-glaette-image-group/wide__1300x731,2026-02-05T06:09:46Z,,Der Deutsche Wetterdienst (DWD) warnt für Teile von Mecklenburg-Vorpommern vor Glatteis. Demnach kann es im Osten Mecklenburg-Vorpommerns sowie auf Teilen Usedoms zu gefrierendem Regen mit unwetterar… [+1066 chars],,de,'Winter'
https://www.zeit.de/gesellschaft/zeitgeschehen/2026-02/flughafen-berlin-ber-fluege-eis-enteisung,https://www.zeit.de/gesellschaft/zeitgeschehen/2026-02/flughafen-berlin-ber-fluege-eis-enteisung,0,www.zeit.de,Flughafen Berlin: Alle Starts am Berliner Flughafen wetterbedingt gestoppt,"Wegen Eis und Schnee können am Hauptstadtflughafen in Berlin zurzeit keine Flugzeuge starten. Wie lang der Stopp dauert, ist laut dem Flughafen unklar.",https://img.zeit.de/administratives/sharing/fallback-image-die-zeit/wide__1300x731,2026-02-05T07:14:53Z,,"Am Berliner Flughafen sind wegen Eis die Starts vorübergehend eingestellt worden. ""Aktuell finden am Flughafen
 BER aufgrund der Witterungsverhältnisse keine Starts statt"", sagte eine
 Sprecherin. … [+306 chars]",,de,'Eis'
https://www.zeit.de/news/2026-02/05/region-waren-busse-fahren-wegen-eisregens-nicht,https://www.zeit.de/news/2026-02/05/region-waren-busse-fahren-wegen-eisregens-nicht,0,www.zeit.de,Winter in MV: Region Waren: Busse fahren wegen Eisregens nicht,Hier finden Sie Informationen zu dem Thema „Winter in MV“. Lesen Sie jetzt „Region Waren: Busse fahren wegen Eisregens nicht“.,https://img.zeit.de/news/2026-02/05/region-waren-busse-fahren-wegen-eisregens-nicht-image-group/wide__1300x731,2026-02-05T08:52:33Z,,Wegen Eisregens und Glätte kommt es an der Mecklenburgischen Seenplatte zu Einschränkungen im Busverkehr. Donnerstagfrüh fallen nach Angaben der Mecklenburg-Vorpommerschen Verkehrsgesellschaft (MVVG)… [+466 chars],,de,'Winter'
https://www.zeit.de/news/2026-02/05/dwd-unwetterwarnung-aufgehoben-glaette-bis-abends-moeglich,https://www.zeit.de/news/2026-02/05/dwd-unwetterwarnung-aufgehoben-glaette-bis-abends-moeglich,0,www.zeit.de,Winter: DWD-Unwetterwarnung aufgehoben - Glätte bis abends möglich,Hier finden Sie Informationen zu dem Thema „Winter“. Lesen Sie jetzt „DWD-Unwetterwarnung aufgehoben - Glätte bis abends möglich“.,https://img.zeit.de/news/2026-02/05/dwd-unwetterwarnung-aufgehoben-glaette-bis-abends-moeglich-image-group/wide__1300x731,2026-02-05T10:02:58Z,,"Die Unwetterwarnung vor Glatteis des Deutschen Wetterdiensts (DWD) für Berlin und Teile Brandenburgs ist aufgehoben. In Berlin sei das Gröbste geschafft, sagte DWD-Meteorologin Cathleen Hickmann am V… [+896 chars]",,de,'Winter'
