index,url,valid,domain,title,description,image,published,archive,content,quote,language,keyword
https://www.stern.de/gesellschaft/regional/sachsen/frostschaeden--obstbauern--erhebliche-ausfaelle-bei-kirschernte-in-sachsen-34782242.html,https://www.stern.de/gesellschaft/regional/sachsen/frostschaeden--obstbauern--erhebliche-ausfaelle-bei-kirschernte-in-sachsen-34782242.html,0,www.stern.de,Frostschäden: Obstbauern: Erhebliche Ausfälle bei Kirschernte in Sachsen,Die Kirschernte in Sachsen ist aufgrund des Frosts fast vollständig ausgefallen. Frostschäden könnten aufgrund des Klimawandels künftig häufiger werden.,https://image.stern.de/34782244/t/D4/v1/w1440/r1.7778/-/09--urnnewsmldpacom2009010124060999327362v2w800h600l875t550r2625b1654jpeg---fbc806a6f88e53bf.jpg,2024-06-09T07:10:35Z,,"Die Kirschernte in Sachsen ist aufgrund des Frosts fast vollständig ausgefallen. Frostschäden könnten aufgrund des Klimawandels künftig häufiger werden.
Sachsens Obstbauern rechnen in diesem Jahr nu… [+1748 chars]",,de,'Frost'
https://www.welt.de/wirtschaft/article251923210/Gas-Jetzt-plant-die-EU-Sanktionen-die-Russland-wirklich-wehtun.html,https://www.welt.de/wirtschaft/article251923210/Gas-Jetzt-plant-die-EU-Sanktionen-die-Russland-wirklich-wehtun.html,0,www.welt.de,"Jetzt plant die EU Gas-Sanktionen, die Russland wirklich wehtun","Europäische Unternehmen helfen Russland dabei, LNG-Flüssiggas in die ganze Welt zu verschiffen. Neue Sanktionen der EU sollen diese Geschäfte nun verbieten. Verbraucher und Unternehmen dürften unter dem Verbot nicht leiden. Es winken sogar Rabatte.",https://img.welt.de/img/wirtschaft/mobile251923764/9271350397-ci16x9-w1200/An-aerial-sunset-view-of-an-oil-tanker-on-The-Solent-sea-UK-stock-photo.jpg,2024-06-09T10:08:32Z,,"Trotz aller Rhetorik fällt es Europa notorisch schwer, auf russisches Erdgas zu verzichten. Zwar hat die EU den Import von russischer Kohle und auf dem Seeweg importiertem Öl aus Russland verboten. D… [+7180 chars]",,de,'Gas'
https://www.welt.de/regionales/hamburg/article251944422/Innenstadt-Bis-zum-Winter-soll-das-geschafft-sein-Arbeiten-am-Jungfernstieg-im-Zeitplan.html,https://www.welt.de/regionales/hamburg/article251944422/Innenstadt-Bis-zum-Winter-soll-das-geschafft-sein-Arbeiten-am-Jungfernstieg-im-Zeitplan.html,0,www.welt.de,„Bis zum Winter soll das geschafft sein“ – Arbeiten am Jungfernstieg im Zeitplan,"Der Jungfernstieg gehört zu Hamburgs bekanntesten Orten. Künftig soll er zum Flanieren und Entspannen einladen, auch wenn das manchen Autofahrern nicht gefällt. Bis zu einem wichtigen Zeitpunkt sollen die Bauarbeiten abgeschlossen sein.",https://img.welt.de/img/regionales/hamburg/mobile251944420/3627939607-ci16x9-w1200/Jungfernstieg-in-Hamburg.jpg,2024-06-10T05:30:58Z,,"Der Jungfernstieg gehört zu Hamburgs bekanntesten Orten. Künftig soll er zum Flanieren und Entspannen einladen, auch wenn das manchen Autofahrern nicht gefällt. Bis zu einem wichtigen Zeitpunkt solle… [+2004 chars]",,de,'Winter'
https://www.spektrum.de/news/roter-planet-reif-auf-olympus-mons/2218708,https://www.spektrum.de/news/roter-planet-reif-auf-olympus-mons/2218708,0,www.spektrum.de,Roter Planet: Reif auf Olympus Mons,"Auch am Marsäquator gibt es Eis in Form von Reif, wie Messungen der beiden europäischen Marssonden TGO und Mars Express belegen.",https://static.spektrum.de/fm/912/f1920x1080/PIA04304_erw.jpg,2024-06-10T15:09:33Z,,Unter der Leitung von Adomas Valantinas vom Physikalischen Institut der Universität Bern hat ein internationales Forschungsteam in der Tharsis-Vulkangruppe nahe dem Marsäquator Spuren von Reif aus Wa… [+1854 chars],,de,'Gas'
https://stadt-bremerhaven.de/prince-of-persia-lost-crown-im-dezember-auch-auf-dem-mac/,https://stadt-bremerhaven.de/prince-of-persia-lost-crown-im-dezember-auch-auf-dem-mac/,0,stadt-bremerhaven.de,Prince of Persia: Lost Crown: Im Dezember auch auf dem Mac,"Prince of Persia: The Lost Crown kommt diesen Winter auf den Mac und ermöglicht es noch mehr Spielern, in eine von der Zeit zerbrochene Welt einzutauchen. Die Spieler schlüpfen in die Rolle von Sargon, dem jüngsten Mitglied einer Elitekriegergruppe namens...Z…",https://stadt-bremerhaven.de/wp-content/uploads/2024/06/Swing-bar-scene-_Lower-City_1920x1080.jpg,2024-06-10T15:30:20Z,,"Prince of Persia: The Lost Crown kommt diesen Winter auf den Mac und ermöglicht es noch mehr Spielern, in eine von der Zeit zerbrochene Welt einzutauchen. Die Spieler schlüpfen in die Rolle von Sargo… [+1223 chars]",,de,'Winter'
https://www.bild.de/leben-wissen/forscher-entdecken-erstmals-frost-auf-mars-vulkanen-666718351ddc6a0605e94508,https://www.bild.de/leben-wissen/forscher-entdecken-erstmals-frost-auf-mars-vulkanen-666718351ddc6a0605e94508,0,www.bild.de,Hochauflösende Aufnahmen - Forscher entdecken Frost auf dem Mars,Die Vulkan-Gipfel auf dem Mars sind von Frost bedeckt! Den eisigen Beweis dazu hat jetzt ein internationales Forscherteam erbracht.,"https://images.bild.de/666718351ddc6a0605e94508/aa63619ca047e464c615217985d468f4,755e4a73?w=1280",2024-06-10T16:03:28Z,,"Die Vulkan-Gipfel auf dem Mars sind von Frost bedeckt!
Den eisigen Beweis dazu hat jetzt ein internationales Forscherteam unter der Leitung der Universität Bern mit hochauflösenden Farbfotos einer M… [+1608 chars]",,de,'Frost'
https://science.orf.at/stories/3225390/,https://science.orf.at/stories/3225390/,0,science.orf.at,Frost auf Marsvulkanen nachgewiesen,"Auf den Vulkanen des Mars bilden sich dünne Reifablagerungen, die in der Sonne wieder verdampfen. Das zeigen hochauflösenden Farbfotos einer Marskamera. Der Frost wurde auf den Gipfeln der höchsten Berge des Mars entdeckt, den Tharsis-Vulkanen.",https://ibs.orf.at/science?image=https%3A%2F%2Ftubestatic.orf.at%2Fmims%2F2024%2F24%2F12%2Fcrops%2Fw%3D1200%2Ch%3D627%2Cq%3D75%2F2238616_master_850212_image_7.jpg%3Fs%3D0e80f73f5daa086824497379219321dd6b54fe30,2024-06-11T07:55:41Z,,"Für das internationale Team war die Frostbildung eine Überraschung, liegen die Vulkane doch in der Nähe des Marsäquators, wo die starke Sonneneinstrahlung die Oberflächentemperaturen tendenziell hoch… [+1247 chars]",,de,'Frost'
https://www.morgenpost.de/vermischtes/article229058667/schafskaelte-kaelte-juni-eisheilige-2024-datum-bedeutung-wetter-hintergrund.html,https://www.morgenpost.de/vermischtes/article229058667/schafskaelte-kaelte-juni-eisheilige-2024-datum-bedeutung-wetter-hintergrund.html,0,www.morgenpost.de,Kälteeinbruch im Juni: Was sind Eisheilige und Schafskälte?,“Orientiert euch an den Eisheiligen“ – die alte Bauernregel kennen viele. Doch was genau bedeuten eigentlich die Eisheiligen?,https://img.sparknews.funkemedien.de/242549352/242549352_1718095097_v16_9_1600.jpeg,2024-06-11T08:38:00Z,,"Berlin. Eine Kälterückfall im Juni holt Deutschland ein. Was steckt wirklich hinter den sogenannten Eisheiligen und der Schafskälte?
<ul><li>Wer dachte, der Kälteeinbruch im Mai wäre der letzte gewe… [+4463 chars]",,de,'Eis'
https://www.stern.de/panorama/gaslighting--die-urspruenge-des-beliebten-psychologie-begriffs-34785038.html,https://www.stern.de/panorama/gaslighting--die-urspruenge-des-beliebten-psychologie-begriffs-34785038.html,0,www.stern.de,"Psychologie : 80 Jahre ""Gaslight"": Ein Thriller wird zum Psycho-Begriff","Ein Drama als Namensgeber für seelischen Missbrauch: 1944 kam die legendäre ""Gaslicht""-Verfilmung mit Ingrid Bergman ins Kino. Das sogenannte ""Gaslighting"" erscheint 80 Jahre später so aktuell wie nie.",https://image.stern.de/34785040/t/tu/v1/w1440/r1.7778/-/10--urnnewsmldpacom2009010124061099339279v3w800h600l563t94r2191b1272jpeg---a2b858a2cfce76f1.jpg,2024-06-11T10:42:00Z,,"Ein Drama als Namensgeber für seelischen Missbrauch: 1944 kam die legendäre ""Gaslicht""-Verfilmung mit Ingrid Bergman ins Kino. Das sogenannte ""Gaslighting"" erscheint 80 Jahre später so aktuell wie ni… [+4917 chars]",,de,'Gas'
https://www.welt.de/wissenschaft/article251966480/Frost-auf-dem-Mars-Eisschichten-auf-Vulkanen-entdeckt.html,https://www.welt.de/wissenschaft/article251966480/Frost-auf-dem-Mars-Eisschichten-auf-Vulkanen-entdeckt.html,0,www.welt.de,Eisschichten auf Mars-Vulkanen entdeckt,"Astronomen rätseln, woher das Wasser kommt: Auf den riesigen Vulkanen des Mars bildet sich morgens eine hauchdünne Schicht Eis. Am Nachmittag ist diese schon weggeschmolzen. Bisher wurde es für unmöglich gehalten, dass sich dort am Äquator Frost bildet.",https://img.welt.de/img/wissenschaft/mobile251966478/4911354477-ci16x9-w1200/Duenne-Eisschichten-auf-Mars-Vulkanen-3.jpg,2024-06-11T11:32:12Z,,Auf dem Mars in der Nähe des Äquators haben Astronomen feine Schichten aus Wassereis entdeckt. Ähnlich wie Raureif bedeckt das Eis den Boden in Vulkankratern in den kälteren Jahreszeiten kurz nach So… [+3122 chars],,de,'Frost'
https://t3n.de/news/ueberraschung-im-weltraum-wasserfrost-am-marsaequator-widerlegt-bisherige-annahmen-1629465/,https://t3n.de/news/ueberraschung-im-weltraum-wasserfrost-am-marsaequator-widerlegt-bisherige-annahmen-1629465/,0,t3n.de,Überraschung im Weltraum: Wasserfrost am Marsäquator widerlegt bisherige Annahmen,"Bislang sind Wissenschaftler:innen davon ausgegangen, dass es am Äquator des Mars keinen Frost geben könne. Dass er nun trotzdem gefunden wurde, soll künftig Antworten auf eine wichtige Frage geben.
weiterlesen auf t3n.de",https://t3n.de/news/wp-content/uploads/2024/06/Frost-Olympus-Mons.jpg,2024-06-11T11:45:47Z,,"Was bislang als unmöglich galt, wurde nun von gleich zwei Raumfahrzeugen der Europäischen Weltraumorganisation Esa eindeutig belegt: Sowohl die Exomars-Sonde Trace Gas Orbiter als auch die Sonde Mars… [+2140 chars]",,de,'Gas'
https://www.bild.de/sport/mehr-sport/poker-starker-auftritt-kann-er-den-deutschen-titel-fluch-brechen-666832d4c674eb2c4b562e57,https://www.bild.de/sport/mehr-sport/poker-starker-auftritt-kann-er-den-deutschen-titel-fluch-brechen-666832d4c674eb2c4b562e57,0,www.bild.de,Starker Poker-Auftritt - Kann ER den deutschen Titel-Fluch brechen?,Es würde auch endlich mal Zeit... Der Deutsche Lucas Zwingmann-Gocht liegt beim 1.500 Dollar „BIG O“ Event bei der World Series of P...Foto: Pokernews/Rachel Kay Winter,"https://images.bild.de/666832d4c674eb2c4b562e57/5a6c09907146c87ea0d899a3dba944ed-landscape,b9196bab?w=1280",2024-06-11T13:04:01Z,,"Es würde auch endlich mal Zeit...
Der Deutsche Lucas Zwingmann-Gocht liegt beim 1.500 Dollar BIG O Event bei der World Series of Poker in Las Vegas nach dem 2. Tag auf Platz 5, hat gute Chancen auf … [+2107 chars]",,de,'Winter'
https://www.diepresse.com/18555204/kommt-2025-doch-noch-gas-durch-die-ukraine-nach-europa,https://www.diepresse.com/18555204/kommt-2025-doch-noch-gas-durch-die-ukraine-nach-europa,0,www.diepresse.com,Kommt 2025 doch noch Gas durch die Ukraine nach Europa? [premium],"Hinter den Kulissen sucht Europa einen Weg, auch nach Jahresende noch Erdgas durch die Ukraine geliefert zu bekommen. Der Schlüssel könnte Aserbaidschan sein. Russland und die Ukraine könnten gleichermaßen profitieren.",https://img.diepresse.com/public/incoming/ufaogm-kein-Titel/alternates/DPR_SOCIAL_NACHRICHTEN_PAID/kein%20Titel,2024-06-11T14:35:33Z,,"Hinter den Kulissen sucht Europa einen Weg, auch nach Jahresende noch Erdgas durch die Ukraine geliefert zu bekommen. Der Schlüssel könnte Aserbaidschan sein. Russland und die Ukraine könnten gleiche… [+809 chars]",,de,'Gas'
"https://www.gamestar.de/videos/winter-burrow-trailer-zeigt-eine-kleine-maus-im-grossen-ueberlebenskampf,131265.html","https://www.gamestar.de/videos/winter-burrow-trailer-zeigt-eine-kleine-maus-im-grossen-ueberlebenskampf,131265.html",0,www.gamestar.de,Winter Burrow: Trailer zeigt eine kleine Maus im großen Überlebenskampf,"Winter Burrow ist ein Survival-Spiel mit ungewöhnlichem Setting: Wir steuern eine Maus, die eigentlich aus der Stadt kommt, sich jetzt aber im harten Winter auf dem kargen Land durchschlagen muss. Mit gesammelten Ressourcen bauen wir das Zuhause unserer Kindh…",https://images.cgames.de/images/gamestar/4/videoimage_6295265.jpg,2024-06-11T15:20:00Z,,"Für die Weiterentwicklung und Finanzierung unseres Angebotes erheben und verarbeiten wir und bis zu 223 Partner personenbezogene Daten und Identifikationsmerkmale wie, Gerätekennungen oder IP-Adresse… [+830 chars]",,de,'Winter'
https://www.telepolis.de/features/Habeck-sucht-nach-Loesungen-fuer-Transit-von-Erdgas-durch-Ukraine-9758579.html,https://www.telepolis.de/features/Habeck-sucht-nach-Loesungen-fuer-Transit-von-Erdgas-durch-Ukraine-9758579.html,0,www.telepolis.de,Habeck sucht nach Lösungen für Transit von Erdgas durch Ukraine,"Die EU hängt an russischem Gas, obwohl sie unabhängiger werden wollte. Der Transitvertrag mit der Ukraine läuft aus. Findet Robert Habeck eine Lösung?",https://heise.cloudimg.io/bound/1200x1200/q85.png-lossy-85.webp-lossy-85.foil1/_www-heise-de_/imgs/18/4/6/1/1/4/3/5/shutterstock_2343857327-852013ee80aaaac5.jpeg,2024-06-11T16:00:00Z,,"(Bild: FOTOGRIN / Shutterstock.com)
Die EU hängt an russischem Gas, obwohl sie unabhängiger werden wollte. Der Transitvertrag mit der Ukraine läuft aus. Findet Robert Habeck eine Lösung?
Die Europä… [+3668 chars]",,de,'Gas'
https://www.morgenpost.de/ratgeber/article242556460/Heizung-austauschen-Wann-sich-der-teure-Schritt-lohnt.html,https://www.morgenpost.de/ratgeber/article242556460/Heizung-austauschen-Wann-sich-der-teure-Schritt-lohnt.html,0,www.morgenpost.de,Heizung austauschen: Wann sich der teure Schritt lohnt,Eine neue Heizungsanlage kostet schnell einen fünfstelligen Betrag. Warum sich der Wechsel lohnen kann und welche Fördermittel es gibt.,https://img.sparknews.funkemedien.de/241766986/241766986_1709030578_v16_9_1600.jpeg,2024-06-11T18:55:22Z,,"Berlin. Eine neue Heizungsanlage kostet schnell einen fünfstelligen Betrag. Warum sich der Wechsel lohnen kann und welche Fördermittel es gibt.
Das Gebäudeenergiegesetz schreibt für besonders ineffi… [+5228 chars]",,de,'Heizung'
https://www.tagesschau.de/wirtschaft/gazprom-uniper-13-milliarden-schiedsgericht-100.html,https://www.tagesschau.de/wirtschaft/gazprom-uniper-13-milliarden-schiedsgericht-100.html,0,www.tagesschau.de,Gazprom soll 13 Milliarden Euro Schadenersatz an Uniper zahlen,"Gazprom hatte seine Gaslieferungen an Uniper 2022 erst reduziert und dann ganz eingestellt. Ein Schiedsgericht hat Uniper jetzt 13 Milliarden Euro Schadenersatz zugesprochen. Dass das Geld fließt, ist aber unwahrscheinlich.",https://images.tagesschau.de/image/fd807e57-d6cd-486f-82d0-a04ef7a5d638/AAABkAxv9hY/AAABjwnlFvA/16x9-1280/gazprom-154.jpg,2024-06-12T13:14:29Z,,"Stand: 12.06.2024 15:14 Uhr
Gazprom hatte seine Gaslieferungen an Uniper 2022 erst reduziert und dann ganz eingestellt. Ein Schiedsgericht hat Uniper jetzt 13 Milliarden Euro Schadenersatz zugesproc… [+3289 chars]",,de,'Gas'
https://www.globenewswire.com/news-release/2024/06/12/2897808/0/de/Rackspace-Technology-als-f%C3%BChrend-im-Frost-Radar-Healthcare-Enterprise-Cloud-Managed-Services-Providers-2024-f%C3%BCr-Wachstumspotenzial-und-Innovation-von-Gesundheitsunternehmen-anerkan.html,https://www.globenewswire.com/news-release/2024/06/12/2897808/0/de/Rackspace-Technology-als-f%C3%BChrend-im-Frost-Radar-Healthcare-Enterprise-Cloud-Managed-Services-Providers-2024-f%C3%BCr-Wachstumspotenzial-und-Innovation-von-Gesundheitsunternehmen-anerkan.html,0,www.globenewswire.com,"Rackspace Technology als führend im Frost Radar: Healthcare Enterprise Cloud Managed Services Providers, 2024 für Wachstumspotenzial und Innovation von Gesundheitsunternehmen anerkannt","Auszeichnung für die Bereitstellung erstklassiger Dienstleistungen in den Bereichen Infrastruktur, IT-Leistung, Anwendungs- und Servicemanagement, Cybersicherheit, Datenmanagement und Prozessoptimierung Auszeichnung für die Bereitstellung erstklassiger Dienst…",https://ml.globenewswire.com/Resource/Download/3397ed0c-def0-4eb1-a4f0-1408e03161e0,2024-06-12T16:59:00Z,,"SAN ANTONIO, June 12, 2024 (GLOBE NEWSWIRE) -- Rackspace Technology® (NASDAQ: RXT) das führende Unternehmen für End-to-End-, hybride Multi-Cloud- und KI-Lösungen, hat heute bekanntgegeben, dass Racks… [+4137 chars]",,de,'Frost'
https://www.kicker.de/zeit-fuer-fussball-und-begeisterung-auf-gehts-zur-heim-em-1032012/artikel,https://www.kicker.de/zeit-fuer-fussball-und-begeisterung-auf-gehts-zur-heim-em-1032012/artikel,0,www.kicker.de,Zeit für Fußball und Begeisterung: Auf geht’s zur Heim-EM,Die Weltmeisterschaft 2018 fand in Russland statt. Das paneuropäische Turnier 2021 wurde von der Corona-Pandemie überschattet. Die Winter-WM 2022 in Katar stand im Zeichen politischer Debatten über Menschenrechtsverletzungen und kulturelle Gegensätze. Jetzt s…,https://derivates.kicker.de/image/upload/c_crop%2Cx_394%2Cy_799%2Cw_3154%2Ch_1774/w_1200%2Cq_auto/v1/2024/06/14/566e45ae-0414-4f30-a3cb-dda46ce2bc10.jpeg,2024-06-14T14:27:27Z,,Die Weltmeisterschaft 2018 fand in Russland statt. Das paneuropäische Turnier 2021 wurde von der Corona-Pandemie überschattet. Die Winter-WM 2022 in Katar stand im Zeichen politischer Debatten über M… [+3246 chars],,de,'Winter'
