index,url,valid,domain,title,description,image,published,archive,content,quote,language,keyword
https://www.stern.de/gesellschaft/regional/hamburg-schleswig-holstein/strassen-und-schienen--welche-folgen-das-winterwetter-fuer-baustellen-hat-37180252.html,https://www.stern.de/gesellschaft/regional/hamburg-schleswig-holstein/strassen-und-schienen--welche-folgen-das-winterwetter-fuer-baustellen-hat-37180252.html,0,www.stern.de,Straßen und Schienen: Welche Folgen das Winterwetter für Baustellen hat,"Wochenlang herrschten in Norddeutschland Kälte, Frost und Schnee. Bei Straßen und Gleisen konnte deshalb nicht immer so gebaut werden, wie vorgesehen. Brauchen Reisende also mehr Geduld?",https://image.stern.de/37180254/t/B6/v1/w1440/r1.7778/-/01--ejxrhe64ofv4axs2048jpeg---7da61c591e83a2af.jpg,2026-03-01T03:00:44Z,,"Kopiere den aktuellen Link
Zur Merkliste hinzufügen
Wochenlang herrschten in Norddeutschland Kälte, Frost und Schnee. Bei Straßen und Gleisen konnte deshalb nicht immer so gebaut werden, wie vorges… [+5070 chars]",,de,'Winter'
https://www.zeit.de/news/2026-03/01/welche-folgen-das-winterwetter-fuer-baustellen-hat,https://www.zeit.de/news/2026-03/01/welche-folgen-das-winterwetter-fuer-baustellen-hat,0,www.zeit.de,Straßen und Schienen: Welche Folgen das Winterwetter für Baustellen hat,Hier finden Sie Informationen zu dem Thema „Straßen und Schienen“. Lesen Sie jetzt „Welche Folgen das Winterwetter für Baustellen hat“.,https://img.zeit.de/news/2026-03/01/welche-folgen-das-winterwetter-fuer-baustellen-hat-image-group/wide__1300x731,2026-03-01T03:00:44Z,,Das wochenlange Winterwetter im Norden hat nicht nur den Alltag vieler Menschen eingeschränkt. Auch bei Baustellen ging es nicht durchgehend voran. Einige Arbeiten an Straßen oder Gleisen mussten ver… [+5182 chars],,de,'Kälte'
https://www.stern.de/gesellschaft/regional/hessen/weissstoerche-in-hessen--fruehlingsboten--stoerche-starten-in-die-neue-brutsaison-37180278.html,https://www.stern.de/gesellschaft/regional/hessen/weissstoerche-in-hessen--fruehlingsboten--stoerche-starten-in-die-neue-brutsaison-37180278.html,0,www.stern.de,Weißstörche in Hessen: Frühlingsboten: Störche starten in die neue Brutsaison,Mit dem Frühling beginnt in Hessen die Brutsaison der Störche – begleitet von lautem Klappern und Nestkämpfen. Warum immer mehr Vögel auch im Winter bleiben.,https://image.stern.de/37180280/t/eD/v1/w1440/r1.7778/-/01--dns5caeb6uv8axs2048jpeg---cf411a4514ec9cdc.jpg,2026-03-01T03:00:50Z,,"Kopiere den aktuellen Link
Zur Merkliste hinzufügen
Mit dem Frühling beginnt in Hessen die Brutsaison der Störche begleitet von lautem Klappern und Nestkämpfen. Warum immer mehr Vögel auch im Winte… [+3491 chars]",,de,'Kälte'
https://www.tagesschau.de/ausland/europa/spanien-schnee-duerre-klimawandel-100.html,https://www.tagesschau.de/ausland/europa/spanien-schnee-duerre-klimawandel-100.html,0,www.tagesschau.de,Extremwetter: Schnee satt in Spanien,Im Norden Spaniens ist das Glück gerade mehr als zwei Meter dick. So hoch liegt der Schnee in den Pyrenäen. Viele Menschen zieht es auf die Pisten. Doch Meteorologen haben einen eigenen Blick darauf. Von Sebastian Kisters.,https://images.tagesschau.de/image/37b2fe4f-540c-462f-8bb2-9ba98543e85e/AAABnJ4DPjM/AAABmyZE0EA/16x9-big/skifahrer-astun-100.jpg?width=1280,2026-03-01T03:09:35Z,,"Stand: 01.03.2026 04:09 Uhr
Im Norden Spaniens ist das Glück gerade mehr als zwei Meter dick. So hoch liegt der Schnee in den Pyrenäen. Viele Menschen zieht es auf die Pisten. Doch Meteorologen habe… [+3383 chars]",,de,'Schnee'
https://www.n-tv.de/wirtschaft/Jan-Rabe-von-Rabot-Energy-Gaskraftwerke-werden-wir-bald-nicht-mehr-benoetigen-id30403419.html,https://www.n-tv.de/wirtschaft/Jan-Rabe-von-Rabot-Energy-Gaskraftwerke-werden-wir-bald-nicht-mehr-benoetigen-id30403419.html,0,www.n-tv.de,"Das ist das neue Energiesystem: ""Gaskraftwerke werden wir bald nicht mehr benötigen""","Smartmeter und Batteriespeicher sind die Bausteine für das Energiesystem der Zukunft. Und dynamische Tarife. ""Man speichert Strom, wenn er günstig ist, um ihn zu verwenden, wenn er teuer ist"", sagt ein Energieunternehmer im ""Klima-Labor"" von ntv. Das spart Ge…",https://www.n-tv.de/img/30404971/1772191189/Img_16_9/1200/Frachtschiffe-auf-dem-Rhein-vor-der-Kulisse-des-Kraftwerk-Huckingen-Gaskraftwerk-der-HKM-Huettenwerke-Krupp-Mannesmann-Betriebsfuehrung-durch-RWE-Generation-Betrieben-mit-Kuppelgas-aus-der-Stahlerzeugung-und-der-Kokerei-Kokereigas-Kuehltuerme-Duisburg-NRW-Deutschland.jpg,2026-03-01T06:38:18Z,,"Das Gaskraftwerk Huckingen in Duisburg: Nur noch notwendig, um das Sicherheitsbedürfnis vieler Menschen zu erfüllen? (Foto: picture alliance / Jochen Tack)
Digital? Für das deutsche Stromsystem ein … [+11828 chars]",,de,'Kälte'
https://www.welt.de/reise/article698ed34c616e1cbb1fcd4bf6/engadin-in-der-schweiz-winter-in-der-abgeschiedenheit-im-tal-der-letzten-dorfbewohner.html,https://www.welt.de/reise/article698ed34c616e1cbb1fcd4bf6/engadin-in-der-schweiz-winter-in-der-abgeschiedenheit-im-tal-der-letzten-dorfbewohner.html,0,www.welt.de,Völlige Ruhe im Tal der letzten Dorfbewohner,"Wenn es schneit, kann man das S-charl-Tal im Engadin nur zu Fuß oder mit dem Pferdeschlitten erreichen. Der Winterurlaub dort ist perfekt zum Runterkommen. Im Dorf halten als einzige dauerhafte Einwohner ein Wirt und seine Partnerin die Stellung.",https://images.welt.de/698ed34c616e1cbb1fcd4bf6/65e1639fa8776235cdb6d213501ad5f6/ci16x9-w1200/s-charl-c-thalia-wunsche-jpg,2026-03-01T06:47:17Z,,"Wenn es schneit, kann man das S-charl-Tal im Engadin nur zu Fuß oder mit dem Pferdeschlitten erreichen. Der Winterurlaub dort ist perfekt zum Runterkommen. Im Dorf halten als einzige dauerhafte Einwo… [+10844 chars]",,de,'Winter'
https://www.faz.net/aktuell/wirtschaft/brauche-ich-eine-waermepumpe-accg-110845271.html,https://www.faz.net/aktuell/wirtschaft/brauche-ich-eine-waermepumpe-accg-110845271.html,0,www.faz.net,Heizungsfrage: Funktioniert die Wärmepumpe sogar im Fachwerkhaus?,"Gasheizungen bleiben erlaubt. Der Eigentümer eines Fachwerkhauses fragt sich, was jetzt besser ist – eine Wärmepumpe oder doch die Grüngasheizung?",https://media0.faz.net/image/w1200h627/4dccc5fe17d7/w3000h1567x0y152o/202412/43601.0.741662566/fachwerkhaeuser-praegen-das.webp,2026-03-01T08:16:30Z,,Wie wollen wir in Zukunft heizen? Darüber machen sich in Deutschland nicht nur Millionen Haushalte mit teilweise hochbetagten Öl- und Gasheizungen Gedanken. Auch die schwarz-rote Bundesregierung hat … [+224 chars],,de,'Heizen'
https://www.zeit.de/news/2026-03/01/drei-menschen-brechen-am-eibsee-ins-eis-ein,https://www.zeit.de/news/2026-03/01/drei-menschen-brechen-am-eibsee-ins-eis-ein,0,www.zeit.de,Wetter: Drei Menschen brechen am Eibsee ins Eis ein,Hier finden Sie Informationen zu dem Thema „Wetter“. Lesen Sie jetzt „Drei Menschen brechen am Eibsee ins Eis ein“.,https://img.zeit.de/news/2026-03/01/drei-menschen-brechen-am-eibsee-ins-eis-ein-image-group/wide__1300x731,2026-03-01T09:48:00Z,,"Drei Menschen sind auf dem Eibsee in Grainau (Landkreis Garmisch-Partenkirchen) ins Eis eingebrochen. Die Wasserwacht konnte alle Verunglückten retten, wie die Polizei mitteilte.
Demnach waren drei … [+674 chars]",,de,'Eis'
https://www.morgenpost.de/panorama/article411314388/riskantes-ritual-klimawandel-bedroht-kaiserpinguine-staerker-als-gedacht.html,https://www.morgenpost.de/panorama/article411314388/riskantes-ritual-klimawandel-bedroht-kaiserpinguine-staerker-als-gedacht.html,0,www.morgenpost.de,Riskantes Ritual: Klimawandel bedroht Kaiserpinguine stärker als gedacht,"Neue Satellitendaten zeigen, wie stark der Rückgang des antarktischen Eises Kaiserpinguine unter Druck setzt – ausgerechnet in ihrer verletzlichsten Phase.",https://img.sparknews.funkemedien.de/407631285/407631285_1739561963_v16_9_1600.jpeg,2026-03-01T10:49:36Z,,"Jedes Jahr durchlaufen Kaiserpinguine ein riskantes Ritual. Während der sogenannten Mauser verlieren sie innerhalb weniger Wochen ihr komplettes Federkleid und bilden ein neues, wasserdichtes Gefiede… [+3207 chars]",,de,'Kälte'
https://www.welt.de/vermischtes/article69a419654b8f567f12fce27d/wetter-warmer-maerzbeginn-mit-sonne-und-bis-zu-16-grad.html,https://www.welt.de/vermischtes/article69a419654b8f567f12fce27d/wetter-warmer-maerzbeginn-mit-sonne-und-bis-zu-16-grad.html,0,www.welt.de,Warmer Märzbeginn mit Sonne und bis zu 16 Grad,Ein Eis essen? Das Wetter ist dafür in den kommenden Tagen wie gemacht. Zum meteorologischen Frühlingsanfang wird es auch in den nächsten Tagen warm und sonnig. Nur die Ski-Fans haben das Nachsehen.,https://images.welt.de/69a419654b8f567f12fce27d/494de0d22d7bfd2dd01e1f3209f9c833-master/ci16x9-w1200/dpa-com-20090101-260301-935-1184728-jpg,2026-03-01T11:14:37Z,,Ein Eis essen? Das Wetter ist dafür in den kommenden Tagen wie gemacht. Zum meteorologischen Frühlingsanfang wird es auch in den nächsten Tagen warm und sonnig. Nur die Ski-Fans haben das Nachsehen.S… [+2164 chars],,de,'Eis'
https://www.faz.net/aktuell/reise/finnlands-osten-skitour-durch-den-oulanka-nationalpark-accg-110844142.html,https://www.faz.net/aktuell/reise/finnlands-osten-skitour-durch-den-oulanka-nationalpark-accg-110844142.html,0,www.faz.net,Skiwandern in Finnland: Ein Vielfraß ist unter uns,"Das einzige, was man im Winter im Osten Finnland fürchten muss, ist die Dunkelheit – auch im Wald bei den wilden Tiren. Auf Skitour durch den Oulanka-Nationalpark.",https://media0.faz.net/image/w1200h627/a4b9be370f7e/w2999h1566x0y341o/022026/1.10844139/es-hat-sie-doch-niemand.webp,2026-03-01T12:12:43Z,,"Am Tag vor der Tour schreibt Guide Tommi Kallberg eine Whatsapp. Es geht um die Schneebedingungen. Wegen des warmen Wetters sei der Schnee nass und halte die Ski nicht auf der Oberfläche, wir würden … [+9402 chars]",,de,'Winter'
https://www.stern.de/gesellschaft/regional/hamburg-schleswig-holstein/aktion-fuer-sauberkeit--erfolgreicher-abschluss-bei--hamburg-raeumt-auf---37181168.html,https://www.stern.de/gesellschaft/regional/hamburg-schleswig-holstein/aktion-fuer-sauberkeit--erfolgreicher-abschluss-bei--hamburg-raeumt-auf---37181168.html,0,www.stern.de,"Aktion für Sauberkeit: Erfolgreicher Abschluss bei ""Hamburg räumt auf!""","Der Winter hat sich gerade rechtzeitig für den Stadtputz ""Hamburg räumt auf!"" zurückgezogen. Die Bilanz kann sich sehen lassen. Die Hansestadt ist von einer großen Menge Müll befreit.",https://image.stern.de/37181170/t/AE/v1/w1440/r1.7778/-/01--rmhaqbrnb4v8axs2048jpeg---d405c488062dda38.jpg,2026-03-01T12:50:05Z,,"Kopiere den aktuellen Link
Zur Merkliste hinzufügen
Der Winter hat sich gerade rechtzeitig für den Stadtputz ""Hamburg räumt auf!"" zurückgezogen. Die Bilanz kann sich sehen lassen. Die Hansestadt is… [+1083 chars]",,de,'Schnee'
https://www.zeit.de/news/2026-03/01/fruehlingsauftakt-mit-eistuermen-am-strand,https://www.zeit.de/news/2026-03/01/fruehlingsauftakt-mit-eistuermen-am-strand,0,www.zeit.de,Eis und Sand: Frühlingsauftakt mit Eistürmen am Strand,Hier finden Sie Informationen zu dem Thema „Eis und Sand“. Lesen Sie jetzt „Frühlingsauftakt mit Eistürmen am Strand“.,https://img.zeit.de/news/2026-03/01/fruehlingsauftakt-mit-eistuermen-am-strand-image-group/wide__1300x731,2026-03-01T13:38:06Z,,Auch zum meteorologischen Frühlingsanfang gibt sich die Strandkulisse vor Zempin auf Usedom winterlich. Das Eis der langen Frostperiode türmt sich weiterhin meterhoch auf und schmilzt selbst bei zwei… [+684 chars],,de,'Eis'
https://noe.orf.at/stories/3343962/,https://noe.orf.at/stories/3343962/,0,noe.orf.at,Natur erwacht im Nationalpark Donauauen,Rechtzeitig zum meteorolgischen Frühlingsbeginn am 1. März zeigen sich im Nationalpark Donauauen für aufmerksame Beobachter bereits zahlreiche Frühlingsboten.  Schneeglöckchen trotzen dem Frost und Sumpfschildkröten erwachen ebenso wie die Insekten.,https://ibs.orf.at/noe?image=https%3A%2F%2Foekastatic.orf.at%2Fmims%2F2026%2F10%2F99%2Fcrops%2Fw%3D1200%2Ch%3D627%2Cq%3D75%2F2953570_master_1141899_260301_fruehlingsbeginn_00_00_37_16.jpg%3Fs%3D1793b806721bf0cdc01b1e2cd9a2b6d9777b3ce5,2026-03-01T15:34:46Z,,"Frühlingsbeginn
Der kalendarische Frühlingsbeginn ist am 21. März, für Metereologen startet der Frühling aber schon drei Wochen früher und dauert den gesamten März, April und Mai
Die Auböden sind b… [+2504 chars]",,de,'Frost'
https://www.faz.net/aktuell/politik/ukraine/ukraine-liveticker-selenskyj-haben-schwierigen-winter-ueberstanden-faz-110683325.html,https://www.faz.net/aktuell/politik/ukraine/ukraine-liveticker-selenskyj-haben-schwierigen-winter-ueberstanden-faz-110683325.html,0,www.faz.net,Krieg in der Ukraine: Selenskyj: Haben schwierigen Winter überstanden,Selenskyj: „Kein Volk hat solche Prüfungen durchgemacht“ +++ Ukraine: Russland würde US-Sicherheitsgarantien akzeptieren +++ Vier Tote nach russischen Angriffen in der Nordostukraine +++ alle Neuigkeiten im Liveblog,https://media0.faz.net/image/w1200h627/4b05ebe13643/w4852h2535x0y417o/202602/43601.0.1826357063/wolodymyr-selenskyj-in.webp,2026-03-01T19:32:58Z,,Im Konflikt um Energielieferungen hat der ukrainische Präsident Wolodymyr Selenskyj am Freitag mit dem slowakischen Regierungschef Robert Fico telefoniert. Der Präsident der Ukraine lade Fico in die … [+846 chars],,de,'Winter'
https://www.welt.de/politik/article69a4fb017c787f6a1cef382a/mehrmonatige-vollsperrungen-koennen-jetzt-gar-nicht-anders-bahnchefin-verteidigt-streckensanierungen.html,https://www.welt.de/politik/article69a4fb017c787f6a1cef382a/mehrmonatige-vollsperrungen-koennen-jetzt-gar-nicht-anders-bahnchefin-verteidigt-streckensanierungen.html,0,www.welt.de,„Können jetzt gar nicht anders“ – Bahnchefin verteidigt Streckensanierungen,Die umfassende Sanierung wichtiger Gleisstrecken stockt gerade zwischen Hamburg und Berlin. Grund ist laut Bahn die lange Frostperiode. Am Konzept will die Konzernchefin deshalb aber nicht rütteln.,https://images.welt.de/69a4fb017c787f6a1cef382a/abd29279e40868af9ddf3faedf9d3935-master/ci16x9-w1200/dpa-com-20090101-251211-935-1013136-jpg,2026-03-02T03:01:12Z,,Die umfassende Sanierung wichtiger Gleisstrecken stockt gerade zwischen Hamburg und Berlin. Grund ist laut Bahn die lange Frostperiode. Am Konzept will die Konzernchefin deshalb aber nicht rütteln.Ba… [+2330 chars],,de,'Kälte'
https://www.diepresse.com/20609310/urteil-streupflicht-bei-eis-kann-in-alle-richtungen-gehen,https://www.diepresse.com/20609310/urteil-streupflicht-bei-eis-kann-in-alle-richtungen-gehen,0,www.diepresse.com,Urteil: Streupflicht bei Eis kann in alle Richtungen gehen [premium],"Auch hinter einer Haltestellenhütte hätte man Vorsorge treffen müssen, sagt der Oberste Gerichtshof. Verletzte erhält Entschädigung.",https://img.diepresse.com/public/incoming/d22g05-imago-images-0846793647/alternates/DPR_SOCIAL_MAGAZIN/imago%20images%200846793647,2026-03-02T06:44:30Z,,"Man muss sich nicht immer nur von vorne, von rechts oder von links der Haltestelle nähern. Weil sie auf einer eisigen Fläche hinter einer Haltestellenhütte ausgerutscht war, forderte eine Frau Schade… [+1530 chars]",,de,'Eis'
https://www.zeit.de/news/2026-03/02/eisbaeren-auf-der-suche-nach-der-verlorenen-leichtigkeit,https://www.zeit.de/news/2026-03/02/eisbaeren-auf-der-suche-nach-der-verlorenen-leichtigkeit,0,www.zeit.de,"Deutsche Eishockey Liga: Eisbären: Auf der Suche nach der verlorenen ""Leichtigkeit""","Hier finden Sie Informationen zu dem Thema „Deutsche Eishockey Liga“. Lesen Sie jetzt „Eisbären: Auf der Suche nach der verlorenen ""Leichtigkeit""“.",https://img.zeit.de/news/2026-03/02/eisbaeren-auf-der-suche-nach-der-verlorenen-leichtigkeit-image-group/wide__1300x731,2026-03-02T09:10:15Z,,"Die Eisbären Berlin suchten nach dem ernüchternden 1:3 gegen die Fischtown Pinguins Bremerhaven nach Gründen für die zuletzt unbefriedigenden Leistungen in der Deutschen Eishockey Liga (DEL).
«Die L… [+1483 chars]",,de,'Eis'
https://burgenland.orf.at/stories/3344046/,https://burgenland.orf.at/stories/3344046/,0,burgenland.orf.at,Störche kehren zurück,Im Burgenland sind die ersten Störche bereits gelandet. Im Bezirk Oberwart wurden im Februar bereits Vögel im Schnee gesichtet und auch Rust meldete die ersten Rückkehrer.,https://ibs.orf.at/bgl?image=https%3A%2F%2Foekastatic.orf.at%2Fmims%2F2026%2F10%2F66%2Fcrops%2Fw%3D1200%2Ch%3D627%2Cq%3D75%2F2954413_master_1142166_burgenland_heute_wetter_aus_st._martin_in_der_wart_260223_strobl_00_00_42_00.jpg%3Fs%3Dbb8b8510d8eee241d7e5f8078fc879102064e9d7,2026-03-02T10:46:27Z,,"Schon Mitte Februar, so früh wie noch nie, landete ein Storch in St. Martin in der Wart (Bezirk Oberwart). Er erlebte dann den Wintereinbruch und musste ein Wochenende lang mit Schnee klarkommen.
OR… [+620 chars]",,de,'Schnee'
https://www.bild.de/sport/fussball/jetzt-hier-reif-ist-live-gucken-wird-el-mala-zum-kwasniok-problem-69a538c56a8626658c54b203,https://www.bild.de/sport/fussball/jetzt-hier-reif-ist-live-gucken-wird-el-mala-zum-kwasniok-problem-69a538c56a8626658c54b203,0,www.bild.de,Reif ist Live vom 02.03.26 - Wird El Mala zum Kwasniok-Problem?,Bayern nach BVB-Sieg jetzt schon Meister? Wie geht es jetzt mit den Dortmund-Bossen weiter? Und wie schwer wird es jetzt für Kwasniok beim 1. FC Köln?,"https://images.bild.de/69a538c56a8626658c54b203/7c9cc9c56593741ee60b89252824f001,cbb552b7?w=1280",2026-03-02T11:05:15Z,,"+++Teil der Anlage geschlossen: Drohne trifft Mega-Raffinerie in Saudi-Arabien
+++Teil der Anlage geschlossen: Drohne trifft Mega-Raffinerie in Saudi-Arabien
+++Teil der Anlage geschlossen: Drohne … [+598 chars]",,de,'Reif'
https://www.bild.de/sport/fussball/interessantes-interview-detail-achten-sie-mal-auf-die-stanisic-verletzung-69a54ff26a8626658c54b392,https://www.bild.de/sport/fussball/interessantes-interview-detail-achten-sie-mal-auf-die-stanisic-verletzung-69a54ff26a8626658c54b392,0,www.bild.de,Interessantes Interview-Detail - Achten Sie mal auf die Stanisic-Verletzung,BVB-Star Nico Schlotterbeck trifft Bayern-Spieler Josip Stanišić beim Zweikampf gefährlich am Schienbein. Das ist u.a. Thema bei „Reif ist Live“.,"https://images.bild.de/69a54ff26a8626658c54b392/b07c8802dd25143eed47cd4c36b0bee6,c3a59f?w=1280",2026-03-02T11:27:28Z,,"+++Live-Ticker zur Lage in Nahost: Israel fliegt neue Angriffe auf Teheran 
+++Live-Ticker zur Lage in Nahost: Israel fliegt neue Angriffe auf Teheran 
+++Live-Ticker zur Lage in Nahost: Israel fli… [+567 chars]",,de,'Reif'
https://www.bild.de/sport/fussball/bittere-liga-erkenntnis-das-ist-das-deprimierende-an-dem-spiel-69a54f9f6a8626658c54b383,https://www.bild.de/sport/fussball/bittere-liga-erkenntnis-das-ist-das-deprimierende-an-dem-spiel-69a54f9f6a8626658c54b383,0,www.bild.de,Bittere Liga-Erkenntnis - „Das ist das deprimierende an dem Spiel“,Fußball-Experte Marcel Reif ordnet das Bundesliga-Top-Spiel Dortmund gegen Bayern ein. Das ist u.a. Thema bei „Reif ist Live“.,"https://images.bild.de/69a54f9f6a8626658c54b383/52133ce8c2eaff4079f085ce2b5fbec7-landscape,ffb3c125?w=1280",2026-03-02T11:31:59Z,,"+++Live-Ticker zur Lage in Nahost: Israel fliegt neue Angriffe auf Teheran 
+++Live-Ticker zur Lage in Nahost: Israel fliegt neue Angriffe auf Teheran 
+++Live-Ticker zur Lage in Nahost: Israel fli… [+567 chars]",,de,'Reif'
https://www.bild.de/sport/fussball/stand-jetzt-wird-leon-goretzka-spannende-nagelsmann-aussage-zur-wm-69a550416a8626658c54b3ac,https://www.bild.de/sport/fussball/stand-jetzt-wird-leon-goretzka-spannende-nagelsmann-aussage-zur-wm-69a550416a8626658c54b3ac,0,www.bild.de,„Stand jetzt wird Leon Goretzka…“ - Spannende Nagelsmann-Aussage zur WM,Das sagt Bundestrainer Julian Nagelsmann über den möglichen DFB-Kader. Das ist u.a. Thema bei „Reif ist Live“.,"https://images.bild.de/69a550416a8626658c54b3ac/4ba6c0f935d32c5f3d9fda0e5393732a,9a459850?w=1280",2026-03-02T11:32:19Z,,"+++Live-Ticker zur Lage in Nahost: Israel fliegt neue Angriffe auf Teheran 
+++Live-Ticker zur Lage in Nahost: Israel fliegt neue Angriffe auf Teheran 
+++Live-Ticker zur Lage in Nahost: Israel fli… [+567 chars]",,de,'Reif'
https://www.bild.de/sport/fussball/vor-dem-bergamo-duell-da-werden-die-bayern-zulegen-muessen-69a54fb96a8626658c54b38a,https://www.bild.de/sport/fussball/vor-dem-bergamo-duell-da-werden-die-bayern-zulegen-muessen-69a54fb96a8626658c54b38a,0,www.bild.de,Vor dem Bergamo-Duell - „Da werden die Bayern zulegen müssen“,Fußball-Experte Marcel Reif erklärt in welcher Hinsicht der deutsche Rekordmeister vor dem Champions-League-Duell gegen Bergamo verbessern müssen. Das is...,"https://images.bild.de/69a54fb96a8626658c54b38a/6072754be6d9964fe7fb1b0887b14024,e41b11c2?w=1280",2026-03-02T11:33:28Z,,"+++Live-Ticker zur Lage in Nahost: Israel fliegt neue Angriffe auf Teheran 
+++Live-Ticker zur Lage in Nahost: Israel fliegt neue Angriffe auf Teheran 
+++Live-Ticker zur Lage in Nahost: Israel fli… [+567 chars]",,de,'Reif'
https://www.bild.de/sport/fussball/es-geht-um-die-bvb-bosse-ich-denke-sie-werden-das-verschlanken-69a550286a8626658c54b3a6,https://www.bild.de/sport/fussball/es-geht-um-die-bvb-bosse-ich-denke-sie-werden-das-verschlanken-69a550286a8626658c54b3a6,0,www.bild.de,"Es geht um die BVB-Bosse - „Ich denke, sie werden das verschlanken“",Was muss sich in der Führungsetage bei den BVB-Bossen ändern? Das ist u.a. Thema bei „Reif ist Live“.,"https://images.bild.de/69a550286a8626658c54b3a6/130b59c071cb6794e5e9a7ef60b8729a,738b84c4?w=1280",2026-03-02T11:34:00Z,,"+++Live-Ticker zur Lage in Nahost: Israel fliegt neue Angriffe auf Teheran 
+++Live-Ticker zur Lage in Nahost: Israel fliegt neue Angriffe auf Teheran 
+++Live-Ticker zur Lage in Nahost: Israel fli… [+567 chars]",,de,'Reif'
https://www.bild.de/sport/fussball/schlotterbeck-weg-sie-muessen-sich-zumindest-intensiv-umgucken-69a550106a8626658c54b39d,https://www.bild.de/sport/fussball/schlotterbeck-weg-sie-muessen-sich-zumindest-intensiv-umgucken-69a550106a8626658c54b39d,0,www.bild.de,SCHLOTTERBECK WEG? - „Sie müssen sich zumindest intensiv umgucken“,Verlängert Nico Schlotterbeck seinen Vertag beim BVB? Das ist u.a. Thema bei „Reif ist Live“.,"https://images.bild.de/69a550106a8626658c54b39d/e2baf6e4470db53eb7e213d67a263f67,5d63c193?w=1280",2026-03-02T11:34:44Z,,"+++Live-Ticker zur Lage in Nahost: Israel fliegt neue Angriffe auf Teheran 
+++Live-Ticker zur Lage in Nahost: Israel fliegt neue Angriffe auf Teheran 
+++Live-Ticker zur Lage in Nahost: Israel fli… [+567 chars]",,de,'Reif'
https://www.teltarif.de/adactestsieger-reifen-ebay/news/102248.html,https://www.teltarif.de/adactestsieger-reifen-ebay/news/102248.html,0,www.teltarif.de,ADAC-Reifentest: Sommer-Testsieger im Angebot,Der ADAC hat die Sommerreifen 2026 bewertet. Bei eBay lassen sich die Testsieger durch Gutscheincodes zu reduzierten Endpreisen beziehen,https://www.teltarif.de/img/arch/2026/kw10/adactestsieger-reifen-ebay-4og.jpg,2026-03-02T11:38:51Z,,Stei­gende Asphalt-Tempe­raturen und plötz­liche Stark­regen­ereig­nisse im Frühjahr verän­dern die physi­kali­schen Anfor­derungen an die Boden­haftung von Kraft­fahr­zeugen. Der saiso­nale Wechsel … [+4764 chars],,de,'Reif'
https://www.stern.de/wirtschaft/news/folgen-fuer-die-wirtschaft--iran-krieg-trifft-deutschland--sprit-und-gas-deutlich-teurer-37183546.html,https://www.stern.de/wirtschaft/news/folgen-fuer-die-wirtschaft--iran-krieg-trifft-deutschland--sprit-und-gas-deutlich-teurer-37183546.html,0,www.stern.de,Folgen für die Wirtschaft: Iran-Krieg trifft Deutschland: Sprit und Gas deutlich teurer,Der Irankonflikt hat Folgen für Verbraucher und Wirtschaft - von steigenden Kosten für Heizen und Tanken über sinkende Aktienkurse bis Sorgen um die Konjunktur. Viel hängt von der Dauer des Kriegs ab.,https://image.stern.de/37183790/t/9r/v1/w1440/r1.7778/-/02--qod5shm4n3v1axs2048jpeg---2c09ea15c4e45baf.jpg,2026-03-02T12:39:30Z,,"Kopiere den aktuellen Link
Zur Merkliste hinzufügen
Der Irankonflikt hat Folgen für Verbraucher und Wirtschaft - von steigenden Kosten für Heizen und Tanken über sinkende Aktienkurse bis Sorgen um … [+6329 chars]",,de,'Heizen'
https://www.tagesspiegel.de/wirtschaft/folgen-fur-die-wirtschaft-iran-krieg-trifft-deutschland-sprit-und-gas-deutlich-teurer-15307835.html,https://www.tagesspiegel.de/wirtschaft/folgen-fur-die-wirtschaft-iran-krieg-trifft-deutschland-sprit-und-gas-deutlich-teurer-15307835.html,0,www.tagesspiegel.de,Folgen für die Wirtschaft: Iran-Krieg trifft Deutschland: Sprit und Gas deutlich teurer,Der Irankonflikt hat Folgen für Verbraucher und Wirtschaft - von steigenden Kosten für Heizen und Tanken über sinkende Aktienkurse bis Sorgen um die Konjunktur. Viel hängt von der Dauer des Kriegs ab.,https://www.tagesspiegel.de/images/15307834/alternates/BASE_16_9_W1400/1772455261000/kraftstoffpreise-an-der-tankstelle.jpeg,2026-03-02T12:41:01Z,,"Rasant steigende Öl-, Sprit und Gaspreise, Aktien unter Druck, Sorgen um die Konjunktur: Der Iran-Krieg sorgt für große Unsicherheit und könnte die Wirtschaft in Deutschland treffen - sofern die Kämp… [+6161 chars]",,de,'Heizen'
