index,url,valid,domain,title,description,image,published,archive,content,quote,language,keyword
https://www.stern.de/gesellschaft/regional/sachsen/wetter--weiter-heiter-in-sachsen--sachsen-anhalt-und-thueringen-37189178.html,https://www.stern.de/gesellschaft/regional/sachsen/wetter--weiter-heiter-in-sachsen--sachsen-anhalt-und-thueringen-37189178.html,0,www.stern.de,"Wetter: Weiter heiter in Sachsen, Sachsen-Anhalt und Thüringen","Kühle Nächte, sonnige Tage: In Sachsen, Sachsen-Anhalt und Thüringen bleibt es freundlich, aber morgens mit Frostgefahr. Was der Wetterdienst für das Wochenende erwartet.",https://image.stern.de/37189180/t/FL/v1/w1440/r1.7778/-/04--gutkvqepf7v6axs2048jpeg---197a29d6908c576a.jpg,2026-03-04T06:41:34Z,,"Kopiere den aktuellen Link
Zur Merkliste hinzufügen
Kühle Nächte, sonnige Tage: In Sachsen, Sachsen-Anhalt und Thüringen bleibt es freundlich, aber morgens mit Frostgefahr. Was der Wetterdienst für… [+1213 chars]",,de,'Reif'
https://www.zeit.de/2026/10/schneeschuhwandern-lenk-berner-alpen-biwak-reisen,https://www.zeit.de/2026/10/schneeschuhwandern-lenk-berner-alpen-biwak-reisen,0,www.zeit.de,Schneeschuhwandern: Auf Schnee schlafen,Im Biwak in den Schweizer Bergen übernachten? Unser Autor hatte große Angst vor diesem Abenteuer – und muss am Ende vor Freude weinen.,https://img.zeit.de/2026/10/auf-schnee-schlafen-bild-2/wide__1300x731,2026-03-04T09:27:42Z,,"Dieser Artikel ist Teil von ZEIT am Wochenende, Ausgabe 09/2026.
Alles beginnt damit, dass ich eine E-Mail bekomme, in der ich mit ""Lieber Abenteurer"" angesprochen werde. Grundsätzlich identifiziere… [+517 chars]",,de,'Schnee'
https://www.faz.net/aktuell/wirtschaft/unternehmen/dwd-soll-durch-ki-die-wettervorhersagen-verbessern-accg-110847005.html,https://www.faz.net/aktuell/wirtschaft/unternehmen/dwd-soll-durch-ki-die-wettervorhersagen-verbessern-accg-110847005.html,0,www.faz.net,Schnellere Prognosen: KI soll die Wettervorhersagen verbessern,Der Deutsche Wetterdienst hat nun ein zweites Instrument für seine Prognosen. Die Vorhersage von Schneefall könnte schon bald genauer werden.,https://media0.faz.net/image/w1200h627/16e2e5a2c26a/w3000h1567x0y622o/032019/1.10847104/unter-blauem-himmel-mit-diesem.webp,2026-03-04T09:56:20Z,,"Der Schnee auf den Straßen oder den Flughäfen, wie er vor wenigen Tagen teils unerwartet den Verkehr gestört hat, könnte bald genauer und mit mehr Vorlauf vorhergesagt werden. Dazu soll dem Deutschen… [+5505 chars]",,de,'Schnee'
https://www.welt.de/sport/olympia/article69a7dc8518681589ec9eb7c1/ukrainischer-skeletoni-waehrend-bei-uns-menschen-sterben-bekommt-russland-die-buehne.html,https://www.welt.de/sport/olympia/article69a7dc8518681589ec9eb7c1/ukrainischer-skeletoni-waehrend-bei-uns-menschen-sterben-bekommt-russland-die-buehne.html,0,www.welt.de,"„Während bei uns die Menschen sterben, bekommt Russland eine Bühne“","Bei den Winterspielen sorgte  Vladyslav Heraskevych für Schlagzeilen. Der Skeletoni aus der Ukraine wollte einen Helm tragen, auf dem im Krieg gefallene Athleten abgebildet waren. Er wurde disqualifiziert. Vor dem Start der Paralympics sieht er nun eine Doppe…",https://images.welt.de/69a7dc8518681589ec9eb7c1/0945a70026836ce819af9b7f9c53ea91-master/ci16x9-w1200/2026-02-19t132931z-1406293022-rc2yojabhl37-rtrmadp-3-olympics-2026-skeleton-ukraine-jpg,2026-03-04T10:21:42Z,,"Bei den Winterspielen sorgte Vladyslav Heraskevych für Schlagzeilen. Der Skeletoni aus der Ukraine wollte einen Helm tragen, auf dem im Krieg gefallene Athleten abgebildet waren. Er wurde disqualifiz… [+6173 chars]",,de,'Winter'
https://www.n-tv.de/wirtschaft/Auch-Deutschland-wird-Gas-zu-diesen-Preisen-kaufen-muessen-id30429737.html,https://www.n-tv.de/wirtschaft/Auch-Deutschland-wird-Gas-zu-diesen-Preisen-kaufen-muessen-id30429737.html,0,www.n-tv.de,"Wiederholung der Energiekrise?: ""Auch Deutschland wird Gas zu diesen Preisen kaufen müssen""","Deutschland bezieht kein Flüssiggas aus Katar, Europa nur sehr wenig. Dennoch explodiert der hiesige Gaspreis durch den Iran-Konflikt. Auf Verbraucher im Pech schlagen die Verwerfungen bereits durch, sagte ein Energiemarktexperte bei ntv.de. Noch schlimmer tr…",https://www.n-tv.de/img/30429971/1772627054/Img_16_9/1200/Visitors-gather-at-the-exhibition-entrance-beneath-a-large-QatarEnergy-display-reading-Home-of-LNG-during-the-21st-International-Conference-and-Exhibition-on-Liquefied-Natural-Gas-LNG2026-This-photo-is-taken-on-February-2-2026-QatarEnergy-announces-a-complete-shutdown-of-its-liquefied-natural-gas-production-following-Iranian-drone-strikes-on-its-facilities-in-Ras-Laffan-and-Mesaieed-amid-a-wider-regional-escalation-on-March-2-2026-Photo-by-Noushad-Thekkayil-NurPhoto.jpg,2026-03-04T11:40:33Z,,"Katar, Heimat des Flüssigerdgases. Durch den Iran-Konflikt explodieren die LNG-Preise weltweit. Was bedeutet das für die deutsche Energieversorgung? (Foto: picture alliance / NurPhoto)
Deutschland b… [+9222 chars]",,de,'Gas'
https://www.faz.net/aktuell/stil/mode-design/herbstkollektion-von-anderson-fuer-dior-eleganz-und-kontraste-im-tuileriengarten-110847436.html,https://www.faz.net/aktuell/stil/mode-design/herbstkollektion-von-anderson-fuer-dior-eleganz-und-kontraste-im-tuileriengarten-110847436.html,0,www.faz.net,Dior für den Herbst: Der nächste Winter wird dramatisch,Jonathan Anderson zeigt für Dior eine eklektische Herbstkollektion im Tuileriengarten – und macht der Idylle an manchen Stellen einen Strich durch die Rechnung.,https://media0.faz.net/image/w1200h627/1176a3f91002/w8192h4280x0y1020o/202603/b5123302-aa08-4c0d-991d-b1f3172d6636/in-floraler-umgebung-jonathan.webp,2026-03-04T13:01:06Z,,"Das Szenario könnte idyllischer kaum sein. Ein sonniger Nachmittag in Paris, 18 Grad, und gut gekleidete Menschen strömen vom Place de la Concorde in den Jardin des Tuileries. Dior präsentiert am zwe… [+2899 chars]",,de,'Winter'
https://www.bild.de/sport/fussball/spannende-andeutung-verdacht-um-die-zukunft-der-bvb-bosse-69a596b97fd0cd971e10c0b5,https://www.bild.de/sport/fussball/spannende-andeutung-verdacht-um-die-zukunft-der-bvb-bosse-69a596b97fd0cd971e10c0b5,0,www.bild.de,Spannende Andeutung - Verdacht um die Zukunft der BVB-Bosse,Was muss sich in der Führungsetage bei den BVB-Bossen ändern? Marcel Reif hat einen Verdacht.,"https://images.bild.de/69a596b97fd0cd971e10c0b5/338a718d2e0ccbf35a074bd225485a32-landscape,31297af?w=1280",2026-03-04T14:52:28Z,,"+++US-Kriegsminister Hegseth bestätigt: USA versenken iranisches Kriegsschiff vor Sri Lanka
+++US-Kriegsminister Hegseth bestätigt: USA versenken iranisches Kriegsschiff vor Sri Lanka
+++US-Kriegsm… [+728 chars]",,de,'Reif'
https://www.zeit.de/politik/ausland/2026-03/europaeische-union-gasversorgung-iran-usa-israel-krieg-strasse-hormus,https://www.zeit.de/politik/ausland/2026-03/europaeische-union-gasversorgung-iran-usa-israel-krieg-strasse-hormus,0,www.zeit.de,Krieg im Iran: EU sieht Öl- und Gasversorgung vorerst gesichert,Die Europäische Kommission sieht keine akuten Engpässe bei der Versorgung mit Öl und Gas. Kurzfristig sei wegen des Irankriegs vor allem mit höheren Ölpreisen zu rechnen.,https://img.zeit.de/politik/deutschland/2026-03/energieversorgung-eu-iran-krieg/wide__1300x731,2026-03-04T14:52:56Z,,"Die Europäische Kommission hält die Versorgung mit Öl und Gas trotz des Irankriegs nicht für unmittelbar gefährdet. Bezüglich der Gasversorgung habe die Behörde derzeit keine Sorge vor einem Engpass,… [+910 chars]",,de,'Gas'
https://www.tagesspiegel.de/berlin/bezirke/friedrichshain-kreuzberg/in-den-park-gehe-ich-bei-dunkelheit-ohnehin-nicht-mehr-wie-sicher-ist-der-berliner-volkspark-friedrichshain-15315069.html,https://www.tagesspiegel.de/berlin/bezirke/friedrichshain-kreuzberg/in-den-park-gehe-ich-bei-dunkelheit-ohnehin-nicht-mehr-wie-sicher-ist-der-berliner-volkspark-friedrichshain-15315069.html,0,www.tagesspiegel.de,„In den Park gehe ich bei Dunkelheit ohnehin nicht mehr“ : Wie sicher ist der Berliner Volkspark Friedrichshain?,Nächtliche Schüsse auf einen Mann im Volkspark Friedrichshain: Der Vorfall weckt erneut Zweifel an der Sicherheit. Auch wenn sich Spaziergänger tagsüber gelassen zeigen – Besuche zu später Stunde meiden manche Berliner komplett.,https://www.tagesspiegel.de/images/15315375/alternates/BASE_16_9_W1400/1772636980000/img-2119.jpeg,2026-03-04T15:13:31Z,,Im Volkspark Friedrichshain ist am frühen Dienstagmorgen ein 50-jähriger Mann mit mehreren Schusswunden aufgefunden worden. Nach Angaben von Staatsanwaltschaftssprecher Alan Bauer war die Polizei geg… [+136 chars],,de,'Dunkelheit'
https://www.zeit.de/news/2026-03/04/preisschock-werden-strom-und-gas-jetzt-teurer,https://www.zeit.de/news/2026-03/04/preisschock-werden-strom-und-gas-jetzt-teurer,0,www.zeit.de,Iran-Krieg: Preisschock: Werden Strom und Gas jetzt teurer?,Hier finden Sie Informationen zu dem Thema „Iran-Krieg“. Lesen Sie jetzt „Preisschock: Werden Strom und Gas jetzt teurer?“.,https://img.zeit.de/news/2026-03/04/preisschock-werden-strom-und-gas-jetzt-teurer-image-group/wide__1300x731,2026-03-04T16:07:48Z,,"Im europäischen Großhandel sind die Erdgaspreise nach Beginn des Iran-Krieges stark gestiegen. Werden deshalb auch Strom und Gas für die Haushalte wieder teurer?
Die Energiewirtschaft hält sich mit … [+3734 chars]",,de,'Gas'
https://www.zeit.de/news/2026-03/04/gasalarm-im-kurzentrum-vier-verletzte,https://www.zeit.de/news/2026-03/04/gasalarm-im-kurzentrum-vier-verletzte,0,www.zeit.de,C02 im Keller: Gasalarm im Kurzentrum - Vier Verletzte,Hier finden Sie Informationen zu dem Thema „C02 im Keller“. Lesen Sie jetzt „Gasalarm im Kurzentrum - Vier Verletzte“.,https://img.zeit.de/news/2026-03/04/gasalarm-im-kurzentrum-vier-verletzte-image-group/wide__1300x731,2026-03-04T16:37:13Z,,"Im Kurzentrum von Horn-Bad Meinberg im Kreis Lippe sind vier Personen durch das Gas Kohlenstoffdioxid (CO2) verletzt worden. Unter ihnen ist eine schwer verletzte Reinigungskraft, die bewusstlos im K… [+441 chars]",,de,'Gas'
https://www.faz.net/aktuell/feuilleton/medien-und-film/fernsehfilm/zdf-zeigt-landkrimi-schnee-von-gestern-keine-spur-von-idylle-in-den-bergen-110847166.html,https://www.faz.net/aktuell/feuilleton/medien-und-film/fernsehfilm/zdf-zeigt-landkrimi-schnee-von-gestern-keine-spur-von-idylle-in-den-bergen-110847166.html,0,www.faz.net,„Landkrimi“ im ZDF: Von der Außenwelt sind sie abgeschnitten,"Von Idylle in den Bergen ist im „Landkrimi: Schnee von gestern“ keine Spur. Im Dorf mit dem sprechenden Namen „Inner Ainöd“ geht ein Mörder um. Die ermittelnden Kommissare stehen erst im Regen, dann in der Traufe.",https://media0.faz.net/image/w1200h627/ee7274f8af4d/w3000h1567x0y261o/032026/1.10847161/ein-mann-schreit-im-schnee.webp,2026-03-04T16:39:00Z,,"Der ORF-Landkrimi hat einmal mehr Zuwachs bekommen, und im Gegensatz zu anderen Reihen kann man hier sicher sein, nicht mit Dutzendware abgespeist zu werden. Schnee von gestern spielt in Lienz, Ostti… [+4315 chars]",,de,'Schnee'
https://www.stern.de/gesellschaft/regional/bayern/hohe-gas--und-oelpreise--aiwanger-fordert-stopp-der-co2-steuer-wegen-preisschub-37192166.html,https://www.stern.de/gesellschaft/regional/bayern/hohe-gas--und-oelpreise--aiwanger-fordert-stopp-der-co2-steuer-wegen-preisschub-37192166.html,0,www.stern.de,Hohe Gas- und Ölpreise: Aiwanger fordert Stopp der CO2-Steuer wegen Preisschub,München (lby) - Bayerns Wirtschaftsminister Hubert Aiwanger (Freie Wähler) fordert angesichts gestiegener Preise für Öl und Gas den Stopp der CO2-Steuer.,https://image.stern.de/37192168/t/S4/v1/w1440/r1.7778/-/04--z3wczzevwev7axs2048jpeg---1995e1c8d5ad9a20.jpg,2026-03-04T18:07:06Z,,"Kopiere den aktuellen Link
Zur Merkliste hinzufügen
Spritpreise könnten laut Hubert Aiwanger sofort um 15 bis 20 Cent sinken wenn die CO2-Steuer fällt. Wo er stattdessen Einsparpotenzial sieht.
Ba… [+1429 chars]",,de,'Heizen'
https://www.zeit.de/news/2026-03/04/aiwanger-fordert-stopp-der-co2-steuer-wegen-preisschub,https://www.zeit.de/news/2026-03/04/aiwanger-fordert-stopp-der-co2-steuer-wegen-preisschub,0,www.zeit.de,Hohe Gas- und Ölpreise: Aiwanger fordert Stopp der CO2-Steuer wegen Preisschub,Hier finden Sie Informationen zu dem Thema „Hohe Gas- und Ölpreise“. Lesen Sie jetzt „Aiwanger fordert Stopp der CO2-Steuer wegen Preisschub“.,https://img.zeit.de/news/2026-03/04/aiwanger-fordert-stopp-der-co2-steuer-wegen-preisschub-image-group/wide__1300x731,2026-03-04T18:07:06Z,,Bayerns Wirtschaftsminister Hubert Aiwanger (Freie Wähler) fordert angesichts gestiegener Preise für Öl und Gas den Stopp der CO2-Steuer. Der Bund und die Europäische Union müssten die heimische Wirt… [+1271 chars],,de,'Gas'
https://www.zeit.de/news/2026-03/05/wo-das-wetter-in-baden-wuerttemberg-zum-eisessen-einlaedt,https://www.zeit.de/news/2026-03/05/wo-das-wetter-in-baden-wuerttemberg-zum-eisessen-einlaedt,0,www.zeit.de,DWD-Vorhersage: Wo das Wetter in Baden-Württemberg zum Eisessen einlädt,Hier finden Sie Informationen zu dem Thema „DWD-Vorhersage“. Lesen Sie jetzt „Wo das Wetter in Baden-Württemberg zum Eisessen einlädt“.,https://img.zeit.de/news/2026-03/05/wo-das-wetter-in-baden-wuerttemberg-zum-eisessen-einlaedt-image-group/wide__1300x731,2026-03-05T04:43:47Z,,"Erdbeere, Zitrone oder doch lieber Schokolade? In Teilen Baden-Württembergs könnten sich die Menschen heute und in den kommenden Tagen genau diese Frage stellen, wenn sie vor der Eisdiele in der Schl… [+1060 chars]",,de,'Eis'
https://www.autobild.de/artikel/schlagloch-schaden-wer-haftet-bei-schaeden--25337819.html,https://www.autobild.de/artikel/schlagloch-schaden-wer-haftet-bei-schaeden--25337819.html,0,www.autobild.de,In diesem Jahr gibt es besonders viele Schlaglöcher – wer haftet?,"Aufgrund des häufigen Wechsels zwischen Frost und Tauwetter ist es in einigen Regionen Deutschlands in diesem Jahr zu mehr Schlaglöchern als üblich gekommen. Wie Sie sich verhalten sollten, wenn Sie durch ein Schlagloch gefahren sind – und wer bei Schäden auf…",https://i.auto-bild.de/ir_img/3/5/6/0/5/0/5/Schlagloch-Alarm-2869-1200x674-4518696f0f67434d.jpg?impolicy=og_images,2026-03-05T05:00:00Z,,"Schlaglöcher im Asphalt entstehen vor allem im Winter: Feuchtigkeit dringt in kleine Risse in der Asphaltdecke ein, dehnt sich beim Gefrieren aus und sprengt den Asphalt dabei auf. Durch den häufigen… [+2821 chars]",,de,'Gefrieren'
https://noe.orf.at/stories/3344374/,https://noe.orf.at/stories/3344374/,0,noe.orf.at,Energiesparen: Langfristige Konzepte nötig,Der 5. März ist der internationale Tag des Energiesparens. Nach den erneuten Unruhen im nahen Osten könnten Preise für Öl und Gas wieder steigen. Die Energie- und Umweltagentur (eNu) des Landes setzt in ihren Beratungen diesbezüglich auf langfristige Konzepte.,https://ibs.orf.at/noe?image=https%3A%2F%2Foekastatic.orf.at%2Fmims%2F2025%2F46%2F49%2Fcrops%2Fw%3D1200%2Ch%3D627%2Cq%3D75%2F2833800_master_1094049_abd_20220720_abd0028.hr.jpg%3Fs%3D1bdc0fb448f4ac7d06cc45d65bdd9450223daa9a,2026-03-05T07:24:20Z,,"Seit Beginn des Krieges, den die USA und Israel gemeinsam mit ihren völkerrechtswidrigen Angriffen am Samstag starteten, ist der Gaspreis um mehr als 80 Prozent gestiegen. Noch stärker war der Gaspre… [+2396 chars]",,de,'Gas'
https://www.tagesspiegel.de/dunkelheit-vom-osten-bis-zum-westen-millionen-menschen-auf-kuba-ohne-strom-15318276.html,https://www.tagesspiegel.de/dunkelheit-vom-osten-bis-zum-westen-millionen-menschen-auf-kuba-ohne-strom-15318276.html,0,www.tagesspiegel.de,Dunkelheit vom Osten bis zum Westen: Millionen Menschen auf Kuba ohne Strom,Für Kubanerinnen und Kubaner gehören Stromausfälle zum Alltag. Doch seit den neuesten US-Sanktionen hat sich die Lage weiter verschärft. Die Reparatur könnte dauern.,https://www.tagesspiegel.de/images/15318310/alternates/BASE_16_9_W1400/1772702912000/cuba-energy-blackout.jpeg,2026-03-05T09:32:15Z,,"Auf Kuba sind erneut Millionen Menschen ohne Strom. Ursache sei eine Störung im größten Wärmekraftwerk des Landes östlich der Hauptstadt Havanna, teilte der Stromversorger der sozialistischen Karibik… [+2175 chars]",,de,'Dunkelheit'
https://www.faz.net/aktuell/reise/wanderung-an-der-frostigen-ostseekueste-accg-110846925.html,https://www.faz.net/aktuell/reise/wanderung-an-der-frostigen-ostseekueste-accg-110846925.html,0,www.faz.net,Wanderung an der Ostsee: Eiszeit an der Ostsee,"Das Meer gefroren, der Strand von Schnee bedeckt: In acht Tagen zu Fuß von Barth nach Swinemünde, immer an der Ostseeküste entlang – ein Tagebuch aus der Erinnerung.",https://media0.faz.net/image/w1200h627/d5603b7a22a1/w2250h1175x0y266o/032026/1.10846924/spiegel-statt-buergersteig.webp,2026-03-05T10:35:09Z,,"Meer, Wellen, Strände: Ab Barth ist es damit vorüber. Auch der Wind, der bei Zingst noch tobte, hat nachgelassen. Seinetwegen hatten sich minus fünf Grad angefühlt wie minus zwanzig. Vereistes Wasser… [+20807 chars]",,de,'Schnee'
https://www.bild.de/sport/fussball/reporter-ueberrascht-kompany-verkuendet-grosse-personal-news-69a941e6e113ea4ba793699c,https://www.bild.de/sport/fussball/reporter-ueberrascht-kompany-verkuendet-grosse-personal-news-69a941e6e113ea4ba793699c,0,www.bild.de,Reporter überrascht - Kompany verkündet große Personal-News,Die Fußball-Sendung mit TV-Legende Marcel Reif im Livestream.,"https://images.bild.de/69a941e6e113ea4ba793699c/002ae1c5fa1ce8c613474770e9351dec-landscape,d51f604?w=1280",2026-03-05T10:59:45Z,,"+++Mit vier anderen EU-Staaten: Deutschland baut Abschiebe-Zentren im Ausland
+++Mit vier anderen EU-Staaten: Deutschland baut Abschiebe-Zentren im Ausland
+++Mit vier anderen EU-Staaten: Deutschla… [+588 chars]",,de,'Reif'
https://www.bild.de/sport/fussball/vor-erneutem-fehltritt-hier-drohte-nagelsmann-ruediger-mit-konsequenzen-69a94176e113ea4ba7936988,https://www.bild.de/sport/fussball/vor-erneutem-fehltritt-hier-drohte-nagelsmann-ruediger-mit-konsequenzen-69a94176e113ea4ba7936988,0,www.bild.de,Vor erneutem Fehltritt - Hier drohte Nagelsmann Rüdiger mit Konsequenzen,Die Fußball-Sendung mit TV-Legende Marcel Reif im Livestream.,"https://images.bild.de/69a94176e113ea4ba7936988/5120d345e70c173997844e455ee130c3-landscape,3f5bd02f?w=1280",2026-03-05T11:01:39Z,,"+++Mit vier anderen EU-Staaten: Deutschland baut Abschiebe-Zentren im Ausland
+++Mit vier anderen EU-Staaten: Deutschland baut Abschiebe-Zentren im Ausland
+++Mit vier anderen EU-Staaten: Deutschla… [+588 chars]",,de,'Reif'
https://www.bild.de/sport/fussball/reif-ueber-ruediger-eklat-wenn-er-das-auf-der-strasse-macht-dann-69a9423be113ea4ba79369aa,https://www.bild.de/sport/fussball/reif-ueber-ruediger-eklat-wenn-er-das-auf-der-strasse-macht-dann-69a9423be113ea4ba79369aa,0,www.bild.de,"Reif über Rüdiger-Eklat - „Wenn er das auf der Straße macht, dann…“",Die Fußball-Sendung mit TV-Legende Marcel Reif im Livestream.,"https://images.bild.de/69a9423be113ea4ba79369aa/2b77b0920e7b7168142491ffad65498d-landscape,d87faf20?w=1280",2026-03-05T11:02:10Z,,"+++Mit vier anderen EU-Staaten: Deutschland baut Abschiebe-Zentren im Ausland
+++Mit vier anderen EU-Staaten: Deutschland baut Abschiebe-Zentren im Ausland
+++Mit vier anderen EU-Staaten: Deutschla… [+588 chars]",,de,'Reif'
https://www.bild.de/sport/fussball/deutscher-top-stuermer-undav-botschaft-an-nagelsmann-69a9419be113ea4ba793698e,https://www.bild.de/sport/fussball/deutscher-top-stuermer-undav-botschaft-an-nagelsmann-69a9419be113ea4ba793698e,0,www.bild.de,Deutscher Top-Stürmer - Undav-Botschaft an Nagelsmann,Die Fußball-Sendung mit TV-Legende Marcel Reif im Livestream.,"https://images.bild.de/69a9419be113ea4ba793698e/43faa9992bf782d41e781f855e6cd502,11e1032c?w=1280",2026-03-05T11:02:54Z,,"+++Mit vier anderen EU-Staaten: Deutschland baut Abschiebe-Zentren im Ausland
+++Mit vier anderen EU-Staaten: Deutschland baut Abschiebe-Zentren im Ausland
+++Mit vier anderen EU-Staaten: Deutschla… [+588 chars]",,de,'Reif'
https://taz.de/Winter-Paralympics-in-Italien/!6160073/,https://taz.de/Winter-Paralympics-in-Italien/!6160073/,0,taz.de,Winter-Paralympics in Italien: So geht Paralympics,Das Stichwort bei den am Freitag startenden Paralympics lautet Klassifizierung: Die Einteilung erfolgt je nach Behinderungsgrad.,https://taz.de/picture/8296937/1200/40611588.jpeg,2026-03-05T12:13:00Z,,Das Stichwort bei den am Freitag startenden Paralympics lautet Klassifizierung: Die Einteilung erfolgt je nach Behinderungsgrad. mehr...,,de,'Winter'
https://www.stern.de/sport/winter-paralympics--zwischen-konflikten-und-medaillen--team-d-startet-in-italien-37194638.html,https://www.stern.de/sport/winter-paralympics--zwischen-konflikten-und-medaillen--team-d-startet-in-italien-37194638.html,0,www.stern.de,Winter-Paralympics: Zwischen Konflikten und Medaillen: Team D startet in Italien,"Keine Athleten beim Einmarsch, politische Spannungen und Sonne statt Schnee: Vor dem Start der Paralympics in Italien steht nicht nur der Sport im Fokus. Deutschland hat aber ein klares Ziel.",https://image.stern.de/37194640/t/rv/v1/w1440/r1.7778/-/05--nsixl26pozv3axs2048jpeg---b17a754d23eea36d.jpg,2026-03-05T13:32:14Z,,"Kopiere den aktuellen Link
Zur Merkliste hinzufügen
Keine Athleten beim Einmarsch, politische Spannungen und Sonne statt Schnee: Vor dem Start der Paralympics in Italien steht nicht nur der Sport i… [+5235 chars]",,de,'Schnee'
https://www.tagesspiegel.de/sport/winter-paralympics-zwischen-konflikten-und-medaillen-team-d-startet-in-italien-15320371.html,https://www.tagesspiegel.de/sport/winter-paralympics-zwischen-konflikten-und-medaillen-team-d-startet-in-italien-15320371.html,0,www.tagesspiegel.de,Winter-Paralympics: Zwischen Konflikten und Medaillen: Team D startet in Italien,"Keine Athleten beim Einmarsch, politische Spannungen und Sonne statt Schnee: Vor dem Start der Paralympics in Italien steht nicht nur der Sport im Fokus. Deutschland hat aber ein klares Ziel.",https://www.tagesspiegel.de/images/15320370/alternates/BASE_16_9_W1400/1772717625000/paralympics-2026.jpeg,2026-03-05T13:33:45Z,,Bei der Suche nach dem Quartier von Team D im Paralympischen Dorf von Cortina d'Ampezzo hält man vergeblich Ausschau nach einer deutschen Fahne. Erst im hinteren Drittel des Areals markieren schwarz-… [+5070 chars],,de,'Schnee'
https://www.sueddeutsche.de/stil/fruehling-deutschland-fruehblueher-mode-li.3393860,https://www.sueddeutsche.de/stil/fruehling-deutschland-fruehblueher-mode-li.3393860,0,www.sueddeutsche.de,Garten: Endlich Frühling!,"Krokusse und Narzissen fangen an zu knospen, auch die Mode ist in federleichter Stimmung: Nach einem langen Winter blüht nicht nur die Natur auf.",https://www.sueddeutsche.de/2026/03/03/d85da19e-4e36-4495-b8fc-f37be6df7e15.jpg?q=60&fm=webp&width=1200&rect=0%2C304%2C4000%2C2250,2026-03-05T14:12:17Z,,"Hoffnungsvoll
Gestern lag noch Schnee, dann geht plötzlich alles ganz schnell. Zwischen braunen Blättern und grauen Schneeresten verkünden gelb-lila-weiße Farbtupfer den Neuanfang: zuerst die Schnee… [+902 chars]",,de,'Winter'
https://www.zeit.de/news/2026-03/05/mit-sledgehockey-spieler-forster-wieder-fahnentraegerin,https://www.zeit.de/news/2026-03/05/mit-sledgehockey-spieler-forster-wieder-fahnentraegerin,0,www.zeit.de,Winter-Paralympics: Mit Sledgehockey-Spieler: Forster wieder Fahnenträgerin,Hier finden Sie Informationen zu dem Thema „Winter-Paralympics“. Lesen Sie jetzt „Mit Sledgehockey-Spieler: Forster wieder Fahnenträgerin“.,https://img.zeit.de/news/2026-03/05/mit-sledgehockey-spieler-forster-wieder-fahnentraegerin-image-group/wide__1300x731,2026-03-05T14:14:17Z,,Die alpine Skirennläuferin Anna-Lena Forster ist zum zweiten Mal die deutsche Fahnenträgerin bei der Eröffnungsfeier der Winter-Paralympics. Wie bereits 2022 in Peking ist die viermalige Paralympicss… [+1390 chars],,de,'Winter'
https://wien.orf.at/stories/3344611/,https://wien.orf.at/stories/3344611/,0,wien.orf.at,Luft nach oben bei „Sackerl für’s Gackerl“,Rund 100.000 „Sackerl für’s Gackerl“ oder ähnliche Gebinde landen in Wien täglich im Mistkübel. Aus Sicht der Stadt Wien könnten es noch mehr sein. Denn einige Hundehalter würden den Kot ihrer Tiere gerade während der Wintermonate nicht ordnungsgemäß entsorge…,https://ibs.orf.at/wie?image=https%3A%2F%2Foekastatic.orf.at%2Fmims%2F2026%2F10%2F01%2Fcrops%2Fw%3D1200%2Ch%3D627%2Cq%3D75%2F2958936_master_1144001_3ef92a75-8d9a-4da6-8116-07c88a56e21b.jpg%3Fs%3Dd7d04f73d3d5d09f56defdf3d267631b35f1225b,2026-03-05T18:24:12Z,,"Zunächst bleibt der Hundekot oft im Schnee verborgen. Ist dieser nach dem Winter weg, wird auch der Kot sichtbar. Wiesen, Grünstreifen und Gehwege würden dann plötzlich stark verschmutzt wirken, was … [+1292 chars]",,de,'Schnee'
https://www.zeit.de/news/2026-03/06/fegebank-gas-und-oel-nie-wieder-verlaessliche-energietraeger,https://www.zeit.de/news/2026-03/06/fegebank-gas-und-oel-nie-wieder-verlaessliche-energietraeger,0,www.zeit.de,Energieversorgung: Fegebank: Gas und Öl nie wieder verlässliche Energieträger,Hier finden Sie Informationen zu dem Thema „Energieversorgung“. Lesen Sie jetzt „Fegebank: Gas und Öl nie wieder verlässliche Energieträger“.,https://img.zeit.de/news/2026-03/06/fegebank-gas-und-oel-nie-wieder-verlaessliche-energietraeger-image-group/wide__1300x731,2026-03-06T05:30:04Z,,Hamburgs Umweltsenatorin Katharina Fegebank setzt angesichts stark steigender Energiepreise infolge des Iran-Kriegs klar auf erneuerbare Energien. Bereits der russische Angriffskrieg auf die Ukraine … [+1405 chars],,de,'Gas'
