index,url,valid,domain,title,description,image,published,archive,content,quote,language,keyword
https://www.zeit.de/entdecken/reisen/2024-08/cold-hawaii-daenemark-surfen-kueste,https://www.zeit.de/entdecken/reisen/2024-08/cold-hawaii-daenemark-surfen-kueste,0,www.zeit.de,Cold Hawaii: Die Kälte gibt dir den Kick,"Es ist zwar etwas kühler dort, aber: ""Die Kälte gibt dir den Kick"", sagen erfahrene Surfer. Unser Autor surft schon länger und hat das dänische Cold Hawaii ausprobiert.",https://img.zeit.de/2024/35/die-kaelte-gibt-dir-den-kick-bild-1/wide__1300x731,2024-08-15T12:22:44Z,,"Als ich von
Hamburg aus die A7 Richtung Norden nehme, liegen in meinem Kombi drei
unterschiedlich dicke Neoprenanzüge, ein Neopren-Sweatshirt, ein
Neopren-Unterzieher, je ein Paar Neopren-Handschu… [+701 chars]",,de,'Kälte'
https://www.focus.de/focustv/k1-magazin/k1-magazin-donnerstag-den-15-08-2024-um-22-15-uhr-bei-kabel-eins-mit-diesen-themen_id_260227421.html,https://www.focus.de/focustv/k1-magazin/k1-magazin-donnerstag-den-15-08-2024-um-22-15-uhr-bei-kabel-eins-mit-diesen-themen_id_260227421.html,0,www.focus.de,"K1 Magazin, Donnerstag, den 15.08.2024 um 22:15 Uhr bei kabel eins - Mit diesen Themen:","Bolzen statt Beten: Neue Ideen für leerstehende Kirchen!
Speiseeis ohne Eismaschine: Drei Rezepte für den eiskalten Genuss.
Im Sommer schön braun: Was ist der beste UV-Schutz?",https://p6.focus.de/img/focustv/k1-magazin/id_137080265/k1-logo-neu-website-16-9.png?im=Crop%3D%280%2C40%2C1280%2C640%29%3BResize%3D%281200%2C627%29&impolicy=perceptual&quality=mediumHigh&hash=0f5fd989c3c3c9b4ebb7a81a13d71617da6e5452c769d50df7b95e083edb654b,2024-08-15T16:00:32Z,,"Bolzen statt Beten: Neue Ideen für leerstehende Kirchen!
Über 400.000 Menschen sind im vergangenen Jahr aus der katholischen Kirche ausgetreten. Eine Konsequenz: Immer mehr Kirchengebäude bleiben le… [+1387 chars]",,de,'Eis'
https://www.morgenpost.de/politik/article407023402/experten-befuerchten-massenflucht-doch-sie-waere-zu-verhindern.html,https://www.morgenpost.de/politik/article407023402/experten-befuerchten-massenflucht-doch-sie-waere-zu-verhindern.html,0,www.morgenpost.de,Experten befürchten Massenflucht – doch sie wäre zu verhindern,In der Ukraine tobt ein Kampf um Licht und Wärme. Das Worst-Case-Szenario im Winter: Millionen Flüchtlinge. Eine Studie zeigt Lösungen auf.,https://img.sparknews.funkemedien.de/407024701/407024701_1723738554_v16_9_1600.jpeg,2024-08-15T16:15:55Z,,"Berlin. In der Ukraine tobt ein Kampf um Licht und Wärme. Das Worst-Case-Szenario im Winter: Millionen Flüchtlinge. Eine Studie zeigt Lösungen auf. 
Ständig greift Russland die ukrainische Energieve… [+5496 chars]",,de,'Winter'
https://www.stern.de/panorama/wissen/raumfahrt--training-im-eis-koennte-ins-weltall-fuehren-34984662.html,https://www.stern.de/panorama/wissen/raumfahrt--training-im-eis-koennte-ins-weltall-fuehren-34984662.html,0,www.stern.de,Raumfahrt: Training im Eis könnte ins Weltall führen,"Schon häufig hieß es, jetzt könnte endlich die erste deutsche Astronautin starten. Ist es diesmal endlich so weit? Rabea Rogge aus Berlin führte ein eher ungewöhnlicher Weg zum Astro-Training.",https://image.stern.de/34984664/t/1Q/v1/w1440/r1.7778/-/16--zdsnwz765qv7axw800h600jpeg---2e3b51e23fee76fb.jpg,2024-08-16T06:05:29Z,,"Schon häufig hieß es, jetzt könnte endlich die erste deutsche Astronautin starten. Ist es diesmal endlich so weit? Rabea Rogge aus Berlin führte ein eher ungewöhnlicher Weg zum Astro-Training.
Ein E… [+5081 chars]",,de,'Eis'
https://www.zeit.de/news/2024-08/16/training-im-eis-koennte-ins-weltall-fuehren,https://www.zeit.de/news/2024-08/16/training-im-eis-koennte-ins-weltall-fuehren,0,www.zeit.de,Raumfahrt: Training im Eis könnte ins Weltall führen,Hier finden Sie Informationen zu dem Thema „Raumfahrt“. Lesen Sie jetzt „Training im Eis könnte ins Weltall führen“.,https://img.zeit.de/news/2024-08/16/training-im-eis-koennte-ins-weltall-fuehren-image-group/wide__1300x731,2024-08-16T06:05:29Z,,Ein Expeditionstraining im eiskalten Spitzbergen hat Rabea Rogge eine einzigartige Chance gebracht: Sie könnte als erste deutsche Frau ins All fliegen. Bei dem Training im hohen Norden habe sie Chun … [+5580 chars],,de,'Eis'
https://www.focus.de/wissen/hirnfrost-darum-sticht-der-kopf-wenn-sie-ein-eis-essen_id_196278679.html,https://www.focus.de/wissen/hirnfrost-darum-sticht-der-kopf-wenn-sie-ein-eis-essen_id_196278679.html,0,www.focus.de,"Hirnfrost - Darum sticht der Kopf, wenn Sie ein Eis essen","Sommerhitze: Eis ist oft die perfekte Abkühlung! Doch dann passiert es: ein Kältekopfschmerz macht sich beim Eisessen bemerkbar. Wir verraten Ihnen, wieso Sie diese Kopfschmerzen bekommen und was Sie dagegen tun können.",https://p6.focus.de/img/fotos/id_196288101/gettyimages-1042466722-170667a.jpg?im=Crop%3D%280%2C26%2C537%2C268%29%3BResize%3D%281200%2C627%29&impolicy=perceptual&quality=mediumHigh&hash=5ef0e79711f50130cc8001d149bcec5af3420b9a526c4855f111af7109462304,2024-08-16T11:54:59Z,,"Kennen Sie das auch? Sie löffeln genüsslich ein Eis und dann schießt ganz plötzlich ein stechender Schmerz in Ihre Stirn, fast so, als würde Ihr Hirn gefrieren. Tatsächlich nennt man diesen Kältekopf… [+2023 chars]",,de,'Kälte'
https://www.tagesspiegel.de/berlin/berliner-wirtschaft/kalter-fruhling-leere-kisten-brandenburgs-obstbauern-bangen-um-die-zukunft-12203105.html,https://www.tagesspiegel.de/berlin/berliner-wirtschaft/kalter-fruhling-leere-kisten-brandenburgs-obstbauern-bangen-um-die-zukunft-12203105.html,0,www.tagesspiegel.de,"Kalter Frühling, leere Kisten: Brandenburgs Obstbauern bangen um ihre Zukunft","Der Frost hat die Ernte vernichtet. Ob Brandenburger Obstbauern Hilfe aus EU-Töpfen bekommen, steht noch nicht fest.",https://www.tagesspiegel.de/images/12211052/alternates/BASE_16_9_W1400/1723817698000/apfelbaum-mit-apfel.jpeg,2024-08-16T16:20:06Z,,"So etwas habe er noch nie erlebt, sagt Sylvio Lienert. Ich hatte in diesem Jahr nicht mal eine Kirsche zum Kosten. Seit 1993 betreibt er eine Plantage im Havelland, auf der Kunden selbst Obst pflücke… [+5447 chars]",,de,'Frost'
https://orf.at/stories/3366738/,https://orf.at/stories/3366738/,0,orf.at,Extremwetter mit schweren Folgen,"Frost, Hagel, Sturm, Überschwemmungen, Hitze, Dürre – Extremwetterereignisse wie diese werden durch die Klimakrise zusätzlich angefacht. Sie bringen nicht nur schwere Schäden etwa für die Landwirtschaft, sondern auch die Versicherer zunehmend unter Druck.",https://ibs.orf.at/news?image=https%3A%2F%2Fassets.orf.at%2Fmims%2F2024%2F33%2F73%2Fcrops%2Fw%3D1200%2Ch%3D630%2Cq%3D75%2F2319289_master_883173_klima_extremwetter_folgen_schaeden_im.jpg%3Fs%3Dce662924725b57a57a25464a9ea0ef5bcf523453,2024-08-16T17:58:22Z,,Die österreichische Hagelversicherung schätzt die durch Extremwetterereignisse entstandenen Schäden bis Mitte August für die Landwirtschaft auf 200 Mio. Euro. Alleine die Dürre dürfte mittlerweile Sc… [+5171 chars],,de,'Frost'
https://taz.de/Klimawandel-friert-Obstanbau-ein/!6030542/,https://taz.de/Klimawandel-friert-Obstanbau-ein/!6030542/,0,taz.de,Klimawandel friert Obstanbau ein: Schlechteste Apfelernte seit 2017,In Deutschland werden 2024 wohl rund ein Viertel weniger Äpfel geerntet. Frost hat die dank Klimawandel früh blühenden Bäume geschädigt.,https://taz.de/picture/7186614/948/36026852-1.jpeg,2024-08-16T18:05:00Z,,"In Deutschland werden 2024 wohl rund ein Viertel weniger Äpfel geerntet. Frost hat die dank Klimawandel früh blühenden Bäume geschädigt.
Erste Apfel-Ernte im Sülzetal Foto: Klaus-Dietmar Gabbert/dpa… [+3843 chars]",,de,'Frost'
https://www.stern.de/gesellschaft/regional/thueringen/weinbau--feuchtigkeit-und-hitze-bringen-winzer-unter--pilzdruck--34987232.html,https://www.stern.de/gesellschaft/regional/thueringen/weinbau--feuchtigkeit-und-hitze-bringen-winzer-unter--pilzdruck--34987232.html,0,www.stern.de,"Weinbau: Feuchtigkeit und Hitze bringen Winzer unter ""Pilzdruck""",Der Frost hat schon die ersten Triebe auf dem Gewissen. Nun kämpfen die Winzer mit anderen Herausforderungen. Grund zum Feiern haben sie dieses Wochenende trotzdem.,https://image.stern.de/34987234/t/_o/v1/w1440/r1.7778/-/17--jwvfus2dqvv24axw800h600jpeg---0bb976d6bcfe9d85.jpg,2024-08-17T02:30:37Z,,"Der Frost hat schon die ersten Triebe auf dem Gewissen. Nun kämpfen die Winzer mit anderen Herausforderungen. Grund zum Feiern haben sie dieses Wochenende trotzdem.
Hohe Temperaturen und teils reich… [+3028 chars]",,de,'Frost'
https://kaernten.orf.at/stories/3269362/,https://kaernten.orf.at/stories/3269362/,0,kaernten.orf.at,Apfelernte begann ungewöhnlich früh,"2024 ist ein herausforderndes Jahr für die heimischen Obstbauern. Erst gab es  hohe Temperaturen im März, dann Frost und viele Regentage und jetzt die Hitze. Die Wetterextreme schwächen die Pflanzen und machen sie anfällig für Krankheiten oder Pilzinfektionen…",https://ibs.orf.at/ktn?image=https%3A%2F%2Foekastatic.orf.at%2Fmims%2F2020%2F47%2F94%2Fcrops%2Fw%3D1200%2Ch%3D627%2Cq%3D75%2F753912_master_261794___kh_v1_neu_apfelernte_201113_00_01_00_06.jpg%3Fs%3D34c4bcde5183a5b4073bfe71c101a93f47e67420,2024-08-17T05:06:58Z,,Als durchwachsen und ungewöhnlich bezeichnete Manfred Reautschnig das heurige Jahr. Für den Obstbauern aus Ebenthal im Bezirk Klagenfurt Land begann die Apfelernte bereits: Ich habe jetzt schon zwei … [+1525 chars],,de,'Frost'
https://www.morgenpost.de/ratgeber-wissen/article407014250/coE28282-preis-steigt-wie-bekomme-ich-geld-vom-vermieter-zurueck.html,https://www.morgenpost.de/ratgeber-wissen/article407014250/coE28282-preis-steigt-wie-bekomme-ich-geld-vom-vermieter-zurueck.html,0,www.morgenpost.de,CO₂-Preis steigt: Wie bekomme ich Geld vom Vermieter zurück?,"Wer mit Gas, Öl oder Fernwärme heizt, zahlt den CO₂-Preis. Jetzt beteiligen sich Vermieter an den Kosten – sofern man das selbst einfordert.",https://img.sparknews.funkemedien.de/407020930/407020930_1723979097_v16_9_1600.jpeg,2024-08-18T11:04:59Z,,"Berlin. Wer mit Gas, Öl oder Fernwärme heizt, zahlt den CO-Preis. Jetzt beteiligen sich Vermieter an den Kosten sofern man das selbst einfordert.
Das Klima zu erwärmen, kostet extra dafür sorgt seit… [+5121 chars]",,de,'Gas'
https://www.stern.de/gesellschaft/regional/thueringen/weinbau--neue-weinprinzessin-gekroent---winzer-beklagen--pilzdruck--34989720.html,https://www.stern.de/gesellschaft/regional/thueringen/weinbau--neue-weinprinzessin-gekroent---winzer-beklagen--pilzdruck--34989720.html,0,www.stern.de,"Weinbau: Neue Weinprinzessin gekrönt - Winzer beklagen ""Pilzdruck""",Der Frost hat schon die ersten Triebe auf dem Gewissen. Nun kämpfen die Winzer mit anderen Herausforderungen. Grund zum Feiern haben sie dieses Wochenende trotzdem.,https://image.stern.de/34989722/t/lM/v1/w1440/r1.7778/-/18--z25n4bjg46v3axw800h600jpeg---e19fdaf940e651de.jpg,2024-08-18T15:49:20Z,,"Der Frost hat schon die ersten Triebe auf dem Gewissen. Nun kämpfen die Winzer mit anderen Herausforderungen. Grund zum Feiern haben sie dieses Wochenende trotzdem.
Hohe Temperaturen und teils reich… [+3654 chars]",,de,'Frost'
https://www.zeit.de/news/2024-08/18/76-jaehriger-autofahrer-toedlich-verunglueckt,https://www.zeit.de/news/2024-08/18/76-jaehriger-autofahrer-toedlich-verunglueckt,0,www.zeit.de,Unfall bei Nässe: 76-jähriger Autofahrer tödlich verunglückt,Hier finden Sie Informationen zu dem Thema „Unfall bei Nässe“. Lesen Sie jetzt „76-jähriger Autofahrer tödlich verunglückt“.,https://img.zeit.de/news/2024-08/18/76-jaehriger-autofahrer-toedlich-verunglueckt-image-group/wide__1300x731,2024-08-18T19:13:56Z,,"Bei einem Verkehrsunfall in der Region Hannover ist ein 76 Jahre alter Mann am Nachmittag tödlich verunglückt. Eine 27-jährige Frau hatte den folgenschweren Unfall in Neustadt/Rübenberg verursacht, a… [+443 chars]",,de,'Nässe'
https://www.stern.de/gesellschaft/regional/niedersachsen-bremen/unfall-bei-naesse--76-jaehriger-autofahrer-toedlich-verunglueckt-34989842.html,https://www.stern.de/gesellschaft/regional/niedersachsen-bremen/unfall-bei-naesse--76-jaehriger-autofahrer-toedlich-verunglueckt-34989842.html,0,www.stern.de,Unfall bei Nässe: 76-jähriger Autofahrer tödlich verunglückt,Hannover - Bei einem Verkehrsunfall in der Region Hannover ist ein 76 Jahre alter Mann am Nachmittag tödlich verunglückt. Eine 27-jährige Frau hatte den,https://image.stern.de/34989844/t/59/v1/w1440/r1.7778/-/18--7lxwbw4glpv13axw800h600jpeg---257933e5222af9af.jpg,2024-08-18T19:13:56Z,,"Ein junge Autofahrerin kommt auf nasser Straße ins Schleudern. Sie gerät in den Gegenverkehr - und kracht dort in das Auto eines 76-Jährigen.
Bei einem Verkehrsunfall in der Region Hannover ist ein … [+596 chars]",,de,'Nässe'
https://www.kicker.de/wie-schnee-in-der-sonne-geschmolzen-conte-muss-viel-aufarbeiten-1045242/artikel,https://www.kicker.de/wie-schnee-in-der-sonne-geschmolzen-conte-muss-viel-aufarbeiten-1045242/artikel,0,www.kicker.de,"""Wie Schnee in der Sonne geschmolzen"": Conte muss viel aufarbeiten",Mit einer Nackenschelle ist die SSC Neapel in die neue Serie-A-Saison gestartet. Und Trainer Antonio Conte ist bedient.,https://derivates.kicker.de/image/upload/c_crop%2Cx_0%2Cy_131%2Cw_3072%2Ch_1728/w_1200%2Cq_auto/v1/2024/08/18/f8e194b7-8f92-4dbb-ae0c-fe58816cbf4c.jpeg,2024-08-18T21:40:00Z,,"Mit einer Nackenschelle ist die SSC Neapel in die neue Serie-A-Saison gestartet. Und Trainer Antonio Conte ist bedient. 
 Klar, der von Chelsea oder auch Paris Saint-Germain umworbene Victor Osimhen… [+1817 chars]",,de,'Schnee'
https://www.bild.de/sport/fussball/dfb-pokal-und-bundesliga-start-jetzt-hier-reif-ist-live-gucken-66c272fe06f52977c7f707c0,https://www.bild.de/sport/fussball/dfb-pokal-und-bundesliga-start-jetzt-hier-reif-ist-live-gucken-66c272fe06f52977c7f707c0,0,www.bild.de,DFB-Pokal und Bundesliga-Start - Jetzt hier „Reif ist Live“ gucken,Jetzt im Livestream: Reif ist live mit BILD-Experte Marcel Reif.,"https://images.bild.de/66c272fe06f52977c7f707c0/44ef979845803bcf501c10237e27b9a5,997dbf1a?w=1280",2024-08-19T08:17:26Z,,"Mehr zum Video anzeigen 
Jetzt im Livestream: Reif ist live mit BILD-Experte Marcel Reif.
Quelle: BILD19.08.2024 - 10:35 Uhr",,de,'Reif'
https://www.bild.de/sport/fussball/das-kann-auch-nicht-gesund-sein-goretzka-warnung-an-die-bayern-66c30719a47d17441b1b544e,https://www.bild.de/sport/fussball/das-kann-auch-nicht-gesund-sein-goretzka-warnung-an-die-bayern-66c30719a47d17441b1b544e,0,www.bild.de,Reif: „Das kann auch nicht gesund sein“ - Goretzka-Warnung an die Bayern!,Die Vertragssituation von Leon Goretzka beim FC Bayern München bleibt ein Diskussionsthema. Marcel Reif schickt eine Warnung an die Bayern ...,"https://images.bild.de/66c30719a47d17441b1b544e/ab5edc7a4bfe0704c04a7c0f4fbe0f73-landscape,52914db1?w=1280",2024-08-19T09:00:43Z,,"Mehr zum Video anzeigen 
Die Vertragssituation von Leon Goretzka beim FC Bayern München bleibt ein Diskussionsthema. Marcel Reif schickt eine Warnung an die Bayern ...
Quelle: BILD19.08.2024 - 11:0… [+4 chars]",,de,'Reif'
https://www.bild.de/sport/fussball/stadion-beobachtung-deutete-tah-an-dass-er-nicht-zu-bayern-geht-66c31304309e1677c25e77ed,https://www.bild.de/sport/fussball/stadion-beobachtung-deutete-tah-an-dass-er-nicht-zu-bayern-geht-66c31304309e1677c25e77ed,0,www.bild.de,"Spannende Stadion-Beobachtung! - Deutete Tah an, dass er nicht zu Bayern geht?",Die Wechselgerüchte um Jonathan Tah von Bayern 04 Leverkusen zum FC Bayern München beschäftigen uns den ganzen Sommer. Marcel Reif hat eine Beobachtung d...,"https://images.bild.de/66c31304309e1677c25e77ed/f396df855b5f4c875d96ce5267c88d1a-landscape,e8e58ac?w=1280",2024-08-19T09:54:07Z,,"Mehr zum Video anzeigen 
Die Wechselgerüchte um Jonathan Tah von Bayern 04 Leverkusen zum FC Bayern München beschäftigen uns den ganzen Sommer. Marcel Reif hat eine Beobachtung dazu ...
Quelle: BIL… [+22 chars]",,de,'Reif'
https://www.faz.net/aktuell/wirtschaft/klima-nachhaltigkeit/auch-im-klimafonds-ktf-klafft-eine-grosse-milliardenluecke-19928889.html,https://www.faz.net/aktuell/wirtschaft/klima-nachhaltigkeit/auch-im-klimafonds-ktf-klafft-eine-grosse-milliardenluecke-19928889.html,0,www.faz.net,Auch im Klimafonds klafft eine große Milliardenlücke,Der sogenannte Klima- und Transformationsfonds (KTF) ist das wichtigste „Sondervermögen“ der Regierung neben dem regulären Bundeshaushalt. Nun zeigt sich: Auch hier dominieren Hoffnungswerte. Müssen am Ende die Zuschüsse für Heizungen gekürzt werden?,https://media1.faz.net/ppmedia/aktuell/wirtschaft/3493145513/1.9928867/facebook_teaser/robert-habeck-buendnis-90-die.jpg,2024-08-19T12:19:45Z,,"Das Geld stammt aus dem Klima- und Transformationsfonds (KTF), dem wichtigsten Sondervermögen der Regierung neben dem regulären Bundeshaushalt. Zusammen mit dem Entwurf für den Haushalt 2025 haben di… [+3992 chars]",,de,'Heizung'
https://www.n-tv.de/politik/Im-Klimafonds-KTF-klafft-ein-Milliarden-Loch-article25168250.html,https://www.n-tv.de/politik/Im-Klimafonds-KTF-klafft-ein-Milliarden-Loch-article25168250.html,0,www.n-tv.de,Fördergeld für Heizungstausch: Im Klimafonds KTF klafft ein Milliarden-Loch,"E-Mobilität, Chip-Fabriken und Heizungswechsel: All das soll durch den Klima- und Transformationsfonds (KTF) gefördert werden. Das Bundesverfassungsgericht strich 60 Milliarden Euro aus dem Topf - und löste die Haushaltskrise aus. Jetzt gibt es wieder eine Fi…",https://bilder2.n-tv.de/img/incoming/crop25168273/3361328441-cImg_16_9-w1200/478038682.jpg,2024-08-19T15:50:55Z,,"E-Mobilität, Chip-Fabriken und Heizungswechsel: All das soll durch den Klima- und Transformationsfonds (KTF) gefördert werden. Das Bundesverfassungsgericht strich 60 Milliarden Euro aus dem Topf - un… [+3987 chars]",,de,'Heizung'
https://orf.at/stories/3366996/,https://orf.at/stories/3366996/,0,orf.at,"Gasspeicher gut gefüllt, E-Control erwartet keinen Mangel",,https://orf.at/mojo/1_4_1/storyserver//news/common/images/og-fallback-news.png,2024-08-19T16:02:21Z,,"Ans Heizen, das oft in Österreich auch mit Gas erfolgt, denken bei der sommerlichen Hitze derzeit wenige. Doch gibt es positive Vorzeichen für die Versorgung in der kalten Jahreszeit. Die Speicher si… [+1282 chars]",,de,'Heizen'
https://www.zeit.de/news/2024-08/19/junge-eistaenzer-misshandelt-trainer-weist-vorwuerfe-zurueck,https://www.zeit.de/news/2024-08/19/junge-eistaenzer-misshandelt-trainer-weist-vorwuerfe-zurueck,0,www.zeit.de,Prozess in Berlin: Junge Eistänzer misshandelt? Trainer weist Vorwürfe zurück,Hier finden Sie Informationen zu dem Thema „Prozess in Berlin“. Lesen Sie jetzt „Junge Eistänzer misshandelt? Trainer weist Vorwürfe zurück“.,https://img.zeit.de/news/2024-08/19/junge-eistaenzer-misshandelt-trainer-weist-vorwuerfe-zurueck-image-group/wide__1300x731,2024-08-19T16:12:13Z,,"Weil er mehrere seiner Eistanz-Schützlinge körperlich misshandelt haben soll, steht der Bundestrainer des Eistanz-Nachwuchses vor einem Berliner Amtsgericht. Dem 37-jährigen Stefano Caruso werden sie… [+3252 chars]",,de,'Eis'
https://www.tagesschau.de/ausland/asien/aserbaidschan-putin-100.html,https://www.tagesschau.de/ausland/asien/aserbaidschan-putin-100.html,0,www.tagesschau.de,"Putins Besuch in Aserbaidschan: Gas, Armenien - kein Wort zu Kursk","Es war ein Besuch ganz nach dem Geschmack Putins: In Aserbaidschan wurde der russische Präsident herzlich empfangen. Man sprach über Öl und Gas, über Armenien - aber nicht über die ukrainische Offensive in Kursk. Von Björn Blaschke.",https://images.tagesschau.de/image/3e7c37ef-09ea-4dcb-bc84-6eb550a97a25/AAABkWtKnZ8/AAABkUqnCZ0/16x9-1280/putin-aserbaidschan-100.jpg,2024-08-19T18:39:57Z,,"Stand: 19.08.2024 20:39 Uhr
Es war ein Besuch ganz nach dem Geschmack Putins: In Aserbaidschan wurde der russische Präsident herzlich empfangen. Man sprach über Öl und Gas, über Armenien - aber nich… [+3240 chars]",,de,'Gas'
https://www.diepresse.com/18776313/gasspeicher-gut-gefuellt-e-control-erwartet-keinen-mangel-im-winter,https://www.diepresse.com/18776313/gasspeicher-gut-gefuellt-e-control-erwartet-keinen-mangel-im-winter,0,www.diepresse.com,Gasspeicher gut gefüllt: E-Control erwartet keinen Mangel im Winter,"Die Speicher seien europaweit gut gefüllt, so die Leiterin der E-Control-Gasabteilung Carola Millgramm. In Österreich beträgt der Speicherstand gut 90 Prozent.",https://img.diepresse.com/public/incoming/jr9egy-imago-images-170785244/alternates/DPR_SOCIAL_NACHRICHTEN/imago%20images%20170785244,2024-08-19T18:54:15Z,,"Die Speicher seien europaweit gut gefüllt, so die Leiterin der E-Control-Gasabteilung Carola Millgramm. In Österreich beträgt der Speicherstand gut 90 Prozent.
Ans Heizen, das oft in Österreich auch… [+1888 chars]",,de,'Heizen'
https://www.faz.net/aktuell/karriere-hochschule/nine-to-five/kolumne-nine-to-five-die-last-mit-dem-gast-19906856.html,https://www.faz.net/aktuell/karriere-hochschule/nine-to-five/kolumne-nine-to-five-die-last-mit-dem-gast-19906856.html,0,www.faz.net,Kolumne „Nine to five“: Die Last mit dem Gast,"Wer im Dienstleistungssektor arbeitet, braucht vor allem Geduld. Die wird in der Ferienzeit hart auf die Probe gestellt.",https://media1.faz.net/ppmedia/aktuell/4192845454/1.8198253/facebook_teaser/blick-in-ein-legendaeres.jpg,2024-08-20T06:39:09Z,,"Leipzig ist wuselig, das Hotel liegt zentral, wohin mit dem Auto? Ab in die Tiefgarage. Dass die durch einen steilen Schlauchtunnel in eine Art überfüllten Dunkelstollen führt, verschweigt das Online… [+2266 chars]",,de,'Gas'
https://www.zeit.de/news/2024-08/20/scholz-haelt-gasfoerderung-vor-borkum-fuer-wahrscheinlich,https://www.zeit.de/news/2024-08/20/scholz-haelt-gasfoerderung-vor-borkum-fuer-wahrscheinlich,0,www.zeit.de,Umstrittenes Energieprojekt: Scholz hält Gasförderung vor Borkum für wahrscheinlich,Hier finden Sie Informationen zu dem Thema „Umstrittenes Energieprojekt“. Lesen Sie jetzt „Scholz hält Gasförderung vor Borkum für wahrscheinlich“.,https://img.zeit.de/news/2024-08/20/scholz-haelt-gasfoerderung-vor-borkum-fuer-wahrscheinlich-image-group/wide__1300x731,2024-08-20T13:49:22Z,,"Bundeskanzler Olaf Scholz (SPD) geht davon aus, dass vor der Nordseeinsel Borkum bald nach Gas gebohrt wird. «Es gibt auf niederländischer Seite Genehmigungen. Es gibt auf deutscher Seite Genehmigung… [+989 chars]",,de,'Gas'
https://www.bild.de/leben-wissen/mein-recht-verbraucherportal/trotz-hoher-kosten-darum-hat-jeder-vierte-eigentuemer-sein-haus-saniert-66c32e3406f52977c7f70d23,https://www.bild.de/leben-wissen/mein-recht-verbraucherportal/trotz-hoher-kosten-darum-hat-jeder-vierte-eigentuemer-sein-haus-saniert-66c32e3406f52977c7f70d23,0,www.bild.de,Allein im letzten Jahr - Darum haben jetzt viele ihr Haus saniert,"Trotz hoher Kosten, Warten auf Handwerker oder des Wirrwarrs beim Heizen haben mehr als 25 Prozent der Deutschen ihr eigenes Haus flott gemacht. BILD weiß warum","https://images.bild.de/66c32e3406f52977c7f70d23/17f6b005dce12faf2567050ed5681e9d,c43b659b?w=1280",2024-08-20T17:17:31Z,,"Kaum zu glauben: Hohe Baukosten, langes Warten auf Handwerker, selbst das politische Dauergezänk beim Gebäudeenergiegesetz nichts hat sie aufgehalten. Viele Eigentümer von Immobilien haben in jüngste… [+1952 chars]",,de,'Heizen'
https://bildblog.de/144885/kein-gas-kein-strom-im-entwicklungsland/,https://bildblog.de/144885/kein-gas-kein-strom-im-entwicklungsland/,0,bildblog.de,"“Kein Gas, kein Strom” im “Entwicklungsland”","Wirft man regelmäßig einen Blick in die “Bild”-Medien, begegnen einem dort immer wieder Aussagen und Behauptungen, die irgendwo zwischen ziemlich schräg und völligem Unsinn liegen. Heute war mal wieder völliger Unsinn dran – in einer “Bild”-Umfrage, angetease…",,2024-08-21T11:39:13Z,,"Wirft man regelmäßig einen Blick in die “Bild”-Medien, begegnen einem dort immer wieder Aussagen und Behauptungen, die irgendwo zwischen ziemlich schräg und völligem Unsinn liegen. Heute war mal wied… [+2501 chars]",,de,'Gas'
https://www.dw.com/de/streit-um-gasf%C3%B6rderung-vor-nordseeinsel-borkum/a-69992820,https://www.dw.com/de/streit-um-gasf%C3%B6rderung-vor-nordseeinsel-borkum/a-69992820,0,www.dw.com,Streit um Gasförderung vor Nordseeinsel Borkum,"Die Niederlande wollen vor der deutschen Nordsee-Insel Borkum Gas fördern. Klimaschützer und Wirtschaftsminister Habeck sind dagegen, Bundeskanzler Scholz eher dafür. Das Land ist zweitgrößter Gaslieferant Deutschlands.",https://static.dw.com/image/69833910_6.jpg,2024-08-21T14:00:00Z,,"Wer genau hinschaut am Strand der beliebten deutschen Urlauberinsel Borkum, kann die Vorarbeiten für die Förderplattform draußen auf dem Meer schon erkennen: Der niederländische Konzern One-Dyas will… [+6219 chars]",,de,'Gas'
