index,url,valid,domain,title,description,image,published,archive,content,quote,language,keyword
https://www.faz.net/aktuell/rhein-main/schloss-bad-homburg-wird-restauriert-19745426.html,https://www.faz.net/aktuell/rhein-main/schloss-bad-homburg-wird-restauriert-19745426.html,0,www.faz.net,"Restaurierung Schloss Bad Homburg: Erst die Kirche, dann die Gruft","In der Schlosskirche in Bad Homburg werden Chor, Orgel und Heizung erneuert. Danach sind die Särge der Landgrafen an der Reihe.",https://media0.faz.net/ppmedia/aktuell/2144066657/1.9745420/facebook_teaser_fplus/blick-in-die-schlosskirche-im.jpg,2024-06-01T09:29:41Z,,"Der Abgang zur Gruft steht offen, und Kirsten Worms kündigt an, dass es gleich noch dort hinuntergeht zu den Särgen Friedrichs II. und Dutzender anderer Toter des Hauses Hessen-Homburg. Manche müssen… [+103 chars]",,de,'Heizung'
https://www.morgenpost.de/berlin/article242466344/Ich-bin-dann-besonders-gut-wenn-ich-Gegenwehr-habe.html,https://www.morgenpost.de/berlin/article242466344/Ich-bin-dann-besonders-gut-wenn-ich-Gegenwehr-habe.html,0,www.morgenpost.de,"„Ich bin dann besonders gut, wenn ich Gegenwehr habe“",Reinhard Müller hat den Euref-Campus mit der Eröffnung des Hochhauses im Gasometer vollendet. Das Vorzeigeprojekt traf auf Widerstände,https://img.sparknews.funkemedien.de/242466342/242466342_1717160121_v16_9_1600.jpeg,2024-06-01T11:50:57Z,,"Berlin. Reinhard Müller hat den Euref-Campus mit der Eröffnung des Hochhauses im Gasometer vollendet. Das Vorzeigeprojekt traf auf Widerstände
Reinhard Müller wundert sich immer noch. Warum hat niem… [+5553 chars]",,de,'Gas'
https://www.focus.de/wissen/schwere-unwetter-drohen-diese-stellen-am-haus-sollten-sie-checken-um-unwetter-schaeden-zu-vermeiden_id_136710075.html,https://www.focus.de/wissen/schwere-unwetter-drohen-diese-stellen-am-haus-sollten-sie-checken-um-unwetter-schaeden-zu-vermeiden_id_136710075.html,0,www.focus.de,"Schwere Unwetter drohen - Diese Stellen am Haus müssen Sie checken, um es vor Schäden zu schützen","Am Wochenende muss in Deutschland mit heftigen Regenfällen gerechnet werden, auch Hochwasser droht. Hier erfahren Sie, mit welchen Vorsorgemaßnahmen Sie Ihr Eigenheim vor möglichen Schäden durch Nässe oder Sturm schützen können.Von FOCUS-online-Autorin Laura …",https://p6.focus.de/img/fotos/id_136710268/starkregen.jpg?im=Crop%3D%280%2C72%2C3464%2C1732%29%3BResize%3D%281200%2C627%29&impolicy=perceptual&quality=mediumHigh&hash=2e2dff111f39a50ea196c8986c55ef7d6c7b8a18d38cc1535c8cfa2bd6c9f6ed,2024-06-01T12:29:52Z,,"Am Wochenende muss in Deutschland mit heftigen Regenfällen gerechnet werden, auch Hochwasser droht. Hier erfahren Sie, mit welchen Vorsorgemaßnahmen Sie Ihr Eigenheim vor möglichen Schäden durch Näss… [+4934 chars]",,de,'Nässe'
https://taz.de/Beschaedigte-Weinstoecke/!6011437/,https://taz.de/Beschaedigte-Weinstoecke/!6011437/,0,taz.de,Beschädigte Weinstöcke: Hoffen auf den goldenen Herbst,"Der Frost hat Spuren hinterlassen, viele Weinstöcke sind beschädigt. Für Winzer ist das schlimm, für unseren Autor hat es zumindest einen Vorteil.",https://taz.de/picture/7029535/948/35455401-1.jpeg,2024-06-01T12:33:00Z,,"Der Frost hat Spuren hinterlassen, viele Weinstöcke sind beschädigt. Für Winzer ist das schlimm, für unseren Autor hat es zumindest einen Vorteil.
Weinanbau in Franken werden die Trauben nicht reif,… [+2651 chars]",,de,'Frost'
https://www.stern.de/gesellschaft/regional/bayern/unfaelle--bergwacht-zieht-bilanz---wintersaison-mit-vielen-gesichtern--34761686.html,https://www.stern.de/gesellschaft/regional/bayern/unfaelle--bergwacht-zieht-bilanz---wintersaison-mit-vielen-gesichtern--34761686.html,0,www.stern.de,"Unfälle: Bergwacht zieht Bilanz: ""Wintersaison mit vielen Gesichtern""","Milder Winter im Tal, aber Rekorde bei den Schneehöhen hoch oben auf den Gipfeln: Die Bergwacht zieht Bilanz eines ungewöhnlichen Winters - der die Retter auf neue Weise forderte.",https://image.stern.de/34761688/t/oL/v1/w1440/r1.7778/-/02--urnnewsmldpacom2009010124060299245227v3w800h600l186t140r1852b1421jpeg---67ea860958761ebb.jpg,2024-06-02T06:59:45Z,,"Milder Winter im Tal, aber Rekorde bei den Schneehöhen hoch oben auf den Gipfeln: Die Bergwacht zieht Bilanz eines ungewöhnlichen Winters - der die Retter auf neue Weise forderte.
Grüne Wiesen im Ta… [+2686 chars]",,de,'Schnee'
https://www.sueddeutsche.de/bayern/bergwacht-einsaetze-bilanz-lux.HoDEUn1QURVHoLuA9DmNhL,https://www.sueddeutsche.de/bayern/bergwacht-einsaetze-bilanz-lux.HoDEUn1QURVHoLuA9DmNhL,0,www.sueddeutsche.de,Bergwacht zieht Bilanz: Wintersaison mit vielen Gesichtern,"Milder Winter im Tal, aber Rekorde bei den Schneehöhen hoch oben auf den Gipfeln.",https://www.sueddeutsche.de/2024/06/02/fa5f1d06-e23c-4440-bf1a-2b249e6f8c72.jpeg?q=60&fm=webp&width=1200&rect=undefined%2Cundefined%2Cundefined%2Cundefined,2024-06-02T11:49:14Z,,"Grüne Wiesen im Tal, so viel Schnee wie lange nicht in den Hochlagen der Berge: Die Wintersaison hat sich in Bayern dieses Jahr extrem zweigeteilt gezeigt. Das bekam auch die Bergwacht zu spüren: Wäh… [+2541 chars]",,de,'Schnee'
https://tirol.orf.at/stories/3259559/,https://tirol.orf.at/stories/3259559/,0,tirol.orf.at,Sommersaison startet am Berg winterlich,"Die Niederschläge der letzten Tage haben auf den Bergen neuen Schnee gebracht und sorgen mit dem Schnee aus dem Frühjahr für winterliche Verhältnisse in der beginnenden Bergsaison. Auf vielen Touren sei deshalb noch mit Einschränkungen zu rechnen, betont man …",https://ibs.orf.at/tir?image=https%3A%2F%2Foekastatic.orf.at%2Fmims%2F2024%2F23%2F27%2Fcrops%2Fw%3D1200%2Ch%3D627%2Cq%3D75%2F2227682_master_845727_winter.jpg%3Fs%3Dd3647b912d5be80412f70771e0bf95b98003d8f3,2024-06-02T15:58:50Z,,"Auf den Bergen herrschen nach den Niederschlägen der letzten Tage wieder winterliche Verhältnisse. So wurden etwa am Stubaier Gletscher 70 Zentimeter Neuschnee gemessen. Winterliche Verhältnisse, die… [+1108 chars]",,de,'Schnee'
https://www.jungewelt.de/artikel/476513.jazz-in-der-jw-maigalerie-die-besten-gummistiefel.html,https://www.jungewelt.de/artikel/476513.jazz-in-der-jw-maigalerie-die-besten-gummistiefel.html,0,www.jungewelt.de,Jazz in der jW-Maigalerie: Die besten Gummistiefel [Online-Abo],Das Duo Matsch & Schnee spielt in der neuen Reihe »jW geht Jazz« in der Maigalerie in Berlin • Foto: https://maikehilbig.wordpress.com/projekte/matschschnee,https://www.jungewelt.de/img/1100/195582.jpg,2024-06-02T17:37:08Z,,"Jazz ist Existentialismus, und Existentialismus ist Jazz. Wer wüsste das besser als die Frauen, die musikalisch im Jazz und gedanklich mit dem Existentialismus zu tun haben? Wie Maike Hilbig und Silk… [+271 chars]",,de,'Schnee'
https://www.stern.de/gesellschaft/regional/hamburg-schleswig-holstein/verkehr--rund-15-millionen-euro-kosten-fuer-winterdienst-im-norden-34764418.html,https://www.stern.de/gesellschaft/regional/hamburg-schleswig-holstein/verkehr--rund-15-millionen-euro-kosten-fuer-winterdienst-im-norden-34764418.html,0,www.stern.de,Verkehr: Rund 15 Millionen Euro Kosten für Winterdienst im Norden,Kiel (lno) - Rund 15 Millionen Euro hat der Landesbetrieb für Straßenbau und Verkehr (LBV) im vergangenen Winter für rutschfeste Straßen und Radwege in,https://image.stern.de/34764420/t/ia/v1/w1440/r1.7778/-/03--urnnewsmldpacom2009010124060399257122v2w800h600l1076t680r3234b2044jpeg---f308715d718e3fb4.jpg,2024-06-03T09:58:21Z,,"Der Winterdienst kostete in Schleswig-Holstein zuletzt deutlich mehr. Dafür gibt es mehrere Gründe.
Rund 15 Millionen Euro hat der Landesbetrieb für Straßenbau und Verkehr (LBV) im vergangenen Winte… [+1411 chars]",,de,'Winter'
https://www.kraftfuttermischwerk.de/blogg/eine-motorisierte-bushaltestelle-auf-eis/,https://www.kraftfuttermischwerk.de/blogg/eine-motorisierte-bushaltestelle-auf-eis/,0,www.kraftfuttermischwerk.de,Eine motorisierte Bushaltestelle auf Eis,"Schneemann bauen, Schneeballschlacht, Snowboarden, Rodeln. Winter und der damit einhergehende Schnee ermöglichen uns jede Menge Spaßmomente. Man kann sich natürlich auch einen Motor an eine…Mehr lesen ->Eine motorisierte Bushaltestelle auf Eis",https://www.kraftfuttermischwerk.de/blogg/wp-content/uploads2/2024/06/Bildschirmfoto-2024-06-03-um-14.33.48.jpg,2024-06-03T12:34:36Z,,"Schneemann bauen, Schneeballschlacht, Snowboarden, Rodeln. Winter und der damit einhergehende Schnee ermöglichen uns jede Menge Spaßmomente. Man kann sich natürlich auch einen Motor an eine Bushaltes… [+107 chars]",,de,'Schnee'
https://www.stern.de/gesellschaft/regional/nordrhein-westfalen/natur--regen-schlecht-fuer-borkenkaefer---hoffnung-fuer-den-wald-34766566.html,https://www.stern.de/gesellschaft/regional/nordrhein-westfalen/natur--regen-schlecht-fuer-borkenkaefer---hoffnung-fuer-den-wald-34766566.html,0,www.stern.de,Natur: Regen schlecht für Borkenkäfer - Hoffnung für den Wald,"Borkenkäfer haben in den vergangenen Jahren in NRW große Waldbestände vernichtet. Das regnerische Wetter gibt Anlass zur Hoffnung, denn Borkenkäfer mögen keine Nässe.",https://image.stern.de/34766568/t/C4/v1/w1440/r1.7778/-/04--urnnewsmldpacom2009010124060499266307v2w800h600l278t68r1249b789jpeg---b2fdc2741238f6d5.jpg,2024-06-04T03:32:24Z,,"Borkenkäfer haben in den vergangenen Jahren in NRW große Waldbestände vernichtet. Das regnerische Wetter gibt Anlass zur Hoffnung, denn Borkenkäfer mögen keine Nässe.
Der viele Regen der vergangenen… [+828 chars]",,de,'Nässe'
https://www.focus.de/auto/gebrauchtwagen/schnaeppchen-mit-gruener-plakette-von-elektro-bis-diesel-mit-diesen-gebrauchtwagen-kommen-sie-durch-die-umweltzone_id_260000098.html,https://www.focus.de/auto/gebrauchtwagen/schnaeppchen-mit-gruener-plakette-von-elektro-bis-diesel-mit-diesen-gebrauchtwagen-kommen-sie-durch-die-umweltzone_id_260000098.html,0,www.focus.de,"Mit grüner Plakette überall rein - Elektro, Benzin, Gas, Diesel - die besten Gebraucht-Schnäppchen für jede Umweltzone",Schon jetzt gibt es 56 Umweltzonen in Deutschland - auch Gebrauchtwagen sollte man nur mit grüner Plakette kaufen. FOCUS online und mobile.de zeigen die größten Schnäppchen aller Antriebsarten. Extrem billig gibt es derzeit Gasfahrzeuge - doch lohnen sich die…,https://p6.focus.de/img/fotos/id_4023005/skoda-citigo7.jpg?im=Crop%3D%280%2C75%2C1600%2C800%29%3BResize%3D%281200%2C627%29&impolicy=perceptual&quality=mediumHigh&hash=78268cfb1a75d74f47640497435217a8a2be976f2256402be07f734b557b2d9a,2024-06-04T04:37:57Z,,"<ul><li>
Kommentare</li><li>
E-Mail</li><li>
Teilen</li><li>
Mehr</li><li>
Twitter</li><li>
Drucken</li><li>
Feedback</li><li>
Fehler meldenSie haben einen Fehler gefunden?
Bitte markieren S… [+11118 chars]",,de,'Gas'
https://www.morgenpost.de/wirtschaft/article242494690/Heimlicher-Energiefresser-treibt-Stromkosten-in-die-Hoehe.html,https://www.morgenpost.de/wirtschaft/article242494690/Heimlicher-Energiefresser-treibt-Stromkosten-in-die-Hoehe.html,0,www.morgenpost.de,Heimlicher Energiefresser treibt Stromkosten in die Höhe,"Ob im Wasserkocher, in der Heizung oder den Rohren: Eine Millimeterschicht reicht, um die Heizkosten um hunderte Euro zu verteuern.",https://img.sparknews.funkemedien.de/242494686/242494686_1717488486_v16_9_1600.jpeg,2024-06-04T08:08:06Z,,"Berlin. Ob im Wasserkocher, in der Heizung oder den Rohren: Eine Millimeterschicht reicht, um die Heizkosten um Hunderte Euro zu verteuern.",,de,'Heizung'
https://www.n-tv.de/wirtschaft/Waermepumpen-beheizen-zwei-Drittel-der-Neubauten-article24987626.html,https://www.n-tv.de/wirtschaft/Waermepumpen-beheizen-zwei-Drittel-der-Neubauten-article24987626.html,0,www.n-tv.de,Gas auf Platz zwei: Wärmepumpen beheizen zwei Drittel der Neubauten,Ölheizungen spielen in neuen Gebäuden keine Rolle mehr. Gas hingegen bleibt eine zentrale Energiequelle. Weit davor jedoch die Wärmepumpe - Tendenz massiv steigend. Schon jetzt wird in vier von fünf neuen Wohnhäusern mit erneuerbaren Energien geheizt.,https://bilder3.n-tv.de/img/incoming/crop24987898/5731325577-cImg_16_9-w1200/7390eef881926685da3303cbd94fa93d.jpg,2024-06-04T09:13:12Z,,Ölheizungen spielen in neuen Gebäuden keine Rolle mehr. Gas hingegen bleibt eine zentrale Energiequelle. Weit davor jedoch die Wärmepumpe - Tendenz massiv steigend. Schon jetzt wird in vier von fünf … [+1935 chars],,de,'Gas'
https://www.focus.de/wissen/natur/wetterphaenomen-gibt-es-im-juni-einen-kaelteeinbruch-das-muessen-sie-zur-schafskaelte-wissen_id_259987962.html,https://www.focus.de/wissen/natur/wetterphaenomen-gibt-es-im-juni-einen-kaelteeinbruch-das-muessen-sie-zur-schafskaelte-wissen_id_259987962.html,0,www.focus.de,Wetterphänomen - Gibt es im Juni einen Kälteeinbruch? Das müssen Sie zur Schafskälte wissen,"Auch wenn die Temperaturen in den nächsten Tagen steigen, könnte es im Juni zu einem Temperatursturz kommen. Lesen Sie hier, was Sie zur Schafskälte wissen müssen.Von FOCUS-online-Redakteurin Julia Mosberger",https://p6.focus.de/img/fotos/id_259988062/schafskaelte.jpg?im=Crop%3D%280%2C288%2C3464%2C1732%29%3BResize%3D%281200%2C627%29&impolicy=perceptual&quality=mediumHigh&hash=457ee200095f7369488828cce0f65800d347d557433e3c9f46f08d1080c08294,2024-06-04T09:42:03Z,,"Auch wenn die Temperaturen in den nächsten Tagen steigen, könnte es im Juni zu einem Temperatursturz kommen. Lesen Sie hier, was Sie zur Schafskälte wissen müssen. Die Schafskälte naht! Dieses erstau… [+2746 chars]",,de,'Kälte'
https://www.sueddeutsche.de/muenchen/muenchen-mieter-ohne-wasser-klenzestrasse-lux.Vx4ADZHvKQ5ELu5ULUm4wB,https://www.sueddeutsche.de/muenchen/muenchen-mieter-ohne-wasser-klenzestrasse-lux.Vx4ADZHvKQ5ELu5ULUm4wB,0,www.sueddeutsche.de,Mieter in München: Wohnen auf der Baustelle,"In einem Haus an der Klenzestraße gibt es seit acht Monaten kein Wasser mehr und keine Heizung – obwohl dort immer noch Mieter leben. Der Eigentümer will das Gebäude umbauen und sanieren, der Bezirksausschuss spricht von einem „krassen Fall von sozialwidriger…",https://www.sueddeutsche.de/2024/06/04/461a64b9-a0fa-4a92-9ad4-7eb74cad89f1.jpeg?q=60&fm=webp&width=1200&rect=undefined%2Cundefined%2Cundefined%2Cundefined,2024-06-04T15:22:28Z,,"In einem Haus an der Klenzestraße gibt es seit acht Monaten kein Wasser mehr und keine Heizung obwohl dort immer noch Mieter leben. Der Eigentümer will das Gebäude umbauen und sanieren, der Bezirksau… [+525 chars]",,de,'Heizung'
https://www.n-tv.de/politik/Gruene-dringen-auf-Untersuchungsausschuss-bei-Nord-Stream-2-article24990708.html,https://www.n-tv.de/politik/Gruene-dringen-auf-Untersuchungsausschuss-bei-Nord-Stream-2-article24990708.html,0,www.n-tv.de,"""Bis heute nicht aufgeklärt"": Grüne dringen auf Untersuchungsausschuss bei Nord Stream 2","Gegen alle Widerstände setzt Berlin lange auf die Ostsee-Pipelines Nord Stream 2, um sich günstiges russisches Gas zu sichern. Erst kurz vor der großangelegten Invasion in der Ukraine wird das Projekt gestoppt - doch eine parlamentarische Aufarbeitung der Hin…",https://bilder1.n-tv.de/img/incoming/crop24990716/4611323990-cImg_16_9-w1200/431804965-1-.jpg,2024-06-05T09:45:16Z,,"Gegen alle Widerstände setzt Berlin lange auf die Ostsee-Pipelines Nord Stream 2, um sich günstiges russisches Gas zu sichern. Erst kurz vor der großangelegten Invasion in der Ukraine wird das Projek… [+1982 chars]",,de,'Gas'
https://www.freitag.de/autoren/maurice-hoefgen/maurice-hoefgen-schuldenbremse-verhindert-dass-wir-unsere-klimaziele-erreichen,https://www.freitag.de/autoren/maurice-hoefgen/maurice-hoefgen-schuldenbremse-verhindert-dass-wir-unsere-klimaziele-erreichen,0,www.freitag.de,"Klimaschutzbremse | Deutschland reißt laut Expertenrat Klimaziele: Schulden werden gebremst, Emissionen nicht?","Deutschland wird seine Klimaziele bis 2030 reißen, stellt der Expertenrat für Klimafragen in einem neuen Gutachten fest. Maurice Höfgen sagt: Wer Geld für Heizungstausch und E-Autos streicht, darf sich über höhere Emissionen nicht wundern Im Finanzministerium…",https://www.freitag.de/autoren/maurice-hoefgen/maurice-hoefgen-schuldenbremse-verhindert-dass-wir-unsere-klimaziele-erreichen/@@images/social_image,2024-06-05T15:18:00Z,,"Im Finanzministerium wurde letzte Woche gefeiert. Der Anlass: Die Schuldenbremse hatte ihren 15. Geburtstag. Und obwohl es ein SPD-Finanzminister war, der die Schuldenbremse geboren hat, Peer Steinbr… [+3989 chars]",,de,'Heizung'
https://www.sueddeutsche.de/sport/sz-talk-max-eberl-em-kulturprogramm-stadion-traeume-bayern-lux.UU1Bh7GaCozHeoAH9YdBbm,https://www.sueddeutsche.de/sport/sz-talk-max-eberl-em-kulturprogramm-stadion-traeume-bayern-lux.UU1Bh7GaCozHeoAH9YdBbm,0,www.sueddeutsche.de,EM-Kulturprogramm: SZ-Talk mit Max Eberl,"Der Sportvorstand spricht im „Stadion der Träume“ in München über die Zukunft des FC Bayern. Auch Javier Cáceres, Albert Ostermaier, Alfred Dorfer und viele andere sind beim EM-Kulturprogramm zu Gast.",https://www.sueddeutsche.de/2024/02/27/38e21a6c-697f-4741-8eb3-367b61f26e63.jpeg?q=60&fm=webp&width=1200&rect=undefined%2Cundefined%2Cundefined%2Cundefined,2024-06-06T11:52:20Z,,Der fünfte und letzte Talk im Rahmen der SZ-Reihe Zukunft des Fußballs ist diesmal nur eine Veranstaltung von vielen an einem Wochenende voller Fußballkultur. Schon um 18 Uhr sprechen am Freitag Nahi… [+1350 chars],,de,'Reif'
https://www.sueddeutsche.de/wirtschaft/wein-winzer-frost-lux.Qv55ryaLdTPbaDKc7xSMai,https://www.sueddeutsche.de/wirtschaft/wein-winzer-frost-lux.Qv55ryaLdTPbaDKc7xSMai,0,www.sueddeutsche.de,Winzer: Tristesse im Weinberg,"Die Nächte im Frühjahr waren teils extrem kalt, an den Reben hat der Frost großen Schaden angerichtet. Wie schwer der neue Jahrgang getroffen wurde, zeigt sich aber erst jetzt. Zu Besuch bei einem Winzer an der Nahe.",https://www.sueddeutsche.de/2024/06/06/47fc3637-ad0e-4f42-89f5-a5a128f477b7.jpeg?q=60&fm=webp&width=1200&rect=undefined%2Cundefined%2Cundefined%2Cundefined,2024-06-06T13:15:51Z,,"6. Juni 2024, 15:15 UhrLesezeit: 4 min
Die Nächte im Frühjahr waren teils extrem kalt, an den Reben hat der Frost großen Schaden angerichtet. Wie schwer der neue Jahrgang getroffen wurde, zeigt sich… [+670 chars]",,de,'Frost'
https://www.welt.de/kultur/literarischewelt/article251896126/Actionszenen-der-Weltliteratur-Als-Kafka-die-Damen-umhaute.html,https://www.welt.de/kultur/literarischewelt/article251896126/Actionszenen-der-Weltliteratur-Als-Kafka-die-Damen-umhaute.html,0,www.welt.de,Als Kafka die Damen umhaute,Im Winter 1916 liest Franz Kafka in einem Münchner Salon seine Erzählung „In der Strafkolonie“. Die Zeitungsberichte über den Abend sind wenig schmeichelhaft. Doch Jahrzehnte später erinnert sich ein Anwesender an Ungeheuerliches während Kafkas Lesung.,https://img.welt.de/img/kultur/literarischewelt/mobile251896122/0141354137-ci16x9-w1200/Kafka-Ausstellung-4.jpg,2024-06-06T13:53:34Z,,"Schrieb Franz Kafka sein Publikum in die Ohnmacht? Lüstling des Entsetzens: diese Formel prägte ein Autor mit sprachlichem Einfallsreichtum, der ein nomen est omen provozieren könnte, im Winter 1916 … [+3493 chars]",,de,'Winter'
https://www.n-tv.de/wissen/Permafrost-in-der-Schweiz-taut-immer-weiter-article24994981.html,https://www.n-tv.de/wissen/Permafrost-in-der-Schweiz-taut-immer-weiter-article24994981.html,0,www.n-tv.de,Alpen verlieren Schutzschild: Permafrost in der Schweiz taut immer weiter,Wenig Schnee und heiße Sommer setzen dem Permafrostboden in der Schweiz zu. Die zwölf Monate bis September vergangenen Jahres waren die wärmsten seit Beginn der Wetteraufzeichnungen. Auch das laufende Jahr reicht an Negativrekorde heran. Dabei hat ein Mangel …,https://bilder4.n-tv.de/img/incoming/crop24994975/4161329777-cImg_16_9-w1200/220396226.jpg,2024-06-06T16:26:53Z,,Wenig Schnee und heiße Sommer setzen dem Permafrostboden in der Schweiz zu. Die zwölf Monate bis September vergangenen Jahres waren die wärmsten seit Beginn der Wetteraufzeichnungen. Auch das laufend… [+2655 chars],,de,'Schnee'
https://www.welt.de/wissenschaft/article251892146/Eisschmelze-Riesige-Viren-in-der-Arktis-koennten-den-Trend-aufhalten.html,https://www.welt.de/wissenschaft/article251892146/Eisschmelze-Riesige-Viren-in-der-Arktis-koennten-den-Trend-aufhalten.html,0,www.welt.de,"Riesenviren auf Grönlandeis entdeckt, sie könnten die Eisschmelze aufhalten","Forscher haben auf dem Grönländischen Eisschild eine unheimliche Entdeckung gemacht: Viren, die größer als Bakterien sind, und wahrscheinlich die Eisschmelze in der Polarregion beschleunigen. Sie tun das in Wechselwirkung mit einem anderen Eisbewohner.",https://img.welt.de/img/bildergalerien/mobile251893890/7451353737-ci16x9-w1200/Low-Res-DJI-0336.jpg,2024-06-07T05:17:29Z,,"Die Pressemitteilung der Aarhus-Universität beginnt ungewöhnlich poetisch: Jedes Frühjahr, wenn die Sonne in der Arktis nach Monaten der Dunkelheit aufgeht, kehrt das Leben zurück. Die Eisbären tauch… [+5034 chars]",,de,'Schnee'
https://taz.de/Konzertempfehlungen-fuer-Berlin/!6015632/,https://taz.de/Konzertempfehlungen-fuer-Berlin/!6015632/,0,taz.de,Konzertempfehlungen für Berlin: Stimmen in der Kälte,"Warme Bässe, Kriegsmadrigale, Geräusche und Klänge aus aller Welt sowie die Poesie Künstlicher Intelligenz geben in dieser Woche den Ton an.",https://taz.de/picture/7046126/948/0035443209-10-1.jpeg,2024-06-07T11:00:00Z,,"Warme Bässe, Kriegsmadrigale, Geräusche und Klänge aus aller Welt sowie die Poesie Künstlicher Intelligenz geben in dieser Woche den Ton an.
Das Duo Matmos seziert Klänge und Geräusche aller Art Fot… [+3464 chars]",,de,'Kälte'
https://www.sueddeutsche.de/wirtschaft/waermepumpe-heizung-foerderung-kfw-lux.VywBVuC3kzwepJsvm6eyu6,https://www.sueddeutsche.de/wirtschaft/waermepumpe-heizung-foerderung-kfw-lux.VywBVuC3kzwepJsvm6eyu6,0,www.sueddeutsche.de,Heizungförderung : Klappt doch alles reibungslos – oder?,"Die neue Heizungsförderung laufe gut, so die Förderbank KfW. Allerdings startet das Programm erst schrittweise – und die Ziele der Regierung dürften trotzdem weit verfehlt werden.",https://www.sueddeutsche.de/2023/06/25/59ce2a1d-a8fb-44c7-a062-2d6f0846cbef.jpeg?q=60&fm=webp&width=1200&rect=undefined%2Cundefined%2Cundefined%2Cundefined,2024-06-07T12:10:42Z,,"7. Juni 2024, 14:10 UhrLesezeit: 2 min
Die neue Heizungsförderung laufe gut, so die Förderbank KfW. Allerdings startet das Programm erst schrittweise und die Ziele der Regierung dürften trotzdem wei… [+521 chars]",,de,'Heizung'
https://www.faz.net/aktuell/wirtschaft/mehr-wirtschaft/warum-die-schweiz-mehr-strom-produzieren-will-19772274.html,https://www.faz.net/aktuell/wirtschaft/mehr-wirtschaft/warum-die-schweiz-mehr-strom-produzieren-will-19772274.html,0,www.faz.net,Wie die Schweiz die Stromproduktion erhöhen will,Im Winter kann die Schweiz ihren Strombedarf nicht durch die eigene Produktion decken. Erneuerbare Energien sollen die Unabhängigkeit von Stromimporten sichern. Über das Stromgesetz entscheiden nun die Bürger.,https://media1.faz.net/ppmedia/aktuell/wirtschaft/2441037058/1.9772321/facebook_teaser/rotorblaetter-werden-an-eine.jpg,2024-06-07T12:17:35Z,,"Das Gesetz sieht zudem den Ausbau von Wasserkraftwerken vor, damit im Winter genügend Strom gespeichert werden kann. Regierung, Parlament und Kantone haben sich im Einvernehmen mit den Umweltorganisa… [+3718 chars]",,de,'Winter'
https://www.faz.net/aktuell/wirtschaft/klima-nachhaltigkeit/zuschuss-zur-waermepumpe-was-sie-zur-heizungsfoerderung-wissen-muessen-19772560.html,https://www.faz.net/aktuell/wirtschaft/klima-nachhaltigkeit/zuschuss-zur-waermepumpe-was-sie-zur-heizungsfoerderung-wissen-muessen-19772560.html,0,www.faz.net,21.000 Euro Zuschuss zur Wärmepumpe,"34.000 Anträge auf Heizungsförderung hat die KfW bislang bewilligt. Auch wer den Strom zum Heizen selbst erzeugen will, profitiert von staatlichen Zuschüssen.",https://media0.faz.net/ppmedia/aktuell/wirtschaft/2012755722/1.9772668/facebook_teaser/klimafreundlich-wer-sich-eine.jpg,2024-06-07T15:17:35Z,,"Wie genau funktioniert die Heizungsförderung?
Grundsätzlich fördert die KfW 30 Prozent der Anschaffungskosten in Höhe von 30.000 Euro. Für selbstnutzende Eigentümer kommen weitere Boni hinzu: Einen … [+6868 chars]",,de,'Gas'
https://www.mobiflip.de/shortnews/waermepumpe-ohne-aerger-markt-fuer-schallschutzwaende-gedeiht/,https://www.mobiflip.de/shortnews/waermepumpe-ohne-aerger-markt-fuer-schallschutzwaende-gedeiht/,0,www.mobiflip.de,Wärmepumpe ohne Ärger: Markt für Schallschutzwände gedeiht,"Immer mehr Hausbesitzer nutzen Wärmepumpen zum Heizen, da der Gesetzgeber die Nutzung erneuerbarer Energien fördert. Wärmepumpen sind jedoch nicht geräuschlos, was zunehmend zu Beschwerden von Nachbarn führt. Der Anteil von […]",https://www.mobiflip.de/wp-content/uploads/2024/06/00_devaux_laermschutzwand_waermepumpe_aus.jpg,2024-06-08T14:16:35Z,,"Immer mehr Hausbesitzer nutzen Wärmepumpen zum Heizen, da der Gesetzgeber die Nutzung erneuerbarer Energien fördert. Wärmepumpen sind jedoch nicht geräuschlos, was zunehmend zu Beschwerden von Nachba… [+1254 chars]",,de,'Heizung'
