index,url,valid,domain,title,description,image,published,archive,content,quote,language,keyword
https://www.morgenpost.de/wirtschaft/article408935772/heizoelpreise-aktuell-heute-5-mai-2025-was-kostet-oel-heizung-heizen.html,https://www.morgenpost.de/wirtschaft/article408935772/heizoelpreise-aktuell-heute-5-mai-2025-was-kostet-oel-heizung-heizen.html,0,www.morgenpost.de,Heizölpreise am Montag (5. Mai): Das kostet ein Liter heute,Die neue Woche beginnt mit Regen und Kälte. Was bedeutet der Wetterumschwung für die Heizölpreise? Der aktuelle Überblick vom 5. Mai.,https://img.sparknews.funkemedien.de/406858447/406858447_1724138717_v16_9_1600.jpeg,2025-05-05T07:21:21Z,,"Berlin. Die neue Woche beginnt mit Regen und Kälte. Was bedeutet der Wetterumschwung für die Heizölpreise? Der aktuelle Überblick vom 5. Mai.
Vergangene Woche wurde Deutschland noch von Frühlingswet… [+7393 chars]",,de,'Kälte'
https://www.sueddeutsche.de/bayern/bayern-wetter-frost-schnee-regen-eisheilige-li.3247349,https://www.sueddeutsche.de/bayern/bayern-wetter-frost-schnee-regen-eisheilige-li.3247349,0,www.sueddeutsche.de,"Wetter: Regen, Schnee und Frost zu Wochenbeginn in Bayern","Nach den sommerlichen Tagen mit viel Sonnenschein wird es nochmal kühl im Freistaat. Nass ist es vor allem im Süden, im Gebirge kann Schnee fallen.",https://www.sueddeutsche.de/2025/05/05/59a7dcbf-caac-407b-8b16-4d956f041008.jpeg?q=60&fm=webp&width=1200&rect=0%2C417%2C4000%2C2250,2025-05-05T11:23:02Z,,"In der Nacht zum Dienstag soll im Süden der Regen allmählich nachlassen, auch im Norden gebe es Auflockerungen. An den nördlichen Mittelgebirgen sei gebietsweise mit bodennahem Frost zu rechnen. Bis … [+971 chars]",,de,'Frost'
https://www.stern.de/gesellschaft/regional/berlin-brandenburg/wetter--dwd-warnt-vor-frost--bis-zu--9-grad-in-brandenburg-35695164.html,https://www.stern.de/gesellschaft/regional/berlin-brandenburg/wetter--dwd-warnt-vor-frost--bis-zu--9-grad-in-brandenburg-35695164.html,0,www.stern.de,Wetter: DWD warnt vor Frost: Bis zu -9 Grad in Brandenburg,Am Sonntag beginnen die sogenannten Eisheiligen. Die Temperaturen fallen im Osten Deutschlands schon ab dieser Nacht. Besonders kalt wird es im Norden Brandenburgs.,https://image.stern.de/35695166/t/Tr/v1/w1440/r1.7778/-/05--5kc77o2oulv5axs2048jpeg---42d95efb5fa84726.jpg,2025-05-05T12:38:48Z,https://web.archive.org/web/20250505134615/https://www.stern.de/gesellschaft/regional/berlin-brandenburg/wetter--dwd-warnt-vor-frost--bis-zu--9-grad-in-brandenburg-35695164.html,"Kopiere den aktuellen Link
Zur Merkliste hinzufügen
Am Sonntag beginnen die sogenannten Eisheiligen. Die Temperaturen fallen im Osten Deutschlands schon ab dieser Nacht. Besonders kalt wird es im N… [+1767 chars]",,de,'Frost'
https://www.zeit.de/news/2025-05/05/dwd-warnt-vor-frost-bis-zu-9-grad-in-brandenburg,https://www.zeit.de/news/2025-05/05/dwd-warnt-vor-frost-bis-zu-9-grad-in-brandenburg,0,www.zeit.de,Wetter: DWD warnt vor Frost: Bis zu -9 Grad in Brandenburg,Hier finden Sie Informationen zu dem Thema „Wetter“. Lesen Sie jetzt „DWD warnt vor Frost: Bis zu -9 Grad in Brandenburg“.,https://img.zeit.de/news/2025-05/05/dwd-warnt-vor-frost-bis-zu-9-grad-in-brandenburg-image-group/wide__1300x731,2025-05-05T12:38:48Z,https://web.archive.org/web/20250506055619/https://www.zeit.de/news/2025-05/05/dwd-warnt-vor-frost-bis-zu-9-grad-in-brandenburg,Knapp eine Woche vor den sogenannten Eisheiligen warnt der Deutsche Wetterdienst (DWD) in den ostdeutschen Bundesländern vor Frost in den kommenden Nächten. Die Nacht zu Dienstag werde die kälteste s… [+1587 chars],,de,'Frost'
https://www.tagesspiegel.de/potsdam/brandenburg/wetter-dwd-warnt-vor-frost-bis-zu-9-grad-in-brandenburg-13640755.html,https://www.tagesspiegel.de/potsdam/brandenburg/wetter-dwd-warnt-vor-frost-bis-zu-9-grad-in-brandenburg-13640755.html,0,www.tagesspiegel.de,Winterliche Verhältnisse: DWD warnt vor Frost – bis zu -9 Grad in Brandenburg,Am Sonntag beginnen die sogenannten Eisheiligen. Die Temperaturen fallen im Osten Deutschlands schon ab dieser Nacht. Besonders kalt wird es im Norden Brandenburgs.,https://www.tagesspiegel.de/images/13640752/alternates/BASE_16_9_W1400/1746448779000/minusgrade-in-berlin.jpeg,2025-05-05T12:39:40Z,http://archive.md/20250505155054/https://www.tagesspiegel.de/potsdam/brandenburg/wetter-dwd-warnt-vor-frost-bis-zu-9-grad-in-brandenburg-13640755.html,Knapp eine Woche vor den sogenannten Eisheiligen warnt der Deutsche Wetterdienst (DWD) in den ostdeutschen Bundesländern vor Frost in den kommenden Nächten. Die Nacht zu Dienstag werde die kälteste s… [+2385 chars],,de,'Eis'
https://www.n-tv.de/ratgeber/Verbraucherzentrale-fordert-Preisdeckel-fuer-Fernwaerme-article25745805.html,https://www.n-tv.de/ratgeber/Verbraucherzentrale-fordert-Preisdeckel-fuer-Fernwaerme-article25745805.html,0,www.n-tv.de,Teures Heizen: Verbraucherzentrale fordert Preisdeckel für Fernwärme,"Fernwärme ist komfortabel, umweltschonend - und mitunter ziemlich kostspielig. Denn die Preise unterscheiden sich regional stark. Wer an ein teures Wärmenetz angeschlossen ist, hat schnell zusätzliche Kosten von mehreren Hundert Euro pro Jahr, beklagt die Ver…",https://www.n-tv.de/img/Bilder_dpa_Import/crop25387691/1991326903-cImg_16_9-w1200/NRW-hat-deutschlandweit-das-langste-Fernwarmenetz.jpg,2025-05-05T13:18:37Z,,"Fernwärme ist komfortabel, umweltschonend - und mitunter ziemlich kostspielig. Denn die Preise unterscheiden sich regional stark. Wer an ein teures Wärmenetz angeschlossen ist, hat schnell zusätzlich… [+2837 chars]",,de,'Heizen'
https://www.bild.de/regional/sachsen/die-eisheiligen-temperaturen-bis-zu-minus-9-grad-im-osten-6818b717c956e61cc27aa70a,https://www.bild.de/regional/sachsen/die-eisheiligen-temperaturen-bis-zu-minus-9-grad-im-osten-6818b717c956e61cc27aa70a,0,www.bild.de,Bis zu minus 9 Grad! - Jetzt kommt der Ost-Frost,Dresden – Die Eisheiligen stehen mal wieder vor der Tür und lassen ab Sonntag die Landwirte und Hobbygärtner zittern. Allerdings fallen die Temperaturen schon jetzt.,"https://images.bild.de/6818b717c956e61cc27aa70a/30514dab9d04c5890885c22a506bec76,62f99996?w=1280",2025-05-05T13:35:22Z,https://web.archive.org/web/20250505145346/https://www.bild.de/regional/sachsen/die-eisheiligen-temperaturen-bis-zu-minus-9-grad-im-osten-6818b717c956e61cc27aa70a,"Dresden  Die Eisheiligen stehen mal wieder vor der Tür und lassen ab Sonntag die Landwirte und Hobbygärtner zittern.
Allerdings fallen die Temperaturen schon jetzt. So warnt der Deutsche Wetterdiens… [+2518 chars]",,de,'Frost'
https://hallespektrum.de/aktuelles/tomatenco-besser-einholen-heute-nacht-gibt-es-frost/470955/,https://hallespektrum.de/aktuelles/tomatenco-besser-einholen-heute-nacht-gibt-es-frost/470955/,0,hallespektrum.de,Tomaten&Co besser einholen: heute Nacht gibt es Frost,"Amtliche Wetterwarnung: Frostgefahr für Stadt Halle Die Stadt Halle (Saale) wird am Dienstag, dem 06. Mai 2025, von 00:00 Uhr bis voraussichtlich 08:00 Uhr mit Frost gefährdet. Der Deutsche Wetterdienst hat eine amtliche Warnung vor Frost (Stufe 1 von 2) hera…",https://hallespektrum.de/wp-content/uploads/2020/12/frost-scaled.jpg,2025-05-05T16:07:33Z,,"Amtliche Wetterwarnung: Frostgefahr für Stadt Halle 
Die Stadt Halle (Saale) wird am Dienstag, dem 06. Mai 2025, von 00:00 Uhr bis voraussichtlich 08:00 Uhr mit Frost gefährdet. Der Deutsche Wetterd… [+738 chars]",,de,'Frost'
https://www.stern.de/gesellschaft/regional/berlin-brandenburg/wetteraussichten--sonnenschein--etwas-regen-und-frost-in-berlin-brandenburg-35696750.html,https://www.stern.de/gesellschaft/regional/berlin-brandenburg/wetteraussichten--sonnenschein--etwas-regen-und-frost-in-berlin-brandenburg-35696750.html,0,www.stern.de,"Wetteraussichten: Sonnenschein, etwas Regen und Frost in Berlin-Brandenburg",Der Tag startet nach Angaben des Deutschen Wetterdienstes sonnig - im Laufe des Tages ziehen jedoch Wolken auf und mancherorts regnet es. Nachts ist mit Frost zu rechnen.,https://image.stern.de/35696752/t/nw/v1/w1440/r1.7778/-/06--kxnsmneg5jv8axs2048jpeg---228b5a2b9a9dcd0b.jpg,2025-05-06T03:59:06Z,https://web.archive.org/web/20250506050510/https://www.stern.de/gesellschaft/regional/berlin-brandenburg/wetteraussichten--sonnenschein--etwas-regen-und-frost-in-berlin-brandenburg-35696750.html,"Kopiere den aktuellen Link
Zur Merkliste hinzufügen
Der Tag startet nach Angaben des Deutschen Wetterdienstes sonnig - im Laufe des Tages ziehen jedoch Wolken auf und mancherorts regnet es. Nachts … [+959 chars]",,de,'Frost'
https://www.zeit.de/news/2025-05/06/sonnenschein-etwas-regen-und-frost-in-berlin-brandenburg,https://www.zeit.de/news/2025-05/06/sonnenschein-etwas-regen-und-frost-in-berlin-brandenburg,0,www.zeit.de,"Wetteraussichten: Sonnenschein, etwas Regen und Frost in Berlin-Brandenburg","Hier finden Sie Informationen zu dem Thema „Wetteraussichten“. Lesen Sie jetzt „Sonnenschein, etwas Regen und Frost in Berlin-Brandenburg“.",https://img.zeit.de/news/2025-05/06/sonnenschein-etwas-regen-und-frost-in-berlin-brandenburg-image-group/wide__1300x731,2025-05-06T03:59:06Z,https://web.archive.org/web/20250507025826/https://www.zeit.de/news/2025-05/06/sonnenschein-etwas-regen-und-frost-in-berlin-brandenburg,Auf leicht wechselhaftes Wetter können sich die Menschen in Berlin und Brandenburg einstellen. Nach einem sonnigen Start in den Tag und vielerorts Frost ziehen im Laufe des Tages vom Norden her Wolke… [+773 chars],,de,'Frost'
https://www.tagesspiegel.de/berlin/wetteraussichten-sonnenschein-etwas-regen-und-frost-in-berlin-brandenburg-13643788.html,https://www.tagesspiegel.de/berlin/wetteraussichten-sonnenschein-etwas-regen-und-frost-in-berlin-brandenburg-13643788.html,0,www.tagesspiegel.de,"Wetteraussichten: Sonnenschein, etwas Regen und Frost in Berlin-Brandenburg",Der Tag startet nach Angaben des Deutschen Wetterdienstes sonnig - im Laufe des Tages ziehen jedoch Wolken auf und mancherorts regnet es. Nachts ist mit Frost zu rechnen.,https://www.tagesspiegel.de/images/13643785/alternates/BASE_16_9_W1400/1746503998000/sonniges-wetter-in-brandenburg.jpeg,2025-05-06T03:59:58Z,https://web.archive.org/web/20250507080433/https://www.tagesspiegel.de/berlin/wetteraussichten-sonnenschein-etwas-regen-und-frost-in-berlin-brandenburg-13643788.html,Auf leicht wechselhaftes Wetter können sich die Menschen in Berlin und Brandenburg einstellen. Nach einem sonnigen Start in den Tag und vielerorts Frost ziehen im Laufe des Tages vom Norden her Wolke… [+1496 chars],,de,'Frost'
https://www.morgenpost.de/berlin/article408944367/wetter-in-berlin-sonnenschein-aber-nachts-kommt-der-frost.html,https://www.morgenpost.de/berlin/article408944367/wetter-in-berlin-sonnenschein-aber-nachts-kommt-der-frost.html,0,www.morgenpost.de,"Wetter in Berlin: Sonnenschein, aber nachts kommt der Frost",Der Tag startet nach Angaben des Deutschen Wetterdienstes sonnig – im Laufe des Tages ziehen jedoch Wolken auf und mancherorts regnet es.,https://img.sparknews.funkemedien.de/408944374/408944374_1746508083_v16_9_1600.jpeg,2025-05-06T05:08:03Z,https://web.archive.org/web/20250507103234/https://www.morgenpost.de/berlin/article408944367/wetter-in-berlin-sonnenschein-aber-nachts-kommt-der-frost.html,"Berlin. Der Tag startet nach Angaben des Deutschen Wetterdienstes sonnig im Laufe des Tages ziehen jedoch Wolken auf und mancherorts regnet es.
Auf leicht wechselhaftes Wetter können sich die Mensch… [+2332 chars]",,de,'Frost'
https://www.zeit.de/news/2025-05/06/schnee-faellt-nachts-auf-dem-feldberg-am-morgen-nur-sturm,https://www.zeit.de/news/2025-05/06/schnee-faellt-nachts-auf-dem-feldberg-am-morgen-nur-sturm,0,www.zeit.de,Wetter: Schnee fällt nachts auf dem Feldberg - am Morgen nur Sturm,Hier finden Sie Informationen zu dem Thema „Wetter“. Lesen Sie jetzt „Schnee fällt nachts auf dem Feldberg - am Morgen nur Sturm“.,https://img.zeit.de/news/2025-05/06/schnee-faellt-nachts-auf-dem-feldberg-am-morgen-nur-sturm-image-group/wide__1300x731,2025-05-06T06:16:27Z,,Leichten Schneefall hat der Deutsche Wetterdienst auf dem Feldberg (Landkreis Breisgau-Hochschwarzwald) in der Nacht auf Dienstag gemeldet. Am Morgen lagen am Bismarckdenkmal auf dem Gipfel allerding… [+1557 chars],,de,'Frost'
https://www.stern.de/gesellschaft/regional/baden-wuerttemberg/wetter--schnee-faellt-nachts-auf-dem-feldberg---am-morgen-nur-sturm-35696926.html,https://www.stern.de/gesellschaft/regional/baden-wuerttemberg/wetter--schnee-faellt-nachts-auf-dem-feldberg---am-morgen-nur-sturm-35696926.html,0,www.stern.de,Wetter: Schnee fällt nachts auf dem Feldberg - am Morgen nur Sturm,"Leicht geschneit hat es in der Nacht auf Dienstag auf dem Feldberg - am Morgen ist davon aber nichts mehr zu sehen. In Baden-Württemberg soll es weiter Wolken, Regen und Wind geben.",https://image.stern.de/35696928/t/sr/v1/w1440/r1.7778/-/06--6kqmw4cbgav5axs2048jpeg---0b66537a694b429b.jpg,2025-05-06T06:16:27Z,https://web.archive.org/web/20250506070726/https://www.stern.de/gesellschaft/regional/baden-wuerttemberg/wetter--schnee-faellt-nachts-auf-dem-feldberg---am-morgen-nur-sturm-35696926.html,"Kopiere den aktuellen Link
Zur Merkliste hinzufügen
Leicht geschneit hat es in der Nacht auf Dienstag auf dem Feldberg - am Morgen ist davon aber nichts mehr zu sehen. In Baden-Württemberg soll es … [+1754 chars]",,de,'Schnee'
https://www.computerbase.de/news/apps/gemeinnuetzigkeit-bleibt-openai-gibt-umwandlungsplaene-vorerst-auf.92485/,https://www.computerbase.de/news/apps/gemeinnuetzigkeit-bleibt-openai-gibt-umwandlungsplaene-vorerst-auf.92485/,0,www.computerbase.de,Gemeinnützigkeit bleibt: OpenAI gibt Umwandlungs­pläne vorerst auf,"OpenAI hat die seit längerem verfolgten Pläne, das Unternehmen in ein kommerzielles Start-up umzuwandeln, vorerst auf Eis gelegt. Der KI-Entwickler bleibt damit weiterhin unter der Kontrolle einer gemeinnützigen Organisation, wie OpenAI-CEO Sam Altman in eine…",https://pics.computerbase.de/1/1/7/2/9/8-4a601180056663b0/article-1280x720.292116fc.jpg,2025-05-06T07:42:00Z,,"OpenAI hat die seit längerem verfolgten Pläne, das Unternehmen in ein kommerzielles Start-up umzuwandeln, vorerst auf Eis gelegt. Der KI-Entwickler bleibt damit weiterhin unter der Kontrolle einer ge… [+2061 chars]",,de,'Eis'
https://www.focus.de/auto/adac-test-zeigt-dass-offroad-reifen-bei-naesse-eine-gefahr-sind_aa3e9d67-c2cc-4283-8b0a-5a310ae1abac.html,https://www.focus.de/auto/adac-test-zeigt-dass-offroad-reifen-bei-naesse-eine-gefahr-sind_aa3e9d67-c2cc-4283-8b0a-5a310ae1abac.html,0,www.focus.de,"ADAC Test zeigt, dass Offroad-Reifen bei Nässe eine Gefahr sind","Der ADAC hat seinen Test für Offroad-Reifen veröffentlicht. Die Ergebnisse sind ""ernüchternd"" - die besten Modelle erhalten nur die Note ""befriedigend"".",https://quadro.burda-forward.de/ctf/4e3bdd09-a34f-41a7-a885-48c07eaeb5a9.d5fd77c4-8f36-4343-ae26-6e821adf82c0.jpg?im=RegionOfInterestCrop%3D%281200%2C630%29%2CregionOfInterest%3D%281047%2C655%29&hash=ce0ae1dd0eb628d8be20ecb39d83ad66f9e9dc22592183cf992facb09cc9cbfd,2025-05-06T09:22:11Z,https://web.archive.org/web/20250507164501/https://www.focus.de/auto/adac-test-zeigt-dass-offroad-reifen-bei-naesse-eine-gefahr-sind_aa3e9d67-c2cc-4283-8b0a-5a310ae1abac.html,"Mehr und mehr Fahrzeughalter entscheiden sich für All-Terrain-Reifen, die sowohl für den Einsatz im Gelände als auch auf befestigten Straßen ausgelegt sind. Der ADAC hat diese Entwicklung gründlich u… [+2166 chars]",,de,'Nässe'
https://www.tagesspiegel.de/kultur/netflix-hit-eternauta-schnee-der-todlich-auf-korper-fallt-13642573.html,https://www.tagesspiegel.de/kultur/netflix-hit-eternauta-schnee-der-todlich-auf-korper-fallt-13642573.html,0,www.tagesspiegel.de,"Netflix-Hit „Eternauta“: Schnee, der tödlich auf Körper fällt","Die dystopische Sci-Fi-Serie „Eternauta“ geht bei Netflix gerade durch die Decke, auch ohne Zombies. Wir sagen Ihnen, warum.",https://www.tagesspiegel.de/images/13646026/alternates/BASE_16_9_W1400/1746526652000/eternauta.jpeg,2025-05-06T10:18:06Z,https://web.archive.org/web/20250507095538/https://www.tagesspiegel.de/kultur/netflix-hit-eternauta-schnee-der-todlich-auf-korper-fallt-13642573.html,"Wie aus dem Nichts ist in den vergangenen Tagen auf Netflix eine sechsteilige Serie an die Spitze der Charts gesprungen, die es in gewisser Weise mit The Last of Us (auf Sky/WoW) aufnehmen kann. In E… [+4866 chars]",,de,'Schnee'
https://www.stern.de/panorama/wetter--frostige-naechte-und-kuehles-wetter-35698210.html,https://www.stern.de/panorama/wetter--frostige-naechte-und-kuehles-wetter-35698210.html,0,www.stern.de,Wetter: Frostige Nächte und kühles Wetter,Nach sommerlichem Wetter gibt es jetzt kühlere Temperaturen. In der vergangenen Nacht wurden an mehreren Orten Werte unter dem Gefrierpunkt gemessen. Wie geht es in dieser Woche weiter?,https://image.stern.de/35698212/t/Ob/v1/w1440/r1.7778/-/06--sonln3v6a5v3axs2048jpeg---3956aeea9e4d1d68.jpg,2025-05-06T11:05:50Z,https://web.archive.org/web/20250506131221/https://www.stern.de/panorama/wetter--frostige-naechte-und-kuehles-wetter-35698210.html,"Kopiere den aktuellen Link
Zur Merkliste hinzufügen
Nach sommerlichem Wetter gibt es jetzt kühlere Temperaturen. In der vergangenen Nacht wurden an mehreren Orten Werte unter dem Gefrierpunkt gemes… [+2296 chars]",,de,'Frost'
https://www.diepresse.com/19649539/dystopische-serie-el-eternauta-warum-bringt-hier-der-schnee-den-tod,https://www.diepresse.com/19649539/dystopische-serie-el-eternauta-warum-bringt-hier-der-schnee-den-tod,0,www.diepresse.com,Dystopische Serie „El Eternauta“: Warum bringt hier der Schnee den Tod?,"Vieles bleibt rätselhaft in der Netflix-Serie „El Eternauta“. Sie basiert auf einer Graphic Novel aus den 1950er-Jahren, deren Schöpfer Opfer der Militärjunta wurde – und sie ist voll politischer Symbolik.",https://img.diepresse.com/public/incoming/hm33fe-El-Eternauta/alternates/DPR_SOCIAL_MAGAZIN/El%20Eternauta,2025-05-06T11:06:59Z,https://web.archive.org/web/20250507063350/https://www.diepresse.com/19649539/dystopische-serie-el-eternauta-warum-bringt-hier-der-schnee-den-tod,"Vieles bleibt rätselhaft in der Netflix-Serie El Eternauta. Sie basiert auf einer Graphic Novel aus den 1950er-Jahren, deren Schöpfer Opfer der Militärjunta wurde und sie ist voll politischer Symboli… [+4092 chars]",,de,'Schnee'
https://www.tagesspiegel.de/gesellschaft/panorama/wetter-frostige-nachte-und-kuhles-wetter-13646614.html,https://www.tagesspiegel.de/gesellschaft/panorama/wetter-frostige-nachte-und-kuhles-wetter-13646614.html,0,www.tagesspiegel.de,Wetter: Frostige Nächte und kühles Wetter,Nach sommerlichem Wetter gibt es jetzt kühlere Temperaturen. In der vergangenen Nacht wurden an mehreren Orten Werte unter dem Gefrierpunkt gemessen. Wie geht es in dieser Woche weiter?,https://www.tagesspiegel.de/images/13646611/alternates/BASE_16_9_W1400/1746529625000/morgenstimmung-in-brandenburg.jpeg,2025-05-06T11:07:05Z,https://web.archive.org/web/20250507150127/https://www.tagesspiegel.de/gesellschaft/panorama/wetter-frostige-nachte-und-kuhles-wetter-13646614.html,Nach einem sommerlichen Maibeginn kommt diese Woche mit kühlen Temperaturen und nächtlichem Frost daher. Laut dem Deutschen Wetterdienst (DWD) wurden in der Nacht zum Dienstag in Faßberg (Niedersachs… [+2813 chars],,de,'Frost'
https://www.zeit.de/news/2025-05/06/frostige-naechte-und-kuehles-wetter,https://www.zeit.de/news/2025-05/06/frostige-naechte-und-kuehles-wetter,0,www.zeit.de,Wetter: Frostige Nächte und kühles Wetter,Hier finden Sie Informationen zu dem Thema „Wetter“. Lesen Sie jetzt „Frostige Nächte und kühles Wetter“.,https://img.zeit.de/news/2025-05/06/frostige-naechte-und-kuehles-wetter-image-group/wide__1300x731,2025-05-06T11:09:38Z,,Nach einem sommerlichen Maibeginn kommt diese Woche mit kühlen Temperaturen und nächtlichem Frost daher. Laut dem Deutschen Wetterdienst (DWD) wurden in der Nacht zum Dienstag in Faßberg (Niedersachs… [+2094 chars],,de,'Frost'
https://www.welt.de/videos/video256074102/FC-Bayern-Nichts-Besseres-zu-tun-Sanes-Wechsel-zum-Piranha-wirft-viele-Fragen-auf.html,https://www.welt.de/videos/video256074102/FC-Bayern-Nichts-Besseres-zu-tun-Sanes-Wechsel-zum-Piranha-wirft-viele-Fragen-auf.html,0,www.welt.de,„Nichts Besseres zu tun?“ – Sanés Wechsel zum „Piranha“ wirft viele Fragen auf,"Die Vertragsverlängerung von Leroy Sané beim FC Bayern München soll bereits ausverhandelt gewesen sein, doch nun hat der deutsche Nationalspieler plötzlich seinen Berater gewechselt. Der Zeitpunkt dieses Schritts sorgt für Fragezeichen bei Marcel Reif.",https://img.welt.de/img/videos/mobile256074100/2187938977-ci16x9-w1200/Leroy-Sane.jpg,2025-05-06T11:21:04Z,https://web.archive.org/web/20250507151952/https://www.welt.de/videos/video256074102/FC-Bayern-Nichts-Besseres-zu-tun-Sanes-Wechsel-zum-Piranha-wirft-viele-Fragen-auf.html,"Die Vertragsverlängerung von Leroy Sané beim FC Bayern München soll bereits ausverhandelt gewesen sein, doch nun hat der deutsche Nationalspieler plötzlich seinen Berater gewechselt. Der Zeitpunkt di… [+112 chars]",,de,'Reif'
https://www.zeit.de/news/2025-05/06/eu-kommission-will-verbot-fuer-alle-russischen-gasimporte,https://www.zeit.de/news/2025-05/06/eu-kommission-will-verbot-fuer-alle-russischen-gasimporte,0,www.zeit.de,Energie: EU-Kommission will Verbot für alle russischen Gasimporte,Hier finden Sie Informationen zu dem Thema „Energie“. Lesen Sie jetzt „EU-Kommission will Verbot für alle russischen Gasimporte“.,https://img.zeit.de/news/2025-05/06/eu-kommission-will-verbot-fuer-alle-russischen-gasimporte-image-group/wide__1300x731,2025-05-06T13:37:01Z,https://web.archive.org/web/20250506163954/https://www.zeit.de/news/2025-05/06/eu-kommission-will-verbot-fuer-alle-russischen-gasimporte,"Die EU-Kommission will die Einfuhr von russischem Gas in die Europäische Union bis Ende 2027 vollständig verbieten. Im Juni sollen den Mitgliedsstaaten dafür konkrete Maßnahmen vorgelegt werden, wie … [+143 chars]",,de,'Gas'
https://www.tagesschau.de/ausland/europa/eu-russisches-gas-100.html,https://www.tagesschau.de/ausland/europa/eu-russisches-gas-100.html,0,www.tagesschau.de,EU-Kommission plant Verbot aller russischen Gasimporte,Anders als bei Einfuhren von Öl oder Kohle gibt es für russische Gasimporte in die EU noch keine Beschränkungen. Das will die EU-Kommission schnell ändern - und die Importe bis Ende 2027 sogar komplett verbieten.,https://images.tagesschau.de/image/61c4046d-9020-43d4-9d7c-57d188bfd8ec/AAABlqXvMFs/AAABkZLhkrw/16x9-1280/russland-lng-schiff-100.jpg,2025-05-06T14:27:14Z,http://archive.md/20250507141326/https://www.tagesschau.de/ausland/europa/eu-russisches-gas-100.html,"Stand: 06.05.2025 16:27 Uhr
Anders als bei Einfuhren von Öl oder Kohle gibt es für russische Gasimporte in die EU noch keine Beschränkungen. Das will die EU-Kommission schnell ändern - und die Impor… [+3722 chars]",,de,'Gas'
https://www.faz.net/aktuell/wirtschaft/mehr-wirtschaft/eu-will-neue-gasliefervertraege-mit-russland-verbieten-110459688.html,https://www.faz.net/aktuell/wirtschaft/mehr-wirtschaft/eu-will-neue-gasliefervertraege-mit-russland-verbieten-110459688.html,0,www.faz.net,EU will neue Gaslieferverträge mit Russland verbieten,Noch deckt die EU fast 20 Prozent ihres Gasbedarfs mit Importen aus Russland. Die EU-Kommission will das ändern. Kann das gelingen?,https://media0.faz.net/ppmedia/aktuell/1727680326/1.10357278/facebook_teaser/ein-russischer-gas-tanker-vor.jpg,2025-05-06T14:38:52Z,http://archive.md/20250506153537/https://www.faz.net/aktuell/wirtschaft/mehr-wirtschaft/eu-will-neue-gasliefervertraege-mit-russland-verbieten-110459688.html,Die Europäische Union will neue Gaslieferverträge mit Russland bis zum Jahresende verbieten und bestehende Verträge bis Ende 2027 auslaufen lassen. Bestehende Spotverträge sollen ebenfalls schon zum … [+3558 chars],,de,'Gas'
https://www.bild.de/politik/friedrich-merz-bei-kanzlerwahl-handschuh-geheimnis-um-kloeckner-681a2d926255e217f6c1eca3,https://www.bild.de/politik/friedrich-merz-bei-kanzlerwahl-handschuh-geheimnis-um-kloeckner-681a2d926255e217f6c1eca3,0,www.bild.de,Tag der Kanzlerwahl - Darum trug Klöckner weiße Handschuhe,"Was steckt dahinter, dass Julia Klöckner beim Amtseid für Merz weiße Handschuhe trug? Ist es ein Mode-Gag? Nein! Der Grund ist viel bedeutender.","https://images.bild.de/681a2d926255e217f6c1eca3/be3f82fff1bc922c8938ca15dafb322d,4b6fe595?w=1280",2025-05-06T17:41:45Z,https://web.archive.org/web/20250506182245/https://www.bild.de/politik/friedrich-merz-bei-kanzlerwahl-handschuh-geheimnis-um-kloeckner-681a2d926255e217f6c1eca3,"Es war der große Moment der Machtübergabe. Der neue Bundeskanzler Friedrich Merz hebt die Hand zum Amtseid und schwört SO WAHR MIR GOTT HELFE. Und plötzlich fällt allen ein kleines, feines Detail auf… [+2513 chars]",,de,'Handschuhe'
https://www.stern.de/politik/deutschland/julia-kloeckner--warum-trug-sie-bei-der-vereidigung-weisse-handschuhe--35699678.html,https://www.stern.de/politik/deutschland/julia-kloeckner--warum-trug-sie-bei-der-vereidigung-weisse-handschuhe--35699678.html,0,www.stern.de,Bundestagspräsidentin: Warum trug Julia Klöckner bei der Vereidigung weiße Handschuhe?,Bundestagspräsidentin Julia Klöckner fiel bei der Vereidigung von Friedrich Merz durch ein ungewöhnliches Accessoire auf – weiße Handschuhe. Was steckte dahinter?,https://image.stern.de/35699714/t/J2/v1/w1440/r1.7778/-/julia-klo-ckner-vereidigung.jpg,2025-05-06T18:10:00Z,,"Kopiere den aktuellen Link
Zur Merkliste hinzufügen
Bundestagspräsidentin Julia Klöckner fiel bei der Vereidigung von Friedrich Merz durch ein ungewöhnliches Accessoire auf weiße Handschuhe. Was st… [+1858 chars]",,de,'Handschuhe'
