index,url,valid,domain,title,description,image,published,archive,content,quote,language,keyword
https://www.bild.de/sport/fussball/finde-ich-merkwuerdig-tv-experte-kritisiert-bayern-enthuellungen-6715efb2a0e636753eda6735,https://www.bild.de/sport/fussball/finde-ich-merkwuerdig-tv-experte-kritisiert-bayern-enthuellungen-6715efb2a0e636753eda6735,0,www.bild.de,„Finde ich merkwürdig“ - TV-Experte kritisiert Bayern-Enthüllungen,Das Bosse-Beben bei den Bayern macht Marcel Reif stutzig.,"https://images.bild.de/6715efb2a0e636753eda6735/f70d26fe1bcef01080de0d0749e74c4b,55f1b6a8?w=1280",2024-10-21T09:56:50Z,,"Mehr zum Video anzeigen 
Das Bosse-Beben bei den Bayern macht Marcel Reif stutzig.
Quelle: BILD21.10.2024 - 11:56 Uhr",,de,'Reif'
https://www.telepolis.de/features/Kubas-Kampf-gegen-die-Dunkelheit-Stromnetz-erneut-kollabiert-9988239.html,https://www.telepolis.de/features/Kubas-Kampf-gegen-die-Dunkelheit-Stromnetz-erneut-kollabiert-9988239.html,0,www.telepolis.de,Kubas Kampf gegen die Dunkelheit: Stromnetz erneut kollabiert,"Kubas Energienetz vor wenigen Stunden erneut kollabiert, während Hurrikan Oscar naht. Regierung macht US-Sanktionen für Krise verantwortlich. Wann gehen die Lichter auf der Insel wieder an?",https://heise.cloudimg.io/bound/1200x1200/q85.png-lossy-85.webp-lossy-85.foil1/_www-heise-de_/imgs/18/4/6/9/2/9/1/7/shutterstock_2473556431-cb3ccf1bb32b5331.jpeg,2024-10-21T10:00:00Z,,"Stromausfall im kubanischen Trinidad im Januar dieses Jahres
(Bild: Rosen Ivanov Iliev/Shutterstock.com )
Kubas Energienetz am Sonntag erneut kollabiert, während Hurrikan Oscar naht. Regierung mach… [+6078 chars]",,de,'Dunkelheit'
https://www.focus.de/panorama/wetter-im-ticker-kalte-polarluft-bringt-schnee-nach-deutschland_id_54933749.html,https://www.focus.de/panorama/wetter-im-ticker-kalte-polarluft-bringt-schnee-nach-deutschland_id_54933749.html,0,www.focus.de,Wetter im Ticker - Wintervorboten: Kalte Polarluft bringt Schnee nach Deutschland,"Ab der nächsten Woche wird es in Deutschland kälter, und es könnte sogar bis in tiefere Lagen schneien. Ein Hochdruckgebiet über den Britischen Inseln sorgt dafür, dass kalte Polarluft nach Deutschland gelangt. Alle Wetter-Entwicklungen im Ticker.",https://p6.focus.de/img/fotos/id_260409709/wetter.jpg?im=Crop%3D%280%2C288%2C3464%2C1732%29%3BResize%3D%281200%2C627%29&impolicy=perceptual&quality=mediumHigh&hash=e91d761cb607d5ec6cb58ef95dbfcf1ec3d3851c35ece9715a8bb8f3103ff3fb,2024-10-21T10:10:42Z,,"Ab der nächsten Woche wird es in Deutschland kälter, und es könnte sogar bis in tiefere Lagen schneien. Ein Hochdruckgebiet über den Britischen Inseln sorgt dafür, dass kalte Polarluft nach Deutschla… [+10002 chars]",,de,'Winter'
https://www.bild.de/politik/ausland-und-internationales/israel-hamas-chef-nutzte-sechs-israelische-geiseln-als-schutzschilde-6715f7d5bb1dac668c75b2d0,https://www.bild.de/politik/ausland-und-internationales/israel-hamas-chef-nutzte-sechs-israelische-geiseln-als-schutzschilde-6715f7d5bb1dac668c75b2d0,0,www.bild.de,"Folter, Dunkelheit, Hunger - Sechs getötete Geiseln waren Sinwars Schutzschild","Schockierende Details über Sinwar enthüllen, wie er israelische Geiseln in Terror-Tunneln als menschliche Schutzschilde missbrauchte.","https://images.bild.de/6715f7d5bb1dac668c75b2d0/4456a12b3254311de4c7b0fe72884502,aecc91ed?w=1280",2024-10-21T10:54:34Z,,In den endlosen Terror-Tunneln der Hamas umgab sich der am Mittwoch getötete Hamas-Chef Jahja Sinwar mit israelischen Geiseln missbrauchte sie so monatelang als menschliche Schutzschilde. Zu essen be… [+1846 chars],,de,'Dunkelheit'
https://www.sueddeutsche.de/bayern/bayern-liftbetreiber-wintersport-skigebiete-klimawandel-lux.UrjW1AZgdTDncL4cMTifm1,https://www.sueddeutsche.de/bayern/bayern-liftbetreiber-wintersport-skigebiete-klimawandel-lux.UrjW1AZgdTDncL4cMTifm1,0,www.sueddeutsche.de,Wintersport: Skifahren in Bayern wird teurer,"Wegen steigender Personal- und Energiekosten heben die Skigebiete ihre Preise an. Vor dem Start der Saison hoffen die Betreiber auf Schnee und Kälte, doch das Geschäft wird angesichts des Klimawandels immer schwieriger.",https://www.sueddeutsche.de/2024/10/21/21b7167a-afac-4e91-80ce-adeee89a51ad.jpeg?q=60&fm=webp&width=1200&rect=0%2C562%2C3000%2C1688,2024-10-21T11:07:00Z,,"Klar ist schon jetzt: Die Skipässe werden teurer. Aufgrund der allgemeinen Kostensteigerung in vielen Bereichen etwa Energie und Personal sei eine Erhöhung nicht vermeidbar, teilte der Verband Deutsc… [+5051 chars]",,de,'Schnee'
https://www.zeit.de/news/2024-10/21/netzentgelte-bei-gas-steigen-hoehere-kundenpreise,https://www.zeit.de/news/2024-10/21/netzentgelte-bei-gas-steigen-hoehere-kundenpreise,0,www.zeit.de,Energiekosten: Netzentgelte bei Gas steigen - Höhere Kundenpreise?,Hier finden Sie Informationen zu dem Thema „Energiekosten“. Lesen Sie jetzt „Netzentgelte bei Gas steigen - Höhere Kundenpreise?“.,https://img.zeit.de/news/2024-10/21/netzentgelte-bei-gas-steigen-hoehere-kundenpreise-image-group/wide__1300x731,2024-10-21T12:51:27Z,,"Die Gasnetzbetreiber in Brandenburg haben steigende Netzentgelte ab dem kommenden Jahr angekündigt. So würden diese um rund 20 Prozent erhöht, erklärte eine Sprecherin der Verbraucherzentrale in Bran… [+1281 chars]",,de,'Gas'
https://www.tagesspiegel.de/berlin/energiekosten-netzentgelte-bei-gas-steigen-hohere-kundenpreise-12571055.html,https://www.tagesspiegel.de/berlin/energiekosten-netzentgelte-bei-gas-steigen-hohere-kundenpreise-12571055.html,0,www.tagesspiegel.de,Energiekosten: Netzentgelte bei Gas steigen - Höhere Kundenpreise?,Für die Gasanbieter in Brandenburg steigen die Netzentgelte im kommenden Jahr. Bedeutet das auch einen Anstieg der Gaspreise beim Endkunden?,https://www.tagesspiegel.de/images/12571052/alternates/BASE_16_9_W1400/1729515150000/gas-metallplatte.jpeg,2024-10-21T12:52:30Z,,"Die Gasnetzbetreiber in Brandenburg haben steigende Netzentgelte ab dem kommenden Jahr angekündigt. So würden diese um rund 20 Prozent erhöht, erklärte eine Sprecherin der Verbraucherzentrale in Bran… [+787 chars]",,de,'Heizen'
https://www.stern.de/auto/tempolimit-mit-schneeflocken-schild--wann-gilt-das-eigentlich--35159774.html,https://www.stern.de/auto/tempolimit-mit-schneeflocken-schild--wann-gilt-das-eigentlich--35159774.html,0,www.stern.de,Straßenverkehr: Tempolimit mit Schneeflocken-Schild: Wann gilt das eigentlich?,Gilt es oder nicht? Diese Frage stellen sich bei einem Tempolimit mit Schneeflocken-Symbol viele Autofahrer. Die meisten würden sich falsch entscheiden – besonders im Sommer.,https://image.stern.de/35159772/t/RX/v1/w1440/r1.7778/-/schneeflocke-tempolimit-verkehrsschild.jpg,2024-10-21T13:55:00Z,,"Im deutschen Schilderwald gibt es zahllose Besonderheiten. Schilder, die nur zu bestimmten Uhrzeiten gelten, zum Beispiel. Oder Schilder, die nur bei einem bestimmten Wetter zu beachten sind. In letz… [+2543 chars]",,de,'Schnee'
https://www.telepolis.de/features/Afrikanische-Staaten-planen-eigene-Bank-fuer-fossile-Energieprojekte-9988482.html,https://www.telepolis.de/features/Afrikanische-Staaten-planen-eigene-Bank-fuer-fossile-Energieprojekte-9988482.html,0,www.telepolis.de,Afrikanische Staaten planen eigene Bank für fossile Energieprojekte,Ziel des neuen Finanzinstituts soll die Erschließung von Öl und Gas für den Eigenbedarf sein ‒ entgegen westlichen Interessen. Doch es gibt Hürden.,https://heise.cloudimg.io/bound/1200x1200/q85.png-lossy-85.webp-lossy-85.foil1/_www-heise-de_/imgs/18/4/6/9/3/0/4/1/Zwischenablage-1-ba60f0de877d69e3.jpeg,2024-10-21T14:00:00Z,http://archive.md/20241021202032/https://www.telepolis.de/features/Afrikanische-Staaten-planen-eigene-Bank-fuer-fossile-Energieprojekte-9988482.html,"Holzkohlemarkt in Kampala, Uganda. Foto: Vlad Karavaev, shutterstock
Ziel des neuen Finanzinstituts soll die Erschließung von Öl und Gas für den Eigenbedarf sein entgegen westlichen Interessen. Doch… [+4862 chars]",,de,'Gas'
https://www.brigitte.de/leben/wohnen/fuer-ein-gemuetlicheres-zuhause--5-dinge--die-du-noch-vor-dem-winter-entsorgen-solltest-13893496.html,https://www.brigitte.de/leben/wohnen/fuer-ein-gemuetlicheres-zuhause--5-dinge--die-du-noch-vor-dem-winter-entsorgen-solltest-13893496.html,0,www.brigitte.de,"Für ein gemütlicheres Zuhause: 5 Dinge, die du noch vor dem Winter entsorgen solltest","Der Frühling ist nicht die einzige Zeit, die sich gut zum Entrümpeln eignet. Du könntest den Herbst nutzen, um dein Zuhause aufzuräumen und neu zu organisieren – wie das am besten klappt, erfährst du im Video.",https://image.brigitte.de/13893490/t/yr/v1/w1440/r1.7778/-/fuenf-dinge-die-du-vor-dem-winter-entsorgen-solltest.jpg,2024-10-21T15:11:00Z,,"Der Frühling ist nicht die einzige Zeit, die sich gut zum Entrümpeln eignet: Auch der Herbst ist perfekt, um dein Zuhause aufzuräumen und neu zu organisieren wie das am besten klappt, erfährst du im … [+689 chars]",,de,'Winter'
https://www.stern.de/gesellschaft/regional/berlin-brandenburg/berliner-gasnetz--uebernahme-der-gasag-durch-das-land-steht-auf-der-kippe-35162020.html,https://www.stern.de/gesellschaft/regional/berlin-brandenburg/berliner-gasnetz--uebernahme-der-gasag-durch-das-land-steht-auf-der-kippe-35162020.html,0,www.stern.de,Berliner Gasnetz: Übernahme der Gasag durch das Land steht auf der Kippe,Das Land Berlin will zentrale Energienetze nach und nach verstaatlichen. Beim Gas stößt der Senat bei dem Plan aber auf Widerstand. Die Rekommunalisierung des Netzes steht infrage.,https://image.stern.de/35162022/t/hm/v1/w1440/r1.7778/-/21--giw4idkgirv5axw800h600jpeg---e4d050062098d443.jpg,2024-10-21T15:35:49Z,,"Das Land Berlin will zentrale Energienetze nach und nach verstaatlichen. Beim Gas stößt der Senat bei dem Plan aber auf Widerstand. Die Rekommunalisierung des Netzes steht infrage.
Die geplante Über… [+963 chars]",,de,'Gas'
https://www.zeit.de/news/2024-10/21/gegen-gruene-eu-label-fuer-atom-und-gas-prozess-startet,https://www.zeit.de/news/2024-10/21/gegen-gruene-eu-label-fuer-atom-und-gas-prozess-startet,0,www.zeit.de,EuGH-Verhandlung: Gegen grüne EU-Label für Atom und Gas: Prozess startet,Hier finden Sie Informationen zu dem Thema „EuGH-Verhandlung“. Lesen Sie jetzt „Gegen grüne EU-Label für Atom und Gas: Prozess startet“.,https://img.zeit.de/news/2024-10/21/gegen-gruene-eu-label-fuer-atom-und-gas-prozess-startet-image-group/wide__1300x731,2024-10-21T15:38:18Z,,Der Rechtsstreit zwischen Österreich und der EU-Kommission zur Einstufung von Atomkraft und Gas als klimafreundlich geht in die heiße Phase. Vor dem Europäischen Gerichtshof (EuGH) in Luxemburg start… [+1338 chars],,de,'Gas'
https://www.zeit.de/news/2024-10/21/erstes-del-spiel-im-ausland-abgesagt-worden,https://www.zeit.de/news/2024-10/21/erstes-del-spiel-im-ausland-abgesagt-worden,0,www.zeit.de,Eishockey: Erstes DEL-Spiel im Ausland abgesagt worden,Hier finden Sie Informationen zu dem Thema „Eishockey“. Lesen Sie jetzt „Erstes DEL-Spiel im Ausland abgesagt worden“.,https://img.zeit.de/news/2024-10/21/erstes-del-spiel-im-ausland-abgesagt-worden-image-group/wide__1300x731,2024-10-21T20:14:44Z,,"Das erste Spiel der Deutschen Eishockey Liga (DEL) auf ausländischem Boden findet vorerst nicht statt. Die Winter Hockey Games 2024 in Prag, bei denen auch die DEL-Partie zwischen den Grizzlys Wolfsb… [+662 chars]",,de,'Winter'
"https://www.gamestar.de/artikel/dayz-frostline-gespielt-survival,3421496.html","https://www.gamestar.de/artikel/dayz-frostline-gespielt-survival,3421496.html",0,www.gamestar.de,Special: DayZ Frostline - Eines der größten Survivalspiele hat für mich seine Faszination verloren,Mit Frostline hat das altehrwürdige Survivalspiel eine ganz neue Karte bekommen. Doch unser Autor scheitert an der Rückkehr in die Zombieapokalypse.,https://images.cgames.de/images/gamestar/4/dayz-frostline_6316117.jpg,2024-10-22T04:14:00Z,,"Nach fünf Stunden in Dayz Frostline fühle ich mich ungefähr wie Phil Connors (Bill Murray) in Und täglich grüßt das Murmeltier. Ich bin dazu verurteilt, dieselbe Erfahrung, denselben Tag immer wieder… [+5090 chars]",,de,'Winterkleidung'
https://www.tagesschau.de/ausland/asien/brics-china-pipeline-100.html,https://www.tagesschau.de/ausland/asien/brics-china-pipeline-100.html,0,www.tagesschau.de,China und Russland: Beim Gaspreis hört die Freundschaft auf,"Heute beginnt der BRICS-Gipfel in der russischen Stadt Kasan, bei dem sich China und Russland als enge Freunde präsentieren. Doch bei einem Pipeline-Projekt gibt es offenbar einen Interessenskonflikt. Von Benjamin Eyssel.",https://images.tagesschau.de/image/3d347657-75be-41ef-b85a-01e7426b12a1/AAABkrMBjkA/AAABkZLhkrw/16x9-1280/putin-brics-104.jpg,2024-10-22T06:54:37Z,http://archive.md/20241022104352/https://www.tagesschau.de/ausland/asien/brics-china-pipeline-100.html,"Stand: 22.10.2024 08:54 Uhr
Heute beginnt der BRICS-Gipfel in der russischen Stadt Kasan, bei dem sich China und Russland als enge Freunde präsentieren. Doch bei einem Pipeline-Projekt gibt es offen… [+4280 chars]",,de,'Gas'
https://www.telepolis.de/features/Nebel-Naesse-Nervenkitzel-So-meistern-Sie-den-Herbst-Verkehr-9989181.html,https://www.telepolis.de/features/Nebel-Naesse-Nervenkitzel-So-meistern-Sie-den-Herbst-Verkehr-9989181.html,0,www.telepolis.de,"Nebel, Nässe, Nervenkitzel: So meistern Sie den Herbst-Verkehr",Herbst birgt Tücken für Autofahrer. Experten raten zu angepasster Fahrweise und Fahrzeugchecks. Vor allem eine Gefahr wird oft unterschätzt.,https://heise.cloudimg.io/bound/1200x1200/q85.png-lossy-85.webp-lossy-85.foil1/_www-heise-de_/imgs/18/4/6/9/3/4/1/0/shutterstock_1009484023-3cbf38cfc9493cc6.jpeg,2024-10-22T07:00:00Z,,"Bild: DrimaFilm/ Shutterstock.com
Herbst birgt Tücken für Autofahrer. Experten raten zu angepasster Fahrweise und Fahrzeugchecks. Vor allem eine Gefahr wird oft unterschätzt.
Nebel, Regen und rutsc… [+3480 chars]",,de,'Schnee'
https://www.brigitte.de/leben/psychologie--diese-7-tipps-helfen-gegen-den-winterblues-13893716.html,https://www.brigitte.de/leben/psychologie--diese-7-tipps-helfen-gegen-den-winterblues-13893716.html,0,www.brigitte.de,Winterblues: Diese 7 Tipps helfen gegen schlechte Stimmung,"Winterblues erwischt einen in der dunklen Jahreszeit schnell mal. Doch das muss nicht sein. Diese 7 Tipps helfen euch, der schlechten Stimmung entgegenzuwirken.",https://image.brigitte.de/13446768/t/FG/v1/w1440/r1.7778/-/winterblues-frau-fenster-tasse-tee.jpg,2024-10-22T07:31:00Z,,"Kälte, grauer Himmel im Winter kann einem die Welt schon einmal trostlos erscheinen. Bevor der Winterblues bei euch einsetzt oder ihr erste Anzeichen eines Stimmungstiefs bekämpfen möchtet, schaut eu… [+5256 chars]",,de,'Kälte'
https://www.welt.de/vermischtes/article254128298/Beginn-der-Winterzeit-Zeitumstellung-wurde-von-Menschen-erfunden-die-keine-Kinder-haben.html,https://www.welt.de/vermischtes/article254128298/Beginn-der-Winterzeit-Zeitumstellung-wurde-von-Menschen-erfunden-die-keine-Kinder-haben.html,0,www.welt.de,"„Zeitumstellung wurde von Menschen erfunden, die keine Kinder haben“",Sie kommt so regelmäßig wie die Diskussion um ihre Sinnhaftigkeit: Am Wochenende werden die Uhren auf Winterzeit gestellt. Diesmal fordert ein Lehrerverband die Abschaffung. In einem europäischen Land wird zum letzten Mal an der Uhr gedreht.,https://img.welt.de/img/vermischtes/mobile254128334/9457932947-ci16x9-w1200/portrait-of-schoolboy-looking-bored.jpg,2024-10-22T09:07:48Z,,"Diesmal ist es der hessische Lehrerverband VBE, der es zuerst fordert: ein Ende der Zeitumstellung. Sie belaste den Organismus und verursache in Familien mit Schulkindern Stress besonders dann, wenn … [+4345 chars]",,de,'Winter'
https://www.stern.de/gesellschaft/regional/berlin-brandenburg/energie--gaspreis-fuer-berliner-gasag-kunden-soll-stabil-bleiben-35164328.html,https://www.stern.de/gesellschaft/regional/berlin-brandenburg/energie--gaspreis-fuer-berliner-gasag-kunden-soll-stabil-bleiben-35164328.html,0,www.stern.de,Energie: Gaspreis für Berliner Gasag-Kunden soll stabil bleiben,Eine dritte Preissenkung in Folge gibt es für Gas-Kunden des Energieversorgers Gasag nicht. Zumindest kann das Unternehmen eigenen Angaben zufolge höhere Kosten ausgleichen.,https://image.stern.de/35164330/t/lN/v1/w1440/r1.7778/-/22--brzep7hzawv10axw800h600jpeg---cc0c04c7e83b2b05.jpg,2024-10-22T11:30:57Z,,"Eine dritte Preissenkung in Folge gibt es für Gas-Kunden des Energieversorgers Gasag nicht. Zumindest kann das Unternehmen eigenen Angaben zufolge höhere Kosten ausgleichen.
Der Gaspreis für die Ber… [+955 chars]",,de,'Gas'
https://www.zeit.de/news/2024-10/22/gaspreis-fuer-berliner-gasag-kunden-soll-stabil-bleiben,https://www.zeit.de/news/2024-10/22/gaspreis-fuer-berliner-gasag-kunden-soll-stabil-bleiben,0,www.zeit.de,Energie: Gaspreis für Berliner Gasag-Kunden soll stabil bleiben,Hier finden Sie Informationen zu dem Thema „Energie“. Lesen Sie jetzt „Gaspreis für Berliner Gasag-Kunden soll stabil bleiben“.,https://img.zeit.de/news/2024-10/22/gaspreis-fuer-berliner-gasag-kunden-soll-stabil-bleiben-image-group/wide__1300x731,2024-10-22T11:30:57Z,,Der Gaspreis für die Berliner Kunden des Anbieters Gasag soll nach Unternehmensangaben im kommenden Jahr stabil bleiben. «Wir können dank verbesserter Beschaffungspreise die Kostensteigerungen für di… [+774 chars],,de,'Gas'
https://www.stern.de/wirtschaft/news/handel--nordfrost-ruft-eiswuerfel-beutel-zurueck-35164766.html,https://www.stern.de/wirtschaft/news/handel--nordfrost-ruft-eiswuerfel-beutel-zurueck-35164766.html,0,www.stern.de,Handel: Nordfrost ruft Eiswürfel-Beutel zurück,Schortens - Die Firma Nordfrost GmbH & Co. KG hat Eiswürfel-Beutel wegen möglicher Verunreinigung mit Plastikteilchen deutschlandweit zurückgerufen.,https://image.stern.de/35164768/t/-U/v1/w1440/r1.7778/-/22--bc4dkfooeov13axw800h600jpeg---bc894d05e0099d30.jpg,2024-10-22T12:49:31Z,,"Wegen möglicher Verunreinigung mit Plastikteilchen ruft die Firma Nordfrost zwei Eiswürfel-Produkte zurück.
Die Firma Nordfrost GmbH &amp; Co. KG hat Eiswürfel-Beutel wegen möglicher Verunreinigung … [+751 chars]",,de,'Eis'
https://www.zeit.de/news/2024-10/22/nordfrost-ruft-eiswuerfel-beutel-zurueck,https://www.zeit.de/news/2024-10/22/nordfrost-ruft-eiswuerfel-beutel-zurueck,0,www.zeit.de,Handel: Nordfrost ruft Eiswürfel-Beutel zurück,Hier finden Sie Informationen zu dem Thema „Handel“. Lesen Sie jetzt „Nordfrost ruft Eiswürfel-Beutel zurück“.,https://img.zeit.de/news/2024-10/22/nordfrost-ruft-eiswuerfel-beutel-zurueck-image-group/wide__1300x731,2024-10-22T12:49:31Z,,Die Firma Nordfrost GmbH &amp; Co. KG hat Eiswürfel-Beutel wegen möglicher Verunreinigung mit Plastikteilchen deutschlandweit zurückgerufen. Betroffen sind die Produkte «Ice Cubes» im Zwei-Kilogramm-… [+633 chars],,de,'Eis'
https://www.sueddeutsche.de/wirtschaft/kuba-krise-stromausfall-wirtschaftskrise-ursachen-lux.BtbZz1ED3pusL9mDJCGch,https://www.sueddeutsche.de/wirtschaft/kuba-krise-stromausfall-wirtschaftskrise-ursachen-lux.BtbZz1ED3pusL9mDJCGch,0,www.sueddeutsche.de,"Wirtschaftskrise: Der Strom ist zurück auf Kuba, die Dunkelheit bleibt","Der rekordverdächtige Vier-Tage-Blackout zeigt, wie schlimm es um die sozialistische Insel steht. Die kubanische Wirtschaft liegt am Boden – und dürfte Schwierigkeiten haben, wieder auf die Füße zu kommen.",https://www.sueddeutsche.de/2024/10/22/64df4395-753f-4bc3-96ae-507208f6b692.jpeg?q=60&fm=webp&width=1200&rect=0%2C0%2C3000%2C1688,2024-10-22T13:00:11Z,,"22. Oktober 2024, 15:00 UhrLesezeit: 4 Min.
Der rekordverdächtige Vier-Tage-Blackout zeigt, wie schlimm es um die sozialistische Insel steht. Die kubanische Wirtschaft liegt am Boden und dürfte Schw… [+506 chars]",,de,'Dunkelheit'
https://www.n-tv.de/politik/US-wahl-2024/Harris-sagt-nicht-ob-sie-Trump-begnadigen-wuerde-article25308065.html,https://www.n-tv.de/politik/US-wahl-2024/Harris-sagt-nicht-ob-sie-Trump-begnadigen-wuerde-article25308065.html,0,www.n-tv.de,"Lange Liste von Verfahren: Harris sagt nicht, ob sie Trump begnadigen würde","Im Moment liegen die vielen Ermittlungsverfahren gegen Trump auf Eis. Verliert er die Wahl, dürfte er aber wieder viel Zeit vor Gericht verbringen. Harris könnte ihm das ersparen - aber will sie das auch?",https://bilder3.n-tv.de/img/incoming/crop25308070/4331324856-cImg_16_9-w1200/15c8d00928fae102c0b5f96099b7f2ed.jpg,2024-10-23T02:52:05Z,,"Im Moment liegen die vielen Ermittlungsverfahren gegen Trump auf Eis. Verliert er die Wahl, dürfte er aber wieder viel Zeit vor Gericht verbringen. Harris könnte ihm das ersparen - aber will sie das … [+2045 chars]",,de,'Eis'
https://www.stern.de/panorama/augentest--koennen-sie-alle-pferde-im-schnee-finden--32699966.html,https://www.stern.de/panorama/augentest--koennen-sie-alle-pferde-im-schnee-finden--32699966.html,0,www.stern.de,Suchbild: Augentest: Können Sie alle Pferde im Schnee entdecken?,Viele Tiere sind gute getarnt und daher in freier Wildbahn nur schwer zu erkennen. Das gilt auch für dieses Suchbild. Wie viele Pferde können sie erkennen? Augen auf!,https://image.stern.de/32699980/t/xK/v2/w1440/r1.7778/-/pferde-raetsel.jpg,2024-10-23T07:11:00Z,,"Viele Tiere sind gute getarnt und daher in freier Wildbahn nur schwer zu erkennen. Das gilt auch für dieses Suchbild. Wie viele Pferde können sie erkennen? Augen auf!
Sie mögen Augentests und Suchbi… [+80 chars]",,de,'Schnee'
https://feed.laut.de/Ensiferum/Alben/Winter-Storm-124162,https://feed.laut.de/Ensiferum/Alben/Winter-Storm-124162,0,feed.laut.de,"""Winter Storm"" von Ensiferum",Harte Nordmänner gegen noch härtere Nordmänner. (3/5),https://www.laut.de/Ensiferum/Alben/Winter-Storm-124162/ensiferum-winter-storm-239138.jpg?40657f,2024-10-23T09:10:05Z,,"laut.de-Kritik
Harte Nordmänner gegen noch härtere Nordmänner.
Review von Franz Mauerer
Selten habe ich mich visuell so gelangweilt wie beim Video zu ""Winter Storm Vigilantes"", der Single von ""Win… [+3557 chars]",,de,'Schnee'
https://www.stern.de/panorama/weltgeschehen/norwegen--190-rentiere-brechen-durch-eis-und-ertrinken-35167010.html,https://www.stern.de/panorama/weltgeschehen/norwegen--190-rentiere-brechen-durch-eis-und-ertrinken-35167010.html,0,www.stern.de,Norwegen: 190 Rentiere brechen durch Eis und ertrinken,"In Norwegen ertrinken 190 Rentiere, nachdem sie auf einem See ins Eis eingebrochen waren. Ein großer Verlust für den Herdenbesitzer – und es hätte noch schlimmer kommen können.",https://image.stern.de/35167012/t/I8/v2/w1440/r1.7778/-/rentiere-norwegen.jpg,2024-10-23T10:59:00Z,,Tragödie im Norden Norwegens: 190 Rentiere sind in einem See nahe der finnischen Grenze ertrunken. Die Tiere brachen durch dünnes Eis am See Stuorajávri in der Gemeinde Kautokeino. Der Vorfall ereign… [+2876 chars],,de,'Eis'
https://www.stern.de/gesellschaft/regional/berlin-brandenburg/innovatives-bauen--scholz-dringt-auf-mehr-schnelligkeit-fuer-neue-technologien-35167874.html,https://www.stern.de/gesellschaft/regional/berlin-brandenburg/innovatives-bauen--scholz-dringt-auf-mehr-schnelligkeit-fuer-neue-technologien-35167874.html,0,www.stern.de,Innovatives Bauen: Scholz dringt auf mehr Schnelligkeit für neue Technologien,Ein Bauprojekt in Brandenburg soll sich beim Heizen und Kühlen selbst versorgen und kann als Modell dienen. Kanzler Scholz wirbt für mehr Standards und sagt auch warum.,https://image.stern.de/35167876/t/ye/v1/w1440/r1.7778/-/23--cnqzwk3x3rv14axw800h600jpeg---5d46b15d9b2bd09f.jpg,2024-10-23T12:06:39Z,,"Ein Bauprojekt in Brandenburg soll sich beim Heizen und Kühlen selbst versorgen und kann als Modell dienen. Kanzler Scholz wirbt für mehr Standards und sagt auch warum.
Bundeskanzler Olaf Scholz (SP… [+1890 chars]",,de,'Heizen'
https://www.tagesspiegel.de/berlin/innovatives-bauen-scholz-dringt-auf-mehr-schnelligkeit-fur-neue-technologien-12582416.html,https://www.tagesspiegel.de/berlin/innovatives-bauen-scholz-dringt-auf-mehr-schnelligkeit-fur-neue-technologien-12582416.html,0,www.tagesspiegel.de,Innovatives Bauen: Scholz dringt auf mehr Schnelligkeit für neue Technologien,Ein Bauprojekt in Brandenburg soll sich beim Heizen und Kühlen selbst versorgen und kann als Modell dienen. Kanzler Scholz wirbt für mehr Standards und sagt auch warum.,https://www.tagesspiegel.de/images/12582413/alternates/BASE_16_9_W1400/1729685259000/bundeskanzler-besucht-blutenviertel-in-caputh.jpeg,2024-10-23T12:07:39Z,,"Bundeskanzler Olaf Scholz (SPD) hält die Schaffung von mehr Standards etwa bei Bauprojekten für sinnvoll, um für mehr Tempo zu sorgen. Wir müssen sehen, dass wir bestimmte Techniken, Fertigkeiten, Te… [+1797 chars]",,de,'Heizen'
https://www.stern.de/sport/ueberschuhe-fuers-radfahren-im-herbst--modelle-und-kauftipps-35166548.html,https://www.stern.de/sport/ueberschuhe-fuers-radfahren-im-herbst--modelle-und-kauftipps-35166548.html,0,www.stern.de,Rundum-Paket: Radfahren mit Überschuhen: So bleiben die Füße beim Biken warm und trocken,"Radfahren und nasskaltes Wetter passen nicht zusammen? Stimmt. Allerdings nur, wenn man keine passenden Überschuhe zur Hand hat. Kauftipps für Herbst und Winter.",https://image.stern.de/35168588/t/PP/v1/w1440/r1.7778/-/ueberschuhe-radfahren-regen-aufmacher-2024.jpg,2024-10-23T14:19:00Z,,"Wer im Alltag auf sein Rad angewiesen ist, sollte auf Wetterkapriolen jedweder Art vorbereitet sein. Der Herbst ist bei Radfahrerinnen und Radfahrern aus mehreren Gründen gefürchtet. Sowohl morgens a… [+3923 chars]",,de,'Winter'
