index,url,valid,domain,title,description,image,published,archive,content,quote,language,keyword
https://www.businessinsider.de/gruenderszene/so-lief-es-fuer-die-ankerkraut-gruender-als-gastloewen-bei-dhdl/,https://www.businessinsider.de/gruenderszene/so-lief-es-fuer-die-ankerkraut-gruender-als-gastloewen-bei-dhdl/,0,www.businessinsider.de,So lief es für die Ankerkraut-Gründer als Gastlöwen bei DHDL,Anne und Stefan Lemcke sind als Gastlöwen zurück: Sie investieren gemeinsam mit Thelen 500.000 Euro für zehn Prozent in Supernutural.,https://cdn.businessinsider.de/wp-content/uploads/2026/03/BF5D4-1-scaled.jpg?ver=1772713080,2026-03-10T06:35:05Z,,"Die Ankerkraut-Gründer, Anne und Stefan Lemcke, sind als Gastlöwen zurück: Sie investieren gemeinsam mit Frank Thelen 500.000Euro in das Startup Supernutural, das eine Nussmus-Maschine entwickelt hat… [+2809 chars]",,de,'Gas'
https://www.stern.de/gesellschaft/regional/hessen/wintersport--wintersport-in-hessen--skigebiete-ziehen-positive-bilanz-37207746.html,https://www.stern.de/gesellschaft/regional/hessen/wintersport--wintersport-in-hessen--skigebiete-ziehen-positive-bilanz-37207746.html,0,www.stern.de,Wintersport: Wintersport in Hessen: Skigebiete ziehen positive Bilanz,Willingen/Gersfeld (lhe) - Der Frühling ist da und die Wintersportsaison in Hessen ist damit vorbei. Die Skigebiete im Land ziehen eine positive Bilanz.,https://image.stern.de/37207748/t/Uz/v1/w1440/r1.7778/-/10--zwe2bz62z3v8axs2048jpeg---b43cfc5702656232.jpg,2026-03-10T10:18:03Z,,"Kopiere den aktuellen Link
Zur Merkliste hinzufügen
Konstante Kälte, volle Pisten: Hessens Wintersportgebiete blicken zufrieden auf die vergangene Saison zurück.
Der Frühling ist da und die Winter… [+1706 chars]",,de,'Kälte'
https://www.faz.net/aktuell/politik/ukraine/ukraine-krieg-warum-junge-ukrainer-freiwillig-zur-armee-gehen-110849251.html,https://www.faz.net/aktuell/politik/ukraine/ukraine-krieg-warum-junge-ukrainer-freiwillig-zur-armee-gehen-110849251.html,0,www.faz.net,Junge Ukrainer in der Armee: Ihre Eltern waren dagegen,"Während viele junge Ukrainer das Land verlassen, gehen andere freiwillig zur Armee. An der Front erwarten sie Kälte, Drohnenterror und Todesangst.",https://media0.faz.net/image/w1200h627/6525ada59854/w3000h1567x0y368o/022026/1.10849249/neue-uniformen-bogdan-und.webp,2026-03-10T15:02:35Z,,"Eine der ersten Aufgaben, die Illja bekam, war es, einen Unterstand zu bauen. Er habe sich da gleich richtig ins Zeug gelegt, erzählt er, mit Zweigen getarnt und einen kleinen Ofen dazu. Bei Luftalar… [+15293 chars]",,de,'Kälte'
https://www.stern.de/gesellschaft/regional/baden-wuerttemberg/dramatischer-vorfall--partie-abgebrochen--eishockey-profi-muss-wiederbelebt-werden-37209890.html,https://www.stern.de/gesellschaft/regional/baden-wuerttemberg/dramatischer-vorfall--partie-abgebrochen--eishockey-profi-muss-wiederbelebt-werden-37209890.html,0,www.stern.de,Dramatischer Vorfall: Partie abgebrochen: Eishockey-Profi muss wiederbelebt werden,Klagenfurt - Eine Eishockey-Partie in Österreich ist von einem schwerwiegenden Zwischenfall überschattet worden. Bei der ICE-Viertelfinalpartie zwischen,https://image.stern.de/37209892/t/dG/v1/w1440/r1.7778/-/10--jbws3wm7m6v9axs2048jpeg---160cafaacf074e2e.jpg,2026-03-10T21:40:20Z,,"Kopiere den aktuellen Link
Zur Merkliste hinzufügen
Jordan Murray spielte für mehrere Teams in Deutschland. Ein medizinischer Notfall um den Kanadier schockt die österreichische Eishockey-Welt.
Ei… [+924 chars]",,de,'Eis'
https://www.zeit.de/news/2026-03/10/partie-abgebrochen-eishockey-profi-muss-wiederbelebt-werden,https://www.zeit.de/news/2026-03/10/partie-abgebrochen-eishockey-profi-muss-wiederbelebt-werden,0,www.zeit.de,Dramatischer Vorfall: Partie abgebrochen: Eishockey-Profi muss wiederbelebt werden,Hier finden Sie Informationen zu dem Thema „Dramatischer Vorfall“. Lesen Sie jetzt „Partie abgebrochen: Eishockey-Profi muss wiederbelebt werden“.,https://img.zeit.de/news/2026-03/10/partie-abgebrochen-eishockey-profi-muss-wiederbelebt-werden-image-group/wide__1300x731,2026-03-10T21:40:20Z,,Eine Eishockey-Partie in Österreich ist von einem schwerwiegenden Zwischenfall überschattet worden. Bei der ICE-Viertelfinalpartie zwischen dem Rekordmeister KAC aus Klagenfurt und dem ungarischen Te… [+767 chars],,de,'Eis'
https://www.tagesspiegel.de/sport/dramatischer-vorfall-partie-abgebrochen-eishockey-profi-muss-wiederbelebt-werden-15339683.html,https://www.tagesspiegel.de/sport/dramatischer-vorfall-partie-abgebrochen-eishockey-profi-muss-wiederbelebt-werden-15339683.html,0,www.tagesspiegel.de,Dramatischer Vorfall: Partie abgebrochen: Eishockey-Profi muss wiederbelebt werden,Jordan Murray spielte für mehrere Teams in Deutschland. Ein medizinischer Notfall um den Kanadier schockt die österreichische Eishockey-Welt.,https://www.tagesspiegel.de/images/15339682/alternates/BASE_16_9_W1400/1773178894000/jordan-murray-l.jpeg,2026-03-10T21:41:34Z,,Eine Eishockey-Partie in Österreich ist von einem schwerwiegenden Zwischenfall überschattet worden. Bei der ICE-Viertelfinalpartie zwischen dem Rekordmeister KAC aus Klagenfurt und dem ungarischen Te… [+821 chars],,de,'Eis'
https://www.focus.de/sport/eishockey/eishockey-profi-bricht-zusammen-und-muss-wiederbelebt-werden_b771db79-a1ff-4af7-9023-6f3baceb42b8.html,https://www.focus.de/sport/eishockey/eishockey-profi-bricht-zusammen-und-muss-wiederbelebt-werden_b771db79-a1ff-4af7-9023-6f3baceb42b8.html,0,www.focus.de,Eishockey-Profi bricht zusammen und muss wiederbelebt werden,Jordan Murray spielte für mehrere Teams in Deutschland. Ein medizinischer Notfall um den Kanadier schockt die österreichische Eishockey-Welt.,https://quadro.burda-forward.de/ctf/2b30c6a4-7492-49b2-8e7c-a42185936312.c260ebbc-f6f2-44a3-b553-f6d6ef1b5076.jpeg?im=RegionOfInterestCrop%3D%281200%2C630%29%2CregionOfInterest%3D%28914%2C350%29&hash=a9f4443c1235a30a2fe0805f9fc150f48d30d46645f612c2572d9724db8e593e,2026-03-10T21:47:00Z,,Eine Eishockey-Partie in Österreich ist von einem schwerwiegenden Zwischenfall überschattet worden. Bei der ICE-Viertelfinalpartie zwischen dem Rekordmeister KAC aus Klagenfurt und dem ungarischen Te… [+735 chars],,de,'Eis'
https://www.stern.de/gesellschaft/regional/baden-wuerttemberg/leicht-salzig--so-schmeckt-kamelmilch-eis-37210104.html,https://www.stern.de/gesellschaft/regional/baden-wuerttemberg/leicht-salzig--so-schmeckt-kamelmilch-eis-37210104.html,0,www.stern.de,Leicht salzig: So schmeckt Kamelmilch-Eis,Morbus Crohn brachte Eismacher Thomas Micolino zur Kamelmilch. Jetzt möchte der Deutsche Eis-Meister auch den WM-Titel mit der ungewöhnlichen Kreation.,https://image.stern.de/37210106/t/AW/v1/w1440/r1.7778/-/11--nybj2pmluwv9axs2048jpeg---64e5dc5a267af813.jpg,2026-03-11T03:00:42Z,,"Kopiere den aktuellen Link
Zur Merkliste hinzufügen
Morbus Crohn brachte Eismacher Thomas Micolino zur Kamelmilch. Jetzt möchte der Deutsche Eis-Meister auch den WM-Titel mit der ungewöhnlichen Kre… [+1077 chars]",,de,'Eis'
https://www.zeit.de/news/2026-03/11/so-schmeckt-kamelmilch-eis,https://www.zeit.de/news/2026-03/11/so-schmeckt-kamelmilch-eis,0,www.zeit.de,Leicht salzig: So schmeckt Kamelmilch-Eis,Hier finden Sie Informationen zu dem Thema „Leicht salzig“. Lesen Sie jetzt „So schmeckt Kamelmilch-Eis“.,https://img.zeit.de/news/2026-03/11/so-schmeckt-kamelmilch-eis-image-group/wide__1300x731,2026-03-11T03:00:42Z,,Mit Eis aus Kamelmilch möchte der Deutsche Meister Thomas Micolino auch bei der WM in Las Vegas überzeugen. Bei seinen Kunden ist die Sorte längst einer der Favoriten. Viele beschreiben die Kreation … [+910 chars],,de,'Eis'
https://www.stern.de/panorama/leicht-salzig--eis-aus-kamelmilch--deutscher-fliegt-zur-wm-in-die-usa-37210140.html,https://www.stern.de/panorama/leicht-salzig--eis-aus-kamelmilch--deutscher-fliegt-zur-wm-in-die-usa-37210140.html,0,www.stern.de,Leicht salzig: Eis aus Kamelmilch: Deutscher fliegt zur WM in die USA,Rottenburg am Neckar/Las Vegas - Beim Eismachen ist Thomas Micolino erfinderisch und scheut auch nicht vor ungewöhnlichen Zutaten zurück. Eine seiner,https://image.stern.de/37210142/t/20/v1/w1440/r1.7778/-/11--bcpkpfjktuv1axs2048jpeg---0e2c1ae8f24a4278.jpg,2026-03-11T03:00:43Z,,"Kopiere den aktuellen Link
Zur Merkliste hinzufügen
Morbus Crohn brachte Eismacher Thomas Micolino aus Baden-Württemberg zur Kamelmilch. Jetzt möchte der Deutsche Eis-Meister auch den nächsten Tite… [+1658 chars]",,de,'Eis'
https://www.zeit.de/news/2026-03/11/eis-aus-kamelmilch-deutscher-fliegt-zur-wm-in-die-usa,https://www.zeit.de/news/2026-03/11/eis-aus-kamelmilch-deutscher-fliegt-zur-wm-in-die-usa,0,www.zeit.de,Leicht salzig: Eis aus Kamelmilch: Deutscher fliegt zur WM in die USA,Hier finden Sie Informationen zu dem Thema „Leicht salzig“. Lesen Sie jetzt „Eis aus Kamelmilch: Deutscher fliegt zur WM in die USA“.,https://img.zeit.de/news/2026-03/11/eis-aus-kamelmilch-deutscher-fliegt-zur-wm-in-die-usa-image-group/wide__1300x731,2026-03-11T03:00:43Z,,"Beim Eismachen ist Thomas Micolino erfinderisch und scheut auch nicht vor ungewöhnlichen Zutaten zurück. Eine seiner erfolgreichsten Kreationen besteht aus Kamelmilch.
«Kamelatte» nennt er die Erfin… [+1495 chars]",,de,'Eis'
https://www.tagesspiegel.de/gesellschaft/panorama/leicht-salzig-eis-aus-kamelmilch-deutscher-fliegt-zur-wm-in-die-usa-15339774.html,https://www.tagesspiegel.de/gesellschaft/panorama/leicht-salzig-eis-aus-kamelmilch-deutscher-fliegt-zur-wm-in-die-usa-15339774.html,0,www.tagesspiegel.de,Leicht salzig: Eis aus Kamelmilch: Deutscher fliegt zur WM in die USA,Morbus Crohn brachte Eismacher Thomas Micolino aus Baden-Württemberg zur Kamelmilch. Jetzt möchte der Deutsche Eis-Meister auch den nächsten Titel.,https://www.tagesspiegel.de/images/15339772/alternates/BASE_16_9_W1400/1773198190000/kamelmilch-eis.jpeg,2026-03-11T03:03:10Z,,"Beim Eismachen ist Thomas Micolino erfinderisch und scheut auch nicht vor ungewöhnlichen Zutaten zurück. Eine seiner erfolgreichsten Kreationen besteht aus Kamelmilch.
Kamelatte nennt er die Erfindu… [+1543 chars]",,de,'Eis'
https://www.tagesschau.de/wirtschaft/konjunktur/inflation-krieg-100.html,https://www.tagesschau.de/wirtschaft/konjunktur/inflation-krieg-100.html,0,www.tagesschau.de,Wie stark heizt der Krieg die Inflation an?,"Wirtschaft und Verbraucher sind alarmiert, sie sorgen sich vor noch höheren Energiepreisen. Aber nicht nur die Kosten für Öl und Gas drohen aus dem Ruder zu laufen. Von Axel John.",https://images.tagesschau.de/image/e888ca36-d595-49bd-b066-6fde72d75236/AAABnCOYSzI/AAABmyZE0EA/16x9-big/einkauf-124.jpg?width=1280,2026-03-11T07:31:10Z,,"Stand: 11.03.2026 08:31 Uhr
Wirtschaft und Verbraucher sind alarmiert, sie sorgen sich vor noch höheren Energiepreisen. Droht eine Teuerung auf breiter Front?
Im Gutenberg Center in Mainz gibt es z… [+6669 chars]",,de,'Gas'
https://www.welt.de/politik/deutschland/video69b1359c52b77f377e19d156/gegen-einstufung-geklagt-verfassungsschutz-behandelt-afd-niedersachsen-vorerst-wieder-nur-als-verdachtsfall.html,https://www.welt.de/politik/deutschland/video69b1359c52b77f377e19d156/gegen-einstufung-geklagt-verfassungsschutz-behandelt-afd-niedersachsen-vorerst-wieder-nur-als-verdachtsfall.html,0,www.welt.de,Verfassungsschutz behandelt AfD Niedersachsen vorerst wieder nur als Verdachtsfall,"Die Hochstufung der AfD in Niedersachsen durch den Landesverfassungsschutz liegt nach einer Klage der Partei auf Eis. Vorerst werde der Landesverband weiter nur wie ein Verdachtsobjekt behandelt, teilte der Verfassungsschutz mit.",https://images.welt.de/69b1359c52b77f377e19d156/c1d8f9c531c1ae09713ccc4710df69d3-master/ci16x9-w1200/dpa-com-20090101-260310-935-1206793-jpg,2026-03-11T09:47:29Z,,"Die Hochstufung der AfD in Niedersachsen durch den Landesverfassungsschutz liegt nach einer Klage der Partei auf Eis. Vorerst werde der Landesverband weiter nur wie ein Verdachtsobjekt behandelt, tei… [+89 chars]",,de,'Eis'
https://www.morgenpost.de/berlin/article401495374/eisdiele-bestes-eis-berlin-fruehling-2026-test-ueberblick.html,https://www.morgenpost.de/berlin/article401495374/eisdiele-bestes-eis-berlin-fruehling-2026-test-ueberblick.html,0,www.morgenpost.de,Das beste Eis in Berlin: Die Top-Eisdielen der Hauptstadt im Überblick,Welche Orte bieten das ultimative Eis-Erlebnis in Berlin? Diese Eisdielen versüßen Ihnen den Frühling – und enttäuschen garantiert nicht.,https://img.sparknews.funkemedien.de/407124675/407124675_1724918707_v16_9_1600.jpeg,2026-03-11T10:04:17Z,,<ul><li>Der Frühling ist da und damit Zeit für leckere Erfrischungen</li><li>Wo gibt es in der Hauptstadt das beste Eis?</li><li>Wir haben die Adressen erstklassiger Eisdielen im Überblick</li></ul>E… [+4347 chars],,de,'Eis'
https://www.tagesspiegel.de/sport/winterspiele-zwischen-job-und-paralympics-athleten-kampfen-um-forderung-15341019.html,https://www.tagesspiegel.de/sport/winterspiele-zwischen-job-und-paralympics-athleten-kampfen-um-forderung-15341019.html,0,www.tagesspiegel.de,Winterspiele: Zwischen Job und Paralympics: Athleten kämpfen um Förderung,"Finanzielle Sicherheit oder ständiger Spagat? Deutsche Para-Sportler berichten, warum Förderstellen Gold wert sind – und wer trotz Vollzeitjobs um Medaillen kämpft.",https://www.tagesspiegel.de/images/15341018/alternates/BASE_16_9_W1400/1773223514000/paralympics-2026.jpeg,2026-03-11T10:05:14Z,,"Vollzeitprofis, Studierende, Beamte, Lehrer, Ärzte oder Sportsoldaten: Hinter den deutschen Teilnehmerinnen und Teilnehmern der Paralympischen Spiele in Italien stehen teils durchaus unterschiedliche… [+4681 chars]",,de,'Winter'
https://www.welt.de/regionales/hamburg/article69b13be9234864f234f04c95/klimadaten-ein-winter-voller-gegensaetze-in-nord-und-ostsee.html,https://www.welt.de/regionales/hamburg/article69b13be9234864f234f04c95/klimadaten-ein-winter-voller-gegensaetze-in-nord-und-ostsee.html,0,www.welt.de,Ein Winter voller Gegensätze in Nord- und Ostsee,"Der zurückliegende Winter zeigte extreme Schwankungen in Nord- und Ostsee: Rekordwärme im Dezember 2025, ein kalter Februar 2026 und ungewöhnlich viel Eis an der Ostseeküste. Trotz einzelner Kaltphasen lagen die Meerestemperaturen über dem langjährigen Durchs…",https://images.welt.de/69b13be9234864f234f04c95/f5f32327b0721f10650bca4b8ec0ed35-master/ci16x9-w1200/dpa-com-20090101-260218-911-025927-jpg,2026-03-11T10:11:37Z,,"Der zurückliegende Winter zeigte extreme Schwankungen in Nord- und Ostsee: Rekordwärme im Dezember 2025, ein kalter Februar 2026 und ungewöhnlich viel Eis an der Ostseeküste. Trotz einzelner Kaltphas… [+3630 chars]",,de,'Eis'
https://www.diepresse.com/20666306/am-eis-reanimiert-kac-spieler-jordan-murray-in-stabilem-zustand,https://www.diepresse.com/20666306/am-eis-reanimiert-kac-spieler-jordan-murray-in-stabilem-zustand,0,www.diepresse.com,Am Eis reanimiert: KAC-Spieler Jordan Murray in „stabilem Zustand“,Der Kanadier brach im Viertelfinalspiel der Klagenfurter plötzlich zusammen.,https://img.diepresse.com/public/incoming/5xc7ic-gepa-20251114-101-147-0006jpg/alternates/DPR_SOCIAL_NACHRICHTEN/GEPA-20251114-101-147-0006.jpg,2026-03-11T10:15:16Z,,"Der Kanadier brach im Viertelfinalspiel der Klagenfurter plötzlich zusammen. 
Der am Dienstag im ersten Viertelfinalspiel der ICE-Eishockey-Liga gegen Fehervar reanimierte KAC-Verteidiger Jordan Mur… [+1155 chars]",,de,'Eis'
https://www.zeit.de/2026/12/energiekrise-oel-gaspreise-strasse-von-hormus,https://www.zeit.de/2026/12/energiekrise-oel-gaspreise-strasse-von-hormus,0,www.zeit.de,"Energiekrise: Vorsicht, hochentzündlich!","Die Welt bezahlt für Donald Trumps Irankrieg mit steigenden Energiepreisen. Was Tankrabatt, Gaspreisbremse oder die Kontrolle der Ölkonzerne dagegen ausrichten können.",https://img.zeit.de/2026/12/vorsicht-hochentzuendlich-bild-3/wide__1300x731,2026-03-11T10:31:12Z,,"Plötzlich ist sie wieder da, die Energiekrise und schlägt sofort bei den Ärmsten zu: in Bangladesch, wo die Regierung nicht nur alle Universitäten geschlossen hat, um Energie zu sparen, sondern auch … [+540 chars]",,de,'Gas'
https://www.bild.de/news/inland/prozess-als-sie-kein-eis-mehr-bekamen-rasteten-die-drei-brueder-aus-69ae98d61e8a26d4a237a208,https://www.bild.de/news/inland/prozess-als-sie-kein-eis-mehr-bekamen-rasteten-die-drei-brueder-aus-69ae98d61e8a26d4a237a208,0,www.bild.de,"Wilder Prügelei - Als sie kein Eis bekamen, rasteten die Brüder aus","Hof (Bayern) – Erst zahlten sie nicht, dann drehren sie durch: Drei syrische Brüder üb...","https://images.bild.de/69ae98d61e8a26d4a237a208/4747492d1f4e0b55b66f3def3934e1ae,a55a6ad9?w=1280",2026-03-11T11:00:02Z,,"+++Wegen Iran-Krieg: Deutschland gibt Teil der Ölreserven frei
+++Wegen Iran-Krieg: Deutschland gibt Teil der Ölreserven frei
+++Wegen Iran-Krieg: Deutschland gibt Teil der Ölreserven frei
+++Wege… [+438 chars]",,de,'Eis'
https://www.sueddeutsche.de/muenchen/muenchen-eisdiele-ki-eisbrunnen-li.3442985,https://www.sueddeutsche.de/muenchen/muenchen-eisdiele-ki-eisbrunnen-li.3442985,0,www.sueddeutsche.de,"Gastronomie: Hier hilft die KI, Eis herzustellen",Lucy Allary setzt in ihrem jungen Unternehmen Eisbrunnen stark auf einen KI-Agent. Wobei ihr „Frosty“ hilft und warum sie sagt: Ohne ihn würde sie es nicht schaffen.,https://www.sueddeutsche.de/2026/03/05/479b3a56-55b5-474a-904c-0727fc98c83c.jpg?q=60&fm=webp&width=1200&rect=0%2C233%2C4000%2C2250,2026-03-11T12:28:05Z,,"Denn wäre sie nicht schwanger geworden und hätte sie nicht einen Weg finden müssen, Prozesse zu automatisieren, zu optimieren und sich selbst in gewisser Weise zu duplizieren  wer weiß, ob es die kün… [+7754 chars]",,de,'Eis'
https://www.tagesschau.de/inland/bundeswehr-mission-naher-oster-100.html,https://www.tagesschau.de/inland/bundeswehr-mission-naher-oster-100.html,0,www.tagesschau.de,Wie sich der Iran-Krieg auf die Bundeswehr in Nahost auswirkt,"Der Krieg im Nahen Osten hat auch Folgen für die Einsätze der Bundeswehr in der Region. Einzelne Aufgaben liegen auf Eis, Kontingente wurden verkleinert und Personal verlegt. Ein Überblick. Von Christina Nagel.",https://images.tagesschau.de/image/ef305fb6-2a49-41f8-a1e2-6b79dc0fbef7/AAABnNvSLLI/AAABmyZE0EA/16x9-big/bundeswehr-al-asrak-100.jpg?width=1280,2026-03-11T13:17:47Z,,"Stand: 11.03.2026 14:17 Uhr
Der Krieg im Nahen Osten hat auch Folgen für die Einsätze der Bundeswehr in der Region. Einzelne Aufgaben liegen auf Eis, Kontingente wurden verkleinert und Personal verl… [+3160 chars]",,de,'Eis'
https://www.zeit.de/news/2026-03/12/flanieren-und-geniessen-mandelbluetenfest-lockt-in-die-pfalz,https://www.zeit.de/news/2026-03/12/flanieren-und-geniessen-mandelbluetenfest-lockt-in-die-pfalz,0,www.zeit.de,Natur erwacht nach dem Winter: Flanieren und genießen – Mandelblütenfest lockt in die Pfalz,Hier finden Sie Informationen zu dem Thema „Natur erwacht nach dem Winter“. Lesen Sie jetzt „Flanieren und genießen – Mandelblütenfest lockt in die Pfalz“.,https://img.zeit.de/news/2026-03/12/flanieren-und-geniessen-mandelbluetenfest-lockt-in-die-pfalz-image-group/wide__1300x731,2026-03-12T05:00:07Z,,"Freitag, der 13. März 2026 für manche ein Unglückstag, für Gimmeldingen ein Glückstag. Dann beginnt in dem pfälzischen Ort das erste von zwei Wochenenden des überregional beliebten Mandelblütenfestes… [+1190 chars]",,de,'Winter'
https://www.bild.de/sport/fussball/jetzt-hier-reif-ist-live-gucken-bayern-bestien-und-eberl-vertrag-69b2263338797877ddaa0195,https://www.bild.de/sport/fussball/jetzt-hier-reif-ist-live-gucken-bayern-bestien-und-eberl-vertrag-69b2263338797877ddaa0195,0,www.bild.de,Reif ist Live vom 12.03.26 - Bayern-Bestien und Eberl-Vertrag,Eine neue Folge „Reif ist live“ mit Kommentatoren-Legende Marcel Reif und Moderator Filip Thiel.,"https://images.bild.de/69b2263338797877ddaa0195/b1ff6d959f494aece14ed2fdcd130dd6-landscape,cbb552b7?w=1280",2026-03-12T10:58:23Z,,"+++Straße von Hormus: Feuer auf Schiff von Hapag-Lloyd 
+++Straße von Hormus: Feuer auf Schiff von Hapag-Lloyd 
+++Straße von Hormus: Feuer auf Schiff von Hapag-Lloyd 
+++Straße von Hormus: Feuer … [+367 chars]",,de,'Reif'
https://www.zeit.de/news/2026-03/12/trotz-schneemengen-sind-niedersachsens-boeden-weiter-durstig,https://www.zeit.de/news/2026-03/12/trotz-schneemengen-sind-niedersachsens-boeden-weiter-durstig,0,www.zeit.de,Bodenfeuchte: Trotz Schneemengen sind Niedersachsens Böden weiter durstig,Hier finden Sie Informationen zu dem Thema „Bodenfeuchte“. Lesen Sie jetzt „Trotz Schneemengen sind Niedersachsens Böden weiter durstig“.,https://img.zeit.de/news/2026-03/12/trotz-schneemengen-sind-niedersachsens-boeden-weiter-durstig-image-group/wide__1300x731,2026-03-12T11:05:14Z,,Trotz einiger Pfützen auf Äckern und Straßen nach dem eher schneereichen Winter sind die Böden in Niedersachsen vielerorts zurzeit nur mäßig feucht. Das könnte Folgen für die Neubildung des Grundwass… [+2264 chars],,de,'Schnee'
https://www.bild.de/sport/fussball/boah-bayern-hat-kompany-eine-bestie-erschaffen-69b287bf38797877ddaa067a,https://www.bild.de/sport/fussball/boah-bayern-hat-kompany-eine-bestie-erschaffen-69b287bf38797877ddaa067a,0,www.bild.de,"Boah, Bayern! - Hat Kompany eine Bestie erschaffen?",Die Bayern zermalmen Atalanta Bergamo mit 6:1. In „Reif ist live“ wird eine provokante Reporter-Frage diskutiert.,"https://images.bild.de/69b287bf38797877ddaa067a/4b9a0996ee1e61626bcec2459c170d92-landscape,37fc6928?w=1280",2026-03-12T11:05:43Z,,"+++Straße von Hormus: Feuer auf Schiff von Hapag-Lloyd 
+++Straße von Hormus: Feuer auf Schiff von Hapag-Lloyd 
+++Straße von Hormus: Feuer auf Schiff von Hapag-Lloyd 
+++Straße von Hormus: Feuer … [+367 chars]",,de,'Reif'
https://www.bild.de/sport/fussball/koennen-diese-rehaugen-luegen-hitzige-diskussion-um-kimmich-aussage-69b27fbaedb67419c43bd2fa,https://www.bild.de/sport/fussball/koennen-diese-rehaugen-luegen-hitzige-diskussion-um-kimmich-aussage-69b27fbaedb67419c43bd2fa,0,www.bild.de,„Können diese Rehaugen lügen?“ - Hitzige Studio-Diskussion um Kimmich-Aussage,Hat Joshua Kimmich seine Gelbe Karte provoziert? Seine Aussage nach dem Spiel wird in „Reif ist live“ diskutiert.,"https://images.bild.de/69b27fbaedb67419c43bd2fa/6f60aced6da20624e1d3c308c1400bf5-landscape,2a578508?w=1280",2026-03-12T11:06:01Z,,"+++Straße von Hormus: Feuer auf Schiff von Hapag-Lloyd 
+++Straße von Hormus: Feuer auf Schiff von Hapag-Lloyd 
+++Straße von Hormus: Feuer auf Schiff von Hapag-Lloyd 
+++Straße von Hormus: Feuer … [+367 chars]",,de,'Reif'
https://www.bild.de/sport/fussball/pikante-interne-aussagen-wird-ein-alter-hoeness-vorwurf-fuer-eberl-zum-bumerang-69b27fdcedb67419c43bd304,https://www.bild.de/sport/fussball/pikante-interne-aussagen-wird-ein-alter-hoeness-vorwurf-fuer-eberl-zum-bumerang-69b27fdcedb67419c43bd304,0,www.bild.de,"Pikante, interne Aussagen - Wird ein alter Hoeneß-Vorwurf für Eberl zum Bumerang?",Bleibt Max Eberl bei den Bayern? In „Reif ist live“ wird über seine Zukunft diskutiert.,"https://images.bild.de/69b27fdcedb67419c43bd304/652022a85b630d81e5201ad10df9366a-landscape,1e3a55f5?w=1280",2026-03-12T11:06:21Z,,"+++Straße von Hormus: Feuer auf Schiff von Hapag-Lloyd 
+++Straße von Hormus: Feuer auf Schiff von Hapag-Lloyd 
+++Straße von Hormus: Feuer auf Schiff von Hapag-Lloyd 
+++Straße von Hormus: Feuer … [+367 chars]",,de,'Reif'
https://www.bild.de/sport/fussball/seltsame-pk-nach-real-klatsche-guardiola-ist-der-schlechteste-verlierer-unter-der-sonne-69b2810aedb67419c43bd319,https://www.bild.de/sport/fussball/seltsame-pk-nach-real-klatsche-guardiola-ist-der-schlechteste-verlierer-unter-der-sonne-69b2810aedb67419c43bd319,0,www.bild.de,Seltsame PK nach Real-Klatsche - „Guardiola ist der schlechteste Verlierer unter der Sonne“,Manchester City geht bei Real Madrid unter. In „Reif ist live“ wird die seltsame PK nach dem 0:3 bei Real Madrid besprochen.,"https://images.bild.de/69b2810aedb67419c43bd319/751f1b9f9551467f105d201f20d78d26-landscape,9969db08?w=1280",2026-03-12T11:06:40Z,,"+++Straße von Hormus: Feuer auf Schiff von Hapag-Lloyd 
+++Straße von Hormus: Feuer auf Schiff von Hapag-Lloyd 
+++Straße von Hormus: Feuer auf Schiff von Hapag-Lloyd 
+++Straße von Hormus: Feuer … [+367 chars]",,de,'Reif'
https://www.bild.de/sport/fussball/tottenham-trainer-demuetigt-eigenen-torwart-ekelhaft-menschlich-erbaermlich-69b28137edb67419c43bd323,https://www.bild.de/sport/fussball/tottenham-trainer-demuetigt-eigenen-torwart-ekelhaft-menschlich-erbaermlich-69b28137edb67419c43bd323,0,www.bild.de,Tottenham-Trainer demütigt eigenen Torwart - „Ekelhaft! Menschlich erbärmlich!“,Tottenham-Torwart Antonin Kinsky wird nach 16 Minuten ausgewechselt. Marcel Reif findet in „Reif ist live“ äußert klare Worte.,"https://images.bild.de/69b28137edb67419c43bd323/abfc5a114cb22fc5f3ea47bf12d2b0db-landscape,a843cba0?w=1280",2026-03-12T11:06:59Z,,"+++Straße von Hormus: Feuer auf Schiff von Hapag-Lloyd 
+++Straße von Hormus: Feuer auf Schiff von Hapag-Lloyd 
+++Straße von Hormus: Feuer auf Schiff von Hapag-Lloyd 
+++Straße von Hormus: Feuer … [+367 chars]",,de,'Reif'
