index,url,valid,domain,title,description,image,published,archive,content,quote,language,keyword
https://www.zeit.de/news/2025-12/01/mildes-wetter-zum-meteorologischen-winteranfang,https://www.zeit.de/news/2025-12/01/mildes-wetter-zum-meteorologischen-winteranfang,0,www.zeit.de,Wetter: Mildes Wetter zum meteorologischen Winteranfang,Hier finden Sie Informationen zu dem Thema „Wetter“. Lesen Sie jetzt „Mildes Wetter zum meteorologischen Winteranfang“.,https://img.zeit.de/news/2025-12/01/mildes-wetter-zum-meteorologischen-winteranfang-image-group/wide__1300x731,2025-12-01T03:57:24Z,,"Am 1. Dezember beginnt für Meteorologen der Winter - der zeigt sich zum Wochenbeginn aber erstmal eher von seiner milden Seite. Im Süden und Südosten werde vereinzelt trübes Wetter erwartet, ansonste… [+645 chars]",,de,'Winter'
https://www.zeit.de/news/2025-12/01/frost-und-nebel-zum-wochenstart-in-hessen,https://www.zeit.de/news/2025-12/01/frost-und-nebel-zum-wochenstart-in-hessen,0,www.zeit.de,Wetterprognose: Frost und Nebel zum Wochenstart in Hessen,Hier finden Sie Informationen zu dem Thema „Wetterprognose“. Lesen Sie jetzt „Frost und Nebel zum Wochenstart in Hessen“.,https://img.zeit.de/news/2025-12/01/frost-und-nebel-zum-wochenstart-in-hessen-image-group/wide__1300x731,2025-12-01T04:40:16Z,,"In Hessen startet die neue Woche mit leichtem Frost. Wie der Deutsche Wetterdienst (DWD) berichtet, kann es örtlich durch überfrierende Nässe oder Reif glatt werden. In einzelnen Tälern bildet sich a… [+1243 chars]",,de,'Frost'
https://www.stern.de/gesellschaft/regional/hessen/wetterprognose--frost-und-nebel-zum-wochenstart-in-hessen-36914080.html,https://www.stern.de/gesellschaft/regional/hessen/wetterprognose--frost-und-nebel-zum-wochenstart-in-hessen-36914080.html,0,www.stern.de,Wetterprognose: Frost und Nebel zum Wochenstart in Hessen,"Offenbach (lhe) - In Hessen startet die neue Woche mit leichtem Frost. Wie der Deutsche Wetterdienst (DWD) berichtet, kann es örtlich durch überfrierende",https://image.stern.de/36914082/t/dI/v1/w1440/r1.7778/-/01--6bysrnebiev8axs2048jpeg---649bf6bf566f508a.jpg,2025-12-01T04:40:16Z,,"Kopiere den aktuellen Link
Zur Merkliste hinzufügen
In Hessen beginnt die Woche kalt und teils neblig. Besonders in Hochlagen ist Vorsicht wegen Glätte geboten.
In Hessen startet die neue Woche mi… [+1367 chars]",,de,'Reif'
https://www.zeit.de/news/2025-12/01/kalter-wochenstart-mit-frost-und-glaettegefahr-in-nrw,https://www.zeit.de/news/2025-12/01/kalter-wochenstart-mit-frost-und-glaettegefahr-in-nrw,0,www.zeit.de,Wettervorhersage: Kalter Wochenstart mit Frost und Glättegefahr in NRW,Hier finden Sie Informationen zu dem Thema „Wettervorhersage“. Lesen Sie jetzt „Kalter Wochenstart mit Frost und Glättegefahr in NRW“.,https://img.zeit.de/news/2025-12/01/kalter-wochenstart-mit-frost-und-glaettegefahr-in-nrw-image-group/wide__1300x731,2025-12-01T04:55:48Z,,"In Nordrhein-Westfalen beginnt die neue Woche mit leichtem Frost. Autofahrer und Fußgänger sollten vorsichtig sein, da örtlich Glätte durch überfrierende Nässe oder Reif auftreten kann. Am Montag ble… [+805 chars]",,de,'Frost'
https://www.stern.de/gesellschaft/regional/nordrhein-westfalen/wettervorhersage--kalter-wochenstart-mit-frost-und-glaettegefahr-in-nrw-36914100.html,https://www.stern.de/gesellschaft/regional/nordrhein-westfalen/wettervorhersage--kalter-wochenstart-mit-frost-und-glaettegefahr-in-nrw-36914100.html,0,www.stern.de,Wettervorhersage: Kalter Wochenstart mit Frost und Glättegefahr in NRW,"In Nordrhein-Westfalen beginnt die neue Woche mit kühlen Temperaturen, verbreitet leichtem Frost und örtlicher Glätte auf den Straßen. In Tälern kann sich stellenweise dichter Nebel bilden.",https://image.stern.de/36914102/t/CP/v1/w1440/r1.7778/-/01--jnvefztltev5axs2048jpeg---3718026a2445f408.jpg,2025-12-01T04:55:48Z,,"Kopiere den aktuellen Link
Zur Merkliste hinzufügen
In Nordrhein-Westfalen beginnt die neue Woche mit kühlen Temperaturen, verbreitet leichtem Frost und örtlicher Glätte auf den Straßen. In Tälern … [+1010 chars]",,de,'Frost'
https://www.welt.de/reise/article6920542eb524e0ce7f1c3d0e/winter-outdoor-im-norden-von-finnland-auf-dicken-reifen-durch-dicken-schnee-mit-dem-fatbike-am-polarkreis.html,https://www.welt.de/reise/article6920542eb524e0ce7f1c3d0e/winter-outdoor-im-norden-von-finnland-auf-dicken-reifen-durch-dicken-schnee-mit-dem-fatbike-am-polarkreis.html,0,www.welt.de,Tower AB+Auf dicken Reifen durch dicken Schnee – mit dem Fatbike am Polarkreis,Jetzt wird geradelt statt gewedelt: Fatbiking als Wintersport ist eine spannende Alternative zum klassischen Skiurlaub. Unser Autor machte den Test in der finnischen Taiga auf grobem Profil – bei klirrender Kälte.,https://images.welt.de/6920542eb524e0ce7f1c3d0e/0f982450275cbfd298299cc913ee9107/ci16x9-w1200/ruka-kuusamo-winterbiking-rukasafaris-jan22-harritarvainen00028-jpg,2025-12-01T08:50:26Z,,Jetzt wird geradelt statt gewedelt: Fatbiking als Wintersport ist eine spannende Alternative zum klassischen Skiurlaub. Unser Autor machte den Test in der finnischen Taiga auf grobem Profil bei klirr… [+9281 chars],,de,'Kälte'
https://www.focus.de/kultur/stars/tv-star-enthuellt-heiz-trick-so-spart-sie-im-winter-richtig-geld_634d5954-6fc1-4ab6-a869-25976cd96a9b.html,https://www.focus.de/kultur/stars/tv-star-enthuellt-heiz-trick-so-spart-sie-im-winter-richtig-geld_634d5954-6fc1-4ab6-a869-25976cd96a9b.html,0,www.focus.de,TV-Star enthüllt Heiz-Trick: So spart sie im Winter richtig Geld,"Wenn andere frieren, hat Hanka Rackwitz die Lösung: Mit einem Heiz-Zelt hält sie ihr Schloss warm – und spart dabei jede Menge Geld.",https://quadro.burda-forward.de/ctf/d8979d61-a3ea-45f3-8f31-9a203a8845f7.176e7ee0-a8e5-4f98-b871-5079867661de.jpg?im=RegionOfInterestCrop%3D%281200%2C630%29%2CregionOfInterest%3D%281136%2C638%29&hash=14901e903040610a33af98907666e2d3ce860a63cd4425229dfb36f33dbb93a2,2025-12-01T14:48:35Z,,"Hohe Heizkosten machen vielen Menschen zu schaffen selbst Promis bleiben davon nicht verschont. Hanka Rackwitz (56), bekannt aus dem ""Sommerhaus der Stars"", das sie freiwillig verließ, und dem ""Dschu… [+2154 chars]",,de,'Heizen'
https://www.zeit.de/news/2025-12/02/frostige-naechte-warnung-vor-glaette-und-nebel-in-hessen,https://www.zeit.de/news/2025-12/02/frostige-naechte-warnung-vor-glaette-und-nebel-in-hessen,0,www.zeit.de,Wetterprognose: Frostige Nächte – Warnung vor Glätte und Nebel in Hessen,Hier finden Sie Informationen zu dem Thema „Wetterprognose“. Lesen Sie jetzt „Frostige Nächte – Warnung vor Glätte und Nebel in Hessen“.,https://img.zeit.de/news/2025-12/02/frostige-naechte-warnung-vor-glaette-und-nebel-in-hessen-image-group/wide__1300x731,2025-12-02T07:01:44Z,,"Nach einer vielerorts frostigen Nacht kann im Westen von Hessen vereinzelt etwas Regen fallen. Im Osten des Bundeslandes bleibt es trocken, wie der Deutsche Wetterdienst (DWD) mitteilte. Die Temperat… [+862 chars]",,de,'Frost'
https://www.zeit.de/news/2025-12/03/eu-einig-ueber-komplettverzicht-auf-gas-aus-russland,https://www.zeit.de/news/2025-12/03/eu-einig-ueber-komplettverzicht-auf-gas-aus-russland,0,www.zeit.de,Energie: EU einig über Komplettverzicht auf Gas aus Russland,Hier finden Sie Informationen zu dem Thema „Energie“. Lesen Sie jetzt „EU einig über Komplettverzicht auf Gas aus Russland“.,https://img.zeit.de/administratives/sharing/fallback-image-die-zeit/wide__1300x731,2025-12-03T01:07:39Z,,Die EU will bis spätestens Ende 2027 vollkommen unabhängig von Erdgas aus Russland sein und jegliche Importe stoppen. Das sieht eine in Brüssel erzielte Einigung zwischen Vertretern der Regierungen d… [+86 chars],,de,'Gas'
https://www.welt.de/wirtschaft/article692f8e2c34f148f9c6046039/bis-2027-eu-beschliesst-komplettverzicht-auf-gas-aus-russland.html,https://www.welt.de/wirtschaft/article692f8e2c34f148f9c6046039/bis-2027-eu-beschliesst-komplettverzicht-auf-gas-aus-russland.html,0,www.welt.de,EU beschließt Komplettverzicht auf Gas aus Russland,Die Europäische Union zeigt ungewohnte Einigkeit. Bis 2027 beabsichtigt die EU den Gashahn aus Russland komplett abzudrehen. Für Ungarn und die Slowakei soll es einen speziellen Ausstiegsplan geben.,https://images.welt.de/692f8e2c34f148f9c6046039/9dce4e9f710d668f62ac3391bdd7c8f1-master/ci16x9-w1200/dpa-com-20090101-251023-935-909354-jpg,2025-12-03T01:49:05Z,,Die Europäische Union zeigt ungewohnte Einigkeit. Bis 2027 beabsichtigt die EU den Gashahn aus Russland komplett abzudrehen. Für Ungarn und die Slowakei soll es einen speziellen Ausstiegsplan geben.D… [+3912 chars],,de,'Gas'
https://www.faz.net/aktuell/wirtschaft/mehr-wirtschaft/eu-ende-aller-gasimporte-aus-russland-beschlossen-accg-200319557.html,https://www.faz.net/aktuell/wirtschaft/mehr-wirtschaft/eu-ende-aller-gasimporte-aus-russland-beschlossen-accg-200319557.html,0,www.faz.net,Einigung in Brüssel: EU will Gasimporte aus Russland komplett einstellen,Putin wird der lukrative Gashahn zugedreht: Bis Ende 2027 wollen alle EU-Staaten den Kauf von russischem Erdgas oder LNG beenden – und zwar dauerhaft. Die Gaspreise für Verbraucher soll das kaum ändern.,https://media0.faz.net/image/w1200h627/4f419cf3ca45/w3000h1567x0y216o/202510/43601.0.1392588357/in-sassnitz-mukran-in.webp,2025-12-03T01:53:22Z,,"Die EU will bis spätestens Ende 2027 vollkommen unabhängig von russischem Erdgas sein. Das sieht eine Einigung zwischen Vertretern der Regierungen der Mitgliedstaaten und des Europaparlaments vor, di… [+3476 chars]",,de,'Gas'
https://www.zeit.de/politik/ausland/2025-12/russland-eu-ukraine-krieg-gasimporte-ende-2027,https://www.zeit.de/politik/ausland/2025-12/russland-eu-ukraine-krieg-gasimporte-ende-2027,0,www.zeit.de,Krieg in der Ukraine: EU einigt sich auf Komplettverzicht von Gas aus Russland,Ab Ende 2027 will die Europäische Union keine russischen Gasimporte mehr beziehen. Die Einigung zwischen Mitgliedstaaten und Parlament s0ll dauerhaft bindend sein.,https://img.zeit.de/politik/ausland/2025-12/gas-rohoelverarbeitung-importe-russland/wide__1300x731,2025-12-03T02:20:26Z,,Die Europäische Union hat sich auf einen früheren Komplettverzicht auf russisches Gas geeinigt. Laut der Übereinkunft soll die Einfuhr von russischem Gas über Pipelines auf Grundlage von langfristige… [+3566 chars],,de,'Gas'
https://www.zeit.de/news/2025-12/03/heizen-ist-teurer-geworden-mal-wieder,https://www.zeit.de/news/2025-12/03/heizen-ist-teurer-geworden-mal-wieder,0,www.zeit.de,"Öl, Gas und Fernwärme: Heizen ist teurer geworden - mal wieder","Hier finden Sie Informationen zu dem Thema „Öl, Gas und Fernwärme“. Lesen Sie jetzt „Heizen ist teurer geworden - mal wieder“.",https://img.zeit.de/news/2025-12/03/heizen-ist-teurer-geworden-mal-wieder-image-group/wide__1300x731,2025-12-03T04:15:06Z,,"Die Heizkosten sind in Deutschland einer Studie zufolge zwar gestiegen, es geht aber längst nicht mehr so steil nach oben wie früher. Wie aus dem Wärmemonitor des Deutschen Instituts für Wirtschaftsf… [+4268 chars]",,de,'Gas'
https://www.welt.de/politik/ausland/video692fc83b34f148f9c6046193/bis-2027-eu-beschliesst-komplettverzicht-auf-gas-aus-russland.html,https://www.welt.de/politik/ausland/video692fc83b34f148f9c6046193/bis-2027-eu-beschliesst-komplettverzicht-auf-gas-aus-russland.html,0,www.welt.de,EU beschließt Komplettverzicht auf Gas aus Russland,"Die EU will bis spätestens Ende 2027 vollkommen unabhängig von russischem Erdgas sein. Das sieht eine Einigung zwischen Vertretern der Regierungen der Mitgliedstaaten und des Europaparlaments vor, die vor dem Hintergrund des Ukraine-Kriegs erzielt wurde.",https://images.welt.de/692fc83b34f148f9c6046193/33e83952ab3860f2590230aa2643a617-master/ci16x9-w1200/dpa-com-20090101-251023-935-909354-jpg,2025-12-03T05:22:11Z,,"Die EU will bis spätestens Ende 2027 vollkommen unabhängig von russischem Erdgas sein. Das sieht eine Einigung zwischen Vertretern der Regierungen der Mitgliedstaaten und des Europaparlaments vor, di… [+114 chars]",,de,'Gas'
https://www.zeit.de/news/2025-12/03/kretschmer-eu-beschluss-zu-russischem-gas-fehlentscheidung,https://www.zeit.de/news/2025-12/03/kretschmer-eu-beschluss-zu-russischem-gas-fehlentscheidung,0,www.zeit.de,Energie: Kretschmer: EU-Beschluss zu russischem Gas Fehlentscheidung,Hier finden Sie Informationen zu dem Thema „Energie“. Lesen Sie jetzt „Kretschmer: EU-Beschluss zu russischem Gas Fehlentscheidung“.,https://img.zeit.de/news/2025-12/03/kretschmer-eu-beschluss-zu-russischem-gas-fehlentscheidung-image-group/wide__1300x731,2025-12-03T13:55:54Z,,"Sachsens Regierungschef Michael Kretschmer (CDU) hält den Beschluss der EU zum kompletten Verzicht auf russisches Erdgas für unverständlich. Er halte das für eine Fehlentscheidung, sagte er der Deuts… [+1775 chars]",,de,'Gas'
https://www.stern.de/auto/diese-fuenf-autos-unter-15-000-euro-sind-optimal-fuer-den-winter-36159076.html,https://www.stern.de/auto/diese-fuenf-autos-unter-15-000-euro-sind-optimal-fuer-den-winter-36159076.html,0,www.stern.de,"Ratgeber: Fünf Autos unter 15.000 Euro, die sich perfekt für den Winter eignen","Die kühlen Herbststürme sind durch und der erste Schnee der Saison ist gefallen. Wohl dem, der einen wintertauglichen Wagen hat, der einem das Wetter nicht übelnimmt.",https://image.stern.de/36159094/t/dJ/v3/w1440/r1.7778/-/range-rover-evoque-1.jpg,2025-12-03T16:27:00Z,,"Kopiere den aktuellen Link
Zur Merkliste hinzufügen
Die kühlen Herbststürme sind durch und der erste Schnee der Saison ist gefallen. Wohl dem, der einen wintertauglichen Wagen hat, der einem das We… [+679 chars]",,de,'Kälte'
https://www.brigitte.de/beauty/haut/3-wirkstoffe--auf-die-du-bei-der-koerperpflege-im-winter-setzen-solltest-14048958.html,https://www.brigitte.de/beauty/haut/3-wirkstoffe--auf-die-du-bei-der-koerperpflege-im-winter-setzen-solltest-14048958.html,0,www.brigitte.de,"Körperpflege im Winter: Auf diese Inhaltsstoffe solltest du achten, um deine Haut zu schützen",Mit dem Beginn der Winterzeit werden die Sommerklamotten eingemottet und die warmen Klamotten hervorgeholt. Wir müssen uns vor der Kälte schützen und darum gibt es keinen Grund bei der Körperpflege aufzuhören. Drei Inhaltsstoffe sollten jetzt für eine geeigne…,https://image.brigitte.de/14048960/t/aW/v2/w1440/r1.7778/-/drei-wirkstoffe-fuer-den-winter-teaser.jpg,2025-12-03T20:00:00Z,,"Frieren wir, ziehen wir uns einen dicken Pullover an. Juckt die Haut, cremen wir zwar häufiger, aber in den seltensten Fällen wird sich mit Inhaltsstoffen von Cremes auseinandergesetzt. Sollten wir a… [+2327 chars]",,de,'Winter'
https://ooe.orf.at/stories/3332686/,https://ooe.orf.at/stories/3332686/,0,ooe.orf.at,Sinn des Vogelfütterns im Winter,"Obwohl in großen Teilen Oberösterreichs noch kein Schnee liegt: Viele Menschen füttern bereits die Vögel. Ob Eingriff in die Natur oder notwendig für das Überleben – da gehen die Meinungen auseinander. Das Nahrungsangebot für Amsel, Meise oder Spatz ist in ma…",https://ibs.orf.at/ooe?image=https%3A%2F%2Foekastatic.orf.at%2Fmims%2F2025%2F49%2F36%2Fcrops%2Fw%3D1200%2Ch%3D627%2Cq%3D75%2F2855843_master_1102836_251203_ooeh_sinn_und_unsinn_des_vogelfuetterns_00_00_43_22.jpg%3Fs%3Dae72e09e0106ec0bb708025d4d107b913dca5124,2025-12-04T05:07:08Z,,"Wenn Insekten oder Kleinlebewesen wie Schnecken um diese Jahreszeit nicht mehr zu finden sind, kommen viele Naturliebhaber ins Spiel: Futterhäuschen und Säulen werden aufgehängt, um den Vögeln bei de… [+1834 chars]",,de,'Schnee'
https://tirol.orf.at/stories/3332702/,https://tirol.orf.at/stories/3332702/,0,tirol.orf.at,Hitze und Kälte fördern Vorhofflimmern,"Vorhofflimmern, die häufigste anhaltende Herzrhythmusstörung beim Menschen, wird offenbar durch extreme Temperaturen beeinflusst: Forscher der Medizinischen Universität Innsbruck zeigten in einer Studie, dass Episoden von Vorhofflimmern bei Kälte häufiger auf…",https://ibs.orf.at/tir?image=https%3A%2F%2Foekastatic.orf.at%2Fmims%2F2025%2F49%2F11%2Fcrops%2Fw%3D1200%2Ch%3D627%2Cq%3D75%2F2856072_master_1102911_tiroler_studie_extreme_temperaturen_verstaerken_vorhofflimmern_.jpg%3Fs%3D3bb2a159c346686d1a90bd32c6cbda2cfdd92d06,2025-12-04T06:15:42Z,,"203 Patienten mit Herzschrittmacher wurden telemedizinisch überwacht und lieferten die Daten, erklärte Kardiologe und Studienleiter Wolfgang Dichtl im APA-Gespräch. Was bei unseren Daten wirklich her… [+5030 chars]",,de,'Kälte'
https://www.zeit.de/news/2025-12/04/frost-nebel-und-schnee-ungemuetliche-naechte-in-sachsen,https://www.zeit.de/news/2025-12/04/frost-nebel-und-schnee-ungemuetliche-naechte-in-sachsen,0,www.zeit.de,"Wetter: Frost, Nebel und Schnee - ungemütliche Nächte in Sachsen","Hier finden Sie Informationen zu dem Thema „Wetter“. Lesen Sie jetzt „Frost, Nebel und Schnee - ungemütliche Nächte in Sachsen“.",https://img.zeit.de/news/2025-12/04/frost-nebel-und-schnee-ungemuetliche-naechte-in-sachsen-image-group/wide__1300x731,2025-12-04T07:00:53Z,,"In Sachsen wird es in der Nacht zum Freitag frostig und neblig. Wie der Deutsche Wetterdienst (DWD) mitteilte, kommt es in der ersten Nachthälfte zu Nebel mit Sichtweiten unter 150 Metern. Gebietswei… [+900 chars]",,de,'Schnee'
https://www.zeit.de/news/2025-12/04/dwd-erwartet-schnee-und-glaette-in-thueringen,https://www.zeit.de/news/2025-12/04/dwd-erwartet-schnee-und-glaette-in-thueringen,0,www.zeit.de,Wetter: DWD erwartet Schnee und Glätte in Thüringen,Hier finden Sie Informationen zu dem Thema „Wetter“. Lesen Sie jetzt „DWD erwartet Schnee und Glätte in Thüringen“.,https://img.zeit.de/news/2025-12/04/dwd-erwartet-schnee-und-glaette-in-thueringen-image-group/wide__1300x731,2025-12-04T08:05:17Z,,Der Donnerstag startet mit frostigen Temperaturen und Nebel in Thüringen. Bei Höchstwerten um den Gefrierpunkt bis maximal vier Grad im Altenburger Land kann es im späteren Tagesverlauf und bis in di… [+454 chars],,de,'Schnee'
https://www.stern.de/gesellschaft/regional/thueringen/wetter--dwd-erwartet-schnee-und-glaette-in-thueringen-36926774.html,https://www.stern.de/gesellschaft/regional/thueringen/wetter--dwd-erwartet-schnee-und-glaette-in-thueringen-36926774.html,0,www.stern.de,Wetter: DWD erwartet Schnee und Glätte in Thüringen,Erfurt/Offenbach (th) - Der Donnerstag startet mit frostigen Temperaturen und Nebel in Thüringen. Bei Höchstwerten um den Gefrierpunkt bis maximal vier,https://image.stern.de/36926776/t/hv/v1/w1440/r1.7778/-/04--mygfkhxzs4v7axs2048jpeg---175796d76270c6ef.jpg,2025-12-04T08:05:17Z,,"Kopiere den aktuellen Link
Zur Merkliste hinzufügen
Frost, Nebel und bis zu drei Zentimeter Neuschnee: In Thüringen kann es glatt werden besonders in höheren Lagen und zum Start ins Wochenende.
De… [+611 chars]",,de,'Schnee'
https://www.bild.de/news/wetter/wetterexperten-warnen-frost-nebel-glaette-jetzt-wirds-rutschig-69312c5d11f914c89b8523e6,https://www.bild.de/news/wetter/wetterexperten-warnen-frost-nebel-glaette-jetzt-wirds-rutschig-69312c5d11f914c89b8523e6,0,www.bild.de,"Wetterdienst warnt - Frost, Nebel, Glätte! Jetzt wird’s richtig rutschig",Frostiger Start in den Tag: Im Süden und Osten kann es auch noch einmal glatt auf den Straßen werden.,"https://images.bild.de/69312c5d11f914c89b8523e6/edf0ff77da3229dfbaa9368c28942db7,c8a6a828?w=1280",2025-12-04T09:21:24Z,,Frostiger Start in den Tag: Im Süden und Osten Deutschlands kann es heute erneut glatt auf den Straßen werden. Der Deutsche Wetterdienst (DWD) warnt wegen erwarteter Frosttemperaturen vor örtlicher G… [+1561 chars],,de,'Frost'
https://www.stern.de/lifestyle/leute/witziger-oder-peinlicher-prinz-harry---royal-zu-gast-bei-stephen-colbert-late-show-36927416.html,https://www.stern.de/lifestyle/leute/witziger-oder-peinlicher-prinz-harry---royal-zu-gast-bei-stephen-colbert-late-show-36927416.html,0,www.stern.de,Witziger oder peinlicher Prinz Harry?: Royal zu Gast bei Stephen Colbert Late-Show,Prinz Harry überraschte bei Stephen Colbert - und nahm dabei Donald Trump und die amerikanische Begeisterung für Royals aufs Korn.,https://image.stern.de/36927420/t/i5/v1/w1440/r1.7778/-/04--royal-zu-gast-bei-stephen-colbert-late-show---16-9---spoton-article-1124444.jpg,2025-12-04T10:08:00Z,,"Kopiere den aktuellen Link
Zur Merkliste hinzufügen
Prinz Harry überraschte bei Stephen Colbert - und nahm dabei Donald Trump und die amerikanische Begeisterung für Royals aufs Korn.
Prinz Harry (… [+2106 chars]",,de,'Gas'
https://www.stern.de/panorama/wetter--der-fruehwinter-schaltet-auf--herbstprogramm--36927660.html,https://www.stern.de/panorama/wetter--der-fruehwinter-schaltet-auf--herbstprogramm--36927660.html,0,www.stern.de,"Wetter: Der Frühwinter schaltet auf ""Herbstprogramm""","Am Wochenende zeigt sich der Winter von seiner milderen Seite: Vielerorts gibt es graues, nasses Wetter – doch Glätte bleibt zunächst in einigen Regionen noch ein Thema.",https://image.stern.de/36927662/t/Cz/v1/w1440/r1.7778/-/04--htoibmwwrev16axs2048jpeg---a13bd41b4fd54c2f.jpg,2025-12-04T10:34:54Z,,"Kopiere den aktuellen Link
Zur Merkliste hinzufügen
Am Wochenende zeigt sich der Winter von seiner milderen Seite: Vielerorts gibt es graues, nasses Wetter doch Glätte bleibt zunächst in einigen Re… [+2202 chars]",,de,'Schnee'
https://www.tagesspiegel.de/gesellschaft/panorama/wetter-der-fruhwinter-schaltet-auf-herbstprogramm-15016358.html,https://www.tagesspiegel.de/gesellschaft/panorama/wetter-der-fruhwinter-schaltet-auf-herbstprogramm-15016358.html,0,www.tagesspiegel.de,Wetter: Der Frühwinter schaltet auf „Herbstprogramm“,"Am Wochenende zeigt sich der Winter von seiner milderen Seite: Vielerorts gibt es graues, nasses Wetter – doch Glätte bleibt zunächst in einigen Regionen noch ein Thema.",https://www.tagesspiegel.de/images/15016357/alternates/BASE_16_9_W1400/1764844574000/herbstwetter.jpeg,2025-12-04T10:36:14Z,,"Am Wochenende wird in Deutschland zumeist graues und ungemütliches Wetter mit zunehmend milderen Temperaturen erwartet. Dabei schalte der Frühwinter auf Herbstprogramm um, wie es beim Deutschen Wette… [+2071 chars]",,de,'Winter'
https://www.diepresse.com/20371914/rechen-maehen-umgraben-fuenf-gartenmythen-im-faktencheck,https://www.diepresse.com/20371914/rechen-maehen-umgraben-fuenf-gartenmythen-im-faktencheck,0,www.diepresse.com,"Rechen, mähen, umgraben: Fünf Gartenmythen im Faktencheck [premium]","Laub rechen, Beete umgraben, Hecken stutzen: Für viele ganz traditionelle Gartenarbeiten vor dem Winter. Doch wenig davon ist wirklich sinnvoll.",https://img.diepresse.com/public/incoming/ytuwhg-GettyImages-187092297.jpg/alternates/DPR_SOCIAL_MAGAZIN/GettyImages-187092297.jpg,2025-12-04T11:10:00Z,,"Der erste Frost war schon da und hat so manchen Garten unvorbereitet getroffen. Weit öfter allerdings komme es vor, dass zu viel gemacht werde, sagen Experten. Denn die alte Ansicht, der Garten müsse… [+6076 chars]",,de,'Kälte'
https://www.morgenpost.de/berlin/article410623009/berliner-stadtreinigung-mit-sole-splitt-und-salz-gegen-schnee-und-eis.html,https://www.morgenpost.de/berlin/article410623009/berliner-stadtreinigung-mit-sole-splitt-und-salz-gegen-schnee-und-eis.html,0,www.morgenpost.de,"Berliner Stadtreinigung: Mit Sole, Splitt und Salz gegen Schnee und Eis","Die BSR ist gerüstet für den Winterdienst. Die Salzlager sind gefüllt, 540 Räumfahrzeuge und 2300 Mitarbeiter stehen bereit.",https://img.sparknews.funkemedien.de/410625564/410625564_1764863759_v16_9_1600.jpeg,2025-12-04T12:44:39Z,,"Die Berliner Stadtreinigung (BSR) startet gut ausgerüstet in diesen Winter. 2300 Beschäftige mit 540 Räumfahrzeugen stehen in den 16 Winterdienst-Standorten der BSR bereit, um die Straßen Berlins von… [+4467 chars]",,de,'Schnee'
https://www.morgenpost.de/berlin/article410623088/schmierzug-heizung-co-wie-die-bvg-sich-fuer-den-winter-ruestet.html,https://www.morgenpost.de/berlin/article410623088/schmierzug-heizung-co-wie-die-bvg-sich-fuer-den-winter-ruestet.html,0,www.morgenpost.de,"Schmierzug, Heizung & Co.: Wie die BVG sich für den Winter rüstet",Die kalte Jahreszeit in Berlin ist angebrochen. Schnee und Eis könnten den Fahrplan der BVG durcheinanderbringen. Wie das verhindert werden soll.,https://img.sparknews.funkemedien.de/410622875/410622875_1764855207_v16_9_1600.jpeg,2025-12-04T13:33:27Z,,"Bislang hat es in Berlin nur an einem Tag geschneit, doch das könnte sich schnell ändern. Die Berliner Verkehrsbetriebe (BVG) haben sich deshalb auf die besonders kalte Jahreszeit vorbereitet. Mit ve… [+2130 chars]",,de,'Heizung'
https://www.stern.de/panorama/der-augentest-im-winter--sehen-sie-alle-pferde-im-schnee--32699966.html,https://www.stern.de/panorama/der-augentest-im-winter--sehen-sie-alle-pferde-im-schnee--32699966.html,0,www.stern.de,"Augentest: Schaffen Sie es, alle Pferde im Schnee zu entdecken?",Viele Tiere sind gut getarnt und daher in freier Wildbahn nur schwer zu erkennen. Das gilt auch für dieses Suchbild. Wie viele Pferde können sie erkennen? Augen auf!,https://image.stern.de/32699980/t/wY/v4/w1440/r1.7778/-/pferde-im-schnee-raetsel.jpg,2025-12-04T13:37:00Z,,"Zugang zu stern+statt 11,96 
 nur 1  
<ul><li>Alles von stern+ mit erstklassigen Inhalten von GEO und Capital</li><li>4 Wochen testen, dann 2,99  je Woche</li><li>jederzeit kündbar</li></ul>",,de,'Schnee'
