index,url,valid,domain,title,description,image,published,archive,content,quote,language,keyword
https://www.zeit.de/news/2026-02/01/vitamin-d-ergaenzung-im-winter-hype-oder-sinnvoll,https://www.zeit.de/news/2026-02/01/vitamin-d-ergaenzung-im-winter-hype-oder-sinnvoll,0,www.zeit.de,Ernährungstrend: Vitamin-D-Ergänzung im Winter: Hype oder sinnvoll?,Hier finden Sie Informationen zu dem Thema „Ernährungstrend“. Lesen Sie jetzt „Vitamin-D-Ergänzung im Winter: Hype oder sinnvoll?“.,https://img.zeit.de/news/2026-02/01/vitamin-d-ergaenzung-im-winter-hype-oder-sinnvoll-image-group/wide__1300x731,2026-02-01T04:00:05Z,,"In den Wintermonaten scheint die Sonne deutlich schwächer - das verringert die körpereigene Produktion von Vitamin D in der Haut. Nachhelfen kann man mit Nahrungsergänzungsmitteln, die Vitamin D enth… [+5319 chars]",,de,'Winter'
https://www.zeit.de/news/2026-02/01/trotz-frost-und-schnee-mv-geht-in-die-heisse-karnevalszeit,https://www.zeit.de/news/2026-02/01/trotz-frost-und-schnee-mv-geht-in-die-heisse-karnevalszeit,0,www.zeit.de,MV Helau!: Trotz Frost und Schnee: MV geht in die heiße Karnevalszeit,Hier finden Sie Informationen zu dem Thema „MV Helau!“. Lesen Sie jetzt „Trotz Frost und Schnee: MV geht in die heiße Karnevalszeit“.,https://img.zeit.de/news/2026-02/01/trotz-frost-und-schnee-mv-geht-in-die-heisse-karnevalszeit-image-group/wide__1300x731,2026-02-01T04:00:22Z,,Die Karnevalssaison in Nordosten steuert auf ihren Höhepunkt zu. Bis zum Rosenmontag am 16. Februar und darüber hinaus absolvieren «Tollitäten und närrisches Fußvolk» in vielen Orten ein strammes Pro… [+1875 chars],,de,'Frost'
https://www.zeit.de/news/2026-02/01/glaettegefahr-im-nordwesten-frost-im-nordosten-erwartet,https://www.zeit.de/news/2026-02/01/glaettegefahr-im-nordwesten-frost-im-nordosten-erwartet,0,www.zeit.de,Wetter: Glättegefahr im Nordwesten - Frost im Nordosten erwartet,Hier finden Sie Informationen zu dem Thema „Wetter“. Lesen Sie jetzt „Glättegefahr im Nordwesten - Frost im Nordosten erwartet“.,https://img.zeit.de/news/2026-02/01/glaettegefahr-im-nordwesten-frost-im-nordosten-erwartet-image-group/wide__1300x731,2026-02-01T04:15:05Z,,Im Nordwesten und Westen Deutschlands droht in der Nacht und am Sonntag stellenweise Glatteis. Dies gelte insbesondere in der Westhälfte Niedersachsens über Ostwestfalen und Hessen hinweg bis zum Ode… [+1367 chars],,de,'Frost'
https://www.zeit.de/politik/2026-01/stromausfall-kyjiw-heizungsausfall-ukrainekrieg-nachrichtenpodcast,https://www.zeit.de/politik/2026-01/stromausfall-kyjiw-heizungsausfall-ukrainekrieg-nachrichtenpodcast,0,www.zeit.de,Stromausfälle in Kyjiw: Wenn der Winter zur Waffe wird,Inmitten von russischen Angriffen und Strom- und Heizungsausfällen in Kyjiw beginnen neue Ukraineverhandlungen in Abu Dhabi. Und: Deutschland im Finale der Handball-EM,https://img.zeit.de/politik/2017-09/illu-podcast-news/wide__8ed8a6__1300x731,2026-02-01T05:02:27Z,,"Nach russischen Angriffen auf die Energieinfrastruktur kommt es in Kyjiw seit Wochen zu weitreichenden Strom-, Heizungs- und Wasserausfällen. Hunderttausende Menschen sind zeitweise ohne grundlegende… [+2142 chars]",,de,'Heizung'
https://www.faz.net/aktuell/politik/ukraine/kommentar-kiew-trotzt-der-kaelte-und-berlin-hilft-nicht-genug-110828424.html,https://www.faz.net/aktuell/politik/ukraine/kommentar-kiew-trotzt-der-kaelte-und-berlin-hilft-nicht-genug-110828424.html,0,www.faz.net,Winter ohne Heizung: Merz hätte besser geschwiegen,"An den Ukrainern kann man sehen, was es bedeutet, wenn Menschen um ein Leben in persönlicher Souveränität kämpfen. Warum kommt aus Berlin nicht mehr Hilfe?",https://media0.faz.net/image/w1200h627/22d724bc5ccc/w3000h1567x0y375o/012026/1.10828422/notzelte-in-kiew.webp,2026-02-01T07:15:17Z,,"Morgenbulletin aus Kiew: Es bleibt eisig. Für nächste Woche werden minus zwanzig Grad erwartet. Am Donnerstag waren nach russischen Bombardements immer noch 613 Wohnblocks ohne Heizung, und auch in d… [+3096 chars]",,de,'Heizung'
https://www.zeit.de/politik/deutschland/2026-02/gasspeicher-fuellstaende-gasversorgung-katherina-reiche,https://www.zeit.de/politik/deutschland/2026-02/gasspeicher-fuellstaende-gasversorgung-katherina-reiche,0,www.zeit.de,Gasspeicher: Katherina Reiche befürchtet keine Knappheit bei der Gasversorgung,In deutschen Gasspeichern sind die Füllstände auf 35 Prozent gesunken. Laut Bundeswirtschaftsministerin Katherina Reiche ist das aber kein Grund zur Beunruhigung.,https://img.zeit.de/politik/deutschland/2026-02/erdgas-speicher-reiche-bild/wide__1300x731,2026-02-01T14:28:59Z,,"Nach Einschätzung von Bundeswirtschaftsministerin
 Katherina Reiche (CDU) sind die relativ niedrigen Füllstände in deutschen 
Gasspeichern kein Grund zur Beunruhigung. Man beobachte die Lage 
tägl… [+830 chars]",,de,'Gas'
https://www.faz.net/aktuell/gesellschaft/bombenzyklon-trifft-usa-north-carolina-versinkt-im-schnee-accg-200495220.html,https://www.faz.net/aktuell/gesellschaft/bombenzyklon-trifft-usa-north-carolina-versinkt-im-schnee-accg-200495220.html,0,www.faz.net,"Schnee, Orkanböen, Sturmfluten: Bombenzyklon trifft USA","Eine gefährliche Kältewelle erfasst den Süden der USA. In North Carolina fallen örtlich Schneemengen, die zu den höchsten seit Beginn der Aufzeichnungen zählen.",https://media0.faz.net/image/w1200h627/91131d3cd1e5/w4000h2090x0y169o/202602/43601.0.1725169934/streugut-ist-dieser-tage-in.webp,2026-02-01T17:03:26Z,,"Ein schwerer Wintersturm hat Schnee, Orkanböen, Sturmfluten und gefährliche Kälte in den Südosten der USA gebracht. Ein Tiefdruckgebiet vor der Küste entwickelte sich in der Nacht zum Sonntag nach An… [+1799 chars]",,de,'Schnee'
https://www.stern.de/news/schneestuerme-haben-weite-teile-der-usa-fest-im-griff---kaelteeinbruch-in-florida-37095020.html,https://www.stern.de/news/schneestuerme-haben-weite-teile-der-usa-fest-im-griff---kaelteeinbruch-in-florida-37095020.html,0,www.stern.de,Schneestürme haben weite Teile der USA fest im Griff - Kälteeinbruch in Florida,"Die Kältewelle in den USA hat viele Bundesstaaten weiter fest im Griff. Für North und South Carolina sowie Teile von Georgia, Kentucky, Tennessee und Virginia in der Osthälfte des Landes galt am Wochenende eine Sturmwarnung. Schnee und Eiseskälte trafen auch …",https://image.stern.de/37096794/t/Al/v1/w1440/r1.7778/-/01--ein-gruener-leguan-in-kaeltestarre-in-miami-beach---6340deaba3d2c329.jpg,2026-02-01T19:12:57Z,,"Kopiere den aktuellen Link
Zur Merkliste hinzufügen
Die Kältewelle in den USA hat viele Bundesstaaten weiter fest im Griff. Für North und South Carolina sowie Teile von Georgia, Kentucky, Tennessee… [+2904 chars]",,de,'Winter'
https://www.transfermarkt.de/-kicker-quot-bvb-hat-stuttgarts-hendriks-im-blick-winter-wechsel-nach-nottingham-abgeblockt/view/news/474675,https://www.transfermarkt.de/-kicker-quot-bvb-hat-stuttgarts-hendriks-im-blick-winter-wechsel-nach-nottingham-abgeblockt/view/news/474675,0,www.transfermarkt.de,BVB hat Stuttgarts Hendriks im Blick – Winter-Wechsel nach Nottingham abgeblockt,Ramon Hendriks vom VfB Stuttgart ist offenbar ein gefragter Mann auf dem Transfermarkt. Einen Tag vor dem Ende der Wechselperiode kamen zuerst Gerüchte um ein Interesse von Nottingham Forest...,https://tmssl.akamaized.net/images/foto/big/ramon-hendriks-vfb-stuttgart-2026-1769973627-188537.jpg?lm=1769973637,2026-02-01T19:21:51Z,,"Gefragter Innenverteidiger 
Ramon Hendriks vom VfB Stuttgart ist offenbar ein gefragter Mann auf dem Transfermarkt. Einen Tag vor dem Ende der Wechselperiode kamen zuerst Gerüchte um ein Interesse v… [+1484 chars]",,de,'Winter'
https://www.dw.com/de/was-politische-gefangene-in-belarus-im-winter-durchmachen/a-75702920,https://www.dw.com/de/was-politische-gefangene-in-belarus-im-winter-durchmachen/a-75702920,0,www.dw.com,Was politische Gefangene in Belarus im Winter durchmachen,"Ein schneereicher und kalter Winter wie in diesem Jahr sei in belarussischer Haft eine Tortur, sagen ehemalige politische Gefangene. Denn Schnee und Kälte würden systematisch als Folterinstrumente eingesetzt.",https://static.dw.com/image/64848827_6.jpg,2026-02-01T19:46:00Z,,"Die Leitungen von Haftanstalten in Belarus verpflichten Gefangene, ständig Schnee zu räumen, bis auf den Asphalt. Sie müssen stundenlang Schnee in Säcken tragen, oft ohne die Möglichkeit, sich danach… [+6466 chars]",,de,'Kälte'
https://www.focus.de/immobilien/wohnen/auch-im-winter-kalt-expertin-verraet-die-perfekte-schlafzimmer-temperatur-zum-schlafen_b4b7422c-3b25-4605-9aab-d9114d339d89.html,https://www.focus.de/immobilien/wohnen/auch-im-winter-kalt-expertin-verraet-die-perfekte-schlafzimmer-temperatur-zum-schlafen_b4b7422c-3b25-4605-9aab-d9114d339d89.html,0,www.focus.de,Auch im Winter kalt: Expertin verrät die perfekte Schlafzimmer-Temperatur zum Schlafen,"Schlafen Sie schlecht? Wer nachts keine Ruhe findet, ist tagsüber nicht leistungsfähig. Neurowissenschaftlerin Rachel Barr gibt drei Tipps für besseren Schlaf und überrascht mit ihrer Empfehlung zur Zimmertemperatur.",https://quadro.burda-forward.de/ctf/b8a1ecc3-bbe6-4d32-820e-de930bdb57ca.b8c89b3e-ec56-40c4-bba2-3b4744cd9242.jpg?im=RegionOfInterestCrop%3D%281200%2C630%29%2CregionOfInterest%3D%281170%2C803%29&hash=12dca2218529b98e1ddae42fdbfaefef6d4d8e089c94080ea56967c399f299de,2026-02-01T20:31:00Z,,Schlaflosigkeit und schlechter Schlaf können das tägliche Leben erheblich beeinträchtigen. Neurowissenschaftlerin Rachel Barr verrät ihre besten Tipps für einen erholsameren Schlaf. Mit drei Maßnahme… [+1186 chars],,de,'Winter'
https://www.autobild.de/artikel/autobatterie-check-und-pflege-im-winter-44097.html,https://www.autobild.de/artikel/autobatterie-check-und-pflege-im-winter-44097.html,0,www.autobild.de,Viele drücken sich vor diesem Batterie-Test,"Fast die Hälfte aller Autopannen im Winter geht auf eine schwache Starter-Batterie zurück. Minusgrade, Kurzstrecken und Stromfresser machen der Batterie zu schaffen. Ein einfacher Check verrät, ob die Batterie durch den Winter kommt. Doch scheuen sich davor",https://i.auto-bild.de/ir_img/4/3/9/3/9/Multimeter--die-gemessene-Spannung-zeigt-den-Ladezustand-2869-1200x675-5110fd8dbafda4bb.jpg?impolicy=og_images,2026-02-02T03:00:00Z,,"Das Messen der Batteriespannung dauert nur wenige Sekunden und könnte viele Autopannen verhindern. Trotzdem verzichten viele Autofahrer darauf. Häufige Gründe sind Unsicherheit, etwa die Sorge, die B… [+742 chars]",,de,'Winter'
https://www.stern.de/gesellschaft/regional/bayern/winterliche-gefahr--der-weisse-tod---lawinen-drohen-auch-bei-wenig-schnee-37097116.html,https://www.stern.de/gesellschaft/regional/bayern/winterliche-gefahr--der-weisse-tod---lawinen-drohen-auch-bei-wenig-schnee-37097116.html,0,www.stern.de,Winterliche Gefahr: Der weiße Tod - Lawinen drohen auch bei wenig Schnee,Acht Tote gab es jüngst an einem einzigen Tag: Lawinen fordern immer wieder Menschenleben. Dabei gibt es gute Einschätzungen der Lage durch Lawinenwarndienste. Warum bleibt ein Risiko?,https://image.stern.de/37097118/t/y6/v1/w1440/r1.7778/-/02--aac3rdjlqfv9axs2048jpeg---10881a4725abfbce.jpg,2026-02-02T03:00:20Z,,"Kopiere den aktuellen Link
Zur Merkliste hinzufügen
Acht Tote gab es jüngst an einem einzigen Tag: Lawinen fordern immer wieder Menschenleben. Dabei gibt es gute Einschätzungen der Lage durch Lawin… [+5718 chars]",,de,'Winter'
https://www.zeit.de/news/2026-02/02/winterwetter-stellt-bauern-vor-unterschiedliche-aufgaben,https://www.zeit.de/news/2026-02/02/winterwetter-stellt-bauern-vor-unterschiedliche-aufgaben,0,www.zeit.de,Wetter: Winterwetter stellt Bauern vor unterschiedliche Aufgaben,Hier finden Sie Informationen zu dem Thema „Wetter“. Lesen Sie jetzt „Winterwetter stellt Bauern vor unterschiedliche Aufgaben“.,https://img.zeit.de/news/2026-02/02/winterwetter-stellt-bauern-vor-unterschiedliche-aufgaben-image-group/wide__1300x731,2026-02-02T04:00:18Z,,"Die Landwirte in Niedersachsen nehmen das aktuelle Winterwetter mit gemischten Gefühlen wahr. «Je nach Betriebsschwerpunkt sehen die Landwirte die Herausforderungen des Winters unterschiedlich», sagt… [+1290 chars]",,de,'Winter'
https://www.stern.de/gesellschaft/regional/niedersachsen-bremen/wetter--winterwetter-stellt-bauern-vor-unterschiedliche-aufgaben-37097166.html,https://www.stern.de/gesellschaft/regional/niedersachsen-bremen/wetter--winterwetter-stellt-bauern-vor-unterschiedliche-aufgaben-37097166.html,0,www.stern.de,Wetter: Winterwetter stellt Bauern vor unterschiedliche Aufgaben,"Für Pflanzenanbauer ist Schnee ein Segen, Tierhalter kämpfen mit steigenden Heizkosten. Wie Bauern in Niedersachsen den Winter unterschiedlich erleben.",https://image.stern.de/37097168/t/bO/v1/w1440/r1.7778/-/02--htyo55232cv4axs2048jpeg---382fd333de1ba5cd.jpg,2026-02-02T04:00:18Z,,"Kopiere den aktuellen Link
Zur Merkliste hinzufügen
Für Pflanzenanbauer ist Schnee ein Segen, Tierhalter kämpfen mit steigenden Heizkosten. Wie Bauern in Niedersachsen den Winter unterschiedlich er… [+1457 chars]",,de,'Winter'
https://www.focus.de/gesundheit/ernaehrung/auf-diese-naehrstoffe-sollten-sie-im-winter-nicht-verzichten_b356dea7-08fc-4788-ae95-02b9ac588d9e.html,https://www.focus.de/gesundheit/ernaehrung/auf-diese-naehrstoffe-sollten-sie-im-winter-nicht-verzichten_b356dea7-08fc-4788-ae95-02b9ac588d9e.html,0,www.focus.de,Auf diese Nährstoffe sollten Sie im Winter nicht verzichten,"Wenig Sonne, mehr Müdigkeit? Warum bestimmte Nährstoffe vor allem im Winter besonders wichtig für Körper und Psyche sind, lesen Sie hier.",https://quadro.burda-forward.de/ctf/da2e34a0-e5c8-42f2-adda-658cf08de560.a25b89d3-056e-4d69-b8b1-f12f9055aae9.jpg?im=RegionOfInterestCrop%3D%281200%2C630%29%2CregionOfInterest%3D%28981%2C820%29&hash=bdcc299f8dd78852f2150810d312d4ac36c0ede6104cb3ccc0efaafaaa190418,2026-02-02T04:01:00Z,,"Weniger Tageslicht, kalte Temperaturen und ein veränderter Alltag belasten im Winter Körper und Psyche. Viele Menschen fühlen sich müder, antriebsloser oder emotional unausgeglichener. Neben Bewegung… [+4668 chars]",,de,'Winter'
https://www.diepresse.com/20530565/wie-ueberlebt-eine-schneerose,https://www.diepresse.com/20530565/wie-ueberlebt-eine-schneerose,0,www.diepresse.com,Wie überlebt eine Schneerose? [premium],"Minus zehn Grad und weniger – und die Pflanze trotzt der Kälte. Um das auszuhalten, nutzt sie allerlei Strategien, Frostschutzmittel inklusive.",https://img.diepresse.com/public/incoming/6591ss-kein-titel/alternates/DPR_SOCIAL_MAGAZIN/kein%20Titel,2026-02-02T05:00:00Z,,"Es ist ein fast unglaublicher Anblick. Just in der kargen, kalten Jahreszeit wärmt die Schneerose mit ihren weiß-grünen bis zart-rosa Blüten die Herzen der Betrachter. Doch wie wappnet sie sich gegen… [+3131 chars]",,de,'Frost'
https://www.stern.de/gesellschaft/regional/berlin-brandenburg/ueberlebenskuenstler--wie-winterhart-wildtiere-sind-und-wo-gefahren-lauern-37097320.html,https://www.stern.de/gesellschaft/regional/berlin-brandenburg/ueberlebenskuenstler--wie-winterhart-wildtiere-sind-und-wo-gefahren-lauern-37097320.html,0,www.stern.de,Überlebenskünstler: Wie winterhart Wildtiere sind und wo Gefahren lauern,"Dauerfrost in Brandenburg: Wie kommen Tiere durch den Winter? Schnee und Eis können zur Belastung für Rehe, aber auch Fische und Vögel werden. Ein Schmetterling zeigt sich besonders winterhart.",https://image.stern.de/37097322/t/7O/v1/w1440/r1.7778/-/02--6bv4epggiwv9axs2048jpeg---30b6b0834c4f2981.jpg,2026-02-02T05:00:09Z,,"Kopiere den aktuellen Link
Zur Merkliste hinzufügen
Dauerfrost in Brandenburg: Wie kommen Tiere durch den Winter? Schnee und Eis können zur Belastung für Rehe, aber auch Fische und Vögel werden. Ei… [+4694 chars]",,de,'Winter'
https://www.tagesspiegel.de/berlin/uberlebenskunstler-wie-winterhart-wildtiere-sind-und-wo-gefahren-lauern-15207453.html,https://www.tagesspiegel.de/berlin/uberlebenskunstler-wie-winterhart-wildtiere-sind-und-wo-gefahren-lauern-15207453.html,0,www.tagesspiegel.de,Überlebenskünstler: Wie winterhart Wildtiere sind und wo Gefahren lauern,"Dauerfrost in Brandenburg: Wie kommen Tiere durch den Winter? Schnee und Eis können zur Belastung für Rehe, aber auch Fische und Vögel werden. Ein Schmetterling zeigt sich besonders winterhart.",https://www.tagesspiegel.de/images/15207452/alternates/BASE_16_9_W1400/1770008514000/winterwetter.jpeg,2026-02-02T05:01:54Z,,Tiere im Winterstress? Fettpolster und Futtervorräte helfen Wildtieren bei der Eiseskälte. Doch minus 10 Grad können auch gut angepasste Arten an Grenzen bringen. Wie es geht Tieren in Brandenburg - … [+4535 chars],,de,'Winter'
https://www.zeit.de/news/2026-02/02/glatte-strassen-am-warnstreiktag-in-nrw,https://www.zeit.de/news/2026-02/02/glatte-strassen-am-warnstreiktag-in-nrw,0,www.zeit.de,Regen und Schnee: Glatte Straßen am Warnstreiktag in NRW,Hier finden Sie Informationen zu dem Thema „Regen und Schnee“. Lesen Sie jetzt „Glatte Straßen am Warnstreiktag in NRW“.,https://img.zeit.de/news/2026-02/02/glatte-strassen-am-warnstreiktag-in-nrw-image-group/wide__1300x731,2026-02-02T05:19:46Z,,Am Morgen des Warnstreiks kann es auf den Straßen in Nordrhein-Westfalen weiterhin glatt werden. Dies teilt der Deutsche Wetterdienst (DWD) mit. Vor allem im Norden und Nordosten ist bis in den Vormi… [+1229 chars],,de,'Nässe'
https://vorarlberg.orf.at/stories/3340203/,https://vorarlberg.orf.at/stories/3340203/,0,vorarlberg.orf.at,Luftgüte leidet unter Öl- und Gasheizungen,"Das Jahr 2026 hat kalt begonnen. Schnee und frostige Temperaturen haben dazu geführt, dass in ganz Vorarlberg ordentlich geheizt werden musste. In vielen Fällen wird immer noch mit Öl oder Gas geheizt. Darunter leidet die Luftgüte, wie die Messwerte im Jänner…",https://ibs.orf.at/vbg?image=https%3A%2F%2Foekastatic.orf.at%2Fmims%2F2021%2F48%2F07%2Fcrops%2Fw%3D1200%2Ch%3D627%2Cq%3D75%2F1152693_master_410507_umstieg_von_oelheizung_211122_poechhacker_15315.mxf_00_19_26_09.jpg%3Fs%3D1b302da4fb3f8db120362a70f70764913cc6d39a,2026-02-02T05:39:26Z,,Die Belastung durch Feinstaub und Stickstoffdioxid war heuer im Jänner deutlich höher als in den Jahren zuvor. So fasst Luftgütespezialist Bernhard Anwander vom Umweltinstitut die Werte zusammen. Gre… [+1078 chars],,de,'Schnee'
https://www.zeit.de/news/2026-02/02/frost-in-brandenburg-und-es-wird-gestreikt,https://www.zeit.de/news/2026-02/02/frost-in-brandenburg-und-es-wird-gestreikt,0,www.zeit.de,Wetter: Frost in Brandenburg - und es wird gestreikt,Hier finden Sie Informationen zu dem Thema „Wetter“. Lesen Sie jetzt „Frost in Brandenburg - und es wird gestreikt“.,https://img.zeit.de/news/2026-02/02/frost-in-brandenburg-und-es-wird-gestreikt-image-group/wide__1300x731,2026-02-02T05:57:17Z,,Warnstreiks und glatte Straßen erschweren in Brandenburg den Weg zur Arbeit. Laut Deutschem Wetterdienst (DWD) soll es frostig bleiben und ab der Nacht zum Mittwoch gebietsweise schneien. Heute kommt… [+1015 chars],,de,'Frost'
https://www.zeit.de/news/2026-02/02/winterlicher-wochenstart-mit-frost-und-sturmboeen,https://www.zeit.de/news/2026-02/02/winterlicher-wochenstart-mit-frost-und-sturmboeen,0,www.zeit.de,Wetter: Winterlicher Wochenstart mit Frost und Sturmböen,Hier finden Sie Informationen zu dem Thema „Wetter“. Lesen Sie jetzt „Winterlicher Wochenstart mit Frost und Sturmböen“.,https://img.zeit.de/news/2026-02/02/winterlicher-wochenstart-mit-frost-und-sturmboeen-image-group/wide__1300x731,2026-02-02T07:13:35Z,,"Die Woche beginnt frostig mit niedrigen Temperaturen und vereinzeltem Schneefall. Auf den Straßen muss mit Glätte gerechnet werden.
Am Montag bleibt es zunächst bedeckt, im Laufe des Tages kann es v… [+1399 chars]",,de,'Frost'
https://www.mobiflip.de/diese-kleinen-akku-handwaermer-haben-meinen-winter-alltag-veraendert/,https://www.mobiflip.de/diese-kleinen-akku-handwaermer-haben-meinen-winter-alltag-veraendert/,0,www.mobiflip.de,Diese kleinen Akku-Handwärmer haben meinen Winter-Alltag verändert,"Akku-Handwärmer sind für mich ein kleines, aber sehr nützliches Alltags-Gadget geworden, das ich nicht mehr missen möchte. In diesem Beitrag schildere ich meine persönlichen Erfahrungen mit magnetischen Handwärmern und erkläre, …",https://i0.wp.com/www.mobiflip.de/wp-content/uploads/2026/02/akku-handwaermer.jpeg?fit=1600%2C1032&ssl=1,2026-02-02T07:30:56Z,,"Akku-Handwärmer sind für mich ein kleines, aber sehr nützliches Alltags-Gadget geworden, das ich nicht mehr missen möchte. In diesem Beitrag schildere ich meine persönlichen Erfahrungen mit magnetisc… [+5217 chars]",,de,'Handschuhe'
https://www.faz.net/aktuell/reise/von-huette-zu-huette-skiwandern-in-schweden-accg-110827991.html,https://www.faz.net/aktuell/reise/von-huette-zu-huette-skiwandern-in-schweden-accg-110827991.html,0,www.faz.net,Auf Skiern durch Schweden: Eine Tour für alle Fjälle,"Im Winter ist im schwedischen Jämtland-Dreieck deutlich weniger los als im Sommer, doch was weiß der Mitteleuropäer schon übers Turskidåkning – Skiwandern im kapriziösen arktischen Winter?",https://media0.faz.net/image/w1200h627/f83a358a4e41/w3000h1567x0y216o/042025/1.10827981/gegen-den-wind-meist-bleibt.webp,2026-02-02T08:09:36Z,,"Die Storulvån Fjällstation ist eine sonderbare Berghütte. Auf dem Parkplatz steht ein Reisebus, Touristen ziehen Rollkoffer durch Schnee und Eis. Im Laden neben der Rezeption ist von Köttbullar in Do… [+9693 chars]",,de,'Winter'
https://www.diepresse.com/20539518/minus-20-grad-new-yorker-frieren-bei-eisigen-temperaturen,https://www.diepresse.com/20539518/minus-20-grad-new-yorker-frieren-bei-eisigen-temperaturen,0,www.diepresse.com,Minus 20 Grad: New Yorker frieren bei eisigen Temperaturen [premium],"Eis am Hudson River, 25 Zentimeter Schnee in South Carolina, Tausende abgesagte Flüge: Die Kälte sucht die US-Ostküste heim, ein Ende ist vorerst in weiten Teilen nicht in Sicht.",https://img.diepresse.com/public/incoming/pckcil-us-frigid-temperatures-chill-new-york-city/alternates/DPR_SOCIAL_NACHRICHTEN/US-FRIGID-TEMPERATURES-CHILL-NEW-YORK-CITY,2026-02-02T10:08:28Z,,"New York. Es hat schon einen guten Grund, warum die Wetter-Apps für New York City nicht nur die tatsächliche Temperatur, sondern stets auch die gefühlte Kälte anzeigen. Ein Spaziergang am Ufer des Hu… [+4350 chars]",,de,'Kälte'
https://www.zeit.de/news/2026-02/02/drei-eisrettungen-in-berlin-feuerwehr-findet-toten-an-see,https://www.zeit.de/news/2026-02/02/drei-eisrettungen-in-berlin-feuerwehr-findet-toten-an-see,0,www.zeit.de,Frost: Drei Eisrettungen in Berlin - Feuerwehr findet Toten an See,Hier finden Sie Informationen zu dem Thema „Frost“. Lesen Sie jetzt „Drei Eisrettungen in Berlin - Feuerwehr findet Toten an See“.,https://img.zeit.de/news/2026-02/02/drei-eisrettungen-in-berlin-feuerwehr-findet-toten-an-see-image-group/wide__1300x731,2026-02-02T13:46:45Z,,"Die Berliner Feuerwehr musste vergangene Woche dreimal zur Eisrettung ausrücken. Am Biesdorfer Baggersee hätten die Einsatzkräfte am 29. Januar eine Person leblos aufgefunden, wie ein Feuerwehrsprech… [+1638 chars]",,de,'Frost'
https://www.stern.de/gesellschaft/regional/mecklenburg-vorpommern/wetter--wind-und-kaelte-sorgen-fuer-gefuehlte-temperatur-von--22-grad-37099164.html,https://www.stern.de/gesellschaft/regional/mecklenburg-vorpommern/wetter--wind-und-kaelte-sorgen-fuer-gefuehlte-temperatur-von--22-grad-37099164.html,0,www.stern.de,Wetter: Wind und Kälte sorgen für gefühlte Temperatur von -22 Grad,"In MV geht der Frost zum Wochenbeginn durch Mark und Bein. Von Rekorden sind die Temperaturen aber weit entfernt. Stefan Kreibohm arbeitet derzeit auf Rügen, teils wegen des Frostes.",https://image.stern.de/37099166/t/7Y/v1/w1440/r1.7778/-/02--i3jqhsbkixv3axs2048jpeg---8f8254834fdce7e6.jpg,2026-02-02T13:53:49Z,,"Kopiere den aktuellen Link
Zur Merkliste hinzufügen
In MV geht der Frost zum Wochenbeginn durch Mark und Bein. Von Rekorden sind die Temperaturen aber weit entfernt. Stefan Kreibohm arbeitet derzei… [+3036 chars]",,de,'Frost'
https://www.tagesschau.de/ausland/europa/ukraine-russische-angriffe-110.html,https://www.tagesschau.de/ausland/europa/ukraine-russische-angriffe-110.html,0,www.tagesschau.de,Russische Raketen- und Drohnenangriffe auf Kiew,Kurz vor ukrainisch-russischen Gesprächen in Abu Dhabi gibt es Raketen- und Drohnenangriffe auf ukrainische Städte. Aus Charkiw werden Verletzte gemeldet. Die Menschen suchen bei strengem Frost Schutz in Metro-Stationen.,https://images.tagesschau.de/image/0049865a-2fc7-4409-aa0a-5d723dbd31a0/AAABnCFNqew/AAABmyZE0EA/16x9-big/kiew-ubahnstation-100.jpg?width=1280,2026-02-03T02:47:40Z,,"Stand: 03.02.2026 03:47 Uhr
Kurz vor ukrainisch-russischen Gesprächen in Abu Dhabi gibt es Raketen- und Drohnenangriffe auf ukrainische Städte. Aus Charkiw werden Verletzte gemeldet. Die Menschen su… [+1460 chars]",,de,'Frost'
https://www.zeit.de/news/2026-02/03/glatteisgefahr-im-westen-eisige-kaelte-im-osten,https://www.zeit.de/news/2026-02/03/glatteisgefahr-im-westen-eisige-kaelte-im-osten,0,www.zeit.de,Wetter: Glatteisgefahr im Westen - eisige Kälte im Osten,Hier finden Sie Informationen zu dem Thema „Wetter“. Lesen Sie jetzt „Glatteisgefahr im Westen - eisige Kälte im Osten“.,https://img.zeit.de/news/2026-02/03/glatteisgefahr-im-westen-eisige-kaelte-im-osten-image-group/wide__1300x731,2026-02-03T03:41:42Z,,"Während die Menschen im Osten und Nordosten mit den eisigen Temperaturen zu kämpfen haben, droht im Westen und Südwesten Deutschlands zur Wochenmitte neue Glatteisgefahr. Am Dienstag fällt dort laut … [+2939 chars]",,de,'Kälte'
