index,url,valid,domain,title,description,image,published,archive,content,quote,language,keyword
https://www.zeit.de/news/2025-12/04/was-sie-ueber-den-winterdienst-in-berlin-wissen-muessen,https://www.zeit.de/news/2025-12/04/was-sie-ueber-den-winterdienst-in-berlin-wissen-muessen,0,www.zeit.de,Einsatz bei Schnee und Eis: Was Sie über den Winterdienst in Berlin wissen müssen,Hier finden Sie Informationen zu dem Thema „Einsatz bei Schnee und Eis“. Lesen Sie jetzt „Was Sie über den Winterdienst in Berlin wissen müssen“.,https://img.zeit.de/news/2025-12/04/was-sie-ueber-den-winterdienst-in-berlin-wissen-muessen-image-group/wide__1300x731,2025-12-04T13:52:56Z,,Die ersten frostigen Nächte und auch den ersten Schneefall gab es in dieser Winter-Saison bereits in der Hauptstadt - der Winterdienst der BSR war daher auch schon im Einsatz. Auch für die kommenden … [+4168 chars],,de,'Schnee'
https://www.stern.de/gesellschaft/regional/berlin-brandenburg/einsatz-bei-schnee-und-eis--was-sie-ueber-den-winterdienst-in-berlin-wissen-muessen-36928696.html,https://www.stern.de/gesellschaft/regional/berlin-brandenburg/einsatz-bei-schnee-und-eis--was-sie-ueber-den-winterdienst-in-berlin-wissen-muessen-36928696.html,0,www.stern.de,Einsatz bei Schnee und Eis: Was Sie über den Winterdienst in Berlin wissen müssen,Wer muss in Berlin wann Schnee räumen? Warum Bus- und Straßenbahnhaltestellen oft schon früh dran sind – und wo Anwohner selbst zur Schaufel greifen müssen.,https://image.stern.de/36928698/t/My/v1/w1440/r1.7778/-/04--3bh2tltwmmv4axs2048jpeg---ef18ff07ee10aa7f.jpg,2025-12-04T13:52:56Z,,"Kopiere den aktuellen Link
Zur Merkliste hinzufügen
Wer muss in Berlin wann Schnee räumen? Warum Bus- und Straßenbahnhaltestellen oft schon früh dran sind und wo Anwohner selbst zur Schaufel greife… [+4599 chars]",,de,'Eis'
https://www.tagesspiegel.de/berlin/13000-tonnen-salz-und-beheizte-weichen-wie-sich-bvg-und-bsr-fur-den-winter-in-berlin-wappnen-15018172.html,https://www.tagesspiegel.de/berlin/13000-tonnen-salz-und-beheizte-weichen-wie-sich-bvg-und-bsr-fur-den-winter-in-berlin-wappnen-15018172.html,0,www.tagesspiegel.de,13.000 Tonnen Salz und beheizte Weichen: Wie sich BVG und BSR für den Winter in Berlin wappnen,"Noch sind die Temperaturen in Berlin kaum winterlich, doch BVG und BSR bereiten sich auf den Ernstfall vor. Für Grundstückseigentümer liefert die BSR wichtige Informationen.",https://www.tagesspiegel.de/images/15018171/alternates/BASE_16_9_W1400/1764857717000/winterdienst-berliner-stadtreinigung.jpeg,2025-12-04T13:54:04Z,,Die ersten frostigen Nächte und auch den ersten Schneefall gab es in dieser Winter-Saison bereits in der Hauptstadt der Winterdienst der BSR war daher auch schon im Einsatz. Auch für die kommenden Au… [+4648 chars],,de,'Winter'
https://www.tagesspiegel.de/berlin/einsatz-bei-schnee-und-eis-was-sie-uber-den-winterdienst-in-berlin-wissen-mussen-15018172.html,https://www.tagesspiegel.de/berlin/einsatz-bei-schnee-und-eis-was-sie-uber-den-winterdienst-in-berlin-wissen-mussen-15018172.html,0,www.tagesspiegel.de,Einsatz bei Schnee und Eis: Was Sie über den Winterdienst in Berlin wissen müssen,Wer muss in Berlin wann Schnee räumen? Warum Bus- und Straßenbahnhaltestellen oft schon früh dran sind – und wo Anwohner selbst zur Schaufel greifen müssen.,https://www.tagesspiegel.de/images/15018171/alternates/BASE_16_9_W1400/1764856444000/winterdienst-berliner-stadtreinigung.jpeg,2025-12-04T13:54:04Z,,Die ersten frostigen Nächte und auch den ersten Schneefall gab es in dieser Winter-Saison bereits in der Hauptstadt - der Winterdienst der BSR war daher auch schon im Einsatz. Auch für die kommenden … [+4220 chars],,de,'Schnee'
https://www.n-tv.de/panorama/Winter-liefert-Fruehlingsgefuehle-statt-Frostwelle-id30105545.html,https://www.n-tv.de/panorama/Winter-liefert-Fruehlingsgefuehle-statt-Frostwelle-id30105545.html,0,www.n-tv.de,Noch Chance auf Weiße Weihnacht?: Winter liefert Frühlingsgefühle statt Frostwelle,Der Winter zieht neue Seiten auf: Anstatt Schnee und Glätte gibt es irgendwas zwischen Frühlingsgefühlen und Herbstrückfall mit zweistelligen Temperaturen und Sturmgefahr. Hat sich damit der Traum von weißen Weihnachten 2025 erledigt? ntv-Meteorologe Paul Heg…,https://www.n-tv.de/img/30105547/1764855877/Img_16_9/1200/Ein-Trister-Vormittag-im-Siegerland-Die-kahlen-Baeume-Baeume-spiegeln-sich-im-Buescher-Buescher-Weiher-und-der-Himmel-ist-grau-Herbst-im-Siegerland-am-04-12-2025-in-Freudenberg-Deutschland.jpg,2025-12-04T14:00:29Z,,"Ein graues zweites Adventswochenende erwartet Deutschland. (Foto: picture alliance / Rene Traut Fotografie)
Der Winter zieht neue Seiten auf: Anstatt Schnee und Glätte gibt es irgendwas zwischen Frü… [+4006 chars]",,de,'Frost'
https://www.zeit.de/politik/ausland/2025-12/tuerkei-russland-gas-lieferungen-energiequellen-abhaengigkeit,https://www.zeit.de/politik/ausland/2025-12/tuerkei-russland-gas-lieferungen-energiequellen-abhaengigkeit,0,www.zeit.de,Bis Ende 2026: Türkei verlängert Gasverträge mit Russland um ein Jahr,"Die Türkei will ihre Energiequellen diversifieren, um unabhängiger von Russland zu werden. Dennoch bezieht sie von dort weiterhin Gas.",https://img.zeit.de/administratives/sharing/fallback-image-die-zeit/wide__1300x731,2025-12-04T15:49:12Z,,"Die Türkei hat 
zwei auslaufende Verträge über die Einfuhr russischen Gases verlängert. Wie der stellvertretende Energieminister Ahmet Berat Conkar vor Journalisten in Ankara sagte, liefen die Vertr… [+713 chars]",,de,'Gas'
https://www.jungewelt.de/artikel/513463.schneekönigin-des-tages-katherina-reiche.html,https://www.jungewelt.de/artikel/513463.schneekönigin-des-tages-katherina-reiche.html,0,www.jungewelt.de,Porträt: Schneekönigin des Tages: Katherina Reiche,"Im Selbstbedienungsladen namens Staat kann man besonders lukrativ abstauben, wenn die Temperaturen unter Null liegen. Das hat Katherina Reiche in ihrer Karriere längst verinnerlicht.",https://www.jungewelt.de/img/1100/216419.jpg,2025-12-04T18:38:41Z,,"Wenn Katherina Reiche vor die Kameras tritt, erinnert das stets an den Auftritt der Schneekönigin aus dem gleichnamigen sowjetischen Film von 1967. Grusel pur, nicht nur für Kinder. Um die Wirtschaft… [+1656 chars]",,de,'Schnee'
https://t3n.de/news/gasversorgung-in-deutschland-1711690/,https://t3n.de/news/gasversorgung-in-deutschland-1711690/,0,t3n.de,Wie steht es um die Gasversorgung in Deutschland? Die wichtigsten Fragen beantwortet,"Die aktuelle Heizperiode rückt den Blick auf die Energieversorgung in Deutschland in den Fokus. Wir klären die wichtigsten Fragen zum Gasverbrauch, zu Kosten und zu Alternativen.weiterlesen auf t3n.de",https://cdn.t3n.de/news/wp-content/uploads/2024/12/shutterstock_2518184145.jpg?class=content,2025-12-05T10:55:00Z,,"Zunächst eine gute Nachricht: Gasmangel wird es in diesem Winter wohl nicht geben. Die Bundesnetzagentur schätzt die Gasversorgung in Deutschland als stabil ein, mahnt aber, dass ein sparsamer Gasver… [+6965 chars]",,de,'Gas'
https://salzburg.orf.at/stories/3332941/,https://salzburg.orf.at/stories/3332941/,0,salzburg.orf.at,Weihnachtsfeiern: Firmen setzen Sparstift an,"Salzburgs Unternehmen feiern Weihnachten deutlich sparsamer als früher. Zwar sei die Zahl der Feiern unverändert, pro Mitarbeiter werde aber deutlich weniger Geld ausgegeben und die Firmenräumlichkeiten ersetzen häufig den Gasthausbesuch, beobachten heimische…",https://ibs.orf.at/sbg?image=https%3A%2F%2Foekastatic.orf.at%2Fmims%2F2025%2F49%2F11%2Fcrops%2Fw%3D1200%2Ch%3D627%2Cq%3D75%2F2857557_master_1103511_feier1.jpg%3Fs%3D098ed2b5240f065cc3c51ba26ce5d55a8594a72d,2025-12-05T17:00:00Z,,"Das Weihnachtsgeschäft ist neben der Festspielzeit das Wichtigste im Jahr und dabei verändere sich das Konsumverhalten deutlich, sagt der Gastronom und Spartenobmann für Tourismus und Freizeitwirtsch… [+1910 chars]",,de,'Gas'
https://www.welt.de/wirtschaft/plus6932afc0f4bf598c0697abc4/gas-von-milei-statt-von-putin-dieser-gas-coup-wird-zur-chance-fuer-argentinien.html,https://www.welt.de/wirtschaft/plus6932afc0f4bf598c0697abc4/gas-von-milei-statt-von-putin-dieser-gas-coup-wird-zur-chance-fuer-argentinien.html,0,www.welt.de,Gas von Milei statt von Putin – Dieser „Tote Kuh“-Coup wird zur Chance für Argentinien,Europa strebt nach Energie-Unabhängigkeit von Russland. Für Ersatz soll unter anderem ab 2027 Flüssiggas aus Argentinien sorgen. Der Deal stärkt nicht nur die Energiesicherheit Europas – sondern könnte auch Mileis Wachstumsplan nachhaltig stärken.,https://images.welt.de/6932afc0f4bf598c0697abc4/10452069ad54c68eb9165e4ab0ed6617/ci16x9-w1200/gettyimages-2159625529-jpg,2025-12-05T17:51:29Z,,Die WELT als ePaper: Die vollständige Ausgabe steht Ihnen bereits am Vorabend zur Verfügung so sind Sie immer hochaktuell informiert. Weitere Informationen https://epaper.welt.de,,de,'Gas'
https://www.zeit.de/news/2025-12/05/gasaustritt-in-rheinhessen-explosionsfaehiges-gemisch,https://www.zeit.de/news/2025-12/05/gasaustritt-in-rheinhessen-explosionsfaehiges-gemisch,0,www.zeit.de,"Mehrere Haushalte ohne Gas: Gasaustritt in Rheinhessen - ""Explosionsfähiges Gemisch""","Hier finden Sie Informationen zu dem Thema „Mehrere Haushalte ohne Gas“. Lesen Sie jetzt „Gasaustritt in Rheinhessen - ""Explosionsfähiges Gemisch""“.",https://img.zeit.de/news/2025-12/05/gasaustritt-in-rheinhessen-explosionsfaehiges-gemisch-image-group/wide__1300x731,2025-12-05T19:12:21Z,,"In Schwabenheim an der Selz (Rheinhessen) ist die Feuerwehr wegen eines Gasaustritts im Einsatz. «Beim Eintreffen der ersten Kräfte hat sich die Gasausströmung bestätigt», sagte ein Verwaltungssprech… [+949 chars]",,de,'Gas'
https://www.stern.de/gesellschaft/regional/rheinland-pfalz-saarland/mehrere-haushalte-ohne-gas--gasaustritt-in-rheinhessen----explosionsfaehiges-gemisch--36933874.html,https://www.stern.de/gesellschaft/regional/rheinland-pfalz-saarland/mehrere-haushalte-ohne-gas--gasaustritt-in-rheinhessen----explosionsfaehiges-gemisch--36933874.html,0,www.stern.de,"Mehrere Haushalte ohne Gas: Gasaustritt in Rheinhessen - ""Explosionsfähiges Gemisch""",Schwabenheim an der Selz (lrs) - In Schwabenheim an der Selz (Rheinhessen) ist die Feuerwehr wegen eines Gasaustritts im Einsatz. «Beim Eintreffen der,https://image.stern.de/36933876/t/YA/v1/w1440/r1.7778/-/05--l6iuh5e5h5v8axs2048jpeg---4053f38bcb79efea.jpg,2025-12-05T19:12:21Z,,"Kopiere den aktuellen Link
Zur Merkliste hinzufügen
Die Feuerwehr ist in einem Wohngebiet im Einsatz. Ein Sprecher nennt die Gefahr am Abend ""rückläufig"". Aber Entwarnung will er nicht geben.
In S… [+1104 chars]",,de,'Gas'
https://www.stern.de/gesellschaft/regional/rheinland-pfalz-saarland/mehrere-haushalte-ohne-gas--gasaustritt-in-rheinhessen--gemisch-nicht-explosionsfaehig-36933874.html,https://www.stern.de/gesellschaft/regional/rheinland-pfalz-saarland/mehrere-haushalte-ohne-gas--gasaustritt-in-rheinhessen--gemisch-nicht-explosionsfaehig-36933874.html,0,www.stern.de,Mehrere Haushalte ohne Gas: Gasaustritt in Rheinhessen: Gemisch nicht explosionsfähig,"Die Feuerwehr ist in einem Wohngebiet im Einsatz. Ein Sprecher nennt die Gefahr am späten Abend ""rückläufig"". Komplette Entwarnung gibt er noch nicht.",https://image.stern.de/36933876/t/IW/v2/w1440/r1.7778/-/05--l6iuh5e5h5v8axs2048jpeg---4053f38bcb79efea.jpg,2025-12-05T21:00:38Z,,"Kopiere den aktuellen Link
Zur Merkliste hinzufügen
Die Feuerwehr ist in einem Wohngebiet im Einsatz. Ein Sprecher nennt die Gefahr am späten Abend ""rückläufig"". Komplette Entwarnung gibt er noch n… [+1191 chars]",,de,'Gas'
https://www.freitag.de/autoren/eprudlik/winterblues-alles-dunkel-bringt-es-wirklich-was-vitamin-d-zu-nehmen,https://www.freitag.de/autoren/eprudlik/winterblues-alles-dunkel-bringt-es-wirklich-was-vitamin-d-zu-nehmen,0,www.freitag.de,"Winterblues, alles dunkel: Bringt es wirklich was, Vitamin D zu nehmen?","Es wird dunkel, unsere Autorin wird müde und fragt: Muss sie jetzt Vitamin D nehmen? Während ihrer Recherche trifft sie auf viele Tipps und verschiedene Glaubensarten. Was Vitamin D angeht, gibt es Wichtiges zu beachten Grau in Grau, mit einem Hauch Dunkelgra…",https://www.freitag.de/autoren/eprudlik/winterblues-alles-dunkel-bringt-es-wirklich-was-vitamin-d-zu-nehmen/@@images/image/great,2025-12-06T03:00:00Z,,"Grau in Grau, mit einem Hauch Dunkelgrau, das sehe ich, wenn ich aus dem Fenster schaue. Gebückte Gestalten auf der Straße, die im Schnellschritt aneinander vorbeihuschen, die Kapuzen tief in die Ges… [+10046 chars]",,de,'Winter'
https://www.tagesspiegel.de/berlin/regnerisches-nikolauswochenende-die-sonne-hat-in-berlin-derzeit-kaum-eine-chance-15025007.html,https://www.tagesspiegel.de/berlin/regnerisches-nikolauswochenende-die-sonne-hat-in-berlin-derzeit-kaum-eine-chance-15025007.html,0,www.tagesspiegel.de,Regnerisches Nikolauswochenende: Die Sonne hat in Berlin derzeit kaum eine Chance,"In Berlin und Brandenburg dominieren am Wochenende Regen, Frost und dichter Nebel. In der neuen Woche wird es in der Hauptstadtregion deutlich wärmer.",https://www.tagesspiegel.de/images/15025006/alternates/BASE_16_9_W1400/1765003329000/morgenstimmung-in-brandenburg.jpeg,2025-12-06T06:42:09Z,,Das Nikolaus-Wochenende bringt Berlin und Brandenburg wechselhaftes und zunehmend milderes Wetter. In den Morgenstunden dominieren laut Deutschem Wetterdienst (DWD) noch Frost mit Glätte und dichtem … [+992 chars],,de,'Frost'
https://www.urlaubspiraten.de/pauschalreisen/citytrip-reykjavik,https://www.urlaubspiraten.de/pauschalreisen/citytrip-reykjavik,0,www.urlaubspiraten.de,Auf Island im Whirlpool chillen & Polarlichter bestaunen ,"Ein Kurztrip nach Island lohnt sich, vor allem wenn man in futuristischen Pods übernachtet und High-Class Gemeinschaftsbädern (wie im Spa) und einen Whirlpool nutzen kann, von dem man aus im Winter die Polarlichter beobachten kann! Auf nach Island: 4 Nächte…",https://image.urlaubspiraten.de/720/image/upload/v1764846995/Impressions%20and%20Other%20Assets/6311251382_1_mkx057.png,2025-12-06T09:30:00Z,,"Ein Kurztrip nach Island lohnt sich, vor allem wenn man in futuristischen Pods übernachtet und High-Class Gemeinschaftsbädern (wie im Spa) und einen Whirlpool nutzen kann, von dem man aus im Winter d… [+346 chars]",,de,'Winter'
https://www.zeit.de/zeit-magazin/2025/52/huehnersuppe-suppengemuese-suppennudeln-rezept-wochenmarkt,https://www.zeit.de/zeit-magazin/2025/52/huehnersuppe-suppengemuese-suppennudeln-rezept-wochenmarkt,0,www.zeit.de,Cremige Hühnersuppe: Dafür wurde der Winter erfunden,"Eine Suppe, so gut, dass man sich kälteste Tage wünscht, um sie zu kochen: eine cremige, dampfende Köstlichkeit mit Huhn. Und Sahne! Keine Sorge, Gemüse ist auch drin.",https://img.zeit.de/zeit-magazin/2025/52/dafuer-wurde-der-winter-erfunden-bild-1/wide__1300x731,2025-12-06T09:44:00Z,,"Manche Warnungen vor hochverarbeiteten Lebensmitteln lesen sich irgendwie einladend: Die Mischung aus Fett und Salz aktiviere das Belohnungssystem im Gehirn, die softe Textur verlange wenig Kauarbeit… [+883 chars]",,de,'Winter'
https://www.brigitte.de/rezepte/nostalgisches-winter-soulfood--rezept-fuer-cremige-alpen-makkaroni-13144144.html,https://www.brigitte.de/rezepte/nostalgisches-winter-soulfood--rezept-fuer-cremige-alpen-makkaroni-13144144.html,0,www.brigitte.de,Winter-Rezept: Rezept für cremige Alpen-Makkaroni,"Du vermisst die Berge? Wer auch zu Hause nicht auf das gemütliche Hütten-Gefühl verzichten möchte, sollte dieses leckere Alpen-Rezept ausprobieren.",https://image.brigitte.de/13144124/t/OA/v4/w1440/r1.7778/-/shutterstock-1642566850.jpg,2025-12-06T10:00:00Z,,"Sich nach dem Skifahren in einer gemütlichen Hütte aufzuwärmen und mit leckerem Essen zu stärken, ist ein echter Winterurlaub-Glücksmoment  den du auch zu Hause kreieren kannst.
Äplermagronen, auch … [+263 chars]",,de,'Winter'
