index,url,valid,domain,title,description,image,published,archive,content,quote,language,keyword
https://www.morgenpost.de/ratgeber-wissen/article404280929/heizung-brennwert-heizoel-heizkessel.html,https://www.morgenpost.de/ratgeber-wissen/article404280929/heizung-brennwert-heizoel-heizkessel.html,0,www.morgenpost.de,Austausch nötig? So effizient arbeitet eine Brennwertheizung,"Nicht jede Heizung mit Gas oder Öl läuft ineffizient. Dazu zählt die Brennwertheizung, die auch nicht unter die Austauschpflicht fällt.",https://img.sparknews.funkemedien.de/402748043/402748043_1684188784_v16_9_1600.jpeg,2025-05-06T19:00:00Z,,"Nicht jede Heizung mit Gas oder Öl läuft ineffizient. Dazu zählt die Brennwertheizung, die auch nicht unter die Austauschpflicht fällt.
<ul><li>Eine Heizung mit Brennwerttechnik ist nicht von der Au… [+5189 chars]",,de,'Heizen'
https://www.zeit.de/news/2025-05/07/zwei-menschen-sterben-bei-gasaustritt-in-wohnhaus-in-hoexter,https://www.zeit.de/news/2025-05/07/zwei-menschen-sterben-bei-gasaustritt-in-wohnhaus-in-hoexter,0,www.zeit.de,Notfälle: Zwei Menschen sterben bei Gasaustritt in Wohnhaus in Höxter,Hier finden Sie Informationen zu dem Thema „Notfälle“. Lesen Sie jetzt „Zwei Menschen sterben bei Gasaustritt in Wohnhaus in Höxter“.,https://img.zeit.de/news/2025-05/07/zwei-menschen-sterben-bei-gasaustritt-in-wohnhaus-in-hoexter-image-group/wide__1300x731,2025-05-07T07:16:29Z,https://web.archive.org/web/20250508125429/https://www.zeit.de/news/2025-05/07/zwei-menschen-sterben-bei-gasaustritt-in-wohnhaus-in-hoexter,"Zwei junge Menschen sind in Höxter bei einem nächtlichen Austritt von Gas in einem Wohnhaus ums Leben gekommen. Es handele sich um eine 19 Jahre alte Frau und einen 23 Jahre alten Mann, teilte ein Po… [+558 chars]",,de,'Gas'
https://versicherungswirtschaft-heute.de/unternehmen-und-management/2025-05-07/urgewald-die-allianz-muss-sich-ehrlich-machen-und-geschaefte-mit-gasinfrastruktur-beenden/,https://versicherungswirtschaft-heute.de/unternehmen-und-management/2025-05-07/urgewald-die-allianz-muss-sich-ehrlich-machen-und-geschaefte-mit-gasinfrastruktur-beenden/,0,versicherungswirtschaft-heute.de,Urgewald: „Die Allianz muss sich ehrlich machen und Geschäfte mit Gasinfrastruktur beenden“,Die Umweltschützer von Urgewald werfen den führenden deutschen Versicherungskonzernen Doppelmoral im Hinblick auf ihre Klimapolitik vor. Vor der Hauptversammlung der Munich Re Ende April kritisierte die Organisation bereits den Umgang des Rückversicherers mit…,https://versicherungswirtschaft-heute.de/wp-60d20-content/uploads/2022/10/demonstration-klima-protest.jpg,2025-05-07T10:50:09Z,,Die Umweltschützer von Urgewald werfen den führenden deutschen Versicherungskonzernen Doppelmoral im Hinblick auf ihre Klimapolitik vor. Vor der Hauptversammlung der Munich Re Ende April kritisierte … [+368 chars],,de,'Heizen'
https://www.stern.de/news/umfrage--1-8-millionen-menschen-haben-wegen-hoher-heizkosten-im-winter-gefroren-35701874.html,https://www.stern.de/news/umfrage--1-8-millionen-menschen-haben-wegen-hoher-heizkosten-im-winter-gefroren-35701874.html,0,www.stern.de,"Umfrage: 1,8 Millionen Menschen haben wegen hoher Heizkosten im Winter gefroren","In Deutschland haben einer Umfrage zufolge 1,8 Millionen Menschen (drei Prozent) im vergangenen Winter so stark Heizkosten gespart, dass sie regelmäßig gefroren haben. Besonders häufig waren Menschen mit Gasheizung davon betroffen, wie das Heidelberger Vergle…",https://image.stern.de/35701876/t/ia/v1/w1440/r1.7778/-/07--heizkoerper---eb8c41f51b04b04b.jpg,2025-05-07T10:58:45Z,,"Kopiere den aktuellen Link
Zur Merkliste hinzufügen
In Deutschland haben einer Umfrage zufolge 1,8 Millionen Menschen (drei Prozent) im vergangenen Winter so stark Heizkosten gespart, dass sie rege… [+875 chars]",,de,'Gas'
https://www.n-tv.de/auto/Kein-einziger-Offroad-Reifen-kann-ueberzeugen-article25751190.html,https://www.n-tv.de/auto/Kein-einziger-Offroad-Reifen-kann-ueberzeugen-article25751190.html,0,www.n-tv.de,All-Terrain-Reifen im ADAC-Test: Kein einziger Offroad-Reifen kann überzeugen,"Der ADAC hat acht All-Terrain-Reifen einem Vergleichstest unterzogen und zusätzlich einem Pkw-Ganzjahresreifen mit Schneeflockensymbol gegenübergestellt. Das Ergebnis fällt für die AT-Reifen ernüchternd aus: Keiner der Geländereifen erreicht die Note ""gut"".",https://www.n-tv.de/img/incoming/crop25747482/6541329292-cImg_16_9-w1200/Der-ADAC-hat-acht-Offroad-Reifen-unter-die-Lupe-genommen.jpg,2025-05-07T11:01:41Z,https://web.archive.org/web/20250507141006/https://www.n-tv.de/auto/Kein-einziger-Offroad-Reifen-kann-ueberzeugen-article25751190.html,Der ADAC hat acht All-Terrain-Reifen einem Vergleichstest unterzogen und zusätzlich einem Pkw-Ganzjahresreifen mit Schneeflockensymbol gegenübergestellt. Das Ergebnis fällt für die AT-Reifen ernüchte… [+2424 chars],,de,'Reif'
https://www.stern.de/gesellschaft/regional/hessen/agrar--erdbeebauern-setzen-auf-gute-saison---ernte-angelaufen-35702284.html,https://www.stern.de/gesellschaft/regional/hessen/agrar--erdbeebauern-setzen-auf-gute-saison---ernte-angelaufen-35702284.html,0,www.stern.de,Agrar: Erdbeebauern setzen auf gute Saison - Ernte angelaufen,Süße Erdbeeren aus der Region sind jetzt wieder vielerorts an Ständen und in Supermärkten zu haben. Wenig Frost und zuletzt auch viel Sonne stimmt die Erdbeerbauern optimistisch.,https://image.stern.de/35702286/t/_S/v1/w1440/r1.7778/-/07--f5to4gulxjv9axs2048jpeg---7f4d376e8ca9f395.jpg,2025-05-07T12:19:13Z,https://web.archive.org/web/20250508182716/https://www.stern.de/gesellschaft/regional/hessen/agrar--erdbeebauern-setzen-auf-gute-saison---ernte-angelaufen-35702284.html,"Kopiere den aktuellen Link
Zur Merkliste hinzufügen
Süße Erdbeeren aus der Region sind jetzt wieder vielerorts an Ständen und in Supermärkten zu haben. Wenig Frost und zuletzt auch viel Sonne stimm… [+3339 chars]",,de,'Frost'
https://www.stern.de/gesellschaft/regional/rheinland-pfalz-saarland/fruehlingswetter--sonniges-wochenende-und-auch-frost-erwartet-35704332.html,https://www.stern.de/gesellschaft/regional/rheinland-pfalz-saarland/fruehlingswetter--sonniges-wochenende-und-auch-frost-erwartet-35704332.html,0,www.stern.de,Frühlingswetter: Sonniges Wochenende und auch Frost erwartet,Mainz (lrs) - Zum Ende der Woche dürfen sich die Menschen in Rheinland-Pfalz und im Saarland auf sonniges Wetter freuen. Wie der Deutsche Wetterdienst,https://image.stern.de/35704334/t/_B/v1/w1440/r1.7778/-/08--ty6u3y5g7pv7axs2048jpeg---b18b3f886d7e3a75.jpg,2025-05-08T05:42:37Z,https://web.archive.org/web/20250508064644/https://www.stern.de/gesellschaft/regional/rheinland-pfalz-saarland/fruehlingswetter--sonniges-wochenende-und-auch-frost-erwartet-35704332.html,"Kopiere den aktuellen Link
Zur Merkliste hinzufügen
Die nächsten Tage wird es sonnig in Rheinland-Pfalz und im Saarland. Die Temperaturen steigen kontinuierlich bis 25 Grad am Sonntag.
Zum Ende de… [+931 chars]",,de,'Frost'
https://www.diepresse.com/19660142/kommt-zu-den-eisheiligen-immer-frost,https://www.diepresse.com/19660142/kommt-zu-den-eisheiligen-immer-frost,0,www.diepresse.com,Kommt zu den Eisheiligen immer Frost?,"Es ist nicht typisch für den Zeitraum vom 12. bis zum 15. Mai, dass es zu Bodenfrost kommt. Das ergab eine Auswertung der Geosphere der vergangenen 80 Jahre. Trotzdem ist es ratsam, empfindliche Pflanzen erst nach den Eisheiligen zu pflanzen.",https://img.diepresse.com/public/incoming/j15hxt-imago-images-0807329256/alternates/DPR_SOCIAL_NACHRICHTEN/imago%20images%200807329256,2025-05-08T07:58:45Z,,"Es ist nicht typisch für den Zeitraum vom 12. bis zum 15. Mai, dass es zu Bodenfrost kommt. Das ergab eine Auswertung der Geosphere der vergangenen 80Jahre. Trotzdem ist es ratsam, empfindliche Pflan… [+3183 chars]",,de,'Eis'
https://www.bild.de/sport/fussball/es-reizt-mich-auf-jeden-fall-dieser-wirtz-satz-heizt-die-wechsel-geruechte-an-681c6331a81ba818d8fa5c39,https://www.bild.de/sport/fussball/es-reizt-mich-auf-jeden-fall-dieser-wirtz-satz-heizt-die-wechsel-geruechte-an-681c6331a81ba818d8fa5c39,0,www.bild.de,„Es reizt mich auf jeden Fall ...“ - Dieser Wirtz-Satz heizt die Wechsel-Gerüchte an!,Was Insider Marcel Reif zwischen seinen Eltern und den Bossen beobachtet hat.,"https://images.bild.de/681c6331a81ba818d8fa5c39/9e76c1446aa70a4e2fd54d9605da734b,a0747754?w=1280",2025-05-08T09:27:17Z,https://web.archive.org/web/20250508103501/http://www.bild.de/sport/fussball/es-reizt-mich-auf-jeden-fall-dieser-wirtz-satz-heizt-die-wechsel-geruechte-an-681c6331a81ba818d8fa5c39,"Sie zählten gerade die Tageseinnahmen: Verkäufer bei New Yorker ersticht Chefin
Sie zählten gerade die Tageseinnahmen: Verkäufer bei New Yorker ersticht Chefin
Sie zählten gerade die Tageseinnahmen… [+608 chars]",,de,'Reif'
https://www.bild.de/sport/fussball/wegen-piranha-berater-was-reif-ueber-den-sane-poker-hoert-681c62f6a81ba818d8fa5c2b,https://www.bild.de/sport/fussball/wegen-piranha-berater-was-reif-ueber-den-sane-poker-hoert-681c62f6a81ba818d8fa5c2b,0,www.bild.de,Wegen „Piranha“-Berater - Was Reif über den Sané-Poker hört,Was der Berater-Wechsel von Leroy Sané bedeutet.,"https://images.bild.de/681c62f6a81ba818d8fa5c2b/1f43685250fa511a20fcca368dc8dc13-landscape,e65b5885?w=1280",2025-05-08T09:34:39Z,https://web.archive.org/web/20250508111823/https://www.bild.de/sport/fussball/wegen-piranha-berater-was-reif-ueber-den-sane-poker-hoert-681c62f6a81ba818d8fa5c2b,"Sie zählten gerade die Tageseinnahmen: Verkäufer bei New Yorker ersticht Chefin
Sie zählten gerade die Tageseinnahmen: Verkäufer bei New Yorker ersticht Chefin
Sie zählten gerade die Tageseinnahmen… [+608 chars]",,de,'Reif'
https://www.welt.de/sport/fussball/bundesliga/bayer-leverkusen/video256086682/Reizt-mich-auf-jeden-Fall-Pikantes-Wirtz-Interview-heizt-Geruechtekueche-weiter-an.html,https://www.welt.de/sport/fussball/bundesliga/bayer-leverkusen/video256086682/Reizt-mich-auf-jeden-Fall-Pikantes-Wirtz-Interview-heizt-Geruechtekueche-weiter-an.html,0,www.welt.de,Pikantes Wirtz-Interview heizt Gerüchteküche weiter an,"Im Poker um die Zukunft von Florian Wirtz sorgt ein Interview des Leverkusen-Stars für neuen Gesprächsstoff. Es reize Wirtz, seine „Komfortzone zu verlassen“. Marcel Reif glaubt, dass die Entscheidung bereits gefallen ist.",https://img.welt.de/img/sport/fussball/bundesliga/bayer-leverkusen/mobile256086712/8367936607-ci16x9-w1200/SC-Freiburg-Bayer-Leverkusen.jpg,2025-05-08T10:04:31Z,,"Im Poker um die Zukunft von Florian Wirtz sorgt ein Interview des Leverkusen-Stars für neuen Gesprächsstoff. Es reize Wirtz, seine Komfortzone zu verlassen. Marcel Reif glaubt, dass die Entscheidung … [+80 chars]",,de,'Reif'
https://www.sueddeutsche.de/bayern/bayern-wetter-neuschnee-alpen-sonne-li.3249301,https://www.sueddeutsche.de/bayern/bayern-wetter-neuschnee-alpen-sonne-li.3249301,0,www.sueddeutsche.de,Wetter in Bayern: Aprilwetter im Mai - Neuschnee in den Bergen,"In den höheren Lagen der Alpen kann es weiteren Schnee geben, überwiegend wird es zum Muttertagswochenende aber schön und wieder wärmer im Freistaat.",https://www.sueddeutsche.de/2025/05/08/b804bf23-e1db-429a-93a9-215a7f36773d.jpeg?q=60&fm=webp&width=1200&rect=0%2C149%2C3000%2C1687,2025-05-08T10:42:33Z,https://web.archive.org/web/20250508122742/https://www.sueddeutsche.de/bayern/bayern-wetter-neuschnee-alpen-sonne-li.3249301,"Am Wochenende können sich die Menschen in Bayern dann aber auf viel Sonne einstellen, am Samstag an den Alpen mit vereinzelten Schauern und Gewittern. Die Temperaturen steigen am Wochenende auf bis z… [+303 chars]",,de,'Schnee'
https://www.bild.de/sport/fussball/champions-league-spektakel-jetzt-hier-reif-ist-live-gucken-681bac836255e217f6c20926,https://www.bild.de/sport/fussball/champions-league-spektakel-jetzt-hier-reif-ist-live-gucken-681bac836255e217f6c20926,0,www.bild.de,Reif ist live vom 08.05. - Das Champions-League-Spektakel,"„Reif ist live“, der BILD-Talk mit Kommentatoren-Legende Marcel Reif.","https://images.bild.de/681bac836255e217f6c20926/3a24b6f1dc9de4b2c3787a465f58ae7a,4de5212?w=1280",2025-05-08T10:51:34Z,https://web.archive.org/web/20250508080804/https://www.bild.de/sport/fussball/champions-league-spektakel-jetzt-hier-reif-ist-live-gucken-681bac836255e217f6c20926,"Aus verfahrenstaktischen Gründen: Verfassungsschutz legt AfD-Hochstufung als rechtsextrem zunächst auf Eis
Aus verfahrenstaktischen Gründen: Verfassungsschutz legt AfD-Hochstufung als rechtsextrem z… [+878 chars]",,de,'Reif'
https://tirol.orf.at/stories/3304600/,https://tirol.orf.at/stories/3304600/,0,tirol.orf.at,Schafrisse im Ötztal – Hinweise auf Bär,"In einem Almgebiet der Ötztaler Gemeinde Umhausen sind am Donnerstag Bärenspuren im Schnee entdeckt worden, zudem wurden zwei tote Schafe und zwei tote Lämmer entdeckt. Der Amtstierarzt ging von Rissen durch einen Bären aus. Erst in der Vorwoche war ein Bär a…",https://ibs.orf.at/tir?image=https%3A%2F%2Foekastatic.orf.at%2Fmims%2F2025%2F19%2F56%2Fcrops%2Fw%3D1200%2Ch%3D627%2Cq%3D75%2F2618078_master_1005356_baer2.jpg%3Fs%3D8ccec853f5f6b5dc939cb83a320180c790f45e5d,2025-05-08T18:00:36Z,https://web.archive.org/web/20250508231731/https://tirol.orf.at/stories/3304600/,"Wie das Land Tirol in einer Aussendung mitteilte, gehe man jedenfalls von einer Bärenpräsenz im Gemeindegebiet von Umhausen aus. Die Gemeinde hatte die Bevölkerung bereits informiert. Demnach entdeck… [+1177 chars]",,de,'Schnee'
https://www.stern.de/gesellschaft/regional/berlin-brandenburg/wetter--tagsueber-bis-zu-20-grad--nachts-vereinzelt-frost-35707748.html,https://www.stern.de/gesellschaft/regional/berlin-brandenburg/wetter--tagsueber-bis-zu-20-grad--nachts-vereinzelt-frost-35707748.html,0,www.stern.de,"Wetter: Tagsüber bis zu 20 Grad, nachts vereinzelt Frost","Während die Temperaturen tagsüber auf maximal 20 Grad steigen, kühlt es nachts deutlich ab. Für Gärtnerinnen und Gärtner heißt das: Frost ist möglich.",https://image.stern.de/35707750/t/sR/v1/w1440/r1.7778/-/09--f3nzbibtlnv4axs2048jpeg---e6f86b2d3053f7bb.jpg,2025-05-09T04:09:44Z,,"Kopiere den aktuellen Link
Zur Merkliste hinzufügen
Während die Temperaturen tagsüber auf maximal 20 Grad steigen, kühlt es nachts deutlich ab. Für Gärtnerinnen und Gärtner heißt das: Frost ist mög… [+889 chars]",,de,'Frost'
https://www.tagesspiegel.de/berlin/wetter-tagsuber-bis-zu-20-grad-nachts-vereinzelt-frost-13662628.html,https://www.tagesspiegel.de/berlin/wetter-tagsuber-bis-zu-20-grad-nachts-vereinzelt-frost-13662628.html,0,www.tagesspiegel.de,"Wetter: Tagsüber bis zu 20 Grad, nachts vereinzelt Frost","Während die Temperaturen tagsüber auf maximal 20 Grad steigen, kühlt es nachts deutlich ab. Für Gärtnerinnen und Gärtner heißt das: Frost ist möglich.",https://www.tagesspiegel.de/images/13662625/alternates/BASE_16_9_W1400/1746763853000/frost-in-sudbrandenburg.jpeg,2025-05-09T04:10:53Z,,"Nach einem frostigen Morgen wird der Freitag in Berlin und Brandenburg heiter. In den Morgenstunden kommt es stellenweise zu Minusgraden, später steigen die Temperaturen auf maximal 17 bis 20 Grad, w… [+1446 chars]",,de,'Frost'
https://www.n-tv.de/politik/500-000-Migranten-mit-Aufenthaltsrecht-Trump-zieht-vor-Supreme-Court-article25756174.html,https://www.n-tv.de/politik/500-000-Migranten-mit-Aufenthaltsrecht-Trump-zieht-vor-Supreme-Court-article25756174.html,0,www.n-tv.de,"""Eingriff in Vorrechte"": 500.000 Migranten mit Aufenthaltsrecht - Trump zieht vor Supreme Court",Die US-Regierung entzieht hunderttausenden Menschen aus Südamerika ihren humanitären Schutz. Eine Bundesrichterin legt das Vorgehen auf Eis. Doch Präsident Trump gibt sich nicht geschlagen.,https://www.n-tv.de/img/incoming/crop25756205/0231325119-cImg_16_9-w1200/eaeeb8f48dd3f9b9c038219f48430c6a.jpg,2025-05-09T05:36:30Z,https://web.archive.org/web/20250509071328/https://www.n-tv.de/politik/500-000-Migranten-mit-Aufenthaltsrecht-Trump-zieht-vor-Supreme-Court-article25756174.html,"Die US-Regierung entzieht hunderttausenden Menschen aus Südamerika ihren humanitären Schutz. Eine Bundesrichterin legt das Vorgehen auf Eis. Doch Präsident Trump gibt sich nicht geschlagen.
Bei ihre… [+2425 chars]",,de,'Eis'
https://sport.orf.at/stories/3141053/,https://sport.orf.at/stories/3141053/,0,sport.orf.at,Prager Märchen als Vorbild und Mahnung,"Österreich und Finnland wird am Freitag (16.20 Uhr, live in ORF1) die Ehre zuteil, die 88. Weltmeisterschaft im Eishockey zu eröffnen. Bei der WM 2024 in Prag war der historische 3:2-Erfolg über die „Leijonat“ einer der Höhepunkte der erfolgreichsten Titelkäm…",https://ibs.orf.at/sport?image=https%3A%2F%2Fassets.orf.at%2Fmims%2F2025%2F19%2F06%2Fcrops%2Fw%3D1200%2Ch%3D630%2Cq%3D75%2F2617952_master_1005306_eishockey_wm_2025_vor_aut_fin2_g.jpg%3Fs%3D51b344c4a46edf3a1e1b1f72608b1eb56967443c,2025-05-09T07:30:06Z,,Die Auftaktpartie in der im Volksmund Globen genannten Arena im Süden der schwedischen Hauptstadt ist für die Burschen von Teamchef Roger Bader gleich ein Rendezvous mit der Vergangenheit. Es waren g… [+6244 chars],,de,'Schnee'
https://www.faz.net/aktuell/wirtschaft/klima-nachhaltigkeit/reiche-will-schnell-neue-gaskraftwerke-110466034.html,https://www.faz.net/aktuell/wirtschaft/klima-nachhaltigkeit/reiche-will-schnell-neue-gaskraftwerke-110466034.html,0,www.faz.net,Reiche will schnell neue Gaskraftwerke,Bei ihrem ersten größeren Auftritt betont die neue Bundeswirtschaftsministerin die Bedeutung von Gas. Sie wolle sich „ehrlich machen“ zum Stand der Energiewende.,https://media0.faz.net/ppmedia/aktuell/politik/3178300444/1.10466050/facebook_teaser/wirtschaftsministerin.jpg,2025-05-09T09:47:51Z,https://web.archive.org/web/20250514045553/https://www.faz.net/aktuell/wirtschaft/klima-nachhaltigkeit/reiche-will-schnell-neue-gaskraftwerke-110466034.html,"Bundeswirtschaftsministerin Katherina Reiche fordert den schnellen Zubau von neuen Gaskraftwerken in Deutschland. Wir brauchen flexible Gaskraftwerke, die dann Strom liefern, wenn der Wind nicht weht… [+2564 chars]",,de,'Gas'
https://www.deutsche-startups.de/2025/05/09/startupticker-bosch-ventures-startup-dictionary-1komma5/,https://www.deutsche-startups.de/2025/05/09/startupticker-bosch-ventures-startup-dictionary-1komma5/,0,www.deutsche-startups.de,#StartupTicker - +++ Bosch Ventures +++ Das große Startup-Dictionary +++ 1Komma5° +++ GoStudent +++ Studienkreis +++,+++ #StartupTicker +++ Bosch Ventures legt neuen Fonds (250 Millionen) auf +++ Jetzt neu: Das große Startup-Dictionary +++ 1Komma5° legt Börsenpläne erst einmal auf Eis +++ GoStudent-Tochter Studienkreis geht auf Expansionskurs +++,https://www.deutsche-startups.de/app/uploads/2024/02/ds-unicorn-baum-ki.jpg,2025-05-09T09:55:34Z,,"Was gibtsNeues? In unserem #StartupTicker liefern wir eine kompakte Übersicht über die wichtigsten Startup-Nachrichten des Tages (Freitag, 9. Mai).
#STARTUPLAND
SAVE THE DATE: Am 5. November findet… [+3302 chars]",,de,'Eis'
https://www.stern.de/gesellschaft/regional/bayern/baerenverdacht--schafrisse-und-spuren-im-schnee--baer-in-tirol-vermutet-35709294.html,https://www.stern.de/gesellschaft/regional/bayern/baerenverdacht--schafrisse-und-spuren-im-schnee--baer-in-tirol-vermutet-35709294.html,0,www.stern.de,Bärenverdacht: Schafrisse und Spuren im Schnee: Bär in Tirol vermutet,Einmal mehr scheint ein Bär im österreichischen Ötztal nicht allzu weit von der bayerischen Grenze unterwegs zu sein. Darauf lassen gerissene Tiere und Spuren schließen.,https://image.stern.de/35709296/t/Ns/v1/w1440/r1.7778/-/09--6je5cbuldlv1axs2048jpeg---33ac04b897928319.jpg,2025-05-09T11:11:12Z,https://web.archive.org/web/20250509115210/https://www.stern.de/gesellschaft/regional/bayern/baerenverdacht--schafrisse-und-spuren-im-schnee--baer-in-tirol-vermutet-35709294.html,"Kopiere den aktuellen Link
Zur Merkliste hinzufügen
Einmal mehr scheint ein Bär im österreichischen Ötztal nicht allzu weit von der bayerischen Grenze unterwegs zu sein. Darauf lassen gerissene Tie… [+1931 chars]",,de,'Schnee'
https://www.zeit.de/news/2025-05/09/schafrisse-und-spuren-im-schnee-baer-in-tirol-vermutet,https://www.zeit.de/news/2025-05/09/schafrisse-und-spuren-im-schnee-baer-in-tirol-vermutet,0,www.zeit.de,Bärenverdacht: Schafrisse und Spuren im Schnee: Bär in Tirol vermutet,Hier finden Sie Informationen zu dem Thema „Bärenverdacht“. Lesen Sie jetzt „Schafrisse und Spuren im Schnee: Bär in Tirol vermutet“.,https://img.zeit.de/news/2025-05/09/schafrisse-und-spuren-im-schnee-baer-in-tirol-vermutet-image-group/wide__1300x731,2025-05-09T11:11:12Z,https://web.archive.org/web/20250511000312/https://www.zeit.de/news/2025-05/09/schafrisse-und-spuren-im-schnee-baer-in-tirol-vermutet,"In einem Almgebiet bei der Gemeinde Umhausen in Tirol, rund 60 Kilometer von der bayerischen Grenze entfernt, sind Bärenspuren im Schnee entdeckt worden. Außerdem wurden zwei tote Schafe sowie zwei t… [+1745 chars]",,de,'Schnee'
https://www.zeit.de/zeit-magazin/2025-05/animal-crossing-videospiel-freizeit-kindheitstraum,https://www.zeit.de/zeit-magazin/2025-05/animal-crossing-videospiel-freizeit-kindheitstraum,0,www.zeit.de,"""Animal Crossing"": Reif für die Insel","Unsere Autorin hat sich einen Wunsch erfüllt, der ihr als Kind verwehrt blieb: eine eigene Insel mit sprechenden Tieren, platzsparend verpackt in einer Spielkonsole.",https://img.zeit.de/zeit-magazin/2025-05/zwe-ode-an-ein-ding-animal-crossing/wide__1300x731,2025-05-09T12:26:44Z,http://archive.md/20250509130632/https://www.zeit.de/zeit-magazin/2025-05/animal-crossing-videospiel-freizeit-kindheitstraum,"Lange gesucht und endlich gefunden: In der Serie ""Ode an ein Ding"" feiern wir jede Woche völlig subjektiv ein Produkt. Dieser Artikel ist Teil von ZEIT am Wochenende, Ausgabe 19/2025.
Ich erinnere m… [+448 chars]",,de,'Reif'
https://www.bild.de/leben-wissen/wohnen-living/frostschutz-fuer-pflanzen-tipps-zum-schutz-waehrend-der-eisheiligen-681894516255e217f6c19051,https://www.bild.de/leben-wissen/wohnen-living/frostschutz-fuer-pflanzen-tipps-zum-schutz-waehrend-der-eisheiligen-681894516255e217f6c19051,0,www.bild.de,11. bis 15. Mai - So schützen Sie Ihre Pflanzen vor den Eisheiligen,"Schützen Sie Ihre Pflanzen vor Frost durch Vlies, Laub und mehr. Die Eisheiligen könnten Frühlingsblumen gefährden.","https://images.bild.de/681894516255e217f6c19051/6e22dc9590a06724997fa2f3e27e1bbb,7fc4612a?w=1280",2025-05-10T05:26:51Z,,"Um den TTS Player darzustellen, brauchen wir deine Zustimmung. 
 externen Inhalt aktivieren Um eingebettete Inhalte anzuzeigen, ist Ihre jederzeit widerrufliche Einwilligung (über den Schalter oder … [+2741 chars]",,de,'Eis'
https://www.bild.de/unterhaltung/stars-und-leute/pamela-reif-so-kam-es-zum-liebes-aus-mit-willi-whey-682040cac956e61cc27b443d,https://www.bild.de/unterhaltung/stars-und-leute/pamela-reif-so-kam-es-zum-liebes-aus-mit-willi-whey-682040cac956e61cc27b443d,0,www.bild.de,"„Brauche jemanden, mit dem ich ...“ - Willi Whey spricht über Liebes-Aus mit Pamela Reif",Sie galten als das Fitness-Traumpaar: Daran scheiterte Pamelas und Willis Beziehung.,"https://images.bild.de/682040cac956e61cc27b443d/a04d19660e2efe1a07b57ff543f23a6b,74ebcbdf?w=1280",2025-05-11T17:40:53Z,http://archive.md/20250511174432/https://www.bild.de/unterhaltung/stars-und-leute/pamela-reif-so-kam-es-zum-liebes-aus-mit-willi-whey-682040cac956e61cc27b443d,"Sie galten als DAS Fitness-Traumpaar Deutschlands ...
Pamela Reif und TikTok-Star Willi Whey teilten gemeinsame Fotos und Videos von der Sonneninsel Ibiza, zeigten sich innig bei Events wie der GLOW… [+188 chars]",,de,'Reif'
https://www.zeit.de/news/2025-05/12/magenprobleme-nach-gaststaettenbesuch-fast-150-betroffene,https://www.zeit.de/news/2025-05/12/magenprobleme-nach-gaststaettenbesuch-fast-150-betroffene,0,www.zeit.de,Gesundheit: Magenprobleme nach Gaststättenbesuch - fast 150 Betroffene,Hier finden Sie Informationen zu dem Thema „Gesundheit“. Lesen Sie jetzt „Magenprobleme nach Gaststättenbesuch - fast 150 Betroffene“.,https://img.zeit.de/news/2025-05/12/magenprobleme-nach-gaststaettenbesuch-fast-150-betroffene-image-group/wide__1300x731,2025-05-12T06:57:21Z,https://web.archive.org/web/20250512124923/https://www.zeit.de/news/2025-05/12/magenprobleme-nach-gaststaettenbesuch-fast-150-betroffene,Nach dem Besuch einer Gaststätte in Schwaben haben sich mindestens 144 Menschen unwohl gefühlt oder von Schwindel oder Magen-Darm-Problemen berichtet. Vermutlich haben sich die Betroffenen mit dem No… [+1469 chars],,de,'Winter'
https://www.bild.de/sport/fussball/es-kann-ja-nur-alles-spricht-fuer-diesen-neuen-mueller-klub-68219a8d9166b6044ba06043,https://www.bild.de/sport/fussball/es-kann-ja-nur-alles-spricht-fuer-diesen-neuen-mueller-klub-68219a8d9166b6044ba06043,0,www.bild.de,„Es kann ja nur …“ - Alles spricht für diesen neuen Müller-Klub,Fußball-Experte Marcel Reif spekuliert über den nächsten Müller-Verein.,"https://images.bild.de/68219a8d9166b6044ba06043/f6bc1b20ee15775c2add3cca8f4ddcdf-landscape,41d45b85?w=1280",2025-05-12T09:52:08Z,https://web.archive.org/web/20250512140919/https://www.bild.de/sport/fussball/es-kann-ja-nur-alles-spricht-fuer-diesen-neuen-mueller-klub-68219a8d9166b6044ba06043,"Mehr zum Video anzeigen 
Fußball-Experte Marcel Reif spekuliert über den nächsten Müller-Verein.
Quelle: BILD12.05.2025 - 11:52 Uhr",,de,'Reif'
