index,url,valid,domain,title,description,image,published,archive,content,quote,language,keyword
https://www.bild.de/sport/fussball/diskussion-um-bayerns-ibiza-trip-will-eberl-nichts-sagen-kann-eberl-nichts-sagen-68219ab49166b6044ba0604b,https://www.bild.de/sport/fussball/diskussion-um-bayerns-ibiza-trip-will-eberl-nichts-sagen-kann-eberl-nichts-sagen-68219ab49166b6044ba0604b,0,www.bild.de,Diskussion um Bayerns Ibiza-Trip - „Will Eberl nichts sagen? Kann Eberl nichts sagen?“,Fußball-Experte Marcel Reif hat eine klare Meinung zur Bayern-Reise.,"https://images.bild.de/68219ab49166b6044ba0604b/540dba44cad2cbcdb990d507ff4cfb10-landscape,3af8d730?w=1280",2025-05-12T09:52:27Z,https://web.archive.org/web/20250512123806/https://www.bild.de/sport/fussball/diskussion-um-bayerns-ibiza-trip-will-eberl-nichts-sagen-kann-eberl-nichts-sagen-68219ab49166b6044ba0604b,"Mehr zum Video anzeigen 
Fußball-Experte Marcel Reif hat eine klare Meinung zur Bayern-Reise.
Quelle: BILD12.05.2025 - 11:52 Uhr",,de,'Reif'
https://www.bild.de/sport/fussball/es-geht-um-den-kleinen-jungen-alonso-foto-ruehrt-marcel-reif-68219b6ff3279f6203e2e31f,https://www.bild.de/sport/fussball/es-geht-um-den-kleinen-jungen-alonso-foto-ruehrt-marcel-reif-68219b6ff3279f6203e2e31f,0,www.bild.de,Es geht um den kleinen Jungen - Alonso-Foto rührt Marcel Reif,Zu diesem Foto hat Fußball-Experte Marcel Reif eine ganz besondere Verbindung.,"https://images.bild.de/68219b6ff3279f6203e2e31f/04aa51af2f19693932079e9671c65b19-landscape,7b04a3ff?w=1280",2025-05-12T09:53:26Z,https://web.archive.org/web/20250512141832/https://www.bild.de/sport/fussball/es-geht-um-den-kleinen-jungen-alonso-foto-ruehrt-marcel-reif-68219b6ff3279f6203e2e31f,"Mehr zum Video anzeigen 
Zu diesem Foto hat Fußball-Experte Marcel Reif eine ganz besondere Verbindung. 
Quelle: BILD12.05.2025 - 11:53 Uhr",,de,'Reif'
https://www.bild.de/sport/fussball/hsv-und-mueller-party-jetzt-hier-reif-ist-live-gucken-6820c5979166b6044ba059d9,https://www.bild.de/sport/fussball/hsv-und-mueller-party-jetzt-hier-reif-ist-live-gucken-6820c5979166b6044ba059d9,0,www.bild.de,"Reif ist live vom 12.05. - Müller-Abschied, Alonso ade & Cl-Kampf","„Reif ist live“, der BILD-Talk mit Kommentatoren-Legende Marcel Reif.","https://images.bild.de/6820c5979166b6044ba059d9/3a24b6f1dc9de4b2c3787a465f58ae7a,4de5212?w=1280",2025-05-12T09:56:20Z,https://web.archive.org/web/20250512080603/https://www.bild.de/sport/fussball/hsv-und-mueller-party-jetzt-hier-reif-ist-live-gucken-6820c5979166b6044ba059d9,"Mehr zum Video anzeigen 
Reif ist live, der BILD-Talk mit Kommentatoren-Legende Marcel Reif.
Quelle: BILD12.05.2025 - 11:56 Uhr",,de,'Reif'
https://www.welt.de/sport/fussball/video256104976/Transfer-fix-In-dem-Zustand-in-dem-Real-ist-Xabi-Alonso-uebernimmt-frueher-als-gedacht.html,https://www.welt.de/sport/fussball/video256104976/Transfer-fix-In-dem-Zustand-in-dem-Real-ist-Xabi-Alonso-uebernimmt-frueher-als-gedacht.html,0,www.welt.de,"„In dem Zustand, in dem Real ist …“ – Xabi Alonso übernimmt früher als gedacht","Der Wechsel von Xabi Alonso von Bayer Leverkusen zu Real Madrid ist fix. Der spanische Trainer soll das kriselnde Team schon zur anstehenden Klub-WM übernehmen. „Perez hat ihm keine Wahl gelassen“, glaubt Marcel Reif.",https://img.welt.de/img/sport/fussball/mobile256104992/4657934587-ci16x9-w1200/FILE-PHOTO-Bundesliga-Bayer-Leverkusen-v-Borussia-Dortmund.jpg,2025-05-12T12:47:37Z,,"Der Wechsel von Xabi Alonso von Bayer Leverkusen zu Real Madrid ist fix. Der spanische Trainer soll das kriselnde Team schon zur anstehenden Klub-WM übernehmen. Perez hat ihm keine Wahl gelassen, gla… [+75 chars]",,de,'Reif'
https://www.welt.de/sport/fussball/bundesliga/fc-bayern-muenchen/video256104960/Nach-Verbot-von-Eberl-Das-ist-nicht-Bayern-wuerdig-Reif-kritisiert-Party-Ausflug-nach-Ibiza.html,https://www.welt.de/sport/fussball/bundesliga/fc-bayern-muenchen/video256104960/Nach-Verbot-von-Eberl-Das-ist-nicht-Bayern-wuerdig-Reif-kritisiert-Party-Ausflug-nach-Ibiza.html,0,www.welt.de,„Das ist nicht Bayern-würdig“ – Reif kritisiert Party-Ausflug nach Ibiza,"Den für die vergangene Woche geplanten Party-Ausflug hatte Max Eberl noch untersagt, nun feiern die Stars des FC Bayern doch auf Ibiza, obwohl die Saison noch nicht beendet ist. Marcel Reif kann die Entscheidung nicht nachvollziehen.",https://img.welt.de/img/sport/fussball/bundesliga/fc-bayern-muenchen/mobile256105058/1767932717-ci16x9-w1200/Image-6821ef403e1ca14e7f761c72.jpg,2025-05-12T12:54:17Z,,"Den für die vergangene Woche geplanten Party-Ausflug hatte Max Eberl noch untersagt, nun feiern die Stars des FC Bayern doch auf Ibiza, obwohl die Saison noch nicht beendet ist. Marcel Reif kann die … [+93 chars]",,de,'Reif'
https://www.welt.de/wirtschaft/article256095052/Erfolgsrezept-Fernwaerme-Wie-eine-Stadt-erfolgreich-die-Waermewende-vorantreibt.html,https://www.welt.de/wirtschaft/article256095052/Erfolgsrezept-Fernwaerme-Wie-eine-Stadt-erfolgreich-die-Waermewende-vorantreibt.html,0,www.welt.de,Wie eine Stadt erfolgreich die Wärmewende vorantreibt,"Um weniger abhängig von Gas und Öl zu sein, setzt Brandenburg an der Havel auf den Ausbau der Fernwärme – mit einer ungewöhnlich langen Leitung. Das Beispiel der Stadt zeigt, welche Hindernisse es bei der Wärmewende gibt und wie sie sich überwinden lassen.",https://img.welt.de/img/wirtschaft/mobile256105364/5037937167-ci16x9-w1200/Waermewende.jpg,2025-05-12T13:37:59Z,https://web.archive.org/web/20250512172627/https://www.welt.de/wirtschaft/article256095052/Erfolgsrezept-Fernwaerme-Wie-eine-Stadt-erfolgreich-die-Waermewende-vorantreibt.html,"Um weniger abhängig von Gas und Öl zu sein, setzt Brandenburg an der Havel auf den Ausbau der Fernwärme mit einer ungewöhnlich langen Leitung. Das Beispiel der Stadt zeigt, welche Hindernisse es bei … [+9622 chars]",,de,'Gas'
https://taz.de/Eishockey-WM-in-Daenemark-und-Schweden/!6084485/,https://taz.de/Eishockey-WM-in-Daenemark-und-Schweden/!6084485/,0,taz.de,Eishockey WM in Dänemark und Schweden: Minimalziel Viertelfinale,"Bei der diesjährigen Eishockey Weltmeisterschaft stehen einige NHL-Stars auf dem Eis. Auch für das deutsche Team, das gut ins Turnier gestartet ist.",https://taz.de/picture/7693546/1200/imago1061873892-1.jpeg,2025-05-12T14:22:00Z,,"Bei der diesjährigen Eishockey Weltmeisterschaft stehen einige NHL-Stars auf dem Eis. Auch für das deutsche Team, das gut ins Turnier gestartet ist. mehr...",,de,'Eis'
https://www.bild.de/sport/fussball/fc-bayern-reagiert-nach-kritik-auf-den-ibiza-trip-der-stars-6821fe88e2b5b63444690454,https://www.bild.de/sport/fussball/fc-bayern-reagiert-nach-kritik-auf-den-ibiza-trip-der-stars-6821fe88e2b5b63444690454,0,www.bild.de,Kritik von anderen Klubs! - Bayern reagiert auf den Ibiza-Trip der Stars,"Neuer, Müller und Kane fliegen nach Ibiza zur Meisterschaftsfeier. Christian Heidel und Marcel Reif üben scharfe Kritik.","https://images.bild.de/6821fe88e2b5b63444690454/67238561cbdcb25ba58e4e1afef61f2d,794724c7?w=1280",2025-05-12T14:43:05Z,https://web.archive.org/web/20250512153652/https://www.bild.de/sport/fussball/fc-bayern-reagiert-nach-kritik-auf-den-ibiza-trip-der-stars-6821fe88e2b5b63444690454,"Sie tanzten und tranken und hatten Spaß. Dabei läuft die Saison noch 
13 Bayern-Stars (u.a. Neuer, Müller, Kane) flogen am Sonntag in einem Privatjet nach Ibiza, um die Meisterschaft zu feiern. Der … [+3223 chars]",,de,'Reif'
https://www.zeit.de/news/2025-05/12/marcel-reifs-verhaeltnis-zu-deutschland-und-israel,https://www.zeit.de/news/2025-05/12/marcel-reifs-verhaeltnis-zu-deutschland-und-israel,0,www.zeit.de,Lebendige Geschichte: Marcel Reifs Verhältnis zu Deutschland und Israel,Hier finden Sie Informationen zu dem Thema „Lebendige Geschichte“. Lesen Sie jetzt „Marcel Reifs Verhältnis zu Deutschland und Israel“.,https://img.zeit.de/news/2025-05/12/marcel-reifs-verhaeltnis-zu-deutschland-und-israel-image-group/wide__1300x731,2025-05-12T15:32:51Z,https://web.archive.org/web/20250513030752/https://www.zeit.de/news/2025-05/12/marcel-reifs-verhaeltnis-zu-deutschland-und-israel,Der Sportmoderator Marcel Reif wird am Dienstag (13.00 Uhr) im nordrhein-westfälischen Landtag über seine persönliche Bindung zu Deutschland und Israel sprechen. Anlass ist die Eröffnung der Ausstell… [+1242 chars],,de,'Reif'
https://www.stern.de/gesellschaft/regional/nordrhein-westfalen/lebendige-geschichte--marcel-reifs-verhaeltnis-zu-deutschland-und-israel-35716852.html,https://www.stern.de/gesellschaft/regional/nordrhein-westfalen/lebendige-geschichte--marcel-reifs-verhaeltnis-zu-deutschland-und-israel-35716852.html,0,www.stern.de,Lebendige Geschichte: Marcel Reifs Verhältnis zu Deutschland und Israel,Eine Ausstellung im nordrhein-westfälischen Landtag zeigt aus ganz persönlichen Blickwinkeln Ausschnitte aus 60 Jahren deutsch-israelischer Beziehungen. Auch ein prominenter Protagonist ist dabei.,https://image.stern.de/35716854/t/-2/v1/w1440/r1.7778/-/12--ljpnxgz5rdv15axs2048jpeg---c01ae213d4ed13e1.jpg,2025-05-12T15:32:51Z,https://web.archive.org/web/20250512160440/https://www.stern.de/gesellschaft/regional/nordrhein-westfalen/lebendige-geschichte--marcel-reifs-verhaeltnis-zu-deutschland-und-israel-35716852.html,"Kopiere den aktuellen Link
Zur Merkliste hinzufügen
Eine Ausstellung im nordrhein-westfälischen Landtag zeigt aus ganz persönlichen Blickwinkeln Ausschnitte aus 60 Jahren deutsch-israelischer Bezie… [+1454 chars]",,de,'Reif'
https://www.bild.de/unterhaltung/stars-und-leute/pamela-reif-im-steckbrief-das-leben-der-fitness-influencerin-62f4b3be60a3e73b21ea4a10,https://www.bild.de/unterhaltung/stars-und-leute/pamela-reif-im-steckbrief-das-leben-der-fitness-influencerin-62f4b3be60a3e73b21ea4a10,0,www.bild.de,Steckbrief - So tickt Fitness-Star Pamela Reif,"Sie ist Deutschlands Fitness-Star Nummer 1. Wie Pamela Reif so erfolgreich wurde und warum sie sich von ihrem Ex-Freund trennte, lesen Sie hier!","https://images.bild.de/62f4b3be60a3e73b21ea4a10/b29eef7320b1d3128edcadadc43d69b3,37e233a8?w=1280",2025-05-12T20:07:07Z,https://web.archive.org/web/20250512220456/https://www.bild.de/unterhaltung/stars-und-leute/pamela-reif-im-steckbrief-das-leben-der-fitness-influencerin-62f4b3be60a3e73b21ea4a10,"Sie ist die erfolgreichste Fitness-Influencerin Deutschlands: Pamela Reif erreicht mit ihren Videos Millionen von Zuschauern! 
Seit 2013 gibt sie auf ihrem YouTube-Kanal Einblicke in ihr Leben, und … [+4683 chars]",,de,'Reif'
https://www.stern.de/gesellschaft/regional/nordrhein-westfalen/lebendige-geschichte--marcel-reif-moechte-normales-juedisches-leben-in-deutschland-35717372.html,https://www.stern.de/gesellschaft/regional/nordrhein-westfalen/lebendige-geschichte--marcel-reif-moechte-normales-juedisches-leben-in-deutschland-35717372.html,0,www.stern.de,Lebendige Geschichte: Marcel Reif möchte normales jüdisches Leben in Deutschland,Eine Ausstellung im nordrhein-westfälischen Landtag zeigt aus ganz persönlichen Blickwinkeln Ausschnitte aus 60 Jahren deutsch-israelischer Beziehungen. Auch Marcel Reif hat etwas beizutragen.,https://image.stern.de/35719630/t/0G/v1/w1440/r1.7778/-/13--sys2eicno5v8axs2048jpeg---190ea77fe1503e6b.jpg,2025-05-13T13:10:56Z,https://web.archive.org/web/20250513145444/https://www.stern.de/gesellschaft/regional/nordrhein-westfalen/lebendige-geschichte--marcel-reif-moechte-normales-juedisches-leben-in-deutschland-35717372.html,"Kopiere den aktuellen Link
Zur Merkliste hinzufügen
Eine Ausstellung im nordrhein-westfälischen Landtag zeigt aus ganz persönlichen Blickwinkeln Ausschnitte aus 60 Jahren deutsch-israelischer Bezie… [+3635 chars]",,de,'Reif'
https://stadt-bremerhaven.de/gemini-wird-zum-universellen-assistenten-fuer-alle-android-geraete/,https://stadt-bremerhaven.de/gemini-wird-zum-universellen-assistenten-fuer-alle-android-geraete/,0,stadt-bremerhaven.de,Gemini wird zum universellen Assistenten für alle Android-Geräte,"Google gibt Gas und rollt seinen KI-Assistenten Gemini auf weitere Android-Plattformen aus. Nach dem erfolgreichen Start auf Smartphones wird die künstliche Intelligenz nun bald auch auf Smartwatches mit Wear OS, Android Auto, Google TV und sogar auf AR/VR-He…",https://stadt-bremerhaven.de/wp-content/uploads/2025/05/TAS_Gemini_Across_Devices_Blog_H.width-2200.format-webp.jpg,2025-05-13T17:19:56Z,https://web.archive.org/web/20250514154318/https://stadt-bremerhaven.de/gemini-wird-zum-universellen-assistenten-fuer-alle-android-geraete/,Google gibt Gas und rollt seinen KI-Assistenten Gemini auf weitere Android-Plattformen aus. Nach dem erfolgreichen Start auf Smartphones wird die künstliche Intelligenz nun bald auch auf Smartwatches… [+2129 chars],,de,'Gas'
https://www.stern.de/sport/eishockey-wm--aerger-um-das-wm-eis-in-herning---gefaehrlich-fuer-den-spieler--35721010.html,https://www.stern.de/sport/eishockey-wm--aerger-um-das-wm-eis-in-herning---gefaehrlich-fuer-den-spieler--35721010.html,0,www.stern.de,"Eishockey-WM: Ärger um das WM-Eis in Herning: ""Gefährlich für den Spieler""","Ein Loch im Eis, schwer kontrollierbare Pucks: Das Eis in der Messehalle im dänischen Herning ist nicht WM-reif. Die deutschen Eishockey-Cracks sind genervt.",https://image.stern.de/35721012/t/Zy/v1/w1440/r1.7778/-/14--np5s6lrb2lv5axs2048jpeg---5fba8c8e3657ee69.jpg,2025-05-14T02:50:35Z,https://web.archive.org/web/20250514045627/https://www.stern.de/sport/eishockey-wm--aerger-um-das-wm-eis-in-herning---gefaehrlich-fuer-den-spieler--35721010.html,"Kopiere den aktuellen Link
Zur Merkliste hinzufügen
Ein Loch im Eis, schwer kontrollierbare Pucks: Das Eis in der Messehalle im dänischen Herning ist nicht WM-reif. Die deutschen Eishockey-Cracks s… [+1468 chars]",,de,'Eis'
https://www.tagesspiegel.de/sport/eishockey-wm-arger-um-das-wm-eis-in-herning-gefahrlich-fur-den-spieler-13687492.html,https://www.tagesspiegel.de/sport/eishockey-wm-arger-um-das-wm-eis-in-herning-gefahrlich-fur-den-spieler-13687492.html,0,www.tagesspiegel.de,Eishockey-WM: Ärger um das WM-Eis in Herning: „Gefährlich für den Spieler“,"Ein Loch im Eis, schwer kontrollierbare Pucks: Das Eis in der Messehalle im dänischen Herning ist nicht WM-reif. Die deutschen Eishockey-Cracks sind genervt.",https://www.tagesspiegel.de/images/13687489/alternates/BASE_16_9_W1400/1747191138000/eishockey-wm-norwegen-deutschland.jpeg,2025-05-14T02:52:18Z,,"NHL-Torhüter Philipp Grubauer musste sich zurücknehmen. Jetzt muss ich aufpassen, was ich sage. Nicht, dass ich noch eine Rüge vom Weltverband bekomme, sagte der deutsche Nationalkeeper nach dem 5:2 … [+2003 chars]",,de,'Eis'
https://www.n-tv.de/sport/DEB-Stars-wueten-wegen-kaputtem-WM-Eis-mit-Loechern-article25765511.html,https://www.n-tv.de/sport/DEB-Stars-wueten-wegen-kaputtem-WM-Eis-mit-Loechern-article25765511.html,0,www.n-tv.de,"""Wie ein Weiher, der schmilzt"": DEB-Stars wüten wegen kaputtem WM-Eis mit Löchern","Ein Loch im Eis, schwer kontrollierbare Pucks: Das Eis in der Messehalle im dänischen Herning ist nicht WM-reif. Die deutschen Eishockey-Cracks sind so richtig genervt.",https://www.n-tv.de/img/incoming/crop25765510/8041329888-cImg_16_9-w1200/imago1061999614.jpg,2025-05-14T04:31:37Z,,"Ein Loch im Eis, schwer kontrollierbare Pucks: Das Eis in der Messehalle im dänischen Herning ist nicht WM-reif. Die deutschen Eishockey-Cracks sind so richtig genervt. 
NHL-Torhüter Philipp Grubaue… [+1842 chars]",,de,'Eis'
https://www.diepresse.com/19681818/klimaminister-norbert-totschnig-es-ist-jedenfalls-klug-seine-fossile-heizung-zu-tauschen,https://www.diepresse.com/19681818/klimaminister-norbert-totschnig-es-ist-jedenfalls-klug-seine-fossile-heizung-zu-tauschen,0,www.diepresse.com,"Klimaminister Norbert Totschnig :„Es ist jedenfalls klug, seine fossile Heizung zu tauschen“","Klimaminister Norbert Totschnig will mit weniger Geld gleich viel erreichen. Statt alles zu fördern, will er den Menschen klarmachen, was es sie kosten wird, wenn sie nichts tun.",https://img.diepresse.com/public/incoming/rk4se4-GettyImages-1325987655.jpg/alternates/DPR_SOCIAL_NACHRICHTEN/GettyImages-1325987655.jpg,2025-05-14T14:54:35Z,https://web.archive.org/web/20250515034310/https://www.diepresse.com/19681818/klimaminister-norbert-totschnig-es-ist-jedenfalls-klug-seine-fossile-heizung-zu-tauschen,"Klimaminister Norbert Totschnig will mit weniger Geld gleich viel erreichen. Statt alles zu fördern, will er den Menschen klarmachen, was es sie kosten wird, wenn sie nichts tun.
Der zuletzt stark a… [+3048 chars]",,de,'Gas'
https://www.bild.de/politik/inland/nach-heizkosten-schock-wie-gas-kunden-jetzt-mehr-als-500-euro-sparen-68231941578c1a3797759666,https://www.bild.de/politik/inland/nach-heizkosten-schock-wie-gas-kunden-jetzt-mehr-als-500-euro-sparen-68231941578c1a3797759666,0,www.bild.de,Nach Heizkosten-Schock - Wie Gas-Kunden jetzt mehr als 500 Euro sparen,"Die Heizkosten sind für Millionen Mieter deutlich raufgeschossen! Doch einige können sich wehren. Auch, wer ein eigenes Haus hat, sollte aktiv werden.","https://images.bild.de/68231941578c1a3797759666/1e9af64739a0e45b3abcd116a1d91da5,8e1ba63d?w=1280",2025-05-14T17:57:47Z,http://archive.md/20250514175946/https://www.bild.de/politik/inland/nach-heizkosten-schock-wie-gas-kunden-jetzt-mehr-als-500-euro-sparen-68231941578c1a3797759666,"Kostenschock für Millionen Mieter auf der Nebenkosten-Abrechnung. Die Heizkosten sind deutlich raufgeschossen! 
Bei Gas und Fernwärme wird dieser Trend voraussichtlich weiter anhalten, sagt Thorsten… [+299 chars]",,de,'Gas'
https://www.diepresse.com/19682255/neue-gaskraftwerke-fuer-deutschland-neue-wirtschaftsministerin-saegt-an-habecks-erbe,https://www.diepresse.com/19682255/neue-gaskraftwerke-fuer-deutschland-neue-wirtschaftsministerin-saegt-an-habecks-erbe,0,www.diepresse.com,Neue Gaskraftwerke für Deutschland: Neue Wirtschaftsministerin sägt an Habecks Erbe [premium],Deutschlands neue Wirtschaftsministerin Katherina Reiche (CDU) will „so schnell wie möglich“ neue Gaskraftwerke bauen lassen. Sie baut ihr Ministerium völlig um,https://img.diepresse.com/public/incoming/pz8sl4-GERMANY-POLITICSHANDOVER/alternates/DPR_SOCIAL_NACHRICHTEN/GERMANY-POLITICSHANDOVER,2025-05-15T03:35:47Z,,"Deutschlands neue Wirtschaftsministerin Katherina Reiche (CDU) will so schnell wie möglich neue Gaskraftwerke bauen lassen. Sie baut ihr Ministerium völlig um
Es waren durchaus bemerkenswerte Szenen… [+1236 chars]",,de,'Gas'
https://www.welt.de/geschichte/article256107766/Energieversorgung-Sicherheit-und-Preise-sprachen-angeblich-fuer-russisches-Gas.html,https://www.welt.de/geschichte/article256107766/Energieversorgung-Sicherheit-und-Preise-sprachen-angeblich-fuer-russisches-Gas.html,0,www.welt.de,„Versorgungssicherheit und bezahlbare Preise“ sprachen angeblich für russisches Gas,"Systematisch nutzt Moskau seit Jahrzehnten das sibirische Erdgas, um politisch Einfluss auf Europa auszuüben. Der Historiker Martin Lutz untersucht die Gemengelage rund um dieses wenig bekannte Kapitel des Kalten Krieges.",https://img.welt.de/img/geschichte/mobile256109828/5157937277-ci16x9-w1200/UdSSR-DDR-Erdgastrasse.jpg,2025-05-15T05:36:16Z,https://web.archive.org/web/20250515061900/https://www.welt.de/geschichte/article256107766/Energieversorgung-Sicherheit-und-Preise-sprachen-angeblich-fuer-russisches-Gas.html,"Systematisch nutzt Moskau seit Jahrzehnten das sibirische Erdgas, um politisch Einfluss auf Europa auszuüben. Der Historiker Martin Lutz untersucht die Gemengelage rund um dieses wenig bekannte Kapit… [+7661 chars]",,de,'Gas'
https://www.computerbase.de/news/monitore/woled-mit-trueblack-glossy-asus-verspricht-fuer-32-oleds-echtes-schwarz-in-allen-lagen.92644/,https://www.computerbase.de/news/monitore/woled-mit-trueblack-glossy-asus-verspricht-fuer-32-oleds-echtes-schwarz-in-allen-lagen.92644/,0,www.computerbase.de,"WOLED mit TrueBlack Glossy: Asus verspricht für 32""-OLEDs echtes Schwarz in allen Lagen","Asus gibt weiter Gas bei den OLED-Monitoren und präsentiert zwei neue Modelle mit 32 Zoll. Beide besitzen ein WOLED-Panel von LG Display, bieten 4K UHD sowie eine Dual-Mode- und KVM-Funktion. „TrueBlack Glossy“ steht für eine Display-Beschichtung, die auch be…",https://pics.computerbase.de/1/1/7/4/7/1-61a35e5fcc95be75/article-1280x720.f892341f.jpg,2025-05-15T07:03:00Z,,"Asus gibt weiter Gas bei den OLED-Monitoren und präsentiert zwei neue Modelle mit 32 Zoll. Beide besitzen ein WOLED-Panel von LG Display, bieten 4K UHD sowie eine Dual-Mode- und KVM-Funktion. TrueBla… [+3121 chars]",,de,'Gas'
https://www.tagesspiegel.de/wirtschaft/immobilien/versorger-machen-meine-fernwarme-teurer-warum-soll-ich-fur-die-ferne-energiewende-zahlen-13678912.html,https://www.tagesspiegel.de/wirtschaft/immobilien/versorger-machen-meine-fernwarme-teurer-warum-soll-ich-fur-die-ferne-energiewende-zahlen-13678912.html,0,www.tagesspiegel.de,Versorger machen meine Fernwärme teurer: Warum soll ich für die ferne Energiewende zahlen?,Versorger verfeuern billiges Gas und Kohle – doch ohne Wettbewerb und Kontrolle verlangen sie maßlose Preise. Ein Betroffener hakt nach.,https://www.tagesspiegel.de/images/13693735/alternates/BASE_16_9_W1400/1747237705000/mohamed-nohassi-iuydelnfles-unsplash.jpeg,2025-05-15T07:09:42Z,http://archive.md/20250515072450/https://www.tagesspiegel.de/wirtschaft/immobilien/versorger-machen-meine-fernwarme-teurer-warum-soll-ich-fur-die-ferne-energiewende-zahlen-13678912.html,"Briefe wie diesen möchte niemand bekommen: Die Berliner Energie und Wärme, kurz: BEW, kündigt uns den Vertrag zur Lieferung von Fernwärme. Wärme, das ist etwas Grundlegendes. Und eine Kündigung durch… [+88 chars]",,de,'Gas'
https://www.tagesspiegel.de/wirtschaft/immobilien/warum-fernwarme-immer-teurer-wird-13678912.html,https://www.tagesspiegel.de/wirtschaft/immobilien/warum-fernwarme-immer-teurer-wird-13678912.html,0,www.tagesspiegel.de,Im Würgegriff der Monopolisten: Warum Fernwärme immer teurer wird,Versorger verfeuern billiges Gas und Kohle – doch ohne Wettbewerb und Kontrolle verlangen sie maßlose Preise. Ein Betroffener hakt nach.,https://www.tagesspiegel.de/images/13693735/alternates/BASE_16_9_W1400/1747237705000/mohamed-nohassi-iuydelnfles-unsplash.jpeg,2025-05-15T07:09:42Z,http://archive.md/20250515122852/http://www.tagesspiegel.de/wirtschaft/immobilien/warum-fernwarme-immer-teurer-wird-13678912.html,"Briefe wie diesen möchte niemand bekommen: Die Berliner Energie und Wärme, kurz: BEW, kündigt uns den Vertrag zur Lieferung von Fernwärme. Wärme, das ist etwas Grundlegendes. Und eine Kündigung durch… [+88 chars]",,de,'Gas'
https://www.golem.de/sonstiges/zustimmung/auswahl.html?from=https://www.golem.de/news/hitzeschild-raumfahrzeuge-sollen-beim-wiedereintritt-schwitzen-2505-196225.html&referer=https://t.co/7ff491982e,https://www.golem.de/sonstiges/zustimmung/auswahl.html?from=https://www.golem.de/news/hitzeschild-raumfahrzeuge-sollen-beim-wiedereintritt-schwitzen-2505-196225.html&referer=https://t.co/7ff491982e,0,www.golem.de,Hitzeschild: Raumfahrzeuge sollen beim Wiedereintritt schwitzen,"Eine Forschungsgruppe testet gerade ein neues Material, das für Hitzeschilde in der Raumfahrt zum Einsatz kommen und ein Gas zur Kühlung freisetzen soll. (Raumfahrt, Wissenschaft)",,2025-05-15T10:30:02Z,,"Besuchen Sie Golem.de wie gewohnt mit Werbung und Tracking,
 indem Sie der Nutzung aller Cookies zustimmen.
 Details zum Tracking finden Sie im Privacy Center.
Skript wurde nicht geladen. Informat… [+607 chars]",,de,'Gas'
https://www.tagesspiegel.de/berlin/wie-der-klimawandel-das-geschaft-der-gasag-pragt-sinkender-warmebedarf--mehr-dezentrale-energielosungen-13695271.html,https://www.tagesspiegel.de/berlin/wie-der-klimawandel-das-geschaft-der-gasag-pragt-sinkender-warmebedarf--mehr-dezentrale-energielosungen-13695271.html,0,www.tagesspiegel.de,Wie der Klimawandel das Geschäft der Gasag prägt: Sinkender Wärmebedarf – mehr dezentrale Energielösungen,Umsatz und Erlös des Berliner Energieversorgers Gasag sanken im Jahr 2024 teils erheblich. Trotzdem sieht sich das Unternehmen gut gewappnet für eine klimaneutrale Zukunft.,https://www.tagesspiegel.de/images/12663326/alternates/BASE_16_9_W1400/1730980669000/jahres-pressekonferenz-der-gasag-berlin.jpeg,2025-05-15T11:39:37Z,,"Der Klimawandel und die damit einhergehenden steigenden Temperaturen entwickeln sich zu dem prägenden Faktor für das Geschäft des Berliner Energieversorgers Gasag. Das ist der Grundtrend, mit dem wir… [+3504 chars]",,de,'Gas'
https://www.morgenpost.de/politik/article409024671/estland-alarmiert-russischer-kampfjet-dringt-in-nato-luftraum-ein.html,https://www.morgenpost.de/politik/article409024671/estland-alarmiert-russischer-kampfjet-dringt-in-nato-luftraum-ein.html,0,www.morgenpost.de,Estland alarmiert: Russischer Kampfjet dringt in Nato-Luftraum ein,Russland will weiter Öl und Gas exportieren und schickt zum Schutz eines Schiffs einen Kampfjet los. Für eine Minute wird es brenzlig.,https://img.sparknews.funkemedien.de/407703361/407703361_1747310630_v16_9_1600.jpeg,2025-05-15T12:07:08Z,https://web.archive.org/web/20250515123252/https://www.morgenpost.de/politik/article409024671/estland-alarmiert-russischer-kampfjet-dringt-in-nato-luftraum-ein.html,"Berlin. Russland will weiter Öl und Gas exportieren und schickt zum Schutz eines Schiffs einen Kampfjet los. Für eine Minute wird es brenzlig.
Ein russisches Militärflugzeug ist nach estnischen Anga… [+1991 chars]",,de,'Gas'
