index,url,valid,domain,title,description,image,published,archive,content,quote,language,keyword
https://www.tagesspiegel.de/potsdam/landeshauptstadt/potsdamer-sommertipps-ralph-gutzmer-guckt-von-st-nikolai-uber-die-stadt-12238358.html,https://www.tagesspiegel.de/potsdam/landeshauptstadt/potsdamer-sommertipps-ralph-gutzmer-guckt-von-st-nikolai-uber-die-stadt-12238358.html,0,www.tagesspiegel.de,Potsdamer Sommertipps: Ralph Gutzmer guckt von St. Nikolai über die Stadt,"Die beste Badestelle, das leckerste Eis: Potsdamer verraten in der PNN-Serie für die Ferienzeit ihre zehn Tipps für einen tollen Sommer. Heute: Ralph Gutzmer vom Vorstand der Aids-Hilfe Potsdam e.V.",https://www.tagesspiegel.de/images/12238691/alternates/BASE_16_9_W1400/1724318782000/nikolaikirche-und-obelisk-potsdam.jpeg,2024-08-25T11:01:21Z,,"1. Wo gibt es das beste Eis?Mein persönlicher Favorit ist in den letzten Jahren das Melonen-Eis in Wartmanns Café in der Lankestraße in Klein Glienicke gewesen, in diesem Jahr habe ich es jedoch tats… [+4146 chars]",,de,'Eis'
https://www.sueddeutsche.de/bayern/bayern-wespen-regen-fruehjahr-lux.GN5n7tHdHJMD9Y1cSfoxmi,https://www.sueddeutsche.de/bayern/bayern-wespen-regen-fruehjahr-lux.GN5n7tHdHJMD9Y1cSfoxmi,0,www.sueddeutsche.de,Umwelt und Natur: Weniger Wespen in Bayern wegen des verregneten Frühjahrs,"Kaum stehen Eis oder Kuchen auf dem Tisch, nerven Wespen. In diesem Sommer ist es jedoch vergleichsweise ruhig. Wie kommt das?",https://www.sueddeutsche.de/2024/08/25/d02d074b-699f-4b41-91c6-17af810b63a7.jpeg?q=60&fm=webp&width=1200&rect=0%2C0%2C3000%2C1688,2024-08-25T12:24:35Z,,"LBV und der Naturschutzbund Deutschland (Nabu) hatten die Menschen in Deutschland dazu aufgerufen, in zwei Zeiträumen im Juni und August jeweils eine Stunde lang die Insekten in ihrer Umgebung zu zäh… [+1641 chars]",,de,'Eis'
https://www.faz.net/aktuell/wissen/leben-gene/wann-wespen-besonders-nerven-was-zieht-sie-zu-eis-und-kuchen-19941009.html,https://www.faz.net/aktuell/wissen/leben-gene/wann-wespen-besonders-nerven-was-zieht-sie-zu-eis-und-kuchen-19941009.html,0,www.faz.net,Kein gutes Jahr für Wespen? Verregnetes Frühjahr hat Folgen,"Kaum stehen Eis oder Kuchen auf dem Tisch, nerven die Wespen. In diesem Sommer ist es jedoch vergleichsweise ruhig. Wie kommt das?",https://media1.faz.net/ppmedia/aktuell/wissen/leben-gene/2867617164/1.9941017/facebook_teaser/gemeine-wespe-vespula-vulgaris.jpg,2024-08-25T13:49:27Z,,"Der Nabu und der bayerische Naturschutzverband LBV hatten die Menschen in Deutschland dazu aufgerufen, in zwei Zeiträumen im Juni und August jeweils eine Stunde lang die Insekten in ihrer Umgebung zu… [+2571 chars]",,de,'Eis'
https://www.stern.de/gesellschaft/regional/hessen/notfaelle--e-bike-brand-laesst-gaskartuschen-explodieren---mann-verletzt-35008086.html,https://www.stern.de/gesellschaft/regional/hessen/notfaelle--e-bike-brand-laesst-gaskartuschen-explodieren---mann-verletzt-35008086.html,0,www.stern.de,Notfälle: E-Bike-Brand lässt Gaskartuschen explodieren - Mann verletzt,"Hadamar (lhe) - Bei einem Brand eines E-Bikes und der Explosion mehrerer Gaskartuschen ist ein Mann schwer verletzt worden. Wie die Polizei mitteilte, war",https://image.stern.de/35008088/t/dv/v1/w1440/r1.7778/-/25--te53aucaorv32axw800h600jpeg---ef626cad5c53770d.jpg,2024-08-25T14:03:06Z,,"Ein E-Bike samt Anhänger brennt, daraufhin explodieren mehrere Gas-Kartuschen. Der Besitzer erleidet schwere Brandverletzungen.
Bei einem Brand eines E-Bikes und der Explosion mehrerer Gaskartuschen… [+589 chars]",,de,'Gas'
https://steiermark.orf.at/stories/3270399/,https://steiermark.orf.at/stories/3270399/,0,steiermark.orf.at,Polizist bei Kontrolle angefahren,Die Polizei hat in der Steiermark Samstagabend Verkehr-Schwerpunktkontrollen mit Schwerpunkt auf die Tuningszene durchgeführt. Dabei gab 19-jähriger Motorradlenker Gas und stieß einen Beamten zu Boden. Der Polizist wurde schwer verletzt.,https://ibs.orf.at/stm?image=https%3A%2F%2Foekastatic.orf.at%2Fmims%2F2023%2F50%2F89%2Fcrops%2Fw%3D1200%2Ch%3D627%2Cq%3D75%2F2043480_master_770789_image.jpg%3Fs%3D5b1596929b8b8823511786ce0988a741caf9c275,2024-08-25T16:02:00Z,,"Gegen 19:20 Uhr fiel einer Polizeistreife in Feldkirchen bei Graz ein Motorrad auf, das ohne Kennzeichen auf der B67, der Triesterstraße, unterwegs war. Eine sofortige Nachfahrt verlief zunächst ohne… [+814 chars]",,de,'Gas'
https://www.bild.de/unterhaltung/stars-und-leute/ralf-schumacher-trifft-auf-corinna-und-mick-der-eis-kuss-66cb586c0f2ad15e276183ff,https://www.bild.de/unterhaltung/stars-und-leute/ralf-schumacher-trifft-auf-corinna-und-mick-der-eis-kuss-66cb586c0f2ad15e276183ff,0,www.bild.de,Ralf trifft auf Corinna - Der Eis-Kuss beim Formel-1-Rennen,Sieht diese Bussi-Bussi-Begrüßung herzlich aus? Ex-Rennfahrer Ralf Schumacher (49) und seine Schwägerin Corinna Schumacher (55) trafen sich am Wochenende.,"https://images.bild.de/66cb586c0f2ad15e276183ff/0feb9ec476e8ec330838f320a1d40076,22c15b93?w=1280",2024-08-25T19:36:17Z,,Sieht diese Bussi-Bussi-Begrüßung herzlich aus? Ex-Rennfahrer Ralf Schumacher (49) und seine Schwägerin Corinna Schumacher (55) trafen sich am Wochenende in Zandvoort (Holland) beim Formel-1-Rennen. … [+2353 chars],,de,'Eis'
https://www.tagesspiegel.de/gesellschaft/panorama/nach-einsturz-von-eishohle-auf-island-keine-vermissten-mehr-auf-gletscher--einsatz-abgeschlossen-12256034.html,https://www.tagesspiegel.de/gesellschaft/panorama/nach-einsturz-von-eishohle-auf-island-keine-vermissten-mehr-auf-gletscher--einsatz-abgeschlossen-12256034.html,0,www.tagesspiegel.de,Nach Einsturz von Eishöhle auf Island: Keine Vermissten mehr auf Gletscher – Einsatz abgeschlossen,Eine Touristengruppe erkundet auf einer isländischen Gletscherzunge eine Eishöhle - plötzlich stürzt die Höhle ein. Nach längerer Suche nach zwei Vermissten hat die Polizei eine gute Nachricht.,https://www.tagesspiegel.de/images/12256031/alternates/BASE_16_9_W1400/1724617912000/island-gletscherlagune-jokulsarlon.jpeg,2024-08-25T20:31:52Z,,"Nach dem Einsturz einer Eishöhle auf einem Gletscher in Island ist die Suche nach zwei vermeintlich vermissten Touristen abgebrochen worden. Es seien keine Menschen mehr unter dem Eis eingeschlossen,… [+2716 chars]",,de,'Eis'
https://www.tagesspiegel.de/gesellschaft/panorama/rettungsaktion-eishohle-auf-island-eingesturzt-verletzte-und-vermisste-12256034.html,https://www.tagesspiegel.de/gesellschaft/panorama/rettungsaktion-eishohle-auf-island-eingesturzt-verletzte-und-vermisste-12256034.html,0,www.tagesspiegel.de,Rettungsaktion: Eishöhle auf Island eingestürzt: Verletzte und Vermisste,Die Gegend um die Gletscherlagune Jökulsarlon auf Island ist bei Touristen beliebt. Ein Highlight: geführte Touren durch Eishöhlen. Dabei kommt es zu einem Unglück.,https://www.tagesspiegel.de/images/12256031/alternates/BASE_16_9_W1400/1724617912000/island-gletscherlagune-jokulsarlon.jpeg,2024-08-25T20:31:52Z,,"Beim Einsturz einer Eishöhle auf Island sind zwei Menschen schwer verletzt worden, zwei weitere werden noch vermisst. Sie gehörten zu einer 25-köpfigen Touristengruppe, die die Höhle im Gletscher Bre… [+1599 chars]",,de,'Eis'
https://www.bild.de/news/ausland/island-eishoehle-eingestuerzt-zwei-touristen-vermisst-zwei-menschen-verletzt-66cb92f82e96240be0bb9a6e,https://www.bild.de/news/ausland/island-eishoehle-eingestuerzt-zwei-touristen-vermisst-zwei-menschen-verletzt-66cb92f82e96240be0bb9a6e,0,www.bild.de,Zwei Touristen vermisst - Hollywood-Eishöhle auf Island eingestürzt,Drama auf dem größten Gletscher Islands. Bei einer Tour durchs Eis ist eine Höhle eingestürzt. Mehrere Touristen wurden unter den Eismassen begraben.,"https://images.bild.de/66cb92f82e96240be0bb9a6e/6ebb9b2e7add4206046754ebd8936f1c,14fe034?w=1280",2024-08-25T21:05:43Z,,"Reykjavík Drama auf dem größten Gletscher Islands. Bei einer Tour durchs Eis ist eine Höhle eingestürzt. Mehrere Touristen wurden unter den Eismassen begraben. Zwei werden aktuell noch vermisst!
Die… [+1295 chars]",,de,'Eis'
https://www.faz.net/aktuell/gesellschaft/ungluecke/island-verletze-und-vermisste-nach-einsturz-von-eis-hoehle-19942205.html,https://www.faz.net/aktuell/gesellschaft/ungluecke/island-verletze-und-vermisste-nach-einsturz-von-eis-hoehle-19942205.html,0,www.faz.net,Island: Verletze und Vermisste nach Einsturz von Eis-Höhle,"Am Breidamerkurjökull-Gletscher im Süden von Island ist eine Eis-Höhle eingestürzt. Zwei Menschen sind schwer verletzt worden, zwei weitere werden vermisst.",https://media1.faz.net/ppmedia/aktuell/gesellschaft/2546367542/1.9942207/facebook_teaser/am-ufer-des-gletschersees.jpg,2024-08-25T23:45:42Z,,"Dutzende Rettungskräfte, darunter spezialisierte Höhlenretter, sowie zwei Hubschrauber waren im Einsatz, wie der Sender RÚV berichtete. Eine Behördensprecherin sagte, die Bedingungen auf dem Gletsche… [+577 chars]",,de,'Eis'
https://www.n-tv.de/panorama/Mindestens-ein-Toter-bei-Einsturz-von-Eishoehle-in-Island-article25181391.html,https://www.n-tv.de/panorama/Mindestens-ein-Toter-bei-Einsturz-von-Eishoehle-in-Island-article25181391.html,0,www.n-tv.de,Zwei Touristen vermisst: Eishöhle stürzt über Besuchern ein,"Der Gletscher Breidamerkurjökull ist eines der beliebtesten Touristenziele Islands. Zu den Attraktionen gehören auch Wanderungen durch Eishöhlen. Eine solche Höhle bricht über einer 25-köpfigen Besuchergruppe zusammen. Ein Wanderer überlebt das Unglück nicht,…",https://bilder1.n-tv.de/img/incoming/crop25181392/1981328527-cImg_16_9-w1200/219503255.jpg,2024-08-26T00:28:00Z,,Der Gletscher Breidamerkurjökull ist eines der beliebtesten Touristenziele Islands. Zu den Attraktionen gehören auch Wanderungen durch Eishöhlen. Eine solche Höhle bricht über einer 25-köpfigen Besuc… [+2240 chars],,de,'Dunkelheit'
https://www.zeit.de/news/2024-08/26/eishoehle-auf-island-eingestuerzt-mindestens-ein-toter,https://www.zeit.de/news/2024-08/26/eishoehle-auf-island-eingestuerzt-mindestens-ein-toter,0,www.zeit.de,Rettungsaktion: Eishöhle auf Island eingestürzt - mindestens ein Toter,Hier finden Sie Informationen zu dem Thema „Rettungsaktion“. Lesen Sie jetzt „Eishöhle auf Island eingestürzt - mindestens ein Toter“.,https://img.zeit.de/news/2024-08/26/eishoehle-auf-island-eingestuerzt-mindestens-ein-toter-image-group/wide__1300x731,2024-08-26T06:12:04Z,,Beim Einsturz einer Eishöhle auf einem Gletscher in Island ist mindestens ein Tourist ums Leben gekommen. Eine weitere Person sei schwer verletzt und per Hubschrauber in ein Krankenhaus in Reykjavik … [+1837 chars],,de,'Eis'
https://www.stern.de/panorama/rettungsaktion--eishoehle-auf-island-eingestuerzt---mindestens-ein-toter-35008866.html,https://www.stern.de/panorama/rettungsaktion--eishoehle-auf-island-eingestuerzt---mindestens-ein-toter-35008866.html,0,www.stern.de,Rettungsaktion: Eishöhle auf Island eingestürzt - mindestens ein Toter,Vulkane und Gletscher - Island ist das Land von Feuer und Eis. Eine Tour in der Nähe der Gletscherlagune Jökulsarlon endet nun mit einem tragischen Unglück.,https://image.stern.de/35008868/t/wZ/v1/w1440/r1.7778/-/26--sfhhpuyd7jv2axw800h600jpeg---7773ba254d43fcf3.jpg,2024-08-26T06:12:04Z,,"Vulkane und Gletscher - Island ist das Land von Feuer und Eis. Eine Tour in der Nähe der Gletscherlagune Jökulsarlon endet nun mit einem tragischen Unglück.
Beim Einsturz einer Eishöhle auf einem Gl… [+1309 chars]",,de,'Dunkelheit'
https://www.tagesspiegel.de/gesellschaft/panorama/rettungsaktion-eishohle-auf-island-eingesturzt-mindestens-ein-toter-12256334.html,https://www.tagesspiegel.de/gesellschaft/panorama/rettungsaktion-eishohle-auf-island-eingesturzt-mindestens-ein-toter-12256334.html,0,www.tagesspiegel.de,Rettungsaktion: Eishöhle auf Island eingestürzt - mindestens ein Toter,Vulkane und Gletscher - Island ist das Land von Feuer und Eis. Eine Tour in der Nähe der Gletscherlagune Jökulsarlon endet nun mit einem tragischen Unglück.,https://www.tagesspiegel.de/images/12256331/alternates/BASE_16_9_W1400/1724652800000/island-gletscherlagune-jokulsarlon.jpeg,2024-08-26T06:13:21Z,,Beim Einsturz einer Eishöhle auf einem Gletscher in Island ist mindestens ein Tourist ums Leben gekommen. Eine weitere Person sei schwer verletzt und per Hubschrauber in ein Krankenhaus in Reykjavik … [+1236 chars],,de,'Eis'
https://www.tagesschau.de/ausland/europa/island-eishoele-einsturz-toter-100.html,https://www.tagesschau.de/ausland/europa/island-eishoele-einsturz-toter-100.html,0,www.tagesschau.de,Mindestens ein Toter bei Einsturz von Eishöhle in Island,In Island ist mindestens ein Mensch beim Einsturz einer Eishöhle ums Leben gekommen. Drei weitere Menschen wurden dabei verletzt - zwei gelten noch als vermisst. Die Suche nach ihnen soll am Vormittag weitergehen.,https://images.tagesschau.de/image/9f0485dd-25b1-40bb-9d9c-0968ba2213af/AAABkY1d-vs/AAABkUqnCZ0/16x9-1280/island-hoehle-100.jpg,2024-08-26T06:36:25Z,,"Stand: 26.08.2024 08:36 Uhr
In Island ist mindestens ein Mensch beim Einsturz einer Eishöhle ums Leben gekommen. Drei Menschen wurden verletzt - zwei gelten noch als vermisst. Die Suche nach ihnen s… [+1869 chars]",,de,'Eis'
https://www.faz.net/aktuell/gesellschaft/ungluecke/island-verletzte-und-vermisste-nach-einsturz-von-eis-hoehle-19942205.html,https://www.faz.net/aktuell/gesellschaft/ungluecke/island-verletzte-und-vermisste-nach-einsturz-von-eis-hoehle-19942205.html,0,www.faz.net,Island: Verletze und Vermisste nach Einsturz von Eishöhle,"Am Breidamerkurjökull-Gletscher im Süden von Island ist eine Eishöhle eingestürzt. Mindestens ein Tourist starb, zwei weitere könnten noch unter dem Eis eingeschlossen sein.",https://media1.faz.net/ppmedia/aktuell/gesellschaft/2546367542/1.9942207/facebook_teaser/am-ufer-des-gletschersees.jpg,2024-08-26T06:41:09Z,,"Zwei weitere Menschen, die voraussichtlich unter dem Eis eingeschlossen wurden, werden nach dem Unglück auf dem Gletscher Breidamerkurjökull weiter vermisst. Die Suche nach ihnen wurde wegen der schw… [+818 chars]",,de,'Eis'
https://www.morgenpost.de/panorama/article407099661/eishoehle-in-island-eingestuerzt-zwei-menschen-vermisst.html,https://www.morgenpost.de/panorama/article407099661/eishoehle-in-island-eingestuerzt-zwei-menschen-vermisst.html,0,www.morgenpost.de,Eishöhle in Island eingestürzt: Mindestens ein Toter,Bei einem Einsturz einer Höhle in Island ist nach aktuellen Informationen eine Person ums Leben gekommen. Zwei weitere werden vermisst.,https://img.sparknews.funkemedien.de/407099659/407099659_1724657325_v16_9_1600.jpeg,2024-08-26T07:28:45Z,,"Berlin. Bei einem Einsturz einer Höhle in Island ist nach aktuellen Informationen eine Person ums Leben gekommen. Zwei weitere werden vermisst.
Beim Einsturz einer Eishöhle in Island ist mindestens … [+1727 chars]",,de,'Eis'
https://www.stern.de/genuss/-wie--schmeckt-das--neue-eis-trends-im-test-34994130.html,https://www.stern.de/genuss/-wie--schmeckt-das--neue-eis-trends-im-test-34994130.html,0,www.stern.de,"Vegan, proteinreich und Co.: (Wie) Schmeckt das? Neue Eis-Trends im Test","Das eiskalte Dessert gibt es in vielen Varianten. Wie und ob die neusten Eistrends schmecken, sehen Sie im Video.",https://image.stern.de/34994918/t/UG/v4/w1440/r1.7778/-/eistrends.jpg,2024-08-26T07:33:00Z,,Zugang zu allen STERN PLUS-Inhalten und Artikeln aus dem Print-Magazin,,de,'Eis'
https://www.faz.net/aktuell/feuilleton/debatten/ich-und-mein-smarties-eis-restauranterlebnis-fuer-fortgeschrittene-19941442.html,https://www.faz.net/aktuell/feuilleton/debatten/ich-und-mein-smarties-eis-restauranterlebnis-fuer-fortgeschrittene-19941442.html,0,www.faz.net,Ich und mein Smarties-Eis: Ein Restauranterlebnis für Fortgeschrittene,"Neun Tische, sechs Kellner, die über die Terrasse eilen, das Smartphone immer im Blick: jederzeit kann ein kulinarischer Notruf eingehen. Ein Gastbeitrag über ein Restauranterlebnis für Fortgeschrittene.",https://media0.faz.net/ppmedia/aktuell/2114336723/1.9941438/facebook_teaser_fplus/bestellen-im-restaurant-wird.jpg,2024-08-26T08:17:09Z,,Der Chefkellner sieht in sein Smartphone. Dann haben wir für den Herrn den Lachs und für die Dame das Smarties-Eis. Mann: Den Matjes haben Sie? Der Chefkellner zieht sein Headset vom Ohr. Entschuldig… [+799 chars],,de,'Eis'
https://www.bild.de/sport/fussball/knapper-kompany-sieg-jetzt-hier-reif-ist-live-gucken-66cb99380f2ad15e276185ce,https://www.bild.de/sport/fussball/knapper-kompany-sieg-jetzt-hier-reif-ist-live-gucken-66cb99380f2ad15e276185ce,0,www.bild.de,Knapper Kompany-Sieg - Jetzt hier Reif ist Live gucken,Die Bundesliga hat begonnen! Alle Infos und Meinungen mit Ihrem Lieblings-Experten Marcel Reif.,"https://images.bild.de/66cb99380f2ad15e276185ce/44ef979845803bcf501c10237e27b9a5,997dbf1a?w=1280",2024-08-26T08:18:31Z,,"Mehr zum Video anzeigen 
Die Bundesliga hat begonnen! Alle Infos und Meinungen mit Ihrem Lieblings-Experten Marcel Reif.
Quelle: BILD26.08.2024 - 10:26 Uhr",,de,'Reif'
https://www.tagesspiegel.de/gesundheit/unangenehmer-brain-freeze-warum-bekommt-man-vom-eisessen-kopfschmerzen-12256820.html,https://www.tagesspiegel.de/gesundheit/unangenehmer-brain-freeze-warum-bekommt-man-vom-eisessen-kopfschmerzen-12256820.html,0,www.tagesspiegel.de,Unangenehmer „brain freeze“: Warum bekommt man vom Eisessen Kopfschmerzen?,"Manchmal fühlt es sich an, als würde einem beim Eisessen für einen Moment das Gehirn einfrieren. Eine Neurologin erklärt, welcher Mechanismus dahinter steht und ob die Schmerzen Grund zur Sorge sind.",https://www.tagesspiegel.de/images/11534123/alternates/BASE_16_9_W1400/1724664027000/eis.jpeg,2024-08-26T09:20:46Z,,"Mit der Erfrischung kommt der Schmerz: Gerade noch genüsslich an der Kugel Eis geleckt, schon schießt einem ein fieses Stechen direkt hinter die Stirn. Fühlt sich ein bisschen an, als würde mal eben … [+21 chars]",,de,'Eis'
https://www.tagesspiegel.de/gesellschaft/panorama/40-grad-hitze-im-winter-australien-verzeichnet-rekordtemperaturen-12257903.html,https://www.tagesspiegel.de/gesellschaft/panorama/40-grad-hitze-im-winter-australien-verzeichnet-rekordtemperaturen-12257903.html,0,www.tagesspiegel.de,40-Grad-Hitze im Winter: Australien verzeichnet Rekordtemperaturen,In Australien sorgen aktuell heiße Luftmassen für eine ungewöhnliche Hitze. Im Westen des Landes werden Temperaturen von über 40 Grad gemessen. Laut Wetterprognosen gibt es in den nächsten Tagen keine Hoffnung auf Abkühlung.,https://www.tagesspiegel.de/images/12257921/alternates/BASE_16_9_W1400/1724666763000/hitze-in-australien.jpeg,2024-08-26T10:32:53Z,,In Teilen Australiens werden derzeit Hitzerekorde gebrochen - dabei ist in Down Under eigentlich Winter. In der bei Touristen beliebten Region Kimberley im Westen des Landes seien an der Wetterstatio… [+1862 chars],,de,'Eis'
https://www.tagesspiegel.de/potsdam/landeshauptstadt/potsdamer-sommertipps-hans-joachim-lustig-liebt-die-inselbuhne-12255665.html,https://www.tagesspiegel.de/potsdam/landeshauptstadt/potsdamer-sommertipps-hans-joachim-lustig-liebt-die-inselbuhne-12255665.html,0,www.tagesspiegel.de,Potsdamer Sommertipps: Hans-Joachim Lustig liebt die Inselbühne,"Die beste Badestelle, das leckerste Eis: Potsdamer verraten in der PNN-Serie für die Ferienzeit ihre zehn Tipps für einen tollen Sommer. Heute: Hans-Joachim Lustig, Leiter des Chorwerk Potsdam.",https://www.tagesspiegel.de/images/12235430/alternates/BASE_16_9_W1400/1724603350000/lit-potsdam.jpeg,2024-08-26T10:57:29Z,,"1. Wo gibt es das beste Eis?
Fridas Eis in der Benkertstraße mit grandiosem hausgemachtem Softeis!
2. Was ist Ihre liebste Route für einen Spaziergang?In einem der Parks da hat man in Potsdam ja di… [+1680 chars]",,de,'Eis'
https://www.stern.de/panorama/zwei-touristen-weiter-vermisst--mindestens-ein-toter-bei-eishoehlenunglueck-auf-island-35008866.html,https://www.stern.de/panorama/zwei-touristen-weiter-vermisst--mindestens-ein-toter-bei-eishoehlenunglueck-auf-island-35008866.html,0,www.stern.de,Zwei Touristen weiter vermisst: Mindestens ein Toter bei Eishöhlenunglück auf Island,Vulkane und Gletscher - Island ist das Land von Feuer und Eis. Eine geführte Tour in der Nähe der beeindruckenden Gletscherlagune Jökulsarlon endet nun mit einem tragischen Unglück.,https://image.stern.de/35010816/t/x2/v1/w1440/r1.7778/-/26--4fuhoqq6vev13axw800h600jpeg---24e51f2d06813cd4.jpg,2024-08-26T13:50:19Z,,"Vulkane und Gletscher - Island ist das Land von Feuer und Eis. Eine geführte Tour in der Nähe der beeindruckenden Gletscherlagune Jökulsarlon endet nun mit einem tragischen Unglück.
Erst kürzlich ei… [+3503 chars]",,de,'Eis'
https://www.stern.de/panorama/eishoehle-eingestuerzt--entwarnung--keine-vermissten-mehr-auf-gletscher-in-island-35008866.html,https://www.stern.de/panorama/eishoehle-eingestuerzt--entwarnung--keine-vermissten-mehr-auf-gletscher-in-island-35008866.html,0,www.stern.de,Eishöhle eingestürzt: Entwarnung: Keine Vermissten mehr auf Gletscher in Island,Eine Touristengruppe erkundet auf einer isländischen Gletscherzunge eine Eishöhle - plötzlich stürzt die Höhle ein. Nach längerer Suche nach zwei Vermissten hat die Polizei eine gute Nachricht.,https://image.stern.de/35011348/t/Ux/v1/w1440/r1.7778/-/26--pekigehsjlv4axw800h600jpeg---1f130db344e34a28.jpg,2024-08-26T16:30:07Z,,"Eine Touristengruppe erkundet auf einer isländischen Gletscherzunge eine Eishöhle - plötzlich stürzt die Höhle ein. Nach längerer Suche nach zwei Vermissten hat die Polizei eine gute Nachricht.
Nach… [+1123 chars]",,de,'Eis'
https://www.zeit.de/news/2024-08/26/nach-wirbel-um-doktortitel-cathy-hummels-buchplaene-auf-eis,https://www.zeit.de/news/2024-08/26/nach-wirbel-um-doktortitel-cathy-hummels-buchplaene-auf-eis,0,www.zeit.de,Buch über Depressionen: Nach Wirbel um Doktortitel: Cathy Hummels' Buchpläne auf Eis,Hier finden Sie Informationen zu dem Thema „Buch über Depressionen“. Lesen Sie jetzt „Nach Wirbel um Doktortitel: Cathy Hummels' Buchpläne auf Eis“.,https://img.zeit.de/news/2024-08/26/nach-wirbel-um-doktortitel-cathy-hummels-buchplaene-auf-eis-image-group/wide__1300x731,2024-08-26T16:43:33Z,,"Nach Wirbel um den Doktortitel ihres Bruders Sebastian Fischer liegt ein Buchprojekt von Cathy Hummels und dem Südwest-Verlag auf Eis. «Der Verlag, Frau Hummels und Sebastian Fischer haben in der Tat… [+2704 chars]",,de,'Eis'
https://www.stern.de/gesellschaft/regional/bayern/buch-ueber-depressionen--nach-wirbel-um-doktortitel--cathy-hummels--buchplaene-auf-eis-35011374.html,https://www.stern.de/gesellschaft/regional/bayern/buch-ueber-depressionen--nach-wirbel-um-doktortitel--cathy-hummels--buchplaene-auf-eis-35011374.html,0,www.stern.de,Buch über Depressionen: Nach Wirbel um Doktortitel: Cathy Hummels' Buchpläne auf Eis,Eigentlich wollte Cathy Hummels gemeinsam mit ihrem Bruder ein Buch über Depressionen veröffentlichen. Nach Wirbel um seinen Doktortitel haben sich die Pläne nun geändert.,https://image.stern.de/35011376/t/9D/v1/w1440/r1.7778/-/26--uecexh45wtv13axw800h600jpeg---5aab96909dff32f3.jpg,2024-08-26T16:43:33Z,,"Eigentlich wollte Cathy Hummels gemeinsam mit ihrem Bruder ein Buch über Depressionen veröffentlichen. Nach Wirbel um seinen Doktortitel haben sich die Pläne nun geändert.
Nach Wirbel um den Doktort… [+2318 chars]",,de,'Eis'
https://www.tagesspiegel.de/gesellschaft/buch-uber-depressionen-nach-wirbel-um-doktortitel-cathy-hummels-buchplane-auf-eis-12261737.html,https://www.tagesspiegel.de/gesellschaft/buch-uber-depressionen-nach-wirbel-um-doktortitel-cathy-hummels-buchplane-auf-eis-12261737.html,0,www.tagesspiegel.de,Buch über Depressionen: Nach Wirbel um Doktortitel: Cathy Hummels' Buchpläne auf Eis,Eigentlich wollte Cathy Hummels gemeinsam mit ihrem Bruder ein Buch über Depressionen veröffentlichen. Nach Wirbel um seinen Doktortitel haben sich die Pläne nun geändert.,https://www.tagesspiegel.de/images/12261734/alternates/BASE_16_9_W1400/1724690676000/cathy-hummels.jpeg,2024-08-26T16:44:36Z,,"Nach Wirbel um den Doktortitel ihres Bruders Sebastian Fischer liegt ein Buchprojekt von Cathy Hummels und dem Südwest-Verlag auf Eis. Der Verlag, Frau Hummels und Sebastian Fischer haben in der Tat … [+2206 chars]",,de,'Eis'
https://orf.at/stories/3367636/,https://orf.at/stories/3367636/,0,orf.at,Eishöhle in Island eingestürzt: Keine Vermissten mehr,,https://orf.at/mojo/1_4_1/storyserver//news/common/images/og-fallback-news.png,2024-08-26T16:46:15Z,,Nach dem Einsturz einer Eishöhle auf einem Gletscher in Island ist die Suche nach zwei vermeintlich vermissten Touristen heute abgebrochen worden. Es seien keine Menschen mehr unter dem Eis eingeschl… [+935 chars],,de,'Eis'
https://www.stern.de/panorama/vermisstensuche-eingestellt--eishoehlenunglueck-auf-island---ein-toter-und-spaete-entwarnung-35008866.html,https://www.stern.de/panorama/vermisstensuche-eingestellt--eishoehlenunglueck-auf-island---ein-toter-und-spaete-entwarnung-35008866.html,0,www.stern.de,Vermisstensuche eingestellt: Eishöhlenunglück auf Island - ein Toter und späte Entwarnung,"Eine geführte Tour auf einer Gletscherzunge endet mit einem tragischen Unglück. Ein Tourist stirbt, nach zweien wird lange Zeit gesucht. Dann kann die Polizei schließlich Entwarnung geben.",https://image.stern.de/35011390/t/dW/v1/w1440/r1.7778/-/26--dtnrupzfjev2axw800h600jpeg---8fb231ea58126385.jpg,2024-08-26T17:04:18Z,,"Eine geführte Tour auf einer Gletscherzunge endet mit einem tragischen Unglück. Ein Tourist stirbt, nach zweien wird lange Zeit gesucht. Dann kann die Polizei schließlich Entwarnung geben.
Erst kürz… [+3890 chars]",,de,'Eis'
