index,url,valid,domain,title,description,image,published,archive,content,quote,language,keyword
https://burgenland.orf.at/stories/3252044/,https://burgenland.orf.at/stories/3252044/,0,burgenland.orf.at,Familypark: Millioneninvestition in neue Attraktion,Der Familypark in St. Margarethen (Bezirk Eisenstadt-Umgebung) – einer der größten Freizeitparks Österreichs – ist in die Saison gestartet. Die Winterpause wurde für Aus- und Umbauarbeiten in Millionenhöhe genutzt.,https://ibs.orf.at/bgl?image=https%3A%2F%2Foekastatic.orf.at%2Fmims%2F2024%2F15%2F57%2Fcrops%2Fw%3D1200%2Ch%3D627%2Cq%3D75%2F2164215_master_819557_family_4.jpg%3Fs%3D38a03613e6136afca34ebf032e201c9f26c68449,2024-04-07T08:42:46Z,,Eine zwölf Meter hohe Schaukel ist die neue Attraktion im Familypark. Dazu gab es über den Winter mehrere Umbauarbeiten. Neben der neuen Riesenschaukel seien auch noch eine bestehende Bahn und der Mä… [+877 chars],,de,'Eis'
https://www.zeit.de/zeit-magazin/2024/15/kennenlernen-beziehung-camping-familie-liebeskolumne,https://www.zeit.de/zeit-magazin/2024/15/kennenlernen-beziehung-camping-familie-liebeskolumne,0,www.zeit.de,"Kennenlernen: ""Die Polizei war wenig amüsiert""","Im Winter 73 lernte Jürgen seine große Liebe kennen. Er war begeistert, sie eher abwartend – und dann kam auch noch die Polizei.",https://img.zeit.de/zeit-magazin/2024-03/kennenlernen-beziehung-camping-familie-liebeskolumne-bild/wide__1300x731,2024-04-07T11:10:37Z,,"Die Serie ""Lexikon der Liebe"" bietet Leserinnen und Lesern Platz, ihre Liebesgeschichten zu erzählen.
Jürgen*, 72: ""Vor 51 Jahren haben wir uns kennengelernt. Gerade haben wir unsere Goldene Hochzei… [+973 chars]",,de,'Winter'
https://www.zeit.de/news/2024-04/08/berliner-kaeltehilfe-diesen-winter-stark-ausgelastet,https://www.zeit.de/news/2024-04/08/berliner-kaeltehilfe-diesen-winter-stark-ausgelastet,0,www.zeit.de,Obdachlosigkeit: Berliner Kältehilfe diesen Winter stark ausgelastet,Hier finden Sie Informationen zu dem Thema „Obdachlosigkeit“. Lesen Sie jetzt „Berliner Kältehilfe diesen Winter stark ausgelastet“.,https://img.zeit.de/news/2024-04/08/berliner-kaeltehilfe-diesen-winter-stark-ausgelastet-image-group/wide__1300x731,2024-04-08T08:41:32Z,,"Das Berliner Kältehilfesystem ist Wohlfahrtsverbänden zufolge diesen Winter erneut an seine Grenzen gestoßen. Bereits im September hätten die Verbände darauf hingewiesen, dass für die Unterbringung v… [+2747 chars]",,de,'Kälte'
https://www.bild.de/politik/inland/politik/heiz-schock-fuer-millionen-deutsche-droht-erste-grossstadt-will-gasnetz-stillleg-87806238.bild.html,https://www.bild.de/politik/inland/politik/heiz-schock-fuer-millionen-deutsche-droht-erste-grossstadt-will-gasnetz-stillleg-87806238.bild.html,0,www.bild.de,Heiz-Schock droht  - Erste Großstadt will Gasnetz stilllegen,Die erste Großstadt macht Ernst und setzt das Heizgesetz von Wirtschaftsminister Robert Habeck vorzeitig um – mit massiven Folgen für Gaskunden!,"https://images.bild.de/6613fa97eebc187cde726cf1/dde4e78cd006ab6769c60c74cc406968,b71ba977?w=1280",2024-04-09T03:02:00Z,,"Die erste Großstadt macht Ernst und setzt das Heizgesetz von Wirtschaftsminister Robert Habeck (54, Grüne) vorzeitig um mit massiven Folgen für Gaskunden!
Augsburg (knapp 300 000 Einwohner) will sei… [+2331 chars]",,de,'Gas'
https://www.morgenpost.de/politik/article242056476/Gas-vor-dem-Aus-Erste-Grossstadt-geht-radikalen-Schritt.html,https://www.morgenpost.de/politik/article242056476/Gas-vor-dem-Aus-Erste-Grossstadt-geht-radikalen-Schritt.html,0,www.morgenpost.de,Gas vor dem Aus? Erste Großstadt geht radikalen Schritt,Verlieren bald Millionen ihren Gas-Anschluss? Bis 2045 soll Deutschland klimaneutral sein. Eine Stilllegung der Gasnetze ist dabei durchaus vorgesehen.,https://img.sparknews.funkemedien.de/242045280/242045280_1712499461_v16_9_1600.jpeg,2024-04-09T06:19:52Z,,"Berlin. Noch heizen Millionen Menschen in Deutschland mit Gas. Doch das könnte sich bald ändern, denn die Heiz-Revolution ist in vollem Gange.
Bis 2045 soll Deutschland klimaneutral sein. So sieht e… [+4430 chars]",,de,'Heizung'
https://www.focus.de/finanzen/news/gas-abschaltung-droht-erste-grossstadt-will-gasnetz-stilllegen-was-das-fuer-sie-bedeutet_id_259836455.html,https://www.focus.de/finanzen/news/gas-abschaltung-droht-erste-grossstadt-will-gasnetz-stilllegen-was-das-fuer-sie-bedeutet_id_259836455.html,0,www.focus.de,Augsburg - Erste Großstadt will Gasnetz stilllegen - was das für Sie bedeutet,"Die Bundesregierung macht Druck und will ihre Klimaziele bis 2045 erreichen. Dann sollen Haushalte kaum noch mit fossilen Brennstoffen heizen. Regierung und Netzbetreiber überlegen, wie sie die Kunden darauf vorbereiten können. Ein Netzbetreiber prescht vor.",https://p6.focus.de/img/fotos/id_259836453/imago0192738919h.jpg?im=Crop%3D%280%2C289%2C3463%2C1731%29%3BResize%3D%281200%2C627%29&impolicy=perceptual&quality=mediumHigh&hash=2cd1535c98f6e342c73b6c9d030d49b37285686fac47d5a2c9de35f562e0d4f5,2024-04-09T06:41:46Z,https://web.archive.org/web/20240409071951/https://www.focus.de/finanzen/news/gas-abschaltung-droht-erste-grossstadt-will-gasnetz-stilllegen-was-das-fuer-sie-bedeutet_id_259836455.html,"Die Bundesregierung macht Druck und will ihre Klimaziele bis 2045 erreichen. Dann sollen Haushalte kaum noch mit fossilen Brennstoffen heizen. Regierung und Netzbetreiber überlegen, wie sie die Kunde… [+2836 chars]",,de,'Heizen'
https://www.focus.de/politik/ausland/ukraine-krise/schaeden-viel-groesser-als-im-vorjahr-putins-angriffe-auf-ukrainische-energieinfrastruktur_id_259836531.html,https://www.focus.de/politik/ausland/ukraine-krise/schaeden-viel-groesser-als-im-vorjahr-putins-angriffe-auf-ukrainische-energieinfrastruktur_id_259836531.html,0,www.focus.de,Schäden viel größer als im Vorjahr - Putins Angriffe auf ukrainische Energieinfrastruktur,"Neue russische Angriffe auf die ukrainische Energieinfrastruktur verursachen erheblichen Schaden, weit mehr als die Angriffe im Winter 2022-2023.",https://p6.focus.de/img/fotos/id_259836521/russische-drohne-kyjiw-getty.jpg?im=Crop%3D%280%2C419%2C3464%2C1732%29%3BResize%3D%281200%2C627%29&impolicy=perceptual&quality=mediumHigh&hash=54785cdd6dc04821ea25d664fe6684e97cb1d27e1bbca5cbfc629dddd8b4e245,2024-04-09T07:12:51Z,,"Neue russische Angriffe auf die ukrainische Energieinfrastruktur verursachen erheblichen Schaden, weit mehr als die Angriffe im Winter 2022-2023.Der ukrainische Energieminister Herman Haluschenko äuß… [+1490 chars]",,de,'Winter'
https://www.bild.de/sport/fussball/borussia-dortmund-ueberraschungs-gast-im-flieger-nach-madrid-66151abe9ae9be4ed43c079f,https://www.bild.de/sport/fussball/borussia-dortmund-ueberraschungs-gast-im-flieger-nach-madrid-66151abe9ae9be4ed43c079f,0,www.bild.de,Welcher Star mit im Flieger nach Madrid saß - Überraschungs-Gast auf BVB-Reise!,"Borussia Dortmund auf dem Weg zum Champions-League-Viertelfinale gegen Atlético Madrid. An Bord saß plötzlich ein Super-Star, mit dem nicht unbedingt zu rechnen war…Foto: Federico Gambarini/dpa","https://images.bild.de/66151abe9ae9be4ed43c079f/fca81d1c51ca324bc23efb6c50227976,5bfaf2a1?w=1280",2024-04-09T10:51:18Z,,"Ungewohnte Gesichter beim BVB-Boarding!
Um 10.30 Uhr hob 
Borussia Dortmund heute in Richtung Madrid ab. In der spanischen Hauptstadt geht es morgen (21 Uhr) 
im Champions-League-Viertelfinale geg… [+1773 chars]",,de,'Reif'
https://www.diepresse.com/18350038/ein-gift-fuer-unsere-westliche-grundordnung,https://www.diepresse.com/18350038/ein-gift-fuer-unsere-westliche-grundordnung,0,www.diepresse.com,Ein Gift für unsere westliche Grundordnung,"Erschreckend, wie häufig der Kommunismus immer noch als Heilmittel gepriesen wird, vor allem wenn es um das Wohnen und Heizen geht.",https://img.diepresse.com/public/incoming/qhztm9-09apr24-kommunismus-peter-kufner-kuf-online.jpg/alternates/DPR_SOCIAL_MEINUNG/09apr24%20kommunismus%20-%20peter%20kufner%20kuf%20-online.jpg,2024-04-09T13:51:26Z,,"Erschreckend, wie häufig der Kommunismus immer noch als Heilmittel gepriesen wird, vor allem wenn es um das Wohnen und Heizen geht. 
Als toxisch wurde die kommunistische Ideologie zu Recht bezeichne… [+7020 chars]",,de,'Heizen'
https://www.n-tv.de/wirtschaft/Dreht-Augsburg-in-zehn-Jahren-den-Gashahn-zu-article24861589.html,https://www.n-tv.de/wirtschaft/Dreht-Augsburg-in-zehn-Jahren-den-Gashahn-zu-article24861589.html,0,www.n-tv.de,Stadtwerke dementieren: Dreht Augsburg in zehn Jahren den Gashahn zu?,Die Stadt Augsburg will gemäß der Klimaziele weg vom Heizen mit Erdgas. Medienberichten zufolge soll dort ein Umstieg auf Fernwärme bereits in zehn Jahren erfolgt sein - das wäre deutlich früher als von der Bundesregierung angepeilt. Die Stadtwerke sehen sich…,https://bilder4.n-tv.de/img/incoming/crop24861619/8271328186-cImg_16_9-w1200/107301743.jpg,2024-04-09T17:05:14Z,https://web.archive.org/web/20240409180640/https://www.n-tv.de/wirtschaft/Dreht-Augsburg-in-zehn-Jahren-den-Gashahn-zu-article24861589.html,Die Stadt Augsburg will gemäß der Klimaziele weg vom Heizen mit Erdgas. Medienberichten zufolge soll dort ein Umstieg auf Fernwärme bereits in zehn Jahren erfolgt sein - das wäre deutlich früher als … [+4008 chars],,de,'Heizen'
https://futurezone.at/science/klimawandel-laesst-meteoriten-in-antarktis-verschwinden-sonne-eth-zuerich-suchaktion/402851311,https://futurezone.at/science/klimawandel-laesst-meteoriten-in-antarktis-verschwinden-sonne-eth-zuerich-suchaktion/402851311,0,futurezone.at,Klimawandel lässt Meteoriten in der Antarktis verschwinden,Wegen ihrer schwarzen Farbe heizen sich Meteoriten durch die Sonne auf. Das Eis schmilzt und sie verschwinden im Meer.,https://image.futurezone.at/images/facebook/8647972/millerrangeantarctica-meteorite2.jpg,2024-04-09T17:49:59Z,https://web.archive.org/web/20240409192050/https://futurezone.at/science/klimawandel-laesst-meteoriten-in-antarktis-verschwinden-sonne-eth-zuerich-suchaktion/402851311,Wegen ihrer schwarzen Farbe heizen sich Meteoriten durch die Sonne auf. Das Eis schmilzt und sie verschwinden im Meer.,,de,'Eis'
