index,url,valid,domain,title,description,image,published,archive,content,quote,language,keyword
https://www.morgenpost.de/berlin/article237797689/Zunaechst-trueb-spaeter-Auflockerungen.html,https://www.morgenpost.de/berlin/article237797689/Zunaechst-trueb-spaeter-Auflockerungen.html,0,www.morgenpost.de,"Wetter: Zunächst trüb, später Auflockerungen","Am Freitagmorgen hängen Nebel und Wolken über Berlin und Brandenburg. Nach anfänglichem Frost lockert es zum Nachmittag zunehmend auf, wie der Deutsche Wetterdienst am Freitag berichtete. Die Temperaturen liegen zwischen vier und sieben Grad. Zum Teil weht ei…",https://img.morgenpost.de/img/berlin/crop237797687/5302603743-w820-cv16_9-q85/Wechselhaftes-Wetter.jpg,2023-03-03T06:35:06Z,https://web.archive.org/web/20230303091041/https://www.morgenpost.de/berlin/article237797689/Zunaechst-trueb-spaeter-Auflockerungen.html,"Potsdam (dpa/bb). Am Freitagmorgen hängen Nebel und Wolken über Berlin und Brandenburg. Nach anfänglichem Frost lockert es zum Nachmittag zunehmend auf, wie der Deutsche Wetterdienst am Freitag beric… [+720 chars]",,de,'Schnee'
https://www.stern.de/gesellschaft/regional/thueringen/wetter--truebes-und-regnerisches-wochenende-in-thueringen-33247806.html,https://www.stern.de/gesellschaft/regional/thueringen/wetter--truebes-und-regnerisches-wochenende-in-thueringen-33247806.html,0,www.stern.de,Wetter: Trübes und regnerisches Wochenende in Thüringen,"Auf einen grauen Himmel, Regen und Schnee müssen sich die Menschen in Thüringen am Wochenende einrichten. Wie der Deutsche Wetterdienst in Leipzig mitteilte, ist es am Freitag bei maximal vier bis sieben Grad sowie vereinzelt etwas Sprühregen oder Schneegries…",https://image.stern.de/33247808/t/SF/v1/w1440/r1.7778/-/03--urnnewsmldpacom2009010123030399811052v3w800h600l812t237r2033b1596jpeg---baa5fcd073251989.jpg,2023-03-03T06:36:54Z,,"Auf einen grauen Himmel, Regen und Schnee müssen sich die Menschen in Thüringen am Wochenende einrichten. Wie der Deutsche Wetterdienst in Leipzig mitteilte, ist es am Freitag bei maximal vier bis si… [+1166 chars]",,de,'Schnee'
https://www.stern.de/gesellschaft/regional/hessen/wetter--regnerisches-wochenende-bei-einstelligen-temperaturen-33247822.html,https://www.stern.de/gesellschaft/regional/hessen/wetter--regnerisches-wochenende-bei-einstelligen-temperaturen-33247822.html,0,www.stern.de,Wetter: Regnerisches Wochenende bei einstelligen Temperaturen,"Der sonnige Freitag wird am Wochenende in Hessen von Regen und mitunter auch Schnee abgelöst. Freitagvormittag sei ein leichter Sprühregen nicht ausgeschlossen, im Tagesverlauf werde es aber heiter und teils sonnig, teilte der Deutsche Wetterdienst (DWD) mit.…",https://image.stern.de/33247824/t/ti/v1/w1440/r1.7778/-/03--urnnewsmldpacom2009010123030399811113v3w800h600l542t153r1724b1428jpeg---e8581470829a7e8c.jpg,2023-03-03T06:44:40Z,,"Der sonnige Freitag wird am Wochenende in Hessen von Regen und mitunter auch Schnee abgelöst. Freitagvormittag sei ein leichter Sprühregen nicht ausgeschlossen, im Tagesverlauf werde es aber heiter u… [+1147 chars]",,de,'Schnee'
https://www.zeit.de/news/2023-03/03/mix-aus-wolken-regen-und-schnee-am-wochenende-erwartet,https://www.zeit.de/news/2023-03/03/mix-aus-wolken-regen-und-schnee-am-wochenende-erwartet,0,www.zeit.de,"Wetter: Mix aus Wolken, Regen und Schnee am Wochenende erwartet",,,2023-03-03T06:51:21Z,https://web.archive.org/web/20230303073711/https://www.zeit.de/news/2023-03/03/mix-aus-wolken-regen-und-schnee-am-wochenende-erwartet,"When browsing with ads:
We collect personal data and also transmit it to third-party providers
 that help us improve and finance our digital content. Some of the information stored on your device, … [+732 chars]",,de,'Schnee'
https://www.stern.de/gesellschaft/regional/nordrhein-westfalen/wetter--mix-aus-wolken--regen-und-schnee-am-wochenende-erwartet-33247842.html,https://www.stern.de/gesellschaft/regional/nordrhein-westfalen/wetter--mix-aus-wolken--regen-und-schnee-am-wochenende-erwartet-33247842.html,0,www.stern.de,"Wetter: Mix aus Wolken, Regen und Schnee am Wochenende erwartet","Das Wochenende in Nordrhein-Westfalen wird überwiegend regnerisch, mitunter schneit es auch. Freitagvormittag sei ein leichter Sprühregen nicht ausgeschlossen, im Tagesverlauf lockere es aber auf und im Süden zeigt sich zeitweise sogar die Sonne, wie der Deut…",https://image.stern.de/33247844/t/Zh/v1/w1440/r1.7778/-/03--urnnewsmldpacom2009010123030399811145v3w800h600l517t199r1607b1556jpeg---33b7cd86adf70f57.jpg,2023-03-03T06:51:21Z,,"Das Wochenende in Nordrhein-Westfalen wird überwiegend regnerisch, mitunter schneit es auch. Freitagvormittag sei ein leichter Sprühregen nicht ausgeschlossen, im Tagesverlauf lockere es aber auf und… [+1260 chars]",,de,'Schnee'
https://www.stern.de/gesellschaft/regional/sachsen/wetter--regen-und-schnee-am-wochenende-in-sachsen-33247906.html,https://www.stern.de/gesellschaft/regional/sachsen/wetter--regen-und-schnee-am-wochenende-in-sachsen-33247906.html,0,www.stern.de,Wetter: Regen und Schnee am Wochenende in Sachsen,"Mit Nebel, Frost und Glätte hält der Winter Sachsen am Wochenende weiter im Griff. Wie der Deutsche Wetterdienst in Leipzig mitteilte, lockert es bei drei bis sechs Grad am Freitagnachmittag zögernd auf. Den meisten Sonnenschein gibt es im oberen Erzgebirge. …",https://image.stern.de/33247908/t/NZ/v1/w1440/r1.7778/-/03--urnnewsmldpacom2009010123030399811383v3w800h600l936t271r2169b1641jpeg---cc07124639e7a9cf.jpg,2023-03-03T07:12:26Z,https://web.archive.org/web/20230303075326/https://www.stern.de/gesellschaft/regional/sachsen/wetter--regen-und-schnee-am-wochenende-in-sachsen-33247906.html,"Mit Nebel, Frost und Glätte hält der Winter Sachsen am Wochenende weiter im Griff. Wie der Deutsche Wetterdienst in Leipzig mitteilte, lockert es bei drei bis sechs Grad am Freitagnachmittag zögernd … [+995 chars]",,de,'Schnee'
https://www.zeit.de/news/2023-03/03/regen-und-schnee-am-wochenende-in-sachsen,https://www.zeit.de/news/2023-03/03/regen-und-schnee-am-wochenende-in-sachsen,0,www.zeit.de,Wetter: Regen und Schnee am Wochenende in Sachsen,,,2023-03-03T07:12:26Z,https://web.archive.org/web/20230303073641/https://www.zeit.de/news/2023-03/03/regen-und-schnee-am-wochenende-in-sachsen,"When browsing with ads:
We collect personal data and also transmit it to third-party providers
 that help us improve and finance our digital content. Some of the information stored on your device, … [+732 chars]",,de,'Schnee'
https://www.faz.net/aktuell/reise/pionier-der-klimaneutralitaet-das-skigebiet-carezza-18712139.html,https://www.faz.net/aktuell/reise/pionier-der-klimaneutralitaet-das-skigebiet-carezza-18712139.html,0,www.faz.net,Ein Leben für den Maschinenschnee,In den Achtzigerjahren wurde Georg Eisath zum Pionier der künstlichen Beschneiung. Jetzt macht sein Sohn Florian das Südtiroler Skigebiet Carezza zum Vorreiter der Klimaneutralität.,https://media1.faz.net/ppmedia/aktuell/3932939668/1.8712131/facebook_teaser/die-rettung-des-skifahrens.jpg,2023-03-03T07:18:55Z,https://web.archive.org/web/20230303085259/https://www.faz.net/aktuell/reise/pionier-der-klimaneutralitaet-das-skigebiet-carezza-18712139.html,Den glühenden Felsen des Rosengartens und den in allen Farben des Regenbogens schillernden Wassern des ihn spiegelnden Karersees verdanken die Dolomiten viele ihrer alten Sagen. Sie berichten nicht s… [+3931 chars],,de,'Schnee'
https://www.zeit.de/wirtschaft/2023-03/waermepumpen-nachfrage-steigt-energiewende-heizungsverbot-habeck,https://www.zeit.de/wirtschaft/2023-03/waermepumpen-nachfrage-steigt-energiewende-heizungsverbot-habeck,0,www.zeit.de,Energiewende: Produktion von Wärmepumpen deutlich gestiegen,Immer mehr Haushalte heizen statt mit Öl oder Gas mit einer Wärmepumpe. Die Produktion der klimafreundlichen Heizsysteme stieg im ersten Quartal um fast 50 Prozent.,,2023-03-03T08:40:07Z,https://web.archive.org/web/20230303092059/https://www.zeit.de/wirtschaft/2023-03/waermepumpen-nachfrage-steigt-energiewende-heizungsverbot-habeck,"When browsing with ads:
We collect personal data and also transmit it to third-party providers
 that help us improve and finance our digital content. Some of the information stored on your device, … [+732 chars]",,de,'Gas'
https://www.focus.de/wissen/natur/meteorologie/unwetter-alarm-schneesturm-bjoern-nimmt-deutschland-naechste-woche-ins-visier_id_187319431.html,https://www.focus.de/wissen/natur/meteorologie/unwetter-alarm-schneesturm-bjoern-nimmt-deutschland-naechste-woche-ins-visier_id_187319431.html,0,www.focus.de,Unwetter-Alarm! - Schneesturm Björn nimmt Deutschland nächste Woche ins Visier,Die Wetterlage stellt sich nach zuletzt milden Tagen um und kalte Grönlandluft erfasst Deutschland am Wochenende. Am Montag braut sich sogar ein Schneesturm zusammen: Schwere Sturmböen und neuer Schneefall erwarten uns.,https://p6.focus.de/img/fotos/id_187316172/de-schneesturm-bjoern.jpg?im=Crop%3D%280%2C50%2C1600%2C800%29%3BResize%3D%281200%2C627%29&impolicy=perceptual&quality=medium&hash=8f78ffb262affa76756c96d771302e0427875b13f4481079f30491986ce38423,2023-03-03T10:34:28Z,https://web.archive.org/web/20230303115255/https://www.focus.de/wissen/natur/meteorologie/unwetter-alarm-schneesturm-bjoern-nimmt-deutschland-naechste-woche-ins-visier_id_187319431.html,Die Wetterlage stellt sich nach zuletzt milden Tagen um und kalte Grönlandluft erfasst Deutschland am Wochenende. Am Montag braut sich sogar ein Schneesturm zusammen: Schwere Sturmböen und neuer Schn… [+4100 chars],,de,'Schnee'
https://www.tagesspiegel.de/sport/bibbern-statt-beachen-so-funktioniert-volleyball-bei-schnee-und-eis-9439307.html,https://www.tagesspiegel.de/sport/bibbern-statt-beachen-so-funktioniert-volleyball-bei-schnee-und-eis-9439307.html,0,www.tagesspiegel.de,Bibbern statt beachen: So funktioniert Volleyball bei Schnee und Eis,Snow-Volleyball wird auch in Deutschland immer populärer. Am Wochenende findet nun die Meisterschaft statt. Dafür wird seit Wochen Schnee deponiert.,https://www.tagesspiegel.de/images/snowvolleyball-meisterschaft/alternates/BASE_16_9_W1400/snowvolleyball-meisterschaft.jpeg,2023-03-03T12:06:43Z,https://web.archive.org/web/20230304124516/https://www.tagesspiegel.de/sport/bibbern-statt-beachen-so-funktioniert-volleyball-bei-schnee-und-eis-9439307.html,"Schnee und Volleyball passen auf den ersten Blick nicht so recht zusammen. Wer an Beach-Volleyball denkt, hat eher Strand, Sonne und warme Temperaturen im Kopf. Aber eben nur auf den ersten Blick. Am… [+3939 chars]",,de,'Eis'
https://www.zeit.de/wirtschaft/2023-03/energiepreisbremse-strom-gas-verbraucher-abschlagszahlungen,https://www.zeit.de/wirtschaft/2023-03/energiepreisbremse-strom-gas-verbraucher-abschlagszahlungen,0,www.zeit.de,Energiepreisbremse für Strom und Gas: Abhilfe beim achtfachen Abschlag,"Kaum greifen die Preisbremsen für Gas und Strom, verlangen einige Versorger 1.000 Euro an monatlicher Vorauszahlung. So wehren sich Verbraucher gegen hohe Abschläge.",,2023-03-03T12:41:40Z,https://web.archive.org/web/20230303132313/https://www.zeit.de/wirtschaft/2023-03/energiepreisbremse-strom-gas-verbraucher-abschlagszahlungen,"When browsing with ads:
We collect personal data and also transmit it to third-party providers
 that help us improve and finance our digital content. Some of the information stored on your device, … [+732 chars]",,de,'Gas'
https://www.focus.de/finanzen/gebraucht-kaufen-oder-mieten-heizung-kaputt-habeck-ministerium-beruhigt-buerger-mit-gewagter-prognose_id_187330248.html,https://www.focus.de/finanzen/gebraucht-kaufen-oder-mieten-heizung-kaputt-habeck-ministerium-beruhigt-buerger-mit-gewagter-prognose_id_187330248.html,0,www.focus.de,Gebraucht kaufen oder mieten - Heizung kaputt? Habeck-Ministerium beruhigt Bürger jetzt mit gewagter Prognose,"Während in der Ampel nach Habecks Heizungs-Hammer um das plötzliche Fehlen der Worte „soll“ und „Pflicht“ im Entwurf gerungen wird, sorgt das Bundeswirtschaftsministerium erneut für Aufsehen. Es erwartet einen Markt für gebrauchte Heizungen im Übergang und fü…",https://p6.focus.de/img/fotos/id_187312670/habeck1.jpg?im=Crop%3D%280%2C43%2C3464%2C1732%29%3BResize%3D%281200%2C627%29&impolicy=perceptual&quality=medium&hash=356dbb08972a5b3f8970fa7782ddf39ced95e483cad649030353cdf1913f7add,2023-03-03T13:39:53Z,https://web.archive.org/web/20230303145129/https://www.focus.de/finanzen/gebraucht-kaufen-oder-mieten-heizung-kaputt-habeck-ministerium-beruhigt-buerger-mit-gewagter-prognose_id_187330248.html,"Während in der Ampel nach Habecks Heizungs-Hammer um das plötzliche Fehlen der Worte soll und Pflicht im entsprechenden Gesetzes-Entwurf gerungen wird, sorgt das Bundeswirtschaftsministerium erneut f… [+8224 chars]",,de,'Heizung'
https://www.morgenpost.de/vermischtes/article237804559/mallorca-sturmschaeden-katastrophengebiet-schnee.html,https://www.morgenpost.de/vermischtes/article237804559/mallorca-sturmschaeden-katastrophengebiet-schnee.html,0,www.morgenpost.de,Unwetter mit Schnee: Mallorca: Mehrere Zonen sollen Katastrophengebiet werden,"Die von dem Sturmtief ""Juliette"" verwüsteten Gebiete auf Mallorca sollen zum Katastrophengebiet erklärt werden. Die aktuelle Lage.",https://img.morgenpost.de/img/vermischtes/crop237781471/863260690-w820-cv16_9-q85/Dicke-Schneedecke-auf-Mallorca-tiefster-Winter-in-Spanien.jpg,2023-03-03T15:57:31Z,,"Berlin/Palma. Nach dem verheerenden Sturmtief ""Juliette"" auf Mallorca sollen die verwüsteten Gebiete zum Katastrophengebiet erklärt werden. Einen entsprechenden Antrag hat die Balearenregierung bei d… [+1794 chars]",,de,'Schnee'
https://www.n-tv.de/mediathek/videos/wetter/Trueber-Samstag-gibt-Vorgeschmack-auf-Wintercomeback-article23956963.html,https://www.n-tv.de/mediathek/videos/wetter/Trueber-Samstag-gibt-Vorgeschmack-auf-Wintercomeback-article23956963.html,0,www.n-tv.de,Ab Sonntag wieder mehr Schnee: Trüber Samstag gibt Vorgeschmack auf Wintercomeback,"Nach einigen sehr sonnenreichen Tagen steht Deutschland ein ungemütlicher Witterungsmix ins Haus. Der Samstag startet mit Nebel, Glätte, teils starkem Wind und reichlich Niederschlag, den die Kälte ab Sonntag zunehmend in Flocken umwandelt.",https://bilder3.n-tv.de/img/incoming/crop23960170/5821325096-cImg_16_9-w1200/4193028c-7fb2-4854-8633-d9c7b9879498.jpg,2023-03-03T16:04:00Z,,,,de,'Schnee'
https://www.sueddeutsche.de/sport/freestyle-skiing-skicross-funparks-olympia-klimakrise-1.5762329,https://www.sueddeutsche.de/sport/freestyle-skiing-skicross-funparks-olympia-klimakrise-1.5762329,0,www.sueddeutsche.de,"SZ-Serie ""Wintersport in Zeiten des Klimawandels"": Salti in Airbags","Erst Corona, dann Schneemangel: Die Freestyle-Skiszene sucht kreativ nach Ausweichmöglichkeiten. Der Nachwuchs aber schlittert von einer Krise in die nächste. Teil 3 der Serie: Die Zukunft des Wintersports.",https://www.sueddeutsche.de/image/sz.1.5762331/1200x675?v=1677856510,2023-03-03T17:55:43Z,,"Erst Corona, dann Schneemangel: Die Freestyle-Skiszene sucht kreativ nach Ausweichmöglichkeiten. Der Nachwuchs aber schlittert von einer Krise in die nächste. Teil 3 der Serie: Die Zukunft des Winter… [+6088 chars]",,de,'Winter'
https://www.bild.de/regional/frankfurt/frankfurt-aktuell/ab-naechster-woche-wieder-schnee-der-winter-kommt-zurueck-83091880.bild.html,https://www.bild.de/regional/frankfurt/frankfurt-aktuell/ab-naechster-woche-wieder-schnee-der-winter-kommt-zurueck-83091880.bild.html,0,www.bild.de,Ab nächster Woche wieder Schnee - Der Winter kommt zurück,"Oh nee, wieder Schnee! Ab Montag sollen die ersten Flocken fallen.Foto: Michael Probst/AP","https://images.bild.de/6402510993423e01f3236a00/ff9570e5c50571e8d41b6102bb6ae9a4,6fe40248?w=1280",2023-03-03T20:20:05Z,,"Frankfurt Oh nee, wieder Schnee!
Seit 1. März ist offiziell Frühling aus meteorologischer Sicht. Aber wie die Meteorologen das sehen, scheint dem Winter ziemlich schnuppe zu sein. Denn bereits am Mo… [+2220 chars]",,de,'Schnee'
https://www.n-tv.de/sport/Eisenbichlers-WM-Granate-reicht-diesmal-nicht-article23960440.html,https://www.n-tv.de/sport/Eisenbichlers-WM-Granate-reicht-diesmal-nicht-article23960440.html,0,www.n-tv.de,"Planica-Party dank Timi Zajc: Eisenbichlers WM-""Granate"" reicht diesmal nicht","Gute Leistungen, aber diesmal keine Medaille: Die erstaunliche WM-Serie der deutschen Skispringer ist beendet. Der Sieg geht an einen Lokalmatador, der in beiden Durchgängen herausragend fliegt. Die DSV-Ergebnisse machen aber Mut für das Teamspringen.",https://bilder3.n-tv.de/img/incoming/crop23960446/8301327978-cImg_16_9-w1200/dea304e4d9a615bbb62b4058e19fd8c3.jpg,2023-03-03T20:24:44Z,,"Gute Leistungen, aber diesmal keine Medaille: Die erstaunliche WM-Serie der deutschen Skispringer ist beendet. Der Sieg geht an einen Lokalmatador, der in beiden Durchgängen herausragend fliegt. Die … [+4404 chars]",,de,'Schnee'
https://www.brigitte.de/aktuell/camping-im-winter--so-funktioniert-der-outdoor-spass-in-der-kalten-jahreszeit-13488794.html,https://www.brigitte.de/aktuell/camping-im-winter--so-funktioniert-der-outdoor-spass-in-der-kalten-jahreszeit-13488794.html,0,www.brigitte.de,Camping im Winter: So funktioniert der Outdoor-Spaß in der kalten Jahreszeit,"Camping im Winter ist durchaus bliebt. Wer in der kalten Jahreszeit losziehen möchte, sollte diese Dinge beachten.",https://image.brigitte.de/13488796/t/vz/v1/w1440/r1.7778/-/03--so-funktioniert-der-outdoor-spass-in-der-kalten-jahreszeit---1-1---spoton-article-1039629.jpg,2023-03-03T20:35:00Z,,"Camping im Winter ist durchaus bliebt. Wer in der kalten Jahreszeit losziehen möchte, sollte diese Dinge beachten.
Camping steht auch nach der Corona-Pandemie weiterhin hoch im Kurs. Viele holen ihr… [+2299 chars]",,de,'Schnee'
https://www.stern.de/kultur/camping-im-winter--einfache-tipps-fuer-die-kalte-jahreszeit-33250556.html,https://www.stern.de/kultur/camping-im-winter--einfache-tipps-fuer-die-kalte-jahreszeit-33250556.html,0,www.stern.de,Camping im Winter: Einfache Tipps für die kalte Jahreszeit,"Camping im Winter ist durchaus bliebt. Wer in der kalten Jahreszeit losziehen möchte, sollte diese Dinge beachten.",https://image.stern.de/33250560/t/tL/v1/w1440/r1.7778/-/03--einfache-tipps-fuer-die-kalte-jahreszeit---16-9---spoton-article-1039629.jpg,2023-03-03T20:39:00Z,,"Camping im Winter ist durchaus bliebt. Wer in der kalten Jahreszeit losziehen möchte, sollte diese Dinge beachten.
Camping steht auch nach der Corona-Pandemie weiterhin hoch im Kurs. Viele holen ihr… [+2299 chars]",,de,'Winter'
https://www.sueddeutsche.de/muenchen/ebersberg/landkreis-ebersberg-steinsee-eisbaden-moosach-eisschwimmen-1.5762269,https://www.sueddeutsche.de/muenchen/ebersberg/landkreis-ebersberg-steinsee-eisbaden-moosach-eisschwimmen-1.5762269,0,www.sueddeutsche.de,Eisbaden im Landkreis Ebersberg: Abtauchen im eiskalten Steinsee,"Während sich die meisten daheim in die warme Decke kuscheln, gehen ein paar Wagemutige einem ganz besonderen Hobby nach: Eisbaden. Auch im Steinsee im Landkreis Ebersberg traut man sich bei null Grad ins Wasser.",https://www.sueddeutsche.de/image/sz.1.5762274/1200x675?v=1677860566,2023-03-03T20:39:09Z,,"Während sich die meisten daheim in die warme Decke kuscheln, gehen ein paar Wagemutige einem ganz besonderen Hobby nach: Eisbaden. Auch im Steinsee im Landkreis Ebersberg traut man sich bei null Grad… [+5531 chars]",,de,'Eis'
https://www.mobiflip.de/shortnews/waermepumpen-absatz-in-deutschland-steigt-deutlich/,https://www.mobiflip.de/shortnews/waermepumpen-absatz-in-deutschland-steigt-deutlich/,0,www.mobiflip.de,Wärmepumpen-Absatz in Deutschland steigt deutlich,"Im Jahr 2022 sind knapp eine Million Heizungen neu installiert worden, wie der Bundesverband der Deutschen Heizungsindustrie BDH berichtet. Als klimafreundlich geltende Wärmepumpen verzeichnen dabei […]",https://www.mobiflip.de/wp-content/uploads/2023/03/stiebel-eltron-wp-2023.jpg,2023-03-04T07:08:11Z,,"Im Jahr 2022 sind knapp eine Million Heizungen neu installiert worden, wie der Bundesverband der Deutschen Heizungsindustrie BDH berichtet.
Als klimafreundlich geltende Wärmepumpen verzeichnen dabei… [+2389 chars]",,de,'Heizen'
https://www.handelsblatt.com/finanzen/immobilien/immobilien-heizungsverbot-fuer-oel-und-gas-so-mischt-der-plan-den-immobilienmarkt-auf/29013892.html,https://www.handelsblatt.com/finanzen/immobilien/immobilien-heizungsverbot-fuer-oel-und-gas-so-mischt-der-plan-den-immobilienmarkt-auf/29013892.html,0,www.handelsblatt.com,Immobilien: Heizungsverbot für Öl und Gas: So mischt der Plan den Immobilienmarkt auf,Das Bundeswirtschaftsministerium will die Vorschriften für Wärmeerzeugung in Gebäuden ab 2024 verschärfen. Was auf Eigentümer zukommt.,https://www.handelsblatt.com/images/heizoel/29014024/2-format2003.jpg,2023-03-04T10:00:00Z,http://archive.md/20230304101446/https://www.handelsblatt.com/finanzen/immobilien/immobilien-heizungsverbot-fuer-oel-und-gas-so-mischt-der-plan-den-immobilienmarkt-auf/29013892.html,"HeizölEin Mitarbeiter befüllt den Tank eines Hauses mit Heizöl vor. Geht es nach den Plänen des Bundeswirtschaftsministeriums, wird die Zahl der Kundschaft bald kleiner. 
(Foto: dpa)
Frankfurt Die … [+1394 chars]",,de,'Heizung'
https://www.morgenpost.de/vermischtes/article237808169/Maerzwetter-bleibt-weiter-ungemuetlich.html,https://www.morgenpost.de/vermischtes/article237808169/Maerzwetter-bleibt-weiter-ungemuetlich.html,0,www.morgenpost.de,Vorhersage: Märzwetter bleibt weiter ungemütlich,Der Winter ist noch nicht vorbei. In den kommenden Tagen sind nach der Vorhersage bis in tiefere Lagen Schneeschauer und Schneeregen möglich. Wo ist Sonne in Sicht?,https://img.morgenpost.de/img/vermischtes/crop237808167/2442609579-w820-cv16_9-q85/Winterdienst.jpg,2023-03-04T11:57:16Z,,"Offenbach. Der März bleibt in Deutschland weiter ungemütlich. Winterkleidung und Winterreifen haben noch nicht ausgedient, sagte die Meteorologin des Deutschen Wetterdienstes (DWD), Jacqueline Kernn.… [+779 chars]",,de,'Winter'
https://www.faz.net/aktuell/wirtschaft/neues-gesetz-fuer-heizungen-18721038.html,https://www.faz.net/aktuell/wirtschaft/neues-gesetz-fuer-heizungen-18721038.html,0,www.faz.net,Habecks Heizungsgesetz: Die Bürger bekommen die Kosten der Energiewende zu spüren,Bundeswirtschaftsminister Robert Habeck will den Betrieb von Öl- und Gasheizungen einschränken. Der Aufschrei ist laut – die Folgen enorm. Das Vorhaben wird zum bisher größten Härtetest für die Energiewende.,https://media0.faz.net/ppmedia/aktuell/2182678329/1.8721340/facebook_teaser/noch-rauchen-die-schornsteine.jpg,2023-03-04T12:08:23Z,,"Der Satz, an den die Deutschen diese Woche unsanft erinnert wurden, ist eigentlich keine Neuigkeit: Wir werden jetzt gesetzlich festschreiben, dass ab dem 1. Januar 2024 möglichst jede neu eingebaute… [+3070 chars]",,de,'Heizung'
https://www.wiwo.de/finanzen/immobilien/verbot-fuer-oel-und-gasheizungen-das-gasheizungsverbot-wird-ein-rohrkrepierer/29013310.html,https://www.wiwo.de/finanzen/immobilien/verbot-fuer-oel-und-gasheizungen-das-gasheizungsverbot-wird-ein-rohrkrepierer/29013310.html,0,www.wiwo.de,Verbot für Öl- und Gasheizungen: „Das Gasheizungsverbot wird ein Rohrkrepierer“,SPD und Grüne forcieren den Austausch von Heizungen. Sanierungsexperte Thomas Rolf Hermes hält das für übereilt – und warnt vor überforderten privaten Hauseigentümern.,https://www.wiwo.de/images/100-pro-imago-life-2-152638372-highres/29016150/2-format11240.jpg,2023-03-05T09:28:19Z,http://archive.md/20230305181117/https://www.wiwo.de/finanzen/immobilien/verbot-fuer-oel-und-gasheizungen-das-gasheizungsverbot-wird-ein-rohrkrepierer/29013310.html,Theorie trifft auf Realität: Der Hamburger Sanierungsspezialist Thomas Rolf Hermes nimmt derzeit an den Anhörungen in Berlin zur Reform des Gebäudeenergiegesetzes (GEG) teil. Besonders heiß wird das … [+4687 chars],,de,'Heizung'
https://www.n-tv.de/panorama/Spaetwinter-bringt-Kaelte-und-Sturmboeen-article23962353.html,https://www.n-tv.de/panorama/Spaetwinter-bringt-Kaelte-und-Sturmboeen-article23962353.html,0,www.n-tv.de,Die Wetterwoche im Schnellcheck: Spätwinter bringt Kälte und Sturmböen,"Der März bleibt ungemütlich, der Frühling ist noch nicht in Sicht. Stattdessen kommen mit der feuchtkalten Polarluft auch Schneeregen und Glätte bis ins Flachland. Mitte der Woche erfasst dann ein Sturmtief weite Teile Deutschlands.",https://bilder4.n-tv.de/img/incoming/crop23962387/5531325534-cImg_16_9-w1200/275441080.jpg,2023-03-05T12:08:47Z,https://web.archive.org/web/20230306141427/https://www.n-tv.de/panorama/Spaetwinter-bringt-Kaelte-und-Sturmboeen-article23962353.html,"Der März bleibt ungemütlich, der Frühling ist noch nicht in Sicht. Stattdessen kommen mit der feuchtkalten Polarluft auch Schneeregen und Glätte bis ins Flachland. Mitte der Woche erfasst dann ein St… [+4584 chars]",,de,'Frost'
