index,url,valid,domain,title,description,image,published,archive,content,quote,language,keyword
https://www.bild.de/sport/fussball/gefaellt-ihnen-das-mir-nicht-neue-diskussionen-um-ruediger-aussagen-69bbae091434ac10119516f9,https://www.bild.de/sport/fussball/gefaellt-ihnen-das-mir-nicht-neue-diskussionen-um-ruediger-aussagen-69bbae091434ac10119516f9,0,www.bild.de,„Gefällt Ihnen das? Mir nicht!“ - Neue Diskussionen um Rüdiger-Aussagen,Real-Star Antonio Rüdiger sorgt erneut für Aufsehen. In „Reif ist live“ wird darüber diskutiert.,"https://images.bild.de/69bbae091434ac10119516f9/cdfc40aa038ad8f2be019dea46f5cf01-landscape,7984ec14?w=1280",2026-03-19T11:16:51Z,,"Mehr zum Video anzeigen 
Real-Star Antonio Rüdiger sorgt erneut für Aufsehen. In Reif ist live wird darüber diskutiert.
Quelle: BILD19.03.2026 - 12:16 Uhr",,de,'Reif'
https://www.bild.de/sport/fussball/haben-sie-es-mitbekommen-eberl-verraet-ploetzlich-neuen-bayern-rekord-69bbcf88d3cf984a3adb752b,https://www.bild.de/sport/fussball/haben-sie-es-mitbekommen-eberl-verraet-ploetzlich-neuen-bayern-rekord-69bbcf88d3cf984a3adb752b,0,www.bild.de,Haben Sie es mitbekommen? - Eberl verrät plötzlich neuen Bayern-Rekord!,Der FC Bayern stellt in der Champions League einen neuen Bestwert auf. In „Reif ist live“ wird eine Aussage von Max Eberl analysiert.,"https://images.bild.de/69bbcf88d3cf984a3adb752b/31d275e1b9595bf514c914b2e3778d9a-landscape,b0099461?w=1280",2026-03-19T11:17:46Z,,"Mehr zum Video anzeigen 
Der FC Bayern stellt in der Champions League einen neuen Bestwert auf. In Reif ist live wird eine Aussage von Max Eberl analysiert.
Quelle: BILD19.03.2026 - 12:17 Uhr",,de,'Reif'
https://www.bild.de/sport/fussball/hintern-versohlt-witznummer-knallhart-abrechnung-mit-der-premier-league-69bbd0d8d3cf984a3adb7576,https://www.bild.de/sport/fussball/hintern-versohlt-witznummer-knallhart-abrechnung-mit-der-premier-league-69bbd0d8d3cf984a3adb7576,0,www.bild.de,„Hintern versohlt!“ „Witznummer!“ - Knallhart-Abrechnung mit der Premier League,Mit Liverpool und Arsenal sind nur noch zwei Premier-League-Vertreter in der Champions League vertreten. Marcel Reif findet in „Reif ist live“ deutliche ...,"https://images.bild.de/69bbd0d8d3cf984a3adb7576/74a38a99944039d598e12fa3bf91d528-landscape,3ebc357?w=1280",2026-03-19T11:18:15Z,,"Mehr zum Video anzeigen 
Mit Liverpool und Arsenal sind nur noch zwei Premier-League-Vertreter in der Champions League vertreten. Marcel Reif findet in Reif ist live deutliche Worte.
Quelle: BILD19… [+19 chars]",,de,'Reif'
https://www.bild.de/sport/fussball/ich-glaube-die-reise-ist-zu-ende-erstaunliche-pep-pk-laesst-zuschauer-raetseln-69bbd24392f222671ccb3530,https://www.bild.de/sport/fussball/ich-glaube-die-reise-ist-zu-ende-erstaunliche-pep-pk-laesst-zuschauer-raetseln-69bbd24392f222671ccb3530,0,www.bild.de,"„Ich glaube, die Reise ist zu Ende“ - Erstaunliche Pep-PK lässt Zuschauer rätseln",Pep Guardiola wirkt nach der ManCity-Pleite gegen Real Madrid konsterniert. Marcel Reif hat in „Reif ist live“ ein klares Gefühl.,"https://images.bild.de/69bbd24392f222671ccb3530/1805d81496870026c9356f3a20e6d75d-landscape,cf6af762?w=1280",2026-03-19T11:19:27Z,,"Mehr zum Video anzeigen 
Pep Guardiola wirkt nach der ManCity-Pleite gegen Real Madrid konsterniert. Marcel Reif hat in Reif ist live ein klares Gefühl.
Quelle: BILD19.03.2026 - 12:19 Uhr",,de,'Reif'
https://www.bild.de/sport/fussball/ich-weiss-von-nichts-urbig-voellig-ueberrascht-von-news-69bbd2da1434ac1011951acc,https://www.bild.de/sport/fussball/ich-weiss-von-nichts-urbig-voellig-ueberrascht-von-news-69bbd2da1434ac1011951acc,0,www.bild.de,„Ich weiß von nichts!“ - Urbig völlig überrascht von News,Fährt Jonas Urbig zum DFB-Team? Seine Aussage wird in „Reif ist live“ diskutiert.,"https://images.bild.de/69bbd2da1434ac1011951acc/978d8b3ca03c4a74d6878c27361e2362-landscape,cd8d21a9?w=1280",2026-03-19T11:20:10Z,,"Mehr zum Video anzeigen 
Fährt Jonas Urbig zum DFB-Team? Seine Aussage wird in Reif ist live diskutiert.
Quelle: BILD19.03.2026 - 12:20 Uhr",,de,'Reif'
https://www.bild.de/sport/fussball/reif-ist-live-vom-19-03-26-bayern-gala-england-abrechnung-69bbeb19d225a75f4a234d1e,https://www.bild.de/sport/fussball/reif-ist-live-vom-19-03-26-bayern-gala-england-abrechnung-69bbeb19d225a75f4a234d1e,0,www.bild.de,Reif ist Live vom 19.03.26 - Bayern-Gala! England-Abrechnung!,Der FC Bayern zieht wie erwartet ins Champions-League-Viertelfinale ein und trifft dort auf Real Madrid. Die Königlichen schalten Manchester City aus. Da...,"https://images.bild.de/69bbeb19d225a75f4a234d1e/b1ff6d959f494aece14ed2fdcd130dd6-landscape,cbb552b7?w=1280",2026-03-19T12:33:20Z,,"+++Virtuelle Vergewaltigung: Collien Fernandes zeigt Ex Christian Ulmen an
+++Virtuelle Vergewaltigung: Collien Fernandes zeigt Ex Christian Ulmen an
+++Virtuelle Vergewaltigung: Collien Fernandes … [+558 chars]",,de,'Reif'
https://www.tagesschau.de/wirtschaft/weltwirtschaft/gaspreise-trump-iran-katar-lng-100.html,https://www.tagesschau.de/wirtschaft/weltwirtschaft/gaspreise-trump-iran-katar-lng-100.html,0,www.tagesschau.de,Trump droht Iran: Warum die Gaspreise jetzt so stark steigen,"Nach den Angriffen auf Energieanlagen im Nahen Osten schnellen die Gaspreise in Europa nach oben. Im Fokus: das größte Gasfeld der Welt. Für den Weltmarkt ist vor allem der Teil relevant, der zu Katar gehört. Von Angela Göpfert.",https://images.tagesschau.de/image/aa34307a-4fb9-44b6-b3bc-fb5543912801/AAABnQXeMcM/AAABmyZE0EA/16x9-big/iran-gasfeld-100.jpg?width=1280,2026-03-19T16:16:50Z,,"Stand: 19.03.2026 17:16 Uhr
Nach den Angriffen auf Energieanlagen im Nahen Osten schnellen die Gaspreise in Europa nach oben. Im Fokus: das größte Gasfeld der Welt. Für den Weltmarkt ist vor allem d… [+4114 chars]",,de,'Gas'
https://www.zeit.de/politik/ausland/2026-03/fluessiggas-golf-angriffe-terminal-iran-katar,https://www.zeit.de/politik/ausland/2026-03/fluessiggas-golf-angriffe-terminal-iran-katar,0,www.zeit.de,Flüssiggas am Golf: Das bedeuten die Angriffe auf Gasanlagen für den Iran – und die Welt,Im Irankrieg fällt ein Tabu: Energieanlagen werden zum Ziel. Die Folgen für den weltweiten Gasmarkt sind enorm. Sie könnten lange anhalten.,https://img.zeit.de/politik/ausland/2026-03/fluessiggas-golf-angriffe-terminal-iran-katar-bild/wide__1300x731,2026-03-19T19:09:26Z,,"Der Irankrieg hat die
Weltwirtschaft bereits hart getroffen. Die Straße von Hormus ist blockiert, Hunderte Schiffe stecken im Arabischen Golf fest, das hat die Preise für Öl und Gas bereits ansteige… [+433 chars]",,de,'Gas'
https://www.zeit.de/news/2026-03/20/finale-skisaison-endet-anbieter-ziehen-bilanz,https://www.zeit.de/news/2026-03/20/finale-skisaison-endet-anbieter-ziehen-bilanz,0,www.zeit.de,Wintersport: Finale: Skisaison endet - Anbieter ziehen Bilanz,Hier finden Sie Informationen zu dem Thema „Wintersport“. Lesen Sie jetzt „Finale: Skisaison endet - Anbieter ziehen Bilanz“.,https://img.zeit.de/news/2026-03/20/finale-skisaison-endet-anbieter-ziehen-bilanz-image-group/wide__1300x731,2026-03-20T04:00:44Z,,"Der Frühling bricht sich seit Wochen bis in die Berge Bahn, doch in Eibenstock im Erzgebirge wird nach wie vor Ski gefahren. «Auf alle Fälle am Wochenende bei vorhergesagtem schönen Wetter und einer … [+3254 chars]",,de,'Winter'
https://www.stern.de/gesellschaft/regional/niedersachsen-bremen/optimale-wetterbedingungen--spargelbauern-stehen-in-den-startloechern-37238860.html,https://www.stern.de/gesellschaft/regional/niedersachsen-bremen/optimale-wetterbedingungen--spargelbauern-stehen-in-den-startloechern-37238860.html,0,www.stern.de,Optimale Wetterbedingungen: Spargelbauern stehen in den Startlöchern,Die Voraussetzungen für eine gute Spargelernte sind in diesem Jahr nach Expertenansicht gut: Die Pflanzen haben Kälte bekommen - nun dürfte bei Sonnenwetter eine gute Qualität wachsen.,https://image.stern.de/37238862/t/6h/v1/w1440/r1.7778/-/20--4pgdf4o637v16axs2048jpeg---129db2841b70a515.jpg,2026-03-20T04:30:04Z,,"Kopiere den aktuellen Link
Zur Merkliste hinzufügen
Die Voraussetzungen für eine gute Spargelernte sind in diesem Jahr nach Expertenansicht gut: Die Pflanzen haben Kälte bekommen - nun dürfte bei S… [+1421 chars]",,de,'Kälte'
https://www.morgenpost.de/panorama/article411497280/kanaren-teneriffa-unwetter-regen-inseln-kachelmann-sturm-urlaub.html,https://www.morgenpost.de/panorama/article411497280/kanaren-teneriffa-unwetter-regen-inseln-kachelmann-sturm-urlaub.html,0,www.morgenpost.de,Kanaren: Regenmassen erreichen Teneriffa & Co. – dramatische Prognose,"Sturm, Starkregen und Schnee: Die Kanaren werden von schwerem Unwetter heimgesucht. Warnung gilt bis Sonntag. Flüge und Fähren betroffen.",https://img.sparknews.funkemedien.de/411507475/411507475_1773938629_v16_9_1600.jpeg,2026-03-20T12:58:43Z,,"<ul><li>Auf Teneriffa, La Palma, La Gomera und El Hierro werden extreme Regenmengen erwartet</li><li>Schulen und Kindergärten bleiben geschlossen, Inselbewohner sollen zu Hause bleiben</li><li>Flüge … [+3818 chars]",,de,'Schnee'
https://www.focus.de/panorama/krankheit-zwingt-anna-in-voellige-dunkelheit-und-isolation_b40beaf0-6152-47c7-bde6-73f6c2535eda.html,https://www.focus.de/panorama/krankheit-zwingt-anna-in-voellige-dunkelheit-und-isolation_b40beaf0-6152-47c7-bde6-73f6c2535eda.html,0,www.focus.de,Krankheit zwingt Anna in völlige Dunkelheit und Isolation,"Anna (42) leidet wie rund 650.000 weitere Menschen in Deutschland an ME/CFS, einer schweren organischen Erkrankung. Schon kleinste Reize können Patienten extrem beanspruchen.","https://quadro.burda-forward.de/ctf/b3332877-ca36-4c54-8c65-ef727ab9945b.addce856-9225-464e-b1e0-e44e7385dca8.jpg?im=RegionOfInterestCrop=(1200,630),regionOfInterest=(754,357)&hash=3343c8232cfcf36f2862d7b94e57f6148e98c2709c6608b01630a5f3fde8d214",2026-03-20T13:32:00Z,,"Für Anna ist jeder Lichtstrahl, jedes Geräusch, selbst eine Berührung eine Qual. Ihr Alltag spielt sich in völliger Dunkelheit und Isolation ab. Nahrung und Wasser kann ihr Körper nur eingeschränkt a… [+2283 chars]",,de,'Dunkelheit'
https://www.faz.net/aktuell/reise/trois-vallees-skifahren-in-der-franzoesischen-retorte-110855091.html,https://www.faz.net/aktuell/reise/trois-vallees-skifahren-in-der-franzoesischen-retorte-110855091.html,0,www.faz.net,Brutalismus in den Alpen: Masterplan für den Schnee,Brutalistische Architektur in französischen Skiorten Val Thorens und Les Menuires ist nachhaltig.,https://media0.faz.net/image/w1200h627/5e4c27e2f168/w3775h1972x0y207o/202603/086a18cc-7b3f-481e-911e-1b62d7e513a2/der-apartmentkomplex-le-brelin.webp,2026-03-20T13:43:54Z,,"Die Sonne brennt. Man könnte Schirme aufstellen, aber sie würden die Sicht versperren: auf die Schneesportler, die direkt vor den Loungemöbeln die Piste La Val Tho hinabschwingen, auf die tief versch… [+517 chars]",,de,'Schnee'
https://www.tagesspiegel.de/potsdam/landeshauptstadt/bei-jedem-wetter-in-die-havel-die-potsdamerin-die-zwischen-eisschollen-schwimmt-15383168.html,https://www.tagesspiegel.de/potsdam/landeshauptstadt/bei-jedem-wetter-in-die-havel-die-potsdamerin-die-zwischen-eisschollen-schwimmt-15383168.html,0,www.tagesspiegel.de,"Bei jedem Wetter in die Havel: Die Potsdamerin, die zwischen Eisschollen schwimmt","Egal ob Sonne, Regen oder Schnee: Petra Hünnebeck geht jeden Tag draußen schwimmen. Vor viereinhalb Jahren fing sie während Corona damit an – und konnte nicht mehr aufhören.",https://www.tagesspiegel.de/images/15383167/alternates/BASE_16_9_W1400/1774015197000/taglich-in-die-havel.jpeg,2026-03-20T15:37:05Z,,"Ein klarer Morgen im März in Potsdam: Die Sonne geht auf, die Havel ist glatt wie ein Spiegel, die Wassertemperatur liegt bei 6 Grad. Langsam geht Petra Hünnebeck vom Ufer ins Wasser, lässt sich hine… [+269 chars]",,de,'Eis'
https://www.focus.de/sport/olympische-winterspiele/litauischer-olympia-biathlet-stirbt-mit-nur-27-jahren_e3686005-a7c9-45f0-9523-687db1c4401f.html,https://www.focus.de/sport/olympische-winterspiele/litauischer-olympia-biathlet-stirbt-mit-nur-27-jahren_e3686005-a7c9-45f0-9523-687db1c4401f.html,0,www.focus.de,Olympia-Biathlet stirbt mit nur 27 Jahren,"Große Trauer im litauischen Sport: Der Winter-Olympia-Teilnehmer von Peking 2022, Linas Banys, stirbt mit nur 27 Jahren.","https://quadro.burda-forward.de/ctf/6c315814-b87b-4471-b23c-04413485cccf.5b329afd-67a4-4310-a043-9a97d6aa1ff0.png?im=RegionOfInterestCrop=(1200,630),regionOfInterest=(788,401)&hash=fed0cdae11a2045f557f4676462adeebddd78cbc12c4f211715cb93f245f41ad",2026-03-20T16:25:00Z,,Linas Banys war Olympia-Teilnehmer für Litauen und einer der bekanntesten Biathleten seines Landes. Der Wintersportler ist im Alter von nur 27 Jahren verstorben. Der litauische Biathlon-Verband LBF b… [+1713 chars],,de,'Winter'
https://www.sueddeutsche.de/sport/biathlon-finale-gesamtweltcup-perrot-jeanmonnot-li.3456237,https://www.sueddeutsche.de/sport/biathlon-finale-gesamtweltcup-perrot-jeanmonnot-li.3456237,0,www.sueddeutsche.de,Biathlon: Nawrath am Podest vorbei – Perrot holt Gesamtweltcup,Der beste deutsche Biathlet liefert erneut eine gute Leistung. Die beiden Hauptpreise der Wintersaison gehen an Frankreich.,https://www.sueddeutsche.de/2026/03/20/ef0135dd-2969-452d-964e-39c9302babbc.jpg?q=60&fm=webp&width=1200&rect=0%2C209%2C4000%2C2250,2026-03-20T16:41:16Z,,Stattdessen holte sich Sieger Sturla Holm Lägreid noch die kleine Kristallkugel. Der Franzose Eric Perrot schnappte sich derweil bereits zwei Rennen vor Ende des Winters mit der großen Kristallkugel … [+1431 chars],,de,'Winter'
https://www.sueddeutsche.de/bayern/zugspitze-schneeferner-schlepplift-sprengung-gletscherschwund-li.3454504,https://www.sueddeutsche.de/bayern/zugspitze-schneeferner-schlepplift-sprengung-gletscherschwund-li.3454504,0,www.sueddeutsche.de,Schlepplift am Nördlichen Schneeferner gesprengt: Detonation mit Dominoeffekt auf der Zugspitze,Die letzten Gletscher auf Deutschlands höchstem Berg schmelzen immer schneller dahin. Deswegen hat sich die Bayerische Zugspitzbahn nun per Sprengladung von ihrem Schlepplift über den Nördlichen Schneeferner getrennt.,https://www.sueddeutsche.de/2026/03/20/5c5c38fb-5968-4aa3-be9c-d7f44d687977.jpg?q=60&fm=webp&width=1200&rect=0%2C209%2C4000%2C2250,2026-03-20T17:11:25Z,,"Die letzten Skifahrer sind längst weg, aber das Medienaufgebot ist umso größer, als am späten Freitagnachmittag ein erster und dann ein zweiter Signalton vom Abhang des Schneefernerkopfs herüberwehen… [+5886 chars]",,de,'Schnee'
https://www.focus.de/finanzen/aus-fuer-putins-gas-eu-entscheidung-bringt-neue-verluste_8d948e25-d445-45a8-9193-49658dea7753.html,https://www.focus.de/finanzen/aus-fuer-putins-gas-eu-entscheidung-bringt-neue-verluste_8d948e25-d445-45a8-9193-49658dea7753.html,0,www.focus.de,Aus für Putins Gas – EU-Entscheidung bringt neue Verluste,Seit 2022 löst sich die EU von russischen Energieimporten. 2027 sollen die letzten Länder die Importe einstellen. Muss dann Deutschland liefern?,"https://quadro.burda-forward.de/ctf/e7021c92-c597-4acf-87fd-0492f0fccb6e.7ee1acc3-5ebd-4dba-a439-37885667f67b.jpg?im=RegionOfInterestCrop=(1200,630),regionOfInterest=(2880,2250)&hash=96d0569c74a6986f95ede1d8926aaee03257c406a2fea5baa194c0421485ac76",2026-03-20T17:46:00Z,,Ab 1. Januar 2027 darf kein russisches Flüssigerdgas (LNG) mehr nach Europa fließen. Im selben Jahr sollen auch die Pipeline-Gasimporte enden. Das soll wichtige Einnahmen für den Kreml verhindern. Fü… [+3763 chars],,de,'Winter'
https://www.welt.de/regionales/berlin/article69bd8fdce5e9d619745d1cdb/new-york-schneechaos-legt-stadt-lahm.html,https://www.welt.de/regionales/berlin/article69bd8fdce5e9d619745d1cdb/new-york-schneechaos-legt-stadt-lahm.html,0,www.welt.de,Test Artikel Headline,Fast ein Meter Schnee im Nordosten der USA. 500.000 Haushalte ohne Strom. Bürgermeister zahlt Helfern 30 Dollar je Stunde.,https://img.welt.de/img/masters/mobile160492822/7651629427-ci16x9-w1200/welt-fallback-jpg.jpg,2026-03-20T18:20:12Z,,Schneemassen legten den Nordosten der USA lahm. Hunderttausende Haushalte waren ohne Strom. Tausende Flüge wurden gestrichen. New Yorks Bürgermeister Zohran Mamdani rief die Bevölkerung zu Hilfe: Wer… [+3257 chars],,de,'Winter'
https://www.bild.de/news/ausland/new-york-schneechaos-legt-stadt-lahm-69bd8ff18f5761671715a0f5,https://www.bild.de/news/ausland/new-york-schneechaos-legt-stadt-lahm-69bd8ff18f5761671715a0f5,0,www.bild.de,Test Artikel Kicker - Test Artikel Headline,Schneemassen legten den Nordosten der USA lahm. Hunderttausende Haushalte waren ohne Strom. Tausende Flüge wurden gestrichen. New Yo...,https://a.bildstatic.de/assets/social-fallback-xwOAZY_4.jpg,2026-03-20T18:20:33Z,,TTS-Player überspringenArtikel weiterlesenSchneemassen legten den Nordosten der USA lahm. Hunderttausende Haushalte waren ohne Strom. Tausende Flüge wurden gestrichen. New Yorks Bürgermeister Zohran … [+3173 chars],,de,'Winter'
https://www.nzz.ch/sport/ski/ski-alpin-corinne-suter-blickt-vor-dem-weltcupfinale-auf-ihre-turbulente-saison-zurueck-ld.1929986,https://www.nzz.ch/sport/ski/ski-alpin-corinne-suter-blickt-vor-dem-weltcupfinale-auf-ihre-turbulente-saison-zurueck-ld.1929986,0,www.nzz.ch,Corinne Suter fühlt sich wieder mit ihren Ski verbunden und stärker denn je – trotz schwieriger Saison,"Mit 31 Jahren hat Suter nochmals Fortschritte gemacht. Bloss konnte sie das in diesem Winter wegen einer Verletzung lange nicht zeigen, erst nach Olympia machte es klick. Weshalb?","https://img.nzz.ch/2026/03/20/5e2f26cb-3d55-43c7-afc7-b6f4f9cc9b4b.jpg?width=1200&height=675&fit=bounds&quality=75&auto=webp&crop=2624,1476,x0,y1230&wmark=nzz",2026-03-21T04:30:00Z,,"Mit 31 Jahren hat Suter nochmals Fortschritte gemacht. Bloss konnte sie das in diesem Winter wegen einer Verletzung lange nicht zeigen, erst nach Olympia machte es klick. Weshalb?
Zusammenfassung
M… [+6089 chars]",,de,'Winter'
https://www.autobild.de/artikel/vergleichstest-audi-s3-limousine-vs.-bmw-m235-xdrive-gran-coupe-28519031.html,https://www.autobild.de/artikel/vergleichstest-audi-s3-limousine-vs.-bmw-m235-xdrive-gran-coupe-28519031.html,0,www.autobild.de,Neue Stärke im S3: Reicht das gegen den M235i?,Zwischen Herbst und Winter treffen sich zwei kompakte Allradlimousinen zum Drei-Wetter-Haft-Duell. Welche macht mehr Laune: Audi S3 oder BMW M235?,https://i.auto-bild.de/ir_img/4/0/3/7/4/3/5/Audi-S3-Limousine-vs--BMW-M235-xDrive-Gran-Coup--2869-1800x1012-c052434177b35642.jpg?impolicy=og_images,2026-03-21T05:00:00Z,,"In der nasskalten Jahreszeit ist Fahrspaß gar nicht so leicht aufzuspüren. Hier bei uns täuscht er gerade nur an, versteckt im Wald hinter den Schildern mit der schwarzen Fünfzig im roten Ring. Licht… [+7215 chars]",,de,'Winter'
https://www.welt.de/wirtschaft/plus69b7ac1017184da7cffdb072/duengen-maehen-vertikutieren-diese-fehler-ruinieren-ihren-rasen.html,https://www.welt.de/wirtschaft/plus69b7ac1017184da7cffdb072/duengen-maehen-vertikutieren-diese-fehler-ruinieren-ihren-rasen.html,0,www.welt.de,"Düngen, mähen, vertikutieren – So retten Sie nach diesem Winter Ihren Rasen","Viele Gartenbesitzer schauen gerade voller Sorge auf ihren Rasen, der dringend die richtige Pflege braucht. Doch was genau ist jetzt zu tun und in welcher Reihenfolge? Ein Top-Spezialist liefert WELT die Antworten.",https://images.welt.de/69b7ac1017184da7cffdb072/1ccb4d3a1c00d142e1e5344abd9f5963-master/ci16x9-w1200/gettyimages-839120208-jpg,2026-03-21T06:19:31Z,,"Viele Gartenbesitzer schauen gerade voller Sorge auf ihren Rasen, der dringend die richtige Pflege braucht. Doch was genau ist jetzt zu tun und in welcher Reihenfolge? Ein Top-Spezialist liefert WELT… [+14 chars]",,de,'Winter'
https://www.zeit.de/news/2026-03/21/nach-dem-wetter-mix-kommt-die-kaelte-zurueck,https://www.zeit.de/news/2026-03/21/nach-dem-wetter-mix-kommt-die-kaelte-zurueck,0,www.zeit.de,Wetter: Nach dem Wetter-Mix kommt die Kälte zurück,Hier finden Sie Informationen zu dem Thema „Wetter“. Lesen Sie jetzt „Nach dem Wetter-Mix kommt die Kälte zurück“.,https://img.zeit.de/news/2026-03/21/nach-dem-wetter-mix-kommt-die-kaelte-zurueck-image-group/wide__1300x731,2026-03-21T06:25:28Z,,"Sonnencreme oder Schirm, das könnte beim Blick an den Himmel an diesem Wochenende die nicht ganz unwichtige Frage sein. Meteorologen würden beim Spaziergang wohl beides empfehlen. Denn sie erwarten i… [+1613 chars]",,de,'Schnee'
https://www.stern.de/gesellschaft/regional/baden-wuerttemberg/wetter--nach-dem-wetter-mix-kommt-die-kaelte-zurueck-37241880.html,https://www.stern.de/gesellschaft/regional/baden-wuerttemberg/wetter--nach-dem-wetter-mix-kommt-die-kaelte-zurueck-37241880.html,0,www.stern.de,Wetter: Nach dem Wetter-Mix kommt die Kälte zurück,"Stuttgart (lsw) - Sonnencreme oder Schirm, das könnte beim Blick an den Himmel an diesem Wochenende die nicht ganz unwichtige Frage sein. Meteorologen",https://image.stern.de/37241882/t/Sx/v1/w1440/r1.7778/-/21--vfy7xbwze3v3axs2048jpeg---351d30c394845f2a.jpg,2026-03-21T06:25:28Z,,"Kopiere den aktuellen Link
Zur Merkliste hinzufügen
Sonne, Regen und Wind: Das Wetter bleibt am Wochenende wechselhaft. Warum sich Grillfans den Sonntag vormerken sollten, verrät der DWD.
Sonnencr… [+1765 chars]",,de,'Schnee'
https://www.brigitte.de/mode/trends/9-sonnenbrillen--die-die-brigitte-redaktion-jetzt-besonders-liebt-14066376.html,https://www.brigitte.de/mode/trends/9-sonnenbrillen--die-die-brigitte-redaktion-jetzt-besonders-liebt-14066376.html,0,www.brigitte.de,"Favoriten der Redaktion: 9 angesagte Sonnenbrillen, die jetzt in unserem Einkaufskorb landen","Wir lassen den langen, eisigen Winter hinter uns und bereiten uns auf einen sonnigen Frühling vor. Dafür landet nicht nur Sonnencreme in unserem Einkaufskorb, sondern auch die ein oder andere neue Sonnenbrille. Das stylische Accessoire schützt unsere Augen un…",https://image.brigitte.de/14067030/t/4r/v1/w1440/r1.7778/-/teaser-sonnenbrillen.jpg,2026-03-21T07:00:00Z,,"Sonnenbrillen-Trends 2026: Diese Modelle liebt die BRIGITTE-Redaktion jetzt
Mit den ersten warmen Tagen steigt nicht nur die Vorfreude auf Frühling und Sommer, auch die Lust auf neue Accessoires wäc… [+2165 chars]",,de,'Winter'
https://www.computerbase.de/news/betriebssysteme/taskleiste-weniger-ki-schnellerer-explorer-wie-microsoft-windows-11-wieder-reparieren-will.96626/,https://www.computerbase.de/news/betriebssysteme/taskleiste-weniger-ki-schnellerer-explorer-wie-microsoft-windows-11-wieder-reparieren-will.96626/,0,www.computerbase.de,"Taskleiste, weniger KI, schnellerer Explorer: Wie Microsoft Windows 11 wieder reparieren will","Aufgrund von Design-Mängeln, KI-Experimenten und Bugs ist der Ruf von Windows 11 lädiert, Microsoft hat daher bereits im Winter Abhilfe versprochen. Nun hat der Konzern die Maßnahmen angekündigt, die das Betriebssystem wieder auf die Spur bringen sollen.",https://pics.computerbase.de/1/2/1/8/6/6-5fcd99f5cf2ae064/article-1280x720.a3a3deaf.jpg,2026-03-21T09:13:00Z,,"Aufgrund von Design-Mängeln, KI-Experimenten und Bugs ist der Ruf von Windows 11 lädiert, Microsoft hat daher bereits im Winter Abhilfe versprochen. Nun hat der Konzern die Maßnahmen angekündigt, die… [+3309 chars]",,de,'Winter'
https://www.tagesspiegel.de/gesellschaft/panorama/alpen-mindestens-zwei-tote-durch-lawine-in-sudtirol-15385775.html,https://www.tagesspiegel.de/gesellschaft/panorama/alpen-mindestens-zwei-tote-durch-lawine-in-sudtirol-15385775.html,0,www.tagesspiegel.de,Alpen: Mindestens zwei Tote durch Lawine in Südtirol,Schon wieder ein Lawinenunglück in den italienischen Alpen: An der Hohen Ferse reißen die Schneemassen mehrere Skifahrer mit. Nach einem Vermissten wird noch gesucht.,https://www.tagesspiegel.de/images/15385774/alternates/BASE_16_9_W1400/1774104315000/lawinenungluck-in-sudtirol.jpeg,2026-03-21T14:45:15Z,,Bei einem Lawinenunglück in Südtirol sind mindestens zwei Skifahrer ums Leben gekommen. Nach Angaben der italienischen Bergwacht wurden eine Gruppe von etwa zehn Tourengehern an der 2.669 Meter hohen… [+1885 chars],,de,'Schnee'
https://www.tagesspiegel.de/gesellschaft/panorama/mehr-als-60-helfer-im-einsatz-lawine-verschuttet-skifahrer-in-sudtirol--mindestens-zwei-tote-15385775.html,https://www.tagesspiegel.de/gesellschaft/panorama/mehr-als-60-helfer-im-einsatz-lawine-verschuttet-skifahrer-in-sudtirol--mindestens-zwei-tote-15385775.html,0,www.tagesspiegel.de,Mehr als 60 Helfer im Einsatz: Lawine verschüttet Skifahrer in Südtirol – mindestens zwei Tote,Schon wieder ein Lawinenunglück in den italienischen Alpen: An der Hohen Ferse reißen die Schneemassen mehrere Skifahrer mit. Fünf Menschen werden verletzt.,https://www.tagesspiegel.de/images/15385809/alternates/BASE_16_9_W1400/1774107151000/lawinenungluck-in-sudtirol.jpeg,2026-03-21T14:45:15Z,,Bei einem Lawinenunglück in Südtirol sind mindestens zwei Skifahrer ums Leben gekommen. Nach Angaben der italienischen Bergwacht wurden gegen Mittag etwa zwei Dutzend Tourengeher an der 2.669 Meter h… [+2847 chars],,de,'Schnee'
