index,url,valid,domain,title,description,image,published,archive,content,quote,language,keyword
https://www.basicthinking.de/blog/2026/01/01/gewaesser-heizung-waermepumpe/,https://www.basicthinking.de/blog/2026/01/01/gewaesser-heizung-waermepumpe/,0,www.basicthinking.de,Neuartige Wärmepumpe macht Flüsse und Seen zur Heizung,"Der Beitrag Neuartige Wärmepumpe macht Flüsse und Seen zur Heizung erschien zuerst beim Online-Magazin BASIC thinking. Über unseren Newsletter UPDATE startest du jeden Morgen bestens informiert in den Tag.
Mit einer neuartigen Wärmepumpe wollen Forscher künft…",https://www.basicthinking.de/blog/wp-content/uploads/2025/12/waermepumpe-fluesse-seen-heizung.jpg,2026-01-01T04:47:38Z,,"Mit einer neuartigen Wärmepumpe wollen Forscher künftig Flüsse und Seen in Deutschland als Heizung nutzen. Sie soll sogar bei Temperaturen um den Gefrierpunkt Wärmeanergie liefern. 
Ganzjährige Wärm… [+3724 chars]",,de,'Heizung'
https://www.zeit.de/news/2026-01/01/teils-glaette-und-schnee-in-rheinland-pfalz-und-dem-saarland,https://www.zeit.de/news/2026-01/01/teils-glaette-und-schnee-in-rheinland-pfalz-und-dem-saarland,0,www.zeit.de,Vorhersage: Teils Glätte und Schnee in Rheinland-Pfalz und dem Saarland,Hier finden Sie Informationen zu dem Thema „Vorhersage“. Lesen Sie jetzt „Teils Glätte und Schnee in Rheinland-Pfalz und dem Saarland“.,https://img.zeit.de/news/2026-01/01/teils-glaette-und-schnee-in-rheinland-pfalz-und-dem-saarland-image-group/wide__1300x731,2026-01-01T09:05:30Z,,"Der Start ins neue Jahr bringt heute in Rheinland-Pfalz und dem Saarland teils Schnee, Schneeregen und Glätte. Der Tag starte zunächst nur vereinzelt mit Niederschlägen, wie der Deutsche Wetterdienst… [+447 chars]",,de,'Schnee'
https://www.stern.de/gesellschaft/regional/hessen/vorhersage--winterlich-und-teils-windig-in-hessen-37003218.html,https://www.stern.de/gesellschaft/regional/hessen/vorhersage--winterlich-und-teils-windig-in-hessen-37003218.html,0,www.stern.de,Vorhersage: Winterlich und teils windig in Hessen,Offenbach (lhe) - Mit vielen Wolken und vereinzelt Schnee startet das Wetter in Hessen ins neue Jahr. In der Nordhälfte gibt es ab dem Nachmittag häufiger,https://image.stern.de/37003220/t/_y/v1/w1440/r1.7778/-/01--fioxkxikoav2axs2048jpeg---cd0c4b2ae5eebc23.jpg,2026-01-01T09:36:55Z,,"Kopiere den aktuellen Link
Zur Merkliste hinzufügen
Mit Niederschlägen und teils Glätte beginnt 2026. Auch in den kommenden Tagen ändert sich nicht viel.
Mit vielen Wolken und vereinzelt Schnee st… [+614 chars]",,de,'Schnee'
https://www.stern.de/gesellschaft/regional/thueringen/wetteraussichten--widriges-wetter-zum-jahresbeginn-37003340.html,https://www.stern.de/gesellschaft/regional/thueringen/wetteraussichten--widriges-wetter-zum-jahresbeginn-37003340.html,0,www.stern.de,Wetteraussichten: Widriges Wetter zum Jahresbeginn,Trübe Wolkendecke statt Neujahrsspaziergang in der Wintersonne: In Thüringen kann es aber auch aus anderen Gründen noch recht ungemütlich werden.,https://image.stern.de/37003342/t/Te/v1/w1440/r1.7778/-/01--gsy4av3jnov12axs2048jpeg---d093991a741df655.jpg,2026-01-01T10:25:16Z,,"Kopiere den aktuellen Link
Zur Merkliste hinzufügen
Trübe Wolkendecke statt Neujahrsspaziergang in der Wintersonne: In Thüringen kann es aber auch aus anderen Gründen noch recht ungemütlich werden.… [+711 chars]",,de,'Schnee'
https://www.bild.de/news/wetter/unwetterwarnung-heftiger-wintersturm-trifft-deutschland-69550b21a75a88580a6dc6cd,https://www.bild.de/news/wetter/unwetterwarnung-heftiger-wintersturm-trifft-deutschland-69550b21a75a88580a6dc6cd,0,www.bild.de,Unwetterwarnung - Heftiger Wintersturm trifft Deutschland,"Hamburg – Schluss mit Winter-Spaß, jetzt kommt der Winter-Sturm! Die Wetterdienste warnen an Neujahr vor Unwetter mit Orkanböen und starken Schneeverwehu...","https://images.bild.de/69550b21a75a88580a6dc6cd/6364f1e921bfcd89442137cc48c3fad9,ebe04a99?w=1280",2026-01-01T10:46:17Z,,"Hamburg Schluss mit Winter-Spaß, jetzt kommt der Winter-Sturm! Die Wetterdienste warnen an Neujahr vor Unwetter mit Orkanböen und starken Schneeverwehungen in Deutschland.
Der Seewetterdienst Hambur… [+2273 chars]",,de,'Schnee'
https://www.spektrum.de/news/aktuelles-am-himmel-juli-sightseeing-entlang-der-milchstrasse/2285461,https://www.spektrum.de/news/aktuelles-am-himmel-juli-sightseeing-entlang-der-milchstrasse/2285461,0,www.spektrum.de,Aktuelles am Himmel im Januar 2026: Wunder am Winterhimmel,"Im Januar werden Sie durch einen Himmelsanblick belohnt, der unserer alltäglichen Welt völlig entrückt zu sein scheint.",https://static.spektrum.de/fm/912/f1920x1080/Teaser_Startrails.jpg,2026-01-01T11:00:00Z,,"Hoch im Süden präsentiert sich der Himmelsjäger Orion, und gleich neben ihm ziehen die Zwillinge die Blicke auf sich. Zum Geschwisterpaar Kastor und Pollux gesellt sich der strahlende Jupiter, der in… [+1889 chars]",,de,'Winter'
https://www.tagesschau.de/ausland/europa/kulturhauptstadt-finnland-oulu-100.html,https://www.tagesschau.de/ausland/europa/kulturhauptstadt-finnland-oulu-100.html,0,www.tagesschau.de,Finnische Kulturhauptstadt Oulu: Winterradeln und schreiende Männer,"Mit dem finnischen Oulu ist 2026 die nördlichste Großstadt der EU Europäische Kulturhauptstadt. Auf dem Programm stehen samische Kultur, Techno auf dem Eismeer - und Schreien gegen die Stille. Von Jana Sinram.",https://images.tagesschau.de/image/6ba6c16b-ca53-4413-9e17-d7d848e737ee/AAABmzexD-w/AAABmyZE0EA/16x9-big/schrei-chor-100.jpg?width=1280,2026-01-01T12:38:36Z,,"Stand: 01.01.2026 13:38 Uhr
Mit dem finnischen Oulu ist 2026 die nördlichste Großstadt der EU Europäische Kulturhauptstadt. Auf dem Programm stehen samische Kultur, Techno auf dem Eismeer - und Schr… [+4447 chars]",,de,'Schnee'
https://www.faz.net/aktuell/feuilleton/kunst-und-architektur/munch-nolde-und-co-meisterwerke-trotzen-schnee-und-regen-accg-110810088.html,https://www.faz.net/aktuell/feuilleton/kunst-und-architektur/munch-nolde-und-co-meisterwerke-trotzen-schnee-und-regen-accg-110810088.html,0,www.faz.net,Gemälde im Schnee: Wenn Meisterwerke dem Wetter trotzen,Munch und Nolde setzen ihre Gemälde Naturgewalten aus. Auch van Gogh und Richter präsentieren ihre Werke unter freiem Himmel. Ein Blick auf ungewöhnliche Kunstpraktiken.,https://media0.faz.net/image/w1200h627/38ddb434ee27/w1620h846x0y1078o/122025/1.10810086/sie-mussten-nicht-lange.webp,2026-01-01T13:09:20Z,,"Wenn wertvolle Gemälde heute für Ausstellungen angefragt werden, sind die Hürden hoch: Versicherungsprämien sind zu kalkulieren und strengste konservatorische Vorgaben zu berücksichtigen. Kunstwerke … [+5874 chars]",,de,'Schnee'
https://www.sueddeutsche.de/sport/mailand-ioc-ioc-praesidentin-kirsty-coventry-li.3361490,https://www.sueddeutsche.de/sport/mailand-ioc-ioc-praesidentin-kirsty-coventry-li.3361490,0,www.sueddeutsche.de,Olympische Winterspiele: Die Russland-Frage wird die größte Baustelle der neuen IOC-Chefin,"Trotz vieler Probleme in der Vorbereitung wird das IOC die Mailand-Spiele schon irgendwie hinwursteln. Brisanter ist die Frage, wie es mit Russland umgeht.",https://www.sueddeutsche.de/2026/01/01/f794d16d-7cbc-446d-bc46-2d0870a2ff47.jpg?q=60&fm=webp&width=1200&rect=0%2C416%2C4000%2C2250,2026-01-01T14:55:00Z,,"So ist es. Und kein Erfolg, das wäre nicht nur der Albtraum für die Alpenregion, sondern auch für die neue Präsidentin des Internationalen Olympischen Komitees (IOC).
Fifa-Chef Gianni Infantino stel… [+4045 chars]",,de,'Schnee'
https://sz-magazin.sueddeutsche.de/hotel-europa/hotel-europa-wohnen-iglus-tallinn-estland-95764,https://sz-magazin.sueddeutsche.de/hotel-europa/hotel-europa-wohnen-iglus-tallinn-estland-95764,0,sz-magazin.sueddeutsche.de,Aus dem Iglu in die Ostsee,"Im »Iglupark« in Tallinn kann man ein Iglu mieten und darin wohnen, saunieren oder arbeiten. Zwar sind die Häuschen nicht aus Schnee, Abkühlung findet man trotzdem: im eiskalten Hafenbecken direkt vor der Tür.",https://szm-media.sueddeutsche.de/image/szm/8ca9648315eecd5f56ed2de641be3db3/t163l0w1280h672/1280/image.jpeg,2026-01-01T16:00:00Z,,"Aus Eis und Schnee sind die Iglus im »Iglupark Tallinn« nicht. Aber das Wort Iglu bedeutet in der Sprache der Inuit allgemein Wohnung oder Haus, und die konnten auch früher schon ebenso aus Holz, Leh… [+1439 chars]",,de,'Schnee'
https://www.zeit.de/news/2026-01/02/lies-ohne-gas-wird-es-nicht-gehen,https://www.zeit.de/news/2026-01/02/lies-ohne-gas-wird-es-nicht-gehen,0,www.zeit.de,Koalitionsstreit: Lies: Ohne Gas wird es nicht gehen,Hier finden Sie Informationen zu dem Thema „Koalitionsstreit“. Lesen Sie jetzt „Lies: Ohne Gas wird es nicht gehen“.,https://img.zeit.de/news/2026-01/02/lies-ohne-gas-wird-es-nicht-gehen-image-group/wide__1300x731,2026-01-02T04:30:05Z,,"Bei der Gasförderung auf See sind SPD und Grüne in Niedersachsens Landesregierung weiter auf Konfrontationskurs. «Es ist offensichtlich, dass wir bei der Gasförderung unterschiedlicher Auffassung sin… [+2230 chars]",,de,'Gas'
https://www.zeit.de/news/2026-01/02/schnee-glaette-und-wind-hessen-erwartet-winterliche-tage,https://www.zeit.de/news/2026-01/02/schnee-glaette-und-wind-hessen-erwartet-winterliche-tage,0,www.zeit.de,"Vorhersage: Schnee, Glätte und Wind – Hessen erwartet winterliche Tage","Hier finden Sie Informationen zu dem Thema „Vorhersage“. Lesen Sie jetzt „Schnee, Glätte und Wind – Hessen erwartet winterliche Tage“.",https://img.zeit.de/news/2026-01/02/schnee-glaette-und-wind-hessen-erwartet-winterliche-tage-image-group/wide__1300x731,2026-01-02T06:20:32Z,,"In Hessen müssen sich die Menschen auf Schnee, Wind und glatte Straßen einstellen. Für Freitag sagt der Deutsche Wetterdienst (DWD) Frost sowie teilweise Schneeschauer und Glätte vorher. In der Nordh… [+1109 chars]",,de,'Schnee'
https://www.zeit.de/news/2026-01/02/schnee-und-glaette-zum-wochenende-in-nrw,https://www.zeit.de/news/2026-01/02/schnee-und-glaette-zum-wochenende-in-nrw,0,www.zeit.de,Frostige Temperaturen: Schnee und Glätte zum Wochenende in NRW,Hier finden Sie Informationen zu dem Thema „Frostige Temperaturen“. Lesen Sie jetzt „Schnee und Glätte zum Wochenende in NRW“.,https://img.zeit.de/news/2026-01/02/schnee-und-glaette-zum-wochenende-in-nrw-image-group/wide__1300x731,2026-01-02T06:35:59Z,,Das Winterwetter hat Nordrhein-Westfalen auch zum Wochenende fest im Griff. Laut Vorhersage des Deutschen Wetterdienstes (DWD) soll es auch in den kommenden Tagen kalt und glatt bleiben. Am Freitag l… [+610 chars],,de,'Frost'
https://www.zeit.de/news/2026-01/02/hochwasser-und-schnee-im-norden-keine-groesseren-schaeden,https://www.zeit.de/news/2026-01/02/hochwasser-und-schnee-im-norden-keine-groesseren-schaeden,0,www.zeit.de,Wetter: Hochwasser und Schnee im Norden - keine größeren Schäden,Hier finden Sie Informationen zu dem Thema „Wetter“. Lesen Sie jetzt „Hochwasser und Schnee im Norden - keine größeren Schäden“.,https://img.zeit.de/news/2026-01/02/hochwasser-und-schnee-im-norden-keine-groesseren-schaeden-image-group/wide__1300x731,2026-01-02T07:16:57Z,,"Im Norden Deutschlands haben Hochwasser und Sturmflut in der Nacht auf Freitag zunächst keine größeren Schäden verursacht. In Niedersachsen, Schleswig-Holstein und Hamburg verzeichneten die Lagezentr… [+1885 chars]",,de,'Schnee'
https://www.zeit.de/news/2026-01/02/kein-busverkehr-wegen-schnees-und-glaette-in-wuerzburg,https://www.zeit.de/news/2026-01/02/kein-busverkehr-wegen-schnees-und-glaette-in-wuerzburg,0,www.zeit.de,Verkehr: Kein Busverkehr wegen Schnees und Glätte in Würzburg,Hier finden Sie Informationen zu dem Thema „Verkehr“. Lesen Sie jetzt „Kein Busverkehr wegen Schnees und Glätte in Würzburg“.,https://img.zeit.de/news/2026-01/02/kein-busverkehr-wegen-schnees-und-glaette-in-wuerzburg-image-group/wide__1300x731,2026-01-02T07:41:30Z,,"Wegen starker Schneefälle und Straßenglätte fahren in Würzburg am ersten Werktag des Jahres zunächst keine Busse. Die Würzburger Versorgungs- und Verkehrs-GmbH (WVV) werde informieren, wenn sich die … [+333 chars]",,de,'Schnee'
https://www.zeit.de/news/2026-01/02/winterwetter-mit-wind-und-schnee-in-mv,https://www.zeit.de/news/2026-01/02/winterwetter-mit-wind-und-schnee-in-mv,0,www.zeit.de,Wetter: Winterwetter mit Wind und Schnee in MV,Hier finden Sie Informationen zu dem Thema „Wetter“. Lesen Sie jetzt „Winterwetter mit Wind und Schnee in MV“.,https://img.zeit.de/news/2026-01/02/winterwetter-mit-wind-und-schnee-in-mv-image-group/wide__1300x731,2026-01-02T10:18:06Z,,"Schneefall in Teilen des Landes und kräftiger Wind haben den ersten Arbeitstag des neuen Jahres begleitet. An einige Orten musste die Feuerwehr ausrücken, um umgestürzte Bäume von der Straße zu räume… [+1042 chars]",,de,'Schnee'
https://www.tagesschau.de/inland/gesellschaft/wintereinbruch-110.html,https://www.tagesschau.de/inland/gesellschaft/wintereinbruch-110.html,0,www.tagesschau.de,"Sturm, Schnee und Eis sorgen landesweit für Probleme","Der Winter ist da und hat weite Teile Deutschlands im Griff. Aus vielen Bundesländern werden heftiger Schneefall, Sturm und Eisglätte gemeldet, die ein Verkehrschaos anrichten.",https://images.tagesschau.de/image/3350f241-8e50-4b49-8468-e70d6155569f/AAABm349ueY/AAABmyZE0EA/16x9-big/winter-256.jpg?width=1280,2026-01-02T10:25:45Z,,"Stand: 02.01.2026 11:25 Uhr
Der Winter ist da und hat weite Teile Deutschlands im Griff. Aus vielen Bundesländern werden heftiger Schneefall, Sturm und Eisglätte gemeldet, die ein Verkehrschaos anri… [+5083 chars]",,de,'Winter'
https://www.zeit.de/news/2026-01/02/gute-aussichten-und-viele-gaeste-auf-hessens-skipisten,https://www.zeit.de/news/2026-01/02/gute-aussichten-und-viele-gaeste-auf-hessens-skipisten,0,www.zeit.de,Wintersportsaison angelaufen: Gute Aussichten und viele Gäste auf Hessens Skipisten,Hier finden Sie Informationen zu dem Thema „Wintersportsaison angelaufen“. Lesen Sie jetzt „Gute Aussichten und viele Gäste auf Hessens Skipisten“.,https://img.zeit.de/news/2026-01/02/gute-aussichten-und-viele-gaeste-auf-hessens-skipisten-image-group/wide__1300x731,2026-01-02T11:20:06Z,,Volle Pisten und zufriedene Betreiber: Hessens Skigebiete haben zum Saisonstart schon zahlreiche Wintersportler angelockt. «Es ist richtig Winter. Darüber freuen sich unsere Gäste und wir natürlich a… [+1561 chars],,de,'Kälte'
https://www.stern.de/gesundheit/kaelte--warum-es-fuer-den-koerper-nicht-immer-eisbaden-sein-muss-36986060.html,https://www.stern.de/gesundheit/kaelte--warum-es-fuer-den-koerper-nicht-immer-eisbaden-sein-muss-36986060.html,0,www.stern.de,Eisbaden und Co.: Warum Sie öfter mal frieren sollten,"Am Neujahrstag schwimmen Tausende Menschen in eiskaltem Wasser, um Abwehrkräfte und Stoffwechsel zu stärken. Dabei würde ein bisschen Kälte oft schon ausreichen.",https://image.stern.de/36986994/t/6x/v2/w1440/r1.7778/-/kaeltebaden.jpg,2026-01-02T14:29:00Z,,"Zugang zu stern+statt 11,96 
 nur 1  
<ul><li>Alles von stern+ mit erstklassigen Inhalten von GEO und Capital</li><li>4 Wochen testen, dann 2,99  je Woche</li><li>jederzeit kündbar</li></ul>",,de,'Kälte'
https://www.n-tv.de/panorama/Der-Winter-ist-da-und-er-will-es-richtig-wissen-id30196922.html,https://www.n-tv.de/panorama/Der-Winter-ist-da-und-er-will-es-richtig-wissen-id30196922.html,0,www.n-tv.de,"Zweistellige Minusgrade: ""Der Winter ist da, und er will es richtig wissen""","Zu Beginn des neuen Jahres hält der Winter Einzug in weiten Teilen Deutschlands. Kräftiger Schneefall, Glätte und außergewöhnlich niedrige Temperaturen sorgen für ein winterliches Wochenende. ntv-Meteorologe Oliver Scheel erklärt im Interview, was genau auf u…",https://www.n-tv.de/img/30196932/1767360478/Img_16_9/1200/Wintereinbruch-in-Essen-NUR-FUeR-REDAKTIONELLE-ZWECKE-EDITORIAL-USE-ONLY-Spaziergaenger-mit-Regenschirm-im-Essener-Stadtgarten-am-Freitag-dem-02-Januar-2026-Wintereinbruch-in-Essen.jpg,2026-01-02T15:13:00Z,,"Zu Beginn des neuen Jahres hält der Winter Einzug in weiten Teilen Deutschlands. Kräftiger Schneefall, Glätte und außergewöhnlich niedrige Temperaturen sorgen für ein winterliches Wochenende. ntv-Met… [+3499 chars]",,de,'Kälte'
https://www.bild.de/sport/fussball/fortuna-duesseldorf-wie-lange-geht-das-mit-markus-anfang-gut-69577877f6fc544dba9b9efb,https://www.bild.de/sport/fussball/fortuna-duesseldorf-wie-lange-geht-das-mit-markus-anfang-gut-69577877f6fc544dba9b9efb,0,www.bild.de,Neustart-Versuch bei Fortuna - Wie lange geht das mit Anfang gut?,"Mal Schnee, dann nur dunkle Wolken und plötzlich knallende Sonne bei eisiger Kälte – der Trainingsstart von Düsseldorf mit Rakus Anfang als Trainer.","https://images.bild.de/69577877f6fc544dba9b9efb/aa58726c867ee3b4ad68bf9f7f5c988f,13bc16b9?w=1280",2026-01-02T15:14:13Z,,"Mal Schnee, dann nur dunkle Wolken und plötzlich knallende Sonne bei eisiger Kälte der Trainingsstart von Fortuna Düsseldorf ins neue Jahr passt zur bisherigen Saison, in der es für den 16. der 2. Li… [+1532 chars]",,de,'Kälte'
https://www.jungewelt.de/artikel/515007.frosty-winter-kiss.html,https://www.jungewelt.de/artikel/515007.frosty-winter-kiss.html,0,www.jungewelt.de,Coole Wampe: Frosty Winter Kiss,"»Man muss die Feste feiern, wie sie knallen, Mädels, ich geh’ dann mal«, erklärt Udo und verlässt uns mit einer Dreiertüte Kanonenschläge sowie einem 15teiligen Raketensortiment.",https://www.jungewelt.de/images/junge-welt-logo-square.png,2026-01-02T18:38:01Z,,"»Ihr viertes Reich ist nicht von dieser Welt. Es ist eine Ausgeburt der Hölle. Ich bin es leid, die Verbrechen der Herrschenden aufzuzählen, sie werden sich selbst richten. Prost!« Udo erhebt sein Gl… [+2881 chars]",,de,'Kälte'
https://www.diepresse.com/20444851/dakar-und-freistadt-was-wuestensand-und-muehlviertler-eis-eint,https://www.diepresse.com/20444851/dakar-und-freistadt-was-wuestensand-und-muehlviertler-eis-eint,0,www.diepresse.com,Dakar und Freistadt: Was Wüstensand und Mühlviertler Eis eint [premium],"In Riad startet unter globalem Aufsehen die Rallye Dakar, sogar Mark Mateschitz fährt mit. Im Großraum Freistadt lockt die Jänner-Rallye – Österreichs wahrer Motorsport-Klassiker.",https://img.diepresse.com/public/incoming/clluyz-jaenner_testtag_2026_illmer_245.jpg/alternates/DPR_SOCIAL_MAGAZIN/jaenner_testtag_2026_illmer_245.jpg,2026-01-02T19:27:08Z,,"Wer vom ersten großen Motorsport-Ereignis des Jahres spricht, der schielt immer zur Rallye Dakar. Dem Spektakel, das sich auch heuer wieder ab Samstag von Yanbu aus seinen Weg über 8000 Kilometer que… [+3526 chars]",,de,'Kälte'
https://www.faz.net/aktuell/wirtschaft/rwe-chef-erwartet-sinkende-strom-und-gaspreise-accg-200404931.html,https://www.faz.net/aktuell/wirtschaft/rwe-chef-erwartet-sinkende-strom-und-gaspreise-accg-200404931.html,0,www.faz.net,Energiekosten: RWE-Chef erwartet sinkende Strom- und Gaspreise,Staatliche Zuschüsse und wachsendes Angebot dämpfen laut Markus Krebber die Energiepreise. Bei der Gasversorgung im Winter sieht der Chef des Energiekonzerns langfristig Risiken.,https://media0.faz.net/image/w1200h627/fcc3bea093e0/w3000h1567x0y111o/202503/43601.0.917413544/markus-krebber.webp,2026-01-03T04:28:30Z,,"Der Chef des Energiekonzerns RWE, Markus Krebber, rechnet mit sinkenden Preisen bei Strom und Gas. Die Großhandelspreise beim Strom seien stabil, sagte Krebber der Rheinischen Post. Da der Staat die … [+1654 chars]",,de,'Gas'
https://www.basicthinking.de/blog/2026/01/03/heizung-strom-solar-was-sich-2026-aendert/,https://www.basicthinking.de/blog/2026/01/03/heizung-strom-solar-was-sich-2026-aendert/,0,www.basicthinking.de,"Heizung, Strom und Solar: Was sich 2026 für Hausbesitzer ändert","Der Beitrag Heizung, Strom und Solar: Was sich 2026 für Hausbesitzer ändert erschien zuerst beim Online-Magazin BASIC thinking. Über unseren Newsletter UPDATE startest du jeden Morgen bestens informiert in den Tag.
Der Jahreswechsel bringt immer auch Neuerung…",https://www.basicthinking.de/blog/wp-content/uploads/2025/12/heizung-strom-solar-2026.jpeg,2026-01-03T04:45:47Z,,"Der Jahreswechsel bringt immer auch Neuerungen hinsichtlich wichtiger Vorgaben und Fördermodelle. Für die Erreichung der Klimaziele stehen 2026 hier auch Heizung, Strom und Solar im Fokus. Neue Regel… [+3670 chars]",,de,'Gas'
https://www.stern.de/gesellschaft/regional/berlin-brandenburg/unfaelle--glaette-vermutet--unfall-mit-gas-lkw-legt-a9-lahm-37007264.html,https://www.stern.de/gesellschaft/regional/berlin-brandenburg/unfaelle--glaette-vermutet--unfall-mit-gas-lkw-legt-a9-lahm-37007264.html,0,www.stern.de,Unfälle: Glätte vermutet: Unfall mit Gas-Lkw legt A9 lahm,Ein Unfall mit einem gasbetriebenen Lkw sorgt auf der Autobahn bei Rabenstein/Fläming seit Stunden für eine Sperrung. Die Bergung gestaltet sich schwierig. Womit Autofahrer auf der A9 rechnen müssen.,https://image.stern.de/37007266/t/ke/v1/w1440/r1.7778/-/03--7xkmn3ty7dv6axs2048jpeg---68d871c59217dda9.jpg,2026-01-03T09:02:48Z,,"Kopiere den aktuellen Link
Zur Merkliste hinzufügen
Ein Unfall mit einem gasbetriebenen Lkw sorgt auf der Autobahn bei Rabenstein/Fläming seit Stunden für eine Sperrung. Die Bergung gestaltet sich … [+1326 chars]",,de,'Gas'
https://www.zeit.de/news/2026-01/03/glaette-vermutet-unfall-mit-gas-lkw-legt-a9-lahm,https://www.zeit.de/news/2026-01/03/glaette-vermutet-unfall-mit-gas-lkw-legt-a9-lahm,0,www.zeit.de,Unfälle: Glätte vermutet: Unfall mit Gas-Lkw legt A9 lahm,Hier finden Sie Informationen zu dem Thema „Unfälle“. Lesen Sie jetzt „Glätte vermutet: Unfall mit Gas-Lkw legt A9 lahm“.,https://img.zeit.de/news/2026-01/03/glaette-vermutet-unfall-mit-gas-lkw-legt-a9-lahm-image-group/wide__1300x731,2026-01-03T09:02:48Z,,Ein verunglückter Lastwagen legt weiter die Autobahn 9 bei Rabenstein/Fläming (Landkreis Potsdam-Mittelmark) lahm. Nach Angaben der Feuerwehr war das gasbetriebene Fahrzeug am Freitagabend in Richtun… [+1111 chars],,de,'Gas'
https://www.tagesspiegel.de/berlin/unfalle-glatte-vermutet-unfall-mit-gas-lkw-legt-a9-lahm-15098408.html,https://www.tagesspiegel.de/berlin/unfalle-glatte-vermutet-unfall-mit-gas-lkw-legt-a9-lahm-15098408.html,0,www.tagesspiegel.de,Unfälle: Glätte vermutet: Unfall mit Gas-Lkw legt A9 lahm,Ein Unfall mit einem gasbetriebenen Lkw sorgt auf der Autobahn bei Rabenstein/Fläming seit Stunden für eine Sperrung. Die Bergung gestaltet sich schwierig. Womit Autofahrer auf der A9 rechnen müssen.,https://www.tagesspiegel.de/images/15098407/alternates/BASE_16_9_W1400/1767431059000/unfall-legt-a9-lahm.jpeg,2026-01-03T09:04:19Z,,Ein verunglückter Lastwagen legt weiter die Autobahn 9 bei Rabenstein/Fläming (Landkreis Potsdam-Mittelmark) lahm. Nach Angaben der Feuerwehr war das gasbetriebene Fahrzeug am Freitagabend in Richtun… [+1167 chars],,de,'Gas'
https://www.tagesschau.de/inland/schnee-winnter-glaette-unfaelle-100.html,https://www.tagesschau.de/inland/schnee-winnter-glaette-unfaelle-100.html,0,www.tagesschau.de,Winterwetter: Zahlreiche Glätteunfälle auf vereisten Straßen,Der Winter hat Deutschland fest im Griff - für viele Autofahrer wurden die vereisten Straßen zu einer gefährlichen Schlitterpartie. Aus mehreren Teilen Deutschlands werden zahlreiche Unfälle gemeldet.,https://images.tagesschau.de/image/7d6a322d-142e-4371-8de6-94f9c4c8ac24/AAABm4MLKSI/AAABmyZE0EA/16x9-big/winter-strassen-104.jpg?width=1280,2026-01-03T09:32:14Z,,"Stand: 03.01.2026 10:32 Uhr
Der Winter hat Deutschland fest im Griff - für viele Autofahrer wurden die vereisten Straßen zu einer gefährlichen Schlitterpartie. Aus mehreren Teilen Deutschlands werde… [+3281 chars]",,de,'Winter'
https://www.zeit.de/news/2026-01/03/winterwetter-sorgt-fuer-dauerfrost-und-eisige-temperaturen,https://www.zeit.de/news/2026-01/03/winterwetter-sorgt-fuer-dauerfrost-und-eisige-temperaturen,0,www.zeit.de,Wetter: Winterwetter sorgt für Dauerfrost und eisige Temperaturen,Hier finden Sie Informationen zu dem Thema „Wetter“. Lesen Sie jetzt „Winterwetter sorgt für Dauerfrost und eisige Temperaturen“.,https://img.zeit.de/news/2026-01/03/winterwetter-sorgt-fuer-dauerfrost-und-eisige-temperaturen-image-group/wide__1300x731,2026-01-03T10:44:58Z,,"Nach dem Wintereinbruch zum Jahresbeginn haben Schnee, Glätte und Kälte Deutschland fest im Griff. Am Sonntag soll es meist stark bewölkt bis bedeckt bleiben, wie der Deutsche Wetterdienst (DWD) mitt… [+1028 chars]",,de,'Winter'
https://www.faz.net/aktuell/gesellschaft/teils-zweistellige-minusgrade-in-deutschland-erwartet-accg-200405454.html,https://www.faz.net/aktuell/gesellschaft/teils-zweistellige-minusgrade-in-deutschland-erwartet-accg-200405454.html,0,www.faz.net,Wetterausblick: Teils zweistellige Minusgrade in Deutschland erwartet,Die eisige Kälte bleibt erstmal: Der Deutsche Wetterdienst sagt Dauerfrost in weiten Teilen Deutschlands voraus. In der Nacht zum Samstag kam es zu zahlreichen Unfällen wegen vereisten und zugeschneiten Straßen.,https://media0.faz.net/image/w1200h627/f799f0d249e7/w2212h1155x0y251o/202601/43601.0.1630544913/der-verschneite-plaenterwald.webp,2026-01-03T11:36:40Z,,"Nach dem Wintereinbruch zum Jahresbeginn haben Schnee, Glätte und Kälte Deutschland fest im Griff. Wegen vereisten und zugeschneiten Straßen ist es in der Nacht an vielen Orten zu Unfällen gekommen. … [+2351 chars]",,de,'Eis'
