index,url,valid,domain,title,description,image,published,archive,content,quote,language,keyword
https://www.fitforfun.de/news/putzen-leicht-gemacht-2-hausmittel-bekommen-die-heizung-in-10-sekunden-sauber-529106.html,https://www.fitforfun.de/news/putzen-leicht-gemacht-2-hausmittel-bekommen-die-heizung-in-10-sekunden-sauber-529106.html,0,www.fitforfun.de,Putzen leicht gemacht: 2 Hausmittel bekommen die Heizung in 10 Sekunden sauber,Heizungen werden beim Putzen gerne mal vergessen. Dabei kannst du den Heizkörper mit einem Trick in nur zehn Sekunden reinigen.,"https://www.fitforfun.de/files/images/202209/1/mit-2-simplen-zutaten-so-reinigen-sie-ihre-heizung-in-nur-10-sekunden-1221903553,529105_3x2_n.jpg",2025-09-01T11:16:00Z,,"Empfohlener redaktioneller Inhalt
Passend zum Inhalt findest du hier einen externen Inhalt von TikTok.
 Aufgrund deiner Tracking-Einstellung ist die technische Darstellung nicht möglich.
 Mit dem … [+270 chars]",,de,'Heizung'
https://www.appgefahren.de/meross-heizkoerperthermostat-neues-smart-home-zubehoer-mit-matter-support-385502.html,https://www.appgefahren.de/meross-heizkoerperthermostat-neues-smart-home-zubehoer-mit-matter-support-385502.html,0,www.appgefahren.de,Meross Heizkörperthermostat: Neues Smart Home-Zubehör mit Matter-Support,"Die Smart Home-Marke Meross ist hier bei uns im Blog ein gern gesehener Gast, bietet das Unternehmen doch sehr gute und fortschrittliche Produkte für das intelligente Zuhause zu einem angemessenen Preis an. Nun hat Meross ein neues Heizkörperthermostat vorges…",https://www.appgefahren.de/wp-content/uploads/2025/09/Meross-Heizkoerperthermostat-1.jpg,2025-09-01T15:10:25Z,,"Die Smart Home-Marke Meross ist hier bei uns im Blog ein gern gesehener Gast, bietet das Unternehmen doch sehr gute und fortschrittliche Produkte für das intelligente Zuhause zu einem angemessenen Pr… [+1859 chars]",,de,'Gas'
