index,url,valid,domain,title,description,image,published,archive,content,quote,language,keyword
https://www.ibiza-heute.de/die-wueste-ruft-ibizenker-tritt-bei-der-dakar-2026-auf-gas/,https://www.ibiza-heute.de/die-wueste-ruft-ibizenker-tritt-bei-der-dakar-2026-auf-gas/,0,www.ibiza-heute.de,Die Wüste ruft: Ibizenker tritt bei der Dakar 2026 auf Gas,"Seit Jahren lässt sich Toni Vingut das PS-geschwängerte Abenteuer, das Paris längst aus seinen Namen gestrichen hat, nicht mehr entgehen. Ab diesem Samstag muss und will er sich erneut beweisen. 
Der Beitrag Die Wüste ruft: Ibizenker tritt bei der Dakar 2026 …",https://www.ibiza-heute.de/wp-content/uploads/2026/01/Bildschirmfoto-2026-01-03-um-07.11.18-1200x662.png,2026-01-03T12:19:10Z,,IbizaHEUTE ist das etablierteste und am längsten bestehende deutschsprachige Informations-Medium auf Ibiza und Formentera. Wir erscheinen seit 1991 ununterbrochen und erreichen zuverlässig alle Deuts… [+124 chars],,de,'Gas'
https://www.tagesspiegel.de/berlin/winter-schnee-und-glatte-haben-berlin-und-brandenburg-im-griff-15098888.html,https://www.tagesspiegel.de/berlin/winter-schnee-und-glatte-haben-berlin-und-brandenburg-im-griff-15098888.html,0,www.tagesspiegel.de,Winter: Schnee und Glätte haben Berlin und Brandenburg im Griff,Schnee und Eis sorgen in weiten Teilen Brandenburgs für Glätte. Es kommt vielerorts zu Unfällen. Ein Unfall legt die A9 lahm. In Nauen kommt ein Bus von der Fahrbahn ab.,https://www.tagesspiegel.de/images/15099040/alternates/BASE_16_9_W1400/1767448359000/unfall-legt-a9-lahm.jpeg,2026-01-03T12:42:18Z,,"Schneefall und Eisglätte sorgen in Berlin und Brandenburg für Verkehrsbehinderungen. Es gebe glättebedingt mehr Unfälle als üblich, sagte ein Polizeisprecher in Potsdam. Ein verunglückter Lastwagen l… [+2058 chars]",,de,'Eis'
https://www.stern.de/gesellschaft/regional/berlin-brandenburg/winter--schnee-und-glaette-haben-berlin-und-brandenburg-im-griff-37007680.html,https://www.stern.de/gesellschaft/regional/berlin-brandenburg/winter--schnee-und-glaette-haben-berlin-und-brandenburg-im-griff-37007680.html,0,www.stern.de,Winter: Schnee und Glätte haben Berlin und Brandenburg im Griff,Schnee und Eis sorgen in weiten Teilen Brandenburgs für Glätte. Es kommt vielerorts zu Unfällen. Ein Unfall legt die A9 lahm. In Nauen kommt ein Bus von der Fahrbahn ab.,https://image.stern.de/37007808/t/t-/v1/w1440/r1.7778/-/03--5y4bewq225v7axs2048jpeg---2c2f1748059ff3e5.jpg,2026-01-03T13:51:37Z,,"Kopiere den aktuellen Link
Zur Merkliste hinzufügen
Schnee und Eis sorgen in weiten Teilen Brandenburgs für Glätte. Es kommt vielerorts zu Unfällen. Ein Unfall legt die A9 lahm. In Nauen kommt ein … [+2187 chars]",,de,'Gas'
https://www.faz.net/aktuell/gesellschaft/ungluecke/stromausfall-in-berlin-zehntausende-verbringen-winternacht-in-eisiger-kaelte-und-dunkelheit-accg-200405238.html,https://www.faz.net/aktuell/gesellschaft/ungluecke/stromausfall-in-berlin-zehntausende-verbringen-winternacht-in-eisiger-kaelte-und-dunkelheit-accg-200405238.html,0,www.faz.net,Nach Stromausfall: Zehntausende Berliner verbringen die Nacht in Kälte und Dunkelheit,Bei Temperaturen um den Gefrierpunkt sind weiterhin 45.000 Haushalte im Südwesten Berlins ohne Elektrizität. Auf der Suche nach der Ursache für den Stromausfall prüft der Berliner Staatsschutz ein Bekennerschreiben.,https://media0.faz.net/image/w1200h627/525aca5a23dd/w3000h1567x0y60o/202601/43601.0.1630898039/passanten-im-bahnhof-wannsee.webp,2026-01-04T07:06:35Z,,Nach dem großflächigen Stromausfall hat der Südwesten Berlins die erste Nacht in Kälte und Dunkelheit verbracht. Viele Menschen aus den betroffenen 45.000 Haushalten und 2200 Firmen suchten Zuflucht … [+5387 chars],,de,'Kälte'
https://www.zeit.de/news/2026-01/04/weiter-eisig-kaltes-winterwetter-in-bayern,https://www.zeit.de/news/2026-01/04/weiter-eisig-kaltes-winterwetter-in-bayern,0,www.zeit.de,Prognose des DWD: Weiter eisig kaltes Winterwetter in Bayern,Hier finden Sie Informationen zu dem Thema „Prognose des DWD“. Lesen Sie jetzt „Weiter eisig kaltes Winterwetter in Bayern“.,https://img.zeit.de/news/2026-01/04/weiter-eisig-kaltes-winterwetter-in-bayern-image-group/wide__1300x731,2026-01-04T08:23:14Z,,Der Winter zeigt sich im Freistaat von seiner rauen Seite. Der Deutsche Wetterdienst (DWD) hat für die kommenden Tage eisige Kälte vorhergesagt. Nachts könnten die Temperaturen demnach in den zweiste… [+1594 chars],,de,'Kälte'
https://www.tagesspiegel.de/berlin/bleiben-sie-ruhig-liegen-wir-haben-keinen-strom-wie-die-berliner-im-sudwesten-den-stromausfall-erleben-15101682.html,https://www.tagesspiegel.de/berlin/bleiben-sie-ruhig-liegen-wir-haben-keinen-strom-wie-die-berliner-im-sudwesten-den-stromausfall-erleben-15101682.html,0,www.tagesspiegel.de,„Die alten Leute sind hart im Nehmen“: Wie die Berliner im Südwesten den Stromausfall erleben,"Kein Strom, kein Licht, keine Wärme, aber einen kühlen Kopf. In Teilen von Zehlendorf, Lichterfelde und Wannsee erleben die Menschen eine Welle der Hilfsbereitschaft. Ein Streifzug durch die Kälte.",https://www.tagesspiegel.de/images/15102054/alternates/BASE_16_9_W1400/1767546268000/stromausfall-berlin.jpeg,2026-01-04T16:36:52Z,,"Die Lage könnte bedeutend schlechter sein, sagt Alexander S., da kreischt schon wieder eines seiner Kinder auf. Man hört dieses Kreischen viel im Südwesten der Stadt, in den Parks und Grünanlagen, wo… [+5808 chars]",,de,'Kälte'
https://www.zeit.de/news/2026-01/04/fc-st-pauli-und-werder-trennen-sich-im-winter-test-0-0,https://www.zeit.de/news/2026-01/04/fc-st-pauli-und-werder-trennen-sich-im-winter-test-0-0,0,www.zeit.de,Vorbereitung: FC St. Pauli und Werder trennen sich im Winter-Test 0:0,Hier finden Sie Informationen zu dem Thema „Vorbereitung“. Lesen Sie jetzt „FC St. Pauli und Werder trennen sich im Winter-Test 0:0“.,https://img.zeit.de/news/2026-01/04/fc-st-pauli-und-werder-trennen-sich-im-winter-test-0-0-image-group/wide__1300x731,2026-01-04T16:40:58Z,,Die Bundesliga-Rivalen FC St. Pauli und Werder Bremen haben sich in ihrem einzigen Test vor der Fortsetzung der Fußball-Saison unentschieden getrennt. Eine Woche vor dem ersten Spieltag im neuen Jahr… [+1782 chars],,de,'Schnee'
https://www.stern.de/gesellschaft/regional/hamburg-schleswig-holstein/vorbereitung--fc-st--pauli-und-werder-trennen-sich-im-winter-test-0-0-37009470.html,https://www.stern.de/gesellschaft/regional/hamburg-schleswig-holstein/vorbereitung--fc-st--pauli-und-werder-trennen-sich-im-winter-test-0-0-37009470.html,0,www.stern.de,Vorbereitung: FC St. Pauli und Werder trennen sich im Winter-Test 0:0,"Vor dem Testspiel gegen Werder Bremen sind die Fans gefragt. Mit Schaufeln und Schneeschiebern sorgen sie mit dafür, dass die Partie stattfindet. Im Spiel überzeugen vor allem die Hamburger.",https://image.stern.de/37009472/t/A0/v1/w1440/r1.7778/-/04--l5sgitamdiv9axs2048jpeg---40eb366eed26dddc.jpg,2026-01-04T16:40:58Z,,"Kopiere den aktuellen Link
Zur Merkliste hinzufügen
Vor dem Testspiel gegen Werder Bremen sind die Fans gefragt. Mit Schaufeln und Schneeschiebern sorgen sie mit dafür, dass die Partie stattfindet.… [+2249 chars]",,de,'Schnee'
https://www.bild.de/news/wetter/sieht-wie-gepudert-aus-die-schoensten-fotos-vom-winter-in-deutschland-695a2b99fd458507c19142c7,https://www.bild.de/news/wetter/sieht-wie-gepudert-aus-die-schoensten-fotos-vom-winter-in-deutschland-695a2b99fd458507c19142c7,0,www.bild.de,Die schönsten Winter-Fotos - Die Welt sieht wie gepudert aus,Das Wetter hat einen großen Wunsch vieler Kinder erfüllt: Schnee in Deutschland! Viele holten den Schlitten raus. Fotos aus einer verschneiten Welt.,"https://images.bild.de/695a2b99fd458507c19142c7/c4032100c273c4bfe11375812f2e5655,e4a676ef?w=1280",2026-01-04T16:56:47Z,,"Berlin Ein traumhaftes Winter-Wochenende liegt hinter uns. Eine Kältewelle, wie es sie seit Jahren nicht gab, hat in weiten Teilen Deutschlands frischen Schnee fallen lassen.
Meteorologe Peter Hartm… [+3269 chars]",,de,'Winter'
https://orf.at/stories/3416172/,https://orf.at/stories/3416172/,0,orf.at,Es wird grimmig kalt,Nach dem milden Nebel-Sonne-Mix im Dezember hat sich das Wetter mit dem Jahreswechsel umgestellt. Österreich wird in den kommenden Tagen von einer Kältewelle mit Tiefsttemperaturen von mancherorts bis zu minus 20 Grad erfasst. Die GeoSphere Austria gab für de…,https://ibs.orf.at/news?image=https%3A%2F%2Fassets.orf.at%2Fmims%2F2026%2F02%2F41%2Fcrops%2Fw%3D1200%2Ch%3D630%2Cq%3D75%2F2886517_master_1115041_wetter_kaelte_oesterreich_hum.jpg%3Fs%3D2c6a6eee750c88ef691a4146902323827947204e,2026-01-04T18:13:33Z,,"Ein riesiger Tiefdruckkomplex mit Zentrum über der Ostsee lenkt polare Luft aus dem hohen Norden bis nach Österreich. Besonders in den nächsten Tagen bringt das in vielen Regionen Dauerfrost, also Ei… [+3485 chars]",,de,'Schnee'
