index,url,valid,domain,title,description,image,published,archive,content,quote,language,keyword
https://www.stern.de/gesellschaft/regional/niedersachsen-bremen/gasprojekt-in-der-nordsee--fridays-for-future-plant-protestcamp-auf-borkum-36025108.html,https://www.stern.de/gesellschaft/regional/niedersachsen-bremen/gasprojekt-in-der-nordsee--fridays-for-future-plant-protestcamp-auf-borkum-36025108.html,0,www.stern.de,Gasprojekt in der Nordsee: Fridays For Future plant Protestcamp auf Borkum,Borkum/Berlin (lni) - Klimaaktivisten wollen auf der ostfriesischen Insel Borkum gegen Gasbohrungen in der Nordsee protestieren. Mehr als 200 Teilnehmende,https://image.stern.de/36025110/t/VD/v1/w1440/r1.7778/-/03--xad63zso22v13axs2048jpeg---f23133941559aa56.jpg,2025-09-03T10:53:10Z,,"Kopiere den aktuellen Link
Zur Merkliste hinzufügen
Jahrelanger Streit und eine behördliche Entscheidung - ein Energiekonzern darf ab sofort Gas vor der Nordseeinsel fördern. Doch der Protest geht … [+2998 chars]",,de,'Gas'
https://www.zeit.de/news/2025-09/03/fridays-for-future-plant-protestcamp-auf-borkum,https://www.zeit.de/news/2025-09/03/fridays-for-future-plant-protestcamp-auf-borkum,0,www.zeit.de,Gasprojekt in der Nordsee: Fridays For Future plant Protestcamp auf Borkum,Hier finden Sie Informationen zu dem Thema „Gasprojekt in der Nordsee“. Lesen Sie jetzt „Fridays For Future plant Protestcamp auf Borkum“.,https://img.zeit.de/news/2025-09/03/fridays-for-future-plant-protestcamp-auf-borkum-image-group/wide__1300x731,2025-09-03T10:53:10Z,,Klimaaktivisten wollen auf der ostfriesischen Insel Borkum gegen Gasbohrungen in der Nordsee protestieren. Mehr als 200 Teilnehmende seien für das Protestcamp von Donnerstag an angemeldet und würden … [+2569 chars],,de,'Gas'
https://taz.de/Gelato-in-Berlin/!6110669/,https://taz.de/Gelato-in-Berlin/!6110669/,0,taz.de,Gelato in Berlin: Das Eis hat seinen Preis,"Wer sich die Kugel geben will, muss immer tiefer in die Tasche greifen. Warum ist das so? Zwei Eishersteller berichten.",https://taz.de/picture/7906293/1200/39138077-1.jpeg,2025-09-03T12:16:00Z,,"Wer sich die Kugel geben will, muss immer tiefer in die Tasche greifen. Warum ist das so? Zwei Eishersteller berichten. mehr...",,de,'Eis'
https://www.faz.net/aktuell/politik/ukraine/robert-fico-nach-peking-um-mit-putin-ueber-die-ukraine-zu-reden-110668666.html,https://www.faz.net/aktuell/politik/ukraine/robert-fico-nach-peking-um-mit-putin-ueber-die-ukraine-zu-reden-110668666.html,0,www.faz.net,"Robert Fico: Nach Peking, um mit Putin über die Ukraine zu reden","Der slowakische Regierungschef bekräftigt gegenüber dem Kremlchef seine „andere Position“ zum russischen Krieg gegen die Ukraine. Putin fordert Fico auf, kein Gas mehr an die Ukraine zu liefern.",https://media1.faz.net/ppmedia/w1200/aktuell/3733874368/1.10668665/facebook_teaser/robert-fico-und-wladimir-putin.jpg.webp,2025-09-03T15:08:33Z,,"Robert Fico ist der einzige Regierungschef aus der Europäischen Union, der zur Militärparade von Xi Jinping nach Peking gereist ist. Zumindest auf den von chinesischen Staatsmedien verbreiteten Aufna… [+203 chars]",,de,'Gas'
https://www.tagesspiegel.de/politik/genehmigungsstopp-fur-bohrungen-grune-fordern-zeitnahes-ende-der-ol-und-gasforderung-in-deutschland-14271653.html,https://www.tagesspiegel.de/politik/genehmigungsstopp-fur-bohrungen-grune-fordern-zeitnahes-ende-der-ol-und-gasforderung-in-deutschland-14271653.html,0,www.tagesspiegel.de,Genehmigungsstopp für Bohrungen: Grüne fordern zeitnahes Ende der Öl- und Gasförderung in Deutschland,"Gas-Projekte wie vor Borkum sollen in Zukunft nicht mehr genehmigt werden, fordern die Grünen in einem 9-Punkte-Plan. Auch für importiertes Gas fordern sie Restriktionen.",https://www.tagesspiegel.de/images/12230177/alternates/BASE_16_9_W1400/1724168914000/erdgasforderung-vor-borkum.jpeg,2025-09-03T15:26:22Z,,"Tagesspiegel Plus Exklusiv 
Gas-Projekte wie vor Borkum sollen in Zukunft nicht mehr genehmigt werden, fordern die Grünen in einem 9-Punkte-Plan. Auch für importiertes Gas fordern sie Restriktionen.",,de,'Gas'
https://www.n-tv.de/wissen/Europas-Winter-drohen-nach-2100-eisig-zu-werden-article26007612.html,https://www.n-tv.de/wissen/Europas-Winter-drohen-nach-2100-eisig-zu-werden-article26007612.html,0,www.n-tv.de,Meeresströmung könnte versiegen: Europas Winter drohen nach 2100 eisig zu werden,"Droht Europa in einigen Jahrzehnten eine Eiszeit? Der mögliche Kollaps einer atlantischen Meeresströmung könnte das Klima in Europa massiv destabilisieren, so eine Studie. Mit drastischen Folgen auch für Deutschland und seine Küste.",https://www.n-tv.de/img/incoming/crop26007932/8051321545-cImg_16_9-w1200/542244131.jpg,2025-09-03T16:16:38Z,,"Droht Europa in einigen Jahrzehnten eine Eiszeit? Der mögliche Kollaps einer atlantischen Meeresströmung könnte das Klima in Europa massiv destabilisieren, so eine Studie. Mit drastischen Folgen auch… [+5256 chars]",,de,'Winter'
https://www.morgenpost.de/politik/article409910628/trump-will-groenland-eu-steigt-im-ringen-um-die-insel-ein.html,https://www.morgenpost.de/politik/article409910628/trump-will-groenland-eu-steigt-im-ringen-um-die-insel-ein.html,0,www.morgenpost.de,Trump will Grönland – EU steigt im Ringen um die Insel ein,"Das Eis schmilzt, die Bodenschätze werden freigelegt. Die Weltmacht USA ist an Grönland interessiert, nun will auch die EU investieren.",https://img.sparknews.funkemedien.de/409910533/409910533_1756914573_v16_9_1600.jpeg,2025-09-03T16:55:27Z,,"Die EU-Kommission will Grönland stärker an sich binden und deutlich mehr Geld in das autonome Gebiet im Nordatlantik investieren. Der Schritt erfolgt, nachdem die US-Regierung unter Donald Trump wied… [+1357 chars]",,de,'Eis'
https://www.jungewelt.de/artikel/507616.müllentsorgung-mount-everest-hat-ein-müllproblem.html,https://www.jungewelt.de/artikel/507616.müllentsorgung-mount-everest-hat-ein-müllproblem.html,0,www.jungewelt.de,Müllentsorgung: Mount Everest hat ein Müllproblem [Online-Abo],Nepal: Plastikabfall und Kunststoffrückstände in Wasser und Schnee selbst in mehr als 8.400 Metern Höhe.,https://www.jungewelt.de/img/1100/212911.jpg,2025-09-03T17:39:21Z,,"Uneingeschränkter Zugriff auf alle Inhalte: Erleben Sie die Tageszeitung junge Welt in gedruckter oder digitaler Form oder beides kombiniert.
Nachrichtenauswahl und -aufbereitung erfordern finanziel… [+458 chars]",,de,'Schnee'
https://www.nzz.ch/schweiz/lange-verfahren-uneinsichtige-umweltverbaende-und-sture-kantone-warum-der-ausbau-der-wasserkraft-nicht-vom-fleck-kommt-ld.1900653,https://www.nzz.ch/schweiz/lange-verfahren-uneinsichtige-umweltverbaende-und-sture-kantone-warum-der-ausbau-der-wasserkraft-nicht-vom-fleck-kommt-ld.1900653,0,www.nzz.ch,"Lange Verfahren, uneinsichtige Umweltverbände und sture Kantone: Warum der Ausbau der Wasserkraft nicht vom Fleck kommt","Neue Wasserkraftanlagen sollten dafür sorgen, dass die Schweiz auch künftig im Winter genug Strom hat. Doch bereits jetzt zeichnet sich ab: Die versprochenen Ziele werden nicht erreicht. In der Strombranche ist die Ernüchterung gross.","https://img.nzz.ch/2025/09/03/b7a432d4-2ba9-4d29-8d1d-7273f83c9bec.jpg?width=1200&height=675&fit=bounds&quality=75&auto=webp&crop=8256,4644,x0,y527&wmark=nzz",2025-09-04T03:30:00Z,,"Wesentliche Hindernisse übersehen: Das 300 Millionen Franken teure Wasserkraftprojekt am Gornergletscher oberhalb von Zermatt könnte sich weiter verzögern.
Bundesrat Albert Rösti bezeichnete das Pro… [+6912 chars]",,de,'Winter'
https://www.zeit.de/wirtschaft/2025-09/gasprojekt-nordsee-borkum-klimaaktivisten-protest-energieversorgung,https://www.zeit.de/wirtschaft/2025-09/gasprojekt-nordsee-borkum-klimaaktivisten-protest-energieversorgung,0,www.zeit.de,Gasfeld vor Borkum: Braucht Deutschland diese Bohrinsel wirklich?,Vor Borkum wird jetzt nach Gas gebohrt und Klimaaktivisten protestieren. Doch unterm Strich dürfte das Nordseegas klimafreundlicher sein als die Alternativen.,https://img.zeit.de/wirtschaft/2025-09/gasprojekt-nordsee-borkum-klimaaktivisten-protest-energieversorgung-bild/wide__1300x731,2025-09-04T05:01:57Z,,"Fridays for Future hatten auch schon mal härtere Sprüche zu bieten: Mit ""Austauschräumen und Urlaubsfeeling"", wollen die Klimaaktivisten in den nächsten Tagen auf Borkum gegen die Gasförderung vor de… [+610 chars]",,de,'Gas'
https://www.zeit.de/news/2025-09/04/aktivisten-protestieren-an-gasbohrturm-in-reichling,https://www.zeit.de/news/2025-09/04/aktivisten-protestieren-an-gasbohrturm-in-reichling,0,www.zeit.de,Umstrittene Gasförderung: Aktivisten protestieren an Gasbohrturm in Reichling,Hier finden Sie Informationen zu dem Thema „Umstrittene Gasförderung“. Lesen Sie jetzt „Aktivisten protestieren an Gasbohrturm in Reichling“.,https://img.zeit.de/news/2025-09/04/aktivisten-protestieren-an-gasbohrturm-in-reichling-image-group/wide__1300x731,2025-09-04T06:47:05Z,,Aktivisten der Gruppe «Ende Gelände» sind am Morgen aus Protest auf den Gasbohrturm im oberbayerischen Reichling geklettert. Rund zehn Aktivisten brachten laut einer Sprecherin Banner auf dem Bohrtur… [+1895 chars],,de,'Gas'
https://www.stern.de/panorama/verwirrender-augentest---wo-verstecken-sich-die-pferde-im-schnee--32699966.html,https://www.stern.de/panorama/verwirrender-augentest---wo-verstecken-sich-die-pferde-im-schnee--32699966.html,0,www.stern.de,"Suchbild: Augentest: Schaffen Sie es, alle Pferde im Schnee entdecken?",Viele Tiere sind gute getarnt und daher in freier Wildbahn nur schwer zu erkennen. Das gilt auch für dieses Suchbild. Wie viele Pferde können sie erkennen? Augen auf!,https://image.stern.de/32699980/t/VD/v3/w1440/r1.7778/-/pferde-im-schnee-raetsel.jpg,2025-09-04T07:39:00Z,,"Zugang zu stern+statt 11,96 
 nur 1  
<ul><li>Alles von stern+ mit erstklassigen Inhalten von GEO und Capital</li><li>4 Wochen testen, dann 2,99  je Woche</li><li>jederzeit kündbar</li></ul>",,de,'Schnee'
https://www.bild.de/sport/fussball/kommt-nagelsmann-im-trikot-jetzt-hier-reif-ist-live-gucken-68b931de72019652f128941f,https://www.bild.de/sport/fussball/kommt-nagelsmann-im-trikot-jetzt-hier-reif-ist-live-gucken-68b931de72019652f128941f,0,www.bild.de,Kommt Nagelsmann im Trikot? - Jetzt HIER „Reif ist live“ gucken,"„Reif ist live“, der BILD-Talk mit Kommentatoren-Legende Marcel Reif.","https://images.bild.de/68b931de72019652f128941f/d8103da858c28225557d8465087984b9,a836af86?w=1280",2025-09-04T09:22:00Z,,"Mehr zum Video anzeigen 
Reif ist live, der BILD-Talk mit Kommentatoren-Legende Marcel Reif.
Quelle: BILD04.09.2025 - 11:22 Uhr",,de,'Reif'
https://www.bild.de/sport/fussball/bayer-leverkusen-ploetzlich-faellt-der-name-ralf-rangnicke-im-studio-68b9347d01ad191d1ad5eba2,https://www.bild.de/sport/fussball/bayer-leverkusen-ploetzlich-faellt-der-name-ralf-rangnicke-im-studio-68b9347d01ad191d1ad5eba2,0,www.bild.de,Zurück in die Bundesliga? - Plötzlich fällt der Name Rangnick im Studio,BILD-Experte Marcel Reif äußert sich zu der Trainer-Situation in Leverkusen. DAS wäre eine Sensation!,"https://images.bild.de/68b9347d01ad191d1ad5eba2/ee19327078e2af0db5259963cf9c0954,28f601d6?w=1280",2025-09-04T10:54:25Z,,"Weiter zum Hauptinhalt
Mehr zum Video anzeigen 
Das wäre eine Sensation!
Quelle: BILD04.09.2025 - 12:54 Uhr 
Um mit Inhalten von Drittanbietern zu interagieren oder diese darzustellen, brauchen w… [+467 chars]",,de,'Reif'
https://www.bild.de/sport/fussball/reif-ist-live-star-des-fc-bayern-erfindet-sich-gerade-neu-68b9346201ad191d1ad5eb9d,https://www.bild.de/sport/fussball/reif-ist-live-star-des-fc-bayern-erfindet-sich-gerade-neu-68b9346201ad191d1ad5eb9d,0,www.bild.de,Experte hoffnungsvoll - Bayern-Star „erfindet sich gerade neu“,BILD-Experte Marcel Reif schaut auf den DFB-Kader.,"https://images.bild.de/68b9346201ad191d1ad5eb9d/6e09f3e78c0d52b121b8652a8b52499a,f959c148?w=1280",2025-09-04T10:58:28Z,,"Mehr zum Video anzeigen 
BILD-Experte Marcel Reif schaut auf den DFB-Kader.
Quelle: BILD04.09.2025 - 12:58 Uhr",,de,'Reif'
https://www.stern.de/auto/akku-heizluefter-fuers-auto---mobile-waerme-fuer-den-wintereinsatz-36027954.html,https://www.stern.de/auto/akku-heizluefter-fuers-auto---mobile-waerme-fuer-den-wintereinsatz-36027954.html,0,www.stern.de,Wärme auf Knopfdruck: Extra-Wärme fürs Auto: Wie gut sind Akku-Heizlüfter wirklich?,Akku-Heizlüfter sollen Autoscheiben im Winter schneller enteisen und den Innenraum zügig aufwärmen. Doch nicht jedes mobile Modell am Markt erfüllt die wohligen Erwartungen.,https://image.stern.de/36028690/t/Hn/v4/w1440/r1.7778/-/akku-heizluefter-fuers-auto-aufmacher-september-2025.jpg,2025-09-04T12:29:00Z,,"Kopiere den aktuellen Link
Zur Merkliste hinzufügen
Akku-Heizlüfter sollen Autoscheiben im Winter schneller enteisen und den Innenraum zügig aufwärmen. Doch nicht jedes mobile Modell am Markt erfül… [+5667 chars]",,de,'Winter'
https://www.welt.de/wirtschaft/weltplus/plus68b90ffd46b61b4dcb0b8b25/Besser-keine-Heizung-als-eine-Gasheizung-Patrick-Graichens-brisante-Rueckkehr.html,https://www.welt.de/wirtschaft/weltplus/plus68b90ffd46b61b4dcb0b8b25/Besser-keine-Heizung-als-eine-Gasheizung-Patrick-Graichens-brisante-Rueckkehr.html,0,www.welt.de,„Besser keine Heizung als eine Gasheizung“ – die brisante Rückkehr des Patrick Graichen,Er war der Energiewende-Planer der Ampelkoalition und Vater des Heizungsgesetzes – bis er wegen des Vorwurfs der Vetternwirtschaft gehen musste. Jetzt ist Patrick Graichen zurück auf der politischen Bühne und wird von den Grünen begeistert willkommen geheißen.,https://images.welt.de/68b90ffd46b61b4dcb0b8b25/d8fe087cc68079054cb762e18106795c-master/ci16x9-w1200/zeugenbefragung-untersuchungsausschuss-atomausstieg,2025-09-04T14:41:34Z,,Die WELT als ePaper: Die vollständige Ausgabe steht Ihnen bereits am Vorabend zur Verfügung so sind Sie immer hochaktuell informiert. Weitere Informationen https://epaper.welt.de,,de,'Heizung'
https://taz.de/Mumia-Abu-Jamal-fordert-Versorgung/!6108088/,https://taz.de/Mumia-Abu-Jamal-fordert-Versorgung/!6108088/,0,taz.de,Mumia Abu Jamal fordert Versorgung: Acht Monate Dunkelheit,Der seit 1981 in den USA inhaftierte Journalist Abu Jamal klagt über massiven Sehverlust. Solidaritätsgruppen fordern seine sofortige Freilassung.,https://taz.de/picture/7911537/1200/39150254-1.jpeg,2025-09-05T07:19:00Z,,Der seit 1981 in den USA inhaftierte Journalist Abu Jamal klagt über massiven Sehverlust. Solidaritätsgruppen fordern seine sofortige Freilassung. mehr...,,de,'Dunkelheit'
https://www.waz.de/ratgeber-wissen/energie/article409741878/passivhaus-ohne-heizung-architekt-energie.html,https://www.waz.de/ratgeber-wissen/energie/article409741878/passivhaus-ohne-heizung-architekt-energie.html,0,www.waz.de,Haus ohne Heizung? Bewohner zieht ein ehrliches Fazit,"Ein Passivhaus kommt ohne Zentralheizung aus. Was das Wohnkonzept so besonders macht und wie es sich darin lebt, haben wir uns vor Ort angeschaut.",https://img.sparknews.funkemedien.de/409792546/409792546_1755686016_v16_9_1600.jpeg,2025-09-05T08:30:00Z,,"<ul><li>Passivhäuser nutzen die Wärmerückgewinnung, um den Energieverbrauch deutlich zu senken.</li><li>Dank der guten Energieeffizienz können Passivhäuser ohne eine wasserführende Zentralheizung aus… [+6583 chars]",,de,'Heizung'
https://snipz.de/2025/axevmen-wasserdichte-thermo-winterhandschuhe/,https://snipz.de/2025/axevmen-wasserdichte-thermo-winterhandschuhe/,0,snipz.de,"AXEVMEN wasserdichte Thermo Winterhandschuhe für 8,99€ bei Amazon","Die AXEVMEN wasserdichten Winterhandschuhe sind perfekt für alle, die auch im Winter nicht auf Outdoor-Aktivitäten verzichten wollen. Bei Amazon bekommt ihr die AXEVMEN wasserdichte Winterhandschuhe für nur 8,99€ inkl. Prime-Versand. Um auf den Preis zu komme…",https://gadgetwelt.de/wp-content/uploads/2025/09/b0fh19853v-1.jpg,2025-09-05T11:42:07Z,,"Die AXEVMEN wasserdichten Winterhandschuhe sind perfekt für alle, die auch im Winter nicht auf Outdoor-Aktivitäten verzichten wollen. Bei Amazon bekommt ihr die AXEVMEN wasserdichte Winterhandschuhe … [+1078 chars]",,de,'Nässe'
https://taz.de/Fossiles-Gas-aus-der-Nordsee/!6112176/,https://taz.de/Fossiles-Gas-aus-der-Nordsee/!6112176/,0,taz.de,Fossiles Gas aus der Nordsee: Die drei wichtigsten Klima-News der Woche,Behörde winkt Gas-Förderung vor Borkum durch. EU-Kommission billigt das klimaschädliche Mercosur-Abkommen. Klimaklage gegen Zementhersteller Holcim.,https://taz.de/picture/7914867/1200/00-QuadratMitTaz-1.jpeg,2025-09-05T16:50:00Z,,Behörde winkt Gas-Förderung vor Borkum durch. EU-Kommission billigt das klimaschädliche Mercosur-Abkommen. Klimaklage gegen Zementhersteller Holcim. mehr...,,de,'Gas'
https://www.nzz.ch/sport/fussball/mit-reife-und-routine-die-schweiz-startet-gegen-kosovo-ueberzeugend-in-die-wm-qualifikation-aber-sie-sollte-diesen-sieg-nicht-ueberbewerten-ld.1901155,https://www.nzz.ch/sport/fussball/mit-reife-und-routine-die-schweiz-startet-gegen-kosovo-ueberzeugend-in-die-wm-qualifikation-aber-sie-sollte-diesen-sieg-nicht-ueberbewerten-ld.1901155,0,www.nzz.ch,Mit Reife und Routine: Die Schweiz startet gegen Kosovo überzeugend in die WM-Qualifikation – aber sie sollte diesen Sieg nicht überbewerten,"Während Breel Embolo beim 4:0 einen starken Auftritt mit zwei herrlichen Toren hinlegt, wird das Debüt von Leon Avdullahu für Kosovo zum Debakel. Doch das überforderte kosovarische Nationalteam ist kein Gradmesser für die Schweiz.","https://img.nzz.ch/2025/09/06/c6af3845-4a9a-475e-820e-dc78a8dcbdb0.jpg?width=1200&height=674&fit=bounds&quality=75&auto=webp&crop=7740,4353,x0,y807&wmark=nzz",2025-09-06T01:50:24Z,,"Die Schweizer jubelt nach dem ersten Treffer von Manuel Akanji während des Qualifikationsspiels gegen Kosovo.
Die womöglich beste Nachricht des Freitagabends erhielten die Schweizer Nationalspieler … [+6511 chars]",,de,'Reif'
https://www.nzz.ch/feuilleton/mary-shelleys-frankenstein-ld.1900540,https://www.nzz.ch/feuilleton/mary-shelleys-frankenstein-ld.1900540,0,www.nzz.ch,"SERIE - Mary Shelleys «Frankenstein»: über einen britischen Skandal und die Geburt eines Monsters, das seinesgleichen sucht","Während die Welt 1816 nach dem heftigsten Vulkanausbruch der Menschheitsgeschichte in Dunkelheit und Not versinkt, schreibt die 18-jährige Mary Wollstonecraft Godwin am Ufer des Genfersees ihren ersten Roman.","https://img.nzz.ch/2025/09/02/8b92203c-0505-4fb8-8409-c61fc34532e4.jpg?width=1200&height=675&fit=bounds&quality=75&auto=webp&crop=2000,1125,x0,y258&wmark=nzz",2025-09-06T03:30:00Z,,"Im Sommer 1816 genossen die Gäste im Hotel dAngleterre ein skandalöses Spektakel. Derart fasziniert war man vom Geschehen am gegenüberliegenden Ufer des Genfersees, dass nicht nur Ferngläser, sondern… [+18523 chars]",,de,'Schnee'
https://www.tagesspiegel.de/berlin/badespass-sommer-geht-zur-neige-berliner-freibader-schliessen-14286263.html,https://www.tagesspiegel.de/berlin/badespass-sommer-geht-zur-neige-berliner-freibader-schliessen-14286263.html,0,www.tagesspiegel.de,Badespaß: Sommer geht zur Neige - Berliner Freibäder schließen,"Sonne, Eis am Stiel und Freibad, damit ist es bald vorbei: Die ersten Bäder haben am Sonntag ihren letzten Öffnungstag in diesem Jahr.",https://www.tagesspiegel.de/images/14286260/alternates/BASE_16_9_W1400/1757143435000/pool.jpeg,2025-09-06T07:23:55Z,,"Mit dem Ende der Sommerferien in Berlin schließen auch die Freibäder in der Hauptstadt nach und nach. Bereits am Sonntag hätten fünf Sommerbäder in diesem Jahr zum letzten Mal geöffnet, hieß es von d… [+1054 chars]",,de,'Eis'
https://www.faz.net/aktuell/rhein-main/region-und-hessen/selbstfahrende-autos-autonome-shuttles-sind-die-loesung-fuer-den-nahverkehr-accg-110671304.html,https://www.faz.net/aktuell/rhein-main/region-und-hessen/selbstfahrende-autos-autonome-shuttles-sind-die-loesung-fuer-den-nahverkehr-accg-110671304.html,0,www.faz.net,Autonome Shuttles im ÖPNV: Die Robotaxis sind reif für die Straße,Tempo 100 ohne Fahrer: Wie autonome Shuttles den öffentlichen Nahverkehr revolutionieren könnten – und warum dabei mehr Gas gegeben werden sollte.,https://media0.faz.net/ppmedia/w1200/aktuell/2968150117/1.10673414/facebook_teaser/oepnv-der-zukunft.jpg.webp,2025-09-06T12:09:29Z,,"Die Vorstellung klingt wie aus einem Science-Fiction-Film: ein Bus ohne Fahrer, der auf Knopfdruck erscheint, Passagiere sicher und komfortabel ans Ziel bringt in der Stadt ebenso wie in ländlichen R… [+7525 chars]",,de,'Reif'
https://www.n-tv.de/mediathek/videos/ratgeber/Was-die-Beatles-im-Schnee-von-Obertauern-treiben-article25997538.html,https://www.n-tv.de/mediathek/videos/ratgeber/Was-die-Beatles-im-Schnee-von-Obertauern-treiben-article25997538.html,0,www.n-tv.de,"Frühling, Sommer und Herbst: Was die Beatles im Schnee von Obertauern treiben","Im Winter strömen Touristen aus aller Welt nach Obertauern, um Ski zu fahren. Doch was passiert dort, wenn gerade keine Wintersportsaison ist? Und was haben die Beatles damit zu tun? Der erste Teil der ntv-Service-Reportage gibt Einblicke.",https://www.n-tv.de/img/incoming/crop26014339/4501328008-cImg_16_9-w1200/Obertauern2.jpg,2025-09-06T12:15:00Z,,,,de,'Winter'
https://www.nzz.ch/schweiz/schweiz-im-blindflug-bag-legt-wichtiges-drogenmonitoring-auf-eis-ld.1900746,https://www.nzz.ch/schweiz/schweiz-im-blindflug-bag-legt-wichtiges-drogenmonitoring-auf-eis-ld.1900746,0,www.nzz.ch,Schweiz im Blindflug: BAG legt wichtiges Drogenmonitoring auf Eis,"Die Schweiz wird von billigem Kokain überflutet. Der Crack-Konsum steigt, und bald könnten auch grössere Mengen Fentanyl ins Land kommen. Ausgerechnet jetzt stoppt das BAG eine wichtige Datenerhebung dazu. Suchtmediziner schlagen Alarm.","https://img.nzz.ch/2024/06/13/dbc1cc32-8567-4061-9722-7d0e33262ab0.jpeg?width=1200&height=675&fit=bounds&quality=75&auto=webp&crop=8172,4597,x0,y481&wmark=nzz",2025-09-06T19:45:00Z,,"Der Churer Stadtpark ist eine der grössten offenen Drogenszenen der Schweiz. Sie wächst jedes Jahr um neue Schwerabhängige.
Der junge Mann nimmt die gelblichen Steinchen, steckt sie in seine silbern… [+4926 chars]",,de,'Eis'
https://www.bild.de/unterhaltung/stars-und-leute/kati-witt-im-bild-podcast-mayway-heiratsantrag-aus-hollywood-abgelehnt-68bc00cee0bd70281397b6b2,https://www.bild.de/unterhaltung/stars-und-leute/kati-witt-im-bild-podcast-mayway-heiratsantrag-aus-hollywood-abgelehnt-68bc00cee0bd70281397b6b2,0,www.bild.de,Eiskönigin im BILD-Podcast - Kati Witt lehnte Heiratsantrag von Hollywood-Star ab,Eiskunstlauflegende Katarina Witt spricht im BILD-Podcast „MayWay“ über ihre Entscheidung gegen Ehe und Familie.,"https://images.bild.de/68bc00cee0bd70281397b6b2/3d8287608b810c1b9c4ed37d37625ac8,556fa47d?w=1280",2025-09-06T21:07:49Z,,Berlin Disziplin gehörte schon immer zu ihrem Leben. Als Eiskunstlauflegende hat Katarina Witt die Welt mit Anmut und Ehrgeiz verzaubert und sich auch nach ihrer Karriere nie auf ihren Erfolgen ausge… [+2887 chars],,de,'Eis'
https://www.stern.de/panorama/wissen/polarforschung--einst-groesster-eisberg-der-welt-wohl-bald-verschwunden-36034884.html,https://www.stern.de/panorama/wissen/polarforschung--einst-groesster-eisberg-der-welt-wohl-bald-verschwunden-36034884.html,0,www.stern.de,Polarforschung: Einst größter Eisberg der Welt wohl bald verschwunden,London - Er war einmal der größte Eisberg der Welt – und könnte sich nun bald in den Weiten des Ozeans aufgelöst haben. Mit rund 4.000 Quadratkilometern,https://image.stern.de/36034886/t/Qa/v1/w1440/r1.7778/-/07--ab2ktq6dajv12axs2048jpeg---6967717cbcae842d.jpg,2025-09-07T05:00:40Z,,"Kopiere den aktuellen Link
Zur Merkliste hinzufügen
Jahrzehntelang blieb der Eisberg A23a etwa viermal so groß wie Berlin. Nun schmilzt er im Turbogang. Ein Abgesang auf einen eisigen Giganten.
Er… [+5328 chars]",,de,'Eis'
https://www.zeit.de/news/2025-09/07/einst-groesster-eisberg-der-welt-wohl-bald-verschwunden,https://www.zeit.de/news/2025-09/07/einst-groesster-eisberg-der-welt-wohl-bald-verschwunden,0,www.zeit.de,Polarforschung: Einst größter Eisberg der Welt wohl bald verschwunden,Hier finden Sie Informationen zu dem Thema „Polarforschung“. Lesen Sie jetzt „Einst größter Eisberg der Welt wohl bald verschwunden“.,https://img.zeit.de/news/2025-09/07/einst-groesster-eisberg-der-welt-wohl-bald-verschwunden-image-group/wide__1300x731,2025-09-07T05:00:40Z,,Er war einmal der größte Eisberg der Welt und könnte sich nun bald in den Weiten des Ozeans aufgelöst haben. Mit rund 4.000 Quadratkilometern war der Eisberg mit der nüchternen Bezeichnung A23a urspr… [+5169 chars],,de,'Eis'
https://www.tagesspiegel.de/wissen/polarforschung-einst-grosster-eisberg-der-welt-wohl-bald-verschwunden-14288186.html,https://www.tagesspiegel.de/wissen/polarforschung-einst-grosster-eisberg-der-welt-wohl-bald-verschwunden-14288186.html,0,www.tagesspiegel.de,Polarforschung: Einst größter Eisberg der Welt wohl bald verschwunden,Jahrzehntelang blieb der Eisberg A23a etwa viermal so groß wie Berlin. Nun schmilzt er im Turbogang. Ein Abgesang auf einen eisigen Giganten.,https://www.tagesspiegel.de/images/14288183/alternates/BASE_16_9_W1400/1757221337000/eisberg-a23a-im-sommer-2024.jpeg,2025-09-07T05:02:18Z,,Er war einmal der größte Eisberg der Welt und könnte sich nun bald in den Weiten des Ozeans aufgelöst haben. Mit rund 4.000 Quadratkilometern war der Eisberg mit der nüchternen Bezeichnung A23a urspr… [+5207 chars],,de,'Eis'
